
         /\      Grafana   /‾‾/  
    /\  /  \     |\  __   /  /   
   /  \/    \    | |/ /  /   ‾‾\ 
  /          \   |   (  |  (‾)  |
 / __________ \  |_|\_\  \_____/ 


     execution: local
        script: test/k6/presence.ts
        output: -

     scenarios: (100.00%) 1 scenario, 500 max VUs, 3m0s max duration (incl. graceful stop):
              * default: Up to 500 looping VUs for 2m30s over 3 stages (gracefulRampDown: 30s, gracefulStop: 30s)


running (0m00.9s), 008/500 VUs, 0 complete and 0 interrupted iterations
default   [   1% ] 008/500 VUs  0m00.9s/2m30.0s

running (0m01.9s), 016/500 VUs, 0 complete and 0 interrupted iterations
default   [   1% ] 016/500 VUs  0m01.9s/2m30.0s

running (0m02.9s), 025/500 VUs, 0 complete and 0 interrupted iterations
default   [   2% ] 025/500 VUs  0m02.9s/2m30.0s

running (0m03.9s), 033/500 VUs, 0 complete and 0 interrupted iterations
default   [   3% ] 033/500 VUs  0m03.9s/2m30.0s

running (0m04.9s), 041/500 VUs, 0 complete and 0 interrupted iterations
default   [   3% ] 041/500 VUs  0m04.9s/2m30.0s

running (0m05.9s), 050/500 VUs, 0 complete and 0 interrupted iterations
default   [   4% ] 050/500 VUs  0m05.9s/2m30.0s

running (0m06.9s), 058/500 VUs, 8 complete and 0 interrupted iterations
default   [   5% ] 058/500 VUs  0m06.9s/2m30.0s

running (0m07.9s), 066/500 VUs, 16 complete and 0 interrupted iterations
default   [   5% ] 066/500 VUs  0m07.9s/2m30.0s

running (0m08.9s), 074/500 VUs, 24 complete and 0 interrupted iterations
default   [   6% ] 074/500 VUs  0m08.9s/2m30.0s

running (0m09.9s), 083/500 VUs, 33 complete and 0 interrupted iterations
default   [   7% ] 083/500 VUs  0m09.9s/2m30.0s

running (0m10.9s), 091/500 VUs, 41 complete and 0 interrupted iterations
default   [   7% ] 091/500 VUs  0m10.9s/2m30.0s

running (0m11.9s), 099/500 VUs, 49 complete and 0 interrupted iterations
default   [   8% ] 099/500 VUs  0m11.9s/2m30.0s

running (0m12.9s), 108/500 VUs, 66 complete and 0 interrupted iterations
default   [   9% ] 108/500 VUs  0m12.9s/2m30.0s

running (0m13.9s), 116/500 VUs, 82 complete and 0 interrupted iterations
default   [   9% ] 116/500 VUs  0m13.9s/2m30.0s

running (0m14.9s), 124/500 VUs, 98 complete and 0 interrupted iterations
default   [  10% ] 124/500 VUs  0m14.9s/2m30.0s

running (0m15.9s), 133/500 VUs, 116 complete and 0 interrupted iterations
default   [  11% ] 133/500 VUs  0m15.9s/2m30.0s

running (0m16.9s), 141/500 VUs, 132 complete and 0 interrupted iterations
default   [  11% ] 141/500 VUs  0m16.9s/2m30.0s

running (0m17.9s), 149/500 VUs, 148 complete and 0 interrupted iterations
default   [  12% ] 149/500 VUs  0m17.9s/2m30.0s

running (0m18.9s), 158/500 VUs, 172 complete and 0 interrupted iterations
default   [  13% ] 158/500 VUs  0m18.9s/2m30.0s

running (0m19.9s), 166/500 VUs, 198 complete and 0 interrupted iterations
default   [  13% ] 166/500 VUs  0m19.9s/2m30.0s

running (0m20.9s), 174/500 VUs, 222 complete and 0 interrupted iterations
default   [  14% ] 174/500 VUs  0m20.9s/2m30.0s

running (0m21.9s), 183/500 VUs, 246 complete and 0 interrupted iterations
default   [  15% ] 183/500 VUs  0m21.9s/2m30.0s

running (0m22.9s), 191/500 VUs, 273 complete and 0 interrupted iterations
default   [  15% ] 191/500 VUs  0m22.9s/2m30.0s

running (0m23.9s), 199/500 VUs, 297 complete and 0 interrupted iterations
default   [  16% ] 199/500 VUs  0m23.9s/2m30.0s

running (0m24.9s), 208/500 VUs, 328 complete and 0 interrupted iterations
default   [  17% ] 208/500 VUs  0m24.9s/2m30.0s

running (0m25.9s), 216/500 VUs, 364 complete and 0 interrupted iterations
default   [  17% ] 216/500 VUs  0m25.9s/2m30.0s

running (0m26.9s), 224/500 VUs, 396 complete and 0 interrupted iterations
default   [  18% ] 224/500 VUs  0m26.9s/2m30.0s

running (0m27.9s), 232/500 VUs, 428 complete and 0 interrupted iterations
default   [  19% ] 232/500 VUs  0m27.9s/2m30.0s

running (0m28.9s), 241/500 VUs, 462 complete and 0 interrupted iterations
default   [  19% ] 241/500 VUs  0m28.9s/2m30.0s

running (0m29.9s), 249/500 VUs, 496 complete and 0 interrupted iterations
default   [  20% ] 249/500 VUs  0m29.9s/2m30.0s

running (0m30.9s), 257/500 VUs, 535 complete and 0 interrupted iterations
default   [  21% ] 257/500 VUs  0m30.9s/2m30.0s

running (0m31.9s), 266/500 VUs, 578 complete and 0 interrupted iterations
default   [  21% ] 266/500 VUs  0m31.9s/2m30.0s

running (0m32.9s), 274/500 VUs, 620 complete and 0 interrupted iterations
default   [  22% ] 274/500 VUs  0m32.9s/2m30.0s

running (0m33.9s), 282/500 VUs, 660 complete and 0 interrupted iterations
default   [  23% ] 282/500 VUs  0m33.9s/2m30.0s

running (0m34.9s), 291/500 VUs, 702 complete and 0 interrupted iterations
default   [  23% ] 291/500 VUs  0m34.9s/2m30.0s

running (0m35.9s), 299/500 VUs, 743 complete and 0 interrupted iterations
default   [  24% ] 299/500 VUs  0m35.9s/2m30.0s

running (0m36.9s), 307/500 VUs, 792 complete and 0 interrupted iterations
default   [  25% ] 307/500 VUs  0m36.9s/2m30.0s

running (0m37.9s), 316/500 VUs, 841 complete and 0 interrupted iterations
default   [  25% ] 316/500 VUs  0m37.9s/2m30.0s

running (0m38.9s), 324/500 VUs, 890 complete and 0 interrupted iterations
default   [  26% ] 324/500 VUs  0m38.9s/2m30.0s

running (0m39.9s), 332/500 VUs, 941 complete and 0 interrupted iterations
default   [  27% ] 332/500 VUs  0m39.9s/2m30.0s

running (0m40.9s), 341/500 VUs, 990 complete and 0 interrupted iterations
default   [  27% ] 341/500 VUs  0m40.9s/2m30.0s

running (0m41.9s), 349/500 VUs, 1040 complete and 0 interrupted iterations
default   [  28% ] 349/500 VUs  0m41.9s/2m30.0s

running (0m42.9s), 357/500 VUs, 1096 complete and 0 interrupted iterations
default   [  29% ] 357/500 VUs  0m42.9s/2m30.0s

running (0m43.9s), 366/500 VUs, 1155 complete and 0 interrupted iterations
default   [  29% ] 366/500 VUs  0m43.9s/2m30.0s

running (0m44.9s), 374/500 VUs, 1213 complete and 0 interrupted iterations
default   [  30% ] 374/500 VUs  0m44.9s/2m30.0s

running (0m45.9s), 382/500 VUs, 1271 complete and 0 interrupted iterations
default   [  31% ] 382/500 VUs  0m45.9s/2m30.0s

running (0m46.9s), 391/500 VUs, 1330 complete and 0 interrupted iterations
default   [  31% ] 391/500 VUs  0m46.9s/2m30.0s

running (0m47.9s), 399/500 VUs, 1387 complete and 0 interrupted iterations
default   [  32% ] 399/500 VUs  0m47.9s/2m30.0s

running (0m48.9s), 407/500 VUs, 1450 complete and 0 interrupted iterations
default   [  33% ] 407/500 VUs  0m48.9s/2m30.0s

running (0m49.9s), 415/500 VUs, 1518 complete and 0 interrupted iterations
default   [  33% ] 415/500 VUs  0m49.9s/2m30.0s

running (0m50.9s), 424/500 VUs, 1584 complete and 0 interrupted iterations
default   [  34% ] 424/500 VUs  0m50.9s/2m30.0s

running (0m51.9s), 432/500 VUs, 1649 complete and 0 interrupted iterations
default   [  35% ] 432/500 VUs  0m51.9s/2m30.0s

running (0m52.9s), 440/500 VUs, 1715 complete and 0 interrupted iterations
default   [  35% ] 440/500 VUs  0m52.9s/2m30.0s

running (0m53.9s), 449/500 VUs, 1783 complete and 0 interrupted iterations
default   [  36% ] 449/500 VUs  0m53.9s/2m30.0s

running (0m54.9s), 457/500 VUs, 1849 complete and 0 interrupted iterations
default   [  37% ] 457/500 VUs  0m54.9s/2m30.0s

running (0m55.9s), 465/500 VUs, 1927 complete and 0 interrupted iterations
default   [  37% ] 465/500 VUs  0m55.9s/2m30.0s

running (0m56.9s), 474/500 VUs, 1998 complete and 0 interrupted iterations
default   [  38% ] 474/500 VUs  0m56.9s/2m30.0s

running (0m57.9s), 482/500 VUs, 2064 complete and 0 interrupted iterations
default   [  39% ] 482/500 VUs  0m57.9s/2m30.0s

running (0m58.9s), 490/500 VUs, 2123 complete and 0 interrupted iterations
default   [  39% ] 490/500 VUs  0m58.9s/2m30.0s

running (0m59.9s), 499/500 VUs, 2200 complete and 0 interrupted iterations
default   [  40% ] 499/500 VUs  0m59.9s/2m30.0s

running (1m00.9s), 500/500 VUs, 2272 complete and 0 interrupted iterations
default   [  41% ] 500/500 VUs  1m00.9s/2m30.0s

running (1m01.9s), 500/500 VUs, 2352 complete and 0 interrupted iterations
default   [  41% ] 500/500 VUs  1m01.9s/2m30.0s

running (1m02.9s), 500/500 VUs, 2420 complete and 0 interrupted iterations
default   [  42% ] 500/500 VUs  1m02.9s/2m30.0s

running (1m03.9s), 500/500 VUs, 2497 complete and 0 interrupted iterations
default   [  43% ] 500/500 VUs  1m03.9s/2m30.0s

running (1m04.9s), 500/500 VUs, 2565 complete and 0 interrupted iterations
default   [  43% ] 500/500 VUs  1m04.9s/2m30.0s

running (1m05.9s), 500/500 VUs, 2635 complete and 0 interrupted iterations
default   [  44% ] 500/500 VUs  1m05.9s/2m30.0s

running (1m06.9s), 500/500 VUs, 2733 complete and 0 interrupted iterations
default   [  45% ] 500/500 VUs  1m06.9s/2m30.0s

running (1m07.9s), 500/500 VUs, 2799 complete and 0 interrupted iterations
default   [  45% ] 500/500 VUs  1m07.9s/2m30.0s

running (1m08.9s), 500/500 VUs, 2880 complete and 0 interrupted iterations
default   [  46% ] 500/500 VUs  1m08.9s/2m30.0s

running (1m09.9s), 500/500 VUs, 2952 complete and 0 interrupted iterations
default   [  47% ] 500/500 VUs  1m09.9s/2m30.0s

running (1m10.9s), 500/500 VUs, 3017 complete and 0 interrupted iterations
default   [  47% ] 500/500 VUs  1m10.9s/2m30.0s

running (1m11.9s), 500/500 VUs, 3105 complete and 0 interrupted iterations
default   [  48% ] 500/500 VUs  1m11.9s/2m30.0s

running (1m12.9s), 500/500 VUs, 3197 complete and 0 interrupted iterations
default   [  49% ] 500/500 VUs  1m12.9s/2m30.0s

running (1m13.9s), 500/500 VUs, 3249 complete and 0 interrupted iterations
default   [  49% ] 500/500 VUs  1m13.9s/2m30.0s

running (1m14.9s), 500/500 VUs, 3331 complete and 0 interrupted iterations
default   [  50% ] 500/500 VUs  1m14.9s/2m30.0s

running (1m15.9s), 500/500 VUs, 3402 complete and 0 interrupted iterations
default   [  51% ] 500/500 VUs  1m15.9s/2m30.0s

running (1m16.9s), 500/500 VUs, 3468 complete and 0 interrupted iterations
default   [  51% ] 500/500 VUs  1m16.9s/2m30.0s

running (1m17.9s), 500/500 VUs, 3546 complete and 0 interrupted iterations
default   [  52% ] 500/500 VUs  1m17.9s/2m30.0s

running (1m18.9s), 500/500 VUs, 3622 complete and 0 interrupted iterations
default   [  53% ] 500/500 VUs  1m18.9s/2m30.0s

running (1m19.9s), 500/500 VUs, 3693 complete and 0 interrupted iterations
default   [  53% ] 500/500 VUs  1m19.9s/2m30.0s

running (1m20.9s), 500/500 VUs, 3761 complete and 0 interrupted iterations
default   [  54% ] 500/500 VUs  1m20.9s/2m30.0s

running (1m21.9s), 500/500 VUs, 3867 complete and 0 interrupted iterations
default   [  55% ] 500/500 VUs  1m21.9s/2m30.0s

running (1m22.9s), 500/500 VUs, 3932 complete and 0 interrupted iterations
default   [  55% ] 500/500 VUs  1m22.9s/2m30.0s

running (1m23.9s), 500/500 VUs, 4014 complete and 0 interrupted iterations
default   [  56% ] 500/500 VUs  1m23.9s/2m30.0s

running (1m24.9s), 500/500 VUs, 4089 complete and 0 interrupted iterations
default   [  57% ] 500/500 VUs  1m24.9s/2m30.0s

running (1m25.9s), 500/500 VUs, 4139 complete and 0 interrupted iterations
default   [  57% ] 500/500 VUs  1m25.9s/2m30.0s

running (1m26.9s), 500/500 VUs, 4225 complete and 0 interrupted iterations
default   [  58% ] 500/500 VUs  1m26.9s/2m30.0s

running (1m27.9s), 500/500 VUs, 4317 complete and 0 interrupted iterations
default   [  59% ] 500/500 VUs  1m27.9s/2m30.0s

running (1m29.1s), 500/500 VUs, 4415 complete and 0 interrupted iterations
default   [  59% ] 500/500 VUs  1m29.1s/2m30.0s

running (1m29.9s), 500/500 VUs, 4459 complete and 0 interrupted iterations
default   [  60% ] 500/500 VUs  1m29.9s/2m30.0s

running (1m30.9s), 500/500 VUs, 4532 complete and 0 interrupted iterations
default   [  61% ] 500/500 VUs  1m30.9s/2m30.0s

running (1m31.9s), 500/500 VUs, 4607 complete and 0 interrupted iterations
default   [  61% ] 500/500 VUs  1m31.9s/2m30.0s

running (1m32.9s), 500/500 VUs, 4683 complete and 0 interrupted iterations
default   [  62% ] 500/500 VUs  1m32.9s/2m30.0s

running (1m33.9s), 500/500 VUs, 4740 complete and 0 interrupted iterations
default   [  63% ] 500/500 VUs  1m33.9s/2m30.0s

running (1m34.9s), 500/500 VUs, 4843 complete and 0 interrupted iterations
default   [  63% ] 500/500 VUs  1m34.9s/2m30.0s

running (1m35.9s), 500/500 VUs, 4917 complete and 0 interrupted iterations
default   [  64% ] 500/500 VUs  1m35.9s/2m30.0s

running (1m36.9s), 500/500 VUs, 4986 complete and 0 interrupted iterations
default   [  65% ] 500/500 VUs  1m36.9s/2m30.0s

running (1m37.9s), 500/500 VUs, 5044 complete and 0 interrupted iterations
default   [  65% ] 500/500 VUs  1m37.9s/2m30.0s

running (1m38.9s), 500/500 VUs, 5115 complete and 0 interrupted iterations
default   [  66% ] 500/500 VUs  1m38.9s/2m30.0s

running (1m39.9s), 500/500 VUs, 5188 complete and 0 interrupted iterations
default   [  67% ] 500/500 VUs  1m39.9s/2m30.0s

running (1m40.9s), 500/500 VUs, 5278 complete and 0 interrupted iterations
default   [  67% ] 500/500 VUs  1m40.9s/2m30.0s

running (1m41.9s), 500/500 VUs, 5380 complete and 0 interrupted iterations
default   [  68% ] 500/500 VUs  1m41.9s/2m30.0s

running (1m42.9s), 500/500 VUs, 5454 complete and 0 interrupted iterations
default   [  69% ] 500/500 VUs  1m42.9s/2m30.0s

running (1m43.9s), 500/500 VUs, 5518 complete and 0 interrupted iterations
default   [  69% ] 500/500 VUs  1m43.9s/2m30.0s

running (1m44.9s), 500/500 VUs, 5587 complete and 0 interrupted iterations
default   [  70% ] 500/500 VUs  1m44.9s/2m30.0s

running (1m45.9s), 500/500 VUs, 5664 complete and 0 interrupted iterations
default   [  71% ] 500/500 VUs  1m45.9s/2m30.0s

running (1m46.9s), 500/500 VUs, 5737 complete and 0 interrupted iterations
default   [  71% ] 500/500 VUs  1m46.9s/2m30.0s

running (1m47.9s), 500/500 VUs, 5813 complete and 0 interrupted iterations
default   [  72% ] 500/500 VUs  1m47.9s/2m30.0s

running (1m49.1s), 500/500 VUs, 5919 complete and 0 interrupted iterations
default   [  73% ] 500/500 VUs  1m49.1s/2m30.0s

running (1m49.9s), 500/500 VUs, 5968 complete and 0 interrupted iterations
default   [  73% ] 500/500 VUs  1m49.9s/2m30.0s

running (1m50.9s), 500/500 VUs, 6047 complete and 0 interrupted iterations
default   [  74% ] 500/500 VUs  1m50.9s/2m30.0s

running (1m51.9s), 500/500 VUs, 6129 complete and 0 interrupted iterations
default   [  75% ] 500/500 VUs  1m51.9s/2m30.0s

running (1m52.9s), 500/500 VUs, 6211 complete and 0 interrupted iterations
default   [  75% ] 500/500 VUs  1m52.9s/2m30.0s

running (1m53.9s), 500/500 VUs, 6271 complete and 0 interrupted iterations
default   [  76% ] 500/500 VUs  1m53.9s/2m30.0s

running (1m54.9s), 500/500 VUs, 6349 complete and 0 interrupted iterations
default   [  77% ] 500/500 VUs  1m54.9s/2m30.0s

running (1m55.9s), 500/500 VUs, 6425 complete and 0 interrupted iterations
default   [  77% ] 500/500 VUs  1m55.9s/2m30.0s

running (1m56.9s), 500/500 VUs, 6517 complete and 0 interrupted iterations
default   [  78% ] 500/500 VUs  1m56.9s/2m30.0s

running (1m57.9s), 500/500 VUs, 6604 complete and 0 interrupted iterations
default   [  79% ] 500/500 VUs  1m57.9s/2m30.0s

running (1m58.9s), 500/500 VUs, 6666 complete and 0 interrupted iterations
default   [  79% ] 500/500 VUs  1m58.9s/2m30.0s

running (1m59.9s), 500/500 VUs, 6742 complete and 0 interrupted iterations
default   [  80% ] 500/500 VUs  1m59.9s/2m30.0s

running (2m01.0s), 499/500 VUs, 6819 complete and 0 interrupted iterations
default   [  81% ] 499/500 VUs  2m01.0s/2m30.0s

running (2m01.9s), 499/500 VUs, 6891 complete and 0 interrupted iterations
default   [  81% ] 499/500 VUs  2m01.9s/2m30.0s

running (2m02.9s), 491/500 VUs, 6961 complete and 0 interrupted iterations
default   [  82% ] 491/500 VUs  2m02.9s/2m30.0s

running (2m03.9s), 481/500 VUs, 7049 complete and 0 interrupted iterations
default   [  83% ] 481/500 VUs  2m03.9s/2m30.0s

running (2m04.9s), 468/500 VUs, 7130 complete and 0 interrupted iterations
default   [  83% ] 468/500 VUs  2m04.9s/2m30.0s

running (2m05.9s), 456/500 VUs, 7194 complete and 0 interrupted iterations
default   [  84% ] 456/500 VUs  2m05.9s/2m30.0s

running (2m06.9s), 435/500 VUs, 7272 complete and 0 interrupted iterations
default   [  85% ] 435/500 VUs  2m06.9s/2m30.0s

running (2m08.0s), 420/500 VUs, 7354 complete and 0 interrupted iterations
default   [  85% ] 420/500 VUs  2m08.0s/2m30.0s

running (2m08.9s), 410/500 VUs, 7404 complete and 0 interrupted iterations
default   [  86% ] 410/500 VUs  2m08.9s/2m30.0s

running (2m09.9s), 389/500 VUs, 7487 complete and 0 interrupted iterations
default   [  87% ] 389/500 VUs  2m09.9s/2m30.0s

running (2m10.9s), 373/500 VUs, 7579 complete and 0 interrupted iterations
default   [  87% ] 373/500 VUs  2m10.9s/2m30.0s

running (2m11.9s), 358/500 VUs, 7642 complete and 0 interrupted iterations
default   [  88% ] 358/500 VUs  2m11.9s/2m30.0s

running (2m12.9s), 343/500 VUs, 7683 complete and 0 interrupted iterations
default   [  89% ] 343/500 VUs  2m12.9s/2m30.0s

running (2m13.9s), 324/500 VUs, 7754 complete and 0 interrupted iterations
default   [  89% ] 324/500 VUs  2m13.9s/2m30.0s

running (2m14.9s), 307/500 VUs, 7814 complete and 0 interrupted iterations
default   [  90% ] 307/500 VUs  2m14.9s/2m30.0s

running (2m15.9s), 289/500 VUs, 7875 complete and 0 interrupted iterations
default   [  91% ] 289/500 VUs  2m15.9s/2m30.0s

running (2m16.9s), 266/500 VUs, 7951 complete and 0 interrupted iterations
default   [  91% ] 266/500 VUs  2m16.9s/2m30.0s

running (2m17.9s), 246/500 VUs, 7998 complete and 0 interrupted iterations
default   [  92% ] 246/500 VUs  2m17.9s/2m30.0s

running (2m18.9s), 233/500 VUs, 8026 complete and 0 interrupted iterations
default   [  93% ] 233/500 VUs  2m18.9s/2m30.0s

running (2m19.9s), 218/500 VUs, 8078 complete and 0 interrupted iterations
default   [  93% ] 218/500 VUs  2m19.9s/2m30.0s

running (2m20.9s), 201/500 VUs, 8119 complete and 0 interrupted iterations
default   [  94% ] 201/500 VUs  2m20.9s/2m30.0s

running (2m21.9s), 189/500 VUs, 8162 complete and 0 interrupted iterations
default   [  95% ] 189/500 VUs  2m21.9s/2m30.0s

running (2m22.9s), 166/500 VUs, 8213 complete and 0 interrupted iterations
default   [  95% ] 166/500 VUs  2m22.9s/2m30.0s

running (2m23.9s), 146/500 VUs, 8244 complete and 0 interrupted iterations
default   [  96% ] 146/500 VUs  2m23.9s/2m30.0s

running (2m24.9s), 139/500 VUs, 8259 complete and 0 interrupted iterations
default   [  97% ] 139/500 VUs  2m24.9s/2m30.0s

running (2m25.9s), 120/500 VUs, 8294 complete and 0 interrupted iterations
default   [  97% ] 120/500 VUs  2m25.9s/2m30.0s

running (2m26.9s), 103/500 VUs, 8319 complete and 0 interrupted iterations
default   [  98% ] 103/500 VUs  2m26.9s/2m30.0s

running (2m27.9s), 080/500 VUs, 8350 complete and 0 interrupted iterations
default   [  99% ] 080/500 VUs  2m27.9s/2m30.0s

running (2m28.9s), 057/500 VUs, 8378 complete and 0 interrupted iterations
default   [  99% ] 057/500 VUs  2m28.9s/2m30.0s

running (2m29.9s), 046/500 VUs, 8389 complete and 0 interrupted iterations
default   [ 100% ] 046/500 VUs  2m29.9s/2m30.0s

running (2m30.9s), 037/500 VUs, 8398 complete and 0 interrupted iterations
default ↓ [ 100% ] 044/500 VUs  2m30s

running (2m31.9s), 022/500 VUs, 8413 complete and 0 interrupted iterations
default ↓ [ 100% ] 044/500 VUs  2m30s

running (2m32.9s), 013/500 VUs, 8422 complete and 0 interrupted iterations
default ↓ [ 100% ] 044/500 VUs  2m30s

running (2m33.9s), 005/500 VUs, 8430 complete and 0 interrupted iterations
default ↓ [ 100% ] 044/500 VUs  2m30s

running (2m34.9s), 000/500 VUs, 8435 complete and 0 interrupted iterations
default ✓ [ 100% ] 000/500 VUs  2m30s


  █ THRESHOLDS 

    active_clients_time
    ✓ 'p(95)<500' p(95)=104ms

    attach_documents_time
    ✓ 'p(95)<10000' p(95)=363ms

    deactivate_clients_time
    ✓ 'p(95)<10000' p(95)=106ms

    http_req_duration
    ✓ 'p(95)<10000' p(95)=171.07ms

    pushpulls_time
    ✓ 'p(95)<1000' p(95)=172ms

    transaction_success_rate
    ✓ 'rate>0.99' rate=100.00%

    transaction_time
    ✓ 'p(95)<30000' p(95)=7.04s


  █ TOTAL RESULTS 

    checks_total.......: 134960  871.42744/s
    checks_succeeded...: 100.00% 134960 out of 134960
    checks_failed......: 0.00%   0 out of 134960

    ✓ status is 200
    ✓ response has valid body

    CUSTOM
    active_clients....................: 8435    54.464215/s
    active_clients_success_rate.......: 100.00% 8435 out of 8435
    active_clients_time...............: avg=21.71ms min=0s       med=3ms    max=445ms    p(90)=69ms     p(95)=104ms   
    attach_documents..................: 8435    54.464215/s
    attach_documents_success_rate.....: 100.00% 8435 out of 8435
    attach_documents_time.............: avg=81.95ms min=3ms      med=15ms   max=745ms    p(90)=262ms    p(95)=363ms   
    deactivate_clients................: 8435    54.464215/s
    deactivate_clients_success_rate...: 100.00% 8435 out of 8435
    deactivate_clients_time...........: avg=21.05ms min=0s       med=2ms    max=573ms    p(90)=66ms     p(95)=106ms   
    pushpulls.........................: 42175   272.321075/s
    pushpulls_success_rate............: 100.00% 42175 out of 42175
    pushpulls_time....................: avg=40.94ms min=0s       med=12ms   max=702ms    p(90)=121ms    p(95)=172ms   
    transaction_success_rate..........: 100.00% 8435 out of 8435
    transaction_time..................: avg=6.4s    min=6.01s    med=6.37s  max=7.94s    p(90)=6.88s    p(95)=7.04s   

    HTTP
    http_req_duration.................: avg=36.68ms min=177.47µs med=6.23ms max=657.98ms p(90)=112.66ms p(95)=171.07ms
      { expected_response:true }......: avg=36.68ms min=177.47µs med=6.23ms max=657.98ms p(90)=112.66ms p(95)=171.07ms
    http_req_failed...................: 0.00%   0 out of 67480
    http_reqs.........................: 67480   435.71372/s

    EXECUTION
    iteration_duration................: avg=6.4s    min=6.01s    med=6.37s  max=7.94s    p(90)=6.88s    p(95)=7.04s   
    iterations........................: 8435    54.464215/s
    vus...............................: 5       min=5              max=500
    vus_max...........................: 500     min=500            max=500

    NETWORK
    data_received.....................: 1.2 GB  7.9 MB/s
    data_sent.........................: 64 MB   410 kB/s




running (2m34.9s), 000/500 VUs, 8435 complete and 0 interrupted iterations
default ✓ [ 100% ] 000/500 VUs  2m30s
