
         /\      Grafana   /‾‾/  
    /\  /  \     |\  __   /  /   
   /  \/    \    | |/ /  /   ‾‾\ 
  /          \   |   (  |  (‾)  |
 / __________ \  |_|\_\  \_____/ 

     execution: local
        script: test/k6/presence.ts
        output: -

     scenarios: (100.00%) 1 scenario, 500 max VUs, 3m0s max duration (incl. graceful stop):
              * default: Up to 500 looping VUs for 2m30s over 3 stages (gracefulRampDown: 30s, gracefulStop: 30s)


running (0m00.9s), 008/500 VUs, 0 complete and 0 interrupted iterations
default   [   1% ] 008/500 VUs  0m00.9s/2m30.0s

running (0m01.9s), 016/500 VUs, 0 complete and 0 interrupted iterations
default   [   1% ] 016/500 VUs  0m01.9s/2m30.0s

running (0m02.9s), 024/500 VUs, 0 complete and 0 interrupted iterations
default   [   2% ] 024/500 VUs  0m02.9s/2m30.0s

running (0m03.9s), 033/500 VUs, 0 complete and 0 interrupted iterations
default   [   3% ] 033/500 VUs  0m03.9s/2m30.0s

running (0m04.9s), 041/500 VUs, 0 complete and 0 interrupted iterations
default   [   3% ] 041/500 VUs  0m04.9s/2m30.0s

running (0m05.9s), 049/500 VUs, 0 complete and 0 interrupted iterations
default   [   4% ] 049/500 VUs  0m05.9s/2m30.0s

running (0m06.9s), 058/500 VUs, 8 complete and 0 interrupted iterations
default   [   5% ] 058/500 VUs  0m06.9s/2m30.0s

running (0m07.9s), 066/500 VUs, 16 complete and 0 interrupted iterations
default   [   5% ] 066/500 VUs  0m07.9s/2m30.0s

running (0m08.9s), 074/500 VUs, 24 complete and 0 interrupted iterations
default   [   6% ] 074/500 VUs  0m08.9s/2m30.0s

running (0m09.9s), 083/500 VUs, 33 complete and 0 interrupted iterations
default   [   7% ] 083/500 VUs  0m09.9s/2m30.0s

running (0m10.9s), 091/500 VUs, 41 complete and 0 interrupted iterations
default   [   7% ] 091/500 VUs  0m10.9s/2m30.0s

running (0m11.9s), 099/500 VUs, 49 complete and 0 interrupted iterations
default   [   8% ] 099/500 VUs  0m11.9s/2m30.0s

running (0m12.9s), 108/500 VUs, 64 complete and 0 interrupted iterations
default   [   9% ] 108/500 VUs  0m12.9s/2m30.0s

running (0m13.9s), 116/500 VUs, 82 complete and 0 interrupted iterations
default   [   9% ] 116/500 VUs  0m13.9s/2m30.0s

running (0m14.9s), 124/500 VUs, 98 complete and 0 interrupted iterations
default   [  10% ] 124/500 VUs  0m14.9s/2m30.0s

running (0m15.9s), 133/500 VUs, 114 complete and 0 interrupted iterations
default   [  11% ] 133/500 VUs  0m15.9s/2m30.0s

running (0m16.9s), 141/500 VUs, 132 complete and 0 interrupted iterations
default   [  11% ] 141/500 VUs  0m16.9s/2m30.0s

running (0m17.9s), 149/500 VUs, 148 complete and 0 interrupted iterations
default   [  12% ] 149/500 VUs  0m17.9s/2m30.0s

running (0m18.9s), 157/500 VUs, 171 complete and 0 interrupted iterations
default   [  13% ] 157/500 VUs  0m18.9s/2m30.0s

running (0m19.9s), 166/500 VUs, 198 complete and 0 interrupted iterations
default   [  13% ] 166/500 VUs  0m19.9s/2m30.0s

running (0m20.9s), 174/500 VUs, 222 complete and 0 interrupted iterations
default   [  14% ] 174/500 VUs  0m20.9s/2m30.0s

running (0m21.9s), 182/500 VUs, 246 complete and 0 interrupted iterations
default   [  15% ] 182/500 VUs  0m21.9s/2m30.0s

running (0m22.9s), 191/500 VUs, 272 complete and 0 interrupted iterations
default   [  15% ] 191/500 VUs  0m22.9s/2m30.0s

running (0m23.9s), 199/500 VUs, 297 complete and 0 interrupted iterations
default   [  16% ] 199/500 VUs  0m23.9s/2m30.0s

running (0m24.9s), 207/500 VUs, 328 complete and 0 interrupted iterations
default   [  17% ] 207/500 VUs  0m24.9s/2m30.0s

running (0m25.9s), 216/500 VUs, 361 complete and 0 interrupted iterations
default   [  17% ] 216/500 VUs  0m25.9s/2m30.0s

running (0m26.9s), 224/500 VUs, 394 complete and 0 interrupted iterations
default   [  18% ] 224/500 VUs  0m26.9s/2m30.0s

running (0m27.9s), 232/500 VUs, 428 complete and 0 interrupted iterations
default   [  19% ] 232/500 VUs  0m27.9s/2m30.0s

running (0m28.9s), 241/500 VUs, 461 complete and 0 interrupted iterations
default   [  19% ] 241/500 VUs  0m28.9s/2m30.0s

running (0m29.9s), 249/500 VUs, 494 complete and 0 interrupted iterations
default   [  20% ] 249/500 VUs  0m29.9s/2m30.0s

running (0m30.9s), 257/500 VUs, 535 complete and 0 interrupted iterations
default   [  21% ] 257/500 VUs  0m30.9s/2m30.0s

running (0m31.9s), 266/500 VUs, 575 complete and 0 interrupted iterations
default   [  21% ] 266/500 VUs  0m31.9s/2m30.0s

running (0m32.9s), 274/500 VUs, 618 complete and 0 interrupted iterations
default   [  22% ] 274/500 VUs  0m32.9s/2m30.0s

running (0m33.9s), 282/500 VUs, 660 complete and 0 interrupted iterations
default   [  23% ] 282/500 VUs  0m33.9s/2m30.0s

running (0m34.9s), 291/500 VUs, 700 complete and 0 interrupted iterations
default   [  23% ] 291/500 VUs  0m34.9s/2m30.0s

running (0m35.9s), 299/500 VUs, 741 complete and 0 interrupted iterations
default   [  24% ] 299/500 VUs  0m35.9s/2m30.0s

running (0m36.9s), 307/500 VUs, 790 complete and 0 interrupted iterations
default   [  25% ] 307/500 VUs  0m36.9s/2m30.0s

running (0m37.9s), 315/500 VUs, 840 complete and 0 interrupted iterations
default   [  25% ] 315/500 VUs  0m37.9s/2m30.0s

running (0m38.9s), 324/500 VUs, 890 complete and 0 interrupted iterations
default   [  26% ] 324/500 VUs  0m38.9s/2m30.0s

running (0m39.9s), 332/500 VUs, 939 complete and 0 interrupted iterations
default   [  27% ] 332/500 VUs  0m39.9s/2m30.0s

running (0m40.9s), 340/500 VUs, 990 complete and 0 interrupted iterations
default   [  27% ] 340/500 VUs  0m40.9s/2m30.0s

running (0m41.9s), 349/500 VUs, 1039 complete and 0 interrupted iterations
default   [  28% ] 349/500 VUs  0m41.9s/2m30.0s

running (0m42.9s), 357/500 VUs, 1095 complete and 0 interrupted iterations
default   [  29% ] 357/500 VUs  0m42.9s/2m30.0s

running (0m43.9s), 365/500 VUs, 1153 complete and 0 interrupted iterations
default   [  29% ] 365/500 VUs  0m43.9s/2m30.0s

running (0m44.9s), 374/500 VUs, 1211 complete and 0 interrupted iterations
default   [  30% ] 374/500 VUs  0m44.9s/2m30.0s

running (0m45.9s), 382/500 VUs, 1268 complete and 0 interrupted iterations
default   [  31% ] 382/500 VUs  0m45.9s/2m30.0s

running (0m46.9s), 390/500 VUs, 1327 complete and 0 interrupted iterations
default   [  31% ] 390/500 VUs  0m46.9s/2m30.0s

running (0m47.9s), 399/500 VUs, 1385 complete and 0 interrupted iterations
default   [  32% ] 399/500 VUs  0m47.9s/2m30.0s

running (0m48.9s), 407/500 VUs, 1446 complete and 0 interrupted iterations
default   [  33% ] 407/500 VUs  0m48.9s/2m30.0s

running (0m49.9s), 415/500 VUs, 1513 complete and 0 interrupted iterations
default   [  33% ] 415/500 VUs  0m49.9s/2m30.0s

running (0m50.9s), 424/500 VUs, 1580 complete and 0 interrupted iterations
default   [  34% ] 424/500 VUs  0m50.9s/2m30.0s

running (0m51.9s), 432/500 VUs, 1645 complete and 0 interrupted iterations
default   [  35% ] 432/500 VUs  0m51.9s/2m30.0s

running (0m52.9s), 440/500 VUs, 1711 complete and 0 interrupted iterations
default   [  35% ] 440/500 VUs  0m52.9s/2m30.0s

running (0m53.9s), 449/500 VUs, 1775 complete and 0 interrupted iterations
default   [  36% ] 449/500 VUs  0m53.9s/2m30.0s

running (0m54.9s), 457/500 VUs, 1841 complete and 0 interrupted iterations
default   [  37% ] 457/500 VUs  0m54.9s/2m30.0s

running (0m55.9s), 465/500 VUs, 1919 complete and 0 interrupted iterations
default   [  37% ] 465/500 VUs  0m55.9s/2m30.0s

running (0m56.9s), 473/500 VUs, 1988 complete and 0 interrupted iterations
default   [  38% ] 473/500 VUs  0m56.9s/2m30.0s

running (0m57.9s), 482/500 VUs, 2058 complete and 0 interrupted iterations
default   [  39% ] 482/500 VUs  0m57.9s/2m30.0s

running (0m58.9s), 490/500 VUs, 2128 complete and 0 interrupted iterations
default   [  39% ] 490/500 VUs  0m58.9s/2m30.0s

running (1m00.0s), 499/500 VUs, 2190 complete and 0 interrupted iterations
default   [  40% ] 499/500 VUs  1m00.0s/2m30.0s

running (1m00.9s), 500/500 VUs, 2258 complete and 0 interrupted iterations
default   [  41% ] 500/500 VUs  1m00.9s/2m30.0s

running (1m02.2s), 500/500 VUs, 2355 complete and 0 interrupted iterations
default   [  41% ] 500/500 VUs  1m02.2s/2m30.0s

running (1m02.9s), 500/500 VUs, 2412 complete and 0 interrupted iterations
default   [  42% ] 500/500 VUs  1m02.9s/2m30.0s

running (1m03.9s), 500/500 VUs, 2485 complete and 0 interrupted iterations
default   [  43% ] 500/500 VUs  1m03.9s/2m30.0s

running (1m04.9s), 500/500 VUs, 2551 complete and 0 interrupted iterations
default   [  43% ] 500/500 VUs  1m04.9s/2m30.0s

running (1m05.9s), 500/500 VUs, 2628 complete and 0 interrupted iterations
default   [  44% ] 500/500 VUs  1m05.9s/2m30.0s

running (1m06.9s), 500/500 VUs, 2703 complete and 0 interrupted iterations
default   [  45% ] 500/500 VUs  1m06.9s/2m30.0s

running (1m07.9s), 500/500 VUs, 2748 complete and 0 interrupted iterations
default   [  45% ] 500/500 VUs  1m07.9s/2m30.0s

running (1m08.9s), 500/500 VUs, 2832 complete and 0 interrupted iterations
default   [  46% ] 500/500 VUs  1m08.9s/2m30.0s

running (1m09.9s), 500/500 VUs, 2929 complete and 0 interrupted iterations
default   [  47% ] 500/500 VUs  1m09.9s/2m30.0s

running (1m10.9s), 500/500 VUs, 2997 complete and 0 interrupted iterations
default   [  47% ] 500/500 VUs  1m10.9s/2m30.0s

running (1m11.9s), 500/500 VUs, 3049 complete and 0 interrupted iterations
default   [  48% ] 500/500 VUs  1m11.9s/2m30.0s

running (1m12.9s), 500/500 VUs, 3140 complete and 0 interrupted iterations
default   [  49% ] 500/500 VUs  1m12.9s/2m30.0s

running (1m13.9s), 500/500 VUs, 3234 complete and 0 interrupted iterations
default   [  49% ] 500/500 VUs  1m13.9s/2m30.0s

running (1m14.9s), 500/500 VUs, 3290 complete and 0 interrupted iterations
default   [  50% ] 500/500 VUs  1m14.9s/2m30.0s

running (1m15.9s), 500/500 VUs, 3357 complete and 0 interrupted iterations
default   [  51% ] 500/500 VUs  1m15.9s/2m30.0s

running (1m16.9s), 500/500 VUs, 3441 complete and 0 interrupted iterations
default   [  51% ] 500/500 VUs  1m16.9s/2m30.0s

running (1m17.9s), 500/500 VUs, 3537 complete and 0 interrupted iterations
default   [  52% ] 500/500 VUs  1m17.9s/2m30.0s

running (1m18.9s), 500/500 VUs, 3621 complete and 0 interrupted iterations
default   [  53% ] 500/500 VUs  1m18.9s/2m30.0s

running (1m19.9s), 500/500 VUs, 3666 complete and 0 interrupted iterations
default   [  53% ] 500/500 VUs  1m19.9s/2m30.0s

running (1m20.9s), 500/500 VUs, 3733 complete and 0 interrupted iterations
default   [  54% ] 500/500 VUs  1m20.9s/2m30.0s

running (1m21.9s), 500/500 VUs, 3802 complete and 0 interrupted iterations
default   [  55% ] 500/500 VUs  1m21.9s/2m30.0s

running (1m22.9s), 500/500 VUs, 3859 complete and 0 interrupted iterations
default   [  55% ] 500/500 VUs  1m22.9s/2m30.0s

running (1m23.9s), 500/500 VUs, 3942 complete and 0 interrupted iterations
default   [  56% ] 500/500 VUs  1m23.9s/2m30.0s

running (1m24.9s), 500/500 VUs, 4006 complete and 0 interrupted iterations
default   [  57% ] 500/500 VUs  1m24.9s/2m30.0s

running (1m25.9s), 500/500 VUs, 4068 complete and 0 interrupted iterations
default   [  57% ] 500/500 VUs  1m25.9s/2m30.0s

running (1m26.9s), 500/500 VUs, 4176 complete and 0 interrupted iterations
default   [  58% ] 500/500 VUs  1m26.9s/2m30.0s

running (1m27.9s), 500/500 VUs, 4235 complete and 0 interrupted iterations
default   [  59% ] 500/500 VUs  1m27.9s/2m30.0s

running (1m28.9s), 500/500 VUs, 4293 complete and 0 interrupted iterations
default   [  59% ] 500/500 VUs  1m28.9s/2m30.0s

running (1m29.9s), 500/500 VUs, 4384 complete and 0 interrupted iterations
default   [  60% ] 500/500 VUs  1m29.9s/2m30.0s

running (1m30.9s), 500/500 VUs, 4435 complete and 0 interrupted iterations
default   [  61% ] 500/500 VUs  1m30.9s/2m30.0s

running (1m31.9s), 500/500 VUs, 4517 complete and 0 interrupted iterations
default   [  61% ] 500/500 VUs  1m31.9s/2m30.0s

running (1m32.9s), 500/500 VUs, 4592 complete and 0 interrupted iterations
default   [  62% ] 500/500 VUs  1m32.9s/2m30.0s

running (1m33.9s), 500/500 VUs, 4661 complete and 0 interrupted iterations
default   [  63% ] 500/500 VUs  1m33.9s/2m30.0s

running (1m35.0s), 500/500 VUs, 4746 complete and 0 interrupted iterations
default   [  63% ] 500/500 VUs  1m35.0s/2m30.0s

running (1m35.9s), 500/500 VUs, 4818 complete and 0 interrupted iterations
default   [  64% ] 500/500 VUs  1m35.9s/2m30.0s

running (1m36.9s), 500/500 VUs, 4887 complete and 0 interrupted iterations
default   [  65% ] 500/500 VUs  1m36.9s/2m30.0s

running (1m37.9s), 500/500 VUs, 4960 complete and 0 interrupted iterations
default   [  65% ] 500/500 VUs  1m37.9s/2m30.0s

running (1m38.9s), 500/500 VUs, 5019 complete and 0 interrupted iterations
default   [  66% ] 500/500 VUs  1m38.9s/2m30.0s

running (1m40.2s), 500/500 VUs, 5115 complete and 0 interrupted iterations
default   [  67% ] 500/500 VUs  1m40.2s/2m30.0s

running (1m40.9s), 500/500 VUs, 5163 complete and 0 interrupted iterations
default   [  67% ] 500/500 VUs  1m40.9s/2m30.0s

running (1m41.9s), 500/500 VUs, 5224 complete and 0 interrupted iterations
default   [  68% ] 500/500 VUs  1m41.9s/2m30.0s

running (1m43.1s), 500/500 VUs, 5336 complete and 0 interrupted iterations
default   [  69% ] 500/500 VUs  1m43.1s/2m30.0s

running (1m43.9s), 500/500 VUs, 5391 complete and 0 interrupted iterations
default   [  69% ] 500/500 VUs  1m43.9s/2m30.0s

running (1m44.9s), 500/500 VUs, 5477 complete and 0 interrupted iterations
default   [  70% ] 500/500 VUs  1m44.9s/2m30.0s

running (1m46.2s), 500/500 VUs, 5565 complete and 0 interrupted iterations
default   [  71% ] 500/500 VUs  1m46.2s/2m30.0s

running (1m46.9s), 500/500 VUs, 5600 complete and 0 interrupted iterations
default   [  71% ] 500/500 VUs  1m46.9s/2m30.0s

running (1m47.9s), 500/500 VUs, 5680 complete and 0 interrupted iterations
default   [  72% ] 500/500 VUs  1m47.9s/2m30.0s

running (1m48.9s), 500/500 VUs, 5770 complete and 0 interrupted iterations
default   [  73% ] 500/500 VUs  1m48.9s/2m30.0s

running (1m49.9s), 500/500 VUs, 5837 complete and 0 interrupted iterations
default   [  73% ] 500/500 VUs  1m49.9s/2m30.0s

running (1m50.9s), 500/500 VUs, 5908 complete and 0 interrupted iterations
default   [  74% ] 500/500 VUs  1m50.9s/2m30.0s

running (1m51.9s), 500/500 VUs, 6001 complete and 0 interrupted iterations
default   [  75% ] 500/500 VUs  1m51.9s/2m30.0s

running (1m52.9s), 500/500 VUs, 6067 complete and 0 interrupted iterations
default   [  75% ] 500/500 VUs  1m52.9s/2m30.0s

running (1m53.9s), 500/500 VUs, 6136 complete and 0 interrupted iterations
default   [  76% ] 500/500 VUs  1m53.9s/2m30.0s

running (1m54.9s), 500/500 VUs, 6222 complete and 0 interrupted iterations
default   [  77% ] 500/500 VUs  1m54.9s/2m30.0s

running (1m55.9s), 500/500 VUs, 6293 complete and 0 interrupted iterations
default   [  77% ] 500/500 VUs  1m55.9s/2m30.0s

running (1m56.9s), 500/500 VUs, 6378 complete and 0 interrupted iterations
default   [  78% ] 500/500 VUs  1m56.9s/2m30.0s

running (1m57.9s), 500/500 VUs, 6456 complete and 0 interrupted iterations
default   [  79% ] 500/500 VUs  1m57.9s/2m30.0s

running (1m59.0s), 500/500 VUs, 6530 complete and 0 interrupted iterations
default   [  79% ] 500/500 VUs  1m59.0s/2m30.0s

running (1m59.9s), 500/500 VUs, 6605 complete and 0 interrupted iterations
default   [  80% ] 500/500 VUs  1m59.9s/2m30.0s

running (2m00.9s), 498/500 VUs, 6684 complete and 0 interrupted iterations
default   [  81% ] 498/500 VUs  2m00.9s/2m30.0s

running (2m01.9s), 495/500 VUs, 6767 complete and 0 interrupted iterations
default   [  81% ] 495/500 VUs  2m01.9s/2m30.0s

running (2m02.9s), 493/500 VUs, 6815 complete and 0 interrupted iterations
default   [  82% ] 493/500 VUs  2m02.9s/2m30.0s

running (2m03.9s), 485/500 VUs, 6899 complete and 0 interrupted iterations
default   [  83% ] 485/500 VUs  2m03.9s/2m30.0s

running (2m04.9s), 477/500 VUs, 6978 complete and 0 interrupted iterations
default   [  83% ] 477/500 VUs  2m04.9s/2m30.0s

running (2m05.9s), 461/500 VUs, 7055 complete and 0 interrupted iterations
default   [  84% ] 461/500 VUs  2m05.9s/2m30.0s

running (2m06.9s), 441/500 VUs, 7137 complete and 0 interrupted iterations
default   [  85% ] 441/500 VUs  2m06.9s/2m30.0s

running (2m07.9s), 427/500 VUs, 7212 complete and 0 interrupted iterations
default   [  85% ] 427/500 VUs  2m07.9s/2m30.0s

running (2m08.9s), 407/500 VUs, 7291 complete and 0 interrupted iterations
default   [  86% ] 407/500 VUs  2m08.9s/2m30.0s

running (2m09.9s), 391/500 VUs, 7359 complete and 0 interrupted iterations
default   [  87% ] 391/500 VUs  2m09.9s/2m30.0s

running (2m10.9s), 375/500 VUs, 7426 complete and 0 interrupted iterations
default   [  87% ] 375/500 VUs  2m10.9s/2m30.0s

running (2m11.9s), 360/500 VUs, 7485 complete and 0 interrupted iterations
default   [  88% ] 360/500 VUs  2m11.9s/2m30.0s

running (2m12.9s), 339/500 VUs, 7545 complete and 0 interrupted iterations
default   [  89% ] 339/500 VUs  2m12.9s/2m30.0s

running (2m13.9s), 314/500 VUs, 7615 complete and 0 interrupted iterations
default   [  89% ] 314/500 VUs  2m13.9s/2m30.0s

running (2m14.9s), 301/500 VUs, 7693 complete and 0 interrupted iterations
default   [  90% ] 301/500 VUs  2m14.9s/2m30.0s

running (2m15.9s), 284/500 VUs, 7749 complete and 0 interrupted iterations
default   [  91% ] 284/500 VUs  2m15.9s/2m30.0s

running (2m16.9s), 270/500 VUs, 7798 complete and 0 interrupted iterations
default   [  91% ] 270/500 VUs  2m16.9s/2m30.0s

running (2m17.9s), 256/500 VUs, 7841 complete and 0 interrupted iterations
default   [  92% ] 256/500 VUs  2m17.9s/2m30.0s

running (2m18.9s), 240/500 VUs, 7884 complete and 0 interrupted iterations
default   [  93% ] 240/500 VUs  2m18.9s/2m30.0s

running (2m19.9s), 222/500 VUs, 7929 complete and 0 interrupted iterations
default   [  93% ] 222/500 VUs  2m19.9s/2m30.0s

running (2m20.9s), 197/500 VUs, 7993 complete and 0 interrupted iterations
default   [  94% ] 197/500 VUs  2m20.9s/2m30.0s

running (2m21.9s), 182/500 VUs, 8032 complete and 0 interrupted iterations
default   [  95% ] 182/500 VUs  2m21.9s/2m30.0s

running (2m22.9s), 168/500 VUs, 8067 complete and 0 interrupted iterations
default   [  95% ] 168/500 VUs  2m22.9s/2m30.0s

running (2m23.9s), 153/500 VUs, 8096 complete and 0 interrupted iterations
default   [  96% ] 153/500 VUs  2m23.9s/2m30.0s

running (2m24.9s), 142/500 VUs, 8124 complete and 0 interrupted iterations
default   [  97% ] 142/500 VUs  2m24.9s/2m30.0s

running (2m25.9s), 125/500 VUs, 8151 complete and 0 interrupted iterations
default   [  97% ] 125/500 VUs  2m25.9s/2m30.0s

running (2m26.9s), 100/500 VUs, 8190 complete and 0 interrupted iterations
default   [  98% ] 100/500 VUs  2m26.9s/2m30.0s

running (2m27.9s), 085/500 VUs, 8213 complete and 0 interrupted iterations
default   [  99% ] 085/500 VUs  2m27.9s/2m30.0s

running (2m28.9s), 068/500 VUs, 8235 complete and 0 interrupted iterations
default   [  99% ] 068/500 VUs  2m28.9s/2m30.0s

running (2m29.9s), 056/500 VUs, 8248 complete and 0 interrupted iterations
default   [ 100% ] 056/500 VUs  2m29.9s/2m30.0s

running (2m30.9s), 038/500 VUs, 8266 complete and 0 interrupted iterations
default ↓ [ 100% ] 052/500 VUs  2m30s

running (2m31.9s), 028/500 VUs, 8276 complete and 0 interrupted iterations
default ↓ [ 100% ] 052/500 VUs  2m30s

running (2m32.9s), 014/500 VUs, 8290 complete and 0 interrupted iterations
default ↓ [ 100% ] 052/500 VUs  2m30s

running (2m33.9s), 006/500 VUs, 8298 complete and 0 interrupted iterations
default ↓ [ 100% ] 052/500 VUs  2m30s

running (2m34.9s), 001/500 VUs, 8303 complete and 0 interrupted iterations
default ↓ [ 100% ] 052/500 VUs  2m30s


  █ THRESHOLDS 

    active_clients_time
    ✓ 'p(95)<500' p(95)=118ms

    attach_documents_time
    ✓ 'p(95)<10000' p(95)=445.84ms

    deactivate_clients_time
    ✓ 'p(95)<10000' p(95)=110ms

    http_req_duration
    ✓ 'p(95)<10000' p(95)=227.09ms

    pushpulls_time
    ✓ 'p(95)<1000' p(95)=239ms

    transaction_success_rate
    ✓ 'rate>0.99' rate=100.00%

    transaction_time
    ✓ 'p(95)<30000' p(95)=7.31s


  █ TOTAL RESULTS 

    checks_total.......: 132864  857.124303/s
    checks_succeeded...: 100.00% 132864 out of 132864
    checks_failed......: 0.00%   0 out of 132864

    ✓ status is 200
    ✓ response has valid body

    CUSTOM
    active_clients....................: 8304    53.570269/s
    active_clients_success_rate.......: 100.00% 8304 out of 8304
    active_clients_time...............: avg=26.34ms  min=1ms      med=6ms     max=532ms    p(90)=82ms     p(95)=118ms   
    attach_documents..................: 8304    53.570269/s
    attach_documents_success_rate.....: 100.00% 8304 out of 8304
    attach_documents_time.............: avg=106.66ms min=3ms      med=23ms    max=897ms    p(90)=331ms    p(95)=445.84ms
    deactivate_clients................: 8304    53.570269/s
    deactivate_clients_success_rate...: 100.00% 8304 out of 8304
    deactivate_clients_time...........: avg=25.45ms  min=0s       med=4ms     max=570ms    p(90)=74ms     p(95)=110ms   
    pushpulls.........................: 41520   267.851345/s
    pushpulls_success_rate............: 100.00% 41520 out of 41520
    pushpulls_time....................: avg=58ms     min=1ms      med=20ms    max=900ms    p(90)=162ms    p(95)=239ms   
    transaction_success_rate..........: 100.00% 8304 out of 8304
    transaction_time..................: avg=6.51s    min=6.01s    med=6.47s   max=9.03s    p(90)=7.1s     p(95)=7.31s   

    HTTP
    http_req_duration.................: avg=49.63ms  min=499.29µs med=10.95ms max=896.36ms p(90)=143.03ms p(95)=227.09ms
      { expected_response:true }......: avg=49.63ms  min=499.29µs med=10.95ms max=896.36ms p(90)=143.03ms p(95)=227.09ms
    http_req_failed...................: 0.00%   0 out of 66432
    http_reqs.........................: 66432   428.562151/s

    EXECUTION
    iteration_duration................: avg=6.51s    min=6.01s    med=6.47s   max=9.03s    p(90)=7.1s     p(95)=7.31s   
    iterations........................: 8304    53.570269/s
    vus...............................: 1       min=1              max=500
    vus_max...........................: 500     min=500            max=500

    NETWORK
    data_received.....................: 1.2 GB  7.7 MB/s
    data_sent.........................: 63 MB   403 kB/s




running (2m35.0s), 000/500 VUs, 8304 complete and 0 interrupted iterations
default ✓ [ 100% ] 000/500 VUs  2m30s
