
         /\      Grafana   /‾‾/  
    /\  /  \     |\  __   /  /   
   /  \/    \    | |/ /  /   ‾‾\ 
  /          \   |   (  |  (‾)  |
 / __________ \  |_|\_\  \_____/ 

     execution: local
        script: test/k6/presence.ts
        output: -

     scenarios: (100.00%) 1 scenario, 500 max VUs, 3m0s max duration (incl. graceful stop):
              * default: Up to 500 looping VUs for 2m30s over 3 stages (gracefulRampDown: 30s, gracefulStop: 30s)


running (0m00.9s), 008/500 VUs, 0 complete and 0 interrupted iterations
default   [   1% ] 008/500 VUs  0m00.9s/2m30.0s

running (0m01.9s), 016/500 VUs, 0 complete and 0 interrupted iterations
default   [   1% ] 016/500 VUs  0m01.9s/2m30.0s

running (0m02.9s), 025/500 VUs, 0 complete and 0 interrupted iterations
default   [   2% ] 025/500 VUs  0m02.9s/2m30.0s

running (0m03.9s), 033/500 VUs, 0 complete and 0 interrupted iterations
default   [   3% ] 033/500 VUs  0m03.9s/2m30.0s

running (0m04.9s), 041/500 VUs, 0 complete and 0 interrupted iterations
default   [   3% ] 041/500 VUs  0m04.9s/2m30.0s

running (0m05.9s), 050/500 VUs, 0 complete and 0 interrupted iterations
default   [   4% ] 050/500 VUs  0m05.9s/2m30.0s

running (0m06.9s), 058/500 VUs, 8 complete and 0 interrupted iterations
default   [   5% ] 058/500 VUs  0m06.9s/2m30.0s

running (0m07.9s), 066/500 VUs, 16 complete and 0 interrupted iterations
default   [   5% ] 066/500 VUs  0m07.9s/2m30.0s

running (0m08.9s), 074/500 VUs, 24 complete and 0 interrupted iterations
default   [   6% ] 074/500 VUs  0m08.9s/2m30.0s

running (0m09.9s), 083/500 VUs, 33 complete and 0 interrupted iterations
default   [   7% ] 083/500 VUs  0m09.9s/2m30.0s

running (0m10.9s), 091/500 VUs, 41 complete and 0 interrupted iterations
default   [   7% ] 091/500 VUs  0m10.9s/2m30.0s

running (0m11.9s), 099/500 VUs, 49 complete and 0 interrupted iterations
default   [   8% ] 099/500 VUs  0m11.9s/2m30.0s

running (0m12.9s), 108/500 VUs, 66 complete and 0 interrupted iterations
default   [   9% ] 108/500 VUs  0m12.9s/2m30.0s

running (0m13.9s), 116/500 VUs, 82 complete and 0 interrupted iterations
default   [   9% ] 116/500 VUs  0m13.9s/2m30.0s

running (0m14.9s), 124/500 VUs, 98 complete and 0 interrupted iterations
default   [  10% ] 124/500 VUs  0m14.9s/2m30.0s

running (0m15.9s), 133/500 VUs, 116 complete and 0 interrupted iterations
default   [  11% ] 133/500 VUs  0m15.9s/2m30.0s

running (0m16.9s), 141/500 VUs, 132 complete and 0 interrupted iterations
default   [  11% ] 141/500 VUs  0m16.9s/2m30.0s

running (0m17.9s), 149/500 VUs, 148 complete and 0 interrupted iterations
default   [  12% ] 149/500 VUs  0m17.9s/2m30.0s

running (0m18.9s), 158/500 VUs, 172 complete and 0 interrupted iterations
default   [  13% ] 158/500 VUs  0m18.9s/2m30.0s

running (0m19.9s), 166/500 VUs, 198 complete and 0 interrupted iterations
default   [  13% ] 166/500 VUs  0m19.9s/2m30.0s

running (0m20.9s), 174/500 VUs, 222 complete and 0 interrupted iterations
default   [  14% ] 174/500 VUs  0m20.9s/2m30.0s

running (0m21.9s), 183/500 VUs, 246 complete and 0 interrupted iterations
default   [  15% ] 183/500 VUs  0m21.9s/2m30.0s

running (0m22.9s), 191/500 VUs, 273 complete and 0 interrupted iterations
default   [  15% ] 191/500 VUs  0m22.9s/2m30.0s

running (0m23.9s), 199/500 VUs, 297 complete and 0 interrupted iterations
default   [  16% ] 199/500 VUs  0m23.9s/2m30.0s

running (0m24.9s), 208/500 VUs, 328 complete and 0 interrupted iterations
default   [  17% ] 208/500 VUs  0m24.9s/2m30.0s

running (0m25.9s), 216/500 VUs, 363 complete and 0 interrupted iterations
default   [  17% ] 216/500 VUs  0m25.9s/2m30.0s

running (0m26.9s), 224/500 VUs, 396 complete and 0 interrupted iterations
default   [  18% ] 224/500 VUs  0m26.9s/2m30.0s

running (0m27.9s), 232/500 VUs, 428 complete and 0 interrupted iterations
default   [  19% ] 232/500 VUs  0m27.9s/2m30.0s

running (0m28.9s), 241/500 VUs, 462 complete and 0 interrupted iterations
default   [  19% ] 241/500 VUs  0m28.9s/2m30.0s

running (0m29.9s), 249/500 VUs, 496 complete and 0 interrupted iterations
default   [  20% ] 249/500 VUs  0m29.9s/2m30.0s

running (0m30.9s), 257/500 VUs, 535 complete and 0 interrupted iterations
default   [  21% ] 257/500 VUs  0m30.9s/2m30.0s

running (0m31.9s), 266/500 VUs, 577 complete and 0 interrupted iterations
default   [  21% ] 266/500 VUs  0m31.9s/2m30.0s

running (0m32.9s), 274/500 VUs, 620 complete and 0 interrupted iterations
default   [  22% ] 274/500 VUs  0m32.9s/2m30.0s

running (0m33.9s), 282/500 VUs, 660 complete and 0 interrupted iterations
default   [  23% ] 282/500 VUs  0m33.9s/2m30.0s

running (0m34.9s), 291/500 VUs, 701 complete and 0 interrupted iterations
default   [  23% ] 291/500 VUs  0m34.9s/2m30.0s

running (0m35.9s), 299/500 VUs, 744 complete and 0 interrupted iterations
default   [  24% ] 299/500 VUs  0m35.9s/2m30.0s

running (0m36.9s), 307/500 VUs, 792 complete and 0 interrupted iterations
default   [  25% ] 307/500 VUs  0m36.9s/2m30.0s

running (0m37.9s), 316/500 VUs, 840 complete and 0 interrupted iterations
default   [  25% ] 316/500 VUs  0m37.9s/2m30.0s

running (0m38.9s), 324/500 VUs, 889 complete and 0 interrupted iterations
default   [  26% ] 324/500 VUs  0m38.9s/2m30.0s

running (0m39.9s), 332/500 VUs, 937 complete and 0 interrupted iterations
default   [  27% ] 332/500 VUs  0m39.9s/2m30.0s

running (0m40.9s), 341/500 VUs, 989 complete and 0 interrupted iterations
default   [  27% ] 341/500 VUs  0m40.9s/2m30.0s

running (0m41.9s), 349/500 VUs, 1038 complete and 0 interrupted iterations
default   [  28% ] 349/500 VUs  0m41.9s/2m30.0s

running (0m42.9s), 357/500 VUs, 1093 complete and 0 interrupted iterations
default   [  29% ] 357/500 VUs  0m42.9s/2m30.0s

running (0m43.9s), 366/500 VUs, 1151 complete and 0 interrupted iterations
default   [  29% ] 366/500 VUs  0m43.9s/2m30.0s

running (0m44.9s), 374/500 VUs, 1211 complete and 0 interrupted iterations
default   [  30% ] 374/500 VUs  0m44.9s/2m30.0s

running (0m45.9s), 382/500 VUs, 1269 complete and 0 interrupted iterations
default   [  31% ] 382/500 VUs  0m45.9s/2m30.0s

running (0m46.9s), 390/500 VUs, 1326 complete and 0 interrupted iterations
default   [  31% ] 390/500 VUs  0m46.9s/2m30.0s

running (0m47.9s), 399/500 VUs, 1384 complete and 0 interrupted iterations
default   [  32% ] 399/500 VUs  0m47.9s/2m30.0s

running (0m48.9s), 407/500 VUs, 1446 complete and 0 interrupted iterations
default   [  33% ] 407/500 VUs  0m48.9s/2m30.0s

running (0m49.9s), 415/500 VUs, 1515 complete and 0 interrupted iterations
default   [  33% ] 415/500 VUs  0m49.9s/2m30.0s

running (0m50.9s), 424/500 VUs, 1580 complete and 0 interrupted iterations
default   [  34% ] 424/500 VUs  0m50.9s/2m30.0s

running (0m51.9s), 432/500 VUs, 1648 complete and 0 interrupted iterations
default   [  35% ] 432/500 VUs  0m51.9s/2m30.0s

running (0m52.9s), 440/500 VUs, 1711 complete and 0 interrupted iterations
default   [  35% ] 440/500 VUs  0m52.9s/2m30.0s

running (0m53.9s), 449/500 VUs, 1773 complete and 0 interrupted iterations
default   [  36% ] 449/500 VUs  0m53.9s/2m30.0s

running (0m54.9s), 457/500 VUs, 1845 complete and 0 interrupted iterations
default   [  37% ] 457/500 VUs  0m54.9s/2m30.0s

running (0m55.9s), 465/500 VUs, 1915 complete and 0 interrupted iterations
default   [  37% ] 465/500 VUs  0m55.9s/2m30.0s

running (0m57.0s), 472/500 VUs, 1972 complete and 0 interrupted iterations
default   [  38% ] 472/500 VUs  0m57.0s/2m30.0s

running (0m57.9s), 482/500 VUs, 2040 complete and 0 interrupted iterations
default   [  39% ] 482/500 VUs  0m57.9s/2m30.0s

running (0m58.9s), 490/500 VUs, 2114 complete and 0 interrupted iterations
default   [  39% ] 490/500 VUs  0m58.9s/2m30.0s

running (0m59.9s), 498/500 VUs, 2167 complete and 0 interrupted iterations
default   [  40% ] 498/500 VUs  0m59.9s/2m30.0s

running (1m00.9s), 500/500 VUs, 2229 complete and 0 interrupted iterations
default   [  41% ] 500/500 VUs  1m00.9s/2m30.0s

running (1m01.9s), 500/500 VUs, 2308 complete and 0 interrupted iterations
default   [  41% ] 500/500 VUs  1m01.9s/2m30.0s

running (1m02.9s), 500/500 VUs, 2356 complete and 0 interrupted iterations
default   [  42% ] 500/500 VUs  1m02.9s/2m30.0s

running (1m03.9s), 500/500 VUs, 2433 complete and 0 interrupted iterations
default   [  43% ] 500/500 VUs  1m03.9s/2m30.0s

running (1m04.9s), 500/500 VUs, 2511 complete and 0 interrupted iterations
default   [  43% ] 500/500 VUs  1m04.9s/2m30.0s

running (1m05.9s), 500/500 VUs, 2573 complete and 0 interrupted iterations
default   [  44% ] 500/500 VUs  1m05.9s/2m30.0s

running (1m06.9s), 500/500 VUs, 2658 complete and 0 interrupted iterations
default   [  45% ] 500/500 VUs  1m06.9s/2m30.0s

running (1m07.9s), 500/500 VUs, 2726 complete and 0 interrupted iterations
default   [  45% ] 500/500 VUs  1m07.9s/2m30.0s

running (1m09.3s), 500/500 VUs, 2815 complete and 0 interrupted iterations
default   [  46% ] 500/500 VUs  1m09.3s/2m30.0s

running (1m09.9s), 500/500 VUs, 2849 complete and 0 interrupted iterations
default   [  47% ] 500/500 VUs  1m09.9s/2m30.0s

running (1m10.9s), 500/500 VUs, 2932 complete and 0 interrupted iterations
default   [  47% ] 500/500 VUs  1m10.9s/2m30.0s

running (1m11.9s), 500/500 VUs, 3010 complete and 0 interrupted iterations
default   [  48% ] 500/500 VUs  1m11.9s/2m30.0s

running (1m12.9s), 500/500 VUs, 3058 complete and 0 interrupted iterations
default   [  49% ] 500/500 VUs  1m12.9s/2m30.0s

running (1m13.9s), 500/500 VUs, 3143 complete and 0 interrupted iterations
default   [  49% ] 500/500 VUs  1m13.9s/2m30.0s

running (1m14.9s), 500/500 VUs, 3222 complete and 0 interrupted iterations
default   [  50% ] 500/500 VUs  1m14.9s/2m30.0s

running (1m15.9s), 500/500 VUs, 3293 complete and 0 interrupted iterations
default   [  51% ] 500/500 VUs  1m15.9s/2m30.0s

running (1m16.9s), 500/500 VUs, 3375 complete and 0 interrupted iterations
default   [  51% ] 500/500 VUs  1m16.9s/2m30.0s

running (1m17.9s), 500/500 VUs, 3421 complete and 0 interrupted iterations
default   [  52% ] 500/500 VUs  1m17.9s/2m30.0s

running (1m18.9s), 500/500 VUs, 3511 complete and 0 interrupted iterations
default   [  53% ] 500/500 VUs  1m18.9s/2m30.0s

running (1m20.0s), 500/500 VUs, 3588 complete and 0 interrupted iterations
default   [  53% ] 500/500 VUs  1m20.0s/2m30.0s

running (1m20.9s), 500/500 VUs, 3665 complete and 0 interrupted iterations
default   [  54% ] 500/500 VUs  1m20.9s/2m30.0s

running (1m21.9s), 500/500 VUs, 3728 complete and 0 interrupted iterations
default   [  55% ] 500/500 VUs  1m21.9s/2m30.0s

running (1m22.9s), 500/500 VUs, 3818 complete and 0 interrupted iterations
default   [  55% ] 500/500 VUs  1m22.9s/2m30.0s

running (1m23.9s), 500/500 VUs, 3884 complete and 0 interrupted iterations
default   [  56% ] 500/500 VUs  1m23.9s/2m30.0s

running (1m24.9s), 500/500 VUs, 3959 complete and 0 interrupted iterations
default   [  57% ] 500/500 VUs  1m24.9s/2m30.0s

running (1m25.9s), 500/500 VUs, 4043 complete and 0 interrupted iterations
default   [  57% ] 500/500 VUs  1m25.9s/2m30.0s

running (1m26.9s), 500/500 VUs, 4087 complete and 0 interrupted iterations
default   [  58% ] 500/500 VUs  1m26.9s/2m30.0s

running (1m27.9s), 500/500 VUs, 4176 complete and 0 interrupted iterations
default   [  59% ] 500/500 VUs  1m27.9s/2m30.0s

running (1m28.9s), 500/500 VUs, 4260 complete and 0 interrupted iterations
default   [  59% ] 500/500 VUs  1m28.9s/2m30.0s

running (1m29.9s), 500/500 VUs, 4343 complete and 0 interrupted iterations
default   [  60% ] 500/500 VUs  1m29.9s/2m30.0s

running (1m30.9s), 500/500 VUs, 4410 complete and 0 interrupted iterations
default   [  61% ] 500/500 VUs  1m30.9s/2m30.0s

running (1m31.9s), 500/500 VUs, 4465 complete and 0 interrupted iterations
default   [  61% ] 500/500 VUs  1m31.9s/2m30.0s

running (1m32.9s), 500/500 VUs, 4548 complete and 0 interrupted iterations
default   [  62% ] 500/500 VUs  1m32.9s/2m30.0s

running (1m33.9s), 500/500 VUs, 4643 complete and 0 interrupted iterations
default   [  63% ] 500/500 VUs  1m33.9s/2m30.0s

running (1m34.9s), 500/500 VUs, 4702 complete and 0 interrupted iterations
default   [  63% ] 500/500 VUs  1m34.9s/2m30.0s

running (1m35.9s), 500/500 VUs, 4779 complete and 0 interrupted iterations
default   [  64% ] 500/500 VUs  1m35.9s/2m30.0s

running (1m36.9s), 500/500 VUs, 4865 complete and 0 interrupted iterations
default   [  65% ] 500/500 VUs  1m36.9s/2m30.0s

running (1m37.9s), 500/500 VUs, 4949 complete and 0 interrupted iterations
default   [  65% ] 500/500 VUs  1m37.9s/2m30.0s

running (1m38.9s), 500/500 VUs, 5023 complete and 0 interrupted iterations
default   [  66% ] 500/500 VUs  1m38.9s/2m30.0s

running (1m39.9s), 500/500 VUs, 5065 complete and 0 interrupted iterations
default   [  67% ] 500/500 VUs  1m39.9s/2m30.0s

running (1m40.9s), 500/500 VUs, 5147 complete and 0 interrupted iterations
default   [  67% ] 500/500 VUs  1m40.9s/2m30.0s

running (1m41.9s), 500/500 VUs, 5219 complete and 0 interrupted iterations
default   [  68% ] 500/500 VUs  1m41.9s/2m30.0s

running (1m42.9s), 500/500 VUs, 5309 complete and 0 interrupted iterations
default   [  69% ] 500/500 VUs  1m42.9s/2m30.0s

running (1m43.9s), 500/500 VUs, 5381 complete and 0 interrupted iterations
default   [  69% ] 500/500 VUs  1m43.9s/2m30.0s

running (1m44.9s), 500/500 VUs, 5446 complete and 0 interrupted iterations
default   [  70% ] 500/500 VUs  1m44.9s/2m30.0s

running (1m45.9s), 500/500 VUs, 5526 complete and 0 interrupted iterations
default   [  71% ] 500/500 VUs  1m45.9s/2m30.0s

running (1m46.9s), 500/500 VUs, 5613 complete and 0 interrupted iterations
default   [  71% ] 500/500 VUs  1m46.9s/2m30.0s

running (1m47.9s), 500/500 VUs, 5670 complete and 0 interrupted iterations
default   [  72% ] 500/500 VUs  1m47.9s/2m30.0s

running (1m48.9s), 500/500 VUs, 5732 complete and 0 interrupted iterations
default   [  73% ] 500/500 VUs  1m48.9s/2m30.0s

running (1m50.1s), 500/500 VUs, 5830 complete and 0 interrupted iterations
default   [  73% ] 500/500 VUs  1m50.1s/2m30.0s

running (1m50.9s), 500/500 VUs, 5917 complete and 0 interrupted iterations
default   [  74% ] 500/500 VUs  1m50.9s/2m30.0s

running (1m51.9s), 500/500 VUs, 5977 complete and 0 interrupted iterations
default   [  75% ] 500/500 VUs  1m51.9s/2m30.0s

running (1m52.9s), 500/500 VUs, 6033 complete and 0 interrupted iterations
default   [  75% ] 500/500 VUs  1m52.9s/2m30.0s

running (1m53.9s), 500/500 VUs, 6129 complete and 0 interrupted iterations
default   [  76% ] 500/500 VUs  1m53.9s/2m30.0s

running (1m55.2s), 500/500 VUs, 6211 complete and 0 interrupted iterations
default   [  77% ] 500/500 VUs  1m55.2s/2m30.0s

running (1m55.9s), 500/500 VUs, 6264 complete and 0 interrupted iterations
default   [  77% ] 500/500 VUs  1m55.9s/2m30.0s

running (1m57.2s), 500/500 VUs, 6345 complete and 0 interrupted iterations
default   [  78% ] 500/500 VUs  1m57.2s/2m30.0s

running (1m57.9s), 500/500 VUs, 6426 complete and 0 interrupted iterations
default   [  79% ] 500/500 VUs  1m57.9s/2m30.0s

running (1m58.9s), 500/500 VUs, 6499 complete and 0 interrupted iterations
default   [  79% ] 500/500 VUs  1m58.9s/2m30.0s

running (1m59.9s), 500/500 VUs, 6552 complete and 0 interrupted iterations
default   [  80% ] 500/500 VUs  1m59.9s/2m30.0s

running (2m00.9s), 497/500 VUs, 6615 complete and 0 interrupted iterations
default   [  81% ] 497/500 VUs  2m00.9s/2m30.0s

running (2m01.9s), 491/500 VUs, 6705 complete and 0 interrupted iterations
default   [  81% ] 491/500 VUs  2m01.9s/2m30.0s

running (2m02.9s), 487/500 VUs, 6804 complete and 0 interrupted iterations
default   [  82% ] 487/500 VUs  2m02.9s/2m30.0s

running (2m03.9s), 482/500 VUs, 6850 complete and 0 interrupted iterations
default   [  83% ] 482/500 VUs  2m03.9s/2m30.0s

running (2m04.9s), 476/500 VUs, 6928 complete and 0 interrupted iterations
default   [  83% ] 476/500 VUs  2m04.9s/2m30.0s

running (2m05.9s), 463/500 VUs, 6999 complete and 0 interrupted iterations
default   [  84% ] 463/500 VUs  2m05.9s/2m30.0s

running (2m06.9s), 445/500 VUs, 7072 complete and 0 interrupted iterations
default   [  85% ] 445/500 VUs  2m06.9s/2m30.0s

running (2m07.9s), 432/500 VUs, 7136 complete and 0 interrupted iterations
default   [  85% ] 432/500 VUs  2m07.9s/2m30.0s

running (2m08.9s), 408/500 VUs, 7210 complete and 0 interrupted iterations
default   [  86% ] 408/500 VUs  2m08.9s/2m30.0s

running (2m09.9s), 393/500 VUs, 7279 complete and 0 interrupted iterations
default   [  87% ] 393/500 VUs  2m09.9s/2m30.0s

running (2m10.9s), 373/500 VUs, 7373 complete and 0 interrupted iterations
default   [  87% ] 373/500 VUs  2m10.9s/2m30.0s

running (2m11.9s), 359/500 VUs, 7430 complete and 0 interrupted iterations
default   [  88% ] 359/500 VUs  2m11.9s/2m30.0s

running (2m12.9s), 345/500 VUs, 7490 complete and 0 interrupted iterations
default   [  89% ] 345/500 VUs  2m12.9s/2m30.0s

running (2m13.9s), 329/500 VUs, 7547 complete and 0 interrupted iterations
default   [  89% ] 329/500 VUs  2m13.9s/2m30.0s

running (2m14.9s), 310/500 VUs, 7605 complete and 0 interrupted iterations
default   [  90% ] 310/500 VUs  2m14.9s/2m30.0s

running (2m15.9s), 291/500 VUs, 7670 complete and 0 interrupted iterations
default   [  91% ] 291/500 VUs  2m15.9s/2m30.0s

running (2m16.9s), 263/500 VUs, 7744 complete and 0 interrupted iterations
default   [  91% ] 263/500 VUs  2m16.9s/2m30.0s

running (2m17.9s), 251/500 VUs, 7789 complete and 0 interrupted iterations
default   [  92% ] 251/500 VUs  2m17.9s/2m30.0s

running (2m18.9s), 234/500 VUs, 7835 complete and 0 interrupted iterations
default   [  93% ] 234/500 VUs  2m18.9s/2m30.0s

running (2m19.9s), 217/500 VUs, 7873 complete and 0 interrupted iterations
default   [  93% ] 217/500 VUs  2m19.9s/2m30.0s

running (2m20.9s), 200/500 VUs, 7915 complete and 0 interrupted iterations
default   [  94% ] 200/500 VUs  2m20.9s/2m30.0s

running (2m21.9s), 184/500 VUs, 7959 complete and 0 interrupted iterations
default   [  95% ] 184/500 VUs  2m21.9s/2m30.0s

running (2m22.9s), 163/500 VUs, 8006 complete and 0 interrupted iterations
default   [  95% ] 163/500 VUs  2m22.9s/2m30.0s

running (2m23.9s), 146/500 VUs, 8039 complete and 0 interrupted iterations
default   [  96% ] 146/500 VUs  2m23.9s/2m30.0s

running (2m24.9s), 132/500 VUs, 8069 complete and 0 interrupted iterations
default   [  97% ] 132/500 VUs  2m24.9s/2m30.0s

running (2m25.9s), 119/500 VUs, 8089 complete and 0 interrupted iterations
default   [  97% ] 119/500 VUs  2m25.9s/2m30.0s

running (2m26.9s), 104/500 VUs, 8115 complete and 0 interrupted iterations
default   [  98% ] 104/500 VUs  2m26.9s/2m30.0s

running (2m27.9s), 083/500 VUs, 8143 complete and 0 interrupted iterations
default   [  99% ] 083/500 VUs  2m27.9s/2m30.0s

running (2m28.9s), 065/500 VUs, 8168 complete and 0 interrupted iterations
default   [  99% ] 065/500 VUs  2m28.9s/2m30.0s

running (2m29.9s), 049/500 VUs, 8185 complete and 0 interrupted iterations
default   [ 100% ] 049/500 VUs  2m29.9s/2m30.0s

running (2m30.9s), 034/500 VUs, 8200 complete and 0 interrupted iterations
default ↓ [ 100% ] 047/500 VUs  2m30s

running (2m31.9s), 026/500 VUs, 8208 complete and 0 interrupted iterations
default ↓ [ 100% ] 047/500 VUs  2m30s

running (2m32.9s), 015/500 VUs, 8219 complete and 0 interrupted iterations
default ↓ [ 100% ] 047/500 VUs  2m30s

running (2m33.9s), 008/500 VUs, 8226 complete and 0 interrupted iterations
default ↓ [ 100% ] 047/500 VUs  2m30s

running (2m34.9s), 001/500 VUs, 8233 complete and 0 interrupted iterations
default ↓ [ 100% ] 047/500 VUs  2m30s


  █ THRESHOLDS 

    active_clients_time
    ✓ 'p(95)<500' p(95)=126ms

    attach_documents_time
    ✓ 'p(95)<10000' p(95)=435ms

    deactivate_clients_time
    ✓ 'p(95)<10000' p(95)=116ms

    http_req_duration
    ✓ 'p(95)<10000' p(95)=229.76ms

    pushpulls_time
    ✓ 'p(95)<1000' p(95)=245ms

    transaction_success_rate
    ✓ 'rate>0.99' rate=100.00%

    transaction_time
    ✓ 'p(95)<30000' p(95)=7.37s


  █ TOTAL RESULTS 

    checks_total.......: 131744  849.386484/s
    checks_succeeded...: 100.00% 131744 out of 131744
    checks_failed......: 0.00%   0 out of 131744

    ✓ status is 200
    ✓ response has valid body

    CUSTOM
    active_clients....................: 8234    53.086655/s
    active_clients_success_rate.......: 100.00% 8234 out of 8234
    active_clients_time...............: avg=29.21ms  min=1ms      med=6ms     max=576ms    p(90)=91ms     p(95)=126ms   
    attach_documents..................: 8234    53.086655/s
    attach_documents_success_rate.....: 100.00% 8234 out of 8234
    attach_documents_time.............: avg=113.42ms min=3ms      med=36ms    max=863ms    p(90)=324ms    p(95)=435ms   
    deactivate_clients................: 8234    53.086655/s
    deactivate_clients_success_rate...: 100.00% 8234 out of 8234
    deactivate_clients_time...........: avg=26.22ms  min=0s       med=5ms     max=447ms    p(90)=78.69ms  p(95)=116ms   
    pushpulls.........................: 41170   265.433276/s
    pushpulls_success_rate............: 100.00% 41170 out of 41170
    pushpulls_time....................: avg=64.98ms  min=1ms      med=27ms    max=695ms    p(90)=178ms    p(95)=245ms   
    transaction_success_rate..........: 100.00% 8234 out of 8234
    transaction_time..................: avg=6.56s    min=6.01s    med=6.55s   max=8.58s    p(90)=7.17s    p(95)=7.37s   

    HTTP
    http_req_duration.................: avg=55.45ms  min=510.56µs med=14.24ms max=854.53ms p(90)=159.15ms p(95)=229.76ms
      { expected_response:true }......: avg=55.45ms  min=510.56µs med=14.24ms max=854.53ms p(90)=159.15ms p(95)=229.76ms
    http_req_failed...................: 0.00%   0 out of 65872
    http_reqs.........................: 65872   424.693242/s

    EXECUTION
    iteration_duration................: avg=6.56s    min=6.01s    med=6.55s   max=8.58s    p(90)=7.17s    p(95)=7.36s   
    iterations........................: 8234    53.086655/s
    vus...............................: 1       min=1              max=500
    vus_max...........................: 500     min=500            max=500

    NETWORK
    data_received.....................: 1.2 GB  7.5 MB/s
    data_sent.........................: 62 MB   400 kB/s




running (2m35.1s), 000/500 VUs, 8234 complete and 0 interrupted iterations
default ✓ [ 100% ] 000/500 VUs  2m30s
