
         /\      Grafana   /‾‾/  
    /\  /  \     |\  __   /  /   
   /  \/    \    | |/ /  /   ‾‾\ 
  /          \   |   (  |  (‾)  |
 / __________ \  |_|\_\  \_____/ 

     execution: local
        script: test/k6/presence.ts
        output: -

     scenarios: (100.00%) 1 scenario, 500 max VUs, 3m0s max duration (incl. graceful stop):
              * default: Up to 500 looping VUs for 2m30s over 3 stages (gracefulRampDown: 30s, gracefulStop: 30s)


running (0m00.9s), 008/500 VUs, 0 complete and 0 interrupted iterations
default   [   1% ] 008/500 VUs  0m00.9s/2m30.0s

running (0m01.9s), 016/500 VUs, 0 complete and 0 interrupted iterations
default   [   1% ] 016/500 VUs  0m01.9s/2m30.0s

running (0m02.9s), 024/500 VUs, 0 complete and 0 interrupted iterations
default   [   2% ] 024/500 VUs  0m02.9s/2m30.0s

running (0m03.9s), 033/500 VUs, 0 complete and 0 interrupted iterations
default   [   3% ] 033/500 VUs  0m03.9s/2m30.0s

running (0m04.9s), 041/500 VUs, 0 complete and 0 interrupted iterations
default   [   3% ] 041/500 VUs  0m04.9s/2m30.0s

running (0m05.9s), 049/500 VUs, 0 complete and 0 interrupted iterations
default   [   4% ] 049/500 VUs  0m05.9s/2m30.0s

running (0m06.9s), 058/500 VUs, 8 complete and 0 interrupted iterations
default   [   5% ] 058/500 VUs  0m06.9s/2m30.0s

running (0m07.9s), 066/500 VUs, 16 complete and 0 interrupted iterations
default   [   5% ] 066/500 VUs  0m07.9s/2m30.0s

running (0m08.9s), 074/500 VUs, 24 complete and 0 interrupted iterations
default   [   6% ] 074/500 VUs  0m08.9s/2m30.0s

running (0m09.9s), 083/500 VUs, 33 complete and 0 interrupted iterations
default   [   7% ] 083/500 VUs  0m09.9s/2m30.0s

running (0m10.9s), 091/500 VUs, 41 complete and 0 interrupted iterations
default   [   7% ] 091/500 VUs  0m10.9s/2m30.0s

running (0m11.9s), 099/500 VUs, 49 complete and 0 interrupted iterations
default   [   8% ] 099/500 VUs  0m11.9s/2m30.0s

running (0m12.9s), 108/500 VUs, 65 complete and 0 interrupted iterations
default   [   9% ] 108/500 VUs  0m12.9s/2m30.0s

running (0m13.9s), 116/500 VUs, 82 complete and 0 interrupted iterations
default   [   9% ] 116/500 VUs  0m13.9s/2m30.0s

running (0m14.9s), 124/500 VUs, 98 complete and 0 interrupted iterations
default   [  10% ] 124/500 VUs  0m14.9s/2m30.0s

running (0m15.9s), 133/500 VUs, 114 complete and 0 interrupted iterations
default   [  11% ] 133/500 VUs  0m15.9s/2m30.0s

running (0m16.9s), 141/500 VUs, 132 complete and 0 interrupted iterations
default   [  11% ] 141/500 VUs  0m16.9s/2m30.0s

running (0m17.9s), 149/500 VUs, 148 complete and 0 interrupted iterations
default   [  12% ] 149/500 VUs  0m17.9s/2m30.0s

running (0m18.9s), 157/500 VUs, 171 complete and 0 interrupted iterations
default   [  13% ] 157/500 VUs  0m18.9s/2m30.0s

running (0m19.9s), 166/500 VUs, 198 complete and 0 interrupted iterations
default   [  13% ] 166/500 VUs  0m19.9s/2m30.0s

running (0m20.9s), 174/500 VUs, 222 complete and 0 interrupted iterations
default   [  14% ] 174/500 VUs  0m20.9s/2m30.0s

running (0m21.9s), 182/500 VUs, 246 complete and 0 interrupted iterations
default   [  15% ] 182/500 VUs  0m21.9s/2m30.0s

running (0m22.9s), 191/500 VUs, 273 complete and 0 interrupted iterations
default   [  15% ] 191/500 VUs  0m22.9s/2m30.0s

running (0m23.9s), 199/500 VUs, 297 complete and 0 interrupted iterations
default   [  16% ] 199/500 VUs  0m23.9s/2m30.0s

running (0m24.9s), 207/500 VUs, 328 complete and 0 interrupted iterations
default   [  17% ] 207/500 VUs  0m24.9s/2m30.0s

running (0m25.9s), 216/500 VUs, 362 complete and 0 interrupted iterations
default   [  17% ] 216/500 VUs  0m25.9s/2m30.0s

running (0m26.9s), 224/500 VUs, 396 complete and 0 interrupted iterations
default   [  18% ] 224/500 VUs  0m26.9s/2m30.0s

running (0m27.9s), 232/500 VUs, 428 complete and 0 interrupted iterations
default   [  19% ] 232/500 VUs  0m27.9s/2m30.0s

running (0m28.9s), 241/500 VUs, 462 complete and 0 interrupted iterations
default   [  19% ] 241/500 VUs  0m28.9s/2m30.0s

running (0m29.9s), 249/500 VUs, 496 complete and 0 interrupted iterations
default   [  20% ] 249/500 VUs  0m29.9s/2m30.0s

running (0m30.9s), 257/500 VUs, 535 complete and 0 interrupted iterations
default   [  21% ] 257/500 VUs  0m30.9s/2m30.0s

running (0m31.9s), 266/500 VUs, 576 complete and 0 interrupted iterations
default   [  21% ] 266/500 VUs  0m31.9s/2m30.0s

running (0m32.9s), 274/500 VUs, 618 complete and 0 interrupted iterations
default   [  22% ] 274/500 VUs  0m32.9s/2m30.0s

running (0m33.9s), 282/500 VUs, 660 complete and 0 interrupted iterations
default   [  23% ] 282/500 VUs  0m33.9s/2m30.0s

running (0m34.9s), 291/500 VUs, 700 complete and 0 interrupted iterations
default   [  23% ] 291/500 VUs  0m34.9s/2m30.0s

running (0m35.9s), 299/500 VUs, 743 complete and 0 interrupted iterations
default   [  24% ] 299/500 VUs  0m35.9s/2m30.0s

running (0m36.9s), 307/500 VUs, 792 complete and 0 interrupted iterations
default   [  25% ] 307/500 VUs  0m36.9s/2m30.0s

running (0m37.9s), 315/500 VUs, 840 complete and 0 interrupted iterations
default   [  25% ] 315/500 VUs  0m37.9s/2m30.0s

running (0m38.9s), 324/500 VUs, 891 complete and 0 interrupted iterations
default   [  26% ] 324/500 VUs  0m38.9s/2m30.0s

running (0m39.9s), 332/500 VUs, 942 complete and 0 interrupted iterations
default   [  27% ] 332/500 VUs  0m39.9s/2m30.0s

running (0m40.9s), 340/500 VUs, 990 complete and 0 interrupted iterations
default   [  27% ] 340/500 VUs  0m40.9s/2m30.0s

running (0m41.9s), 349/500 VUs, 1039 complete and 0 interrupted iterations
default   [  28% ] 349/500 VUs  0m41.9s/2m30.0s

running (0m42.9s), 357/500 VUs, 1097 complete and 0 interrupted iterations
default   [  29% ] 357/500 VUs  0m42.9s/2m30.0s

running (0m43.9s), 365/500 VUs, 1155 complete and 0 interrupted iterations
default   [  29% ] 365/500 VUs  0m43.9s/2m30.0s

running (0m44.9s), 374/500 VUs, 1213 complete and 0 interrupted iterations
default   [  30% ] 374/500 VUs  0m44.9s/2m30.0s

running (0m45.9s), 382/500 VUs, 1271 complete and 0 interrupted iterations
default   [  31% ] 382/500 VUs  0m45.9s/2m30.0s

running (0m46.9s), 390/500 VUs, 1330 complete and 0 interrupted iterations
default   [  31% ] 390/500 VUs  0m46.9s/2m30.0s

running (0m47.9s), 399/500 VUs, 1386 complete and 0 interrupted iterations
default   [  32% ] 399/500 VUs  0m47.9s/2m30.0s

running (0m48.9s), 407/500 VUs, 1450 complete and 0 interrupted iterations
default   [  33% ] 407/500 VUs  0m48.9s/2m30.0s

running (0m49.9s), 415/500 VUs, 1512 complete and 0 interrupted iterations
default   [  33% ] 415/500 VUs  0m49.9s/2m30.0s

running (0m50.9s), 424/500 VUs, 1579 complete and 0 interrupted iterations
default   [  34% ] 424/500 VUs  0m50.9s/2m30.0s

running (0m51.9s), 432/500 VUs, 1648 complete and 0 interrupted iterations
default   [  35% ] 432/500 VUs  0m51.9s/2m30.0s

running (0m52.9s), 440/500 VUs, 1707 complete and 0 interrupted iterations
default   [  35% ] 440/500 VUs  0m52.9s/2m30.0s

running (0m53.9s), 449/500 VUs, 1767 complete and 0 interrupted iterations
default   [  36% ] 449/500 VUs  0m53.9s/2m30.0s

running (0m54.9s), 457/500 VUs, 1834 complete and 0 interrupted iterations
default   [  37% ] 457/500 VUs  0m54.9s/2m30.0s

running (0m55.9s), 465/500 VUs, 1906 complete and 0 interrupted iterations
default   [  37% ] 465/500 VUs  0m55.9s/2m30.0s

running (0m56.9s), 474/500 VUs, 1971 complete and 0 interrupted iterations
default   [  38% ] 474/500 VUs  0m56.9s/2m30.0s

running (0m57.9s), 482/500 VUs, 2038 complete and 0 interrupted iterations
default   [  39% ] 482/500 VUs  0m57.9s/2m30.0s

running (0m58.9s), 490/500 VUs, 2113 complete and 0 interrupted iterations
default   [  39% ] 490/500 VUs  0m58.9s/2m30.0s

running (0m59.9s), 498/500 VUs, 2195 complete and 0 interrupted iterations
default   [  40% ] 498/500 VUs  0m59.9s/2m30.0s

running (1m00.9s), 500/500 VUs, 2266 complete and 0 interrupted iterations
default   [  41% ] 500/500 VUs  1m00.9s/2m30.0s

running (1m02.0s), 500/500 VUs, 2330 complete and 0 interrupted iterations
default   [  41% ] 500/500 VUs  1m02.0s/2m30.0s

running (1m02.9s), 500/500 VUs, 2418 complete and 0 interrupted iterations
default   [  42% ] 500/500 VUs  1m02.9s/2m30.0s

running (1m03.9s), 500/500 VUs, 2493 complete and 0 interrupted iterations
default   [  43% ] 500/500 VUs  1m03.9s/2m30.0s

running (1m04.9s), 500/500 VUs, 2579 complete and 0 interrupted iterations
default   [  43% ] 500/500 VUs  1m04.9s/2m30.0s

running (1m05.9s), 500/500 VUs, 2630 complete and 0 interrupted iterations
default   [  44% ] 500/500 VUs  1m05.9s/2m30.0s

running (1m06.9s), 500/500 VUs, 2715 complete and 0 interrupted iterations
default   [  45% ] 500/500 VUs  1m06.9s/2m30.0s

running (1m07.9s), 500/500 VUs, 2784 complete and 0 interrupted iterations
default   [  45% ] 500/500 VUs  1m07.9s/2m30.0s

running (1m08.9s), 500/500 VUs, 2849 complete and 0 interrupted iterations
default   [  46% ] 500/500 VUs  1m08.9s/2m30.0s

running (1m09.9s), 500/500 VUs, 2931 complete and 0 interrupted iterations
default   [  47% ] 500/500 VUs  1m09.9s/2m30.0s

running (1m10.9s), 500/500 VUs, 3013 complete and 0 interrupted iterations
default   [  47% ] 500/500 VUs  1m10.9s/2m30.0s

running (1m12.0s), 500/500 VUs, 3091 complete and 0 interrupted iterations
default   [  48% ] 500/500 VUs  1m12.0s/2m30.0s

running (1m12.9s), 500/500 VUs, 3162 complete and 0 interrupted iterations
default   [  49% ] 500/500 VUs  1m12.9s/2m30.0s

running (1m13.9s), 500/500 VUs, 3211 complete and 0 interrupted iterations
default   [  49% ] 500/500 VUs  1m13.9s/2m30.0s

running (1m14.9s), 500/500 VUs, 3318 complete and 0 interrupted iterations
default   [  50% ] 500/500 VUs  1m14.9s/2m30.0s

running (1m15.9s), 500/500 VUs, 3403 complete and 0 interrupted iterations
default   [  51% ] 500/500 VUs  1m15.9s/2m30.0s

running (1m16.9s), 500/500 VUs, 3457 complete and 0 interrupted iterations
default   [  51% ] 500/500 VUs  1m16.9s/2m30.0s

running (1m17.9s), 500/500 VUs, 3555 complete and 0 interrupted iterations
default   [  52% ] 500/500 VUs  1m17.9s/2m30.0s

running (1m18.9s), 500/500 VUs, 3609 complete and 0 interrupted iterations
default   [  53% ] 500/500 VUs  1m18.9s/2m30.0s

running (1m19.9s), 500/500 VUs, 3682 complete and 0 interrupted iterations
default   [  53% ] 500/500 VUs  1m19.9s/2m30.0s

running (1m20.9s), 500/500 VUs, 3770 complete and 0 interrupted iterations
default   [  54% ] 500/500 VUs  1m20.9s/2m30.0s

running (1m21.9s), 500/500 VUs, 3849 complete and 0 interrupted iterations
default   [  55% ] 500/500 VUs  1m21.9s/2m30.0s

running (1m22.9s), 500/500 VUs, 3921 complete and 0 interrupted iterations
default   [  55% ] 500/500 VUs  1m22.9s/2m30.0s

running (1m23.9s), 500/500 VUs, 4010 complete and 0 interrupted iterations
default   [  56% ] 500/500 VUs  1m23.9s/2m30.0s

running (1m24.9s), 500/500 VUs, 4095 complete and 0 interrupted iterations
default   [  57% ] 500/500 VUs  1m24.9s/2m30.0s

running (1m25.9s), 500/500 VUs, 4169 complete and 0 interrupted iterations
default   [  57% ] 500/500 VUs  1m25.9s/2m30.0s

running (1m26.9s), 500/500 VUs, 4212 complete and 0 interrupted iterations
default   [  58% ] 500/500 VUs  1m26.9s/2m30.0s

running (1m28.0s), 500/500 VUs, 4295 complete and 0 interrupted iterations
default   [  59% ] 500/500 VUs  1m28.0s/2m30.0s

running (1m28.9s), 500/500 VUs, 4389 complete and 0 interrupted iterations
default   [  59% ] 500/500 VUs  1m28.9s/2m30.0s

running (1m29.9s), 500/500 VUs, 4468 complete and 0 interrupted iterations
default   [  60% ] 500/500 VUs  1m29.9s/2m30.0s

running (1m30.9s), 500/500 VUs, 4547 complete and 0 interrupted iterations
default   [  61% ] 500/500 VUs  1m30.9s/2m30.0s

running (1m32.0s), 500/500 VUs, 4609 complete and 0 interrupted iterations
default   [  61% ] 500/500 VUs  1m32.0s/2m30.0s

running (1m32.9s), 500/500 VUs, 4676 complete and 0 interrupted iterations
default   [  62% ] 500/500 VUs  1m32.9s/2m30.0s

running (1m33.9s), 500/500 VUs, 4753 complete and 0 interrupted iterations
default   [  63% ] 500/500 VUs  1m33.9s/2m30.0s

running (1m34.9s), 500/500 VUs, 4822 complete and 0 interrupted iterations
default   [  63% ] 500/500 VUs  1m34.9s/2m30.0s

running (1m35.9s), 500/500 VUs, 4901 complete and 0 interrupted iterations
default   [  64% ] 500/500 VUs  1m35.9s/2m30.0s

running (1m36.9s), 500/500 VUs, 4995 complete and 0 interrupted iterations
default   [  65% ] 500/500 VUs  1m36.9s/2m30.0s

running (1m37.9s), 500/500 VUs, 5067 complete and 0 interrupted iterations
default   [  65% ] 500/500 VUs  1m37.9s/2m30.0s

running (1m38.9s), 500/500 VUs, 5126 complete and 0 interrupted iterations
default   [  66% ] 500/500 VUs  1m38.9s/2m30.0s

running (1m39.9s), 500/500 VUs, 5211 complete and 0 interrupted iterations
default   [  67% ] 500/500 VUs  1m39.9s/2m30.0s

running (1m40.9s), 500/500 VUs, 5292 complete and 0 interrupted iterations
default   [  67% ] 500/500 VUs  1m40.9s/2m30.0s

running (1m41.9s), 500/500 VUs, 5368 complete and 0 interrupted iterations
default   [  68% ] 500/500 VUs  1m41.9s/2m30.0s

running (1m42.9s), 500/500 VUs, 5414 complete and 0 interrupted iterations
default   [  69% ] 500/500 VUs  1m42.9s/2m30.0s

running (1m43.9s), 500/500 VUs, 5509 complete and 0 interrupted iterations
default   [  69% ] 500/500 VUs  1m43.9s/2m30.0s

running (1m44.9s), 500/500 VUs, 5590 complete and 0 interrupted iterations
default   [  70% ] 500/500 VUs  1m44.9s/2m30.0s

running (1m45.9s), 500/500 VUs, 5667 complete and 0 interrupted iterations
default   [  71% ] 500/500 VUs  1m45.9s/2m30.0s

running (1m46.9s), 500/500 VUs, 5754 complete and 0 interrupted iterations
default   [  71% ] 500/500 VUs  1m46.9s/2m30.0s

running (1m48.2s), 500/500 VUs, 5849 complete and 0 interrupted iterations
default   [  72% ] 500/500 VUs  1m48.3s/2m30.0s

running (1m48.9s), 500/500 VUs, 5896 complete and 0 interrupted iterations
default   [  73% ] 500/500 VUs  1m48.9s/2m30.0s

running (1m49.9s), 500/500 VUs, 5991 complete and 0 interrupted iterations
default   [  73% ] 500/500 VUs  1m49.9s/2m30.0s

running (1m50.9s), 500/500 VUs, 6064 complete and 0 interrupted iterations
default   [  74% ] 500/500 VUs  1m50.9s/2m30.0s

running (1m51.9s), 500/500 VUs, 6130 complete and 0 interrupted iterations
default   [  75% ] 500/500 VUs  1m51.9s/2m30.0s

running (1m52.9s), 500/500 VUs, 6202 complete and 0 interrupted iterations
default   [  75% ] 500/500 VUs  1m52.9s/2m30.0s

running (1m53.9s), 500/500 VUs, 6275 complete and 0 interrupted iterations
default   [  76% ] 500/500 VUs  1m53.9s/2m30.0s

running (1m54.9s), 500/500 VUs, 6340 complete and 0 interrupted iterations
default   [  77% ] 500/500 VUs  1m54.9s/2m30.0s

running (1m55.9s), 500/500 VUs, 6416 complete and 0 interrupted iterations
default   [  77% ] 500/500 VUs  1m55.9s/2m30.0s

running (1m56.9s), 500/500 VUs, 6507 complete and 0 interrupted iterations
default   [  78% ] 500/500 VUs  1m56.9s/2m30.0s

running (1m57.9s), 500/500 VUs, 6577 complete and 0 interrupted iterations
default   [  79% ] 500/500 VUs  1m57.9s/2m30.0s

running (1m58.9s), 500/500 VUs, 6655 complete and 0 interrupted iterations
default   [  79% ] 500/500 VUs  1m58.9s/2m30.0s

running (1m59.9s), 500/500 VUs, 6747 complete and 0 interrupted iterations
default   [  80% ] 500/500 VUs  1m59.9s/2m30.0s

running (2m00.9s), 499/500 VUs, 6814 complete and 0 interrupted iterations
default   [  81% ] 499/500 VUs  2m00.9s/2m30.0s

running (2m01.9s), 499/500 VUs, 6868 complete and 0 interrupted iterations
default   [  81% ] 499/500 VUs  2m01.9s/2m30.0s

running (2m02.9s), 493/500 VUs, 6965 complete and 0 interrupted iterations
default   [  82% ] 493/500 VUs  2m02.9s/2m30.0s

running (2m03.9s), 482/500 VUs, 7035 complete and 0 interrupted iterations
default   [  83% ] 482/500 VUs  2m03.9s/2m30.0s

running (2m04.9s), 475/500 VUs, 7097 complete and 0 interrupted iterations
default   [  83% ] 475/500 VUs  2m04.9s/2m30.0s

running (2m05.9s), 462/500 VUs, 7178 complete and 0 interrupted iterations
default   [  84% ] 462/500 VUs  2m05.9s/2m30.0s

running (2m06.9s), 442/500 VUs, 7267 complete and 0 interrupted iterations
default   [  85% ] 442/500 VUs  2m06.9s/2m30.0s

running (2m07.9s), 427/500 VUs, 7342 complete and 0 interrupted iterations
default   [  85% ] 427/500 VUs  2m07.9s/2m30.0s

running (2m08.9s), 409/500 VUs, 7397 complete and 0 interrupted iterations
default   [  86% ] 409/500 VUs  2m08.9s/2m30.0s

running (2m09.9s), 389/500 VUs, 7487 complete and 0 interrupted iterations
default   [  87% ] 389/500 VUs  2m09.9s/2m30.0s

running (2m10.9s), 371/500 VUs, 7566 complete and 0 interrupted iterations
default   [  87% ] 371/500 VUs  2m10.9s/2m30.0s

running (2m11.9s), 349/500 VUs, 7636 complete and 0 interrupted iterations
default   [  88% ] 349/500 VUs  2m11.9s/2m30.0s

running (2m12.9s), 334/500 VUs, 7705 complete and 0 interrupted iterations
default   [  89% ] 334/500 VUs  2m12.9s/2m30.0s

running (2m13.9s), 320/500 VUs, 7758 complete and 0 interrupted iterations
default   [  89% ] 320/500 VUs  2m13.9s/2m30.0s

running (2m14.9s), 306/500 VUs, 7806 complete and 0 interrupted iterations
default   [  90% ] 306/500 VUs  2m14.9s/2m30.0s

running (2m15.9s), 285/500 VUs, 7875 complete and 0 interrupted iterations
default   [  91% ] 285/500 VUs  2m15.9s/2m30.0s

running (2m16.9s), 266/500 VUs, 7933 complete and 0 interrupted iterations
default   [  91% ] 266/500 VUs  2m16.9s/2m30.0s

running (2m17.9s), 251/500 VUs, 7981 complete and 0 interrupted iterations
default   [  92% ] 251/500 VUs  2m17.9s/2m30.0s

running (2m18.9s), 228/500 VUs, 8039 complete and 0 interrupted iterations
default   [  93% ] 228/500 VUs  2m18.9s/2m30.0s

running (2m19.9s), 216/500 VUs, 8077 complete and 0 interrupted iterations
default   [  93% ] 216/500 VUs  2m19.9s/2m30.0s

running (2m20.9s), 203/500 VUs, 8112 complete and 0 interrupted iterations
default   [  94% ] 203/500 VUs  2m20.9s/2m30.0s

running (2m21.9s), 181/500 VUs, 8157 complete and 0 interrupted iterations
default   [  95% ] 181/500 VUs  2m21.9s/2m30.0s

running (2m22.9s), 166/500 VUs, 8198 complete and 0 interrupted iterations
default   [  95% ] 166/500 VUs  2m22.9s/2m30.0s

running (2m23.9s), 154/500 VUs, 8225 complete and 0 interrupted iterations
default   [  96% ] 154/500 VUs  2m23.9s/2m30.0s

running (2m24.9s), 133/500 VUs, 8267 complete and 0 interrupted iterations
default   [  97% ] 133/500 VUs  2m24.9s/2m30.0s

running (2m25.9s), 119/500 VUs, 8293 complete and 0 interrupted iterations
default   [  97% ] 119/500 VUs  2m25.9s/2m30.0s

running (2m26.9s), 108/500 VUs, 8315 complete and 0 interrupted iterations
default   [  98% ] 108/500 VUs  2m26.9s/2m30.0s

running (2m27.9s), 094/500 VUs, 8338 complete and 0 interrupted iterations
default   [  99% ] 094/500 VUs  2m27.9s/2m30.0s

running (2m28.9s), 073/500 VUs, 8364 complete and 0 interrupted iterations
default   [  99% ] 073/500 VUs  2m28.9s/2m30.0s

running (2m29.9s), 058/500 VUs, 8379 complete and 0 interrupted iterations
default   [ 100% ] 058/500 VUs  2m29.9s/2m30.0s

running (2m30.9s), 040/500 VUs, 8397 complete and 0 interrupted iterations
default ↓ [ 100% ] 052/500 VUs  2m30s

running (2m31.9s), 026/500 VUs, 8411 complete and 0 interrupted iterations
default ↓ [ 100% ] 052/500 VUs  2m30s

running (2m32.9s), 014/500 VUs, 8423 complete and 0 interrupted iterations
default ↓ [ 100% ] 052/500 VUs  2m30s

running (2m33.9s), 005/500 VUs, 8432 complete and 0 interrupted iterations
default ↓ [ 100% ] 052/500 VUs  2m30s


  █ THRESHOLDS 

    active_clients_time
    ✓ 'p(95)<500' p(95)=93ms

    attach_documents_time
    ✓ 'p(95)<10000' p(95)=350ms

    deactivate_clients_time
    ✓ 'p(95)<10000' p(95)=98ms

    http_req_duration
    ✓ 'p(95)<10000' p(95)=177.09ms

    pushpulls_time
    ✓ 'p(95)<1000' p(95)=182ms

    transaction_success_rate
    ✓ 'rate>0.99' rate=100.00%

    transaction_time
    ✓ 'p(95)<30000' p(95)=6.98s


  █ TOTAL RESULTS 

    checks_total.......: 134992  873.542118/s
    checks_succeeded...: 100.00% 134992 out of 134992
    checks_failed......: 0.00%   0 out of 134992

    ✓ status is 200
    ✓ response has valid body

    CUSTOM
    active_clients....................: 8437    54.596382/s
    active_clients_success_rate.......: 100.00% 8437 out of 8437
    active_clients_time...............: avg=21.78ms min=0s       med=5ms    max=625ms    p(90)=64ms  p(95)=93ms    
    attach_documents..................: 8437    54.596382/s
    attach_documents_success_rate.....: 100.00% 8437 out of 8437
    attach_documents_time.............: avg=91.63ms min=3ms      med=24ms   max=901ms    p(90)=280ms p(95)=350ms   
    deactivate_clients................: 8437    54.596382/s
    deactivate_clients_success_rate...: 100.00% 8437 out of 8437
    deactivate_clients_time...........: avg=20.61ms min=0s       med=3ms    max=380ms    p(90)=61ms  p(95)=98ms    
    pushpulls.........................: 42185   272.981912/s
    pushpulls_success_rate............: 100.00% 42185 out of 42185
    pushpulls_time....................: avg=43.12ms min=1ms      med=13ms   max=905ms    p(90)=123ms p(95)=182ms   
    transaction_success_rate..........: 100.00% 8437 out of 8437
    transaction_time..................: avg=6.41s   min=6.01s    med=6.39s  max=8.21s    p(90)=6.84s p(95)=6.98s   

    HTTP
    http_req_duration.................: avg=38.43ms min=178.27µs med=7.59ms max=899.51ms p(90)=114ms p(95)=177.09ms
      { expected_response:true }......: avg=38.43ms min=178.27µs med=7.59ms max=899.51ms p(90)=114ms p(95)=177.09ms
    http_req_failed...................: 0.00%   0 out of 67496
    http_reqs.........................: 67496   436.771059/s

    EXECUTION
    iteration_duration................: avg=6.41s   min=6.01s    med=6.39s  max=8.21s    p(90)=6.84s p(95)=6.98s   
    iterations........................: 8437    54.596382/s
    vus...............................: 5       min=5              max=500
    vus_max...........................: 500     min=500            max=500

    NETWORK
    data_received.....................: 1.2 GB  7.7 MB/s
    data_sent.........................: 64 MB   411 kB/s




running (2m34.5s), 000/500 VUs, 8437 complete and 0 interrupted iterations
default ✓ [ 100% ] 000/500 VUs  2m30s
