
         /\      Grafana   /‾‾/  
    /\  /  \     |\  __   /  /   
   /  \/    \    | |/ /  /   ‾‾\ 
  /          \   |   (  |  (‾)  |
 / __________ \  |_|\_\  \_____/ 

     execution: local
        script: test/k6/presence.ts
        output: -

     scenarios: (100.00%) 1 scenario, 500 max VUs, 3m0s max duration (incl. graceful stop):
              * default: Up to 500 looping VUs for 2m30s over 3 stages (gracefulRampDown: 30s, gracefulStop: 30s)


running (0m00.9s), 008/500 VUs, 0 complete and 0 interrupted iterations
default   [   1% ] 008/500 VUs  0m00.9s/2m30.0s

running (0m01.9s), 016/500 VUs, 0 complete and 0 interrupted iterations
default   [   1% ] 016/500 VUs  0m01.9s/2m30.0s

running (0m02.9s), 025/500 VUs, 0 complete and 0 interrupted iterations
default   [   2% ] 025/500 VUs  0m02.9s/2m30.0s

running (0m03.9s), 033/500 VUs, 0 complete and 0 interrupted iterations
default   [   3% ] 033/500 VUs  0m03.9s/2m30.0s

running (0m04.9s), 041/500 VUs, 0 complete and 0 interrupted iterations
default   [   3% ] 041/500 VUs  0m04.9s/2m30.0s

running (0m05.9s), 049/500 VUs, 0 complete and 0 interrupted iterations
default   [   4% ] 049/500 VUs  0m05.9s/2m30.0s

running (0m06.9s), 058/500 VUs, 8 complete and 0 interrupted iterations
default   [   5% ] 058/500 VUs  0m06.9s/2m30.0s

running (0m07.9s), 066/500 VUs, 16 complete and 0 interrupted iterations
default   [   5% ] 066/500 VUs  0m07.9s/2m30.0s

running (0m08.9s), 074/500 VUs, 24 complete and 0 interrupted iterations
default   [   6% ] 074/500 VUs  0m08.9s/2m30.0s

running (0m09.9s), 083/500 VUs, 33 complete and 0 interrupted iterations
default   [   7% ] 083/500 VUs  0m09.9s/2m30.0s

running (0m10.9s), 091/500 VUs, 41 complete and 0 interrupted iterations
default   [   7% ] 091/500 VUs  0m10.9s/2m30.0s

running (0m11.9s), 099/500 VUs, 49 complete and 0 interrupted iterations
default   [   8% ] 099/500 VUs  0m11.9s/2m30.0s

running (0m12.9s), 108/500 VUs, 66 complete and 0 interrupted iterations
default   [   9% ] 108/500 VUs  0m12.9s/2m30.0s

running (0m13.9s), 116/500 VUs, 82 complete and 0 interrupted iterations
default   [   9% ] 116/500 VUs  0m13.9s/2m30.0s

running (0m14.9s), 124/500 VUs, 98 complete and 0 interrupted iterations
default   [  10% ] 124/500 VUs  0m14.9s/2m30.0s

running (0m15.9s), 133/500 VUs, 115 complete and 0 interrupted iterations
default   [  11% ] 133/500 VUs  0m15.9s/2m30.0s

running (0m16.9s), 141/500 VUs, 132 complete and 0 interrupted iterations
default   [  11% ] 141/500 VUs  0m16.9s/2m30.0s

running (0m17.9s), 149/500 VUs, 148 complete and 0 interrupted iterations
default   [  12% ] 149/500 VUs  0m17.9s/2m30.0s

running (0m18.9s), 158/500 VUs, 171 complete and 0 interrupted iterations
default   [  13% ] 158/500 VUs  0m18.9s/2m30.0s

running (0m19.9s), 166/500 VUs, 198 complete and 0 interrupted iterations
default   [  13% ] 166/500 VUs  0m19.9s/2m30.0s

running (0m20.9s), 174/500 VUs, 222 complete and 0 interrupted iterations
default   [  14% ] 174/500 VUs  0m20.9s/2m30.0s

running (0m21.9s), 183/500 VUs, 246 complete and 0 interrupted iterations
default   [  15% ] 183/500 VUs  0m21.9s/2m30.0s

running (0m22.9s), 191/500 VUs, 273 complete and 0 interrupted iterations
default   [  15% ] 191/500 VUs  0m22.9s/2m30.0s

running (0m23.9s), 199/500 VUs, 297 complete and 0 interrupted iterations
default   [  16% ] 199/500 VUs  0m23.9s/2m30.0s

running (0m24.9s), 207/500 VUs, 328 complete and 0 interrupted iterations
default   [  17% ] 207/500 VUs  0m24.9s/2m30.0s

running (0m25.9s), 216/500 VUs, 362 complete and 0 interrupted iterations
default   [  17% ] 216/500 VUs  0m25.9s/2m30.0s

running (0m26.9s), 224/500 VUs, 396 complete and 0 interrupted iterations
default   [  18% ] 224/500 VUs  0m26.9s/2m30.0s

running (0m27.9s), 232/500 VUs, 428 complete and 0 interrupted iterations
default   [  19% ] 232/500 VUs  0m27.9s/2m30.0s

running (0m28.9s), 241/500 VUs, 462 complete and 0 interrupted iterations
default   [  19% ] 241/500 VUs  0m28.9s/2m30.0s

running (0m29.9s), 249/500 VUs, 495 complete and 0 interrupted iterations
default   [  20% ] 249/500 VUs  0m29.9s/2m30.0s

running (0m30.9s), 257/500 VUs, 535 complete and 0 interrupted iterations
default   [  21% ] 257/500 VUs  0m30.9s/2m30.0s

running (0m31.9s), 266/500 VUs, 576 complete and 0 interrupted iterations
default   [  21% ] 266/500 VUs  0m31.9s/2m30.0s

running (0m32.9s), 274/500 VUs, 620 complete and 0 interrupted iterations
default   [  22% ] 274/500 VUs  0m32.9s/2m30.0s

running (0m33.9s), 282/500 VUs, 660 complete and 0 interrupted iterations
default   [  23% ] 282/500 VUs  0m33.9s/2m30.0s

running (0m34.9s), 291/500 VUs, 701 complete and 0 interrupted iterations
default   [  23% ] 291/500 VUs  0m34.9s/2m30.0s

running (0m35.9s), 299/500 VUs, 743 complete and 0 interrupted iterations
default   [  24% ] 299/500 VUs  0m35.9s/2m30.0s

running (0m36.9s), 307/500 VUs, 790 complete and 0 interrupted iterations
default   [  25% ] 307/500 VUs  0m36.9s/2m30.0s

running (0m37.9s), 316/500 VUs, 840 complete and 0 interrupted iterations
default   [  25% ] 316/500 VUs  0m37.9s/2m30.0s

running (0m38.9s), 324/500 VUs, 888 complete and 0 interrupted iterations
default   [  26% ] 324/500 VUs  0m38.9s/2m30.0s

running (0m39.9s), 332/500 VUs, 940 complete and 0 interrupted iterations
default   [  27% ] 332/500 VUs  0m39.9s/2m30.0s

running (0m40.9s), 341/500 VUs, 990 complete and 0 interrupted iterations
default   [  27% ] 341/500 VUs  0m40.9s/2m30.0s

running (0m41.9s), 349/500 VUs, 1039 complete and 0 interrupted iterations
default   [  28% ] 349/500 VUs  0m41.9s/2m30.0s

running (0m42.9s), 357/500 VUs, 1095 complete and 0 interrupted iterations
default   [  29% ] 357/500 VUs  0m42.9s/2m30.0s

running (0m43.9s), 366/500 VUs, 1153 complete and 0 interrupted iterations
default   [  29% ] 366/500 VUs  0m43.9s/2m30.0s

running (0m44.9s), 374/500 VUs, 1212 complete and 0 interrupted iterations
default   [  30% ] 374/500 VUs  0m44.9s/2m30.0s

running (0m45.9s), 382/500 VUs, 1269 complete and 0 interrupted iterations
default   [  31% ] 382/500 VUs  0m45.9s/2m30.0s

running (0m46.9s), 390/500 VUs, 1328 complete and 0 interrupted iterations
default   [  31% ] 390/500 VUs  0m46.9s/2m30.0s

running (0m47.9s), 399/500 VUs, 1386 complete and 0 interrupted iterations
default   [  32% ] 399/500 VUs  0m47.9s/2m30.0s

running (0m48.9s), 407/500 VUs, 1449 complete and 0 interrupted iterations
default   [  33% ] 407/500 VUs  0m48.9s/2m30.0s

running (0m49.9s), 415/500 VUs, 1513 complete and 0 interrupted iterations
default   [  33% ] 415/500 VUs  0m49.9s/2m30.0s

running (0m50.9s), 424/500 VUs, 1573 complete and 0 interrupted iterations
default   [  34% ] 424/500 VUs  0m50.9s/2m30.0s

running (0m51.9s), 432/500 VUs, 1634 complete and 0 interrupted iterations
default   [  35% ] 432/500 VUs  0m51.9s/2m30.0s

running (0m52.9s), 440/500 VUs, 1701 complete and 0 interrupted iterations
default   [  35% ] 440/500 VUs  0m52.9s/2m30.0s

running (0m53.9s), 449/500 VUs, 1760 complete and 0 interrupted iterations
default   [  36% ] 449/500 VUs  0m53.9s/2m30.0s

running (0m54.9s), 457/500 VUs, 1816 complete and 0 interrupted iterations
default   [  37% ] 457/500 VUs  0m54.9s/2m30.0s

running (0m55.9s), 465/500 VUs, 1887 complete and 0 interrupted iterations
default   [  37% ] 465/500 VUs  0m55.9s/2m30.0s

running (0m57.0s), 475/500 VUs, 1971 complete and 0 interrupted iterations
default   [  38% ] 475/500 VUs  0m57.1s/2m30.0s

running (0m57.9s), 482/500 VUs, 2027 complete and 0 interrupted iterations
default   [  39% ] 482/500 VUs  0m57.9s/2m30.0s

running (0m58.9s), 490/500 VUs, 2090 complete and 0 interrupted iterations
default   [  39% ] 490/500 VUs  0m58.9s/2m30.0s

running (0m59.9s), 499/500 VUs, 2168 complete and 0 interrupted iterations
default   [  40% ] 499/500 VUs  0m59.9s/2m30.0s

running (1m00.9s), 500/500 VUs, 2225 complete and 0 interrupted iterations
default   [  41% ] 500/500 VUs  1m00.9s/2m30.0s

running (1m01.9s), 500/500 VUs, 2285 complete and 0 interrupted iterations
default   [  41% ] 500/500 VUs  1m01.9s/2m30.0s

running (1m02.9s), 500/500 VUs, 2381 complete and 0 interrupted iterations
default   [  42% ] 500/500 VUs  1m02.9s/2m30.0s

running (1m03.9s), 500/500 VUs, 2446 complete and 0 interrupted iterations
default   [  43% ] 500/500 VUs  1m03.9s/2m30.0s

running (1m04.9s), 500/500 VUs, 2515 complete and 0 interrupted iterations
default   [  43% ] 500/500 VUs  1m04.9s/2m30.0s

running (1m05.9s), 500/500 VUs, 2605 complete and 0 interrupted iterations
default   [  44% ] 500/500 VUs  1m05.9s/2m30.0s

running (1m06.9s), 500/500 VUs, 2672 complete and 0 interrupted iterations
default   [  45% ] 500/500 VUs  1m06.9s/2m30.0s

running (1m07.9s), 500/500 VUs, 2722 complete and 0 interrupted iterations
default   [  45% ] 500/500 VUs  1m07.9s/2m30.0s

running (1m08.9s), 500/500 VUs, 2793 complete and 0 interrupted iterations
default   [  46% ] 500/500 VUs  1m08.9s/2m30.0s

running (1m09.9s), 500/500 VUs, 2866 complete and 0 interrupted iterations
default   [  47% ] 500/500 VUs  1m09.9s/2m30.0s

running (1m10.9s), 500/500 VUs, 2924 complete and 0 interrupted iterations
default   [  47% ] 500/500 VUs  1m10.9s/2m30.0s

running (1m11.9s), 500/500 VUs, 3014 complete and 0 interrupted iterations
default   [  48% ] 500/500 VUs  1m11.9s/2m30.0s

running (1m12.9s), 500/500 VUs, 3077 complete and 0 interrupted iterations
default   [  49% ] 500/500 VUs  1m12.9s/2m30.0s

running (1m13.9s), 500/500 VUs, 3162 complete and 0 interrupted iterations
default   [  49% ] 500/500 VUs  1m13.9s/2m30.0s

running (1m15.0s), 500/500 VUs, 3246 complete and 0 interrupted iterations
default   [  50% ] 500/500 VUs  1m15.0s/2m30.0s

running (1m15.9s), 500/500 VUs, 3306 complete and 0 interrupted iterations
default   [  51% ] 500/500 VUs  1m15.9s/2m30.0s

running (1m16.9s), 500/500 VUs, 3394 complete and 0 interrupted iterations
default   [  51% ] 500/500 VUs  1m16.9s/2m30.0s

running (1m17.9s), 500/500 VUs, 3508 complete and 0 interrupted iterations
default   [  52% ] 500/500 VUs  1m17.9s/2m30.0s

running (1m18.9s), 500/500 VUs, 3546 complete and 0 interrupted iterations
default   [  53% ] 500/500 VUs  1m18.9s/2m30.0s

running (1m19.9s), 500/500 VUs, 3607 complete and 0 interrupted iterations
default   [  53% ] 500/500 VUs  1m19.9s/2m30.0s

running (1m20.9s), 500/500 VUs, 3684 complete and 0 interrupted iterations
default   [  54% ] 500/500 VUs  1m20.9s/2m30.0s

running (1m21.9s), 500/500 VUs, 3751 complete and 0 interrupted iterations
default   [  55% ] 500/500 VUs  1m21.9s/2m30.0s

running (1m22.9s), 500/500 VUs, 3823 complete and 0 interrupted iterations
default   [  55% ] 500/500 VUs  1m22.9s/2m30.0s

running (1m23.9s), 500/500 VUs, 3904 complete and 0 interrupted iterations
default   [  56% ] 500/500 VUs  1m23.9s/2m30.0s

running (1m24.9s), 500/500 VUs, 3977 complete and 0 interrupted iterations
default   [  57% ] 500/500 VUs  1m24.9s/2m30.0s

running (1m26.0s), 500/500 VUs, 4051 complete and 0 interrupted iterations
default   [  57% ] 500/500 VUs  1m26.0s/2m30.0s

running (1m26.9s), 500/500 VUs, 4107 complete and 0 interrupted iterations
default   [  58% ] 500/500 VUs  1m26.9s/2m30.0s

running (1m27.9s), 500/500 VUs, 4167 complete and 0 interrupted iterations
default   [  59% ] 500/500 VUs  1m27.9s/2m30.0s

running (1m28.9s), 500/500 VUs, 4261 complete and 0 interrupted iterations
default   [  59% ] 500/500 VUs  1m28.9s/2m30.0s

running (1m29.9s), 500/500 VUs, 4330 complete and 0 interrupted iterations
default   [  60% ] 500/500 VUs  1m29.9s/2m30.0s

running (1m31.2s), 500/500 VUs, 4419 complete and 0 interrupted iterations
default   [  61% ] 500/500 VUs  1m31.2s/2m30.0s

running (1m31.9s), 500/500 VUs, 4476 complete and 0 interrupted iterations
default   [  61% ] 500/500 VUs  1m31.9s/2m30.0s

running (1m32.9s), 500/500 VUs, 4536 complete and 0 interrupted iterations
default   [  62% ] 500/500 VUs  1m32.9s/2m30.0s

running (1m33.9s), 500/500 VUs, 4620 complete and 0 interrupted iterations
default   [  63% ] 500/500 VUs  1m33.9s/2m30.0s

running (1m34.9s), 500/500 VUs, 4692 complete and 0 interrupted iterations
default   [  63% ] 500/500 VUs  1m34.9s/2m30.0s

running (1m35.9s), 500/500 VUs, 4759 complete and 0 interrupted iterations
default   [  64% ] 500/500 VUs  1m35.9s/2m30.0s

running (1m36.9s), 500/500 VUs, 4834 complete and 0 interrupted iterations
default   [  65% ] 500/500 VUs  1m36.9s/2m30.0s

running (1m37.9s), 500/500 VUs, 4884 complete and 0 interrupted iterations
default   [  65% ] 500/500 VUs  1m37.9s/2m30.0s

running (1m39.0s), 500/500 VUs, 4994 complete and 0 interrupted iterations
default   [  66% ] 500/500 VUs  1m39.0s/2m30.0s

running (1m39.9s), 500/500 VUs, 5057 complete and 0 interrupted iterations
default   [  67% ] 500/500 VUs  1m39.9s/2m30.0s

running (1m40.9s), 500/500 VUs, 5104 complete and 0 interrupted iterations
default   [  67% ] 500/500 VUs  1m40.9s/2m30.0s

running (1m41.9s), 500/500 VUs, 5181 complete and 0 interrupted iterations
default   [  68% ] 500/500 VUs  1m41.9s/2m30.0s

running (1m43.2s), 500/500 VUs, 5305 complete and 0 interrupted iterations
default   [  69% ] 500/500 VUs  1m43.2s/2m30.0s

running (1m43.9s), 500/500 VUs, 5329 complete and 0 interrupted iterations
default   [  69% ] 500/500 VUs  1m43.9s/2m30.0s

running (1m44.9s), 500/500 VUs, 5407 complete and 0 interrupted iterations
default   [  70% ] 500/500 VUs  1m44.9s/2m30.0s

running (1m46.3s), 500/500 VUs, 5547 complete and 0 interrupted iterations
default   [  71% ] 500/500 VUs  1m46.3s/2m30.0s

running (1m46.9s), 500/500 VUs, 5569 complete and 0 interrupted iterations
default   [  71% ] 500/500 VUs  1m46.9s/2m30.0s

running (1m47.9s), 500/500 VUs, 5642 complete and 0 interrupted iterations
default   [  72% ] 500/500 VUs  1m47.9s/2m30.0s

running (1m48.9s), 500/500 VUs, 5736 complete and 0 interrupted iterations
default   [  73% ] 500/500 VUs  1m48.9s/2m30.0s

running (1m49.9s), 500/500 VUs, 5793 complete and 0 interrupted iterations
default   [  73% ] 500/500 VUs  1m49.9s/2m30.0s

running (1m50.9s), 500/500 VUs, 5862 complete and 0 interrupted iterations
default   [  74% ] 500/500 VUs  1m50.9s/2m30.0s

running (1m51.9s), 500/500 VUs, 5929 complete and 0 interrupted iterations
default   [  75% ] 500/500 VUs  1m51.9s/2m30.0s

running (1m52.9s), 500/500 VUs, 5998 complete and 0 interrupted iterations
default   [  75% ] 500/500 VUs  1m52.9s/2m30.0s

running (1m53.9s), 500/500 VUs, 6087 complete and 0 interrupted iterations
default   [  76% ] 500/500 VUs  1m53.9s/2m30.0s

running (1m54.9s), 500/500 VUs, 6176 complete and 0 interrupted iterations
default   [  77% ] 500/500 VUs  1m54.9s/2m30.0s

running (1m55.9s), 500/500 VUs, 6256 complete and 0 interrupted iterations
default   [  77% ] 500/500 VUs  1m55.9s/2m30.0s

running (1m56.9s), 500/500 VUs, 6326 complete and 0 interrupted iterations
default   [  78% ] 500/500 VUs  1m56.9s/2m30.0s

running (1m57.9s), 500/500 VUs, 6382 complete and 0 interrupted iterations
default   [  79% ] 500/500 VUs  1m57.9s/2m30.0s

running (1m58.9s), 500/500 VUs, 6442 complete and 0 interrupted iterations
default   [  79% ] 500/500 VUs  1m58.9s/2m30.0s

running (1m59.9s), 500/500 VUs, 6511 complete and 0 interrupted iterations
default   [  80% ] 500/500 VUs  1m59.9s/2m30.0s

running (2m00.9s), 499/500 VUs, 6591 complete and 0 interrupted iterations
default   [  81% ] 499/500 VUs  2m00.9s/2m30.0s

running (2m01.9s), 495/500 VUs, 6666 complete and 0 interrupted iterations
default   [  81% ] 495/500 VUs  2m01.9s/2m30.0s

running (2m02.9s), 491/500 VUs, 6744 complete and 0 interrupted iterations
default   [  82% ] 491/500 VUs  2m02.9s/2m30.0s

running (2m03.9s), 489/500 VUs, 6801 complete and 0 interrupted iterations
default   [  83% ] 489/500 VUs  2m03.9s/2m30.0s

running (2m04.9s), 474/500 VUs, 6882 complete and 0 interrupted iterations
default   [  83% ] 474/500 VUs  2m04.9s/2m30.0s

running (2m05.9s), 459/500 VUs, 6968 complete and 0 interrupted iterations
default   [  84% ] 459/500 VUs  2m05.9s/2m30.0s

running (2m06.9s), 451/500 VUs, 7016 complete and 0 interrupted iterations
default   [  85% ] 451/500 VUs  2m06.9s/2m30.0s

running (2m07.9s), 429/500 VUs, 7102 complete and 0 interrupted iterations
default   [  85% ] 429/500 VUs  2m07.9s/2m30.0s

running (2m08.9s), 408/500 VUs, 7183 complete and 0 interrupted iterations
default   [  86% ] 408/500 VUs  2m08.9s/2m30.0s

running (2m09.9s), 388/500 VUs, 7252 complete and 0 interrupted iterations
default   [  87% ] 388/500 VUs  2m09.9s/2m30.0s

running (2m10.9s), 377/500 VUs, 7306 complete and 0 interrupted iterations
default   [  87% ] 377/500 VUs  2m10.9s/2m30.0s

running (2m11.9s), 360/500 VUs, 7385 complete and 0 interrupted iterations
default   [  88% ] 360/500 VUs  2m11.9s/2m30.0s

running (2m12.9s), 335/500 VUs, 7457 complete and 0 interrupted iterations
default   [  89% ] 335/500 VUs  2m12.9s/2m30.0s

running (2m13.9s), 318/500 VUs, 7528 complete and 0 interrupted iterations
default   [  89% ] 318/500 VUs  2m13.9s/2m30.0s

running (2m14.9s), 308/500 VUs, 7578 complete and 0 interrupted iterations
default   [  90% ] 308/500 VUs  2m14.9s/2m30.0s

running (2m15.9s), 289/500 VUs, 7628 complete and 0 interrupted iterations
default   [  91% ] 289/500 VUs  2m15.9s/2m30.0s

running (2m16.9s), 271/500 VUs, 7682 complete and 0 interrupted iterations
default   [  91% ] 271/500 VUs  2m16.9s/2m30.0s

running (2m17.9s), 255/500 VUs, 7745 complete and 0 interrupted iterations
default   [  92% ] 255/500 VUs  2m17.9s/2m30.0s

running (2m18.9s), 239/500 VUs, 7790 complete and 0 interrupted iterations
default   [  93% ] 239/500 VUs  2m18.9s/2m30.0s

running (2m19.9s), 221/500 VUs, 7841 complete and 0 interrupted iterations
default   [  93% ] 221/500 VUs  2m19.9s/2m30.0s

running (2m20.9s), 198/500 VUs, 7886 complete and 0 interrupted iterations
default   [  94% ] 198/500 VUs  2m20.9s/2m30.0s

running (2m21.9s), 184/500 VUs, 7913 complete and 0 interrupted iterations
default   [  95% ] 184/500 VUs  2m21.9s/2m30.0s

running (2m22.9s), 170/500 VUs, 7952 complete and 0 interrupted iterations
default   [  95% ] 170/500 VUs  2m22.9s/2m30.0s

running (2m23.9s), 147/500 VUs, 8000 complete and 0 interrupted iterations
default   [  96% ] 147/500 VUs  2m23.9s/2m30.0s

running (2m24.9s), 136/500 VUs, 8028 complete and 0 interrupted iterations
default   [  97% ] 136/500 VUs  2m24.9s/2m30.0s

running (2m25.9s), 113/500 VUs, 8061 complete and 0 interrupted iterations
default   [  97% ] 113/500 VUs  2m25.9s/2m30.0s

running (2m26.9s), 097/500 VUs, 8084 complete and 0 interrupted iterations
default   [  98% ] 097/500 VUs  2m26.9s/2m30.0s

running (2m27.9s), 091/500 VUs, 8097 complete and 0 interrupted iterations
default   [  99% ] 091/500 VUs  2m27.9s/2m30.0s

running (2m28.9s), 072/500 VUs, 8122 complete and 0 interrupted iterations
default   [  99% ] 072/500 VUs  2m28.9s/2m30.0s

running (2m29.9s), 051/500 VUs, 8147 complete and 0 interrupted iterations
default   [ 100% ] 051/500 VUs  2m29.9s/2m30.0s

running (2m30.9s), 034/500 VUs, 8164 complete and 0 interrupted iterations
default ↓ [ 100% ] 051/500 VUs  2m30s

running (2m31.9s), 024/500 VUs, 8174 complete and 0 interrupted iterations
default ↓ [ 100% ] 051/500 VUs  2m30s

running (2m32.9s), 017/500 VUs, 8181 complete and 0 interrupted iterations
default ↓ [ 100% ] 051/500 VUs  2m30s

running (2m33.9s), 010/500 VUs, 8188 complete and 0 interrupted iterations
default ↓ [ 100% ] 051/500 VUs  2m30s

running (2m34.9s), 004/500 VUs, 8194 complete and 0 interrupted iterations
default ↓ [ 100% ] 051/500 VUs  2m30s


  █ THRESHOLDS 

    active_clients_time
    ✓ 'p(95)<500' p(95)=139ms

    attach_documents_time
    ✓ 'p(95)<10000' p(95)=583ms

    deactivate_clients_time
    ✓ 'p(95)<10000' p(95)=126ms

    http_req_duration
    ✓ 'p(95)<10000' p(95)=263.84ms

    pushpulls_time
    ✓ 'p(95)<1000' p(95)=262ms

    transaction_success_rate
    ✓ 'rate>0.99' rate=100.00%

    transaction_time
    ✓ 'p(95)<30000' p(95)=7.41s


  █ TOTAL RESULTS 

    checks_total.......: 131168  842.402999/s
    checks_succeeded...: 100.00% 131168 out of 131168
    checks_failed......: 0.00%   0 out of 131168

    ✓ status is 200
    ✓ response has valid body

    CUSTOM
    active_clients....................: 8198    52.650187/s
    active_clients_success_rate.......: 100.00% 8198 out of 8198
    active_clients_time...............: avg=30.39ms  min=1ms      med=7ms     max=546ms    p(90)=95ms     p(95)=139ms   
    attach_documents..................: 8198    52.650187/s
    attach_documents_success_rate.....: 100.00% 8198 out of 8198
    attach_documents_time.............: avg=144.98ms min=3ms      med=28ms    max=937ms    p(90)=473.3ms  p(95)=583ms   
    deactivate_clients................: 8198    52.650187/s
    deactivate_clients_success_rate...: 100.00% 8198 out of 8198
    deactivate_clients_time...........: avg=27.44ms  min=0s       med=5ms     max=638ms    p(90)=83ms     p(95)=126ms   
    pushpulls.........................: 40990   263.250937/s
    pushpulls_success_rate............: 100.00% 40990 out of 40990
    pushpulls_time....................: avg=66.36ms  min=1ms      med=23ms    max=878ms    p(90)=195ms    p(95)=262ms   
    transaction_success_rate..........: 100.00% 8198 out of 8198
    transaction_time..................: avg=6.59s    min=6.01s    med=6.57s   max=8.9s     p(90)=7.23s    p(95)=7.41s   

    HTTP
    http_req_duration.................: avg=59.91ms  min=507.67µs med=13.02ms max=903.01ms p(90)=177.97ms p(95)=263.84ms
      { expected_response:true }......: avg=59.91ms  min=507.67µs med=13.02ms max=903.01ms p(90)=177.97ms p(95)=263.84ms
    http_req_failed...................: 0.00%   0 out of 65584
    http_reqs.........................: 65584   421.201499/s

    EXECUTION
    iteration_duration................: avg=6.59s    min=6.01s    med=6.57s   max=8.9s     p(90)=7.23s    p(95)=7.41s   
    iterations........................: 8198    52.650187/s
    vus...............................: 4       min=4              max=500
    vus_max...........................: 500     min=500            max=500

    NETWORK
    data_received.....................: 1.2 GB  7.6 MB/s
    data_sent.........................: 62 MB   396 kB/s




running (2m35.7s), 000/500 VUs, 8198 complete and 0 interrupted iterations
default ✓ [ 100% ] 000/500 VUs  2m30s
