
         /\      Grafana   /‾‾/  
    /\  /  \     |\  __   /  /   
   /  \/    \    | |/ /  /   ‾‾\ 
  /          \   |   (  |  (‾)  |
 / __________ \  |_|\_\  \_____/ 

     execution: local
        script: test/k6/presence.ts
        output: -

     scenarios: (100.00%) 1 scenario, 500 max VUs, 3m0s max duration (incl. graceful stop):
              * default: Up to 500 looping VUs for 2m30s over 3 stages (gracefulRampDown: 30s, gracefulStop: 30s)


running (0m00.9s), 008/500 VUs, 0 complete and 0 interrupted iterations
default   [   1% ] 008/500 VUs  0m00.9s/2m30.0s

running (0m01.9s), 016/500 VUs, 0 complete and 0 interrupted iterations
default   [   1% ] 016/500 VUs  0m01.9s/2m30.0s

running (0m02.9s), 024/500 VUs, 0 complete and 0 interrupted iterations
default   [   2% ] 024/500 VUs  0m02.9s/2m30.0s

running (0m03.9s), 033/500 VUs, 0 complete and 0 interrupted iterations
default   [   3% ] 033/500 VUs  0m03.9s/2m30.0s

running (0m04.9s), 041/500 VUs, 0 complete and 0 interrupted iterations
default   [   3% ] 041/500 VUs  0m04.9s/2m30.0s

running (0m05.9s), 049/500 VUs, 0 complete and 0 interrupted iterations
default   [   4% ] 049/500 VUs  0m05.9s/2m30.0s

running (0m06.9s), 058/500 VUs, 8 complete and 0 interrupted iterations
default   [   5% ] 058/500 VUs  0m06.9s/2m30.0s

running (0m07.9s), 066/500 VUs, 16 complete and 0 interrupted iterations
default   [   5% ] 066/500 VUs  0m07.9s/2m30.0s

running (0m08.9s), 074/500 VUs, 24 complete and 0 interrupted iterations
default   [   6% ] 074/500 VUs  0m08.9s/2m30.0s

running (0m09.9s), 083/500 VUs, 33 complete and 0 interrupted iterations
default   [   7% ] 083/500 VUs  0m09.9s/2m30.0s

running (0m10.9s), 091/500 VUs, 41 complete and 0 interrupted iterations
default   [   7% ] 091/500 VUs  0m10.9s/2m30.0s

running (0m11.9s), 099/500 VUs, 49 complete and 0 interrupted iterations
default   [   8% ] 099/500 VUs  0m11.9s/2m30.0s

running (0m12.9s), 108/500 VUs, 66 complete and 0 interrupted iterations
default   [   9% ] 108/500 VUs  0m12.9s/2m30.0s

running (0m13.9s), 116/500 VUs, 82 complete and 0 interrupted iterations
default   [   9% ] 116/500 VUs  0m13.9s/2m30.0s

running (0m14.9s), 124/500 VUs, 98 complete and 0 interrupted iterations
default   [  10% ] 124/500 VUs  0m14.9s/2m30.0s

running (0m15.9s), 133/500 VUs, 114 complete and 0 interrupted iterations
default   [  11% ] 133/500 VUs  0m15.9s/2m30.0s

running (0m16.9s), 141/500 VUs, 132 complete and 0 interrupted iterations
default   [  11% ] 141/500 VUs  0m16.9s/2m30.0s

running (0m17.9s), 149/500 VUs, 148 complete and 0 interrupted iterations
default   [  12% ] 149/500 VUs  0m17.9s/2m30.0s

running (0m18.9s), 158/500 VUs, 171 complete and 0 interrupted iterations
default   [  13% ] 158/500 VUs  0m18.9s/2m30.0s

running (0m19.9s), 166/500 VUs, 198 complete and 0 interrupted iterations
default   [  13% ] 166/500 VUs  0m19.9s/2m30.0s

running (0m20.9s), 174/500 VUs, 222 complete and 0 interrupted iterations
default   [  14% ] 174/500 VUs  0m20.9s/2m30.0s

running (0m21.9s), 182/500 VUs, 246 complete and 0 interrupted iterations
default   [  15% ] 182/500 VUs  0m21.9s/2m30.0s

running (0m22.9s), 191/500 VUs, 273 complete and 0 interrupted iterations
default   [  15% ] 191/500 VUs  0m22.9s/2m30.0s

running (0m23.9s), 199/500 VUs, 297 complete and 0 interrupted iterations
default   [  16% ] 199/500 VUs  0m23.9s/2m30.0s

running (0m24.9s), 207/500 VUs, 328 complete and 0 interrupted iterations
default   [  17% ] 207/500 VUs  0m24.9s/2m30.0s

running (0m25.9s), 216/500 VUs, 362 complete and 0 interrupted iterations
default   [  17% ] 216/500 VUs  0m25.9s/2m30.0s

running (0m26.9s), 224/500 VUs, 396 complete and 0 interrupted iterations
default   [  18% ] 224/500 VUs  0m26.9s/2m30.0s

running (0m27.9s), 232/500 VUs, 428 complete and 0 interrupted iterations
default   [  19% ] 232/500 VUs  0m27.9s/2m30.0s

running (0m28.9s), 241/500 VUs, 461 complete and 0 interrupted iterations
default   [  19% ] 241/500 VUs  0m28.9s/2m30.0s

running (0m29.9s), 249/500 VUs, 496 complete and 0 interrupted iterations
default   [  20% ] 249/500 VUs  0m29.9s/2m30.0s

running (0m30.9s), 257/500 VUs, 535 complete and 0 interrupted iterations
default   [  21% ] 257/500 VUs  0m30.9s/2m30.0s

running (0m31.9s), 266/500 VUs, 575 complete and 0 interrupted iterations
default   [  21% ] 266/500 VUs  0m31.9s/2m30.0s

running (0m32.9s), 274/500 VUs, 618 complete and 0 interrupted iterations
default   [  22% ] 274/500 VUs  0m32.9s/2m30.0s

running (0m33.9s), 282/500 VUs, 660 complete and 0 interrupted iterations
default   [  23% ] 282/500 VUs  0m33.9s/2m30.0s

running (0m34.9s), 291/500 VUs, 700 complete and 0 interrupted iterations
default   [  23% ] 291/500 VUs  0m34.9s/2m30.0s

running (0m35.9s), 299/500 VUs, 742 complete and 0 interrupted iterations
default   [  24% ] 299/500 VUs  0m35.9s/2m30.0s

running (0m36.9s), 307/500 VUs, 790 complete and 0 interrupted iterations
default   [  25% ] 307/500 VUs  0m36.9s/2m30.0s

running (0m37.9s), 316/500 VUs, 840 complete and 0 interrupted iterations
default   [  25% ] 316/500 VUs  0m37.9s/2m30.0s

running (0m38.9s), 324/500 VUs, 890 complete and 0 interrupted iterations
default   [  26% ] 324/500 VUs  0m38.9s/2m30.0s

running (0m39.9s), 332/500 VUs, 940 complete and 0 interrupted iterations
default   [  27% ] 332/500 VUs  0m39.9s/2m30.0s

running (0m40.9s), 340/500 VUs, 990 complete and 0 interrupted iterations
default   [  27% ] 340/500 VUs  0m40.9s/2m30.0s

running (0m41.9s), 349/500 VUs, 1040 complete and 0 interrupted iterations
default   [  28% ] 349/500 VUs  0m41.9s/2m30.0s

running (0m42.9s), 357/500 VUs, 1095 complete and 0 interrupted iterations
default   [  29% ] 357/500 VUs  0m42.9s/2m30.0s

running (0m43.9s), 365/500 VUs, 1153 complete and 0 interrupted iterations
default   [  29% ] 365/500 VUs  0m43.9s/2m30.0s

running (0m44.9s), 374/500 VUs, 1211 complete and 0 interrupted iterations
default   [  30% ] 374/500 VUs  0m44.9s/2m30.0s

running (0m45.9s), 382/500 VUs, 1268 complete and 0 interrupted iterations
default   [  31% ] 382/500 VUs  0m45.9s/2m30.0s

running (0m46.9s), 390/500 VUs, 1325 complete and 0 interrupted iterations
default   [  31% ] 390/500 VUs  0m46.9s/2m30.0s

running (0m47.9s), 399/500 VUs, 1384 complete and 0 interrupted iterations
default   [  32% ] 399/500 VUs  0m47.9s/2m30.0s

running (0m48.9s), 407/500 VUs, 1446 complete and 0 interrupted iterations
default   [  33% ] 407/500 VUs  0m48.9s/2m30.0s

running (0m49.9s), 415/500 VUs, 1511 complete and 0 interrupted iterations
default   [  33% ] 415/500 VUs  0m49.9s/2m30.0s

running (0m50.9s), 424/500 VUs, 1577 complete and 0 interrupted iterations
default   [  34% ] 424/500 VUs  0m50.9s/2m30.0s

running (0m52.0s), 433/500 VUs, 1643 complete and 0 interrupted iterations
default   [  35% ] 433/500 VUs  0m52.0s/2m30.0s

running (0m52.9s), 440/500 VUs, 1696 complete and 0 interrupted iterations
default   [  35% ] 440/500 VUs  0m52.9s/2m30.0s

running (0m53.9s), 449/500 VUs, 1758 complete and 0 interrupted iterations
default   [  36% ] 449/500 VUs  0m53.9s/2m30.0s

running (0m54.9s), 457/500 VUs, 1827 complete and 0 interrupted iterations
default   [  37% ] 457/500 VUs  0m54.9s/2m30.0s

running (0m55.9s), 465/500 VUs, 1905 complete and 0 interrupted iterations
default   [  37% ] 465/500 VUs  0m55.9s/2m30.0s

running (0m56.9s), 474/500 VUs, 1954 complete and 0 interrupted iterations
default   [  38% ] 474/500 VUs  0m56.9s/2m30.0s

running (0m57.9s), 482/500 VUs, 2045 complete and 0 interrupted iterations
default   [  39% ] 482/500 VUs  0m57.9s/2m30.0s

running (0m58.9s), 490/500 VUs, 2115 complete and 0 interrupted iterations
default   [  39% ] 490/500 VUs  0m58.9s/2m30.0s

running (0m59.9s), 499/500 VUs, 2178 complete and 0 interrupted iterations
default   [  40% ] 499/500 VUs  0m59.9s/2m30.0s

running (1m00.9s), 500/500 VUs, 2244 complete and 0 interrupted iterations
default   [  41% ] 500/500 VUs  1m00.9s/2m30.0s

running (1m01.9s), 500/500 VUs, 2330 complete and 0 interrupted iterations
default   [  41% ] 500/500 VUs  1m01.9s/2m30.0s

running (1m03.0s), 500/500 VUs, 2411 complete and 0 interrupted iterations
default   [  42% ] 500/500 VUs  1m03.0s/2m30.0s

running (1m03.9s), 500/500 VUs, 2471 complete and 0 interrupted iterations
default   [  43% ] 500/500 VUs  1m03.9s/2m30.0s

running (1m04.9s), 500/500 VUs, 2533 complete and 0 interrupted iterations
default   [  43% ] 500/500 VUs  1m04.9s/2m30.0s

running (1m05.9s), 500/500 VUs, 2618 complete and 0 interrupted iterations
default   [  44% ] 500/500 VUs  1m05.9s/2m30.0s

running (1m06.9s), 500/500 VUs, 2695 complete and 0 interrupted iterations
default   [  45% ] 500/500 VUs  1m06.9s/2m30.0s

running (1m07.9s), 500/500 VUs, 2767 complete and 0 interrupted iterations
default   [  45% ] 500/500 VUs  1m07.9s/2m30.0s

running (1m08.9s), 500/500 VUs, 2842 complete and 0 interrupted iterations
default   [  46% ] 500/500 VUs  1m08.9s/2m30.0s

running (1m09.9s), 500/500 VUs, 2913 complete and 0 interrupted iterations
default   [  47% ] 500/500 VUs  1m09.9s/2m30.0s

running (1m10.9s), 500/500 VUs, 2985 complete and 0 interrupted iterations
default   [  47% ] 500/500 VUs  1m10.9s/2m30.0s

running (1m11.9s), 500/500 VUs, 3091 complete and 0 interrupted iterations
default   [  48% ] 500/500 VUs  1m11.9s/2m30.0s

running (1m12.9s), 500/500 VUs, 3171 complete and 0 interrupted iterations
default   [  49% ] 500/500 VUs  1m12.9s/2m30.0s

running (1m13.9s), 500/500 VUs, 3251 complete and 0 interrupted iterations
default   [  49% ] 500/500 VUs  1m13.9s/2m30.0s

running (1m14.9s), 500/500 VUs, 3323 complete and 0 interrupted iterations
default   [  50% ] 500/500 VUs  1m14.9s/2m30.0s

running (1m15.9s), 500/500 VUs, 3397 complete and 0 interrupted iterations
default   [  51% ] 500/500 VUs  1m15.9s/2m30.0s

running (1m16.9s), 500/500 VUs, 3480 complete and 0 interrupted iterations
default   [  51% ] 500/500 VUs  1m16.9s/2m30.0s

running (1m17.9s), 500/500 VUs, 3567 complete and 0 interrupted iterations
default   [  52% ] 500/500 VUs  1m17.9s/2m30.0s

running (1m18.9s), 500/500 VUs, 3642 complete and 0 interrupted iterations
default   [  53% ] 500/500 VUs  1m18.9s/2m30.0s

running (1m20.1s), 500/500 VUs, 3730 complete and 0 interrupted iterations
default   [  53% ] 500/500 VUs  1m20.1s/2m30.0s

running (1m20.9s), 500/500 VUs, 3773 complete and 0 interrupted iterations
default   [  54% ] 500/500 VUs  1m20.9s/2m30.0s

running (1m21.9s), 500/500 VUs, 3852 complete and 0 interrupted iterations
default   [  55% ] 500/500 VUs  1m21.9s/2m30.0s

running (1m23.3s), 500/500 VUs, 3960 complete and 0 interrupted iterations
default   [  56% ] 500/500 VUs  1m23.3s/2m30.0s

running (1m23.9s), 500/500 VUs, 4002 complete and 0 interrupted iterations
default   [  56% ] 500/500 VUs  1m23.9s/2m30.0s

running (1m24.9s), 500/500 VUs, 4090 complete and 0 interrupted iterations
default   [  57% ] 500/500 VUs  1m24.9s/2m30.0s

running (1m25.9s), 500/500 VUs, 4160 complete and 0 interrupted iterations
default   [  57% ] 500/500 VUs  1m25.9s/2m30.0s

running (1m26.9s), 500/500 VUs, 4217 complete and 0 interrupted iterations
default   [  58% ] 500/500 VUs  1m26.9s/2m30.0s

running (1m27.9s), 500/500 VUs, 4287 complete and 0 interrupted iterations
default   [  59% ] 500/500 VUs  1m27.9s/2m30.0s

running (1m28.9s), 500/500 VUs, 4364 complete and 0 interrupted iterations
default   [  59% ] 500/500 VUs  1m28.9s/2m30.0s

running (1m29.9s), 500/500 VUs, 4443 complete and 0 interrupted iterations
default   [  60% ] 500/500 VUs  1m29.9s/2m30.0s

running (1m30.9s), 500/500 VUs, 4525 complete and 0 interrupted iterations
default   [  61% ] 500/500 VUs  1m30.9s/2m30.0s

running (1m31.9s), 500/500 VUs, 4595 complete and 0 interrupted iterations
default   [  61% ] 500/500 VUs  1m31.9s/2m30.0s

running (1m32.9s), 500/500 VUs, 4656 complete and 0 interrupted iterations
default   [  62% ] 500/500 VUs  1m32.9s/2m30.0s

running (1m33.9s), 500/500 VUs, 4738 complete and 0 interrupted iterations
default   [  63% ] 500/500 VUs  1m33.9s/2m30.0s

running (1m34.9s), 500/500 VUs, 4804 complete and 0 interrupted iterations
default   [  63% ] 500/500 VUs  1m34.9s/2m30.0s

running (1m35.9s), 500/500 VUs, 4889 complete and 0 interrupted iterations
default   [  64% ] 500/500 VUs  1m35.9s/2m30.0s

running (1m36.9s), 500/500 VUs, 4975 complete and 0 interrupted iterations
default   [  65% ] 500/500 VUs  1m36.9s/2m30.0s

running (1m37.9s), 500/500 VUs, 5032 complete and 0 interrupted iterations
default   [  65% ] 500/500 VUs  1m37.9s/2m30.0s

running (1m38.9s), 500/500 VUs, 5102 complete and 0 interrupted iterations
default   [  66% ] 500/500 VUs  1m38.9s/2m30.0s

running (1m39.9s), 500/500 VUs, 5191 complete and 0 interrupted iterations
default   [  67% ] 500/500 VUs  1m39.9s/2m30.0s

running (1m40.9s), 500/500 VUs, 5261 complete and 0 interrupted iterations
default   [  67% ] 500/500 VUs  1m40.9s/2m30.0s

running (1m41.9s), 500/500 VUs, 5327 complete and 0 interrupted iterations
default   [  68% ] 500/500 VUs  1m41.9s/2m30.0s

running (1m43.0s), 500/500 VUs, 5443 complete and 0 interrupted iterations
default   [  69% ] 500/500 VUs  1m43.0s/2m30.0s

running (1m43.9s), 500/500 VUs, 5502 complete and 0 interrupted iterations
default   [  69% ] 500/500 VUs  1m43.9s/2m30.0s

running (1m44.9s), 500/500 VUs, 5556 complete and 0 interrupted iterations
default   [  70% ] 500/500 VUs  1m44.9s/2m30.0s

running (1m45.9s), 500/500 VUs, 5664 complete and 0 interrupted iterations
default   [  71% ] 500/500 VUs  1m45.9s/2m30.0s

running (1m47.0s), 500/500 VUs, 5745 complete and 0 interrupted iterations
default   [  71% ] 500/500 VUs  1m47.0s/2m30.0s

running (1m47.9s), 500/500 VUs, 5793 complete and 0 interrupted iterations
default   [  72% ] 500/500 VUs  1m47.9s/2m30.0s

running (1m48.9s), 500/500 VUs, 5886 complete and 0 interrupted iterations
default   [  73% ] 500/500 VUs  1m48.9s/2m30.0s

running (1m49.9s), 500/500 VUs, 5988 complete and 0 interrupted iterations
default   [  73% ] 500/500 VUs  1m49.9s/2m30.0s

running (1m50.9s), 500/500 VUs, 6048 complete and 0 interrupted iterations
default   [  74% ] 500/500 VUs  1m50.9s/2m30.0s

running (1m51.9s), 500/500 VUs, 6116 complete and 0 interrupted iterations
default   [  75% ] 500/500 VUs  1m51.9s/2m30.0s

running (1m52.9s), 500/500 VUs, 6200 complete and 0 interrupted iterations
default   [  75% ] 500/500 VUs  1m52.9s/2m30.0s

running (1m54.1s), 500/500 VUs, 6278 complete and 0 interrupted iterations
default   [  76% ] 500/500 VUs  1m54.1s/2m30.0s

running (1m54.9s), 500/500 VUs, 6331 complete and 0 interrupted iterations
default   [  77% ] 500/500 VUs  1m54.9s/2m30.0s

running (1m55.9s), 500/500 VUs, 6417 complete and 0 interrupted iterations
default   [  77% ] 500/500 VUs  1m55.9s/2m30.0s

running (1m56.9s), 500/500 VUs, 6496 complete and 0 interrupted iterations
default   [  78% ] 500/500 VUs  1m56.9s/2m30.0s

running (1m57.9s), 500/500 VUs, 6549 complete and 0 interrupted iterations
default   [  79% ] 500/500 VUs  1m57.9s/2m30.0s

running (1m58.9s), 500/500 VUs, 6633 complete and 0 interrupted iterations
default   [  79% ] 500/500 VUs  1m58.9s/2m30.0s

running (1m59.9s), 500/500 VUs, 6713 complete and 0 interrupted iterations
default   [  80% ] 500/500 VUs  1m59.9s/2m30.0s

running (2m00.9s), 500/500 VUs, 6776 complete and 0 interrupted iterations
default   [  81% ] 500/500 VUs  2m00.9s/2m30.0s

running (2m01.9s), 500/500 VUs, 6856 complete and 0 interrupted iterations
default   [  81% ] 500/500 VUs  2m01.9s/2m30.0s

running (2m02.9s), 499/500 VUs, 6932 complete and 0 interrupted iterations
default   [  82% ] 499/500 VUs  2m02.9s/2m30.0s

running (2m03.9s), 491/500 VUs, 7012 complete and 0 interrupted iterations
default   [  83% ] 491/500 VUs  2m03.9s/2m30.0s

running (2m04.9s), 474/500 VUs, 7089 complete and 0 interrupted iterations
default   [  83% ] 474/500 VUs  2m04.9s/2m30.0s

running (2m05.9s), 462/500 VUs, 7159 complete and 0 interrupted iterations
default   [  84% ] 462/500 VUs  2m05.9s/2m30.0s

running (2m06.9s), 446/500 VUs, 7225 complete and 0 interrupted iterations
default   [  85% ] 446/500 VUs  2m06.9s/2m30.0s

running (2m07.9s), 427/500 VUs, 7309 complete and 0 interrupted iterations
default   [  85% ] 427/500 VUs  2m07.9s/2m30.0s

running (2m09.2s), 398/500 VUs, 7413 complete and 0 interrupted iterations
default   [  86% ] 398/500 VUs  2m09.2s/2m30.0s

running (2m09.9s), 391/500 VUs, 7448 complete and 0 interrupted iterations
default   [  87% ] 391/500 VUs  2m09.9s/2m30.0s

running (2m10.9s), 373/500 VUs, 7534 complete and 0 interrupted iterations
default   [  87% ] 373/500 VUs  2m10.9s/2m30.0s

running (2m11.9s), 352/500 VUs, 7590 complete and 0 interrupted iterations
default   [  88% ] 352/500 VUs  2m11.9s/2m30.0s

running (2m12.9s), 338/500 VUs, 7644 complete and 0 interrupted iterations
default   [  89% ] 338/500 VUs  2m12.9s/2m30.0s

running (2m13.9s), 324/500 VUs, 7712 complete and 0 interrupted iterations
default   [  89% ] 324/500 VUs  2m13.9s/2m30.0s

running (2m14.9s), 304/500 VUs, 7783 complete and 0 interrupted iterations
default   [  90% ] 304/500 VUs  2m14.9s/2m30.0s

running (2m15.9s), 288/500 VUs, 7838 complete and 0 interrupted iterations
default   [  91% ] 288/500 VUs  2m15.9s/2m30.0s

running (2m16.9s), 267/500 VUs, 7906 complete and 0 interrupted iterations
default   [  91% ] 267/500 VUs  2m16.9s/2m30.0s

running (2m17.9s), 256/500 VUs, 7939 complete and 0 interrupted iterations
default   [  92% ] 256/500 VUs  2m17.9s/2m30.0s

running (2m18.9s), 240/500 VUs, 7979 complete and 0 interrupted iterations
default   [  93% ] 240/500 VUs  2m18.9s/2m30.0s

running (2m19.9s), 223/500 VUs, 8036 complete and 0 interrupted iterations
default   [  93% ] 223/500 VUs  2m19.9s/2m30.0s

running (2m20.9s), 202/500 VUs, 8087 complete and 0 interrupted iterations
default   [  94% ] 202/500 VUs  2m20.9s/2m30.0s

running (2m21.9s), 185/500 VUs, 8126 complete and 0 interrupted iterations
default   [  95% ] 185/500 VUs  2m21.9s/2m30.0s

running (2m22.9s), 167/500 VUs, 8172 complete and 0 interrupted iterations
default   [  95% ] 167/500 VUs  2m22.9s/2m30.0s

running (2m23.9s), 156/500 VUs, 8195 complete and 0 interrupted iterations
default   [  96% ] 156/500 VUs  2m23.9s/2m30.0s

running (2m24.9s), 139/500 VUs, 8219 complete and 0 interrupted iterations
default   [  97% ] 139/500 VUs  2m24.9s/2m30.0s

running (2m25.9s), 117/500 VUs, 8258 complete and 0 interrupted iterations
default   [  97% ] 117/500 VUs  2m25.9s/2m30.0s

running (2m26.9s), 099/500 VUs, 8288 complete and 0 interrupted iterations
default   [  98% ] 099/500 VUs  2m26.9s/2m30.0s

running (2m27.9s), 081/500 VUs, 8311 complete and 0 interrupted iterations
default   [  99% ] 081/500 VUs  2m27.9s/2m30.0s

running (2m28.9s), 063/500 VUs, 8339 complete and 0 interrupted iterations
default   [  99% ] 063/500 VUs  2m28.9s/2m30.0s

running (2m29.9s), 051/500 VUs, 8351 complete and 0 interrupted iterations
default   [ 100% ] 051/500 VUs  2m29.9s/2m30.0s

running (2m30.9s), 044/500 VUs, 8358 complete and 0 interrupted iterations
default ↓ [ 100% ] 051/500 VUs  2m30s

running (2m31.9s), 027/500 VUs, 8375 complete and 0 interrupted iterations
default ↓ [ 100% ] 051/500 VUs  2m30s

running (2m32.9s), 017/500 VUs, 8385 complete and 0 interrupted iterations
default ↓ [ 100% ] 051/500 VUs  2m30s

running (2m33.9s), 010/500 VUs, 8392 complete and 0 interrupted iterations
default ↓ [ 100% ] 051/500 VUs  2m30s


  █ THRESHOLDS 

    active_clients_time
    ✓ 'p(95)<500' p(95)=98ms

    attach_documents_time
    ✓ 'p(95)<10000' p(95)=376.94ms

    deactivate_clients_time
    ✓ 'p(95)<10000' p(95)=111ms

    http_req_duration
    ✓ 'p(95)<10000' p(95)=182.18ms

    pushpulls_time
    ✓ 'p(95)<1000' p(95)=192ms

    transaction_success_rate
    ✓ 'rate>0.99' rate=100.00%

    transaction_time
    ✓ 'p(95)<30000' p(95)=7.1s


  █ TOTAL RESULTS 

    checks_total.......: 134432  869.882173/s
    checks_succeeded...: 100.00% 134432 out of 134432
    checks_failed......: 0.00%   0 out of 134432

    ✓ status is 200
    ✓ response has valid body

    CUSTOM
    active_clients....................: 8402    54.367636/s
    active_clients_success_rate.......: 100.00% 8402 out of 8402
    active_clients_time...............: avg=21.29ms min=0s       med=5ms    max=368ms    p(90)=64ms     p(95)=98ms    
    attach_documents..................: 8402    54.367636/s
    attach_documents_success_rate.....: 100.00% 8402 out of 8402
    attach_documents_time.............: avg=95.53ms min=3ms      med=28ms   max=750ms    p(90)=284ms    p(95)=376.94ms
    deactivate_clients................: 8402    54.367636/s
    deactivate_clients_success_rate...: 100.00% 8402 out of 8402
    deactivate_clients_time...........: avg=21.59ms min=0s       med=3ms    max=576ms    p(90)=65ms     p(95)=111ms   
    pushpulls.........................: 42010   271.838179/s
    pushpulls_success_rate............: 100.00% 42010 out of 42010
    pushpulls_time....................: avg=46.64ms min=1ms      med=16ms   max=660ms    p(90)=133ms    p(95)=192ms   
    transaction_success_rate..........: 100.00% 8402 out of 8402
    transaction_time..................: avg=6.43s   min=6.01s    med=6.39s  max=8.25s    p(90)=6.94s    p(95)=7.1s    

    HTTP
    http_req_duration.................: avg=40.16ms min=205.41µs med=9.14ms max=687.66ms p(90)=120.12ms p(95)=182.18ms
      { expected_response:true }......: avg=40.16ms min=205.41µs med=9.14ms max=687.66ms p(90)=120.12ms p(95)=182.18ms
    http_req_failed...................: 0.00%   0 out of 67216
    http_reqs.........................: 67216   434.941087/s

    EXECUTION
    iteration_duration................: avg=6.43s   min=6.01s    med=6.39s  max=8.25s    p(90)=6.94s    p(95)=7.1s    
    iterations........................: 8402    54.367636/s
    vus...............................: 10      min=8              max=500
    vus_max...........................: 500     min=500            max=500

    NETWORK
    data_received.....................: 1.2 GB  7.7 MB/s
    data_sent.........................: 63 MB   409 kB/s




running (2m34.5s), 000/500 VUs, 8402 complete and 0 interrupted iterations
default ✓ [ 100% ] 000/500 VUs  2m30s
