
         /\      Grafana   /‾‾/  
    /\  /  \     |\  __   /  /   
   /  \/    \    | |/ /  /   ‾‾\ 
  /          \   |   (  |  (‾)  |
 / __________ \  |_|\_\  \_____/ 

     execution: local
        script: test/k6/presence.ts
        output: -

     scenarios: (100.00%) 1 scenario, 500 max VUs, 3m0s max duration (incl. graceful stop):
              * default: Up to 500 looping VUs for 2m30s over 3 stages (gracefulRampDown: 30s, gracefulStop: 30s)


running (0m00.9s), 008/500 VUs, 0 complete and 0 interrupted iterations
default   [   1% ] 008/500 VUs  0m00.9s/2m30.0s

running (0m01.9s), 016/500 VUs, 0 complete and 0 interrupted iterations
default   [   1% ] 016/500 VUs  0m01.9s/2m30.0s

running (0m02.9s), 024/500 VUs, 0 complete and 0 interrupted iterations
default   [   2% ] 024/500 VUs  0m02.9s/2m30.0s

running (0m03.9s), 033/500 VUs, 0 complete and 0 interrupted iterations
default   [   3% ] 033/500 VUs  0m03.9s/2m30.0s

running (0m04.9s), 041/500 VUs, 0 complete and 0 interrupted iterations
default   [   3% ] 041/500 VUs  0m04.9s/2m30.0s

running (0m05.9s), 049/500 VUs, 0 complete and 0 interrupted iterations
default   [   4% ] 049/500 VUs  0m05.9s/2m30.0s

running (0m06.9s), 058/500 VUs, 8 complete and 0 interrupted iterations
default   [   5% ] 058/500 VUs  0m06.9s/2m30.0s

running (0m07.9s), 066/500 VUs, 16 complete and 0 interrupted iterations
default   [   5% ] 066/500 VUs  0m07.9s/2m30.0s

running (0m08.9s), 074/500 VUs, 24 complete and 0 interrupted iterations
default   [   6% ] 074/500 VUs  0m08.9s/2m30.0s

running (0m09.9s), 083/500 VUs, 33 complete and 0 interrupted iterations
default   [   7% ] 083/500 VUs  0m09.9s/2m30.0s

running (0m10.9s), 091/500 VUs, 41 complete and 0 interrupted iterations
default   [   7% ] 091/500 VUs  0m10.9s/2m30.0s

running (0m11.9s), 099/500 VUs, 49 complete and 0 interrupted iterations
default   [   8% ] 099/500 VUs  0m11.9s/2m30.0s

running (0m12.9s), 108/500 VUs, 64 complete and 0 interrupted iterations
default   [   9% ] 108/500 VUs  0m12.9s/2m30.0s

running (0m13.9s), 116/500 VUs, 82 complete and 0 interrupted iterations
default   [   9% ] 116/500 VUs  0m13.9s/2m30.0s

running (0m14.9s), 124/500 VUs, 98 complete and 0 interrupted iterations
default   [  10% ] 124/500 VUs  0m14.9s/2m30.0s

running (0m15.9s), 132/500 VUs, 114 complete and 0 interrupted iterations
default   [  11% ] 132/500 VUs  0m15.9s/2m30.0s

running (0m16.9s), 141/500 VUs, 132 complete and 0 interrupted iterations
default   [  11% ] 141/500 VUs  0m16.9s/2m30.0s

running (0m17.9s), 149/500 VUs, 148 complete and 0 interrupted iterations
default   [  12% ] 149/500 VUs  0m17.9s/2m30.0s

running (0m18.9s), 157/500 VUs, 171 complete and 0 interrupted iterations
default   [  13% ] 157/500 VUs  0m18.9s/2m30.0s

running (0m19.9s), 166/500 VUs, 198 complete and 0 interrupted iterations
default   [  13% ] 166/500 VUs  0m19.9s/2m30.0s

running (0m20.9s), 174/500 VUs, 222 complete and 0 interrupted iterations
default   [  14% ] 174/500 VUs  0m20.9s/2m30.0s

running (0m21.9s), 182/500 VUs, 246 complete and 0 interrupted iterations
default   [  15% ] 182/500 VUs  0m21.9s/2m30.0s

running (0m22.9s), 191/500 VUs, 271 complete and 0 interrupted iterations
default   [  15% ] 191/500 VUs  0m22.9s/2m30.0s

running (0m23.9s), 199/500 VUs, 297 complete and 0 interrupted iterations
default   [  16% ] 199/500 VUs  0m23.9s/2m30.0s

running (0m24.9s), 207/500 VUs, 328 complete and 0 interrupted iterations
default   [  17% ] 207/500 VUs  0m24.9s/2m30.0s

running (0m25.9s), 216/500 VUs, 361 complete and 0 interrupted iterations
default   [  17% ] 216/500 VUs  0m25.9s/2m30.0s

running (0m26.9s), 224/500 VUs, 396 complete and 0 interrupted iterations
default   [  18% ] 224/500 VUs  0m26.9s/2m30.0s

running (0m27.9s), 232/500 VUs, 428 complete and 0 interrupted iterations
default   [  19% ] 232/500 VUs  0m27.9s/2m30.0s

running (0m28.9s), 241/500 VUs, 461 complete and 0 interrupted iterations
default   [  19% ] 241/500 VUs  0m28.9s/2m30.0s

running (0m29.9s), 249/500 VUs, 496 complete and 0 interrupted iterations
default   [  20% ] 249/500 VUs  0m29.9s/2m30.0s

running (0m30.9s), 257/500 VUs, 535 complete and 0 interrupted iterations
default   [  21% ] 257/500 VUs  0m30.9s/2m30.0s

running (0m31.9s), 266/500 VUs, 575 complete and 0 interrupted iterations
default   [  21% ] 266/500 VUs  0m31.9s/2m30.0s

running (0m32.9s), 274/500 VUs, 618 complete and 0 interrupted iterations
default   [  22% ] 274/500 VUs  0m32.9s/2m30.0s

running (0m33.9s), 282/500 VUs, 660 complete and 0 interrupted iterations
default   [  23% ] 282/500 VUs  0m33.9s/2m30.0s

running (0m34.9s), 290/500 VUs, 700 complete and 0 interrupted iterations
default   [  23% ] 290/500 VUs  0m34.9s/2m30.0s

running (0m35.9s), 299/500 VUs, 742 complete and 0 interrupted iterations
default   [  24% ] 299/500 VUs  0m35.9s/2m30.0s

running (0m36.9s), 307/500 VUs, 791 complete and 0 interrupted iterations
default   [  25% ] 307/500 VUs  0m36.9s/2m30.0s

running (0m37.9s), 315/500 VUs, 840 complete and 0 interrupted iterations
default   [  25% ] 315/500 VUs  0m37.9s/2m30.0s

running (0m38.9s), 324/500 VUs, 888 complete and 0 interrupted iterations
default   [  26% ] 324/500 VUs  0m38.9s/2m30.0s

running (0m39.9s), 332/500 VUs, 940 complete and 0 interrupted iterations
default   [  27% ] 332/500 VUs  0m39.9s/2m30.0s

running (0m40.9s), 340/500 VUs, 990 complete and 0 interrupted iterations
default   [  27% ] 340/500 VUs  0m40.9s/2m30.0s

running (0m41.9s), 349/500 VUs, 1039 complete and 0 interrupted iterations
default   [  28% ] 349/500 VUs  0m41.9s/2m30.0s

running (0m42.9s), 357/500 VUs, 1096 complete and 0 interrupted iterations
default   [  29% ] 357/500 VUs  0m42.9s/2m30.0s

running (0m43.9s), 365/500 VUs, 1155 complete and 0 interrupted iterations
default   [  29% ] 365/500 VUs  0m43.9s/2m30.0s

running (0m44.9s), 374/500 VUs, 1212 complete and 0 interrupted iterations
default   [  30% ] 374/500 VUs  0m44.9s/2m30.0s

running (0m45.9s), 382/500 VUs, 1272 complete and 0 interrupted iterations
default   [  31% ] 382/500 VUs  0m45.9s/2m30.0s

running (0m46.9s), 390/500 VUs, 1330 complete and 0 interrupted iterations
default   [  31% ] 390/500 VUs  0m46.9s/2m30.0s

running (0m47.9s), 399/500 VUs, 1386 complete and 0 interrupted iterations
default   [  32% ] 399/500 VUs  0m47.9s/2m30.0s

running (0m48.9s), 407/500 VUs, 1449 complete and 0 interrupted iterations
default   [  33% ] 407/500 VUs  0m48.9s/2m30.0s

running (0m49.9s), 415/500 VUs, 1516 complete and 0 interrupted iterations
default   [  33% ] 415/500 VUs  0m49.9s/2m30.0s

running (0m50.9s), 424/500 VUs, 1583 complete and 0 interrupted iterations
default   [  34% ] 424/500 VUs  0m50.9s/2m30.0s

running (0m51.9s), 432/500 VUs, 1648 complete and 0 interrupted iterations
default   [  35% ] 432/500 VUs  0m51.9s/2m30.0s

running (0m52.9s), 440/500 VUs, 1709 complete and 0 interrupted iterations
default   [  35% ] 440/500 VUs  0m52.9s/2m30.0s

running (0m53.9s), 449/500 VUs, 1776 complete and 0 interrupted iterations
default   [  36% ] 449/500 VUs  0m53.9s/2m30.0s

running (0m54.9s), 457/500 VUs, 1842 complete and 0 interrupted iterations
default   [  37% ] 457/500 VUs  0m54.9s/2m30.0s

running (0m55.9s), 465/500 VUs, 1910 complete and 0 interrupted iterations
default   [  37% ] 465/500 VUs  0m55.9s/2m30.0s

running (0m56.9s), 473/500 VUs, 1984 complete and 0 interrupted iterations
default   [  38% ] 473/500 VUs  0m56.9s/2m30.0s

running (0m57.9s), 482/500 VUs, 2067 complete and 0 interrupted iterations
default   [  39% ] 482/500 VUs  0m57.9s/2m30.0s

running (0m58.9s), 490/500 VUs, 2136 complete and 0 interrupted iterations
default   [  39% ] 490/500 VUs  0m58.9s/2m30.0s

running (0m59.9s), 499/500 VUs, 2199 complete and 0 interrupted iterations
default   [  40% ] 499/500 VUs  0m59.9s/2m30.0s

running (1m00.9s), 500/500 VUs, 2274 complete and 0 interrupted iterations
default   [  41% ] 500/500 VUs  1m00.9s/2m30.0s

running (1m01.9s), 500/500 VUs, 2363 complete and 0 interrupted iterations
default   [  41% ] 500/500 VUs  1m01.9s/2m30.0s

running (1m02.9s), 500/500 VUs, 2449 complete and 0 interrupted iterations
default   [  42% ] 500/500 VUs  1m02.9s/2m30.0s

running (1m03.9s), 500/500 VUs, 2507 complete and 0 interrupted iterations
default   [  43% ] 500/500 VUs  1m03.9s/2m30.0s

running (1m04.9s), 500/500 VUs, 2586 complete and 0 interrupted iterations
default   [  43% ] 500/500 VUs  1m04.9s/2m30.0s

running (1m05.9s), 500/500 VUs, 2674 complete and 0 interrupted iterations
default   [  44% ] 500/500 VUs  1m05.9s/2m30.0s

running (1m06.9s), 500/500 VUs, 2749 complete and 0 interrupted iterations
default   [  45% ] 500/500 VUs  1m06.9s/2m30.0s

running (1m07.9s), 500/500 VUs, 2823 complete and 0 interrupted iterations
default   [  45% ] 500/500 VUs  1m07.9s/2m30.0s

running (1m08.9s), 500/500 VUs, 2901 complete and 0 interrupted iterations
default   [  46% ] 500/500 VUs  1m08.9s/2m30.0s

running (1m09.9s), 500/500 VUs, 2980 complete and 0 interrupted iterations
default   [  47% ] 500/500 VUs  1m09.9s/2m30.0s

running (1m10.9s), 500/500 VUs, 3059 complete and 0 interrupted iterations
default   [  47% ] 500/500 VUs  1m10.9s/2m30.0s

running (1m11.9s), 500/500 VUs, 3124 complete and 0 interrupted iterations
default   [  48% ] 500/500 VUs  1m11.9s/2m30.0s

running (1m12.9s), 500/500 VUs, 3196 complete and 0 interrupted iterations
default   [  49% ] 500/500 VUs  1m12.9s/2m30.0s

running (1m13.9s), 500/500 VUs, 3289 complete and 0 interrupted iterations
default   [  49% ] 500/500 VUs  1m13.9s/2m30.0s

running (1m14.9s), 500/500 VUs, 3367 complete and 0 interrupted iterations
default   [  50% ] 500/500 VUs  1m14.9s/2m30.0s

running (1m15.9s), 500/500 VUs, 3438 complete and 0 interrupted iterations
default   [  51% ] 500/500 VUs  1m15.9s/2m30.0s

running (1m16.9s), 500/500 VUs, 3506 complete and 0 interrupted iterations
default   [  51% ] 500/500 VUs  1m16.9s/2m30.0s

running (1m17.9s), 500/500 VUs, 3589 complete and 0 interrupted iterations
default   [  52% ] 500/500 VUs  1m17.9s/2m30.0s

running (1m18.9s), 500/500 VUs, 3673 complete and 0 interrupted iterations
default   [  53% ] 500/500 VUs  1m18.9s/2m30.0s

running (1m19.9s), 500/500 VUs, 3714 complete and 0 interrupted iterations
default   [  53% ] 500/500 VUs  1m19.9s/2m30.0s

running (1m20.9s), 500/500 VUs, 3802 complete and 0 interrupted iterations
default   [  54% ] 500/500 VUs  1m20.9s/2m30.0s

running (1m21.9s), 500/500 VUs, 3899 complete and 0 interrupted iterations
default   [  55% ] 500/500 VUs  1m21.9s/2m30.0s

running (1m23.1s), 500/500 VUs, 3997 complete and 0 interrupted iterations
default   [  55% ] 500/500 VUs  1m23.1s/2m30.0s

running (1m23.9s), 500/500 VUs, 4036 complete and 0 interrupted iterations
default   [  56% ] 500/500 VUs  1m23.9s/2m30.0s

running (1m24.9s), 500/500 VUs, 4123 complete and 0 interrupted iterations
default   [  57% ] 500/500 VUs  1m24.9s/2m30.0s

running (1m25.9s), 500/500 VUs, 4185 complete and 0 interrupted iterations
default   [  57% ] 500/500 VUs  1m25.9s/2m30.0s

running (1m26.9s), 500/500 VUs, 4258 complete and 0 interrupted iterations
default   [  58% ] 500/500 VUs  1m26.9s/2m30.0s

running (1m27.9s), 500/500 VUs, 4330 complete and 0 interrupted iterations
default   [  59% ] 500/500 VUs  1m27.9s/2m30.0s

running (1m28.9s), 500/500 VUs, 4441 complete and 0 interrupted iterations
default   [  59% ] 500/500 VUs  1m28.9s/2m30.0s

running (1m29.9s), 500/500 VUs, 4513 complete and 0 interrupted iterations
default   [  60% ] 500/500 VUs  1m29.9s/2m30.0s

running (1m30.9s), 500/500 VUs, 4582 complete and 0 interrupted iterations
default   [  61% ] 500/500 VUs  1m30.9s/2m30.0s

running (1m31.9s), 500/500 VUs, 4659 complete and 0 interrupted iterations
default   [  61% ] 500/500 VUs  1m31.9s/2m30.0s

running (1m32.9s), 500/500 VUs, 4718 complete and 0 interrupted iterations
default   [  62% ] 500/500 VUs  1m32.9s/2m30.0s

running (1m33.9s), 500/500 VUs, 4793 complete and 0 interrupted iterations
default   [  63% ] 500/500 VUs  1m33.9s/2m30.0s

running (1m34.9s), 500/500 VUs, 4900 complete and 0 interrupted iterations
default   [  63% ] 500/500 VUs  1m34.9s/2m30.0s

running (1m35.9s), 500/500 VUs, 4968 complete and 0 interrupted iterations
default   [  64% ] 500/500 VUs  1m35.9s/2m30.0s

running (1m36.9s), 500/500 VUs, 5032 complete and 0 interrupted iterations
default   [  65% ] 500/500 VUs  1m36.9s/2m30.0s

running (1m37.9s), 500/500 VUs, 5119 complete and 0 interrupted iterations
default   [  65% ] 500/500 VUs  1m37.9s/2m30.0s

running (1m38.9s), 500/500 VUs, 5187 complete and 0 interrupted iterations
default   [  66% ] 500/500 VUs  1m38.9s/2m30.0s

running (1m39.9s), 500/500 VUs, 5267 complete and 0 interrupted iterations
default   [  67% ] 500/500 VUs  1m39.9s/2m30.0s

running (1m40.9s), 500/500 VUs, 5351 complete and 0 interrupted iterations
default   [  67% ] 500/500 VUs  1m40.9s/2m30.0s

running (1m41.9s), 500/500 VUs, 5417 complete and 0 interrupted iterations
default   [  68% ] 500/500 VUs  1m41.9s/2m30.0s

running (1m42.9s), 500/500 VUs, 5495 complete and 0 interrupted iterations
default   [  69% ] 500/500 VUs  1m42.9s/2m30.0s

running (1m43.9s), 500/500 VUs, 5593 complete and 0 interrupted iterations
default   [  69% ] 500/500 VUs  1m43.9s/2m30.0s

running (1m44.9s), 500/500 VUs, 5671 complete and 0 interrupted iterations
default   [  70% ] 500/500 VUs  1m44.9s/2m30.0s

running (1m45.9s), 500/500 VUs, 5736 complete and 0 interrupted iterations
default   [  71% ] 500/500 VUs  1m45.9s/2m30.0s

running (1m46.9s), 500/500 VUs, 5800 complete and 0 interrupted iterations
default   [  71% ] 500/500 VUs  1m46.9s/2m30.0s

running (1m47.9s), 500/500 VUs, 5890 complete and 0 interrupted iterations
default   [  72% ] 500/500 VUs  1m47.9s/2m30.0s

running (1m48.9s), 500/500 VUs, 5965 complete and 0 interrupted iterations
default   [  73% ] 500/500 VUs  1m48.9s/2m30.0s

running (1m49.9s), 500/500 VUs, 6023 complete and 0 interrupted iterations
default   [  73% ] 500/500 VUs  1m49.9s/2m30.0s

running (1m50.9s), 500/500 VUs, 6127 complete and 0 interrupted iterations
default   [  74% ] 500/500 VUs  1m50.9s/2m30.0s

running (1m51.9s), 500/500 VUs, 6206 complete and 0 interrupted iterations
default   [  75% ] 500/500 VUs  1m51.9s/2m30.0s

running (1m52.9s), 500/500 VUs, 6287 complete and 0 interrupted iterations
default   [  75% ] 500/500 VUs  1m52.9s/2m30.0s

running (1m53.9s), 500/500 VUs, 6355 complete and 0 interrupted iterations
default   [  76% ] 500/500 VUs  1m53.9s/2m30.0s

running (1m54.9s), 500/500 VUs, 6422 complete and 0 interrupted iterations
default   [  77% ] 500/500 VUs  1m54.9s/2m30.0s

running (1m55.9s), 500/500 VUs, 6513 complete and 0 interrupted iterations
default   [  77% ] 500/500 VUs  1m55.9s/2m30.0s

running (1m56.9s), 500/500 VUs, 6575 complete and 0 interrupted iterations
default   [  78% ] 500/500 VUs  1m56.9s/2m30.0s

running (1m57.9s), 500/500 VUs, 6646 complete and 0 interrupted iterations
default   [  79% ] 500/500 VUs  1m57.9s/2m30.0s

running (1m58.9s), 500/500 VUs, 6737 complete and 0 interrupted iterations
default   [  79% ] 500/500 VUs  1m58.9s/2m30.0s

running (1m59.9s), 500/500 VUs, 6801 complete and 0 interrupted iterations
default   [  80% ] 500/500 VUs  1m59.9s/2m30.0s

running (2m00.9s), 500/500 VUs, 6887 complete and 0 interrupted iterations
default   [  81% ] 500/500 VUs  2m00.9s/2m30.0s

running (2m01.9s), 497/500 VUs, 6973 complete and 0 interrupted iterations
default   [  81% ] 497/500 VUs  2m01.9s/2m30.0s

running (2m02.9s), 491/500 VUs, 7016 complete and 0 interrupted iterations
default   [  82% ] 491/500 VUs  2m02.9s/2m30.0s

running (2m03.9s), 484/500 VUs, 7107 complete and 0 interrupted iterations
default   [  83% ] 484/500 VUs  2m03.9s/2m30.0s

running (2m04.9s), 467/500 VUs, 7197 complete and 0 interrupted iterations
default   [  83% ] 467/500 VUs  2m04.9s/2m30.0s

running (2m05.9s), 455/500 VUs, 7263 complete and 0 interrupted iterations
default   [  84% ] 455/500 VUs  2m05.9s/2m30.0s

running (2m06.9s), 440/500 VUs, 7339 complete and 0 interrupted iterations
default   [  85% ] 440/500 VUs  2m06.9s/2m30.0s

running (2m07.9s), 423/500 VUs, 7414 complete and 0 interrupted iterations
default   [  85% ] 423/500 VUs  2m07.9s/2m30.0s

running (2m08.9s), 406/500 VUs, 7490 complete and 0 interrupted iterations
default   [  86% ] 406/500 VUs  2m08.9s/2m30.0s

running (2m09.9s), 387/500 VUs, 7568 complete and 0 interrupted iterations
default   [  87% ] 387/500 VUs  2m09.9s/2m30.0s

running (2m10.9s), 374/500 VUs, 7617 complete and 0 interrupted iterations
default   [  87% ] 374/500 VUs  2m10.9s/2m30.0s

running (2m11.9s), 355/500 VUs, 7694 complete and 0 interrupted iterations
default   [  88% ] 355/500 VUs  2m11.9s/2m30.0s

running (2m12.9s), 332/500 VUs, 7777 complete and 0 interrupted iterations
default   [  89% ] 332/500 VUs  2m12.9s/2m30.0s

running (2m13.9s), 321/500 VUs, 7837 complete and 0 interrupted iterations
default   [  89% ] 321/500 VUs  2m13.9s/2m30.0s

running (2m14.9s), 307/500 VUs, 7895 complete and 0 interrupted iterations
default   [  90% ] 307/500 VUs  2m14.9s/2m30.0s

running (2m15.9s), 288/500 VUs, 7948 complete and 0 interrupted iterations
default   [  91% ] 288/500 VUs  2m15.9s/2m30.0s

running (2m16.9s), 274/500 VUs, 7991 complete and 0 interrupted iterations
default   [  91% ] 274/500 VUs  2m16.9s/2m30.0s

running (2m17.9s), 255/500 VUs, 8046 complete and 0 interrupted iterations
default   [  92% ] 255/500 VUs  2m17.9s/2m30.0s

running (2m18.9s), 235/500 VUs, 8108 complete and 0 interrupted iterations
default   [  93% ] 235/500 VUs  2m18.9s/2m30.0s

running (2m19.9s), 213/500 VUs, 8158 complete and 0 interrupted iterations
default   [  93% ] 213/500 VUs  2m19.9s/2m30.0s

running (2m20.9s), 197/500 VUs, 8201 complete and 0 interrupted iterations
default   [  94% ] 197/500 VUs  2m20.9s/2m30.0s

running (2m21.9s), 186/500 VUs, 8236 complete and 0 interrupted iterations
default   [  95% ] 186/500 VUs  2m21.9s/2m30.0s

running (2m22.9s), 168/500 VUs, 8265 complete and 0 interrupted iterations
default   [  95% ] 168/500 VUs  2m22.9s/2m30.0s

running (2m23.9s), 154/500 VUs, 8301 complete and 0 interrupted iterations
default   [  96% ] 154/500 VUs  2m23.9s/2m30.0s

running (2m24.9s), 133/500 VUs, 8343 complete and 0 interrupted iterations
default   [  97% ] 133/500 VUs  2m24.9s/2m30.0s

running (2m25.9s), 119/500 VUs, 8371 complete and 0 interrupted iterations
default   [  97% ] 119/500 VUs  2m25.9s/2m30.0s

running (2m26.9s), 100/500 VUs, 8398 complete and 0 interrupted iterations
default   [  98% ] 100/500 VUs  2m26.9s/2m30.0s

running (2m27.9s), 080/500 VUs, 8422 complete and 0 interrupted iterations
default   [  99% ] 080/500 VUs  2m27.9s/2m30.0s

running (2m28.9s), 072/500 VUs, 8433 complete and 0 interrupted iterations
default   [  99% ] 072/500 VUs  2m28.9s/2m30.0s

running (2m29.9s), 053/500 VUs, 8455 complete and 0 interrupted iterations
default   [ 100% ] 053/500 VUs  2m29.9s/2m30.0s

running (2m30.9s), 033/500 VUs, 8476 complete and 0 interrupted iterations
default ↓ [ 100% ] 053/500 VUs  2m30s

running (2m31.9s), 019/500 VUs, 8490 complete and 0 interrupted iterations
default ↓ [ 100% ] 053/500 VUs  2m30s

running (2m32.9s), 011/500 VUs, 8498 complete and 0 interrupted iterations
default ↓ [ 100% ] 053/500 VUs  2m30s

running (2m33.9s), 007/500 VUs, 8502 complete and 0 interrupted iterations
default ↓ [ 100% ] 053/500 VUs  2m30s

running (2m34.9s), 004/500 VUs, 8505 complete and 0 interrupted iterations
default ↓ [ 100% ] 053/500 VUs  2m30s

running (2m35.9s), 001/500 VUs, 8508 complete and 0 interrupted iterations
default ↓ [ 100% ] 053/500 VUs  2m30s


  █ THRESHOLDS 

    active_clients_time
    ✓ 'p(95)<500' p(95)=89ms

    attach_documents_time
    ✓ 'p(95)<10000' p(95)=315.59ms

    deactivate_clients_time
    ✓ 'p(95)<10000' p(95)=89ms

    http_req_duration
    ✓ 'p(95)<10000' p(95)=144.03ms

    pushpulls_time
    ✓ 'p(95)<1000' p(95)=150ms

    transaction_success_rate
    ✓ 'rate>0.99' rate=100.00%

    transaction_time
    ✓ 'p(95)<30000' p(95)=6.87s


  █ TOTAL RESULTS 

    checks_total.......: 136144  873.090307/s
    checks_succeeded...: 100.00% 136144 out of 136144
    checks_failed......: 0.00%   0 out of 136144

    ✓ status is 200
    ✓ response has valid body

    CUSTOM
    active_clients....................: 8509    54.568144/s
    active_clients_success_rate.......: 100.00% 8509 out of 8509
    active_clients_time...............: avg=19.62ms min=0s       med=3ms    max=398ms    p(90)=63ms    p(95)=89ms    
    attach_documents..................: 8509    54.568144/s
    attach_documents_success_rate.....: 100.00% 8509 out of 8509
    attach_documents_time.............: avg=72.74ms min=3ms      med=14ms   max=710ms    p(90)=237ms   p(95)=315.59ms
    deactivate_clients................: 8509    54.568144/s
    deactivate_clients_success_rate...: 100.00% 8509 out of 8509
    deactivate_clients_time...........: avg=18.95ms min=0s       med=2ms    max=624ms    p(90)=55ms    p(95)=89ms    
    pushpulls.........................: 42545   272.840721/s
    pushpulls_success_rate............: 100.00% 42545 out of 42545
    pushpulls_time....................: avg=36.79ms min=1ms      med=10ms   max=683ms    p(90)=104ms   p(95)=150ms   
    transaction_success_rate..........: 100.00% 8509 out of 8509
    transaction_time..................: avg=6.34s   min=6.01s    med=6.31s  max=7.97s    p(90)=6.74s   p(95)=6.87s   

    HTTP
    http_req_duration.................: avg=31.71ms min=175.63µs med=5.49ms max=649.81ms p(90)=93.82ms p(95)=144.03ms
      { expected_response:true }......: avg=31.71ms min=175.63µs med=5.49ms max=649.81ms p(90)=93.82ms p(95)=144.03ms
    http_req_failed...................: 0.00%   0 out of 68072
    http_reqs.........................: 68072   436.545154/s

    EXECUTION
    iteration_duration................: avg=6.34s   min=6.01s    med=6.31s  max=7.97s    p(90)=6.73s   p(95)=6.87s   
    iterations........................: 8509    54.568144/s
    vus...............................: 1       min=1              max=500
    vus_max...........................: 500     min=500            max=500

    NETWORK
    data_received.....................: 1.2 GB  7.7 MB/s
    data_sent.........................: 64 MB   411 kB/s




running (2m35.9s), 000/500 VUs, 8509 complete and 0 interrupted iterations
default ✓ [ 100% ] 000/500 VUs  2m30s
