
         /\      Grafana   /‾‾/  
    /\  /  \     |\  __   /  /   
   /  \/    \    | |/ /  /   ‾‾\ 
  /          \   |   (  |  (‾)  |
 / __________ \  |_|\_\  \_____/ 


     execution: local
        script: test/k6/presence.ts
        output: -

     scenarios: (100.00%) 1 scenario, 500 max VUs, 3m0s max duration (incl. graceful stop):
              * default: Up to 500 looping VUs for 2m30s over 3 stages (gracefulRampDown: 30s, gracefulStop: 30s)


running (0m00.9s), 008/500 VUs, 0 complete and 0 interrupted iterations
default   [   1% ] 008/500 VUs  0m00.9s/2m30.0s

running (0m01.9s), 016/500 VUs, 0 complete and 0 interrupted iterations
default   [   1% ] 016/500 VUs  0m01.9s/2m30.0s

running (0m02.9s), 024/500 VUs, 0 complete and 0 interrupted iterations
default   [   2% ] 024/500 VUs  0m02.9s/2m30.0s

running (0m03.9s), 033/500 VUs, 0 complete and 0 interrupted iterations
default   [   3% ] 033/500 VUs  0m03.9s/2m30.0s

running (0m04.9s), 041/500 VUs, 0 complete and 0 interrupted iterations
default   [   3% ] 041/500 VUs  0m04.9s/2m30.0s

running (0m05.9s), 049/500 VUs, 0 complete and 0 interrupted iterations
default   [   4% ] 049/500 VUs  0m05.9s/2m30.0s

running (0m06.9s), 058/500 VUs, 8 complete and 0 interrupted iterations
default   [   5% ] 058/500 VUs  0m06.9s/2m30.0s

running (0m07.9s), 066/500 VUs, 16 complete and 0 interrupted iterations
default   [   5% ] 066/500 VUs  0m07.9s/2m30.0s

running (0m08.9s), 074/500 VUs, 24 complete and 0 interrupted iterations
default   [   6% ] 074/500 VUs  0m08.9s/2m30.0s

running (0m09.9s), 083/500 VUs, 33 complete and 0 interrupted iterations
default   [   7% ] 083/500 VUs  0m09.9s/2m30.0s

running (0m10.9s), 091/500 VUs, 41 complete and 0 interrupted iterations
default   [   7% ] 091/500 VUs  0m10.9s/2m30.0s

running (0m11.9s), 099/500 VUs, 49 complete and 0 interrupted iterations
default   [   8% ] 099/500 VUs  0m11.9s/2m30.0s

running (0m12.9s), 108/500 VUs, 64 complete and 0 interrupted iterations
default   [   9% ] 108/500 VUs  0m12.9s/2m30.0s

running (0m13.9s), 116/500 VUs, 82 complete and 0 interrupted iterations
default   [   9% ] 116/500 VUs  0m13.9s/2m30.0s

running (0m14.9s), 124/500 VUs, 98 complete and 0 interrupted iterations
default   [  10% ] 124/500 VUs  0m14.9s/2m30.0s

running (0m15.9s), 133/500 VUs, 114 complete and 0 interrupted iterations
default   [  11% ] 133/500 VUs  0m15.9s/2m30.0s

running (0m16.9s), 141/500 VUs, 132 complete and 0 interrupted iterations
default   [  11% ] 141/500 VUs  0m16.9s/2m30.0s

running (0m17.9s), 149/500 VUs, 148 complete and 0 interrupted iterations
default   [  12% ] 149/500 VUs  0m17.9s/2m30.0s

running (0m18.9s), 157/500 VUs, 171 complete and 0 interrupted iterations
default   [  13% ] 157/500 VUs  0m18.9s/2m30.0s

running (0m19.9s), 166/500 VUs, 197 complete and 0 interrupted iterations
default   [  13% ] 166/500 VUs  0m19.9s/2m30.0s

running (0m20.9s), 174/500 VUs, 222 complete and 0 interrupted iterations
default   [  14% ] 174/500 VUs  0m20.9s/2m30.0s

running (0m21.9s), 182/500 VUs, 246 complete and 0 interrupted iterations
default   [  15% ] 182/500 VUs  0m21.9s/2m30.0s

running (0m22.9s), 191/500 VUs, 272 complete and 0 interrupted iterations
default   [  15% ] 191/500 VUs  0m22.9s/2m30.0s

running (0m23.9s), 199/500 VUs, 297 complete and 0 interrupted iterations
default   [  16% ] 199/500 VUs  0m23.9s/2m30.0s

running (0m24.9s), 207/500 VUs, 328 complete and 0 interrupted iterations
default   [  17% ] 207/500 VUs  0m24.9s/2m30.0s

running (0m25.9s), 216/500 VUs, 362 complete and 0 interrupted iterations
default   [  17% ] 216/500 VUs  0m25.9s/2m30.0s

running (0m26.9s), 224/500 VUs, 396 complete and 0 interrupted iterations
default   [  18% ] 224/500 VUs  0m26.9s/2m30.0s

running (0m27.9s), 232/500 VUs, 428 complete and 0 interrupted iterations
default   [  19% ] 232/500 VUs  0m27.9s/2m30.0s

running (0m28.9s), 241/500 VUs, 461 complete and 0 interrupted iterations
default   [  19% ] 241/500 VUs  0m28.9s/2m30.0s

running (0m29.9s), 249/500 VUs, 496 complete and 0 interrupted iterations
default   [  20% ] 249/500 VUs  0m29.9s/2m30.0s

running (0m30.9s), 257/500 VUs, 535 complete and 0 interrupted iterations
default   [  21% ] 257/500 VUs  0m30.9s/2m30.0s

running (0m31.9s), 266/500 VUs, 576 complete and 0 interrupted iterations
default   [  21% ] 266/500 VUs  0m31.9s/2m30.0s

running (0m32.9s), 274/500 VUs, 620 complete and 0 interrupted iterations
default   [  22% ] 274/500 VUs  0m32.9s/2m30.0s

running (0m33.9s), 282/500 VUs, 660 complete and 0 interrupted iterations
default   [  23% ] 282/500 VUs  0m33.9s/2m30.0s

running (0m34.9s), 291/500 VUs, 700 complete and 0 interrupted iterations
default   [  23% ] 291/500 VUs  0m34.9s/2m30.0s

running (0m35.9s), 299/500 VUs, 743 complete and 0 interrupted iterations
default   [  24% ] 299/500 VUs  0m35.9s/2m30.0s

running (0m36.9s), 307/500 VUs, 792 complete and 0 interrupted iterations
default   [  25% ] 307/500 VUs  0m36.9s/2m30.0s

running (0m37.9s), 316/500 VUs, 840 complete and 0 interrupted iterations
default   [  25% ] 316/500 VUs  0m37.9s/2m30.0s

running (0m38.9s), 324/500 VUs, 890 complete and 0 interrupted iterations
default   [  26% ] 324/500 VUs  0m38.9s/2m30.0s

running (0m39.9s), 332/500 VUs, 940 complete and 0 interrupted iterations
default   [  27% ] 332/500 VUs  0m39.9s/2m30.0s

running (0m40.9s), 340/500 VUs, 989 complete and 0 interrupted iterations
default   [  27% ] 340/500 VUs  0m40.9s/2m30.0s

running (0m41.9s), 349/500 VUs, 1039 complete and 0 interrupted iterations
default   [  28% ] 349/500 VUs  0m41.9s/2m30.0s

running (0m42.9s), 357/500 VUs, 1096 complete and 0 interrupted iterations
default   [  29% ] 357/500 VUs  0m42.9s/2m30.0s

running (0m43.9s), 365/500 VUs, 1152 complete and 0 interrupted iterations
default   [  29% ] 365/500 VUs  0m43.9s/2m30.0s

running (0m44.9s), 374/500 VUs, 1211 complete and 0 interrupted iterations
default   [  30% ] 374/500 VUs  0m44.9s/2m30.0s

running (0m45.9s), 382/500 VUs, 1268 complete and 0 interrupted iterations
default   [  31% ] 382/500 VUs  0m45.9s/2m30.0s

running (0m46.9s), 390/500 VUs, 1326 complete and 0 interrupted iterations
default   [  31% ] 390/500 VUs  0m46.9s/2m30.0s

running (0m47.9s), 399/500 VUs, 1385 complete and 0 interrupted iterations
default   [  32% ] 399/500 VUs  0m47.9s/2m30.0s

running (0m48.9s), 407/500 VUs, 1445 complete and 0 interrupted iterations
default   [  33% ] 407/500 VUs  0m48.9s/2m30.0s

running (0m49.9s), 415/500 VUs, 1514 complete and 0 interrupted iterations
default   [  33% ] 415/500 VUs  0m49.9s/2m30.0s

running (0m50.9s), 424/500 VUs, 1578 complete and 0 interrupted iterations
default   [  34% ] 424/500 VUs  0m50.9s/2m30.0s

running (0m51.9s), 432/500 VUs, 1646 complete and 0 interrupted iterations
default   [  35% ] 432/500 VUs  0m51.9s/2m30.0s

running (0m52.9s), 440/500 VUs, 1713 complete and 0 interrupted iterations
default   [  35% ] 440/500 VUs  0m52.9s/2m30.0s

running (0m53.9s), 446/500 VUs, 1768 complete and 0 interrupted iterations
default   [  36% ] 446/500 VUs  0m53.9s/2m30.0s

running (0m54.9s), 457/500 VUs, 1835 complete and 0 interrupted iterations
default   [  37% ] 457/500 VUs  0m54.9s/2m30.0s

running (0m55.9s), 465/500 VUs, 1908 complete and 0 interrupted iterations
default   [  37% ] 465/500 VUs  0m55.9s/2m30.0s

running (0m56.9s), 473/500 VUs, 1973 complete and 0 interrupted iterations
default   [  38% ] 473/500 VUs  0m56.9s/2m30.0s

running (0m57.9s), 482/500 VUs, 2050 complete and 0 interrupted iterations
default   [  39% ] 482/500 VUs  0m57.9s/2m30.0s

running (0m58.9s), 490/500 VUs, 2113 complete and 0 interrupted iterations
default   [  39% ] 490/500 VUs  0m58.9s/2m30.0s

running (0m59.9s), 498/500 VUs, 2189 complete and 0 interrupted iterations
default   [  40% ] 498/500 VUs  0m59.9s/2m30.0s

running (1m00.9s), 500/500 VUs, 2256 complete and 0 interrupted iterations
default   [  41% ] 500/500 VUs  1m00.9s/2m30.0s

running (1m01.9s), 500/500 VUs, 2319 complete and 0 interrupted iterations
default   [  41% ] 500/500 VUs  1m01.9s/2m30.0s

running (1m02.9s), 500/500 VUs, 2421 complete and 0 interrupted iterations
default   [  42% ] 500/500 VUs  1m02.9s/2m30.0s

running (1m03.9s), 500/500 VUs, 2493 complete and 0 interrupted iterations
default   [  43% ] 500/500 VUs  1m03.9s/2m30.0s

running (1m04.9s), 500/500 VUs, 2575 complete and 0 interrupted iterations
default   [  43% ] 500/500 VUs  1m04.9s/2m30.0s

running (1m05.9s), 500/500 VUs, 2655 complete and 0 interrupted iterations
default   [  44% ] 500/500 VUs  1m05.9s/2m30.0s

running (1m06.9s), 500/500 VUs, 2703 complete and 0 interrupted iterations
default   [  45% ] 500/500 VUs  1m06.9s/2m30.0s

running (1m07.9s), 500/500 VUs, 2775 complete and 0 interrupted iterations
default   [  45% ] 500/500 VUs  1m07.9s/2m30.0s

running (1m08.9s), 500/500 VUs, 2851 complete and 0 interrupted iterations
default   [  46% ] 500/500 VUs  1m08.9s/2m30.0s

running (1m09.9s), 500/500 VUs, 2928 complete and 0 interrupted iterations
default   [  47% ] 500/500 VUs  1m09.9s/2m30.0s

running (1m10.9s), 500/500 VUs, 3004 complete and 0 interrupted iterations
default   [  47% ] 500/500 VUs  1m10.9s/2m30.0s

running (1m11.9s), 500/500 VUs, 3093 complete and 0 interrupted iterations
default   [  48% ] 500/500 VUs  1m11.9s/2m30.0s

running (1m12.9s), 500/500 VUs, 3160 complete and 0 interrupted iterations
default   [  49% ] 500/500 VUs  1m12.9s/2m30.0s

running (1m13.9s), 500/500 VUs, 3204 complete and 0 interrupted iterations
default   [  49% ] 500/500 VUs  1m13.9s/2m30.0s

running (1m14.9s), 500/500 VUs, 3289 complete and 0 interrupted iterations
default   [  50% ] 500/500 VUs  1m14.9s/2m30.0s

running (1m15.9s), 500/500 VUs, 3363 complete and 0 interrupted iterations
default   [  51% ] 500/500 VUs  1m15.9s/2m30.0s

running (1m16.9s), 500/500 VUs, 3454 complete and 0 interrupted iterations
default   [  51% ] 500/500 VUs  1m16.9s/2m30.0s

running (1m17.9s), 500/500 VUs, 3546 complete and 0 interrupted iterations
default   [  52% ] 500/500 VUs  1m17.9s/2m30.0s

running (1m19.2s), 500/500 VUs, 3635 complete and 0 interrupted iterations
default   [  53% ] 500/500 VUs  1m19.2s/2m30.0s

running (1m19.9s), 500/500 VUs, 3685 complete and 0 interrupted iterations
default   [  53% ] 500/500 VUs  1m19.9s/2m30.0s

running (1m20.9s), 500/500 VUs, 3772 complete and 0 interrupted iterations
default   [  54% ] 500/500 VUs  1m20.9s/2m30.0s

running (1m22.0s), 500/500 VUs, 3815 complete and 0 interrupted iterations
default   [  55% ] 500/500 VUs  1m22.0s/2m30.0s

running (1m22.9s), 500/500 VUs, 3908 complete and 0 interrupted iterations
default   [  55% ] 500/500 VUs  1m22.9s/2m30.0s

running (1m23.9s), 500/500 VUs, 3962 complete and 0 interrupted iterations
default   [  56% ] 500/500 VUs  1m23.9s/2m30.0s

running (1m24.9s), 500/500 VUs, 4055 complete and 0 interrupted iterations
default   [  57% ] 500/500 VUs  1m24.9s/2m30.0s

running (1m25.9s), 500/500 VUs, 4140 complete and 0 interrupted iterations
default   [  57% ] 500/500 VUs  1m25.9s/2m30.0s

running (1m26.9s), 500/500 VUs, 4209 complete and 0 interrupted iterations
default   [  58% ] 500/500 VUs  1m26.9s/2m30.0s

running (1m27.9s), 500/500 VUs, 4278 complete and 0 interrupted iterations
default   [  59% ] 500/500 VUs  1m27.9s/2m30.0s

running (1m28.9s), 500/500 VUs, 4334 complete and 0 interrupted iterations
default   [  59% ] 500/500 VUs  1m28.9s/2m30.0s

running (1m29.9s), 500/500 VUs, 4439 complete and 0 interrupted iterations
default   [  60% ] 500/500 VUs  1m29.9s/2m30.0s

running (1m30.9s), 500/500 VUs, 4518 complete and 0 interrupted iterations
default   [  61% ] 500/500 VUs  1m30.9s/2m30.0s

running (1m31.9s), 500/500 VUs, 4587 complete and 0 interrupted iterations
default   [  61% ] 500/500 VUs  1m31.9s/2m30.0s

running (1m33.1s), 500/500 VUs, 4687 complete and 0 interrupted iterations
default   [  62% ] 500/500 VUs  1m33.1s/2m30.0s

running (1m33.9s), 500/500 VUs, 4731 complete and 0 interrupted iterations
default   [  63% ] 500/500 VUs  1m33.9s/2m30.0s

running (1m34.9s), 500/500 VUs, 4796 complete and 0 interrupted iterations
default   [  63% ] 500/500 VUs  1m34.9s/2m30.0s

running (1m35.9s), 500/500 VUs, 4883 complete and 0 interrupted iterations
default   [  64% ] 500/500 VUs  1m35.9s/2m30.0s

running (1m37.0s), 500/500 VUs, 4974 complete and 0 interrupted iterations
default   [  65% ] 500/500 VUs  1m37.0s/2m30.0s

running (1m37.9s), 500/500 VUs, 5052 complete and 0 interrupted iterations
default   [  65% ] 500/500 VUs  1m37.9s/2m30.0s

running (1m38.9s), 500/500 VUs, 5149 complete and 0 interrupted iterations
default   [  66% ] 500/500 VUs  1m38.9s/2m30.0s

running (1m39.9s), 500/500 VUs, 5209 complete and 0 interrupted iterations
default   [  67% ] 500/500 VUs  1m39.9s/2m30.0s

running (1m40.9s), 500/500 VUs, 5274 complete and 0 interrupted iterations
default   [  67% ] 500/500 VUs  1m40.9s/2m30.0s

running (1m41.9s), 500/500 VUs, 5349 complete and 0 interrupted iterations
default   [  68% ] 500/500 VUs  1m41.9s/2m30.0s

running (1m42.9s), 500/500 VUs, 5430 complete and 0 interrupted iterations
default   [  69% ] 500/500 VUs  1m42.9s/2m30.0s

running (1m44.0s), 500/500 VUs, 5512 complete and 0 interrupted iterations
default   [  69% ] 500/500 VUs  1m44.1s/2m30.0s

running (1m44.9s), 500/500 VUs, 5574 complete and 0 interrupted iterations
default   [  70% ] 500/500 VUs  1m44.9s/2m30.0s

running (1m45.9s), 500/500 VUs, 5675 complete and 0 interrupted iterations
default   [  71% ] 500/500 VUs  1m45.9s/2m30.0s

running (1m46.9s), 500/500 VUs, 5737 complete and 0 interrupted iterations
default   [  71% ] 500/500 VUs  1m46.9s/2m30.0s

running (1m47.9s), 500/500 VUs, 5785 complete and 0 interrupted iterations
default   [  72% ] 500/500 VUs  1m47.9s/2m30.0s

running (1m48.9s), 500/500 VUs, 5877 complete and 0 interrupted iterations
default   [  73% ] 500/500 VUs  1m48.9s/2m30.0s

running (1m49.9s), 500/500 VUs, 5953 complete and 0 interrupted iterations
default   [  73% ] 500/500 VUs  1m49.9s/2m30.0s

running (1m50.9s), 500/500 VUs, 6021 complete and 0 interrupted iterations
default   [  74% ] 500/500 VUs  1m50.9s/2m30.0s

running (1m51.9s), 500/500 VUs, 6079 complete and 0 interrupted iterations
default   [  75% ] 500/500 VUs  1m51.9s/2m30.0s

running (1m52.9s), 500/500 VUs, 6192 complete and 0 interrupted iterations
default   [  75% ] 500/500 VUs  1m53.2s/2m30.0s

running (1m53.9s), 500/500 VUs, 6248 complete and 0 interrupted iterations
default   [  76% ] 500/500 VUs  1m53.9s/2m30.0s

running (1m54.9s), 500/500 VUs, 6310 complete and 0 interrupted iterations
default   [  77% ] 500/500 VUs  1m54.9s/2m30.0s

running (1m56.2s), 500/500 VUs, 6419 complete and 0 interrupted iterations
default   [  77% ] 500/500 VUs  1m56.2s/2m30.0s

running (1m56.9s), 500/500 VUs, 6467 complete and 0 interrupted iterations
default   [  78% ] 500/500 VUs  1m56.9s/2m30.0s

running (1m58.1s), 500/500 VUs, 6553 complete and 0 interrupted iterations
default   [  79% ] 500/500 VUs  1m58.1s/2m30.0s

running (1m58.9s), 500/500 VUs, 6657 complete and 0 interrupted iterations
default   [  79% ] 500/500 VUs  1m58.9s/2m30.0s

running (1m59.9s), 500/500 VUs, 6715 complete and 0 interrupted iterations
default   [  80% ] 500/500 VUs  1m59.9s/2m30.0s

running (2m00.9s), 500/500 VUs, 6774 complete and 0 interrupted iterations
default   [  81% ] 500/500 VUs  2m00.9s/2m30.0s

running (2m02.3s), 497/500 VUs, 6875 complete and 0 interrupted iterations
default   [  82% ] 497/500 VUs  2m02.3s/2m30.0s

running (2m02.9s), 494/500 VUs, 6912 complete and 0 interrupted iterations
default   [  82% ] 494/500 VUs  2m02.9s/2m30.0s

running (2m03.9s), 482/500 VUs, 7014 complete and 0 interrupted iterations
default   [  83% ] 482/500 VUs  2m03.9s/2m30.0s

running (2m05.3s), 457/500 VUs, 7135 complete and 0 interrupted iterations
default   [  84% ] 457/500 VUs  2m05.3s/2m30.0s

running (2m05.9s), 451/500 VUs, 7180 complete and 0 interrupted iterations
default   [  84% ] 451/500 VUs  2m05.9s/2m30.0s

running (2m06.9s), 435/500 VUs, 7256 complete and 0 interrupted iterations
default   [  85% ] 435/500 VUs  2m06.9s/2m30.0s

running (2m07.9s), 417/500 VUs, 7329 complete and 0 interrupted iterations
default   [  85% ] 417/500 VUs  2m07.9s/2m30.0s

running (2m08.9s), 401/500 VUs, 7398 complete and 0 interrupted iterations
default   [  86% ] 401/500 VUs  2m08.9s/2m30.0s

running (2m09.9s), 390/500 VUs, 7435 complete and 0 interrupted iterations
default   [  87% ] 390/500 VUs  2m09.9s/2m30.0s

running (2m10.9s), 367/500 VUs, 7539 complete and 0 interrupted iterations
default   [  87% ] 367/500 VUs  2m10.9s/2m30.0s

running (2m11.9s), 347/500 VUs, 7629 complete and 0 interrupted iterations
default   [  88% ] 347/500 VUs  2m11.9s/2m30.0s

running (2m12.9s), 331/500 VUs, 7690 complete and 0 interrupted iterations
default   [  89% ] 331/500 VUs  2m12.9s/2m30.0s

running (2m13.9s), 320/500 VUs, 7734 complete and 0 interrupted iterations
default   [  89% ] 320/500 VUs  2m13.9s/2m30.0s

running (2m14.9s), 310/500 VUs, 7784 complete and 0 interrupted iterations
default   [  90% ] 310/500 VUs  2m14.9s/2m30.0s

running (2m15.9s), 294/500 VUs, 7825 complete and 0 interrupted iterations
default   [  91% ] 294/500 VUs  2m15.9s/2m30.0s

running (2m16.9s), 270/500 VUs, 7905 complete and 0 interrupted iterations
default   [  91% ] 270/500 VUs  2m16.9s/2m30.0s

running (2m17.9s), 245/500 VUs, 7976 complete and 0 interrupted iterations
default   [  92% ] 245/500 VUs  2m17.9s/2m30.0s

running (2m18.9s), 228/500 VUs, 8021 complete and 0 interrupted iterations
default   [  93% ] 228/500 VUs  2m18.9s/2m30.0s

running (2m19.9s), 217/500 VUs, 8054 complete and 0 interrupted iterations
default   [  93% ] 217/500 VUs  2m19.9s/2m30.0s

running (2m20.9s), 206/500 VUs, 8088 complete and 0 interrupted iterations
default   [  94% ] 206/500 VUs  2m20.9s/2m30.0s

running (2m21.9s), 195/500 VUs, 8119 complete and 0 interrupted iterations
default   [  95% ] 195/500 VUs  2m21.9s/2m30.0s

running (2m22.9s), 168/500 VUs, 8174 complete and 0 interrupted iterations
default   [  95% ] 168/500 VUs  2m22.9s/2m30.0s

running (2m23.9s), 147/500 VUs, 8221 complete and 0 interrupted iterations
default   [  96% ] 147/500 VUs  2m23.9s/2m30.0s

running (2m24.9s), 130/500 VUs, 8246 complete and 0 interrupted iterations
default   [  97% ] 130/500 VUs  2m24.9s/2m30.0s

running (2m25.9s), 120/500 VUs, 8265 complete and 0 interrupted iterations
default   [  97% ] 120/500 VUs  2m25.9s/2m30.0s

running (2m26.9s), 104/500 VUs, 8294 complete and 0 interrupted iterations
default   [  98% ] 104/500 VUs  2m26.9s/2m30.0s

running (2m27.9s), 090/500 VUs, 8314 complete and 0 interrupted iterations
default   [  99% ] 090/500 VUs  2m27.9s/2m30.0s

running (2m28.9s), 069/500 VUs, 8342 complete and 0 interrupted iterations
default   [  99% ] 069/500 VUs  2m28.9s/2m30.0s

running (2m29.9s), 043/500 VUs, 8368 complete and 0 interrupted iterations
default   [ 100% ] 043/500 VUs  2m29.9s/2m30.0s

running (2m30.9s), 035/500 VUs, 8376 complete and 0 interrupted iterations
default ↓ [ 100% ] 042/500 VUs  2m30s

running (2m31.9s), 026/500 VUs, 8385 complete and 0 interrupted iterations
default ↓ [ 100% ] 042/500 VUs  2m30s

running (2m32.9s), 013/500 VUs, 8398 complete and 0 interrupted iterations
default ↓ [ 100% ] 042/500 VUs  2m30s

running (2m33.9s), 007/500 VUs, 8404 complete and 0 interrupted iterations
default ↓ [ 100% ] 042/500 VUs  2m30s


  █ THRESHOLDS 

    active_clients_time
    ✓ 'p(95)<500' p(95)=93.5ms

    attach_documents_time
    ✓ 'p(95)<10000' p(95)=353ms

    deactivate_clients_time
    ✓ 'p(95)<10000' p(95)=108ms

    http_req_duration
    ✓ 'p(95)<10000' p(95)=173.65ms

    pushpulls_time
    ✓ 'p(95)<1000' p(95)=181ms

    transaction_success_rate
    ✓ 'rate>0.99' rate=100.00%

    transaction_time
    ✓ 'p(95)<30000' p(95)=7.07s


  █ TOTAL RESULTS 

    checks_total.......: 134576  871.475857/s
    checks_succeeded...: 100.00% 134576 out of 134576
    checks_failed......: 0.00%   0 out of 134576

    ✓ status is 200
    ✓ response has valid body

    CUSTOM
    active_clients....................: 8411    54.467241/s
    active_clients_success_rate.......: 100.00% 8411 out of 8411
    active_clients_time...............: avg=20.81ms min=0s       med=4ms    max=358ms    p(90)=65ms     p(95)=93.5ms  
    attach_documents..................: 8411    54.467241/s
    attach_documents_success_rate.....: 100.00% 8411 out of 8411
    attach_documents_time.............: avg=83.36ms min=3ms      med=20ms   max=864ms    p(90)=266ms    p(95)=353ms   
    deactivate_clients................: 8411    54.467241/s
    deactivate_clients_success_rate...: 100.00% 8411 out of 8411
    deactivate_clients_time...........: avg=22.38ms min=0s       med=2ms    max=597ms    p(90)=66ms     p(95)=108ms   
    pushpulls.........................: 42055   272.336205/s
    pushpulls_success_rate............: 100.00% 42055 out of 42055
    pushpulls_time....................: avg=44.55ms min=1ms      med=14ms   max=894ms    p(90)=123.59ms p(95)=181ms   
    transaction_success_rate..........: 100.00% 8411 out of 8411
    transaction_time..................: avg=6.42s   min=6.01s    med=6.39s  max=8.02s    p(90)=6.89s    p(95)=7.07s   

    HTTP
    http_req_duration.................: avg=38.67ms min=173.41µs med=7.49ms max=708.68ms p(90)=114.92ms p(95)=173.65ms
      { expected_response:true }......: avg=38.67ms min=173.41µs med=7.49ms max=708.68ms p(90)=114.92ms p(95)=173.65ms
    http_req_failed...................: 0.00%   0 out of 67288
    http_reqs.........................: 67288   435.737928/s

    EXECUTION
    iteration_duration................: avg=6.42s   min=6.01s    med=6.39s  max=8.02s    p(90)=6.9s     p(95)=7.07s   
    iterations........................: 8411    54.467241/s
    vus...............................: 7       min=7              max=500
    vus_max...........................: 500     min=500            max=500

    NETWORK
    data_received.....................: 1.2 GB  7.9 MB/s
    data_sent.........................: 63 MB   410 kB/s




running (2m34.4s), 000/500 VUs, 8411 complete and 0 interrupted iterations
default ✓ [ 100% ] 000/500 VUs  2m30s
