
         /\      Grafana   /‾‾/  
    /\  /  \     |\  __   /  /   
   /  \/    \    | |/ /  /   ‾‾\ 
  /          \   |   (  |  (‾)  |
 / __________ \  |_|\_\  \_____/ 

     execution: local
        script: test/k6/presence.ts
        output: -

     scenarios: (100.00%) 1 scenario, 500 max VUs, 3m0s max duration (incl. graceful stop):
              * default: Up to 500 looping VUs for 2m30s over 3 stages (gracefulRampDown: 30s, gracefulStop: 30s)


running (0m00.9s), 008/500 VUs, 0 complete and 0 interrupted iterations
default   [   1% ] 008/500 VUs  0m00.9s/2m30.0s

running (0m01.9s), 016/500 VUs, 0 complete and 0 interrupted iterations
default   [   1% ] 016/500 VUs  0m01.9s/2m30.0s

running (0m02.9s), 024/500 VUs, 0 complete and 0 interrupted iterations
default   [   2% ] 024/500 VUs  0m02.9s/2m30.0s

running (0m03.9s), 033/500 VUs, 0 complete and 0 interrupted iterations
default   [   3% ] 033/500 VUs  0m03.9s/2m30.0s

running (0m04.9s), 041/500 VUs, 0 complete and 0 interrupted iterations
default   [   3% ] 041/500 VUs  0m04.9s/2m30.0s

running (0m05.9s), 049/500 VUs, 0 complete and 0 interrupted iterations
default   [   4% ] 049/500 VUs  0m05.9s/2m30.0s

running (0m06.9s), 058/500 VUs, 8 complete and 0 interrupted iterations
default   [   5% ] 058/500 VUs  0m06.9s/2m30.0s

running (0m07.9s), 066/500 VUs, 16 complete and 0 interrupted iterations
default   [   5% ] 066/500 VUs  0m07.9s/2m30.0s

running (0m08.9s), 074/500 VUs, 24 complete and 0 interrupted iterations
default   [   6% ] 074/500 VUs  0m08.9s/2m30.0s

running (0m09.9s), 083/500 VUs, 33 complete and 0 interrupted iterations
default   [   7% ] 083/500 VUs  0m09.9s/2m30.0s

running (0m10.9s), 091/500 VUs, 41 complete and 0 interrupted iterations
default   [   7% ] 091/500 VUs  0m10.9s/2m30.0s

running (0m11.9s), 099/500 VUs, 49 complete and 0 interrupted iterations
default   [   8% ] 099/500 VUs  0m11.9s/2m30.0s

running (0m12.9s), 108/500 VUs, 64 complete and 0 interrupted iterations
default   [   9% ] 108/500 VUs  0m12.9s/2m30.0s

running (0m13.9s), 116/500 VUs, 82 complete and 0 interrupted iterations
default   [   9% ] 116/500 VUs  0m13.9s/2m30.0s

running (0m14.9s), 124/500 VUs, 98 complete and 0 interrupted iterations
default   [  10% ] 124/500 VUs  0m14.9s/2m30.0s

running (0m15.9s), 133/500 VUs, 114 complete and 0 interrupted iterations
default   [  11% ] 133/500 VUs  0m15.9s/2m30.0s

running (0m16.9s), 141/500 VUs, 132 complete and 0 interrupted iterations
default   [  11% ] 141/500 VUs  0m16.9s/2m30.0s

running (0m17.9s), 149/500 VUs, 148 complete and 0 interrupted iterations
default   [  12% ] 149/500 VUs  0m17.9s/2m30.0s

running (0m18.9s), 158/500 VUs, 171 complete and 0 interrupted iterations
default   [  13% ] 158/500 VUs  0m18.9s/2m30.0s

running (0m19.9s), 166/500 VUs, 197 complete and 0 interrupted iterations
default   [  13% ] 166/500 VUs  0m19.9s/2m30.0s

running (0m20.9s), 174/500 VUs, 222 complete and 0 interrupted iterations
default   [  14% ] 174/500 VUs  0m20.9s/2m30.0s

running (0m21.9s), 183/500 VUs, 246 complete and 0 interrupted iterations
default   [  15% ] 183/500 VUs  0m21.9s/2m30.0s

running (0m22.9s), 191/500 VUs, 271 complete and 0 interrupted iterations
default   [  15% ] 191/500 VUs  0m22.9s/2m30.0s

running (0m23.9s), 199/500 VUs, 297 complete and 0 interrupted iterations
default   [  16% ] 199/500 VUs  0m23.9s/2m30.0s

running (0m24.9s), 207/500 VUs, 328 complete and 0 interrupted iterations
default   [  17% ] 207/500 VUs  0m24.9s/2m30.0s

running (0m25.9s), 216/500 VUs, 361 complete and 0 interrupted iterations
default   [  17% ] 216/500 VUs  0m25.9s/2m30.0s

running (0m26.9s), 224/500 VUs, 395 complete and 0 interrupted iterations
default   [  18% ] 224/500 VUs  0m26.9s/2m30.0s

running (0m27.9s), 232/500 VUs, 428 complete and 0 interrupted iterations
default   [  19% ] 232/500 VUs  0m27.9s/2m30.0s

running (0m28.9s), 241/500 VUs, 460 complete and 0 interrupted iterations
default   [  19% ] 241/500 VUs  0m28.9s/2m30.0s

running (0m29.9s), 249/500 VUs, 494 complete and 0 interrupted iterations
default   [  20% ] 249/500 VUs  0m29.9s/2m30.0s

running (0m30.9s), 257/500 VUs, 533 complete and 0 interrupted iterations
default   [  21% ] 257/500 VUs  0m30.9s/2m30.0s

running (0m31.9s), 266/500 VUs, 576 complete and 0 interrupted iterations
default   [  21% ] 266/500 VUs  0m31.9s/2m30.0s

running (0m32.9s), 274/500 VUs, 617 complete and 0 interrupted iterations
default   [  22% ] 274/500 VUs  0m32.9s/2m30.0s

running (0m33.9s), 282/500 VUs, 658 complete and 0 interrupted iterations
default   [  23% ] 282/500 VUs  0m33.9s/2m30.0s

running (0m34.9s), 291/500 VUs, 700 complete and 0 interrupted iterations
default   [  23% ] 291/500 VUs  0m34.9s/2m30.0s

running (0m35.9s), 299/500 VUs, 741 complete and 0 interrupted iterations
default   [  24% ] 299/500 VUs  0m35.9s/2m30.0s

running (0m36.9s), 307/500 VUs, 788 complete and 0 interrupted iterations
default   [  25% ] 307/500 VUs  0m36.9s/2m30.0s

running (0m37.9s), 316/500 VUs, 839 complete and 0 interrupted iterations
default   [  25% ] 316/500 VUs  0m37.9s/2m30.0s

running (0m38.9s), 324/500 VUs, 889 complete and 0 interrupted iterations
default   [  26% ] 324/500 VUs  0m38.9s/2m30.0s

running (0m39.9s), 332/500 VUs, 937 complete and 0 interrupted iterations
default   [  27% ] 332/500 VUs  0m39.9s/2m30.0s

running (0m40.9s), 341/500 VUs, 987 complete and 0 interrupted iterations
default   [  27% ] 341/500 VUs  0m40.9s/2m30.0s

running (0m41.9s), 349/500 VUs, 1035 complete and 0 interrupted iterations
default   [  28% ] 349/500 VUs  0m41.9s/2m30.0s

running (0m42.9s), 357/500 VUs, 1093 complete and 0 interrupted iterations
default   [  29% ] 357/500 VUs  0m42.9s/2m30.0s

running (0m43.9s), 365/500 VUs, 1150 complete and 0 interrupted iterations
default   [  29% ] 365/500 VUs  0m43.9s/2m30.0s

running (0m44.9s), 374/500 VUs, 1208 complete and 0 interrupted iterations
default   [  30% ] 374/500 VUs  0m44.9s/2m30.0s

running (0m45.9s), 382/500 VUs, 1266 complete and 0 interrupted iterations
default   [  31% ] 382/500 VUs  0m45.9s/2m30.0s

running (0m46.9s), 390/500 VUs, 1322 complete and 0 interrupted iterations
default   [  31% ] 390/500 VUs  0m46.9s/2m30.0s

running (0m47.9s), 399/500 VUs, 1381 complete and 0 interrupted iterations
default   [  32% ] 399/500 VUs  0m47.9s/2m30.0s

running (0m48.9s), 407/500 VUs, 1442 complete and 0 interrupted iterations
default   [  33% ] 407/500 VUs  0m48.9s/2m30.0s

running (0m49.9s), 415/500 VUs, 1500 complete and 0 interrupted iterations
default   [  33% ] 415/500 VUs  0m49.9s/2m30.0s

running (0m50.9s), 424/500 VUs, 1565 complete and 0 interrupted iterations
default   [  34% ] 424/500 VUs  0m50.9s/2m30.0s

running (0m51.9s), 432/500 VUs, 1623 complete and 0 interrupted iterations
default   [  35% ] 432/500 VUs  0m51.9s/2m30.0s

running (0m52.9s), 440/500 VUs, 1680 complete and 0 interrupted iterations
default   [  35% ] 440/500 VUs  0m52.9s/2m30.0s

running (0m53.9s), 449/500 VUs, 1746 complete and 0 interrupted iterations
default   [  36% ] 449/500 VUs  0m53.9s/2m30.0s

running (0m54.9s), 457/500 VUs, 1805 complete and 0 interrupted iterations
default   [  37% ] 457/500 VUs  0m54.9s/2m30.0s

running (0m55.9s), 465/500 VUs, 1873 complete and 0 interrupted iterations
default   [  37% ] 465/500 VUs  0m55.9s/2m30.0s

running (0m57.3s), 477/500 VUs, 1958 complete and 0 interrupted iterations
default   [  38% ] 477/500 VUs  0m57.3s/2m30.0s

running (0m57.9s), 482/500 VUs, 2008 complete and 0 interrupted iterations
default   [  39% ] 482/500 VUs  0m57.9s/2m30.0s

running (0m58.9s), 490/500 VUs, 2058 complete and 0 interrupted iterations
default   [  39% ] 490/500 VUs  0m58.9s/2m30.0s

running (0m59.9s), 499/500 VUs, 2127 complete and 0 interrupted iterations
default   [  40% ] 499/500 VUs  0m59.9s/2m30.0s

running (1m00.9s), 500/500 VUs, 2205 complete and 0 interrupted iterations
default   [  41% ] 500/500 VUs  1m00.9s/2m30.0s

running (1m01.9s), 500/500 VUs, 2270 complete and 0 interrupted iterations
default   [  41% ] 500/500 VUs  1m01.9s/2m30.0s

running (1m02.9s), 500/500 VUs, 2360 complete and 0 interrupted iterations
default   [  42% ] 500/500 VUs  1m02.9s/2m30.0s

running (1m03.9s), 500/500 VUs, 2380 complete and 0 interrupted iterations
default   [  43% ] 500/500 VUs  1m03.9s/2m30.0s

running (1m04.9s), 500/500 VUs, 2462 complete and 0 interrupted iterations
default   [  43% ] 500/500 VUs  1m04.9s/2m30.0s

running (1m05.9s), 500/500 VUs, 2529 complete and 0 interrupted iterations
default   [  44% ] 500/500 VUs  1m05.9s/2m30.0s

running (1m06.9s), 500/500 VUs, 2597 complete and 0 interrupted iterations
default   [  45% ] 500/500 VUs  1m06.9s/2m30.0s

running (1m07.9s), 500/500 VUs, 2696 complete and 0 interrupted iterations
default   [  45% ] 500/500 VUs  1m07.9s/2m30.0s

running (1m08.9s), 500/500 VUs, 2743 complete and 0 interrupted iterations
default   [  46% ] 500/500 VUs  1m08.9s/2m30.0s

running (1m09.9s), 500/500 VUs, 2833 complete and 0 interrupted iterations
default   [  47% ] 500/500 VUs  1m09.9s/2m30.0s

running (1m10.9s), 500/500 VUs, 2896 complete and 0 interrupted iterations
default   [  47% ] 500/500 VUs  1m10.9s/2m30.0s

running (1m12.0s), 500/500 VUs, 2942 complete and 0 interrupted iterations
default   [  48% ] 500/500 VUs  1m12.0s/2m30.0s

running (1m12.9s), 500/500 VUs, 3020 complete and 0 interrupted iterations
default   [  49% ] 500/500 VUs  1m12.9s/2m30.0s

running (1m13.9s), 500/500 VUs, 3070 complete and 0 interrupted iterations
default   [  49% ] 500/500 VUs  1m13.9s/2m30.0s

running (1m14.9s), 500/500 VUs, 3171 complete and 0 interrupted iterations
default   [  50% ] 500/500 VUs  1m14.9s/2m30.0s

running (1m15.9s), 500/500 VUs, 3226 complete and 0 interrupted iterations
default   [  51% ] 500/500 VUs  1m15.9s/2m30.0s

running (1m16.9s), 500/500 VUs, 3300 complete and 0 interrupted iterations
default   [  51% ] 500/500 VUs  1m16.9s/2m30.0s

running (1m17.9s), 500/500 VUs, 3368 complete and 0 interrupted iterations
default   [  52% ] 500/500 VUs  1m17.9s/2m30.0s

running (1m18.9s), 500/500 VUs, 3438 complete and 0 interrupted iterations
default   [  53% ] 500/500 VUs  1m18.9s/2m30.0s

running (1m19.9s), 500/500 VUs, 3513 complete and 0 interrupted iterations
default   [  53% ] 500/500 VUs  1m19.9s/2m30.0s

running (1m20.9s), 500/500 VUs, 3565 complete and 0 interrupted iterations
default   [  54% ] 500/500 VUs  1m20.9s/2m30.0s

running (1m22.3s), 500/500 VUs, 3669 complete and 0 interrupted iterations
default   [  55% ] 500/500 VUs  1m22.3s/2m30.0s

running (1m22.9s), 500/500 VUs, 3722 complete and 0 interrupted iterations
default   [  55% ] 500/500 VUs  1m22.9s/2m30.0s

running (1m23.9s), 500/500 VUs, 3792 complete and 0 interrupted iterations
default   [  56% ] 500/500 VUs  1m23.9s/2m30.0s

running (1m24.9s), 500/500 VUs, 3877 complete and 0 interrupted iterations
default   [  57% ] 500/500 VUs  1m24.9s/2m30.0s

running (1m25.9s), 500/500 VUs, 3913 complete and 0 interrupted iterations
default   [  57% ] 500/500 VUs  1m25.9s/2m30.0s

running (1m26.9s), 500/500 VUs, 4010 complete and 0 interrupted iterations
default   [  58% ] 500/500 VUs  1m26.9s/2m30.0s

running (1m27.9s), 500/500 VUs, 4058 complete and 0 interrupted iterations
default   [  59% ] 500/500 VUs  1m27.9s/2m30.0s

running (1m28.9s), 500/500 VUs, 4104 complete and 0 interrupted iterations
default   [  59% ] 500/500 VUs  1m28.9s/2m30.0s

running (1m29.9s), 500/500 VUs, 4206 complete and 0 interrupted iterations
default   [  60% ] 500/500 VUs  1m29.9s/2m30.0s

running (1m30.9s), 500/500 VUs, 4263 complete and 0 interrupted iterations
default   [  61% ] 500/500 VUs  1m30.9s/2m30.0s

running (1m31.9s), 500/500 VUs, 4333 complete and 0 interrupted iterations
default   [  61% ] 500/500 VUs  1m31.9s/2m30.0s

running (1m32.9s), 500/500 VUs, 4402 complete and 0 interrupted iterations
default   [  62% ] 500/500 VUs  1m32.9s/2m30.0s

running (1m33.9s), 500/500 VUs, 4499 complete and 0 interrupted iterations
default   [  63% ] 500/500 VUs  1m33.9s/2m30.0s

running (1m34.9s), 500/500 VUs, 4537 complete and 0 interrupted iterations
default   [  63% ] 500/500 VUs  1m34.9s/2m30.0s

running (1m35.9s), 500/500 VUs, 4601 complete and 0 interrupted iterations
default   [  64% ] 500/500 VUs  1m35.9s/2m30.0s

running (1m36.9s), 500/500 VUs, 4693 complete and 0 interrupted iterations
default   [  65% ] 500/500 VUs  1m36.9s/2m30.0s

running (1m38.3s), 500/500 VUs, 4814 complete and 0 interrupted iterations
default   [  66% ] 500/500 VUs  1m38.3s/2m30.0s

running (1m38.9s), 500/500 VUs, 4824 complete and 0 interrupted iterations
default   [  66% ] 500/500 VUs  1m38.9s/2m30.0s

running (1m39.9s), 500/500 VUs, 4911 complete and 0 interrupted iterations
default   [  67% ] 500/500 VUs  1m39.9s/2m30.0s

running (1m40.9s), 500/500 VUs, 4984 complete and 0 interrupted iterations
default   [  67% ] 500/500 VUs  1m40.9s/2m30.0s

running (1m41.9s), 500/500 VUs, 5058 complete and 0 interrupted iterations
default   [  68% ] 500/500 VUs  1m41.9s/2m30.0s

running (1m42.9s), 500/500 VUs, 5118 complete and 0 interrupted iterations
default   [  69% ] 500/500 VUs  1m42.9s/2m30.0s

running (1m43.9s), 500/500 VUs, 5170 complete and 0 interrupted iterations
default   [  69% ] 500/500 VUs  1m43.9s/2m30.0s

running (1m44.9s), 500/500 VUs, 5274 complete and 0 interrupted iterations
default   [  70% ] 500/500 VUs  1m44.9s/2m30.0s

running (1m45.9s), 500/500 VUs, 5337 complete and 0 interrupted iterations
default   [  71% ] 500/500 VUs  1m45.9s/2m30.0s

running (1m46.9s), 500/500 VUs, 5401 complete and 0 interrupted iterations
default   [  71% ] 500/500 VUs  1m46.9s/2m30.0s

running (1m47.9s), 500/500 VUs, 5458 complete and 0 interrupted iterations
default   [  72% ] 500/500 VUs  1m47.9s/2m30.0s

running (1m48.9s), 500/500 VUs, 5564 complete and 0 interrupted iterations
default   [  73% ] 500/500 VUs  1m48.9s/2m30.0s

running (1m49.9s), 500/500 VUs, 5623 complete and 0 interrupted iterations
default   [  73% ] 500/500 VUs  1m49.9s/2m30.0s

running (1m50.9s), 500/500 VUs, 5671 complete and 0 interrupted iterations
default   [  74% ] 500/500 VUs  1m50.9s/2m30.0s

running (1m52.2s), 500/500 VUs, 5759 complete and 0 interrupted iterations
default   [  75% ] 500/500 VUs  1m52.2s/2m30.0s

running (1m52.9s), 500/500 VUs, 5841 complete and 0 interrupted iterations
default   [  75% ] 500/500 VUs  1m52.9s/2m30.0s

running (1m53.9s), 500/500 VUs, 5895 complete and 0 interrupted iterations
default   [  76% ] 500/500 VUs  1m53.9s/2m30.0s

running (1m54.9s), 500/500 VUs, 5950 complete and 0 interrupted iterations
default   [  77% ] 500/500 VUs  1m54.9s/2m30.0s

running (1m55.9s), 500/500 VUs, 6055 complete and 0 interrupted iterations
default   [  77% ] 500/500 VUs  1m55.9s/2m30.0s

running (1m56.9s), 500/500 VUs, 6110 complete and 0 interrupted iterations
default   [  78% ] 500/500 VUs  1m56.9s/2m30.0s

running (1m57.9s), 500/500 VUs, 6169 complete and 0 interrupted iterations
default   [  79% ] 500/500 VUs  1m57.9s/2m30.0s

running (1m58.9s), 500/500 VUs, 6242 complete and 0 interrupted iterations
default   [  79% ] 500/500 VUs  1m58.9s/2m30.0s

running (1m59.9s), 500/500 VUs, 6325 complete and 0 interrupted iterations
default   [  80% ] 500/500 VUs  1m59.9s/2m30.0s

running (2m00.9s), 500/500 VUs, 6406 complete and 0 interrupted iterations
default   [  81% ] 500/500 VUs  2m00.9s/2m30.0s

running (2m01.9s), 498/500 VUs, 6443 complete and 0 interrupted iterations
default   [  81% ] 498/500 VUs  2m01.9s/2m30.0s

running (2m02.9s), 483/500 VUs, 6553 complete and 0 interrupted iterations
default   [  82% ] 483/500 VUs  2m02.9s/2m30.0s

running (2m03.9s), 475/500 VUs, 6615 complete and 0 interrupted iterations
default   [  83% ] 475/500 VUs  2m03.9s/2m30.0s

running (2m04.9s), 467/500 VUs, 6691 complete and 0 interrupted iterations
default   [  83% ] 467/500 VUs  2m04.9s/2m30.0s

running (2m05.9s), 453/500 VUs, 6756 complete and 0 interrupted iterations
default   [  84% ] 453/500 VUs  2m05.9s/2m30.0s

running (2m06.9s), 446/500 VUs, 6823 complete and 0 interrupted iterations
default   [  85% ] 446/500 VUs  2m06.9s/2m30.0s

running (2m08.2s), 424/500 VUs, 6927 complete and 0 interrupted iterations
default   [  85% ] 424/500 VUs  2m08.2s/2m30.0s

running (2m08.9s), 404/500 VUs, 6990 complete and 0 interrupted iterations
default   [  86% ] 404/500 VUs  2m08.9s/2m30.0s

running (2m09.9s), 393/500 VUs, 7039 complete and 0 interrupted iterations
default   [  87% ] 393/500 VUs  2m09.9s/2m30.0s

running (2m10.9s), 377/500 VUs, 7112 complete and 0 interrupted iterations
default   [  87% ] 377/500 VUs  2m10.9s/2m30.0s

running (2m11.9s), 356/500 VUs, 7185 complete and 0 interrupted iterations
default   [  88% ] 356/500 VUs  2m11.9s/2m30.0s

running (2m12.9s), 334/500 VUs, 7252 complete and 0 interrupted iterations
default   [  89% ] 334/500 VUs  2m12.9s/2m30.0s

running (2m13.9s), 318/500 VUs, 7341 complete and 0 interrupted iterations
default   [  89% ] 318/500 VUs  2m13.9s/2m30.0s

running (2m14.9s), 309/500 VUs, 7376 complete and 0 interrupted iterations
default   [  90% ] 309/500 VUs  2m14.9s/2m30.0s

running (2m15.9s), 300/500 VUs, 7425 complete and 0 interrupted iterations
default   [  91% ] 300/500 VUs  2m15.9s/2m30.0s

running (2m16.9s), 276/500 VUs, 7480 complete and 0 interrupted iterations
default   [  91% ] 276/500 VUs  2m16.9s/2m30.0s

running (2m17.9s), 256/500 VUs, 7538 complete and 0 interrupted iterations
default   [  92% ] 256/500 VUs  2m17.9s/2m30.0s

running (2m18.9s), 238/500 VUs, 7585 complete and 0 interrupted iterations
default   [  93% ] 238/500 VUs  2m18.9s/2m30.0s

running (2m19.9s), 210/500 VUs, 7657 complete and 0 interrupted iterations
default   [  93% ] 210/500 VUs  2m19.9s/2m30.0s

running (2m20.9s), 200/500 VUs, 7680 complete and 0 interrupted iterations
default   [  94% ] 200/500 VUs  2m20.9s/2m30.0s

running (2m21.9s), 188/500 VUs, 7725 complete and 0 interrupted iterations
default   [  95% ] 188/500 VUs  2m21.9s/2m30.0s

running (2m22.9s), 174/500 VUs, 7756 complete and 0 interrupted iterations
default   [  95% ] 174/500 VUs  2m22.9s/2m30.0s

running (2m23.9s), 155/500 VUs, 7791 complete and 0 interrupted iterations
default   [  96% ] 155/500 VUs  2m23.9s/2m30.0s

running (2m24.9s), 140/500 VUs, 7823 complete and 0 interrupted iterations
default   [  97% ] 140/500 VUs  2m24.9s/2m30.0s

running (2m25.9s), 116/500 VUs, 7866 complete and 0 interrupted iterations
default   [  97% ] 116/500 VUs  2m25.9s/2m30.0s

running (2m26.9s), 107/500 VUs, 7880 complete and 0 interrupted iterations
default   [  98% ] 107/500 VUs  2m26.9s/2m30.0s

running (2m27.9s), 084/500 VUs, 7913 complete and 0 interrupted iterations
default   [  99% ] 084/500 VUs  2m27.9s/2m30.0s

running (2m28.9s), 070/500 VUs, 7930 complete and 0 interrupted iterations
default   [  99% ] 070/500 VUs  2m28.9s/2m30.0s

running (2m29.9s), 055/500 VUs, 7945 complete and 0 interrupted iterations
default   [ 100% ] 055/500 VUs  2m29.9s/2m30.0s

running (2m30.9s), 037/500 VUs, 7963 complete and 0 interrupted iterations
default ↓ [ 100% ] 052/500 VUs  2m30s

running (2m31.9s), 019/500 VUs, 7981 complete and 0 interrupted iterations
default ↓ [ 100% ] 052/500 VUs  2m30s

running (2m32.9s), 014/500 VUs, 7986 complete and 0 interrupted iterations
default ↓ [ 100% ] 052/500 VUs  2m30s

running (2m33.9s), 003/500 VUs, 7997 complete and 0 interrupted iterations
default ↓ [ 100% ] 052/500 VUs  2m30s


  █ THRESHOLDS 

    active_clients_time
    ✓ 'p(95)<500' p(95)=87ms

    attach_documents_time
    ✓ 'p(95)<10000' p(95)=449ms

    deactivate_clients_time
    ✓ 'p(95)<10000' p(95)=542.04ms

    http_req_duration
    ✓ 'p(95)<10000' p(95)=297.85ms

    pushpulls_time
    ✓ 'p(95)<1000' p(95)=278ms

    transaction_success_rate
    ✓ 'rate>0.99' rate=100.00%

    transaction_time
    ✓ 'p(95)<30000' p(95)=7.71s


  █ TOTAL RESULTS 

    checks_total.......................: 128000  828.445547/s
    checks_succeeded...................: 100.00% 128000 out of 128000
    checks_failed......................: 0.00%   0 out of 128000

    ✓ status is 200
    ✓ response has valid body

    CUSTOM
    active_clients..........................................................: 8000    51.777847/s
    active_clients_success_rate.............................................: 100.00% 8000 out of 8000
    active_clients_time.....................................................: avg=17.89ms  min=1ms      med=5ms     max=526ms p(90)=53ms     p(95)=87ms    
    attach_documents........................................................: 8000    51.777847/s
    attach_documents_success_rate...........................................: 100.00% 8000 out of 8000
    attach_documents_time...................................................: avg=128.03ms min=3ms      med=90ms    max=1.07s p(90)=318ms    p(95)=449ms   
    deactivate_clients......................................................: 8000    51.777847/s
    deactivate_clients_success_rate.........................................: 100.00% 8000 out of 8000
    deactivate_clients_time.................................................: avg=159.6ms  min=4ms      med=106ms   max=1.06s p(90)=443ms    p(95)=542.04ms
    pushpulls...............................................................: 40000   258.889234/s
    pushpulls_success_rate..................................................: 100.00% 40000 out of 40000
    pushpulls_time..........................................................: avg=75.22ms  min=1ms      med=33ms    max=951ms p(90)=205ms    p(95)=278ms   
    transaction_success_rate................................................: 100.00% 8000 out of 8000
    transaction_time........................................................: avg=6.75s    min=6.02s    med=6.78s   max=9.05s p(90)=7.49s    p(95)=7.71s   

    HTTP
    http_req_duration.......................................................: avg=76.69ms  min=966.76µs med=24.24ms max=1.07s p(90)=214.18ms p(95)=297.85ms
      { expected_response:true }............................................: avg=76.69ms  min=966.76µs med=24.24ms max=1.07s p(90)=214.18ms p(95)=297.85ms
    http_req_failed.........................................................: 0.00%   0 out of 64000
    http_reqs...............................................................: 64000   414.222774/s

    EXECUTION
    iteration_duration......................................................: avg=6.75s    min=6.02s    med=6.78s   max=9.05s p(90)=7.49s    p(95)=7.71s   
    iterations..............................................................: 8000    51.777847/s
    vus.....................................................................: 3       min=3              max=500
    vus_max.................................................................: 500     min=500            max=500

    NETWORK
    data_received...........................................................: 1.1 GB  7.1 MB/s
    data_sent...............................................................: 60 MB   390 kB/s




running (2m34.5s), 000/500 VUs, 8000 complete and 0 interrupted iterations
default ✓ [ 100% ] 000/500 VUs  2m30s
