
         /\      Grafana   /‾‾/  
    /\  /  \     |\  __   /  /   
   /  \/    \    | |/ /  /   ‾‾\ 
  /          \   |   (  |  (‾)  |
 / __________ \  |_|\_\  \_____/ 

     execution: local
        script: test/k6/presence.ts
        output: -

     scenarios: (100.00%) 1 scenario, 500 max VUs, 3m0s max duration (incl. graceful stop):
              * default: Up to 500 looping VUs for 2m30s over 3 stages (gracefulRampDown: 30s, gracefulStop: 30s)


running (0m00.9s), 008/500 VUs, 0 complete and 0 interrupted iterations
default   [   1% ] 008/500 VUs  0m00.9s/2m30.0s

running (0m01.9s), 016/500 VUs, 0 complete and 0 interrupted iterations
default   [   1% ] 016/500 VUs  0m01.9s/2m30.0s

running (0m02.9s), 024/500 VUs, 0 complete and 0 interrupted iterations
default   [   2% ] 024/500 VUs  0m02.9s/2m30.0s

running (0m03.9s), 033/500 VUs, 0 complete and 0 interrupted iterations
default   [   3% ] 033/500 VUs  0m03.9s/2m30.0s

running (0m04.9s), 041/500 VUs, 0 complete and 0 interrupted iterations
default   [   3% ] 041/500 VUs  0m04.9s/2m30.0s

running (0m05.9s), 049/500 VUs, 0 complete and 0 interrupted iterations
default   [   4% ] 049/500 VUs  0m05.9s/2m30.0s

running (0m06.9s), 058/500 VUs, 8 complete and 0 interrupted iterations
default   [   5% ] 058/500 VUs  0m06.9s/2m30.0s

running (0m07.9s), 066/500 VUs, 16 complete and 0 interrupted iterations
default   [   5% ] 066/500 VUs  0m07.9s/2m30.0s

running (0m08.9s), 074/500 VUs, 24 complete and 0 interrupted iterations
default   [   6% ] 074/500 VUs  0m08.9s/2m30.0s

running (0m09.9s), 083/500 VUs, 33 complete and 0 interrupted iterations
default   [   7% ] 083/500 VUs  0m09.9s/2m30.0s

running (0m10.9s), 091/500 VUs, 41 complete and 0 interrupted iterations
default   [   7% ] 091/500 VUs  0m10.9s/2m30.0s

running (0m11.9s), 099/500 VUs, 49 complete and 0 interrupted iterations
default   [   8% ] 099/500 VUs  0m11.9s/2m30.0s

running (0m12.9s), 108/500 VUs, 64 complete and 0 interrupted iterations
default   [   9% ] 108/500 VUs  0m12.9s/2m30.0s

running (0m13.9s), 116/500 VUs, 82 complete and 0 interrupted iterations
default   [   9% ] 116/500 VUs  0m13.9s/2m30.0s

running (0m14.9s), 124/500 VUs, 98 complete and 0 interrupted iterations
default   [  10% ] 124/500 VUs  0m14.9s/2m30.0s

running (0m15.9s), 132/500 VUs, 114 complete and 0 interrupted iterations
default   [  11% ] 132/500 VUs  0m15.9s/2m30.0s

running (0m16.9s), 141/500 VUs, 132 complete and 0 interrupted iterations
default   [  11% ] 141/500 VUs  0m16.9s/2m30.0s

running (0m17.9s), 149/500 VUs, 148 complete and 0 interrupted iterations
default   [  12% ] 149/500 VUs  0m17.9s/2m30.0s

running (0m18.9s), 157/500 VUs, 171 complete and 0 interrupted iterations
default   [  13% ] 157/500 VUs  0m18.9s/2m30.0s

running (0m19.9s), 166/500 VUs, 198 complete and 0 interrupted iterations
default   [  13% ] 166/500 VUs  0m19.9s/2m30.0s

running (0m20.9s), 174/500 VUs, 222 complete and 0 interrupted iterations
default   [  14% ] 174/500 VUs  0m20.9s/2m30.0s

running (0m21.9s), 182/500 VUs, 246 complete and 0 interrupted iterations
default   [  15% ] 182/500 VUs  0m21.9s/2m30.0s

running (0m22.9s), 191/500 VUs, 271 complete and 0 interrupted iterations
default   [  15% ] 191/500 VUs  0m22.9s/2m30.0s

running (0m23.9s), 199/500 VUs, 297 complete and 0 interrupted iterations
default   [  16% ] 199/500 VUs  0m23.9s/2m30.0s

running (0m24.9s), 207/500 VUs, 328 complete and 0 interrupted iterations
default   [  17% ] 207/500 VUs  0m24.9s/2m30.0s

running (0m25.9s), 216/500 VUs, 360 complete and 0 interrupted iterations
default   [  17% ] 216/500 VUs  0m25.9s/2m30.0s

running (0m26.9s), 224/500 VUs, 396 complete and 0 interrupted iterations
default   [  18% ] 224/500 VUs  0m26.9s/2m30.0s

running (0m27.9s), 232/500 VUs, 428 complete and 0 interrupted iterations
default   [  19% ] 232/500 VUs  0m27.9s/2m30.0s

running (0m28.9s), 241/500 VUs, 460 complete and 0 interrupted iterations
default   [  19% ] 241/500 VUs  0m28.9s/2m30.0s

running (0m29.9s), 249/500 VUs, 495 complete and 0 interrupted iterations
default   [  20% ] 249/500 VUs  0m29.9s/2m30.0s

running (0m30.9s), 257/500 VUs, 535 complete and 0 interrupted iterations
default   [  21% ] 257/500 VUs  0m30.9s/2m30.0s

running (0m31.9s), 266/500 VUs, 575 complete and 0 interrupted iterations
default   [  21% ] 266/500 VUs  0m31.9s/2m30.0s

running (0m32.9s), 274/500 VUs, 618 complete and 0 interrupted iterations
default   [  22% ] 274/500 VUs  0m32.9s/2m30.0s

running (0m33.9s), 282/500 VUs, 660 complete and 0 interrupted iterations
default   [  23% ] 282/500 VUs  0m33.9s/2m30.0s

running (0m34.9s), 291/500 VUs, 700 complete and 0 interrupted iterations
default   [  23% ] 291/500 VUs  0m34.9s/2m30.0s

running (0m35.9s), 299/500 VUs, 742 complete and 0 interrupted iterations
default   [  24% ] 299/500 VUs  0m35.9s/2m30.0s

running (0m36.9s), 307/500 VUs, 792 complete and 0 interrupted iterations
default   [  25% ] 307/500 VUs  0m36.9s/2m30.0s

running (0m37.9s), 315/500 VUs, 840 complete and 0 interrupted iterations
default   [  25% ] 315/500 VUs  0m37.9s/2m30.0s

running (0m38.9s), 324/500 VUs, 889 complete and 0 interrupted iterations
default   [  26% ] 324/500 VUs  0m38.9s/2m30.0s

running (0m39.9s), 332/500 VUs, 940 complete and 0 interrupted iterations
default   [  27% ] 332/500 VUs  0m39.9s/2m30.0s

running (0m40.9s), 340/500 VUs, 990 complete and 0 interrupted iterations
default   [  27% ] 340/500 VUs  0m40.9s/2m30.0s

running (0m41.9s), 349/500 VUs, 1039 complete and 0 interrupted iterations
default   [  28% ] 349/500 VUs  0m41.9s/2m30.0s

running (0m42.9s), 357/500 VUs, 1094 complete and 0 interrupted iterations
default   [  29% ] 357/500 VUs  0m42.9s/2m30.0s

running (0m43.9s), 365/500 VUs, 1154 complete and 0 interrupted iterations
default   [  29% ] 365/500 VUs  0m43.9s/2m30.0s

running (0m44.9s), 374/500 VUs, 1210 complete and 0 interrupted iterations
default   [  30% ] 374/500 VUs  0m44.9s/2m30.0s

running (0m45.9s), 382/500 VUs, 1268 complete and 0 interrupted iterations
default   [  31% ] 382/500 VUs  0m45.9s/2m30.0s

running (0m46.9s), 390/500 VUs, 1325 complete and 0 interrupted iterations
default   [  31% ] 390/500 VUs  0m46.9s/2m30.0s

running (0m47.9s), 399/500 VUs, 1384 complete and 0 interrupted iterations
default   [  32% ] 399/500 VUs  0m47.9s/2m30.0s

running (0m48.9s), 407/500 VUs, 1445 complete and 0 interrupted iterations
default   [  33% ] 407/500 VUs  0m48.9s/2m30.0s

running (0m49.9s), 415/500 VUs, 1512 complete and 0 interrupted iterations
default   [  33% ] 415/500 VUs  0m49.9s/2m30.0s

running (0m50.9s), 424/500 VUs, 1575 complete and 0 interrupted iterations
default   [  34% ] 424/500 VUs  0m50.9s/2m30.0s

running (0m51.9s), 432/500 VUs, 1642 complete and 0 interrupted iterations
default   [  35% ] 432/500 VUs  0m51.9s/2m30.0s

running (0m52.9s), 440/500 VUs, 1707 complete and 0 interrupted iterations
default   [  35% ] 440/500 VUs  0m52.9s/2m30.0s

running (0m53.9s), 449/500 VUs, 1756 complete and 0 interrupted iterations
default   [  36% ] 449/500 VUs  0m53.9s/2m30.0s

running (0m54.9s), 457/500 VUs, 1824 complete and 0 interrupted iterations
default   [  37% ] 457/500 VUs  0m54.9s/2m30.0s

running (0m55.9s), 465/500 VUs, 1896 complete and 0 interrupted iterations
default   [  37% ] 465/500 VUs  0m55.9s/2m30.0s

running (0m56.9s), 473/500 VUs, 1955 complete and 0 interrupted iterations
default   [  38% ] 473/500 VUs  0m56.9s/2m30.0s

running (0m57.9s), 482/500 VUs, 2009 complete and 0 interrupted iterations
default   [  39% ] 482/500 VUs  0m57.9s/2m30.0s

running (0m58.9s), 490/500 VUs, 2083 complete and 0 interrupted iterations
default   [  39% ] 490/500 VUs  0m58.9s/2m30.0s

running (0m59.9s), 499/500 VUs, 2155 complete and 0 interrupted iterations
default   [  40% ] 499/500 VUs  0m59.9s/2m30.0s

running (1m00.9s), 500/500 VUs, 2216 complete and 0 interrupted iterations
default   [  41% ] 500/500 VUs  1m00.9s/2m30.0s

running (1m01.9s), 500/500 VUs, 2285 complete and 0 interrupted iterations
default   [  41% ] 500/500 VUs  1m01.9s/2m30.0s

running (1m03.0s), 500/500 VUs, 2381 complete and 0 interrupted iterations
default   [  42% ] 500/500 VUs  1m03.0s/2m30.0s

running (1m03.9s), 500/500 VUs, 2417 complete and 0 interrupted iterations
default   [  43% ] 500/500 VUs  1m03.9s/2m30.0s

running (1m04.9s), 500/500 VUs, 2493 complete and 0 interrupted iterations
default   [  43% ] 500/500 VUs  1m04.9s/2m30.0s

running (1m05.9s), 500/500 VUs, 2608 complete and 0 interrupted iterations
default   [  44% ] 500/500 VUs  1m05.9s/2m30.0s

running (1m06.9s), 500/500 VUs, 2685 complete and 0 interrupted iterations
default   [  45% ] 500/500 VUs  1m06.9s/2m30.0s

running (1m07.9s), 500/500 VUs, 2729 complete and 0 interrupted iterations
default   [  45% ] 500/500 VUs  1m07.9s/2m30.0s

running (1m08.9s), 500/500 VUs, 2825 complete and 0 interrupted iterations
default   [  46% ] 500/500 VUs  1m08.9s/2m30.0s

running (1m09.9s), 500/500 VUs, 2885 complete and 0 interrupted iterations
default   [  47% ] 500/500 VUs  1m09.9s/2m30.0s

running (1m10.9s), 500/500 VUs, 2933 complete and 0 interrupted iterations
default   [  47% ] 500/500 VUs  1m10.9s/2m30.0s

running (1m11.9s), 500/500 VUs, 3005 complete and 0 interrupted iterations
default   [  48% ] 500/500 VUs  1m11.9s/2m30.0s

running (1m12.9s), 500/500 VUs, 3097 complete and 0 interrupted iterations
default   [  49% ] 500/500 VUs  1m12.9s/2m30.0s

running (1m13.9s), 500/500 VUs, 3188 complete and 0 interrupted iterations
default   [  49% ] 500/500 VUs  1m13.9s/2m30.0s

running (1m14.9s), 500/500 VUs, 3226 complete and 0 interrupted iterations
default   [  50% ] 500/500 VUs  1m14.9s/2m30.0s

running (1m15.9s), 500/500 VUs, 3302 complete and 0 interrupted iterations
default   [  51% ] 500/500 VUs  1m15.9s/2m30.0s

running (1m16.9s), 500/500 VUs, 3392 complete and 0 interrupted iterations
default   [  51% ] 500/500 VUs  1m16.9s/2m30.0s

running (1m17.9s), 500/500 VUs, 3454 complete and 0 interrupted iterations
default   [  52% ] 500/500 VUs  1m17.9s/2m30.0s

running (1m18.9s), 500/500 VUs, 3525 complete and 0 interrupted iterations
default   [  53% ] 500/500 VUs  1m18.9s/2m30.0s

running (1m19.9s), 500/500 VUs, 3627 complete and 0 interrupted iterations
default   [  53% ] 500/500 VUs  1m19.9s/2m30.0s

running (1m20.9s), 500/500 VUs, 3679 complete and 0 interrupted iterations
default   [  54% ] 500/500 VUs  1m20.9s/2m30.0s

running (1m21.9s), 500/500 VUs, 3777 complete and 0 interrupted iterations
default   [  55% ] 500/500 VUs  1m21.9s/2m30.0s

running (1m22.9s), 500/500 VUs, 3840 complete and 0 interrupted iterations
default   [  55% ] 500/500 VUs  1m22.9s/2m30.0s

running (1m23.9s), 500/500 VUs, 3908 complete and 0 interrupted iterations
default   [  56% ] 500/500 VUs  1m23.9s/2m30.0s

running (1m24.9s), 500/500 VUs, 3975 complete and 0 interrupted iterations
default   [  57% ] 500/500 VUs  1m24.9s/2m30.0s

running (1m25.9s), 500/500 VUs, 4043 complete and 0 interrupted iterations
default   [  57% ] 500/500 VUs  1m25.9s/2m30.0s

running (1m27.0s), 500/500 VUs, 4131 complete and 0 interrupted iterations
default   [  58% ] 500/500 VUs  1m27.0s/2m30.0s

running (1m27.9s), 500/500 VUs, 4198 complete and 0 interrupted iterations
default   [  59% ] 500/500 VUs  1m27.9s/2m30.0s

running (1m28.9s), 500/500 VUs, 4277 complete and 0 interrupted iterations
default   [  59% ] 500/500 VUs  1m28.9s/2m30.0s

running (1m29.9s), 500/500 VUs, 4355 complete and 0 interrupted iterations
default   [  60% ] 500/500 VUs  1m29.9s/2m30.0s

running (1m30.9s), 500/500 VUs, 4410 complete and 0 interrupted iterations
default   [  61% ] 500/500 VUs  1m30.9s/2m30.0s

running (1m31.9s), 500/500 VUs, 4472 complete and 0 interrupted iterations
default   [  61% ] 500/500 VUs  1m31.9s/2m30.0s

running (1m32.9s), 500/500 VUs, 4558 complete and 0 interrupted iterations
default   [  62% ] 500/500 VUs  1m32.9s/2m30.0s

running (1m33.9s), 500/500 VUs, 4623 complete and 0 interrupted iterations
default   [  63% ] 500/500 VUs  1m33.9s/2m30.0s

running (1m34.9s), 500/500 VUs, 4702 complete and 0 interrupted iterations
default   [  63% ] 500/500 VUs  1m34.9s/2m30.0s

running (1m35.9s), 500/500 VUs, 4793 complete and 0 interrupted iterations
default   [  64% ] 500/500 VUs  1m35.9s/2m30.0s

running (1m36.9s), 500/500 VUs, 4842 complete and 0 interrupted iterations
default   [  65% ] 500/500 VUs  1m36.9s/2m30.0s

running (1m37.9s), 500/500 VUs, 4912 complete and 0 interrupted iterations
default   [  65% ] 500/500 VUs  1m37.9s/2m30.0s

running (1m38.9s), 500/500 VUs, 4974 complete and 0 interrupted iterations
default   [  66% ] 500/500 VUs  1m38.9s/2m30.0s

running (1m39.9s), 500/500 VUs, 5072 complete and 0 interrupted iterations
default   [  67% ] 500/500 VUs  1m39.9s/2m30.0s

running (1m40.9s), 500/500 VUs, 5125 complete and 0 interrupted iterations
default   [  67% ] 500/500 VUs  1m40.9s/2m30.0s

running (1m41.9s), 500/500 VUs, 5189 complete and 0 interrupted iterations
default   [  68% ] 500/500 VUs  1m41.9s/2m30.0s

running (1m43.1s), 500/500 VUs, 5284 complete and 0 interrupted iterations
default   [  69% ] 500/500 VUs  1m43.1s/2m30.0s

running (1m43.9s), 500/500 VUs, 5327 complete and 0 interrupted iterations
default   [  69% ] 500/500 VUs  1m43.9s/2m30.0s

running (1m44.9s), 500/500 VUs, 5384 complete and 0 interrupted iterations
default   [  70% ] 500/500 VUs  1m44.9s/2m30.0s

running (1m45.9s), 500/500 VUs, 5479 complete and 0 interrupted iterations
default   [  71% ] 500/500 VUs  1m45.9s/2m30.0s

running (1m46.9s), 500/500 VUs, 5537 complete and 0 interrupted iterations
default   [  71% ] 500/500 VUs  1m46.9s/2m30.0s

running (1m48.0s), 500/500 VUs, 5620 complete and 0 interrupted iterations
default   [  72% ] 500/500 VUs  1m48.0s/2m30.0s

running (1m48.9s), 500/500 VUs, 5720 complete and 0 interrupted iterations
default   [  73% ] 500/500 VUs  1m48.9s/2m30.0s

running (1m49.9s), 500/500 VUs, 5763 complete and 0 interrupted iterations
default   [  73% ] 500/500 VUs  1m49.9s/2m30.0s

running (1m50.9s), 500/500 VUs, 5843 complete and 0 interrupted iterations
default   [  74% ] 500/500 VUs  1m50.9s/2m30.0s

running (1m51.9s), 500/500 VUs, 5939 complete and 0 interrupted iterations
default   [  75% ] 500/500 VUs  1m51.9s/2m30.0s

running (1m52.9s), 500/500 VUs, 5990 complete and 0 interrupted iterations
default   [  75% ] 500/500 VUs  1m52.9s/2m30.0s

running (1m53.9s), 500/500 VUs, 6065 complete and 0 interrupted iterations
default   [  76% ] 500/500 VUs  1m53.9s/2m30.0s

running (1m54.9s), 500/500 VUs, 6155 complete and 0 interrupted iterations
default   [  77% ] 500/500 VUs  1m54.9s/2m30.0s

running (1m55.9s), 500/500 VUs, 6224 complete and 0 interrupted iterations
default   [  77% ] 500/500 VUs  1m55.9s/2m30.0s

running (1m56.9s), 500/500 VUs, 6285 complete and 0 interrupted iterations
default   [  78% ] 500/500 VUs  1m56.9s/2m30.0s

running (1m57.9s), 500/500 VUs, 6356 complete and 0 interrupted iterations
default   [  79% ] 500/500 VUs  1m57.9s/2m30.0s

running (1m58.9s), 500/500 VUs, 6453 complete and 0 interrupted iterations
default   [  79% ] 500/500 VUs  1m58.9s/2m30.0s

running (1m59.9s), 500/500 VUs, 6493 complete and 0 interrupted iterations
default   [  80% ] 500/500 VUs  1m59.9s/2m30.0s

running (2m00.9s), 499/500 VUs, 6570 complete and 0 interrupted iterations
default   [  81% ] 499/500 VUs  2m00.9s/2m30.0s

running (2m02.0s), 493/500 VUs, 6676 complete and 0 interrupted iterations
default   [  81% ] 493/500 VUs  2m02.0s/2m30.0s

running (2m02.9s), 491/500 VUs, 6732 complete and 0 interrupted iterations
default   [  82% ] 491/500 VUs  2m02.9s/2m30.0s

running (2m03.9s), 485/500 VUs, 6791 complete and 0 interrupted iterations
default   [  83% ] 485/500 VUs  2m03.9s/2m30.0s

running (2m04.9s), 470/500 VUs, 6908 complete and 0 interrupted iterations
default   [  83% ] 470/500 VUs  2m04.9s/2m30.0s

running (2m05.9s), 455/500 VUs, 6973 complete and 0 interrupted iterations
default   [  84% ] 455/500 VUs  2m05.9s/2m30.0s

running (2m06.9s), 442/500 VUs, 7041 complete and 0 interrupted iterations
default   [  85% ] 442/500 VUs  2m06.9s/2m30.0s

running (2m07.9s), 420/500 VUs, 7134 complete and 0 interrupted iterations
default   [  85% ] 420/500 VUs  2m07.9s/2m30.0s

running (2m08.9s), 399/500 VUs, 7216 complete and 0 interrupted iterations
default   [  86% ] 399/500 VUs  2m08.9s/2m30.0s

running (2m09.9s), 391/500 VUs, 7272 complete and 0 interrupted iterations
default   [  87% ] 391/500 VUs  2m09.9s/2m30.0s

running (2m10.9s), 365/500 VUs, 7363 complete and 0 interrupted iterations
default   [  87% ] 365/500 VUs  2m10.9s/2m30.0s

running (2m11.9s), 348/500 VUs, 7419 complete and 0 interrupted iterations
default   [  88% ] 348/500 VUs  2m11.9s/2m30.0s

running (2m12.9s), 337/500 VUs, 7482 complete and 0 interrupted iterations
default   [  89% ] 337/500 VUs  2m12.9s/2m30.0s

running (2m13.9s), 315/500 VUs, 7550 complete and 0 interrupted iterations
default   [  89% ] 315/500 VUs  2m13.9s/2m30.0s

running (2m14.9s), 305/500 VUs, 7602 complete and 0 interrupted iterations
default   [  90% ] 305/500 VUs  2m14.9s/2m30.0s

running (2m15.9s), 289/500 VUs, 7660 complete and 0 interrupted iterations
default   [  91% ] 289/500 VUs  2m15.9s/2m30.0s

running (2m16.9s), 268/500 VUs, 7727 complete and 0 interrupted iterations
default   [  91% ] 268/500 VUs  2m16.9s/2m30.0s

running (2m17.9s), 260/500 VUs, 7766 complete and 0 interrupted iterations
default   [  92% ] 260/500 VUs  2m17.9s/2m30.0s

running (2m18.9s), 238/500 VUs, 7818 complete and 0 interrupted iterations
default   [  93% ] 238/500 VUs  2m18.9s/2m30.0s

running (2m19.9s), 218/500 VUs, 7865 complete and 0 interrupted iterations
default   [  93% ] 218/500 VUs  2m19.9s/2m30.0s

running (2m20.9s), 203/500 VUs, 7907 complete and 0 interrupted iterations
default   [  94% ] 203/500 VUs  2m20.9s/2m30.0s

running (2m21.9s), 187/500 VUs, 7948 complete and 0 interrupted iterations
default   [  95% ] 187/500 VUs  2m21.9s/2m30.0s

running (2m22.9s), 171/500 VUs, 7993 complete and 0 interrupted iterations
default   [  95% ] 171/500 VUs  2m22.9s/2m30.0s

running (2m23.9s), 155/500 VUs, 8025 complete and 0 interrupted iterations
default   [  96% ] 155/500 VUs  2m23.9s/2m30.0s

running (2m24.9s), 137/500 VUs, 8056 complete and 0 interrupted iterations
default   [  97% ] 137/500 VUs  2m24.9s/2m30.0s

running (2m25.9s), 120/500 VUs, 8082 complete and 0 interrupted iterations
default   [  97% ] 120/500 VUs  2m25.9s/2m30.0s

running (2m26.9s), 098/500 VUs, 8110 complete and 0 interrupted iterations
default   [  98% ] 098/500 VUs  2m26.9s/2m30.0s

running (2m27.9s), 084/500 VUs, 8134 complete and 0 interrupted iterations
default   [  99% ] 084/500 VUs  2m27.9s/2m30.0s

running (2m28.9s), 062/500 VUs, 8162 complete and 0 interrupted iterations
default   [  99% ] 062/500 VUs  2m28.9s/2m30.0s

running (2m29.9s), 047/500 VUs, 8179 complete and 0 interrupted iterations
default   [ 100% ] 047/500 VUs  2m29.9s/2m30.0s

running (2m30.9s), 033/500 VUs, 8193 complete and 0 interrupted iterations
default ↓ [ 100% ] 045/500 VUs  2m30s

running (2m31.9s), 024/500 VUs, 8202 complete and 0 interrupted iterations
default ↓ [ 100% ] 045/500 VUs  2m30s

running (2m32.9s), 018/500 VUs, 8208 complete and 0 interrupted iterations
default ↓ [ 100% ] 045/500 VUs  2m30s

running (2m33.9s), 009/500 VUs, 8217 complete and 0 interrupted iterations
default ↓ [ 100% ] 045/500 VUs  2m30s

running (2m34.9s), 003/500 VUs, 8223 complete and 0 interrupted iterations
default ↓ [ 100% ] 045/500 VUs  2m30s


  █ THRESHOLDS 

    active_clients_time
    ✓ 'p(95)<500' p(95)=130.75ms

    attach_documents_time
    ✓ 'p(95)<10000' p(95)=495ms

    deactivate_clients_time
    ✓ 'p(95)<10000' p(95)=146ms

    http_req_duration
    ✓ 'p(95)<10000' p(95)=245.72ms

    pushpulls_time
    ✓ 'p(95)<1000' p(95)=290ms

    transaction_success_rate
    ✓ 'rate>0.99' rate=100.00%

    transaction_time
    ✓ 'p(95)<30000' p(95)=7.42s


  █ TOTAL RESULTS 

    checks_total.......: 131616  848.58834/s
    checks_succeeded...: 100.00% 131616 out of 131616
    checks_failed......: 0.00%   0 out of 131616

    ✓ status is 200
    ✓ response has valid body

    CUSTOM
    active_clients....................: 8226    53.036771/s
    active_clients_success_rate.......: 100.00% 8226 out of 8226
    active_clients_time...............: avg=27.36ms  min=1ms   med=6ms     max=554ms    p(90)=83ms    p(95)=130.75ms
    attach_documents..................: 8226    53.036771/s
    attach_documents_success_rate.....: 100.00% 8226 out of 8226
    attach_documents_time.............: avg=109.28ms min=3ms   med=24ms    max=1.07s    p(90)=355.5ms p(95)=495ms   
    deactivate_clients................: 8226    53.036771/s
    deactivate_clients_success_rate...: 100.00% 8226 out of 8226
    deactivate_clients_time...........: avg=27.33ms  min=0s    med=4ms     max=758ms    p(90)=78.5ms  p(95)=146ms   
    pushpulls.........................: 41130   265.183856/s
    pushpulls_success_rate............: 100.00% 41130 out of 41130
    pushpulls_time....................: avg=66.39ms  min=1ms   med=20ms    max=916ms    p(90)=198ms   p(95)=290ms   
    transaction_success_rate..........: 100.00% 8226 out of 8226
    transaction_time..................: avg=6.56s    min=6.01s med=6.52s   max=8.77s    p(90)=7.21s   p(95)=7.42s   

    HTTP
    http_req_duration.................: avg=53.19ms  min=495µs med=10.95ms max=991.71ms p(90)=162.9ms p(95)=245.72ms
      { expected_response:true }......: avg=53.19ms  min=495µs med=10.95ms max=991.71ms p(90)=162.9ms p(95)=245.72ms
    http_req_failed...................: 0.00%   0 out of 65808
    http_reqs.........................: 65808   424.29417/s

    EXECUTION
    iteration_duration................: avg=6.56s    min=6.01s med=6.52s   max=8.77s    p(90)=7.21s   p(95)=7.42s   
    iterations........................: 8226    53.036771/s
    vus...............................: 3       min=3              max=500
    vus_max...........................: 500     min=500            max=500

    NETWORK
    data_received.....................: 1.2 GB  7.7 MB/s
    data_sent.........................: 62 MB   399 kB/s




running (2m35.1s), 000/500 VUs, 8226 complete and 0 interrupted iterations
default ✓ [ 100% ] 000/500 VUs  2m30s
