
         /\      Grafana   /‾‾/  
    /\  /  \     |\  __   /  /   
   /  \/    \    | |/ /  /   ‾‾\ 
  /          \   |   (  |  (‾)  |
 / __________ \  |_|\_\  \_____/ 

     execution: local
        script: test/k6/presence.ts
        output: -

     scenarios: (100.00%) 1 scenario, 500 max VUs, 3m0s max duration (incl. graceful stop):
              * default: Up to 500 looping VUs for 2m30s over 3 stages (gracefulRampDown: 30s, gracefulStop: 30s)


running (0m00.9s), 008/500 VUs, 0 complete and 0 interrupted iterations
default   [   1% ] 008/500 VUs  0m00.9s/2m30.0s

running (0m01.9s), 016/500 VUs, 0 complete and 0 interrupted iterations
default   [   1% ] 016/500 VUs  0m01.9s/2m30.0s

running (0m02.9s), 024/500 VUs, 0 complete and 0 interrupted iterations
default   [   2% ] 024/500 VUs  0m02.9s/2m30.0s

running (0m03.9s), 033/500 VUs, 0 complete and 0 interrupted iterations
default   [   3% ] 033/500 VUs  0m03.9s/2m30.0s

running (0m04.9s), 041/500 VUs, 0 complete and 0 interrupted iterations
default   [   3% ] 041/500 VUs  0m04.9s/2m30.0s

running (0m05.9s), 049/500 VUs, 0 complete and 0 interrupted iterations
default   [   4% ] 049/500 VUs  0m05.9s/2m30.0s

running (0m06.9s), 058/500 VUs, 7 complete and 0 interrupted iterations
default   [   5% ] 058/500 VUs  0m06.9s/2m30.0s

running (0m07.9s), 066/500 VUs, 16 complete and 0 interrupted iterations
default   [   5% ] 066/500 VUs  0m07.9s/2m30.0s

running (0m08.9s), 074/500 VUs, 24 complete and 0 interrupted iterations
default   [   6% ] 074/500 VUs  0m08.9s/2m30.0s

running (0m09.9s), 083/500 VUs, 33 complete and 0 interrupted iterations
default   [   7% ] 083/500 VUs  0m09.9s/2m30.0s

running (0m10.9s), 091/500 VUs, 41 complete and 0 interrupted iterations
default   [   7% ] 091/500 VUs  0m10.9s/2m30.0s

running (0m11.9s), 099/500 VUs, 49 complete and 0 interrupted iterations
default   [   8% ] 099/500 VUs  0m11.9s/2m30.0s

running (0m12.9s), 108/500 VUs, 65 complete and 0 interrupted iterations
default   [   9% ] 108/500 VUs  0m12.9s/2m30.0s

running (0m13.9s), 116/500 VUs, 82 complete and 0 interrupted iterations
default   [   9% ] 116/500 VUs  0m13.9s/2m30.0s

running (0m14.9s), 124/500 VUs, 98 complete and 0 interrupted iterations
default   [  10% ] 124/500 VUs  0m14.9s/2m30.0s

running (0m15.9s), 133/500 VUs, 114 complete and 0 interrupted iterations
default   [  11% ] 133/500 VUs  0m15.9s/2m30.0s

running (0m16.9s), 141/500 VUs, 132 complete and 0 interrupted iterations
default   [  11% ] 141/500 VUs  0m16.9s/2m30.0s

running (0m17.9s), 149/500 VUs, 148 complete and 0 interrupted iterations
default   [  12% ] 149/500 VUs  0m17.9s/2m30.0s

running (0m18.9s), 157/500 VUs, 171 complete and 0 interrupted iterations
default   [  13% ] 157/500 VUs  0m18.9s/2m30.0s

running (0m19.9s), 166/500 VUs, 198 complete and 0 interrupted iterations
default   [  13% ] 166/500 VUs  0m19.9s/2m30.0s

running (0m20.9s), 174/500 VUs, 222 complete and 0 interrupted iterations
default   [  14% ] 174/500 VUs  0m20.9s/2m30.0s

running (0m21.9s), 182/500 VUs, 246 complete and 0 interrupted iterations
default   [  15% ] 182/500 VUs  0m21.9s/2m30.0s

running (0m22.9s), 191/500 VUs, 272 complete and 0 interrupted iterations
default   [  15% ] 191/500 VUs  0m22.9s/2m30.0s

running (0m23.9s), 199/500 VUs, 297 complete and 0 interrupted iterations
default   [  16% ] 199/500 VUs  0m23.9s/2m30.0s

running (0m24.9s), 207/500 VUs, 328 complete and 0 interrupted iterations
default   [  17% ] 207/500 VUs  0m24.9s/2m30.0s

running (0m25.9s), 216/500 VUs, 362 complete and 0 interrupted iterations
default   [  17% ] 216/500 VUs  0m25.9s/2m30.0s

running (0m26.9s), 224/500 VUs, 396 complete and 0 interrupted iterations
default   [  18% ] 224/500 VUs  0m26.9s/2m30.0s

running (0m27.9s), 232/500 VUs, 428 complete and 0 interrupted iterations
default   [  19% ] 232/500 VUs  0m27.9s/2m30.0s

running (0m28.9s), 241/500 VUs, 461 complete and 0 interrupted iterations
default   [  19% ] 241/500 VUs  0m28.9s/2m30.0s

running (0m29.9s), 249/500 VUs, 496 complete and 0 interrupted iterations
default   [  20% ] 249/500 VUs  0m29.9s/2m30.0s

running (0m30.9s), 257/500 VUs, 535 complete and 0 interrupted iterations
default   [  21% ] 257/500 VUs  0m30.9s/2m30.0s

running (0m31.9s), 266/500 VUs, 575 complete and 0 interrupted iterations
default   [  21% ] 266/500 VUs  0m31.9s/2m30.0s

running (0m32.9s), 274/500 VUs, 620 complete and 0 interrupted iterations
default   [  22% ] 274/500 VUs  0m32.9s/2m30.0s

running (0m33.9s), 282/500 VUs, 660 complete and 0 interrupted iterations
default   [  23% ] 282/500 VUs  0m33.9s/2m30.0s

running (0m34.9s), 291/500 VUs, 700 complete and 0 interrupted iterations
default   [  23% ] 291/500 VUs  0m34.9s/2m30.0s

running (0m35.9s), 299/500 VUs, 742 complete and 0 interrupted iterations
default   [  24% ] 299/500 VUs  0m35.9s/2m30.0s

running (0m36.9s), 307/500 VUs, 791 complete and 0 interrupted iterations
default   [  25% ] 307/500 VUs  0m36.9s/2m30.0s

running (0m37.9s), 316/500 VUs, 840 complete and 0 interrupted iterations
default   [  25% ] 316/500 VUs  0m37.9s/2m30.0s

running (0m38.9s), 324/500 VUs, 890 complete and 0 interrupted iterations
default   [  26% ] 324/500 VUs  0m38.9s/2m30.0s

running (0m39.9s), 332/500 VUs, 940 complete and 0 interrupted iterations
default   [  27% ] 332/500 VUs  0m39.9s/2m30.0s

running (0m40.9s), 340/500 VUs, 990 complete and 0 interrupted iterations
default   [  27% ] 340/500 VUs  0m40.9s/2m30.0s

running (0m41.9s), 349/500 VUs, 1038 complete and 0 interrupted iterations
default   [  28% ] 349/500 VUs  0m41.9s/2m30.0s

running (0m42.9s), 357/500 VUs, 1093 complete and 0 interrupted iterations
default   [  29% ] 357/500 VUs  0m42.9s/2m30.0s

running (0m43.9s), 365/500 VUs, 1153 complete and 0 interrupted iterations
default   [  29% ] 365/500 VUs  0m43.9s/2m30.0s

running (0m44.9s), 374/500 VUs, 1211 complete and 0 interrupted iterations
default   [  30% ] 374/500 VUs  0m44.9s/2m30.0s

running (0m45.9s), 382/500 VUs, 1268 complete and 0 interrupted iterations
default   [  31% ] 382/500 VUs  0m45.9s/2m30.0s

running (0m46.9s), 390/500 VUs, 1324 complete and 0 interrupted iterations
default   [  31% ] 390/500 VUs  0m46.9s/2m30.0s

running (0m47.9s), 399/500 VUs, 1384 complete and 0 interrupted iterations
default   [  32% ] 399/500 VUs  0m47.9s/2m30.0s

running (0m48.9s), 407/500 VUs, 1449 complete and 0 interrupted iterations
default   [  33% ] 407/500 VUs  0m48.9s/2m30.0s

running (0m49.9s), 415/500 VUs, 1517 complete and 0 interrupted iterations
default   [  33% ] 415/500 VUs  0m49.9s/2m30.0s

running (0m50.9s), 424/500 VUs, 1583 complete and 0 interrupted iterations
default   [  34% ] 424/500 VUs  0m50.9s/2m30.0s

running (0m51.9s), 432/500 VUs, 1650 complete and 0 interrupted iterations
default   [  35% ] 432/500 VUs  0m51.9s/2m30.0s

running (0m52.9s), 440/500 VUs, 1714 complete and 0 interrupted iterations
default   [  35% ] 440/500 VUs  0m52.9s/2m30.0s

running (0m53.9s), 448/500 VUs, 1779 complete and 0 interrupted iterations
default   [  36% ] 448/500 VUs  0m53.9s/2m30.0s

running (0m54.9s), 457/500 VUs, 1842 complete and 0 interrupted iterations
default   [  37% ] 457/500 VUs  0m54.9s/2m30.0s

running (0m55.9s), 465/500 VUs, 1918 complete and 0 interrupted iterations
default   [  37% ] 465/500 VUs  0m55.9s/2m30.0s

running (0m56.9s), 473/500 VUs, 1983 complete and 0 interrupted iterations
default   [  38% ] 473/500 VUs  0m56.9s/2m30.0s

running (0m57.9s), 482/500 VUs, 2048 complete and 0 interrupted iterations
default   [  39% ] 482/500 VUs  0m57.9s/2m30.0s

running (0m58.9s), 490/500 VUs, 2118 complete and 0 interrupted iterations
default   [  39% ] 490/500 VUs  0m58.9s/2m30.0s

running (0m59.9s), 498/500 VUs, 2197 complete and 0 interrupted iterations
default   [  40% ] 498/500 VUs  0m59.9s/2m30.0s

running (1m00.9s), 500/500 VUs, 2260 complete and 0 interrupted iterations
default   [  41% ] 500/500 VUs  1m00.9s/2m30.0s

running (1m01.9s), 500/500 VUs, 2319 complete and 0 interrupted iterations
default   [  41% ] 500/500 VUs  1m01.9s/2m30.0s

running (1m02.9s), 500/500 VUs, 2416 complete and 0 interrupted iterations
default   [  42% ] 500/500 VUs  1m02.9s/2m30.0s

running (1m03.9s), 500/500 VUs, 2510 complete and 0 interrupted iterations
default   [  43% ] 500/500 VUs  1m03.9s/2m30.0s

running (1m04.9s), 500/500 VUs, 2585 complete and 0 interrupted iterations
default   [  43% ] 500/500 VUs  1m04.9s/2m30.0s

running (1m05.9s), 500/500 VUs, 2628 complete and 0 interrupted iterations
default   [  44% ] 500/500 VUs  1m05.9s/2m30.0s

running (1m06.9s), 500/500 VUs, 2728 complete and 0 interrupted iterations
default   [  45% ] 500/500 VUs  1m06.9s/2m30.0s

running (1m07.9s), 500/500 VUs, 2790 complete and 0 interrupted iterations
default   [  45% ] 500/500 VUs  1m07.9s/2m30.0s

running (1m08.9s), 500/500 VUs, 2870 complete and 0 interrupted iterations
default   [  46% ] 500/500 VUs  1m08.9s/2m30.0s

running (1m09.9s), 500/500 VUs, 2923 complete and 0 interrupted iterations
default   [  47% ] 500/500 VUs  1m09.9s/2m30.0s

running (1m10.9s), 500/500 VUs, 3004 complete and 0 interrupted iterations
default   [  47% ] 500/500 VUs  1m10.9s/2m30.0s

running (1m11.9s), 500/500 VUs, 3066 complete and 0 interrupted iterations
default   [  48% ] 500/500 VUs  1m11.9s/2m30.0s

running (1m12.9s), 500/500 VUs, 3160 complete and 0 interrupted iterations
default   [  49% ] 500/500 VUs  1m12.9s/2m30.0s

running (1m13.9s), 500/500 VUs, 3258 complete and 0 interrupted iterations
default   [  49% ] 500/500 VUs  1m13.9s/2m30.0s

running (1m14.9s), 500/500 VUs, 3302 complete and 0 interrupted iterations
default   [  50% ] 500/500 VUs  1m14.9s/2m30.0s

running (1m15.9s), 500/500 VUs, 3402 complete and 0 interrupted iterations
default   [  51% ] 500/500 VUs  1m15.9s/2m30.0s

running (1m16.9s), 500/500 VUs, 3491 complete and 0 interrupted iterations
default   [  51% ] 500/500 VUs  1m16.9s/2m30.0s

running (1m17.9s), 500/500 VUs, 3547 complete and 0 interrupted iterations
default   [  52% ] 500/500 VUs  1m17.9s/2m30.0s

running (1m18.9s), 500/500 VUs, 3644 complete and 0 interrupted iterations
default   [  53% ] 500/500 VUs  1m18.9s/2m30.0s

running (1m19.9s), 500/500 VUs, 3730 complete and 0 interrupted iterations
default   [  53% ] 500/500 VUs  1m19.9s/2m30.0s

running (1m20.9s), 500/500 VUs, 3797 complete and 0 interrupted iterations
default   [  54% ] 500/500 VUs  1m20.9s/2m30.0s

running (1m21.9s), 500/500 VUs, 3851 complete and 0 interrupted iterations
default   [  55% ] 500/500 VUs  1m21.9s/2m30.0s

running (1m22.9s), 500/500 VUs, 3944 complete and 0 interrupted iterations
default   [  55% ] 500/500 VUs  1m22.9s/2m30.0s

running (1m23.9s), 500/500 VUs, 4027 complete and 0 interrupted iterations
default   [  56% ] 500/500 VUs  1m23.9s/2m30.0s

running (1m24.9s), 500/500 VUs, 4112 complete and 0 interrupted iterations
default   [  57% ] 500/500 VUs  1m24.9s/2m30.0s

running (1m25.9s), 500/500 VUs, 4180 complete and 0 interrupted iterations
default   [  57% ] 500/500 VUs  1m25.9s/2m30.0s

running (1m26.9s), 500/500 VUs, 4273 complete and 0 interrupted iterations
default   [  58% ] 500/500 VUs  1m26.9s/2m30.0s

running (1m27.9s), 500/500 VUs, 4321 complete and 0 interrupted iterations
default   [  59% ] 500/500 VUs  1m27.9s/2m30.0s

running (1m28.9s), 500/500 VUs, 4406 complete and 0 interrupted iterations
default   [  59% ] 500/500 VUs  1m28.9s/2m30.0s

running (1m29.9s), 500/500 VUs, 4463 complete and 0 interrupted iterations
default   [  60% ] 500/500 VUs  1m29.9s/2m30.0s

running (1m30.9s), 500/500 VUs, 4544 complete and 0 interrupted iterations
default   [  61% ] 500/500 VUs  1m30.9s/2m30.0s

running (1m31.9s), 500/500 VUs, 4620 complete and 0 interrupted iterations
default   [  61% ] 500/500 VUs  1m31.9s/2m30.0s

running (1m32.9s), 500/500 VUs, 4715 complete and 0 interrupted iterations
default   [  62% ] 500/500 VUs  1m32.9s/2m30.0s

running (1m33.9s), 500/500 VUs, 4788 complete and 0 interrupted iterations
default   [  63% ] 500/500 VUs  1m33.9s/2m30.0s

running (1m34.9s), 500/500 VUs, 4852 complete and 0 interrupted iterations
default   [  63% ] 500/500 VUs  1m34.9s/2m30.0s

running (1m35.9s), 500/500 VUs, 4941 complete and 0 interrupted iterations
default   [  64% ] 500/500 VUs  1m35.9s/2m30.0s

running (1m36.9s), 500/500 VUs, 5028 complete and 0 interrupted iterations
default   [  65% ] 500/500 VUs  1m36.9s/2m30.0s

running (1m37.9s), 500/500 VUs, 5106 complete and 0 interrupted iterations
default   [  65% ] 500/500 VUs  1m37.9s/2m30.0s

running (1m38.9s), 500/500 VUs, 5155 complete and 0 interrupted iterations
default   [  66% ] 500/500 VUs  1m38.9s/2m30.0s

running (1m39.9s), 500/500 VUs, 5252 complete and 0 interrupted iterations
default   [  67% ] 500/500 VUs  1m39.9s/2m30.0s

running (1m40.9s), 500/500 VUs, 5334 complete and 0 interrupted iterations
default   [  67% ] 500/500 VUs  1m40.9s/2m30.0s

running (1m41.9s), 500/500 VUs, 5422 complete and 0 interrupted iterations
default   [  68% ] 500/500 VUs  1m41.9s/2m30.0s

running (1m42.9s), 500/500 VUs, 5511 complete and 0 interrupted iterations
default   [  69% ] 500/500 VUs  1m42.9s/2m30.0s

running (1m43.9s), 500/500 VUs, 5563 complete and 0 interrupted iterations
default   [  69% ] 500/500 VUs  1m43.9s/2m30.0s

running (1m44.9s), 500/500 VUs, 5639 complete and 0 interrupted iterations
default   [  70% ] 500/500 VUs  1m44.9s/2m30.0s

running (1m45.9s), 500/500 VUs, 5735 complete and 0 interrupted iterations
default   [  71% ] 500/500 VUs  1m45.9s/2m30.0s

running (1m46.9s), 500/500 VUs, 5789 complete and 0 interrupted iterations
default   [  71% ] 500/500 VUs  1m46.9s/2m30.0s

running (1m48.1s), 500/500 VUs, 5880 complete and 0 interrupted iterations
default   [  72% ] 500/500 VUs  1m48.1s/2m30.0s

running (1m48.9s), 500/500 VUs, 5967 complete and 0 interrupted iterations
default   [  73% ] 500/500 VUs  1m48.9s/2m30.0s

running (1m49.9s), 500/500 VUs, 6038 complete and 0 interrupted iterations
default   [  73% ] 500/500 VUs  1m49.9s/2m30.0s

running (1m50.9s), 500/500 VUs, 6123 complete and 0 interrupted iterations
default   [  74% ] 500/500 VUs  1m50.9s/2m30.0s

running (1m51.9s), 500/500 VUs, 6184 complete and 0 interrupted iterations
default   [  75% ] 500/500 VUs  1m51.9s/2m30.0s

running (1m52.9s), 500/500 VUs, 6252 complete and 0 interrupted iterations
default   [  75% ] 500/500 VUs  1m52.9s/2m30.0s

running (1m53.9s), 500/500 VUs, 6347 complete and 0 interrupted iterations
default   [  76% ] 500/500 VUs  1m53.9s/2m30.0s

running (1m54.9s), 500/500 VUs, 6432 complete and 0 interrupted iterations
default   [  77% ] 500/500 VUs  1m54.9s/2m30.0s

running (1m55.9s), 500/500 VUs, 6497 complete and 0 interrupted iterations
default   [  77% ] 500/500 VUs  1m55.9s/2m30.0s

running (1m56.9s), 500/500 VUs, 6571 complete and 0 interrupted iterations
default   [  78% ] 500/500 VUs  1m56.9s/2m30.0s

running (1m57.9s), 500/500 VUs, 6638 complete and 0 interrupted iterations
default   [  79% ] 500/500 VUs  1m57.9s/2m30.0s

running (1m58.9s), 500/500 VUs, 6707 complete and 0 interrupted iterations
default   [  79% ] 500/500 VUs  1m58.9s/2m30.0s

running (1m59.9s), 500/500 VUs, 6767 complete and 0 interrupted iterations
default   [  80% ] 500/500 VUs  1m59.9s/2m30.0s

running (2m00.9s), 500/500 VUs, 6877 complete and 0 interrupted iterations
default   [  81% ] 500/500 VUs  2m00.9s/2m30.0s

running (2m01.9s), 500/500 VUs, 6961 complete and 0 interrupted iterations
default   [  81% ] 500/500 VUs  2m01.9s/2m30.0s

running (2m02.9s), 494/500 VUs, 7023 complete and 0 interrupted iterations
default   [  82% ] 494/500 VUs  2m02.9s/2m30.0s

running (2m03.9s), 485/500 VUs, 7093 complete and 0 interrupted iterations
default   [  83% ] 485/500 VUs  2m03.9s/2m30.0s

running (2m04.9s), 470/500 VUs, 7162 complete and 0 interrupted iterations
default   [  83% ] 470/500 VUs  2m04.9s/2m30.0s

running (2m05.9s), 463/500 VUs, 7227 complete and 0 interrupted iterations
default   [  84% ] 463/500 VUs  2m05.9s/2m30.0s

running (2m06.9s), 452/500 VUs, 7287 complete and 0 interrupted iterations
default   [  85% ] 452/500 VUs  2m06.9s/2m30.0s

running (2m07.9s), 421/500 VUs, 7412 complete and 0 interrupted iterations
default   [  85% ] 421/500 VUs  2m07.9s/2m30.0s

running (2m08.9s), 403/500 VUs, 7496 complete and 0 interrupted iterations
default   [  86% ] 403/500 VUs  2m08.9s/2m30.0s

running (2m09.9s), 398/500 VUs, 7527 complete and 0 interrupted iterations
default   [  87% ] 398/500 VUs  2m09.9s/2m30.0s

running (2m10.9s), 372/500 VUs, 7615 complete and 0 interrupted iterations
default   [  87% ] 372/500 VUs  2m10.9s/2m30.0s

running (2m11.9s), 359/500 VUs, 7686 complete and 0 interrupted iterations
default   [  88% ] 359/500 VUs  2m11.9s/2m30.0s

running (2m12.9s), 343/500 VUs, 7739 complete and 0 interrupted iterations
default   [  89% ] 343/500 VUs  2m12.9s/2m30.0s

running (2m13.9s), 315/500 VUs, 7832 complete and 0 interrupted iterations
default   [  89% ] 315/500 VUs  2m13.9s/2m30.0s

running (2m14.9s), 297/500 VUs, 7898 complete and 0 interrupted iterations
default   [  90% ] 297/500 VUs  2m14.9s/2m30.0s

running (2m15.9s), 290/500 VUs, 7922 complete and 0 interrupted iterations
default   [  91% ] 290/500 VUs  2m15.9s/2m30.0s

running (2m16.9s), 270/500 VUs, 7987 complete and 0 interrupted iterations
default   [  91% ] 270/500 VUs  2m16.9s/2m30.0s

running (2m17.9s), 254/500 VUs, 8045 complete and 0 interrupted iterations
default   [  92% ] 254/500 VUs  2m17.9s/2m30.0s

running (2m18.9s), 240/500 VUs, 8082 complete and 0 interrupted iterations
default   [  93% ] 240/500 VUs  2m18.9s/2m30.0s

running (2m19.9s), 217/500 VUs, 8145 complete and 0 interrupted iterations
default   [  93% ] 217/500 VUs  2m19.9s/2m30.0s

running (2m20.9s), 198/500 VUs, 8194 complete and 0 interrupted iterations
default   [  94% ] 198/500 VUs  2m20.9s/2m30.0s

running (2m21.9s), 190/500 VUs, 8212 complete and 0 interrupted iterations
default   [  95% ] 190/500 VUs  2m21.9s/2m30.0s

running (2m22.9s), 174/500 VUs, 8257 complete and 0 interrupted iterations
default   [  95% ] 174/500 VUs  2m22.9s/2m30.0s

running (2m23.9s), 151/500 VUs, 8297 complete and 0 interrupted iterations
default   [  96% ] 151/500 VUs  2m23.9s/2m30.0s

running (2m24.9s), 140/500 VUs, 8322 complete and 0 interrupted iterations
default   [  97% ] 140/500 VUs  2m24.9s/2m30.0s

running (2m25.9s), 113/500 VUs, 8362 complete and 0 interrupted iterations
default   [  97% ] 113/500 VUs  2m25.9s/2m30.0s

running (2m26.9s), 097/500 VUs, 8390 complete and 0 interrupted iterations
default   [  98% ] 097/500 VUs  2m26.9s/2m30.0s

running (2m27.9s), 089/500 VUs, 8402 complete and 0 interrupted iterations
default   [  99% ] 089/500 VUs  2m27.9s/2m30.0s

running (2m28.9s), 063/500 VUs, 8431 complete and 0 interrupted iterations
default   [  99% ] 063/500 VUs  2m28.9s/2m30.0s

running (2m29.9s), 047/500 VUs, 8448 complete and 0 interrupted iterations
default   [ 100% ] 047/500 VUs  2m29.9s/2m30.0s

running (2m30.9s), 033/500 VUs, 8462 complete and 0 interrupted iterations
default ↓ [ 100% ] 043/500 VUs  2m30s

running (2m31.9s), 020/500 VUs, 8475 complete and 0 interrupted iterations
default ↓ [ 100% ] 043/500 VUs  2m30s

running (2m32.9s), 008/500 VUs, 8487 complete and 0 interrupted iterations
default ↓ [ 100% ] 043/500 VUs  2m30s

running (2m33.9s), 004/500 VUs, 8491 complete and 0 interrupted iterations
default ↓ [ 100% ] 043/500 VUs  2m30s

running (2m34.9s), 001/500 VUs, 8494 complete and 0 interrupted iterations
default ↓ [ 100% ] 043/500 VUs  2m30s


  █ THRESHOLDS 

    active_clients_time
    ✓ 'p(95)<500' p(95)=80ms

    attach_documents_time
    ✓ 'p(95)<10000' p(95)=329.29ms

    deactivate_clients_time
    ✓ 'p(95)<10000' p(95)=77ms

    http_req_duration
    ✓ 'p(95)<10000' p(95)=155.61ms

    pushpulls_time
    ✓ 'p(95)<1000' p(95)=153ms

    transaction_success_rate
    ✓ 'rate>0.99' rate=100.00%

    transaction_time
    ✓ 'p(95)<30000' p(95)=6.95s


  █ TOTAL RESULTS 

    checks_total.......: 135920  873.415767/s
    checks_succeeded...: 100.00% 135920 out of 135920
    checks_failed......: 0.00%   0 out of 135920

    ✓ status is 200
    ✓ response has valid body

    CUSTOM
    active_clients....................: 8495    54.588485/s
    active_clients_success_rate.......: 100.00% 8495 out of 8495
    active_clients_time...............: avg=18.55ms min=0s       med=4ms    max=350ms    p(90)=56ms    p(95)=80ms    
    attach_documents..................: 8495    54.588485/s
    attach_documents_success_rate.....: 100.00% 8495 out of 8495
    attach_documents_time.............: avg=85.97ms min=2ms      med=21ms   max=747ms    p(90)=263.6ms p(95)=329.29ms
    deactivate_clients................: 8495    54.588485/s
    deactivate_clients_success_rate...: 100.00% 8495 out of 8495
    deactivate_clients_time...........: avg=17.3ms  min=0s       med=2ms    max=446ms    p(90)=49.6ms  p(95)=77ms    
    pushpulls.........................: 42475   272.942427/s
    pushpulls_success_rate............: 100.00% 42475 out of 42475
    pushpulls_time....................: avg=37.29ms min=1ms      med=12ms   max=671ms    p(90)=101ms   p(95)=153ms   
    transaction_success_rate..........: 100.00% 8495 out of 8495
    transaction_time..................: avg=6.36s   min=6.01s    med=6.3s   max=7.91s    p(90)=6.79s   p(95)=6.95s   

    HTTP
    http_req_duration.................: avg=33.14ms min=191.29µs med=6.84ms max=746.55ms p(90)=95.33ms p(95)=155.61ms
      { expected_response:true }......: avg=33.14ms min=191.29µs med=6.84ms max=746.55ms p(90)=95.33ms p(95)=155.61ms
    http_req_failed...................: 0.00%   0 out of 67960
    http_reqs.........................: 67960   436.707883/s

    EXECUTION
    iteration_duration................: avg=6.36s   min=6.01s    med=6.3s   max=7.91s    p(90)=6.79s   p(95)=6.95s   
    iterations........................: 8495    54.588485/s
    vus...............................: 1       min=1              max=500
    vus_max...........................: 500     min=500            max=500

    NETWORK
    data_received.....................: 1.2 GB  7.7 MB/s
    data_sent.........................: 64 MB   411 kB/s




running (2m35.6s), 000/500 VUs, 8495 complete and 0 interrupted iterations
default ✓ [ 100% ] 000/500 VUs  2m30s
