
         /\      Grafana   /‾‾/  
    /\  /  \     |\  __   /  /   
   /  \/    \    | |/ /  /   ‾‾\ 
  /          \   |   (  |  (‾)  |
 / __________ \  |_|\_\  \_____/ 

     execution: local
        script: test/k6/presence.ts
        output: -

     scenarios: (100.00%) 1 scenario, 500 max VUs, 3m0s max duration (incl. graceful stop):
              * default: Up to 500 looping VUs for 2m30s over 3 stages (gracefulRampDown: 30s, gracefulStop: 30s)


running (0m00.9s), 008/500 VUs, 0 complete and 0 interrupted iterations
default   [   1% ] 008/500 VUs  0m00.9s/2m30.0s

running (0m01.9s), 016/500 VUs, 0 complete and 0 interrupted iterations
default   [   1% ] 016/500 VUs  0m01.9s/2m30.0s

running (0m02.9s), 024/500 VUs, 0 complete and 0 interrupted iterations
default   [   2% ] 024/500 VUs  0m02.9s/2m30.0s

running (0m03.9s), 033/500 VUs, 0 complete and 0 interrupted iterations
default   [   3% ] 033/500 VUs  0m03.9s/2m30.0s

running (0m04.9s), 041/500 VUs, 0 complete and 0 interrupted iterations
default   [   3% ] 041/500 VUs  0m04.9s/2m30.0s

running (0m05.9s), 049/500 VUs, 0 complete and 0 interrupted iterations
default   [   4% ] 049/500 VUs  0m05.9s/2m30.0s

running (0m06.9s), 058/500 VUs, 8 complete and 0 interrupted iterations
default   [   5% ] 058/500 VUs  0m06.9s/2m30.0s

running (0m07.9s), 066/500 VUs, 16 complete and 0 interrupted iterations
default   [   5% ] 066/500 VUs  0m07.9s/2m30.0s

running (0m08.9s), 074/500 VUs, 24 complete and 0 interrupted iterations
default   [   6% ] 074/500 VUs  0m08.9s/2m30.0s

running (0m09.9s), 083/500 VUs, 33 complete and 0 interrupted iterations
default   [   7% ] 083/500 VUs  0m09.9s/2m30.0s

running (0m10.9s), 091/500 VUs, 41 complete and 0 interrupted iterations
default   [   7% ] 091/500 VUs  0m10.9s/2m30.0s

running (0m11.9s), 099/500 VUs, 49 complete and 0 interrupted iterations
default   [   8% ] 099/500 VUs  0m11.9s/2m30.0s

running (0m12.9s), 108/500 VUs, 64 complete and 0 interrupted iterations
default   [   9% ] 108/500 VUs  0m12.9s/2m30.0s

running (0m13.9s), 116/500 VUs, 82 complete and 0 interrupted iterations
default   [   9% ] 116/500 VUs  0m13.9s/2m30.0s

running (0m14.9s), 124/500 VUs, 98 complete and 0 interrupted iterations
default   [  10% ] 124/500 VUs  0m14.9s/2m30.0s

running (0m15.9s), 132/500 VUs, 114 complete and 0 interrupted iterations
default   [  11% ] 132/500 VUs  0m15.9s/2m30.0s

running (0m16.9s), 141/500 VUs, 132 complete and 0 interrupted iterations
default   [  11% ] 141/500 VUs  0m16.9s/2m30.0s

running (0m17.9s), 149/500 VUs, 148 complete and 0 interrupted iterations
default   [  12% ] 149/500 VUs  0m17.9s/2m30.0s

running (0m18.9s), 157/500 VUs, 171 complete and 0 interrupted iterations
default   [  13% ] 157/500 VUs  0m18.9s/2m30.0s

running (0m19.9s), 166/500 VUs, 198 complete and 0 interrupted iterations
default   [  13% ] 166/500 VUs  0m19.9s/2m30.0s

running (0m20.9s), 174/500 VUs, 222 complete and 0 interrupted iterations
default   [  14% ] 174/500 VUs  0m20.9s/2m30.0s

running (0m21.9s), 182/500 VUs, 246 complete and 0 interrupted iterations
default   [  15% ] 182/500 VUs  0m21.9s/2m30.0s

running (0m22.9s), 191/500 VUs, 271 complete and 0 interrupted iterations
default   [  15% ] 191/500 VUs  0m22.9s/2m30.0s

running (0m23.9s), 199/500 VUs, 297 complete and 0 interrupted iterations
default   [  16% ] 199/500 VUs  0m23.9s/2m30.0s

running (0m24.9s), 207/500 VUs, 328 complete and 0 interrupted iterations
default   [  17% ] 207/500 VUs  0m24.9s/2m30.0s

running (0m25.9s), 216/500 VUs, 361 complete and 0 interrupted iterations
default   [  17% ] 216/500 VUs  0m25.9s/2m30.0s

running (0m26.9s), 224/500 VUs, 394 complete and 0 interrupted iterations
default   [  18% ] 224/500 VUs  0m26.9s/2m30.0s

running (0m27.9s), 232/500 VUs, 428 complete and 0 interrupted iterations
default   [  19% ] 232/500 VUs  0m27.9s/2m30.0s

running (0m28.9s), 241/500 VUs, 461 complete and 0 interrupted iterations
default   [  19% ] 241/500 VUs  0m28.9s/2m30.0s

running (0m29.9s), 249/500 VUs, 495 complete and 0 interrupted iterations
default   [  20% ] 249/500 VUs  0m29.9s/2m30.0s

running (0m30.9s), 257/500 VUs, 535 complete and 0 interrupted iterations
default   [  21% ] 257/500 VUs  0m30.9s/2m30.0s

running (0m31.9s), 266/500 VUs, 575 complete and 0 interrupted iterations
default   [  21% ] 266/500 VUs  0m31.9s/2m30.0s

running (0m32.9s), 274/500 VUs, 618 complete and 0 interrupted iterations
default   [  22% ] 274/500 VUs  0m32.9s/2m30.0s

running (0m33.9s), 282/500 VUs, 659 complete and 0 interrupted iterations
default   [  23% ] 282/500 VUs  0m33.9s/2m30.0s

running (0m34.9s), 291/500 VUs, 700 complete and 0 interrupted iterations
default   [  23% ] 291/500 VUs  0m34.9s/2m30.0s

running (0m35.9s), 299/500 VUs, 740 complete and 0 interrupted iterations
default   [  24% ] 299/500 VUs  0m35.9s/2m30.0s

running (0m36.9s), 307/500 VUs, 790 complete and 0 interrupted iterations
default   [  25% ] 307/500 VUs  0m36.9s/2m30.0s

running (0m37.9s), 315/500 VUs, 840 complete and 0 interrupted iterations
default   [  25% ] 315/500 VUs  0m37.9s/2m30.0s

running (0m38.9s), 324/500 VUs, 889 complete and 0 interrupted iterations
default   [  26% ] 324/500 VUs  0m38.9s/2m30.0s

running (0m39.9s), 332/500 VUs, 940 complete and 0 interrupted iterations
default   [  27% ] 332/500 VUs  0m39.9s/2m30.0s

running (0m40.9s), 340/500 VUs, 990 complete and 0 interrupted iterations
default   [  27% ] 340/500 VUs  0m40.9s/2m30.0s

running (0m41.9s), 349/500 VUs, 1039 complete and 0 interrupted iterations
default   [  28% ] 349/500 VUs  0m41.9s/2m30.0s

running (0m42.9s), 357/500 VUs, 1096 complete and 0 interrupted iterations
default   [  29% ] 357/500 VUs  0m42.9s/2m30.0s

running (0m43.9s), 365/500 VUs, 1155 complete and 0 interrupted iterations
default   [  29% ] 365/500 VUs  0m43.9s/2m30.0s

running (0m44.9s), 374/500 VUs, 1211 complete and 0 interrupted iterations
default   [  30% ] 374/500 VUs  0m44.9s/2m30.0s

running (0m45.9s), 382/500 VUs, 1270 complete and 0 interrupted iterations
default   [  31% ] 382/500 VUs  0m45.9s/2m30.0s

running (0m46.9s), 390/500 VUs, 1328 complete and 0 interrupted iterations
default   [  31% ] 390/500 VUs  0m46.9s/2m30.0s

running (0m47.9s), 399/500 VUs, 1386 complete and 0 interrupted iterations
default   [  32% ] 399/500 VUs  0m47.9s/2m30.0s

running (0m48.9s), 407/500 VUs, 1447 complete and 0 interrupted iterations
default   [  33% ] 407/500 VUs  0m48.9s/2m30.0s

running (0m50.1s), 417/500 VUs, 1526 complete and 0 interrupted iterations
default   [  33% ] 417/500 VUs  0m50.1s/2m30.0s

running (0m50.9s), 424/500 VUs, 1573 complete and 0 interrupted iterations
default   [  34% ] 424/500 VUs  0m50.9s/2m30.0s

running (0m51.9s), 432/500 VUs, 1642 complete and 0 interrupted iterations
default   [  35% ] 432/500 VUs  0m51.9s/2m30.0s

running (0m52.9s), 440/500 VUs, 1710 complete and 0 interrupted iterations
default   [  35% ] 440/500 VUs  0m52.9s/2m30.0s

running (0m53.9s), 449/500 VUs, 1774 complete and 0 interrupted iterations
default   [  36% ] 449/500 VUs  0m53.9s/2m30.0s

running (0m54.9s), 457/500 VUs, 1833 complete and 0 interrupted iterations
default   [  37% ] 457/500 VUs  0m54.9s/2m30.0s

running (0m55.9s), 465/500 VUs, 1910 complete and 0 interrupted iterations
default   [  37% ] 465/500 VUs  0m55.9s/2m30.0s

running (0m57.1s), 475/500 VUs, 1982 complete and 0 interrupted iterations
default   [  38% ] 475/500 VUs  0m57.1s/2m30.0s

running (0m57.9s), 482/500 VUs, 2034 complete and 0 interrupted iterations
default   [  39% ] 482/500 VUs  0m57.9s/2m30.0s

running (0m58.9s), 490/500 VUs, 2109 complete and 0 interrupted iterations
default   [  39% ] 490/500 VUs  0m58.9s/2m30.0s

running (0m59.9s), 498/500 VUs, 2161 complete and 0 interrupted iterations
default   [  40% ] 498/500 VUs  0m59.9s/2m30.0s

running (1m00.9s), 500/500 VUs, 2229 complete and 0 interrupted iterations
default   [  41% ] 500/500 VUs  1m00.9s/2m30.0s

running (1m01.9s), 500/500 VUs, 2303 complete and 0 interrupted iterations
default   [  41% ] 500/500 VUs  1m01.9s/2m30.0s

running (1m02.9s), 500/500 VUs, 2369 complete and 0 interrupted iterations
default   [  42% ] 500/500 VUs  1m02.9s/2m30.0s

running (1m03.9s), 500/500 VUs, 2440 complete and 0 interrupted iterations
default   [  43% ] 500/500 VUs  1m03.9s/2m30.0s

running (1m04.9s), 500/500 VUs, 2532 complete and 0 interrupted iterations
default   [  43% ] 500/500 VUs  1m04.9s/2m30.0s

running (1m05.9s), 500/500 VUs, 2606 complete and 0 interrupted iterations
default   [  44% ] 500/500 VUs  1m05.9s/2m30.0s

running (1m06.9s), 500/500 VUs, 2658 complete and 0 interrupted iterations
default   [  45% ] 500/500 VUs  1m06.9s/2m30.0s

running (1m07.9s), 500/500 VUs, 2746 complete and 0 interrupted iterations
default   [  45% ] 500/500 VUs  1m07.9s/2m30.0s

running (1m09.1s), 500/500 VUs, 2829 complete and 0 interrupted iterations
default   [  46% ] 500/500 VUs  1m09.1s/2m30.0s

running (1m09.9s), 500/500 VUs, 2885 complete and 0 interrupted iterations
default   [  47% ] 500/500 VUs  1m09.9s/2m30.0s

running (1m10.9s), 500/500 VUs, 2978 complete and 0 interrupted iterations
default   [  47% ] 500/500 VUs  1m10.9s/2m30.0s

running (1m11.9s), 500/500 VUs, 3028 complete and 0 interrupted iterations
default   [  48% ] 500/500 VUs  1m11.9s/2m30.0s

running (1m12.9s), 500/500 VUs, 3097 complete and 0 interrupted iterations
default   [  49% ] 500/500 VUs  1m12.9s/2m30.0s

running (1m13.9s), 500/500 VUs, 3182 complete and 0 interrupted iterations
default   [  49% ] 500/500 VUs  1m13.9s/2m30.0s

running (1m14.9s), 500/500 VUs, 3245 complete and 0 interrupted iterations
default   [  50% ] 500/500 VUs  1m14.9s/2m30.0s

running (1m15.9s), 500/500 VUs, 3320 complete and 0 interrupted iterations
default   [  51% ] 500/500 VUs  1m15.9s/2m30.0s

running (1m16.9s), 500/500 VUs, 3406 complete and 0 interrupted iterations
default   [  51% ] 500/500 VUs  1m16.9s/2m30.0s

running (1m17.9s), 500/500 VUs, 3460 complete and 0 interrupted iterations
default   [  52% ] 500/500 VUs  1m17.9s/2m30.0s

running (1m18.9s), 500/500 VUs, 3519 complete and 0 interrupted iterations
default   [  53% ] 500/500 VUs  1m18.9s/2m30.0s

running (1m19.9s), 500/500 VUs, 3591 complete and 0 interrupted iterations
default   [  53% ] 500/500 VUs  1m19.9s/2m30.0s

running (1m20.9s), 500/500 VUs, 3675 complete and 0 interrupted iterations
default   [  54% ] 500/500 VUs  1m20.9s/2m30.0s

running (1m21.9s), 500/500 VUs, 3741 complete and 0 interrupted iterations
default   [  55% ] 500/500 VUs  1m21.9s/2m30.0s

running (1m22.9s), 500/500 VUs, 3815 complete and 0 interrupted iterations
default   [  55% ] 500/500 VUs  1m22.9s/2m30.0s

running (1m23.9s), 500/500 VUs, 3918 complete and 0 interrupted iterations
default   [  56% ] 500/500 VUs  1m23.9s/2m30.0s

running (1m24.9s), 500/500 VUs, 3990 complete and 0 interrupted iterations
default   [  57% ] 500/500 VUs  1m24.9s/2m30.0s

running (1m25.9s), 500/500 VUs, 4041 complete and 0 interrupted iterations
default   [  57% ] 500/500 VUs  1m25.9s/2m30.0s

running (1m26.9s), 500/500 VUs, 4145 complete and 0 interrupted iterations
default   [  58% ] 500/500 VUs  1m26.9s/2m30.0s

running (1m27.9s), 500/500 VUs, 4207 complete and 0 interrupted iterations
default   [  59% ] 500/500 VUs  1m27.9s/2m30.0s

running (1m28.9s), 500/500 VUs, 4256 complete and 0 interrupted iterations
default   [  59% ] 500/500 VUs  1m28.9s/2m30.0s

running (1m29.9s), 500/500 VUs, 4348 complete and 0 interrupted iterations
default   [  60% ] 500/500 VUs  1m29.9s/2m30.0s

running (1m30.9s), 500/500 VUs, 4435 complete and 0 interrupted iterations
default   [  61% ] 500/500 VUs  1m30.9s/2m30.0s

running (1m31.9s), 500/500 VUs, 4512 complete and 0 interrupted iterations
default   [  61% ] 500/500 VUs  1m31.9s/2m30.0s

running (1m32.9s), 500/500 VUs, 4588 complete and 0 interrupted iterations
default   [  62% ] 500/500 VUs  1m32.9s/2m30.0s

running (1m33.9s), 500/500 VUs, 4656 complete and 0 interrupted iterations
default   [  63% ] 500/500 VUs  1m33.9s/2m30.0s

running (1m34.9s), 500/500 VUs, 4724 complete and 0 interrupted iterations
default   [  63% ] 500/500 VUs  1m34.9s/2m30.0s

running (1m35.9s), 500/500 VUs, 4796 complete and 0 interrupted iterations
default   [  64% ] 500/500 VUs  1m35.9s/2m30.0s

running (1m36.9s), 500/500 VUs, 4872 complete and 0 interrupted iterations
default   [  65% ] 500/500 VUs  1m36.9s/2m30.0s

running (1m37.9s), 500/500 VUs, 4965 complete and 0 interrupted iterations
default   [  65% ] 500/500 VUs  1m37.9s/2m30.0s

running (1m38.9s), 500/500 VUs, 5010 complete and 0 interrupted iterations
default   [  66% ] 500/500 VUs  1m38.9s/2m30.0s

running (1m39.9s), 500/500 VUs, 5092 complete and 0 interrupted iterations
default   [  67% ] 500/500 VUs  1m39.9s/2m30.0s

running (1m40.9s), 500/500 VUs, 5183 complete and 0 interrupted iterations
default   [  67% ] 500/500 VUs  1m40.9s/2m30.0s

running (1m41.9s), 500/500 VUs, 5238 complete and 0 interrupted iterations
default   [  68% ] 500/500 VUs  1m41.9s/2m30.0s

running (1m42.9s), 500/500 VUs, 5316 complete and 0 interrupted iterations
default   [  69% ] 500/500 VUs  1m42.9s/2m30.0s

running (1m43.9s), 500/500 VUs, 5422 complete and 0 interrupted iterations
default   [  69% ] 500/500 VUs  1m43.9s/2m30.0s

running (1m44.9s), 500/500 VUs, 5473 complete and 0 interrupted iterations
default   [  70% ] 500/500 VUs  1m44.9s/2m30.0s

running (1m45.9s), 500/500 VUs, 5534 complete and 0 interrupted iterations
default   [  71% ] 500/500 VUs  1m45.9s/2m30.0s

running (1m46.9s), 500/500 VUs, 5632 complete and 0 interrupted iterations
default   [  71% ] 500/500 VUs  1m46.9s/2m30.0s

running (1m47.9s), 500/500 VUs, 5679 complete and 0 interrupted iterations
default   [  72% ] 500/500 VUs  1m47.9s/2m30.0s

running (1m48.9s), 500/500 VUs, 5747 complete and 0 interrupted iterations
default   [  73% ] 500/500 VUs  1m48.9s/2m30.0s

running (1m50.2s), 500/500 VUs, 5842 complete and 0 interrupted iterations
default   [  73% ] 500/500 VUs  1m50.2s/2m30.0s

running (1m50.9s), 500/500 VUs, 5885 complete and 0 interrupted iterations
default   [  74% ] 500/500 VUs  1m50.9s/2m30.0s

running (1m51.9s), 500/500 VUs, 5965 complete and 0 interrupted iterations
default   [  75% ] 500/500 VUs  1m51.9s/2m30.0s

running (1m52.9s), 500/500 VUs, 6057 complete and 0 interrupted iterations
default   [  75% ] 500/500 VUs  1m52.9s/2m30.0s

running (1m53.9s), 500/500 VUs, 6116 complete and 0 interrupted iterations
default   [  76% ] 500/500 VUs  1m53.9s/2m30.0s

running (1m54.9s), 500/500 VUs, 6189 complete and 0 interrupted iterations
default   [  77% ] 500/500 VUs  1m54.9s/2m30.0s

running (1m55.9s), 500/500 VUs, 6286 complete and 0 interrupted iterations
default   [  77% ] 500/500 VUs  1m55.9s/2m30.0s

running (1m56.9s), 500/500 VUs, 6340 complete and 0 interrupted iterations
default   [  78% ] 500/500 VUs  1m56.9s/2m30.0s

running (1m58.0s), 500/500 VUs, 6417 complete and 0 interrupted iterations
default   [  79% ] 500/500 VUs  1m58.0s/2m30.0s

running (1m58.9s), 500/500 VUs, 6523 complete and 0 interrupted iterations
default   [  79% ] 500/500 VUs  1m58.9s/2m30.0s

running (1m59.9s), 500/500 VUs, 6566 complete and 0 interrupted iterations
default   [  80% ] 500/500 VUs  1m59.9s/2m30.0s

running (2m00.9s), 496/500 VUs, 6647 complete and 0 interrupted iterations
default   [  81% ] 496/500 VUs  2m00.9s/2m30.0s

running (2m01.9s), 492/500 VUs, 6713 complete and 0 interrupted iterations
default   [  81% ] 492/500 VUs  2m01.9s/2m30.0s

running (2m02.9s), 491/500 VUs, 6799 complete and 0 interrupted iterations
default   [  82% ] 491/500 VUs  2m02.9s/2m30.0s

running (2m03.9s), 478/500 VUs, 6883 complete and 0 interrupted iterations
default   [  83% ] 478/500 VUs  2m03.9s/2m30.0s

running (2m04.9s), 469/500 VUs, 6963 complete and 0 interrupted iterations
default   [  83% ] 469/500 VUs  2m04.9s/2m30.0s

running (2m05.9s), 447/500 VUs, 7053 complete and 0 interrupted iterations
default   [  84% ] 447/500 VUs  2m05.9s/2m30.0s

running (2m06.9s), 433/500 VUs, 7122 complete and 0 interrupted iterations
default   [  85% ] 433/500 VUs  2m06.9s/2m30.0s

running (2m07.9s), 418/500 VUs, 7181 complete and 0 interrupted iterations
default   [  85% ] 418/500 VUs  2m07.9s/2m30.0s

running (2m09.0s), 402/500 VUs, 7263 complete and 0 interrupted iterations
default   [  86% ] 402/500 VUs  2m09.0s/2m30.0s

running (2m09.9s), 384/500 VUs, 7341 complete and 0 interrupted iterations
default   [  87% ] 384/500 VUs  2m09.9s/2m30.0s

running (2m10.9s), 373/500 VUs, 7405 complete and 0 interrupted iterations
default   [  87% ] 373/500 VUs  2m10.9s/2m30.0s

running (2m11.9s), 354/500 VUs, 7489 complete and 0 interrupted iterations
default   [  88% ] 354/500 VUs  2m11.9s/2m30.0s

running (2m12.9s), 339/500 VUs, 7545 complete and 0 interrupted iterations
default   [  89% ] 339/500 VUs  2m12.9s/2m30.0s

running (2m13.9s), 326/500 VUs, 7586 complete and 0 interrupted iterations
default   [  89% ] 326/500 VUs  2m13.9s/2m30.0s

running (2m14.9s), 304/500 VUs, 7654 complete and 0 interrupted iterations
default   [  90% ] 304/500 VUs  2m14.9s/2m30.0s

running (2m15.9s), 285/500 VUs, 7724 complete and 0 interrupted iterations
default   [  91% ] 285/500 VUs  2m15.9s/2m30.0s

running (2m16.9s), 272/500 VUs, 7774 complete and 0 interrupted iterations
default   [  91% ] 272/500 VUs  2m16.9s/2m30.0s

running (2m17.9s), 254/500 VUs, 7841 complete and 0 interrupted iterations
default   [  92% ] 254/500 VUs  2m17.9s/2m30.0s

running (2m18.9s), 242/500 VUs, 7882 complete and 0 interrupted iterations
default   [  93% ] 242/500 VUs  2m18.9s/2m30.0s

running (2m19.9s), 233/500 VUs, 7912 complete and 0 interrupted iterations
default   [  93% ] 233/500 VUs  2m19.9s/2m30.0s

running (2m20.9s), 211/500 VUs, 7957 complete and 0 interrupted iterations
default   [  94% ] 211/500 VUs  2m20.9s/2m30.0s

running (2m21.9s), 188/500 VUs, 8009 complete and 0 interrupted iterations
default   [  95% ] 188/500 VUs  2m21.9s/2m30.0s

running (2m22.9s), 174/500 VUs, 8045 complete and 0 interrupted iterations
default   [  95% ] 174/500 VUs  2m22.9s/2m30.0s

running (2m23.9s), 146/500 VUs, 8095 complete and 0 interrupted iterations
default   [  96% ] 146/500 VUs  2m23.9s/2m30.0s

running (2m24.9s), 128/500 VUs, 8120 complete and 0 interrupted iterations
default   [  97% ] 128/500 VUs  2m24.9s/2m30.0s

running (2m25.9s), 113/500 VUs, 8145 complete and 0 interrupted iterations
default   [  97% ] 113/500 VUs  2m25.9s/2m30.0s

running (2m26.9s), 097/500 VUs, 8168 complete and 0 interrupted iterations
default   [  98% ] 097/500 VUs  2m26.9s/2m30.0s

running (2m27.9s), 080/500 VUs, 8196 complete and 0 interrupted iterations
default   [  99% ] 080/500 VUs  2m27.9s/2m30.0s

running (2m28.9s), 063/500 VUs, 8219 complete and 0 interrupted iterations
default   [  99% ] 063/500 VUs  2m28.9s/2m30.0s

running (2m29.9s), 041/500 VUs, 8241 complete and 0 interrupted iterations
default   [ 100% ] 041/500 VUs  2m29.9s/2m30.0s

running (2m30.9s), 034/500 VUs, 8248 complete and 0 interrupted iterations
default ↓ [ 100% ] 040/500 VUs  2m30s

running (2m31.9s), 024/500 VUs, 8258 complete and 0 interrupted iterations
default ↓ [ 100% ] 040/500 VUs  2m30s

running (2m32.9s), 017/500 VUs, 8265 complete and 0 interrupted iterations
default ↓ [ 100% ] 040/500 VUs  2m30s

running (2m33.9s), 006/500 VUs, 8276 complete and 0 interrupted iterations
default ↓ [ 100% ] 040/500 VUs  2m30s


  █ THRESHOLDS 

    active_clients_time
    ✓ 'p(95)<500' p(95)=144ms

    attach_documents_time
    ✓ 'p(95)<10000' p(95)=412ms

    deactivate_clients_time
    ✓ 'p(95)<10000' p(95)=147ms

    http_req_duration
    ✓ 'p(95)<10000' p(95)=224.97ms

    pushpulls_time
    ✓ 'p(95)<1000' p(95)=246ms

    transaction_success_rate
    ✓ 'rate>0.99' rate=100.00%

    transaction_time
    ✓ 'p(95)<30000' p(95)=7.31s


  █ TOTAL RESULTS 

    checks_total.......: 132512  856.07337/s
    checks_succeeded...: 100.00% 132512 out of 132512
    checks_failed......: 0.00%   0 out of 132512

    ✓ status is 200
    ✓ response has valid body

    CUSTOM
    active_clients....................: 8282    53.504586/s
    active_clients_success_rate.......: 100.00% 8282 out of 8282
    active_clients_time...............: avg=30.17ms  min=1ms     med=6ms     max=592ms    p(90)=96ms     p(95)=144ms   
    attach_documents..................: 8282    53.504586/s
    attach_documents_success_rate.....: 100.00% 8282 out of 8282
    attach_documents_time.............: avg=103.59ms min=3ms     med=25ms    max=931ms    p(90)=330ms    p(95)=412ms   
    deactivate_clients................: 8282    53.504586/s
    deactivate_clients_success_rate...: 100.00% 8282 out of 8282
    deactivate_clients_time...........: avg=28.04ms  min=0s      med=4ms     max=643ms    p(90)=86.9ms   p(95)=147ms   
    pushpulls.........................: 41410   267.522928/s
    pushpulls_success_rate............: 100.00% 41410 out of 41410
    pushpulls_time....................: avg=57.86ms  min=1ms     med=18ms    max=830ms    p(90)=173ms    p(95)=246ms   
    transaction_success_rate..........: 100.00% 8282 out of 8282
    transaction_time..................: avg=6.51s    min=6.01s   med=6.47s   max=8.54s    p(90)=7.12s    p(95)=7.31s   

    HTTP
    http_req_duration.................: avg=49.43ms  min=487.4µs med=10.18ms max=930.11ms p(90)=155.07ms p(95)=224.97ms
      { expected_response:true }......: avg=49.43ms  min=487.4µs med=10.18ms max=930.11ms p(90)=155.07ms p(95)=224.97ms
    http_req_failed...................: 0.00%   0 out of 66256
    http_reqs.........................: 66256   428.036685/s

    EXECUTION
    iteration_duration................: avg=6.51s    min=6.01s   med=6.47s   max=8.54s    p(90)=7.12s    p(95)=7.31s   
    iterations........................: 8282    53.504586/s
    vus...............................: 6       min=6              max=500
    vus_max...........................: 500     min=500            max=500

    NETWORK
    data_received.....................: 1.2 GB  7.5 MB/s
    data_sent.........................: 62 MB   403 kB/s




running (2m34.8s), 000/500 VUs, 8282 complete and 0 interrupted iterations
default ✓ [ 100% ] 000/500 VUs  2m30s
