
         /\      Grafana   /‾‾/  
    /\  /  \     |\  __   /  /   
   /  \/    \    | |/ /  /   ‾‾\ 
  /          \   |   (  |  (‾)  |
 / __________ \  |_|\_\  \_____/ 

     execution: local
        script: test/k6/presence.ts
        output: -

     scenarios: (100.00%) 1 scenario, 500 max VUs, 3m0s max duration (incl. graceful stop):
              * default: Up to 500 looping VUs for 2m30s over 3 stages (gracefulRampDown: 30s, gracefulStop: 30s)


running (0m00.9s), 008/500 VUs, 0 complete and 0 interrupted iterations
default   [   1% ] 008/500 VUs  0m00.9s/2m30.0s

running (0m01.9s), 016/500 VUs, 0 complete and 0 interrupted iterations
default   [   1% ] 016/500 VUs  0m01.9s/2m30.0s

running (0m02.9s), 024/500 VUs, 0 complete and 0 interrupted iterations
default   [   2% ] 024/500 VUs  0m02.9s/2m30.0s

running (0m03.9s), 033/500 VUs, 0 complete and 0 interrupted iterations
default   [   3% ] 033/500 VUs  0m03.9s/2m30.0s

running (0m04.9s), 041/500 VUs, 0 complete and 0 interrupted iterations
default   [   3% ] 041/500 VUs  0m04.9s/2m30.0s

running (0m05.9s), 049/500 VUs, 0 complete and 0 interrupted iterations
default   [   4% ] 049/500 VUs  0m05.9s/2m30.0s

running (0m06.9s), 058/500 VUs, 8 complete and 0 interrupted iterations
default   [   5% ] 058/500 VUs  0m06.9s/2m30.0s

running (0m07.9s), 066/500 VUs, 16 complete and 0 interrupted iterations
default   [   5% ] 066/500 VUs  0m07.9s/2m30.0s

running (0m08.9s), 074/500 VUs, 24 complete and 0 interrupted iterations
default   [   6% ] 074/500 VUs  0m08.9s/2m30.0s

running (0m09.9s), 083/500 VUs, 33 complete and 0 interrupted iterations
default   [   7% ] 083/500 VUs  0m09.9s/2m30.0s

running (0m10.9s), 091/500 VUs, 41 complete and 0 interrupted iterations
default   [   7% ] 091/500 VUs  0m10.9s/2m30.0s

running (0m11.9s), 099/500 VUs, 49 complete and 0 interrupted iterations
default   [   8% ] 099/500 VUs  0m11.9s/2m30.0s

running (0m12.9s), 108/500 VUs, 65 complete and 0 interrupted iterations
default   [   9% ] 108/500 VUs  0m12.9s/2m30.0s

running (0m13.9s), 116/500 VUs, 82 complete and 0 interrupted iterations
default   [   9% ] 116/500 VUs  0m13.9s/2m30.0s

running (0m14.9s), 124/500 VUs, 98 complete and 0 interrupted iterations
default   [  10% ] 124/500 VUs  0m14.9s/2m30.0s

running (0m15.9s), 133/500 VUs, 114 complete and 0 interrupted iterations
default   [  11% ] 133/500 VUs  0m15.9s/2m30.0s

running (0m16.9s), 141/500 VUs, 132 complete and 0 interrupted iterations
default   [  11% ] 141/500 VUs  0m16.9s/2m30.0s

running (0m17.9s), 149/500 VUs, 148 complete and 0 interrupted iterations
default   [  12% ] 149/500 VUs  0m17.9s/2m30.0s

running (0m18.9s), 158/500 VUs, 171 complete and 0 interrupted iterations
default   [  13% ] 158/500 VUs  0m18.9s/2m30.0s

running (0m19.9s), 166/500 VUs, 198 complete and 0 interrupted iterations
default   [  13% ] 166/500 VUs  0m19.9s/2m30.0s

running (0m20.9s), 174/500 VUs, 222 complete and 0 interrupted iterations
default   [  14% ] 174/500 VUs  0m20.9s/2m30.0s

running (0m21.9s), 182/500 VUs, 246 complete and 0 interrupted iterations
default   [  15% ] 182/500 VUs  0m21.9s/2m30.0s

running (0m22.9s), 191/500 VUs, 273 complete and 0 interrupted iterations
default   [  15% ] 191/500 VUs  0m22.9s/2m30.0s

running (0m23.9s), 199/500 VUs, 297 complete and 0 interrupted iterations
default   [  16% ] 199/500 VUs  0m23.9s/2m30.0s

running (0m24.9s), 207/500 VUs, 328 complete and 0 interrupted iterations
default   [  17% ] 207/500 VUs  0m24.9s/2m30.0s

running (0m25.9s), 216/500 VUs, 363 complete and 0 interrupted iterations
default   [  17% ] 216/500 VUs  0m25.9s/2m30.0s

running (0m26.9s), 224/500 VUs, 396 complete and 0 interrupted iterations
default   [  18% ] 224/500 VUs  0m26.9s/2m30.0s

running (0m27.9s), 232/500 VUs, 428 complete and 0 interrupted iterations
default   [  19% ] 232/500 VUs  0m27.9s/2m30.0s

running (0m28.9s), 241/500 VUs, 462 complete and 0 interrupted iterations
default   [  19% ] 241/500 VUs  0m28.9s/2m30.0s

running (0m29.9s), 249/500 VUs, 496 complete and 0 interrupted iterations
default   [  20% ] 249/500 VUs  0m29.9s/2m30.0s

running (0m30.9s), 257/500 VUs, 535 complete and 0 interrupted iterations
default   [  21% ] 257/500 VUs  0m30.9s/2m30.0s

running (0m31.9s), 266/500 VUs, 575 complete and 0 interrupted iterations
default   [  21% ] 266/500 VUs  0m31.9s/2m30.0s

running (0m32.9s), 274/500 VUs, 618 complete and 0 interrupted iterations
default   [  22% ] 274/500 VUs  0m32.9s/2m30.0s

running (0m33.9s), 282/500 VUs, 660 complete and 0 interrupted iterations
default   [  23% ] 282/500 VUs  0m33.9s/2m30.0s

running (0m34.9s), 291/500 VUs, 700 complete and 0 interrupted iterations
default   [  23% ] 291/500 VUs  0m34.9s/2m30.0s

running (0m35.9s), 299/500 VUs, 743 complete and 0 interrupted iterations
default   [  24% ] 299/500 VUs  0m35.9s/2m30.0s

running (0m36.9s), 307/500 VUs, 792 complete and 0 interrupted iterations
default   [  25% ] 307/500 VUs  0m36.9s/2m30.0s

running (0m37.9s), 316/500 VUs, 840 complete and 0 interrupted iterations
default   [  25% ] 316/500 VUs  0m37.9s/2m30.0s

running (0m38.9s), 324/500 VUs, 890 complete and 0 interrupted iterations
default   [  26% ] 324/500 VUs  0m38.9s/2m30.0s

running (0m39.9s), 332/500 VUs, 941 complete and 0 interrupted iterations
default   [  27% ] 332/500 VUs  0m39.9s/2m30.0s

running (0m40.9s), 340/500 VUs, 989 complete and 0 interrupted iterations
default   [  27% ] 340/500 VUs  0m40.9s/2m30.0s

running (0m41.9s), 349/500 VUs, 1039 complete and 0 interrupted iterations
default   [  28% ] 349/500 VUs  0m41.9s/2m30.0s

running (0m42.9s), 357/500 VUs, 1095 complete and 0 interrupted iterations
default   [  29% ] 357/500 VUs  0m42.9s/2m30.0s

running (0m43.9s), 365/500 VUs, 1151 complete and 0 interrupted iterations
default   [  29% ] 365/500 VUs  0m43.9s/2m30.0s

running (0m44.9s), 374/500 VUs, 1210 complete and 0 interrupted iterations
default   [  30% ] 374/500 VUs  0m44.9s/2m30.0s

running (0m45.9s), 382/500 VUs, 1268 complete and 0 interrupted iterations
default   [  31% ] 382/500 VUs  0m45.9s/2m30.0s

running (0m46.9s), 390/500 VUs, 1325 complete and 0 interrupted iterations
default   [  31% ] 390/500 VUs  0m46.9s/2m30.0s

running (0m47.9s), 399/500 VUs, 1383 complete and 0 interrupted iterations
default   [  32% ] 399/500 VUs  0m47.9s/2m30.0s

running (0m48.9s), 407/500 VUs, 1443 complete and 0 interrupted iterations
default   [  33% ] 407/500 VUs  0m48.9s/2m30.0s

running (0m49.9s), 415/500 VUs, 1513 complete and 0 interrupted iterations
default   [  33% ] 415/500 VUs  0m49.9s/2m30.0s

running (0m50.9s), 424/500 VUs, 1579 complete and 0 interrupted iterations
default   [  34% ] 424/500 VUs  0m50.9s/2m30.0s

running (0m51.9s), 432/500 VUs, 1645 complete and 0 interrupted iterations
default   [  35% ] 432/500 VUs  0m51.9s/2m30.0s

running (0m52.9s), 441/500 VUs, 1705 complete and 0 interrupted iterations
default   [  35% ] 441/500 VUs  0m52.9s/2m30.0s

running (0m53.9s), 449/500 VUs, 1765 complete and 0 interrupted iterations
default   [  36% ] 449/500 VUs  0m53.9s/2m30.0s

running (0m54.9s), 457/500 VUs, 1834 complete and 0 interrupted iterations
default   [  37% ] 457/500 VUs  0m54.9s/2m30.0s

running (0m55.9s), 465/500 VUs, 1883 complete and 0 interrupted iterations
default   [  37% ] 465/500 VUs  0m55.9s/2m30.0s

running (0m56.9s), 474/500 VUs, 1953 complete and 0 interrupted iterations
default   [  38% ] 474/500 VUs  0m56.9s/2m30.0s

running (0m57.9s), 482/500 VUs, 2030 complete and 0 interrupted iterations
default   [  39% ] 482/500 VUs  0m57.9s/2m30.0s

running (0m58.9s), 490/500 VUs, 2090 complete and 0 interrupted iterations
default   [  39% ] 490/500 VUs  0m58.9s/2m30.0s

running (0m59.9s), 498/500 VUs, 2154 complete and 0 interrupted iterations
default   [  40% ] 498/500 VUs  0m59.9s/2m30.0s

running (1m00.9s), 500/500 VUs, 2227 complete and 0 interrupted iterations
default   [  41% ] 500/500 VUs  1m00.9s/2m30.0s

running (1m02.0s), 500/500 VUs, 2322 complete and 0 interrupted iterations
default   [  41% ] 500/500 VUs  1m02.0s/2m30.0s

running (1m02.9s), 500/500 VUs, 2370 complete and 0 interrupted iterations
default   [  42% ] 500/500 VUs  1m02.9s/2m30.0s

running (1m03.9s), 500/500 VUs, 2446 complete and 0 interrupted iterations
default   [  43% ] 500/500 VUs  1m03.9s/2m30.0s

running (1m04.9s), 500/500 VUs, 2530 complete and 0 interrupted iterations
default   [  43% ] 500/500 VUs  1m04.9s/2m30.0s

running (1m05.9s), 500/500 VUs, 2600 complete and 0 interrupted iterations
default   [  44% ] 500/500 VUs  1m05.9s/2m30.0s

running (1m06.9s), 500/500 VUs, 2673 complete and 0 interrupted iterations
default   [  45% ] 500/500 VUs  1m06.9s/2m30.0s

running (1m07.9s), 500/500 VUs, 2723 complete and 0 interrupted iterations
default   [  45% ] 500/500 VUs  1m07.9s/2m30.0s

running (1m08.9s), 500/500 VUs, 2782 complete and 0 interrupted iterations
default   [  46% ] 500/500 VUs  1m08.9s/2m30.0s

running (1m09.9s), 500/500 VUs, 2874 complete and 0 interrupted iterations
default   [  47% ] 500/500 VUs  1m09.9s/2m30.0s

running (1m10.9s), 500/500 VUs, 2946 complete and 0 interrupted iterations
default   [  47% ] 500/500 VUs  1m10.9s/2m30.0s

running (1m11.9s), 500/500 VUs, 3013 complete and 0 interrupted iterations
default   [  48% ] 500/500 VUs  1m11.9s/2m30.0s

running (1m12.9s), 500/500 VUs, 3083 complete and 0 interrupted iterations
default   [  49% ] 500/500 VUs  1m12.9s/2m30.0s

running (1m13.9s), 500/500 VUs, 3145 complete and 0 interrupted iterations
default   [  49% ] 500/500 VUs  1m13.9s/2m30.0s

running (1m14.9s), 500/500 VUs, 3216 complete and 0 interrupted iterations
default   [  50% ] 500/500 VUs  1m14.9s/2m30.0s

running (1m15.9s), 500/500 VUs, 3278 complete and 0 interrupted iterations
default   [  51% ] 500/500 VUs  1m15.9s/2m30.0s

running (1m16.9s), 500/500 VUs, 3345 complete and 0 interrupted iterations
default   [  51% ] 500/500 VUs  1m16.9s/2m30.0s

running (1m17.9s), 500/500 VUs, 3442 complete and 0 interrupted iterations
default   [  52% ] 500/500 VUs  1m17.9s/2m30.0s

running (1m18.9s), 500/500 VUs, 3499 complete and 0 interrupted iterations
default   [  53% ] 500/500 VUs  1m18.9s/2m30.0s

running (1m19.9s), 500/500 VUs, 3576 complete and 0 interrupted iterations
default   [  53% ] 500/500 VUs  1m19.9s/2m30.0s

running (1m20.9s), 500/500 VUs, 3663 complete and 0 interrupted iterations
default   [  54% ] 500/500 VUs  1m20.9s/2m30.0s

running (1m21.9s), 500/500 VUs, 3719 complete and 0 interrupted iterations
default   [  55% ] 500/500 VUs  1m21.9s/2m30.0s

running (1m22.9s), 500/500 VUs, 3787 complete and 0 interrupted iterations
default   [  55% ] 500/500 VUs  1m22.9s/2m30.0s

running (1m23.9s), 500/500 VUs, 3842 complete and 0 interrupted iterations
default   [  56% ] 500/500 VUs  1m23.9s/2m30.0s

running (1m24.9s), 500/500 VUs, 3915 complete and 0 interrupted iterations
default   [  57% ] 500/500 VUs  1m24.9s/2m30.0s

running (1m25.9s), 500/500 VUs, 4018 complete and 0 interrupted iterations
default   [  57% ] 500/500 VUs  1m25.9s/2m30.0s

running (1m26.9s), 500/500 VUs, 4081 complete and 0 interrupted iterations
default   [  58% ] 500/500 VUs  1m26.9s/2m30.0s

running (1m27.9s), 500/500 VUs, 4167 complete and 0 interrupted iterations
default   [  59% ] 500/500 VUs  1m27.9s/2m30.0s

running (1m28.9s), 500/500 VUs, 4239 complete and 0 interrupted iterations
default   [  59% ] 500/500 VUs  1m28.9s/2m30.0s

running (1m29.9s), 500/500 VUs, 4306 complete and 0 interrupted iterations
default   [  60% ] 500/500 VUs  1m29.9s/2m30.0s

running (1m30.9s), 500/500 VUs, 4360 complete and 0 interrupted iterations
default   [  61% ] 500/500 VUs  1m30.9s/2m30.0s

running (1m32.0s), 500/500 VUs, 4440 complete and 0 interrupted iterations
default   [  61% ] 500/500 VUs  1m32.0s/2m30.0s

running (1m32.9s), 500/500 VUs, 4515 complete and 0 interrupted iterations
default   [  62% ] 500/500 VUs  1m32.9s/2m30.0s

running (1m33.9s), 500/500 VUs, 4608 complete and 0 interrupted iterations
default   [  63% ] 500/500 VUs  1m33.9s/2m30.0s

running (1m35.4s), 500/500 VUs, 4718 complete and 0 interrupted iterations
default   [  64% ] 500/500 VUs  1m35.4s/2m30.0s

running (1m35.9s), 500/500 VUs, 4744 complete and 0 interrupted iterations
default   [  64% ] 500/500 VUs  1m35.9s/2m30.0s

running (1m36.9s), 500/500 VUs, 4807 complete and 0 interrupted iterations
default   [  65% ] 500/500 VUs  1m36.9s/2m30.0s

running (1m37.9s), 500/500 VUs, 4880 complete and 0 interrupted iterations
default   [  65% ] 500/500 VUs  1m37.9s/2m30.0s

running (1m38.9s), 500/500 VUs, 4938 complete and 0 interrupted iterations
default   [  66% ] 500/500 VUs  1m38.9s/2m30.0s

running (1m39.9s), 500/500 VUs, 5021 complete and 0 interrupted iterations
default   [  67% ] 500/500 VUs  1m39.9s/2m30.0s

running (1m40.9s), 500/500 VUs, 5114 complete and 0 interrupted iterations
default   [  67% ] 500/500 VUs  1m40.9s/2m30.0s

running (1m41.9s), 500/500 VUs, 5182 complete and 0 interrupted iterations
default   [  68% ] 500/500 VUs  1m41.9s/2m30.0s

running (1m42.9s), 500/500 VUs, 5250 complete and 0 interrupted iterations
default   [  69% ] 500/500 VUs  1m42.9s/2m30.0s

running (1m43.9s), 500/500 VUs, 5315 complete and 0 interrupted iterations
default   [  69% ] 500/500 VUs  1m43.9s/2m30.0s

running (1m44.9s), 500/500 VUs, 5384 complete and 0 interrupted iterations
default   [  70% ] 500/500 VUs  1m44.9s/2m30.0s

running (1m45.9s), 500/500 VUs, 5444 complete and 0 interrupted iterations
default   [  71% ] 500/500 VUs  1m45.9s/2m30.0s

running (1m46.9s), 500/500 VUs, 5515 complete and 0 interrupted iterations
default   [  71% ] 500/500 VUs  1m46.9s/2m30.0s

running (1m47.9s), 500/500 VUs, 5629 complete and 0 interrupted iterations
default   [  72% ] 500/500 VUs  1m47.9s/2m30.0s

running (1m48.9s), 500/500 VUs, 5673 complete and 0 interrupted iterations
default   [  73% ] 500/500 VUs  1m48.9s/2m30.0s

running (1m49.9s), 500/500 VUs, 5746 complete and 0 interrupted iterations
default   [  73% ] 500/500 VUs  1m49.9s/2m30.0s

running (1m50.9s), 500/500 VUs, 5831 complete and 0 interrupted iterations
default   [  74% ] 500/500 VUs  1m50.9s/2m30.0s

running (1m51.9s), 500/500 VUs, 5879 complete and 0 interrupted iterations
default   [  75% ] 500/500 VUs  1m51.9s/2m30.0s

running (1m52.9s), 500/500 VUs, 5947 complete and 0 interrupted iterations
default   [  75% ] 500/500 VUs  1m52.9s/2m30.0s

running (1m53.9s), 500/500 VUs, 6033 complete and 0 interrupted iterations
default   [  76% ] 500/500 VUs  1m53.9s/2m30.0s

running (1m54.9s), 500/500 VUs, 6095 complete and 0 interrupted iterations
default   [  77% ] 500/500 VUs  1m54.9s/2m30.0s

running (1m56.2s), 500/500 VUs, 6198 complete and 0 interrupted iterations
default   [  77% ] 500/500 VUs  1m56.2s/2m30.0s

running (1m56.9s), 500/500 VUs, 6253 complete and 0 interrupted iterations
default   [  78% ] 500/500 VUs  1m56.9s/2m30.0s

running (1m57.9s), 500/500 VUs, 6327 complete and 0 interrupted iterations
default   [  79% ] 500/500 VUs  1m57.9s/2m30.0s

running (1m58.9s), 500/500 VUs, 6407 complete and 0 interrupted iterations
default   [  79% ] 500/500 VUs  1m58.9s/2m30.0s

running (1m59.9s), 500/500 VUs, 6479 complete and 0 interrupted iterations
default   [  80% ] 500/500 VUs  1m59.9s/2m30.0s

running (2m00.9s), 500/500 VUs, 6520 complete and 0 interrupted iterations
default   [  81% ] 500/500 VUs  2m00.9s/2m30.0s

running (2m01.9s), 491/500 VUs, 6602 complete and 0 interrupted iterations
default   [  81% ] 491/500 VUs  2m01.9s/2m30.0s

running (2m02.9s), 487/500 VUs, 6680 complete and 0 interrupted iterations
default   [  82% ] 487/500 VUs  2m02.9s/2m30.0s

running (2m03.9s), 481/500 VUs, 6769 complete and 0 interrupted iterations
default   [  83% ] 481/500 VUs  2m03.9s/2m30.0s

running (2m04.9s), 474/500 VUs, 6833 complete and 0 interrupted iterations
default   [  83% ] 474/500 VUs  2m04.9s/2m30.0s

running (2m05.9s), 457/500 VUs, 6909 complete and 0 interrupted iterations
default   [  84% ] 457/500 VUs  2m05.9s/2m30.0s

running (2m06.9s), 437/500 VUs, 7005 complete and 0 interrupted iterations
default   [  85% ] 437/500 VUs  2m06.9s/2m30.0s

running (2m07.9s), 428/500 VUs, 7043 complete and 0 interrupted iterations
default   [  85% ] 428/500 VUs  2m07.9s/2m30.0s

running (2m08.9s), 411/500 VUs, 7103 complete and 0 interrupted iterations
default   [  86% ] 411/500 VUs  2m08.9s/2m30.0s

running (2m09.9s), 386/500 VUs, 7201 complete and 0 interrupted iterations
default   [  87% ] 386/500 VUs  2m09.9s/2m30.0s

running (2m10.9s), 366/500 VUs, 7282 complete and 0 interrupted iterations
default   [  87% ] 366/500 VUs  2m10.9s/2m30.0s

running (2m11.9s), 356/500 VUs, 7336 complete and 0 interrupted iterations
default   [  88% ] 356/500 VUs  2m11.9s/2m30.0s

running (2m12.9s), 327/500 VUs, 7422 complete and 0 interrupted iterations
default   [  89% ] 327/500 VUs  2m12.9s/2m30.0s

running (2m13.9s), 315/500 VUs, 7467 complete and 0 interrupted iterations
default   [  89% ] 315/500 VUs  2m13.9s/2m30.0s

running (2m14.9s), 304/500 VUs, 7513 complete and 0 interrupted iterations
default   [  90% ] 304/500 VUs  2m14.9s/2m30.0s

running (2m15.9s), 286/500 VUs, 7586 complete and 0 interrupted iterations
default   [  91% ] 286/500 VUs  2m15.9s/2m30.0s

running (2m16.9s), 272/500 VUs, 7638 complete and 0 interrupted iterations
default   [  91% ] 272/500 VUs  2m16.9s/2m30.0s

running (2m17.9s), 261/500 VUs, 7691 complete and 0 interrupted iterations
default   [  92% ] 261/500 VUs  2m17.9s/2m30.0s

running (2m18.9s), 237/500 VUs, 7748 complete and 0 interrupted iterations
default   [  93% ] 237/500 VUs  2m18.9s/2m30.0s

running (2m19.9s), 228/500 VUs, 7780 complete and 0 interrupted iterations
default   [  93% ] 228/500 VUs  2m19.9s/2m30.0s

running (2m20.9s), 215/500 VUs, 7816 complete and 0 interrupted iterations
default   [  94% ] 215/500 VUs  2m20.9s/2m30.0s

running (2m21.9s), 191/500 VUs, 7865 complete and 0 interrupted iterations
default   [  95% ] 191/500 VUs  2m21.9s/2m30.0s

running (2m22.9s), 174/500 VUs, 7908 complete and 0 interrupted iterations
default   [  95% ] 174/500 VUs  2m22.9s/2m30.0s

running (2m23.9s), 150/500 VUs, 7952 complete and 0 interrupted iterations
default   [  96% ] 150/500 VUs  2m23.9s/2m30.0s

running (2m24.9s), 131/500 VUs, 7985 complete and 0 interrupted iterations
default   [  97% ] 131/500 VUs  2m24.9s/2m30.0s

running (2m25.9s), 117/500 VUs, 8008 complete and 0 interrupted iterations
default   [  97% ] 117/500 VUs  2m25.9s/2m30.0s

running (2m26.9s), 101/500 VUs, 8031 complete and 0 interrupted iterations
default   [  98% ] 101/500 VUs  2m26.9s/2m30.0s

running (2m27.9s), 085/500 VUs, 8055 complete and 0 interrupted iterations
default   [  99% ] 085/500 VUs  2m27.9s/2m30.0s

running (2m28.9s), 061/500 VUs, 8082 complete and 0 interrupted iterations
default   [  99% ] 061/500 VUs  2m28.9s/2m30.0s

running (2m29.9s), 044/500 VUs, 8102 complete and 0 interrupted iterations
default   [ 100% ] 044/500 VUs  2m29.9s/2m30.0s

running (2m30.9s), 030/500 VUs, 8116 complete and 0 interrupted iterations
default ↓ [ 100% ] 043/500 VUs  2m30s

running (2m31.9s), 022/500 VUs, 8124 complete and 0 interrupted iterations
default ↓ [ 100% ] 043/500 VUs  2m30s

running (2m32.9s), 014/500 VUs, 8132 complete and 0 interrupted iterations
default ↓ [ 100% ] 043/500 VUs  2m30s

running (2m33.9s), 006/500 VUs, 8140 complete and 0 interrupted iterations
default ↓ [ 100% ] 043/500 VUs  2m30s

running (2m34.9s), 003/500 VUs, 8143 complete and 0 interrupted iterations
default ↓ [ 100% ] 043/500 VUs  2m30s


  █ THRESHOLDS 

    active_clients_time
    ✓ 'p(95)<500' p(95)=149ms

    attach_documents_time
    ✓ 'p(95)<10000' p(95)=512ms

    deactivate_clients_time
    ✓ 'p(95)<10000' p(95)=149.75ms

    http_req_duration
    ✓ 'p(95)<10000' p(95)=251.03ms

    pushpulls_time
    ✓ 'p(95)<1000' p(95)=281ms

    transaction_success_rate
    ✓ 'rate>0.99' rate=100.00%

    transaction_time
    ✓ 'p(95)<30000' p(95)=7.47s


  █ TOTAL RESULTS 

    checks_total.......: 130336  837.812637/s
    checks_succeeded...: 100.00% 130336 out of 130336
    checks_failed......: 0.00%   0 out of 130336

    ✓ status is 200
    ✓ response has valid body

    CUSTOM
    active_clients....................: 8146    52.36329/s
    active_clients_success_rate.......: 100.00% 8146 out of 8146
    active_clients_time...............: avg=33.48ms  min=1ms     med=7ms     max=724ms    p(90)=108ms    p(95)=149ms   
    attach_documents..................: 8146    52.36329/s
    attach_documents_success_rate.....: 100.00% 8146 out of 8146
    attach_documents_time.............: avg=124.35ms min=3ms     med=31ms    max=990ms    p(90)=397ms    p(95)=512ms   
    deactivate_clients................: 8146    52.36329/s
    deactivate_clients_success_rate...: 100.00% 8146 out of 8146
    deactivate_clients_time...........: avg=31.55ms  min=0s      med=5ms     max=635ms    p(90)=100ms    p(95)=149.75ms
    pushpulls.........................: 40730   261.816449/s
    pushpulls_success_rate............: 100.00% 40730 out of 40730
    pushpulls_time....................: avg=71.6ms   min=1ms     med=24ms    max=980ms    p(90)=207ms    p(95)=281ms   
    transaction_success_rate..........: 100.00% 8146 out of 8146
    transaction_time..................: avg=6.63s    min=6.01s   med=6.63s   max=8.73s    p(90)=7.28s    p(95)=7.47s   

    HTTP
    http_req_duration.................: avg=59.99ms  min=505.4µs med=13.51ms max=975.99ms p(90)=177.15ms p(95)=251.03ms
      { expected_response:true }......: avg=59.99ms  min=505.4µs med=13.51ms max=975.99ms p(90)=177.15ms p(95)=251.03ms
    http_req_failed...................: 0.00%   0 out of 65168
    http_reqs.........................: 65168   418.906319/s

    EXECUTION
    iteration_duration................: avg=6.63s    min=6.01s   med=6.63s   max=8.73s    p(90)=7.28s    p(95)=7.47s   
    iterations........................: 8146    52.36329/s
    vus...............................: 3       min=3              max=500
    vus_max...........................: 500     min=500            max=500

    NETWORK
    data_received.....................: 1.1 GB  7.3 MB/s
    data_sent.........................: 61 MB   394 kB/s




running (2m35.6s), 000/500 VUs, 8146 complete and 0 interrupted iterations
default ✓ [ 100% ] 000/500 VUs  2m30s
