
         /\      Grafana   /‾‾/  
    /\  /  \     |\  __   /  /   
   /  \/    \    | |/ /  /   ‾‾\ 
  /          \   |   (  |  (‾)  |
 / __________ \  |_|\_\  \_____/ 

     execution: local
        script: test/k6/presence.ts
        output: -

     scenarios: (100.00%) 1 scenario, 500 max VUs, 3m0s max duration (incl. graceful stop):
              * default: Up to 500 looping VUs for 2m30s over 3 stages (gracefulRampDown: 30s, gracefulStop: 30s)


running (0m00.9s), 008/500 VUs, 0 complete and 0 interrupted iterations
default   [   1% ] 008/500 VUs  0m00.9s/2m30.0s

running (0m01.9s), 016/500 VUs, 0 complete and 0 interrupted iterations
default   [   1% ] 016/500 VUs  0m01.9s/2m30.0s

running (0m02.9s), 024/500 VUs, 0 complete and 0 interrupted iterations
default   [   2% ] 024/500 VUs  0m02.9s/2m30.0s

running (0m03.9s), 033/500 VUs, 0 complete and 0 interrupted iterations
default   [   3% ] 033/500 VUs  0m03.9s/2m30.0s

running (0m04.9s), 041/500 VUs, 0 complete and 0 interrupted iterations
default   [   3% ] 041/500 VUs  0m04.9s/2m30.0s

running (0m05.9s), 049/500 VUs, 0 complete and 0 interrupted iterations
default   [   4% ] 049/500 VUs  0m05.9s/2m30.0s

running (0m06.9s), 058/500 VUs, 8 complete and 0 interrupted iterations
default   [   5% ] 058/500 VUs  0m06.9s/2m30.0s

running (0m07.9s), 066/500 VUs, 16 complete and 0 interrupted iterations
default   [   5% ] 066/500 VUs  0m07.9s/2m30.0s

running (0m08.9s), 074/500 VUs, 24 complete and 0 interrupted iterations
default   [   6% ] 074/500 VUs  0m08.9s/2m30.0s

running (0m09.9s), 083/500 VUs, 33 complete and 0 interrupted iterations
default   [   7% ] 083/500 VUs  0m09.9s/2m30.0s

running (0m10.9s), 091/500 VUs, 41 complete and 0 interrupted iterations
default   [   7% ] 091/500 VUs  0m10.9s/2m30.0s

running (0m11.9s), 099/500 VUs, 49 complete and 0 interrupted iterations
default   [   8% ] 099/500 VUs  0m11.9s/2m30.0s

running (0m12.9s), 108/500 VUs, 66 complete and 0 interrupted iterations
default   [   9% ] 108/500 VUs  0m12.9s/2m30.0s

running (0m13.9s), 116/500 VUs, 82 complete and 0 interrupted iterations
default   [   9% ] 116/500 VUs  0m13.9s/2m30.0s

running (0m14.9s), 124/500 VUs, 98 complete and 0 interrupted iterations
default   [  10% ] 124/500 VUs  0m14.9s/2m30.0s

running (0m15.9s), 133/500 VUs, 115 complete and 0 interrupted iterations
default   [  11% ] 133/500 VUs  0m15.9s/2m30.0s

running (0m16.9s), 141/500 VUs, 132 complete and 0 interrupted iterations
default   [  11% ] 141/500 VUs  0m16.9s/2m30.0s

running (0m17.9s), 149/500 VUs, 148 complete and 0 interrupted iterations
default   [  12% ] 149/500 VUs  0m17.9s/2m30.0s

running (0m18.9s), 158/500 VUs, 171 complete and 0 interrupted iterations
default   [  13% ] 158/500 VUs  0m18.9s/2m30.0s

running (0m19.9s), 166/500 VUs, 198 complete and 0 interrupted iterations
default   [  13% ] 166/500 VUs  0m19.9s/2m30.0s

running (0m20.9s), 174/500 VUs, 222 complete and 0 interrupted iterations
default   [  14% ] 174/500 VUs  0m20.9s/2m30.0s

running (0m21.9s), 182/500 VUs, 246 complete and 0 interrupted iterations
default   [  15% ] 182/500 VUs  0m21.9s/2m30.0s

running (0m22.9s), 191/500 VUs, 273 complete and 0 interrupted iterations
default   [  15% ] 191/500 VUs  0m22.9s/2m30.0s

running (0m23.9s), 199/500 VUs, 297 complete and 0 interrupted iterations
default   [  16% ] 199/500 VUs  0m23.9s/2m30.0s

running (0m24.9s), 207/500 VUs, 328 complete and 0 interrupted iterations
default   [  17% ] 207/500 VUs  0m24.9s/2m30.0s

running (0m25.9s), 216/500 VUs, 362 complete and 0 interrupted iterations
default   [  17% ] 216/500 VUs  0m25.9s/2m30.0s

running (0m26.9s), 224/500 VUs, 396 complete and 0 interrupted iterations
default   [  18% ] 224/500 VUs  0m26.9s/2m30.0s

running (0m27.9s), 232/500 VUs, 428 complete and 0 interrupted iterations
default   [  19% ] 232/500 VUs  0m27.9s/2m30.0s

running (0m28.9s), 241/500 VUs, 462 complete and 0 interrupted iterations
default   [  19% ] 241/500 VUs  0m28.9s/2m30.0s

running (0m29.9s), 249/500 VUs, 496 complete and 0 interrupted iterations
default   [  20% ] 249/500 VUs  0m29.9s/2m30.0s

running (0m30.9s), 257/500 VUs, 535 complete and 0 interrupted iterations
default   [  21% ] 257/500 VUs  0m30.9s/2m30.0s

running (0m31.9s), 266/500 VUs, 577 complete and 0 interrupted iterations
default   [  21% ] 266/500 VUs  0m31.9s/2m30.0s

running (0m32.9s), 274/500 VUs, 620 complete and 0 interrupted iterations
default   [  22% ] 274/500 VUs  0m32.9s/2m30.0s

running (0m33.9s), 282/500 VUs, 660 complete and 0 interrupted iterations
default   [  23% ] 282/500 VUs  0m33.9s/2m30.0s

running (0m34.9s), 291/500 VUs, 700 complete and 0 interrupted iterations
default   [  23% ] 291/500 VUs  0m34.9s/2m30.0s

running (0m35.9s), 299/500 VUs, 744 complete and 0 interrupted iterations
default   [  24% ] 299/500 VUs  0m35.9s/2m30.0s

running (0m36.9s), 307/500 VUs, 792 complete and 0 interrupted iterations
default   [  25% ] 307/500 VUs  0m36.9s/2m30.0s

running (0m37.9s), 316/500 VUs, 840 complete and 0 interrupted iterations
default   [  25% ] 316/500 VUs  0m37.9s/2m30.0s

running (0m38.9s), 324/500 VUs, 892 complete and 0 interrupted iterations
default   [  26% ] 324/500 VUs  0m38.9s/2m30.0s

running (0m39.9s), 332/500 VUs, 942 complete and 0 interrupted iterations
default   [  27% ] 332/500 VUs  0m39.9s/2m30.0s

running (0m40.9s), 341/500 VUs, 990 complete and 0 interrupted iterations
default   [  27% ] 341/500 VUs  0m40.9s/2m30.0s

running (0m41.9s), 349/500 VUs, 1039 complete and 0 interrupted iterations
default   [  28% ] 349/500 VUs  0m41.9s/2m30.0s

running (0m42.9s), 357/500 VUs, 1098 complete and 0 interrupted iterations
default   [  29% ] 357/500 VUs  0m42.9s/2m30.0s

running (0m43.9s), 365/500 VUs, 1155 complete and 0 interrupted iterations
default   [  29% ] 365/500 VUs  0m43.9s/2m30.0s

running (0m44.9s), 374/500 VUs, 1212 complete and 0 interrupted iterations
default   [  30% ] 374/500 VUs  0m44.9s/2m30.0s

running (0m45.9s), 382/500 VUs, 1272 complete and 0 interrupted iterations
default   [  31% ] 382/500 VUs  0m45.9s/2m30.0s

running (0m46.9s), 390/500 VUs, 1326 complete and 0 interrupted iterations
default   [  31% ] 390/500 VUs  0m46.9s/2m30.0s

running (0m47.9s), 399/500 VUs, 1386 complete and 0 interrupted iterations
default   [  32% ] 399/500 VUs  0m47.9s/2m30.0s

running (0m48.9s), 407/500 VUs, 1450 complete and 0 interrupted iterations
default   [  33% ] 407/500 VUs  0m48.9s/2m30.0s

running (0m49.9s), 415/500 VUs, 1517 complete and 0 interrupted iterations
default   [  33% ] 415/500 VUs  0m49.9s/2m30.0s

running (0m50.9s), 424/500 VUs, 1581 complete and 0 interrupted iterations
default   [  34% ] 424/500 VUs  0m50.9s/2m30.0s

running (0m51.9s), 432/500 VUs, 1647 complete and 0 interrupted iterations
default   [  35% ] 432/500 VUs  0m51.9s/2m30.0s

running (0m52.9s), 440/500 VUs, 1713 complete and 0 interrupted iterations
default   [  35% ] 440/500 VUs  0m52.9s/2m30.0s

running (0m53.9s), 449/500 VUs, 1779 complete and 0 interrupted iterations
default   [  36% ] 449/500 VUs  0m53.9s/2m30.0s

running (0m54.9s), 457/500 VUs, 1852 complete and 0 interrupted iterations
default   [  37% ] 457/500 VUs  0m54.9s/2m30.0s

running (0m55.9s), 465/500 VUs, 1920 complete and 0 interrupted iterations
default   [  37% ] 465/500 VUs  0m55.9s/2m30.0s

running (0m56.9s), 474/500 VUs, 1989 complete and 0 interrupted iterations
default   [  38% ] 474/500 VUs  0m56.9s/2m30.0s

running (0m57.9s), 482/500 VUs, 2064 complete and 0 interrupted iterations
default   [  39% ] 482/500 VUs  0m57.9s/2m30.0s

running (0m58.9s), 490/500 VUs, 2138 complete and 0 interrupted iterations
default   [  39% ] 490/500 VUs  0m58.9s/2m30.0s

running (0m59.9s), 498/500 VUs, 2196 complete and 0 interrupted iterations
default   [  40% ] 498/500 VUs  0m59.9s/2m30.0s

running (1m00.9s), 500/500 VUs, 2261 complete and 0 interrupted iterations
default   [  41% ] 500/500 VUs  1m00.9s/2m30.0s

running (1m01.9s), 500/500 VUs, 2346 complete and 0 interrupted iterations
default   [  41% ] 500/500 VUs  1m01.9s/2m30.0s

running (1m02.9s), 500/500 VUs, 2431 complete and 0 interrupted iterations
default   [  42% ] 500/500 VUs  1m02.9s/2m30.0s

running (1m03.9s), 500/500 VUs, 2487 complete and 0 interrupted iterations
default   [  43% ] 500/500 VUs  1m03.9s/2m30.0s

running (1m04.9s), 500/500 VUs, 2574 complete and 0 interrupted iterations
default   [  43% ] 500/500 VUs  1m04.9s/2m30.0s

running (1m05.9s), 500/500 VUs, 2657 complete and 0 interrupted iterations
default   [  44% ] 500/500 VUs  1m05.9s/2m30.0s

running (1m06.9s), 500/500 VUs, 2736 complete and 0 interrupted iterations
default   [  45% ] 500/500 VUs  1m06.9s/2m30.0s

running (1m07.9s), 500/500 VUs, 2775 complete and 0 interrupted iterations
default   [  45% ] 500/500 VUs  1m07.9s/2m30.0s

running (1m08.9s), 500/500 VUs, 2869 complete and 0 interrupted iterations
default   [  46% ] 500/500 VUs  1m08.9s/2m30.0s

running (1m09.9s), 500/500 VUs, 2938 complete and 0 interrupted iterations
default   [  47% ] 500/500 VUs  1m09.9s/2m30.0s

running (1m10.9s), 500/500 VUs, 3018 complete and 0 interrupted iterations
default   [  47% ] 500/500 VUs  1m10.9s/2m30.0s

running (1m11.9s), 500/500 VUs, 3106 complete and 0 interrupted iterations
default   [  48% ] 500/500 VUs  1m11.9s/2m30.0s

running (1m12.9s), 500/500 VUs, 3184 complete and 0 interrupted iterations
default   [  49% ] 500/500 VUs  1m12.9s/2m30.0s

running (1m13.9s), 500/500 VUs, 3267 complete and 0 interrupted iterations
default   [  49% ] 500/500 VUs  1m13.9s/2m30.0s

running (1m14.9s), 500/500 VUs, 3328 complete and 0 interrupted iterations
default   [  50% ] 500/500 VUs  1m14.9s/2m30.0s

running (1m15.9s), 500/500 VUs, 3398 complete and 0 interrupted iterations
default   [  51% ] 500/500 VUs  1m15.9s/2m30.0s

running (1m16.9s), 500/500 VUs, 3484 complete and 0 interrupted iterations
default   [  51% ] 500/500 VUs  1m16.9s/2m30.0s

running (1m17.9s), 500/500 VUs, 3561 complete and 0 interrupted iterations
default   [  52% ] 500/500 VUs  1m17.9s/2m30.0s

running (1m18.9s), 500/500 VUs, 3652 complete and 0 interrupted iterations
default   [  53% ] 500/500 VUs  1m18.9s/2m30.0s

running (1m19.9s), 500/500 VUs, 3714 complete and 0 interrupted iterations
default   [  53% ] 500/500 VUs  1m19.9s/2m30.0s

running (1m20.9s), 500/500 VUs, 3790 complete and 0 interrupted iterations
default   [  54% ] 500/500 VUs  1m20.9s/2m30.0s

running (1m22.0s), 500/500 VUs, 3869 complete and 0 interrupted iterations
default   [  55% ] 500/500 VUs  1m22.0s/2m30.0s

running (1m22.9s), 500/500 VUs, 3942 complete and 0 interrupted iterations
default   [  55% ] 500/500 VUs  1m22.9s/2m30.0s

running (1m23.9s), 500/500 VUs, 4006 complete and 0 interrupted iterations
default   [  56% ] 500/500 VUs  1m23.9s/2m30.0s

running (1m24.9s), 500/500 VUs, 4109 complete and 0 interrupted iterations
default   [  57% ] 500/500 VUs  1m24.9s/2m30.0s

running (1m25.9s), 500/500 VUs, 4192 complete and 0 interrupted iterations
default   [  57% ] 500/500 VUs  1m25.9s/2m30.0s

running (1m26.9s), 500/500 VUs, 4267 complete and 0 interrupted iterations
default   [  58% ] 500/500 VUs  1m26.9s/2m30.0s

running (1m27.9s), 500/500 VUs, 4333 complete and 0 interrupted iterations
default   [  59% ] 500/500 VUs  1m27.9s/2m30.0s

running (1m28.9s), 500/500 VUs, 4406 complete and 0 interrupted iterations
default   [  59% ] 500/500 VUs  1m28.9s/2m30.0s

running (1m29.9s), 500/500 VUs, 4466 complete and 0 interrupted iterations
default   [  60% ] 500/500 VUs  1m29.9s/2m30.0s

running (1m30.9s), 500/500 VUs, 4561 complete and 0 interrupted iterations
default   [  61% ] 500/500 VUs  1m30.9s/2m30.0s

running (1m31.9s), 500/500 VUs, 4658 complete and 0 interrupted iterations
default   [  61% ] 500/500 VUs  1m31.9s/2m30.0s

running (1m32.9s), 500/500 VUs, 4723 complete and 0 interrupted iterations
default   [  62% ] 500/500 VUs  1m32.9s/2m30.0s

running (1m33.9s), 500/500 VUs, 4791 complete and 0 interrupted iterations
default   [  63% ] 500/500 VUs  1m33.9s/2m30.0s

running (1m34.9s), 500/500 VUs, 4850 complete and 0 interrupted iterations
default   [  63% ] 500/500 VUs  1m34.9s/2m30.0s

running (1m35.9s), 500/500 VUs, 4942 complete and 0 interrupted iterations
default   [  64% ] 500/500 VUs  1m35.9s/2m30.0s

running (1m36.9s), 500/500 VUs, 5007 complete and 0 interrupted iterations
default   [  65% ] 500/500 VUs  1m36.9s/2m30.0s

running (1m37.9s), 500/500 VUs, 5097 complete and 0 interrupted iterations
default   [  65% ] 500/500 VUs  1m37.9s/2m30.0s

running (1m38.9s), 500/500 VUs, 5189 complete and 0 interrupted iterations
default   [  66% ] 500/500 VUs  1m38.9s/2m30.0s

running (1m39.9s), 500/500 VUs, 5264 complete and 0 interrupted iterations
default   [  67% ] 500/500 VUs  1m39.9s/2m30.0s

running (1m40.9s), 500/500 VUs, 5332 complete and 0 interrupted iterations
default   [  67% ] 500/500 VUs  1m40.9s/2m30.0s

running (1m41.9s), 500/500 VUs, 5392 complete and 0 interrupted iterations
default   [  68% ] 500/500 VUs  1m41.9s/2m30.0s

running (1m42.9s), 500/500 VUs, 5465 complete and 0 interrupted iterations
default   [  69% ] 500/500 VUs  1m42.9s/2m30.0s

running (1m43.9s), 500/500 VUs, 5555 complete and 0 interrupted iterations
default   [  69% ] 500/500 VUs  1m43.9s/2m30.0s

running (1m44.9s), 500/500 VUs, 5648 complete and 0 interrupted iterations
default   [  70% ] 500/500 VUs  1m44.9s/2m30.0s

running (1m45.9s), 500/500 VUs, 5713 complete and 0 interrupted iterations
default   [  71% ] 500/500 VUs  1m45.9s/2m30.0s

running (1m46.9s), 500/500 VUs, 5785 complete and 0 interrupted iterations
default   [  71% ] 500/500 VUs  1m46.9s/2m30.0s

running (1m47.9s), 500/500 VUs, 5865 complete and 0 interrupted iterations
default   [  72% ] 500/500 VUs  1m47.9s/2m30.0s

running (1m48.9s), 500/500 VUs, 5950 complete and 0 interrupted iterations
default   [  73% ] 500/500 VUs  1m48.9s/2m30.0s

running (1m49.9s), 500/500 VUs, 6010 complete and 0 interrupted iterations
default   [  73% ] 500/500 VUs  1m49.9s/2m30.0s

running (1m50.9s), 500/500 VUs, 6102 complete and 0 interrupted iterations
default   [  74% ] 500/500 VUs  1m50.9s/2m30.0s

running (1m51.9s), 500/500 VUs, 6188 complete and 0 interrupted iterations
default   [  75% ] 500/500 VUs  1m51.9s/2m30.0s

running (1m52.9s), 500/500 VUs, 6266 complete and 0 interrupted iterations
default   [  75% ] 500/500 VUs  1m52.9s/2m30.0s

running (1m53.9s), 500/500 VUs, 6340 complete and 0 interrupted iterations
default   [  76% ] 500/500 VUs  1m53.9s/2m30.0s

running (1m54.9s), 500/500 VUs, 6403 complete and 0 interrupted iterations
default   [  77% ] 500/500 VUs  1m54.9s/2m30.0s

running (1m55.9s), 500/500 VUs, 6488 complete and 0 interrupted iterations
default   [  77% ] 500/500 VUs  1m55.9s/2m30.0s

running (1m56.9s), 500/500 VUs, 6572 complete and 0 interrupted iterations
default   [  78% ] 500/500 VUs  1m56.9s/2m30.0s

running (1m57.9s), 500/500 VUs, 6671 complete and 0 interrupted iterations
default   [  79% ] 500/500 VUs  1m57.9s/2m30.0s

running (1m58.9s), 500/500 VUs, 6755 complete and 0 interrupted iterations
default   [  79% ] 500/500 VUs  1m58.9s/2m30.0s

running (1m59.9s), 500/500 VUs, 6809 complete and 0 interrupted iterations
default   [  80% ] 500/500 VUs  1m59.9s/2m30.0s

running (2m00.9s), 500/500 VUs, 6878 complete and 0 interrupted iterations
default   [  81% ] 500/500 VUs  2m00.9s/2m30.0s

running (2m01.9s), 499/500 VUs, 6970 complete and 0 interrupted iterations
default   [  81% ] 499/500 VUs  2m01.9s/2m30.0s

running (2m02.9s), 489/500 VUs, 7058 complete and 0 interrupted iterations
default   [  82% ] 489/500 VUs  2m02.9s/2m30.0s

running (2m03.9s), 478/500 VUs, 7141 complete and 0 interrupted iterations
default   [  83% ] 478/500 VUs  2m03.9s/2m30.0s

running (2m04.9s), 471/500 VUs, 7183 complete and 0 interrupted iterations
default   [  83% ] 471/500 VUs  2m04.9s/2m30.0s

running (2m05.9s), 451/500 VUs, 7289 complete and 0 interrupted iterations
default   [  84% ] 451/500 VUs  2m05.9s/2m30.0s

running (2m06.9s), 434/500 VUs, 7378 complete and 0 interrupted iterations
default   [  85% ] 434/500 VUs  2m06.9s/2m30.0s

running (2m07.9s), 417/500 VUs, 7467 complete and 0 interrupted iterations
default   [  85% ] 417/500 VUs  2m07.9s/2m30.0s

running (2m08.9s), 407/500 VUs, 7503 complete and 0 interrupted iterations
default   [  86% ] 407/500 VUs  2m08.9s/2m30.0s

running (2m09.9s), 391/500 VUs, 7581 complete and 0 interrupted iterations
default   [  87% ] 391/500 VUs  2m09.9s/2m30.0s

running (2m10.9s), 370/500 VUs, 7654 complete and 0 interrupted iterations
default   [  87% ] 370/500 VUs  2m10.9s/2m30.0s

running (2m11.9s), 354/500 VUs, 7738 complete and 0 interrupted iterations
default   [  88% ] 354/500 VUs  2m11.9s/2m30.0s

running (2m12.9s), 333/500 VUs, 7809 complete and 0 interrupted iterations
default   [  89% ] 333/500 VUs  2m12.9s/2m30.0s

running (2m13.9s), 322/500 VUs, 7852 complete and 0 interrupted iterations
default   [  89% ] 322/500 VUs  2m13.9s/2m30.0s

running (2m14.9s), 309/500 VUs, 7901 complete and 0 interrupted iterations
default   [  90% ] 309/500 VUs  2m14.9s/2m30.0s

running (2m15.9s), 290/500 VUs, 7970 complete and 0 interrupted iterations
default   [  91% ] 290/500 VUs  2m15.9s/2m30.0s

running (2m16.9s), 271/500 VUs, 8024 complete and 0 interrupted iterations
default   [  91% ] 271/500 VUs  2m16.9s/2m30.0s

running (2m17.9s), 249/500 VUs, 8091 complete and 0 interrupted iterations
default   [  92% ] 249/500 VUs  2m17.9s/2m30.0s

running (2m18.9s), 236/500 VUs, 8141 complete and 0 interrupted iterations
default   [  93% ] 236/500 VUs  2m18.9s/2m30.0s

running (2m19.9s), 224/500 VUs, 8172 complete and 0 interrupted iterations
default   [  93% ] 224/500 VUs  2m19.9s/2m30.0s

running (2m20.9s), 205/500 VUs, 8210 complete and 0 interrupted iterations
default   [  94% ] 205/500 VUs  2m20.9s/2m30.0s

running (2m21.9s), 187/500 VUs, 8260 complete and 0 interrupted iterations
default   [  95% ] 187/500 VUs  2m21.9s/2m30.0s

running (2m22.9s), 169/500 VUs, 8295 complete and 0 interrupted iterations
default   [  95% ] 169/500 VUs  2m22.9s/2m30.0s

running (2m23.9s), 148/500 VUs, 8340 complete and 0 interrupted iterations
default   [  96% ] 148/500 VUs  2m23.9s/2m30.0s

running (2m24.9s), 130/500 VUs, 8376 complete and 0 interrupted iterations
default   [  97% ] 130/500 VUs  2m24.9s/2m30.0s

running (2m25.9s), 122/500 VUs, 8394 complete and 0 interrupted iterations
default   [  97% ] 122/500 VUs  2m25.9s/2m30.0s

running (2m26.9s), 107/500 VUs, 8415 complete and 0 interrupted iterations
default   [  98% ] 107/500 VUs  2m26.9s/2m30.0s

running (2m27.9s), 083/500 VUs, 8447 complete and 0 interrupted iterations
default   [  99% ] 083/500 VUs  2m27.9s/2m30.0s

running (2m28.9s), 069/500 VUs, 8464 complete and 0 interrupted iterations
default   [  99% ] 069/500 VUs  2m28.9s/2m30.0s

running (2m29.9s), 049/500 VUs, 8488 complete and 0 interrupted iterations
default   [ 100% ] 049/500 VUs  2m29.9s/2m30.0s

running (2m30.9s), 031/500 VUs, 8506 complete and 0 interrupted iterations
default ↓ [ 100% ] 049/500 VUs  2m30s

running (2m31.9s), 023/500 VUs, 8514 complete and 0 interrupted iterations
default ↓ [ 100% ] 049/500 VUs  2m30s

running (2m32.9s), 015/500 VUs, 8522 complete and 0 interrupted iterations
default ↓ [ 100% ] 049/500 VUs  2m30s

running (2m33.9s), 007/500 VUs, 8530 complete and 0 interrupted iterations
default ↓ [ 100% ] 049/500 VUs  2m30s

running (2m34.9s), 004/500 VUs, 8533 complete and 0 interrupted iterations
default ↓ [ 100% ] 049/500 VUs  2m30s


  █ THRESHOLDS 

    active_clients_time
    ✓ 'p(95)<500' p(95)=80ms

    attach_documents_time
    ✓ 'p(95)<10000' p(95)=311ms

    deactivate_clients_time
    ✓ 'p(95)<10000' p(95)=91ms

    http_req_duration
    ✓ 'p(95)<10000' p(95)=148.79ms

    pushpulls_time
    ✓ 'p(95)<1000' p(95)=143ms

    transaction_success_rate
    ✓ 'rate>0.99' rate=100.00%

    transaction_time
    ✓ 'p(95)<30000' p(95)=6.87s


  █ TOTAL RESULTS 

    checks_total.......: 136592  877.954937/s
    checks_succeeded...: 100.00% 136592 out of 136592
    checks_failed......: 0.00%   0 out of 136592

    ✓ status is 200
    ✓ response has valid body

    CUSTOM
    active_clients....................: 8537    54.872184/s
    active_clients_success_rate.......: 100.00% 8537 out of 8537
    active_clients_time...............: avg=17.34ms min=0s       med=4ms    max=395ms    p(90)=52ms    p(95)=80ms    
    attach_documents..................: 8537    54.872184/s
    attach_documents_success_rate.....: 100.00% 8537 out of 8537
    attach_documents_time.............: avg=77.92ms min=2ms      med=17ms   max=739ms    p(90)=250ms   p(95)=311ms   
    deactivate_clients................: 8537    54.872184/s
    deactivate_clients_success_rate...: 100.00% 8537 out of 8537
    deactivate_clients_time...........: avg=17.7ms  min=0s       med=2ms    max=381ms    p(90)=50ms    p(95)=91ms    
    pushpulls.........................: 42685   274.360918/s
    pushpulls_success_rate............: 100.00% 42685 out of 42685
    pushpulls_time....................: avg=33.75ms min=1ms      med=11ms   max=652ms    p(90)=94ms    p(95)=143ms   
    transaction_success_rate..........: 100.00% 8537 out of 8537
    transaction_time..................: avg=6.33s   min=6.01s    med=6.28s  max=7.85s    p(90)=6.72s   p(95)=6.87s   

    HTTP
    http_req_duration.................: avg=30.7ms  min=191.02µs med=5.81ms max=738.86ms p(90)=90.38ms p(95)=148.79ms
      { expected_response:true }......: avg=30.7ms  min=191.02µs med=5.81ms max=738.86ms p(90)=90.38ms p(95)=148.79ms
    http_req_failed...................: 0.00%   0 out of 68296
    http_reqs.........................: 68296   438.977468/s

    EXECUTION
    iteration_duration................: avg=6.33s   min=6.01s    med=6.28s  max=7.85s    p(90)=6.72s   p(95)=6.87s   
    iterations........................: 8537    54.872184/s
    vus...............................: 4       min=4              max=500
    vus_max...........................: 500     min=500            max=500

    NETWORK
    data_received.....................: 1.2 GB  7.8 MB/s
    data_sent.........................: 64 MB   413 kB/s




running (2m35.6s), 000/500 VUs, 8537 complete and 0 interrupted iterations
default ✓ [ 100% ] 000/500 VUs  2m30s
