
         /\      Grafana   /‾‾/  
    /\  /  \     |\  __   /  /   
   /  \/    \    | |/ /  /   ‾‾\ 
  /          \   |   (  |  (‾)  |
 / __________ \  |_|\_\  \_____/ 

     execution: local
        script: test/k6/presence.ts
        output: -

     scenarios: (100.00%) 1 scenario, 500 max VUs, 3m0s max duration (incl. graceful stop):
              * default: Up to 500 looping VUs for 2m30s over 3 stages (gracefulRampDown: 30s, gracefulStop: 30s)


running (0m00.9s), 008/500 VUs, 0 complete and 0 interrupted iterations
default   [   1% ] 008/500 VUs  0m00.9s/2m30.0s

running (0m01.9s), 016/500 VUs, 0 complete and 0 interrupted iterations
default   [   1% ] 016/500 VUs  0m01.9s/2m30.0s

running (0m02.9s), 024/500 VUs, 0 complete and 0 interrupted iterations
default   [   2% ] 024/500 VUs  0m02.9s/2m30.0s

running (0m03.9s), 033/500 VUs, 0 complete and 0 interrupted iterations
default   [   3% ] 033/500 VUs  0m03.9s/2m30.0s

running (0m04.9s), 041/500 VUs, 0 complete and 0 interrupted iterations
default   [   3% ] 041/500 VUs  0m04.9s/2m30.0s

running (0m05.9s), 049/500 VUs, 0 complete and 0 interrupted iterations
default   [   4% ] 049/500 VUs  0m05.9s/2m30.0s

running (0m06.9s), 058/500 VUs, 8 complete and 0 interrupted iterations
default   [   5% ] 058/500 VUs  0m06.9s/2m30.0s

running (0m07.9s), 066/500 VUs, 16 complete and 0 interrupted iterations
default   [   5% ] 066/500 VUs  0m07.9s/2m30.0s

running (0m08.9s), 074/500 VUs, 24 complete and 0 interrupted iterations
default   [   6% ] 074/500 VUs  0m08.9s/2m30.0s

running (0m09.9s), 083/500 VUs, 33 complete and 0 interrupted iterations
default   [   7% ] 083/500 VUs  0m09.9s/2m30.0s

running (0m10.9s), 091/500 VUs, 41 complete and 0 interrupted iterations
default   [   7% ] 091/500 VUs  0m10.9s/2m30.0s

running (0m11.9s), 099/500 VUs, 49 complete and 0 interrupted iterations
default   [   8% ] 099/500 VUs  0m11.9s/2m30.0s

running (0m12.9s), 108/500 VUs, 64 complete and 0 interrupted iterations
default   [   9% ] 108/500 VUs  0m12.9s/2m30.0s

running (0m13.9s), 116/500 VUs, 82 complete and 0 interrupted iterations
default   [   9% ] 116/500 VUs  0m13.9s/2m30.0s

running (0m14.9s), 124/500 VUs, 98 complete and 0 interrupted iterations
default   [  10% ] 124/500 VUs  0m14.9s/2m30.0s

running (0m15.9s), 133/500 VUs, 114 complete and 0 interrupted iterations
default   [  11% ] 133/500 VUs  0m15.9s/2m30.0s

running (0m16.9s), 141/500 VUs, 132 complete and 0 interrupted iterations
default   [  11% ] 141/500 VUs  0m16.9s/2m30.0s

running (0m17.9s), 149/500 VUs, 148 complete and 0 interrupted iterations
default   [  12% ] 149/500 VUs  0m17.9s/2m30.0s

running (0m18.9s), 157/500 VUs, 171 complete and 0 interrupted iterations
default   [  13% ] 157/500 VUs  0m18.9s/2m30.0s

running (0m19.9s), 166/500 VUs, 197 complete and 0 interrupted iterations
default   [  13% ] 166/500 VUs  0m19.9s/2m30.0s

running (0m20.9s), 174/500 VUs, 222 complete and 0 interrupted iterations
default   [  14% ] 174/500 VUs  0m20.9s/2m30.0s

running (0m21.9s), 182/500 VUs, 246 complete and 0 interrupted iterations
default   [  15% ] 182/500 VUs  0m21.9s/2m30.0s

running (0m22.9s), 191/500 VUs, 271 complete and 0 interrupted iterations
default   [  15% ] 191/500 VUs  0m22.9s/2m30.0s

running (0m23.9s), 199/500 VUs, 296 complete and 0 interrupted iterations
default   [  16% ] 199/500 VUs  0m23.9s/2m30.0s

running (0m24.9s), 207/500 VUs, 328 complete and 0 interrupted iterations
default   [  17% ] 207/500 VUs  0m24.9s/2m30.0s

running (0m25.9s), 216/500 VUs, 361 complete and 0 interrupted iterations
default   [  17% ] 216/500 VUs  0m25.9s/2m30.0s

running (0m26.9s), 224/500 VUs, 395 complete and 0 interrupted iterations
default   [  18% ] 224/500 VUs  0m26.9s/2m30.0s

running (0m27.9s), 232/500 VUs, 428 complete and 0 interrupted iterations
default   [  19% ] 232/500 VUs  0m27.9s/2m30.0s

running (0m28.9s), 241/500 VUs, 460 complete and 0 interrupted iterations
default   [  19% ] 241/500 VUs  0m28.9s/2m30.0s

running (0m29.9s), 249/500 VUs, 493 complete and 0 interrupted iterations
default   [  20% ] 249/500 VUs  0m29.9s/2m30.0s

running (0m30.9s), 257/500 VUs, 534 complete and 0 interrupted iterations
default   [  21% ] 257/500 VUs  0m30.9s/2m30.0s

running (0m31.9s), 266/500 VUs, 575 complete and 0 interrupted iterations
default   [  21% ] 266/500 VUs  0m31.9s/2m30.0s

running (0m32.9s), 274/500 VUs, 616 complete and 0 interrupted iterations
default   [  22% ] 274/500 VUs  0m32.9s/2m30.0s

running (0m33.9s), 282/500 VUs, 657 complete and 0 interrupted iterations
default   [  23% ] 282/500 VUs  0m33.9s/2m30.0s

running (0m34.9s), 291/500 VUs, 700 complete and 0 interrupted iterations
default   [  23% ] 291/500 VUs  0m34.9s/2m30.0s

running (0m35.9s), 299/500 VUs, 741 complete and 0 interrupted iterations
default   [  24% ] 299/500 VUs  0m35.9s/2m30.0s

running (0m36.9s), 307/500 VUs, 789 complete and 0 interrupted iterations
default   [  25% ] 307/500 VUs  0m36.9s/2m30.0s

running (0m37.9s), 315/500 VUs, 840 complete and 0 interrupted iterations
default   [  25% ] 315/500 VUs  0m37.9s/2m30.0s

running (0m38.9s), 324/500 VUs, 889 complete and 0 interrupted iterations
default   [  26% ] 324/500 VUs  0m38.9s/2m30.0s

running (0m39.9s), 332/500 VUs, 939 complete and 0 interrupted iterations
default   [  27% ] 332/500 VUs  0m39.9s/2m30.0s

running (0m40.9s), 340/500 VUs, 988 complete and 0 interrupted iterations
default   [  27% ] 340/500 VUs  0m40.9s/2m30.0s

running (0m41.9s), 349/500 VUs, 1036 complete and 0 interrupted iterations
default   [  28% ] 349/500 VUs  0m41.9s/2m30.0s

running (0m42.9s), 357/500 VUs, 1092 complete and 0 interrupted iterations
default   [  29% ] 357/500 VUs  0m42.9s/2m30.0s

running (0m43.9s), 365/500 VUs, 1150 complete and 0 interrupted iterations
default   [  29% ] 365/500 VUs  0m43.9s/2m30.0s

running (0m44.9s), 374/500 VUs, 1209 complete and 0 interrupted iterations
default   [  30% ] 374/500 VUs  0m44.9s/2m30.0s

running (0m45.9s), 382/500 VUs, 1266 complete and 0 interrupted iterations
default   [  31% ] 382/500 VUs  0m45.9s/2m30.0s

running (0m46.9s), 390/500 VUs, 1323 complete and 0 interrupted iterations
default   [  31% ] 390/500 VUs  0m46.9s/2m30.0s

running (0m47.9s), 399/500 VUs, 1372 complete and 0 interrupted iterations
default   [  32% ] 399/500 VUs  0m47.9s/2m30.0s

running (0m48.9s), 407/500 VUs, 1439 complete and 0 interrupted iterations
default   [  33% ] 407/500 VUs  0m48.9s/2m30.0s

running (0m49.9s), 415/500 VUs, 1507 complete and 0 interrupted iterations
default   [  33% ] 415/500 VUs  0m49.9s/2m30.0s

running (0m50.9s), 424/500 VUs, 1568 complete and 0 interrupted iterations
default   [  34% ] 424/500 VUs  0m50.9s/2m30.0s

running (0m51.9s), 432/500 VUs, 1625 complete and 0 interrupted iterations
default   [  35% ] 432/500 VUs  0m51.9s/2m30.0s

running (0m52.9s), 440/500 VUs, 1690 complete and 0 interrupted iterations
default   [  35% ] 440/500 VUs  0m52.9s/2m30.0s

running (0m53.9s), 449/500 VUs, 1757 complete and 0 interrupted iterations
default   [  36% ] 449/500 VUs  0m53.9s/2m30.0s

running (0m54.9s), 456/500 VUs, 1800 complete and 0 interrupted iterations
default   [  37% ] 456/500 VUs  0m54.9s/2m30.0s

running (0m55.9s), 465/500 VUs, 1882 complete and 0 interrupted iterations
default   [  37% ] 465/500 VUs  0m55.9s/2m30.0s

running (0m56.9s), 474/500 VUs, 1936 complete and 0 interrupted iterations
default   [  38% ] 474/500 VUs  0m56.9s/2m30.0s

running (0m57.9s), 482/500 VUs, 1990 complete and 0 interrupted iterations
default   [  39% ] 482/500 VUs  0m57.9s/2m30.0s

running (0m58.9s), 490/500 VUs, 2062 complete and 0 interrupted iterations
default   [  39% ] 490/500 VUs  0m58.9s/2m30.0s

running (0m59.9s), 495/500 VUs, 2125 complete and 0 interrupted iterations
default   [  40% ] 495/500 VUs  0m59.9s/2m30.0s

running (1m00.9s), 500/500 VUs, 2214 complete and 0 interrupted iterations
default   [  41% ] 500/500 VUs  1m00.9s/2m30.0s

running (1m01.9s), 500/500 VUs, 2258 complete and 0 interrupted iterations
default   [  41% ] 500/500 VUs  1m01.9s/2m30.0s

running (1m02.9s), 500/500 VUs, 2323 complete and 0 interrupted iterations
default   [  42% ] 500/500 VUs  1m02.9s/2m30.0s

running (1m03.9s), 500/500 VUs, 2378 complete and 0 interrupted iterations
default   [  43% ] 500/500 VUs  1m03.9s/2m30.0s

running (1m04.9s), 500/500 VUs, 2456 complete and 0 interrupted iterations
default   [  43% ] 500/500 VUs  1m04.9s/2m30.0s

running (1m05.9s), 500/500 VUs, 2503 complete and 0 interrupted iterations
default   [  44% ] 500/500 VUs  1m05.9s/2m30.0s

running (1m06.9s), 500/500 VUs, 2573 complete and 0 interrupted iterations
default   [  45% ] 500/500 VUs  1m06.9s/2m30.0s

running (1m07.9s), 500/500 VUs, 2632 complete and 0 interrupted iterations
default   [  45% ] 500/500 VUs  1m07.9s/2m30.0s

running (1m09.1s), 500/500 VUs, 2731 complete and 0 interrupted iterations
default   [  46% ] 500/500 VUs  1m09.1s/2m30.0s

running (1m09.9s), 500/500 VUs, 2803 complete and 0 interrupted iterations
default   [  47% ] 500/500 VUs  1m09.9s/2m30.0s

running (1m10.9s), 500/500 VUs, 2846 complete and 0 interrupted iterations
default   [  47% ] 500/500 VUs  1m10.9s/2m30.0s

running (1m11.9s), 500/500 VUs, 2949 complete and 0 interrupted iterations
default   [  48% ] 500/500 VUs  1m11.9s/2m30.0s

running (1m12.9s), 500/500 VUs, 2997 complete and 0 interrupted iterations
default   [  49% ] 500/500 VUs  1m12.9s/2m30.0s

running (1m13.9s), 500/500 VUs, 3083 complete and 0 interrupted iterations
default   [  49% ] 500/500 VUs  1m13.9s/2m30.0s

running (1m14.9s), 500/500 VUs, 3148 complete and 0 interrupted iterations
default   [  50% ] 500/500 VUs  1m14.9s/2m30.0s

running (1m15.9s), 500/500 VUs, 3212 complete and 0 interrupted iterations
default   [  51% ] 500/500 VUs  1m15.9s/2m30.0s

running (1m16.9s), 500/500 VUs, 3295 complete and 0 interrupted iterations
default   [  51% ] 500/500 VUs  1m16.9s/2m30.0s

running (1m18.0s), 500/500 VUs, 3351 complete and 0 interrupted iterations
default   [  52% ] 500/500 VUs  1m18.0s/2m30.0s

running (1m18.9s), 500/500 VUs, 3435 complete and 0 interrupted iterations
default   [  53% ] 500/500 VUs  1m18.9s/2m30.0s

running (1m19.9s), 500/500 VUs, 3482 complete and 0 interrupted iterations
default   [  53% ] 500/500 VUs  1m19.9s/2m30.0s

running (1m20.9s), 500/500 VUs, 3580 complete and 0 interrupted iterations
default   [  54% ] 500/500 VUs  1m20.9s/2m30.0s

running (1m21.9s), 500/500 VUs, 3647 complete and 0 interrupted iterations
default   [  55% ] 500/500 VUs  1m21.9s/2m30.0s

running (1m22.9s), 500/500 VUs, 3700 complete and 0 interrupted iterations
default   [  55% ] 500/500 VUs  1m22.9s/2m30.0s

running (1m23.9s), 500/500 VUs, 3790 complete and 0 interrupted iterations
default   [  56% ] 500/500 VUs  1m23.9s/2m30.0s

running (1m24.9s), 500/500 VUs, 3849 complete and 0 interrupted iterations
default   [  57% ] 500/500 VUs  1m24.9s/2m30.0s

running (1m26.0s), 500/500 VUs, 3938 complete and 0 interrupted iterations
default   [  57% ] 500/500 VUs  1m26.0s/2m30.0s

running (1m26.9s), 500/500 VUs, 4011 complete and 0 interrupted iterations
default   [  58% ] 500/500 VUs  1m26.9s/2m30.0s

running (1m27.9s), 500/500 VUs, 4067 complete and 0 interrupted iterations
default   [  59% ] 500/500 VUs  1m27.9s/2m30.0s

running (1m28.9s), 500/500 VUs, 4144 complete and 0 interrupted iterations
default   [  59% ] 500/500 VUs  1m28.9s/2m30.0s

running (1m30.0s), 500/500 VUs, 4209 complete and 0 interrupted iterations
default   [  60% ] 500/500 VUs  1m30.0s/2m30.0s

running (1m30.9s), 500/500 VUs, 4298 complete and 0 interrupted iterations
default   [  61% ] 500/500 VUs  1m30.9s/2m30.0s

running (1m31.9s), 500/500 VUs, 4342 complete and 0 interrupted iterations
default   [  61% ] 500/500 VUs  1m31.9s/2m30.0s

running (1m32.9s), 500/500 VUs, 4420 complete and 0 interrupted iterations
default   [  62% ] 500/500 VUs  1m32.9s/2m30.0s

running (1m33.9s), 500/500 VUs, 4511 complete and 0 interrupted iterations
default   [  63% ] 500/500 VUs  1m33.9s/2m30.0s

running (1m34.9s), 500/500 VUs, 4563 complete and 0 interrupted iterations
default   [  63% ] 500/500 VUs  1m34.9s/2m30.0s

running (1m35.9s), 500/500 VUs, 4646 complete and 0 interrupted iterations
default   [  64% ] 500/500 VUs  1m35.9s/2m30.0s

running (1m36.9s), 500/500 VUs, 4705 complete and 0 interrupted iterations
default   [  65% ] 500/500 VUs  1m36.9s/2m30.0s

running (1m37.9s), 500/500 VUs, 4771 complete and 0 interrupted iterations
default   [  65% ] 500/500 VUs  1m37.9s/2m30.0s

running (1m38.9s), 500/500 VUs, 4870 complete and 0 interrupted iterations
default   [  66% ] 500/500 VUs  1m38.9s/2m30.0s

running (1m39.9s), 500/500 VUs, 4911 complete and 0 interrupted iterations
default   [  67% ] 500/500 VUs  1m39.9s/2m30.0s

running (1m40.9s), 500/500 VUs, 4987 complete and 0 interrupted iterations
default   [  67% ] 500/500 VUs  1m40.9s/2m30.0s

running (1m41.9s), 500/500 VUs, 5063 complete and 0 interrupted iterations
default   [  68% ] 500/500 VUs  1m41.9s/2m30.0s

running (1m42.9s), 500/500 VUs, 5108 complete and 0 interrupted iterations
default   [  69% ] 500/500 VUs  1m42.9s/2m30.0s

running (1m43.9s), 500/500 VUs, 5201 complete and 0 interrupted iterations
default   [  69% ] 500/500 VUs  1m43.9s/2m30.0s

running (1m44.9s), 500/500 VUs, 5265 complete and 0 interrupted iterations
default   [  70% ] 500/500 VUs  1m44.9s/2m30.0s

running (1m46.1s), 500/500 VUs, 5351 complete and 0 interrupted iterations
default   [  71% ] 500/500 VUs  1m46.1s/2m30.0s

running (1m46.9s), 500/500 VUs, 5413 complete and 0 interrupted iterations
default   [  71% ] 500/500 VUs  1m46.9s/2m30.0s

running (1m48.3s), 500/500 VUs, 5501 complete and 0 interrupted iterations
default   [  72% ] 500/500 VUs  1m48.3s/2m30.0s

running (1m48.9s), 500/500 VUs, 5563 complete and 0 interrupted iterations
default   [  73% ] 500/500 VUs  1m48.9s/2m30.0s

running (1m49.9s), 500/500 VUs, 5571 complete and 0 interrupted iterations
default   [  73% ] 500/500 VUs  1m49.9s/2m30.0s

running (1m50.9s), 500/500 VUs, 5669 complete and 0 interrupted iterations
default   [  74% ] 500/500 VUs  1m50.9s/2m30.0s

running (1m51.9s), 500/500 VUs, 5745 complete and 0 interrupted iterations
default   [  75% ] 500/500 VUs  1m51.9s/2m30.0s

running (1m52.9s), 500/500 VUs, 5819 complete and 0 interrupted iterations
default   [  75% ] 500/500 VUs  1m52.9s/2m30.0s

running (1m53.9s), 500/500 VUs, 5876 complete and 0 interrupted iterations
default   [  76% ] 500/500 VUs  1m53.9s/2m30.0s

running (1m54.9s), 500/500 VUs, 5942 complete and 0 interrupted iterations
default   [  77% ] 500/500 VUs  1m54.9s/2m30.0s

running (1m55.9s), 500/500 VUs, 6049 complete and 0 interrupted iterations
default   [  77% ] 500/500 VUs  1m55.9s/2m30.0s

running (1m56.9s), 500/500 VUs, 6084 complete and 0 interrupted iterations
default   [  78% ] 500/500 VUs  1m56.9s/2m30.0s

running (1m57.9s), 500/500 VUs, 6148 complete and 0 interrupted iterations
default   [  79% ] 500/500 VUs  1m57.9s/2m30.0s

running (1m58.9s), 500/500 VUs, 6236 complete and 0 interrupted iterations
default   [  79% ] 500/500 VUs  1m58.9s/2m30.0s

running (2m00.0s), 500/500 VUs, 6315 complete and 0 interrupted iterations
default   [  80% ] 500/500 VUs  2m00.0s/2m30.0s

running (2m01.4s), 498/500 VUs, 6412 complete and 0 interrupted iterations
default   [  81% ] 498/500 VUs  2m01.4s/2m30.0s

running (2m01.9s), 494/500 VUs, 6453 complete and 0 interrupted iterations
default   [  81% ] 494/500 VUs  2m01.9s/2m30.0s

running (2m02.9s), 488/500 VUs, 6519 complete and 0 interrupted iterations
default   [  82% ] 488/500 VUs  2m02.9s/2m30.0s

running (2m03.9s), 475/500 VUs, 6617 complete and 0 interrupted iterations
default   [  83% ] 475/500 VUs  2m03.9s/2m30.0s

running (2m04.9s), 464/500 VUs, 6676 complete and 0 interrupted iterations
default   [  83% ] 464/500 VUs  2m04.9s/2m30.0s

running (2m05.9s), 457/500 VUs, 6730 complete and 0 interrupted iterations
default   [  84% ] 457/500 VUs  2m05.9s/2m30.0s

running (2m06.9s), 443/500 VUs, 6821 complete and 0 interrupted iterations
default   [  85% ] 443/500 VUs  2m06.9s/2m30.0s

running (2m07.9s), 427/500 VUs, 6897 complete and 0 interrupted iterations
default   [  85% ] 427/500 VUs  2m07.9s/2m30.0s

running (2m08.9s), 404/500 VUs, 6986 complete and 0 interrupted iterations
default   [  86% ] 404/500 VUs  2m08.9s/2m30.0s

running (2m09.9s), 389/500 VUs, 7056 complete and 0 interrupted iterations
default   [  87% ] 389/500 VUs  2m09.9s/2m30.0s

running (2m10.9s), 377/500 VUs, 7106 complete and 0 interrupted iterations
default   [  87% ] 377/500 VUs  2m10.9s/2m30.0s

running (2m11.9s), 356/500 VUs, 7182 complete and 0 interrupted iterations
default   [  88% ] 356/500 VUs  2m11.9s/2m30.0s

running (2m12.9s), 336/500 VUs, 7254 complete and 0 interrupted iterations
default   [  89% ] 336/500 VUs  2m12.9s/2m30.0s

running (2m13.9s), 313/500 VUs, 7322 complete and 0 interrupted iterations
default   [  89% ] 313/500 VUs  2m13.9s/2m30.0s

running (2m14.9s), 302/500 VUs, 7378 complete and 0 interrupted iterations
default   [  90% ] 302/500 VUs  2m14.9s/2m30.0s

running (2m15.9s), 290/500 VUs, 7427 complete and 0 interrupted iterations
default   [  91% ] 290/500 VUs  2m15.9s/2m30.0s

running (2m16.9s), 279/500 VUs, 7481 complete and 0 interrupted iterations
default   [  91% ] 279/500 VUs  2m16.9s/2m30.0s

running (2m17.9s), 254/500 VUs, 7538 complete and 0 interrupted iterations
default   [  92% ] 254/500 VUs  2m17.9s/2m30.0s

running (2m18.9s), 238/500 VUs, 7589 complete and 0 interrupted iterations
default   [  93% ] 238/500 VUs  2m18.9s/2m30.0s

running (2m19.9s), 225/500 VUs, 7631 complete and 0 interrupted iterations
default   [  93% ] 225/500 VUs  2m19.9s/2m30.0s

running (2m20.9s), 205/500 VUs, 7679 complete and 0 interrupted iterations
default   [  94% ] 205/500 VUs  2m20.9s/2m30.0s

running (2m21.9s), 191/500 VUs, 7714 complete and 0 interrupted iterations
default   [  95% ] 191/500 VUs  2m21.9s/2m30.0s

running (2m22.9s), 172/500 VUs, 7759 complete and 0 interrupted iterations
default   [  95% ] 172/500 VUs  2m22.9s/2m30.0s

running (2m23.9s), 158/500 VUs, 7792 complete and 0 interrupted iterations
default   [  96% ] 158/500 VUs  2m23.9s/2m30.0s

running (2m24.9s), 142/500 VUs, 7827 complete and 0 interrupted iterations
default   [  97% ] 142/500 VUs  2m24.9s/2m30.0s

running (2m25.9s), 127/500 VUs, 7853 complete and 0 interrupted iterations
default   [  97% ] 127/500 VUs  2m25.9s/2m30.0s

running (2m26.9s), 110/500 VUs, 7884 complete and 0 interrupted iterations
default   [  98% ] 110/500 VUs  2m26.9s/2m30.0s

running (2m27.9s), 094/500 VUs, 7904 complete and 0 interrupted iterations
default   [  99% ] 094/500 VUs  2m27.9s/2m30.0s

running (2m28.9s), 071/500 VUs, 7931 complete and 0 interrupted iterations
default   [  99% ] 071/500 VUs  2m28.9s/2m30.0s

running (2m29.9s), 053/500 VUs, 7950 complete and 0 interrupted iterations
default   [ 100% ] 053/500 VUs  2m29.9s/2m30.0s

running (2m30.9s), 034/500 VUs, 7969 complete and 0 interrupted iterations
default ↓ [ 100% ] 053/500 VUs  2m30s

running (2m31.9s), 023/500 VUs, 7980 complete and 0 interrupted iterations
default ↓ [ 100% ] 053/500 VUs  2m30s

running (2m32.9s), 009/500 VUs, 7994 complete and 0 interrupted iterations
default ↓ [ 100% ] 053/500 VUs  2m30s

running (2m33.9s), 005/500 VUs, 7998 complete and 0 interrupted iterations
default ↓ [ 100% ] 053/500 VUs  2m30s

running (2m34.9s), 001/500 VUs, 8002 complete and 0 interrupted iterations
default ↓ [ 100% ] 053/500 VUs  2m30s


  █ THRESHOLDS 

    active_clients_time
    ✓ 'p(95)<500' p(95)=95.89ms

    attach_documents_time
    ✓ 'p(95)<10000' p(95)=476.89ms

    deactivate_clients_time
    ✓ 'p(95)<10000' p(95)=551ms

    http_req_duration
    ✓ 'p(95)<10000' p(95)=313.33ms

    pushpulls_time
    ✓ 'p(95)<1000' p(95)=285ms

    transaction_success_rate
    ✓ 'rate>0.99' rate=100.00%

    transaction_time
    ✓ 'p(95)<30000' p(95)=7.74s


  █ TOTAL RESULTS 

    checks_total.......................: 128048  822.984994/s
    checks_succeeded...................: 100.00% 128048 out of 128048
    checks_failed......................: 0.00%   0 out of 128048

    ✓ status is 200
    ✓ response has valid body

    CUSTOM
    active_clients..........................................................: 8003    51.436562/s
    active_clients_success_rate.............................................: 100.00% 8003 out of 8003
    active_clients_time.....................................................: avg=20.6ms   min=1ms      med=6ms    max=395ms    p(90)=57ms     p(95)=95.89ms 
    attach_documents........................................................: 8003    51.436562/s
    attach_documents_success_rate...........................................: 100.00% 8003 out of 8003
    attach_documents_time...................................................: avg=136.87ms min=3ms      med=81ms   max=1.03s    p(90)=359ms    p(95)=476.89ms
    deactivate_clients......................................................: 8003    51.436562/s
    deactivate_clients_success_rate.........................................: 100.00% 8003 out of 8003
    deactivate_clients_time.................................................: avg=153.38ms min=4ms      med=91ms   max=977ms    p(90)=406ms    p(95)=551ms   
    pushpulls...............................................................: 40015   257.182811/s
    pushpulls_success_rate..................................................: 100.00% 40015 out of 40015
    pushpulls_time..........................................................: avg=74.93ms  min=1ms      med=34ms   max=1.13s    p(90)=202ms    p(95)=285ms   
    transaction_success_rate................................................: 100.00% 8003 out of 8003
    transaction_time........................................................: avg=6.75s    min=6.02s    med=6.78s  max=9.33s    p(90)=7.52s    p(95)=7.74s   

    HTTP
    http_req_duration.......................................................: avg=77.62ms  min=920.23µs med=26.1ms max=985.64ms p(90)=222.75ms p(95)=313.33ms
      { expected_response:true }............................................: avg=77.62ms  min=920.23µs med=26.1ms max=985.64ms p(90)=222.75ms p(95)=313.33ms
    http_req_failed.........................................................: 0.00%   0 out of 64024
    http_reqs...............................................................: 64024   411.492497/s

    EXECUTION
    iteration_duration......................................................: avg=6.75s    min=6.02s    med=6.78s  max=9.33s    p(90)=7.52s    p(95)=7.74s   
    iterations..............................................................: 8003    51.436562/s
    vus.....................................................................: 1       min=1              max=500
    vus_max.................................................................: 500     min=500            max=500

    NETWORK
    data_received...........................................................: 1.1 GB  7.1 MB/s
    data_sent...............................................................: 60 MB   387 kB/s




running (2m35.6s), 000/500 VUs, 8003 complete and 0 interrupted iterations
default ✓ [ 100% ] 000/500 VUs  2m30s
