
         /\      Grafana   /‾‾/  
    /\  /  \     |\  __   /  /   
   /  \/    \    | |/ /  /   ‾‾\ 
  /          \   |   (  |  (‾)  |
 / __________ \  |_|\_\  \_____/ 

     execution: local
        script: test/k6/presence.ts
        output: -

     scenarios: (100.00%) 1 scenario, 500 max VUs, 3m0s max duration (incl. graceful stop):
              * default: Up to 500 looping VUs for 2m30s over 3 stages (gracefulRampDown: 30s, gracefulStop: 30s)


running (0m00.9s), 008/500 VUs, 0 complete and 0 interrupted iterations
default   [   1% ] 008/500 VUs  0m00.9s/2m30.0s

running (0m01.9s), 016/500 VUs, 0 complete and 0 interrupted iterations
default   [   1% ] 016/500 VUs  0m01.9s/2m30.0s

running (0m02.9s), 025/500 VUs, 0 complete and 0 interrupted iterations
default   [   2% ] 025/500 VUs  0m02.9s/2m30.0s

running (0m03.9s), 033/500 VUs, 0 complete and 0 interrupted iterations
default   [   3% ] 033/500 VUs  0m03.9s/2m30.0s

running (0m04.9s), 041/500 VUs, 0 complete and 0 interrupted iterations
default   [   3% ] 041/500 VUs  0m04.9s/2m30.0s

running (0m05.9s), 049/500 VUs, 0 complete and 0 interrupted iterations
default   [   4% ] 049/500 VUs  0m05.9s/2m30.0s

running (0m06.9s), 058/500 VUs, 8 complete and 0 interrupted iterations
default   [   5% ] 058/500 VUs  0m06.9s/2m30.0s

running (0m07.9s), 066/500 VUs, 16 complete and 0 interrupted iterations
default   [   5% ] 066/500 VUs  0m07.9s/2m30.0s

running (0m08.9s), 074/500 VUs, 24 complete and 0 interrupted iterations
default   [   6% ] 074/500 VUs  0m08.9s/2m30.0s

running (0m09.9s), 083/500 VUs, 33 complete and 0 interrupted iterations
default   [   7% ] 083/500 VUs  0m09.9s/2m30.0s

running (0m10.9s), 091/500 VUs, 41 complete and 0 interrupted iterations
default   [   7% ] 091/500 VUs  0m10.9s/2m30.0s

running (0m11.9s), 099/500 VUs, 49 complete and 0 interrupted iterations
default   [   8% ] 099/500 VUs  0m11.9s/2m30.0s

running (0m12.9s), 108/500 VUs, 66 complete and 0 interrupted iterations
default   [   9% ] 108/500 VUs  0m12.9s/2m30.0s

running (0m13.9s), 116/500 VUs, 82 complete and 0 interrupted iterations
default   [   9% ] 116/500 VUs  0m13.9s/2m30.0s

running (0m14.9s), 124/500 VUs, 98 complete and 0 interrupted iterations
default   [  10% ] 124/500 VUs  0m14.9s/2m30.0s

running (0m15.9s), 133/500 VUs, 116 complete and 0 interrupted iterations
default   [  11% ] 133/500 VUs  0m15.9s/2m30.0s

running (0m16.9s), 141/500 VUs, 132 complete and 0 interrupted iterations
default   [  11% ] 141/500 VUs  0m16.9s/2m30.0s

running (0m17.9s), 149/500 VUs, 148 complete and 0 interrupted iterations
default   [  12% ] 149/500 VUs  0m17.9s/2m30.0s

running (0m18.9s), 158/500 VUs, 171 complete and 0 interrupted iterations
default   [  13% ] 158/500 VUs  0m18.9s/2m30.0s

running (0m19.9s), 166/500 VUs, 198 complete and 0 interrupted iterations
default   [  13% ] 166/500 VUs  0m19.9s/2m30.0s

running (0m20.9s), 174/500 VUs, 222 complete and 0 interrupted iterations
default   [  14% ] 174/500 VUs  0m20.9s/2m30.0s

running (0m21.9s), 183/500 VUs, 246 complete and 0 interrupted iterations
default   [  15% ] 183/500 VUs  0m21.9s/2m30.0s

running (0m22.9s), 191/500 VUs, 273 complete and 0 interrupted iterations
default   [  15% ] 191/500 VUs  0m22.9s/2m30.0s

running (0m23.9s), 199/500 VUs, 297 complete and 0 interrupted iterations
default   [  16% ] 199/500 VUs  0m23.9s/2m30.0s

running (0m24.9s), 207/500 VUs, 328 complete and 0 interrupted iterations
default   [  17% ] 207/500 VUs  0m24.9s/2m30.0s

running (0m25.9s), 216/500 VUs, 364 complete and 0 interrupted iterations
default   [  17% ] 216/500 VUs  0m25.9s/2m30.0s

running (0m26.9s), 224/500 VUs, 396 complete and 0 interrupted iterations
default   [  18% ] 224/500 VUs  0m26.9s/2m30.0s

running (0m27.9s), 232/500 VUs, 428 complete and 0 interrupted iterations
default   [  19% ] 232/500 VUs  0m27.9s/2m30.0s

running (0m28.9s), 241/500 VUs, 461 complete and 0 interrupted iterations
default   [  19% ] 241/500 VUs  0m28.9s/2m30.0s

running (0m29.9s), 249/500 VUs, 496 complete and 0 interrupted iterations
default   [  20% ] 249/500 VUs  0m29.9s/2m30.0s

running (0m30.9s), 257/500 VUs, 535 complete and 0 interrupted iterations
default   [  21% ] 257/500 VUs  0m30.9s/2m30.0s

running (0m31.9s), 266/500 VUs, 577 complete and 0 interrupted iterations
default   [  21% ] 266/500 VUs  0m31.9s/2m30.0s

running (0m32.9s), 274/500 VUs, 620 complete and 0 interrupted iterations
default   [  22% ] 274/500 VUs  0m32.9s/2m30.0s

running (0m33.9s), 282/500 VUs, 660 complete and 0 interrupted iterations
default   [  23% ] 282/500 VUs  0m33.9s/2m30.0s

running (0m34.9s), 291/500 VUs, 701 complete and 0 interrupted iterations
default   [  23% ] 291/500 VUs  0m34.9s/2m30.0s

running (0m35.9s), 299/500 VUs, 743 complete and 0 interrupted iterations
default   [  24% ] 299/500 VUs  0m35.9s/2m30.0s

running (0m36.9s), 307/500 VUs, 792 complete and 0 interrupted iterations
default   [  25% ] 307/500 VUs  0m36.9s/2m30.0s

running (0m37.9s), 316/500 VUs, 840 complete and 0 interrupted iterations
default   [  25% ] 316/500 VUs  0m37.9s/2m30.0s

running (0m38.9s), 324/500 VUs, 892 complete and 0 interrupted iterations
default   [  26% ] 324/500 VUs  0m38.9s/2m30.0s

running (0m39.9s), 332/500 VUs, 942 complete and 0 interrupted iterations
default   [  27% ] 332/500 VUs  0m39.9s/2m30.0s

running (0m40.9s), 341/500 VUs, 990 complete and 0 interrupted iterations
default   [  27% ] 341/500 VUs  0m40.9s/2m30.0s

running (0m41.9s), 349/500 VUs, 1039 complete and 0 interrupted iterations
default   [  28% ] 349/500 VUs  0m41.9s/2m30.0s

running (0m42.9s), 357/500 VUs, 1098 complete and 0 interrupted iterations
default   [  29% ] 357/500 VUs  0m42.9s/2m30.0s

running (0m43.9s), 365/500 VUs, 1155 complete and 0 interrupted iterations
default   [  29% ] 365/500 VUs  0m43.9s/2m30.0s

running (0m44.9s), 374/500 VUs, 1213 complete and 0 interrupted iterations
default   [  30% ] 374/500 VUs  0m44.9s/2m30.0s

running (0m45.9s), 382/500 VUs, 1271 complete and 0 interrupted iterations
default   [  31% ] 382/500 VUs  0m45.9s/2m30.0s

running (0m46.9s), 390/500 VUs, 1330 complete and 0 interrupted iterations
default   [  31% ] 390/500 VUs  0m46.9s/2m30.0s

running (0m47.9s), 399/500 VUs, 1386 complete and 0 interrupted iterations
default   [  32% ] 399/500 VUs  0m47.9s/2m30.0s

running (0m48.9s), 407/500 VUs, 1451 complete and 0 interrupted iterations
default   [  33% ] 407/500 VUs  0m48.9s/2m30.0s

running (0m49.9s), 415/500 VUs, 1516 complete and 0 interrupted iterations
default   [  33% ] 415/500 VUs  0m49.9s/2m30.0s

running (0m50.9s), 424/500 VUs, 1583 complete and 0 interrupted iterations
default   [  34% ] 424/500 VUs  0m50.9s/2m30.0s

running (0m51.9s), 432/500 VUs, 1647 complete and 0 interrupted iterations
default   [  35% ] 432/500 VUs  0m51.9s/2m30.0s

running (0m52.9s), 441/500 VUs, 1714 complete and 0 interrupted iterations
default   [  35% ] 441/500 VUs  0m52.9s/2m30.0s

running (0m53.9s), 449/500 VUs, 1775 complete and 0 interrupted iterations
default   [  36% ] 449/500 VUs  0m53.9s/2m30.0s

running (0m54.9s), 457/500 VUs, 1844 complete and 0 interrupted iterations
default   [  37% ] 457/500 VUs  0m54.9s/2m30.0s

running (0m56.0s), 466/500 VUs, 1926 complete and 0 interrupted iterations
default   [  37% ] 466/500 VUs  0m56.0s/2m30.0s

running (0m56.9s), 474/500 VUs, 1993 complete and 0 interrupted iterations
default   [  38% ] 474/500 VUs  0m56.9s/2m30.0s

running (0m57.9s), 482/500 VUs, 2064 complete and 0 interrupted iterations
default   [  39% ] 482/500 VUs  0m57.9s/2m30.0s

running (0m58.9s), 490/500 VUs, 2126 complete and 0 interrupted iterations
default   [  39% ] 490/500 VUs  0m58.9s/2m30.0s

running (1m00.0s), 499/500 VUs, 2203 complete and 0 interrupted iterations
default   [  40% ] 499/500 VUs  1m00.0s/2m30.0s

running (1m00.9s), 500/500 VUs, 2271 complete and 0 interrupted iterations
default   [  41% ] 500/500 VUs  1m00.9s/2m30.0s

running (1m01.9s), 500/500 VUs, 2342 complete and 0 interrupted iterations
default   [  41% ] 500/500 VUs  1m01.9s/2m30.0s

running (1m02.9s), 500/500 VUs, 2412 complete and 0 interrupted iterations
default   [  42% ] 500/500 VUs  1m02.9s/2m30.0s

running (1m03.9s), 500/500 VUs, 2490 complete and 0 interrupted iterations
default   [  43% ] 500/500 VUs  1m03.9s/2m30.0s

running (1m04.9s), 500/500 VUs, 2584 complete and 0 interrupted iterations
default   [  43% ] 500/500 VUs  1m04.9s/2m30.0s

running (1m06.2s), 500/500 VUs, 2683 complete and 0 interrupted iterations
default   [  44% ] 500/500 VUs  1m06.2s/2m30.0s

running (1m06.9s), 500/500 VUs, 2714 complete and 0 interrupted iterations
default   [  45% ] 500/500 VUs  1m06.9s/2m30.0s

running (1m07.9s), 500/500 VUs, 2810 complete and 0 interrupted iterations
default   [  45% ] 500/500 VUs  1m07.9s/2m30.0s

running (1m09.0s), 500/500 VUs, 2886 complete and 0 interrupted iterations
default   [  46% ] 500/500 VUs  1m09.0s/2m30.0s

running (1m09.9s), 500/500 VUs, 2937 complete and 0 interrupted iterations
default   [  47% ] 500/500 VUs  1m09.9s/2m30.0s

running (1m10.9s), 500/500 VUs, 3012 complete and 0 interrupted iterations
default   [  47% ] 500/500 VUs  1m10.9s/2m30.0s

running (1m12.4s), 500/500 VUs, 3109 complete and 0 interrupted iterations
default   [  48% ] 500/500 VUs  1m12.4s/2m30.0s

running (1m12.9s), 500/500 VUs, 3143 complete and 0 interrupted iterations
default   [  49% ] 500/500 VUs  1m12.9s/2m30.0s

running (1m13.9s), 500/500 VUs, 3226 complete and 0 interrupted iterations
default   [  49% ] 500/500 VUs  1m13.9s/2m30.0s

running (1m14.9s), 500/500 VUs, 3321 complete and 0 interrupted iterations
default   [  50% ] 500/500 VUs  1m14.9s/2m30.0s

running (1m15.9s), 500/500 VUs, 3399 complete and 0 interrupted iterations
default   [  51% ] 500/500 VUs  1m15.9s/2m30.0s

running (1m17.1s), 500/500 VUs, 3459 complete and 0 interrupted iterations
default   [  51% ] 500/500 VUs  1m17.1s/2m30.0s

running (1m17.9s), 500/500 VUs, 3549 complete and 0 interrupted iterations
default   [  52% ] 500/500 VUs  1m17.9s/2m30.0s

running (1m18.9s), 500/500 VUs, 3599 complete and 0 interrupted iterations
default   [  53% ] 500/500 VUs  1m18.9s/2m30.0s

running (1m19.9s), 500/500 VUs, 3687 complete and 0 interrupted iterations
default   [  53% ] 500/500 VUs  1m19.9s/2m30.0s

running (1m20.9s), 500/500 VUs, 3774 complete and 0 interrupted iterations
default   [  54% ] 500/500 VUs  1m20.9s/2m30.0s

running (1m21.9s), 500/500 VUs, 3847 complete and 0 interrupted iterations
default   [  55% ] 500/500 VUs  1m21.9s/2m30.0s

running (1m22.9s), 500/500 VUs, 3938 complete and 0 interrupted iterations
default   [  55% ] 500/500 VUs  1m22.9s/2m30.0s

running (1m23.9s), 500/500 VUs, 3999 complete and 0 interrupted iterations
default   [  56% ] 500/500 VUs  1m23.9s/2m30.0s

running (1m24.9s), 500/500 VUs, 4066 complete and 0 interrupted iterations
default   [  57% ] 500/500 VUs  1m24.9s/2m30.0s

running (1m25.9s), 500/500 VUs, 4151 complete and 0 interrupted iterations
default   [  57% ] 500/500 VUs  1m25.9s/2m30.0s

running (1m26.9s), 500/500 VUs, 4228 complete and 0 interrupted iterations
default   [  58% ] 500/500 VUs  1m26.9s/2m30.0s

running (1m27.9s), 500/500 VUs, 4316 complete and 0 interrupted iterations
default   [  59% ] 500/500 VUs  1m27.9s/2m30.0s

running (1m28.9s), 500/500 VUs, 4366 complete and 0 interrupted iterations
default   [  59% ] 500/500 VUs  1m28.9s/2m30.0s

running (1m29.9s), 500/500 VUs, 4459 complete and 0 interrupted iterations
default   [  60% ] 500/500 VUs  1m29.9s/2m30.0s

running (1m30.9s), 500/500 VUs, 4562 complete and 0 interrupted iterations
default   [  61% ] 500/500 VUs  1m30.9s/2m30.0s

running (1m31.9s), 500/500 VUs, 4639 complete and 0 interrupted iterations
default   [  61% ] 500/500 VUs  1m31.9s/2m30.0s

running (1m32.9s), 500/500 VUs, 4718 complete and 0 interrupted iterations
default   [  62% ] 500/500 VUs  1m32.9s/2m30.0s

running (1m33.9s), 500/500 VUs, 4779 complete and 0 interrupted iterations
default   [  63% ] 500/500 VUs  1m33.9s/2m30.0s

running (1m34.9s), 500/500 VUs, 4855 complete and 0 interrupted iterations
default   [  63% ] 500/500 VUs  1m34.9s/2m30.0s

running (1m35.9s), 500/500 VUs, 4956 complete and 0 interrupted iterations
default   [  64% ] 500/500 VUs  1m35.9s/2m30.0s

running (1m36.9s), 500/500 VUs, 5041 complete and 0 interrupted iterations
default   [  65% ] 500/500 VUs  1m36.9s/2m30.0s

running (1m37.9s), 500/500 VUs, 5103 complete and 0 interrupted iterations
default   [  65% ] 500/500 VUs  1m37.9s/2m30.0s

running (1m38.9s), 500/500 VUs, 5184 complete and 0 interrupted iterations
default   [  66% ] 500/500 VUs  1m38.9s/2m30.0s

running (1m39.9s), 500/500 VUs, 5261 complete and 0 interrupted iterations
default   [  67% ] 500/500 VUs  1m39.9s/2m30.0s

running (1m40.9s), 500/500 VUs, 5348 complete and 0 interrupted iterations
default   [  67% ] 500/500 VUs  1m40.9s/2m30.0s

running (1m41.9s), 500/500 VUs, 5435 complete and 0 interrupted iterations
default   [  68% ] 500/500 VUs  1m41.9s/2m30.0s

running (1m42.9s), 500/500 VUs, 5492 complete and 0 interrupted iterations
default   [  69% ] 500/500 VUs  1m42.9s/2m30.0s

running (1m43.9s), 500/500 VUs, 5569 complete and 0 interrupted iterations
default   [  69% ] 500/500 VUs  1m43.9s/2m30.0s

running (1m44.9s), 500/500 VUs, 5655 complete and 0 interrupted iterations
default   [  70% ] 500/500 VUs  1m44.9s/2m30.0s

running (1m46.0s), 500/500 VUs, 5743 complete and 0 interrupted iterations
default   [  71% ] 500/500 VUs  1m46.0s/2m30.0s

running (1m46.9s), 500/500 VUs, 5811 complete and 0 interrupted iterations
default   [  71% ] 500/500 VUs  1m46.9s/2m30.0s

running (1m47.9s), 500/500 VUs, 5886 complete and 0 interrupted iterations
default   [  72% ] 500/500 VUs  1m47.9s/2m30.0s

running (1m48.9s), 500/500 VUs, 5942 complete and 0 interrupted iterations
default   [  73% ] 500/500 VUs  1m48.9s/2m30.0s

running (1m49.9s), 500/500 VUs, 6029 complete and 0 interrupted iterations
default   [  73% ] 500/500 VUs  1m49.9s/2m30.0s

running (1m50.9s), 500/500 VUs, 6084 complete and 0 interrupted iterations
default   [  74% ] 500/500 VUs  1m50.9s/2m30.0s

running (1m51.9s), 500/500 VUs, 6194 complete and 0 interrupted iterations
default   [  75% ] 500/500 VUs  1m51.9s/2m30.0s

running (1m52.9s), 500/500 VUs, 6260 complete and 0 interrupted iterations
default   [  75% ] 500/500 VUs  1m52.9s/2m30.0s

running (1m53.9s), 500/500 VUs, 6342 complete and 0 interrupted iterations
default   [  76% ] 500/500 VUs  1m53.9s/2m30.0s

running (1m54.9s), 500/500 VUs, 6419 complete and 0 interrupted iterations
default   [  77% ] 500/500 VUs  1m54.9s/2m30.0s

running (1m55.9s), 500/500 VUs, 6483 complete and 0 interrupted iterations
default   [  77% ] 500/500 VUs  1m55.9s/2m30.0s

running (1m56.9s), 500/500 VUs, 6552 complete and 0 interrupted iterations
default   [  78% ] 500/500 VUs  1m56.9s/2m30.0s

running (1m57.9s), 500/500 VUs, 6642 complete and 0 interrupted iterations
default   [  79% ] 500/500 VUs  1m57.9s/2m30.0s

running (1m58.9s), 500/500 VUs, 6715 complete and 0 interrupted iterations
default   [  79% ] 500/500 VUs  1m58.9s/2m30.0s

running (1m59.9s), 500/500 VUs, 6800 complete and 0 interrupted iterations
default   [  80% ] 500/500 VUs  1m59.9s/2m30.0s

running (2m00.9s), 499/500 VUs, 6881 complete and 0 interrupted iterations
default   [  81% ] 499/500 VUs  2m00.9s/2m30.0s

running (2m01.9s), 497/500 VUs, 6947 complete and 0 interrupted iterations
default   [  81% ] 497/500 VUs  2m01.9s/2m30.0s

running (2m02.9s), 489/500 VUs, 7034 complete and 0 interrupted iterations
default   [  82% ] 489/500 VUs  2m02.9s/2m30.0s

running (2m03.9s), 478/500 VUs, 7108 complete and 0 interrupted iterations
default   [  83% ] 478/500 VUs  2m03.9s/2m30.0s

running (2m04.9s), 467/500 VUs, 7180 complete and 0 interrupted iterations
default   [  83% ] 467/500 VUs  2m04.9s/2m30.0s

running (2m05.9s), 460/500 VUs, 7256 complete and 0 interrupted iterations
default   [  84% ] 460/500 VUs  2m05.9s/2m30.0s

running (2m06.9s), 438/500 VUs, 7338 complete and 0 interrupted iterations
default   [  85% ] 438/500 VUs  2m06.9s/2m30.0s

running (2m07.9s), 421/500 VUs, 7422 complete and 0 interrupted iterations
default   [  85% ] 421/500 VUs  2m07.9s/2m30.0s

running (2m08.9s), 400/500 VUs, 7505 complete and 0 interrupted iterations
default   [  86% ] 400/500 VUs  2m08.9s/2m30.0s

running (2m09.9s), 389/500 VUs, 7564 complete and 0 interrupted iterations
default   [  87% ] 389/500 VUs  2m09.9s/2m30.0s

running (2m10.9s), 372/500 VUs, 7630 complete and 0 interrupted iterations
default   [  87% ] 372/500 VUs  2m10.9s/2m30.0s

running (2m11.9s), 355/500 VUs, 7704 complete and 0 interrupted iterations
default   [  88% ] 355/500 VUs  2m11.9s/2m30.0s

running (2m12.9s), 337/500 VUs, 7768 complete and 0 interrupted iterations
default   [  89% ] 337/500 VUs  2m12.9s/2m30.0s

running (2m13.9s), 321/500 VUs, 7829 complete and 0 interrupted iterations
default   [  89% ] 321/500 VUs  2m13.9s/2m30.0s

running (2m14.9s), 300/500 VUs, 7897 complete and 0 interrupted iterations
default   [  90% ] 300/500 VUs  2m14.9s/2m30.0s

running (2m15.9s), 283/500 VUs, 7952 complete and 0 interrupted iterations
default   [  91% ] 283/500 VUs  2m15.9s/2m30.0s

running (2m16.9s), 268/500 VUs, 8001 complete and 0 interrupted iterations
default   [  91% ] 268/500 VUs  2m16.9s/2m30.0s

running (2m17.9s), 251/500 VUs, 8056 complete and 0 interrupted iterations
default   [  92% ] 251/500 VUs  2m17.9s/2m30.0s

running (2m18.9s), 237/500 VUs, 8102 complete and 0 interrupted iterations
default   [  93% ] 237/500 VUs  2m18.9s/2m30.0s

running (2m19.9s), 216/500 VUs, 8149 complete and 0 interrupted iterations
default   [  93% ] 216/500 VUs  2m19.9s/2m30.0s

running (2m20.9s), 195/500 VUs, 8197 complete and 0 interrupted iterations
default   [  94% ] 195/500 VUs  2m20.9s/2m30.0s

running (2m21.9s), 183/500 VUs, 8235 complete and 0 interrupted iterations
default   [  95% ] 183/500 VUs  2m21.9s/2m30.0s

running (2m22.9s), 167/500 VUs, 8268 complete and 0 interrupted iterations
default   [  95% ] 167/500 VUs  2m22.9s/2m30.0s

running (2m23.9s), 147/500 VUs, 8306 complete and 0 interrupted iterations
default   [  96% ] 147/500 VUs  2m23.9s/2m30.0s

running (2m24.9s), 128/500 VUs, 8339 complete and 0 interrupted iterations
default   [  97% ] 128/500 VUs  2m24.9s/2m30.0s

running (2m25.9s), 115/500 VUs, 8365 complete and 0 interrupted iterations
default   [  97% ] 115/500 VUs  2m25.9s/2m30.0s

running (2m26.9s), 102/500 VUs, 8391 complete and 0 interrupted iterations
default   [  98% ] 102/500 VUs  2m26.9s/2m30.0s

running (2m27.9s), 086/500 VUs, 8417 complete and 0 interrupted iterations
default   [  99% ] 086/500 VUs  2m27.9s/2m30.0s

running (2m28.9s), 069/500 VUs, 8434 complete and 0 interrupted iterations
default   [  99% ] 069/500 VUs  2m28.9s/2m30.0s

running (2m29.9s), 052/500 VUs, 8453 complete and 0 interrupted iterations
default   [ 100% ] 052/500 VUs  2m29.9s/2m30.0s

running (2m30.9s), 040/500 VUs, 8466 complete and 0 interrupted iterations
default ↓ [ 100% ] 052/500 VUs  2m30s

running (2m31.9s), 026/500 VUs, 8480 complete and 0 interrupted iterations
default ↓ [ 100% ] 052/500 VUs  2m30s

running (2m32.9s), 013/500 VUs, 8493 complete and 0 interrupted iterations
default ↓ [ 100% ] 052/500 VUs  2m30s

running (2m33.9s), 003/500 VUs, 8503 complete and 0 interrupted iterations
default ↓ [ 100% ] 052/500 VUs  2m30s

running (2m34.9s), 003/500 VUs, 8503 complete and 0 interrupted iterations
default ↓ [ 100% ] 052/500 VUs  2m30s

running (2m35.9s), 001/500 VUs, 8505 complete and 0 interrupted iterations
default ↓ [ 100% ] 052/500 VUs  2m30s


  █ THRESHOLDS 

    active_clients_time
    ✓ 'p(95)<500' p(95)=80ms

    attach_documents_time
    ✓ 'p(95)<10000' p(95)=342ms

    deactivate_clients_time
    ✓ 'p(95)<10000' p(95)=78ms

    http_req_duration
    ✓ 'p(95)<10000' p(95)=149.2ms

    pushpulls_time
    ✓ 'p(95)<1000' p(95)=160ms

    transaction_success_rate
    ✓ 'rate>0.99' rate=100.00%

    transaction_time
    ✓ 'p(95)<30000' p(95)=6.98s


  █ TOTAL RESULTS 

    checks_total.......: 136096  872.62545/s
    checks_succeeded...: 100.00% 136096 out of 136096
    checks_failed......: 0.00%   0 out of 136096

    ✓ status is 200
    ✓ response has valid body

    CUSTOM
    active_clients....................: 8506    54.539091/s
    active_clients_success_rate.......: 100.00% 8506 out of 8506
    active_clients_time...............: avg=16.79ms min=0s       med=4ms    max=402ms    p(90)=50ms    p(95)=80ms   
    attach_documents..................: 8506    54.539091/s
    attach_documents_success_rate.....: 100.00% 8506 out of 8506
    attach_documents_time.............: avg=76.4ms  min=2ms      med=17ms   max=718ms    p(90)=254ms   p(95)=342ms  
    deactivate_clients................: 8506    54.539091/s
    deactivate_clients_success_rate...: 100.00% 8506 out of 8506
    deactivate_clients_time...........: avg=16.9ms  min=0s       med=2ms    max=474ms    p(90)=46ms    p(95)=78ms   
    pushpulls.........................: 42530   272.695453/s
    pushpulls_success_rate............: 100.00% 42530 out of 42530
    pushpulls_time....................: avg=37.46ms min=1ms      med=12ms   max=718ms    p(90)=101ms   p(95)=160ms  
    transaction_success_rate..........: 100.00% 8506 out of 8506
    transaction_time..................: avg=6.34s   min=6.01s    med=6.27s  max=8.17s    p(90)=6.8s    p(95)=6.98s  

    HTTP
    http_req_duration.................: avg=31.91ms min=177.44µs med=6.44ms max=669.99ms p(90)=91.29ms p(95)=149.2ms
      { expected_response:true }......: avg=31.91ms min=177.44µs med=6.44ms max=669.99ms p(90)=91.29ms p(95)=149.2ms
    http_req_failed...................: 0.00%   0 out of 68048
    http_reqs.........................: 68048   436.312725/s

    EXECUTION
    iteration_duration................: avg=6.34s   min=6.01s    med=6.27s  max=8.17s    p(90)=6.8s    p(95)=6.98s  
    iterations........................: 8506    54.539091/s
    vus...............................: 1       min=1              max=500
    vus_max...........................: 500     min=500            max=500

    NETWORK
    data_received.....................: 1.2 GB  7.8 MB/s
    data_sent.........................: 64 MB   411 kB/s




running (2m36.0s), 000/500 VUs, 8506 complete and 0 interrupted iterations
default ✓ [ 100% ] 000/500 VUs  2m30s
