
         /\      Grafana   /‾‾/  
    /\  /  \     |\  __   /  /   
   /  \/    \    | |/ /  /   ‾‾\ 
  /          \   |   (  |  (‾)  |
 / __________ \  |_|\_\  \_____/ 

     execution: local
        script: test/k6/presence.ts
        output: -

     scenarios: (100.00%) 1 scenario, 500 max VUs, 3m0s max duration (incl. graceful stop):
              * default: Up to 500 looping VUs for 2m30s over 3 stages (gracefulRampDown: 30s, gracefulStop: 30s)


running (0m00.9s), 008/500 VUs, 0 complete and 0 interrupted iterations
default   [   1% ] 008/500 VUs  0m00.9s/2m30.0s

running (0m01.9s), 016/500 VUs, 0 complete and 0 interrupted iterations
default   [   1% ] 016/500 VUs  0m01.9s/2m30.0s

running (0m02.9s), 024/500 VUs, 0 complete and 0 interrupted iterations
default   [   2% ] 024/500 VUs  0m02.9s/2m30.0s

running (0m03.9s), 033/500 VUs, 0 complete and 0 interrupted iterations
default   [   3% ] 033/500 VUs  0m03.9s/2m30.0s

running (0m04.9s), 041/500 VUs, 0 complete and 0 interrupted iterations
default   [   3% ] 041/500 VUs  0m04.9s/2m30.0s

running (0m05.9s), 049/500 VUs, 0 complete and 0 interrupted iterations
default   [   4% ] 049/500 VUs  0m05.9s/2m30.0s

running (0m06.9s), 058/500 VUs, 8 complete and 0 interrupted iterations
default   [   5% ] 058/500 VUs  0m06.9s/2m30.0s

running (0m07.9s), 066/500 VUs, 16 complete and 0 interrupted iterations
default   [   5% ] 066/500 VUs  0m07.9s/2m30.0s

running (0m08.9s), 074/500 VUs, 24 complete and 0 interrupted iterations
default   [   6% ] 074/500 VUs  0m08.9s/2m30.0s

running (0m09.9s), 083/500 VUs, 33 complete and 0 interrupted iterations
default   [   7% ] 083/500 VUs  0m09.9s/2m30.0s

running (0m10.9s), 091/500 VUs, 41 complete and 0 interrupted iterations
default   [   7% ] 091/500 VUs  0m10.9s/2m30.0s

running (0m11.9s), 099/500 VUs, 49 complete and 0 interrupted iterations
default   [   8% ] 099/500 VUs  0m11.9s/2m30.0s

running (0m12.9s), 108/500 VUs, 64 complete and 0 interrupted iterations
default   [   9% ] 108/500 VUs  0m12.9s/2m30.0s

running (0m13.9s), 116/500 VUs, 82 complete and 0 interrupted iterations
default   [   9% ] 116/500 VUs  0m13.9s/2m30.0s

running (0m14.9s), 124/500 VUs, 98 complete and 0 interrupted iterations
default   [  10% ] 124/500 VUs  0m14.9s/2m30.0s

running (0m15.9s), 133/500 VUs, 114 complete and 0 interrupted iterations
default   [  11% ] 133/500 VUs  0m15.9s/2m30.0s

running (0m16.9s), 141/500 VUs, 132 complete and 0 interrupted iterations
default   [  11% ] 141/500 VUs  0m16.9s/2m30.0s

running (0m17.9s), 149/500 VUs, 148 complete and 0 interrupted iterations
default   [  12% ] 149/500 VUs  0m17.9s/2m30.0s

running (0m18.9s), 157/500 VUs, 171 complete and 0 interrupted iterations
default   [  13% ] 157/500 VUs  0m18.9s/2m30.0s

running (0m19.9s), 166/500 VUs, 198 complete and 0 interrupted iterations
default   [  13% ] 166/500 VUs  0m19.9s/2m30.0s

running (0m20.9s), 174/500 VUs, 222 complete and 0 interrupted iterations
default   [  14% ] 174/500 VUs  0m20.9s/2m30.0s

running (0m21.9s), 182/500 VUs, 246 complete and 0 interrupted iterations
default   [  15% ] 182/500 VUs  0m21.9s/2m30.0s

running (0m22.9s), 191/500 VUs, 272 complete and 0 interrupted iterations
default   [  15% ] 191/500 VUs  0m22.9s/2m30.0s

running (0m23.9s), 199/500 VUs, 297 complete and 0 interrupted iterations
default   [  16% ] 199/500 VUs  0m23.9s/2m30.0s

running (0m24.9s), 207/500 VUs, 328 complete and 0 interrupted iterations
default   [  17% ] 207/500 VUs  0m24.9s/2m30.0s

running (0m25.9s), 216/500 VUs, 361 complete and 0 interrupted iterations
default   [  17% ] 216/500 VUs  0m25.9s/2m30.0s

running (0m26.9s), 224/500 VUs, 396 complete and 0 interrupted iterations
default   [  18% ] 224/500 VUs  0m26.9s/2m30.0s

running (0m27.9s), 232/500 VUs, 428 complete and 0 interrupted iterations
default   [  19% ] 232/500 VUs  0m27.9s/2m30.0s

running (0m28.9s), 241/500 VUs, 461 complete and 0 interrupted iterations
default   [  19% ] 241/500 VUs  0m28.9s/2m30.0s

running (0m29.9s), 249/500 VUs, 496 complete and 0 interrupted iterations
default   [  20% ] 249/500 VUs  0m29.9s/2m30.0s

running (0m30.9s), 257/500 VUs, 535 complete and 0 interrupted iterations
default   [  21% ] 257/500 VUs  0m30.9s/2m30.0s

running (0m31.9s), 266/500 VUs, 575 complete and 0 interrupted iterations
default   [  21% ] 266/500 VUs  0m31.9s/2m30.0s

running (0m32.9s), 274/500 VUs, 617 complete and 0 interrupted iterations
default   [  22% ] 274/500 VUs  0m32.9s/2m30.0s

running (0m33.9s), 282/500 VUs, 660 complete and 0 interrupted iterations
default   [  23% ] 282/500 VUs  0m33.9s/2m30.0s

running (0m34.9s), 291/500 VUs, 700 complete and 0 interrupted iterations
default   [  23% ] 291/500 VUs  0m34.9s/2m30.0s

running (0m35.9s), 299/500 VUs, 741 complete and 0 interrupted iterations
default   [  24% ] 299/500 VUs  0m35.9s/2m30.0s

running (0m36.9s), 307/500 VUs, 788 complete and 0 interrupted iterations
default   [  25% ] 307/500 VUs  0m36.9s/2m30.0s

running (0m37.9s), 315/500 VUs, 840 complete and 0 interrupted iterations
default   [  25% ] 315/500 VUs  0m37.9s/2m30.0s

running (0m38.9s), 324/500 VUs, 889 complete and 0 interrupted iterations
default   [  26% ] 324/500 VUs  0m38.9s/2m30.0s

running (0m39.9s), 332/500 VUs, 939 complete and 0 interrupted iterations
default   [  27% ] 332/500 VUs  0m39.9s/2m30.0s

running (0m40.9s), 340/500 VUs, 989 complete and 0 interrupted iterations
default   [  27% ] 340/500 VUs  0m40.9s/2m30.0s

running (0m41.9s), 349/500 VUs, 1039 complete and 0 interrupted iterations
default   [  28% ] 349/500 VUs  0m41.9s/2m30.0s

running (0m42.9s), 357/500 VUs, 1094 complete and 0 interrupted iterations
default   [  29% ] 357/500 VUs  0m42.9s/2m30.0s

running (0m43.9s), 365/500 VUs, 1153 complete and 0 interrupted iterations
default   [  29% ] 365/500 VUs  0m43.9s/2m30.0s

running (0m44.9s), 374/500 VUs, 1212 complete and 0 interrupted iterations
default   [  30% ] 374/500 VUs  0m44.9s/2m30.0s

running (0m45.9s), 382/500 VUs, 1270 complete and 0 interrupted iterations
default   [  31% ] 382/500 VUs  0m45.9s/2m30.0s

running (0m46.9s), 390/500 VUs, 1328 complete and 0 interrupted iterations
default   [  31% ] 390/500 VUs  0m46.9s/2m30.0s

running (0m47.9s), 399/500 VUs, 1386 complete and 0 interrupted iterations
default   [  32% ] 399/500 VUs  0m47.9s/2m30.0s

running (0m48.9s), 407/500 VUs, 1450 complete and 0 interrupted iterations
default   [  33% ] 407/500 VUs  0m48.9s/2m30.0s

running (0m49.9s), 415/500 VUs, 1516 complete and 0 interrupted iterations
default   [  33% ] 415/500 VUs  0m49.9s/2m30.0s

running (0m50.9s), 424/500 VUs, 1582 complete and 0 interrupted iterations
default   [  34% ] 424/500 VUs  0m50.9s/2m30.0s

running (0m51.9s), 432/500 VUs, 1648 complete and 0 interrupted iterations
default   [  35% ] 432/500 VUs  0m51.9s/2m30.0s

running (0m52.9s), 440/500 VUs, 1713 complete and 0 interrupted iterations
default   [  35% ] 440/500 VUs  0m52.9s/2m30.0s

running (0m53.9s), 448/500 VUs, 1778 complete and 0 interrupted iterations
default   [  36% ] 448/500 VUs  0m53.9s/2m30.0s

running (0m54.9s), 455/500 VUs, 1836 complete and 0 interrupted iterations
default   [  37% ] 455/500 VUs  0m54.9s/2m30.0s

running (0m55.9s), 465/500 VUs, 1909 complete and 0 interrupted iterations
default   [  37% ] 465/500 VUs  0m55.9s/2m30.0s

running (0m56.9s), 474/500 VUs, 1969 complete and 0 interrupted iterations
default   [  38% ] 474/500 VUs  0m56.9s/2m30.0s

running (0m57.9s), 482/500 VUs, 2036 complete and 0 interrupted iterations
default   [  39% ] 482/500 VUs  0m57.9s/2m30.0s

running (0m58.9s), 490/500 VUs, 2101 complete and 0 interrupted iterations
default   [  39% ] 490/500 VUs  0m58.9s/2m30.0s

running (0m59.9s), 498/500 VUs, 2167 complete and 0 interrupted iterations
default   [  40% ] 498/500 VUs  0m59.9s/2m30.0s

running (1m00.9s), 500/500 VUs, 2229 complete and 0 interrupted iterations
default   [  41% ] 500/500 VUs  1m00.9s/2m30.0s

running (1m01.9s), 500/500 VUs, 2293 complete and 0 interrupted iterations
default   [  41% ] 500/500 VUs  1m01.9s/2m30.0s

running (1m02.9s), 500/500 VUs, 2397 complete and 0 interrupted iterations
default   [  42% ] 500/500 VUs  1m02.9s/2m30.0s

running (1m03.9s), 500/500 VUs, 2449 complete and 0 interrupted iterations
default   [  43% ] 500/500 VUs  1m03.9s/2m30.0s

running (1m04.9s), 500/500 VUs, 2520 complete and 0 interrupted iterations
default   [  43% ] 500/500 VUs  1m04.9s/2m30.0s

running (1m05.9s), 500/500 VUs, 2643 complete and 0 interrupted iterations
default   [  44% ] 500/500 VUs  1m05.9s/2m30.0s

running (1m06.9s), 500/500 VUs, 2682 complete and 0 interrupted iterations
default   [  45% ] 500/500 VUs  1m06.9s/2m30.0s

running (1m07.9s), 500/500 VUs, 2752 complete and 0 interrupted iterations
default   [  45% ] 500/500 VUs  1m07.9s/2m30.0s

running (1m08.9s), 500/500 VUs, 2849 complete and 0 interrupted iterations
default   [  46% ] 500/500 VUs  1m08.9s/2m30.0s

running (1m09.9s), 500/500 VUs, 2895 complete and 0 interrupted iterations
default   [  47% ] 500/500 VUs  1m09.9s/2m30.0s

running (1m10.9s), 500/500 VUs, 2973 complete and 0 interrupted iterations
default   [  47% ] 500/500 VUs  1m10.9s/2m30.0s

running (1m11.9s), 500/500 VUs, 3024 complete and 0 interrupted iterations
default   [  48% ] 500/500 VUs  1m11.9s/2m30.0s

running (1m12.9s), 500/500 VUs, 3142 complete and 0 interrupted iterations
default   [  49% ] 500/500 VUs  1m12.9s/2m30.0s

running (1m13.9s), 500/500 VUs, 3195 complete and 0 interrupted iterations
default   [  49% ] 500/500 VUs  1m13.9s/2m30.0s

running (1m14.9s), 500/500 VUs, 3261 complete and 0 interrupted iterations
default   [  50% ] 500/500 VUs  1m14.9s/2m30.0s

running (1m16.0s), 500/500 VUs, 3323 complete and 0 interrupted iterations
default   [  51% ] 500/500 VUs  1m16.0s/2m30.0s

running (1m16.9s), 500/500 VUs, 3398 complete and 0 interrupted iterations
default   [  51% ] 500/500 VUs  1m16.9s/2m30.0s

running (1m17.9s), 500/500 VUs, 3455 complete and 0 interrupted iterations
default   [  52% ] 500/500 VUs  1m17.9s/2m30.0s

running (1m18.9s), 500/500 VUs, 3521 complete and 0 interrupted iterations
default   [  53% ] 500/500 VUs  1m18.9s/2m30.0s

running (1m19.9s), 500/500 VUs, 3611 complete and 0 interrupted iterations
default   [  53% ] 500/500 VUs  1m19.9s/2m30.0s

running (1m20.9s), 500/500 VUs, 3674 complete and 0 interrupted iterations
default   [  54% ] 500/500 VUs  1m20.9s/2m30.0s

running (1m21.9s), 500/500 VUs, 3778 complete and 0 interrupted iterations
default   [  55% ] 500/500 VUs  1m21.9s/2m30.0s

running (1m22.9s), 500/500 VUs, 3838 complete and 0 interrupted iterations
default   [  55% ] 500/500 VUs  1m22.9s/2m30.0s

running (1m23.9s), 500/500 VUs, 3897 complete and 0 interrupted iterations
default   [  56% ] 500/500 VUs  1m23.9s/2m30.0s

running (1m24.9s), 500/500 VUs, 3954 complete and 0 interrupted iterations
default   [  57% ] 500/500 VUs  1m24.9s/2m30.0s

running (1m25.9s), 500/500 VUs, 4028 complete and 0 interrupted iterations
default   [  57% ] 500/500 VUs  1m25.9s/2m30.0s

running (1m26.9s), 500/500 VUs, 4121 complete and 0 interrupted iterations
default   [  58% ] 500/500 VUs  1m26.9s/2m30.0s

running (1m27.9s), 500/500 VUs, 4177 complete and 0 interrupted iterations
default   [  59% ] 500/500 VUs  1m27.9s/2m30.0s

running (1m28.9s), 500/500 VUs, 4258 complete and 0 interrupted iterations
default   [  59% ] 500/500 VUs  1m28.9s/2m30.0s

running (1m29.9s), 500/500 VUs, 4330 complete and 0 interrupted iterations
default   [  60% ] 500/500 VUs  1m29.9s/2m30.0s

running (1m30.9s), 500/500 VUs, 4376 complete and 0 interrupted iterations
default   [  61% ] 500/500 VUs  1m30.9s/2m30.0s

running (1m31.9s), 500/500 VUs, 4461 complete and 0 interrupted iterations
default   [  61% ] 500/500 VUs  1m31.9s/2m30.0s

running (1m32.9s), 500/500 VUs, 4554 complete and 0 interrupted iterations
default   [  62% ] 500/500 VUs  1m32.9s/2m30.0s

running (1m33.9s), 500/500 VUs, 4603 complete and 0 interrupted iterations
default   [  63% ] 500/500 VUs  1m33.9s/2m30.0s

running (1m34.9s), 500/500 VUs, 4696 complete and 0 interrupted iterations
default   [  63% ] 500/500 VUs  1m34.9s/2m30.0s

running (1m35.9s), 500/500 VUs, 4787 complete and 0 interrupted iterations
default   [  64% ] 500/500 VUs  1m35.9s/2m30.0s

running (1m36.9s), 500/500 VUs, 4831 complete and 0 interrupted iterations
default   [  65% ] 500/500 VUs  1m36.9s/2m30.0s

running (1m37.9s), 500/500 VUs, 4923 complete and 0 interrupted iterations
default   [  65% ] 500/500 VUs  1m37.9s/2m30.0s

running (1m38.9s), 500/500 VUs, 4985 complete and 0 interrupted iterations
default   [  66% ] 500/500 VUs  1m38.9s/2m30.0s

running (1m39.9s), 500/500 VUs, 5066 complete and 0 interrupted iterations
default   [  67% ] 500/500 VUs  1m39.9s/2m30.0s

running (1m40.9s), 500/500 VUs, 5137 complete and 0 interrupted iterations
default   [  67% ] 500/500 VUs  1m40.9s/2m30.0s

running (1m41.9s), 500/500 VUs, 5199 complete and 0 interrupted iterations
default   [  68% ] 500/500 VUs  1m41.9s/2m30.0s

running (1m42.9s), 500/500 VUs, 5310 complete and 0 interrupted iterations
default   [  69% ] 500/500 VUs  1m42.9s/2m30.0s

running (1m43.9s), 500/500 VUs, 5357 complete and 0 interrupted iterations
default   [  69% ] 500/500 VUs  1m43.9s/2m30.0s

running (1m44.9s), 500/500 VUs, 5441 complete and 0 interrupted iterations
default   [  70% ] 500/500 VUs  1m44.9s/2m30.0s

running (1m45.9s), 500/500 VUs, 5545 complete and 0 interrupted iterations
default   [  71% ] 500/500 VUs  1m45.9s/2m30.0s

running (1m46.9s), 500/500 VUs, 5594 complete and 0 interrupted iterations
default   [  71% ] 500/500 VUs  1m46.9s/2m30.0s

running (1m47.9s), 500/500 VUs, 5657 complete and 0 interrupted iterations
default   [  72% ] 500/500 VUs  1m47.9s/2m30.0s

running (1m48.9s), 500/500 VUs, 5727 complete and 0 interrupted iterations
default   [  73% ] 500/500 VUs  1m48.9s/2m30.0s

running (1m50.1s), 500/500 VUs, 5831 complete and 0 interrupted iterations
default   [  73% ] 500/500 VUs  1m50.1s/2m30.0s

running (1m50.9s), 500/500 VUs, 5870 complete and 0 interrupted iterations
default   [  74% ] 500/500 VUs  1m50.9s/2m30.0s

running (1m51.9s), 500/500 VUs, 5946 complete and 0 interrupted iterations
default   [  75% ] 500/500 VUs  1m51.9s/2m30.0s

running (1m52.9s), 500/500 VUs, 6041 complete and 0 interrupted iterations
default   [  75% ] 500/500 VUs  1m52.9s/2m30.0s

running (1m53.9s), 500/500 VUs, 6086 complete and 0 interrupted iterations
default   [  76% ] 500/500 VUs  1m53.9s/2m30.0s

running (1m54.9s), 500/500 VUs, 6163 complete and 0 interrupted iterations
default   [  77% ] 500/500 VUs  1m54.9s/2m30.0s

running (1m55.9s), 500/500 VUs, 6261 complete and 0 interrupted iterations
default   [  77% ] 500/500 VUs  1m55.9s/2m30.0s

running (1m56.9s), 500/500 VUs, 6296 complete and 0 interrupted iterations
default   [  78% ] 500/500 VUs  1m56.9s/2m30.0s

running (1m57.9s), 500/500 VUs, 6392 complete and 0 interrupted iterations
default   [  79% ] 500/500 VUs  1m57.9s/2m30.0s

running (1m58.9s), 500/500 VUs, 6463 complete and 0 interrupted iterations
default   [  79% ] 500/500 VUs  1m58.9s/2m30.0s

running (1m59.9s), 500/500 VUs, 6536 complete and 0 interrupted iterations
default   [  80% ] 500/500 VUs  1m59.9s/2m30.0s

running (2m00.9s), 497/500 VUs, 6593 complete and 0 interrupted iterations
default   [  81% ] 497/500 VUs  2m00.9s/2m30.0s

running (2m01.9s), 492/500 VUs, 6664 complete and 0 interrupted iterations
default   [  81% ] 492/500 VUs  2m01.9s/2m30.0s

running (2m02.9s), 487/500 VUs, 6768 complete and 0 interrupted iterations
default   [  82% ] 487/500 VUs  2m02.9s/2m30.0s

running (2m03.9s), 480/500 VUs, 6825 complete and 0 interrupted iterations
default   [  83% ] 480/500 VUs  2m03.9s/2m30.0s

running (2m04.9s), 472/500 VUs, 6883 complete and 0 interrupted iterations
default   [  83% ] 472/500 VUs  2m04.9s/2m30.0s

running (2m05.9s), 446/500 VUs, 7016 complete and 0 interrupted iterations
default   [  84% ] 446/500 VUs  2m05.9s/2m30.0s

running (2m06.9s), 440/500 VUs, 7063 complete and 0 interrupted iterations
default   [  85% ] 440/500 VUs  2m06.9s/2m30.0s

running (2m07.9s), 426/500 VUs, 7135 complete and 0 interrupted iterations
default   [  85% ] 426/500 VUs  2m07.9s/2m30.0s

running (2m08.9s), 404/500 VUs, 7244 complete and 0 interrupted iterations
default   [  86% ] 404/500 VUs  2m08.9s/2m30.0s

running (2m09.9s), 387/500 VUs, 7289 complete and 0 interrupted iterations
default   [  87% ] 387/500 VUs  2m09.9s/2m30.0s

running (2m10.9s), 375/500 VUs, 7347 complete and 0 interrupted iterations
default   [  87% ] 375/500 VUs  2m10.9s/2m30.0s

running (2m11.9s), 364/500 VUs, 7405 complete and 0 interrupted iterations
default   [  88% ] 364/500 VUs  2m11.9s/2m30.0s

running (2m12.9s), 334/500 VUs, 7496 complete and 0 interrupted iterations
default   [  89% ] 334/500 VUs  2m12.9s/2m30.0s

running (2m13.9s), 318/500 VUs, 7554 complete and 0 interrupted iterations
default   [  89% ] 318/500 VUs  2m13.9s/2m30.0s

running (2m14.9s), 295/500 VUs, 7645 complete and 0 interrupted iterations
default   [  90% ] 295/500 VUs  2m14.9s/2m30.0s

running (2m15.9s), 289/500 VUs, 7673 complete and 0 interrupted iterations
default   [  91% ] 289/500 VUs  2m15.9s/2m30.0s

running (2m16.9s), 277/500 VUs, 7714 complete and 0 interrupted iterations
default   [  91% ] 277/500 VUs  2m16.9s/2m30.0s

running (2m17.9s), 260/500 VUs, 7768 complete and 0 interrupted iterations
default   [  92% ] 260/500 VUs  2m17.9s/2m30.0s

running (2m18.9s), 238/500 VUs, 7827 complete and 0 interrupted iterations
default   [  93% ] 238/500 VUs  2m18.9s/2m30.0s

running (2m19.9s), 223/500 VUs, 7870 complete and 0 interrupted iterations
default   [  93% ] 223/500 VUs  2m19.9s/2m30.0s

running (2m20.9s), 196/500 VUs, 7937 complete and 0 interrupted iterations
default   [  94% ] 196/500 VUs  2m20.9s/2m30.0s

running (2m21.9s), 186/500 VUs, 7962 complete and 0 interrupted iterations
default   [  95% ] 186/500 VUs  2m21.9s/2m30.0s

running (2m22.9s), 175/500 VUs, 7991 complete and 0 interrupted iterations
default   [  95% ] 175/500 VUs  2m22.9s/2m30.0s

running (2m23.9s), 156/500 VUs, 8028 complete and 0 interrupted iterations
default   [  96% ] 156/500 VUs  2m23.9s/2m30.0s

running (2m24.9s), 134/500 VUs, 8064 complete and 0 interrupted iterations
default   [  97% ] 134/500 VUs  2m24.9s/2m30.0s

running (2m25.9s), 118/500 VUs, 8093 complete and 0 interrupted iterations
default   [  97% ] 118/500 VUs  2m25.9s/2m30.0s

running (2m26.9s), 092/500 VUs, 8133 complete and 0 interrupted iterations
default   [  98% ] 092/500 VUs  2m26.9s/2m30.0s

running (2m27.9s), 082/500 VUs, 8147 complete and 0 interrupted iterations
default   [  99% ] 082/500 VUs  2m27.9s/2m30.0s

running (2m28.9s), 067/500 VUs, 8166 complete and 0 interrupted iterations
default   [  99% ] 067/500 VUs  2m28.9s/2m30.0s

running (2m29.9s), 053/500 VUs, 8184 complete and 0 interrupted iterations
default   [ 100% ] 053/500 VUs  2m29.9s/2m30.0s

running (2m30.9s), 039/500 VUs, 8198 complete and 0 interrupted iterations
default ↓ [ 100% ] 052/500 VUs  2m30s

running (2m31.9s), 026/500 VUs, 8211 complete and 0 interrupted iterations
default ↓ [ 100% ] 052/500 VUs  2m30s

running (2m32.9s), 013/500 VUs, 8224 complete and 0 interrupted iterations
default ↓ [ 100% ] 052/500 VUs  2m30s

running (2m33.9s), 008/500 VUs, 8229 complete and 0 interrupted iterations
default ↓ [ 100% ] 052/500 VUs  2m30s

running (2m34.9s), 004/500 VUs, 8233 complete and 0 interrupted iterations
default ↓ [ 100% ] 052/500 VUs  2m30s


  █ THRESHOLDS 

    active_clients_time
    ✓ 'p(95)<500' p(95)=126ms

    attach_documents_time
    ✓ 'p(95)<10000' p(95)=489ms

    deactivate_clients_time
    ✓ 'p(95)<10000' p(95)=124ms

    http_req_duration
    ✓ 'p(95)<10000' p(95)=244.47ms

    pushpulls_time
    ✓ 'p(95)<1000' p(95)=268ms

    transaction_success_rate
    ✓ 'rate>0.99' rate=100.00%

    transaction_time
    ✓ 'p(95)<30000' p(95)=7.39s


  █ TOTAL RESULTS 

    checks_total.......: 131792  847.538755/s
    checks_succeeded...: 100.00% 131792 out of 131792
    checks_failed......: 0.00%   0 out of 131792

    ✓ status is 200
    ✓ response has valid body

    CUSTOM
    active_clients....................: 8237    52.971172/s
    active_clients_success_rate.......: 100.00% 8237 out of 8237
    active_clients_time...............: avg=27.98ms min=1ms      med=6ms     max=741ms   p(90)=87ms     p(95)=126ms   
    attach_documents..................: 8237    52.971172/s
    attach_documents_success_rate.....: 100.00% 8237 out of 8237
    attach_documents_time.............: avg=115.8ms min=3ms      med=27ms    max=1.01s   p(90)=379ms    p(95)=489ms   
    deactivate_clients................: 8237    52.971172/s
    deactivate_clients_success_rate...: 100.00% 8237 out of 8237
    deactivate_clients_time...........: avg=26.12ms min=0s       med=4ms     max=610ms   p(90)=78.4ms   p(95)=124ms   
    pushpulls.........................: 41185   264.855861/s
    pushpulls_success_rate............: 100.00% 41185 out of 41185
    pushpulls_time....................: avg=64.88ms min=1ms      med=21ms    max=841ms   p(90)=188ms    p(95)=268ms   
    transaction_success_rate..........: 100.00% 8237 out of 8237
    transaction_time..................: avg=6.56s   min=6.01s    med=6.53s   max=8.63s   p(90)=7.21s    p(95)=7.39s   

    HTTP
    http_req_duration.................: avg=54.65ms min=490.33µs med=11.61ms max=826.3ms p(90)=160.77ms p(95)=244.47ms
      { expected_response:true }......: avg=54.65ms min=490.33µs med=11.61ms max=826.3ms p(90)=160.77ms p(95)=244.47ms
    http_req_failed...................: 0.00%   0 out of 65896
    http_reqs.........................: 65896   423.769377/s

    EXECUTION
    iteration_duration................: avg=6.56s   min=6.01s    med=6.53s   max=8.63s   p(90)=7.21s    p(95)=7.39s   
    iterations........................: 8237    52.971172/s
    vus...............................: 4       min=4              max=500
    vus_max...........................: 500     min=500            max=500

    NETWORK
    data_received.....................: 1.2 GB  7.4 MB/s
    data_sent.........................: 62 MB   399 kB/s




running (2m35.5s), 000/500 VUs, 8237 complete and 0 interrupted iterations
default ✓ [ 100% ] 000/500 VUs  2m30s
