
         /\      Grafana   /‾‾/  
    /\  /  \     |\  __   /  /   
   /  \/    \    | |/ /  /   ‾‾\ 
  /          \   |   (  |  (‾)  |
 / __________ \  |_|\_\  \_____/ 

     execution: local
        script: test/k6/presence.ts
        output: -

     scenarios: (100.00%) 1 scenario, 500 max VUs, 3m0s max duration (incl. graceful stop):
              * default: Up to 500 looping VUs for 2m30s over 3 stages (gracefulRampDown: 30s, gracefulStop: 30s)


running (0m00.9s), 008/500 VUs, 0 complete and 0 interrupted iterations
default   [   1% ] 008/500 VUs  0m00.9s/2m30.0s

running (0m01.9s), 016/500 VUs, 0 complete and 0 interrupted iterations
default   [   1% ] 016/500 VUs  0m01.9s/2m30.0s

running (0m02.9s), 024/500 VUs, 0 complete and 0 interrupted iterations
default   [   2% ] 024/500 VUs  0m02.9s/2m30.0s

running (0m03.9s), 033/500 VUs, 0 complete and 0 interrupted iterations
default   [   3% ] 033/500 VUs  0m03.9s/2m30.0s

running (0m04.9s), 041/500 VUs, 0 complete and 0 interrupted iterations
default   [   3% ] 041/500 VUs  0m04.9s/2m30.0s

running (0m05.9s), 049/500 VUs, 0 complete and 0 interrupted iterations
default   [   4% ] 049/500 VUs  0m05.9s/2m30.0s

running (0m06.9s), 058/500 VUs, 8 complete and 0 interrupted iterations
default   [   5% ] 058/500 VUs  0m06.9s/2m30.0s

running (0m07.9s), 066/500 VUs, 16 complete and 0 interrupted iterations
default   [   5% ] 066/500 VUs  0m07.9s/2m30.0s

running (0m08.9s), 074/500 VUs, 24 complete and 0 interrupted iterations
default   [   6% ] 074/500 VUs  0m08.9s/2m30.0s

running (0m09.9s), 083/500 VUs, 33 complete and 0 interrupted iterations
default   [   7% ] 083/500 VUs  0m09.9s/2m30.0s

running (0m10.9s), 091/500 VUs, 41 complete and 0 interrupted iterations
default   [   7% ] 091/500 VUs  0m10.9s/2m30.0s

running (0m11.9s), 099/500 VUs, 49 complete and 0 interrupted iterations
default   [   8% ] 099/500 VUs  0m11.9s/2m30.0s

running (0m12.9s), 108/500 VUs, 66 complete and 0 interrupted iterations
default   [   9% ] 108/500 VUs  0m12.9s/2m30.0s

running (0m13.9s), 116/500 VUs, 82 complete and 0 interrupted iterations
default   [   9% ] 116/500 VUs  0m13.9s/2m30.0s

running (0m14.9s), 124/500 VUs, 98 complete and 0 interrupted iterations
default   [  10% ] 124/500 VUs  0m14.9s/2m30.0s

running (0m15.9s), 133/500 VUs, 114 complete and 0 interrupted iterations
default   [  11% ] 133/500 VUs  0m15.9s/2m30.0s

running (0m16.9s), 141/500 VUs, 132 complete and 0 interrupted iterations
default   [  11% ] 141/500 VUs  0m16.9s/2m30.0s

running (0m17.9s), 149/500 VUs, 148 complete and 0 interrupted iterations
default   [  12% ] 149/500 VUs  0m17.9s/2m30.0s

running (0m18.9s), 158/500 VUs, 171 complete and 0 interrupted iterations
default   [  13% ] 158/500 VUs  0m18.9s/2m30.0s

running (0m19.9s), 166/500 VUs, 198 complete and 0 interrupted iterations
default   [  13% ] 166/500 VUs  0m19.9s/2m30.0s

running (0m20.9s), 174/500 VUs, 222 complete and 0 interrupted iterations
default   [  14% ] 174/500 VUs  0m20.9s/2m30.0s

running (0m21.9s), 182/500 VUs, 246 complete and 0 interrupted iterations
default   [  15% ] 182/500 VUs  0m21.9s/2m30.0s

running (0m22.9s), 191/500 VUs, 273 complete and 0 interrupted iterations
default   [  15% ] 191/500 VUs  0m22.9s/2m30.0s

running (0m23.9s), 199/500 VUs, 297 complete and 0 interrupted iterations
default   [  16% ] 199/500 VUs  0m23.9s/2m30.0s

running (0m24.9s), 207/500 VUs, 328 complete and 0 interrupted iterations
default   [  17% ] 207/500 VUs  0m24.9s/2m30.0s

running (0m25.9s), 216/500 VUs, 362 complete and 0 interrupted iterations
default   [  17% ] 216/500 VUs  0m25.9s/2m30.0s

running (0m26.9s), 224/500 VUs, 396 complete and 0 interrupted iterations
default   [  18% ] 224/500 VUs  0m26.9s/2m30.0s

running (0m27.9s), 232/500 VUs, 428 complete and 0 interrupted iterations
default   [  19% ] 232/500 VUs  0m27.9s/2m30.0s

running (0m28.9s), 241/500 VUs, 462 complete and 0 interrupted iterations
default   [  19% ] 241/500 VUs  0m28.9s/2m30.0s

running (0m29.9s), 249/500 VUs, 496 complete and 0 interrupted iterations
default   [  20% ] 249/500 VUs  0m29.9s/2m30.0s

running (0m30.9s), 257/500 VUs, 535 complete and 0 interrupted iterations
default   [  21% ] 257/500 VUs  0m30.9s/2m30.0s

running (0m31.9s), 266/500 VUs, 575 complete and 0 interrupted iterations
default   [  21% ] 266/500 VUs  0m31.9s/2m30.0s

running (0m32.9s), 274/500 VUs, 617 complete and 0 interrupted iterations
default   [  22% ] 274/500 VUs  0m32.9s/2m30.0s

running (0m33.9s), 282/500 VUs, 660 complete and 0 interrupted iterations
default   [  23% ] 282/500 VUs  0m33.9s/2m30.0s

running (0m34.9s), 291/500 VUs, 700 complete and 0 interrupted iterations
default   [  23% ] 291/500 VUs  0m34.9s/2m30.0s

running (0m35.9s), 299/500 VUs, 742 complete and 0 interrupted iterations
default   [  24% ] 299/500 VUs  0m35.9s/2m30.0s

running (0m36.9s), 307/500 VUs, 791 complete and 0 interrupted iterations
default   [  25% ] 307/500 VUs  0m36.9s/2m30.0s

running (0m37.9s), 316/500 VUs, 840 complete and 0 interrupted iterations
default   [  25% ] 316/500 VUs  0m37.9s/2m30.0s

running (0m38.9s), 324/500 VUs, 889 complete and 0 interrupted iterations
default   [  26% ] 324/500 VUs  0m38.9s/2m30.0s

running (0m39.9s), 332/500 VUs, 941 complete and 0 interrupted iterations
default   [  27% ] 332/500 VUs  0m39.9s/2m30.0s

running (0m40.9s), 340/500 VUs, 990 complete and 0 interrupted iterations
default   [  27% ] 340/500 VUs  0m40.9s/2m30.0s

running (0m41.9s), 349/500 VUs, 1039 complete and 0 interrupted iterations
default   [  28% ] 349/500 VUs  0m41.9s/2m30.0s

running (0m42.9s), 357/500 VUs, 1096 complete and 0 interrupted iterations
default   [  29% ] 357/500 VUs  0m42.9s/2m30.0s

running (0m43.9s), 365/500 VUs, 1155 complete and 0 interrupted iterations
default   [  29% ] 365/500 VUs  0m43.9s/2m30.0s

running (0m44.9s), 374/500 VUs, 1212 complete and 0 interrupted iterations
default   [  30% ] 374/500 VUs  0m44.9s/2m30.0s

running (0m45.9s), 382/500 VUs, 1272 complete and 0 interrupted iterations
default   [  31% ] 382/500 VUs  0m45.9s/2m30.0s

running (0m46.9s), 390/500 VUs, 1329 complete and 0 interrupted iterations
default   [  31% ] 390/500 VUs  0m46.9s/2m30.0s

running (0m47.9s), 399/500 VUs, 1384 complete and 0 interrupted iterations
default   [  32% ] 399/500 VUs  0m47.9s/2m30.0s

running (0m48.9s), 407/500 VUs, 1449 complete and 0 interrupted iterations
default   [  33% ] 407/500 VUs  0m48.9s/2m30.0s

running (0m49.9s), 415/500 VUs, 1515 complete and 0 interrupted iterations
default   [  33% ] 415/500 VUs  0m49.9s/2m30.0s

running (0m50.9s), 424/500 VUs, 1580 complete and 0 interrupted iterations
default   [  34% ] 424/500 VUs  0m50.9s/2m30.0s

running (0m51.9s), 432/500 VUs, 1643 complete and 0 interrupted iterations
default   [  35% ] 432/500 VUs  0m51.9s/2m30.0s

running (0m52.9s), 440/500 VUs, 1703 complete and 0 interrupted iterations
default   [  35% ] 440/500 VUs  0m52.9s/2m30.0s

running (0m53.9s), 449/500 VUs, 1763 complete and 0 interrupted iterations
default   [  36% ] 449/500 VUs  0m53.9s/2m30.0s

running (0m54.9s), 457/500 VUs, 1837 complete and 0 interrupted iterations
default   [  37% ] 457/500 VUs  0m54.9s/2m30.0s

running (0m56.0s), 466/500 VUs, 1911 complete and 0 interrupted iterations
default   [  37% ] 466/500 VUs  0m56.0s/2m30.0s

running (0m56.9s), 474/500 VUs, 1976 complete and 0 interrupted iterations
default   [  38% ] 474/500 VUs  0m56.9s/2m30.0s

running (0m57.9s), 482/500 VUs, 2053 complete and 0 interrupted iterations
default   [  39% ] 482/500 VUs  0m57.9s/2m30.0s

running (0m58.9s), 490/500 VUs, 2132 complete and 0 interrupted iterations
default   [  39% ] 490/500 VUs  0m58.9s/2m30.0s

running (0m59.9s), 499/500 VUs, 2202 complete and 0 interrupted iterations
default   [  40% ] 499/500 VUs  0m59.9s/2m30.0s

running (1m00.9s), 500/500 VUs, 2254 complete and 0 interrupted iterations
default   [  41% ] 500/500 VUs  1m00.9s/2m30.0s

running (1m01.9s), 500/500 VUs, 2340 complete and 0 interrupted iterations
default   [  41% ] 500/500 VUs  1m01.9s/2m30.0s

running (1m02.9s), 500/500 VUs, 2430 complete and 0 interrupted iterations
default   [  42% ] 500/500 VUs  1m02.9s/2m30.0s

running (1m03.9s), 500/500 VUs, 2490 complete and 0 interrupted iterations
default   [  43% ] 500/500 VUs  1m03.9s/2m30.0s

running (1m04.9s), 500/500 VUs, 2548 complete and 0 interrupted iterations
default   [  43% ] 500/500 VUs  1m04.9s/2m30.0s

running (1m05.9s), 500/500 VUs, 2633 complete and 0 interrupted iterations
default   [  44% ] 500/500 VUs  1m05.9s/2m30.0s

running (1m06.9s), 500/500 VUs, 2702 complete and 0 interrupted iterations
default   [  45% ] 500/500 VUs  1m06.9s/2m30.0s

running (1m07.9s), 500/500 VUs, 2753 complete and 0 interrupted iterations
default   [  45% ] 500/500 VUs  1m07.9s/2m30.0s

running (1m08.9s), 500/500 VUs, 2844 complete and 0 interrupted iterations
default   [  46% ] 500/500 VUs  1m08.9s/2m30.0s

running (1m09.9s), 500/500 VUs, 2932 complete and 0 interrupted iterations
default   [  47% ] 500/500 VUs  1m09.9s/2m30.0s

running (1m10.9s), 500/500 VUs, 2968 complete and 0 interrupted iterations
default   [  47% ] 500/500 VUs  1m10.9s/2m30.0s

running (1m11.9s), 500/500 VUs, 3072 complete and 0 interrupted iterations
default   [  48% ] 500/500 VUs  1m11.9s/2m30.0s

running (1m12.9s), 500/500 VUs, 3150 complete and 0 interrupted iterations
default   [  49% ] 500/500 VUs  1m12.9s/2m30.0s

running (1m13.9s), 500/500 VUs, 3214 complete and 0 interrupted iterations
default   [  49% ] 500/500 VUs  1m13.9s/2m30.0s

running (1m14.9s), 500/500 VUs, 3281 complete and 0 interrupted iterations
default   [  50% ] 500/500 VUs  1m14.9s/2m30.0s

running (1m15.9s), 500/500 VUs, 3369 complete and 0 interrupted iterations
default   [  51% ] 500/500 VUs  1m15.9s/2m30.0s

running (1m16.9s), 500/500 VUs, 3431 complete and 0 interrupted iterations
default   [  51% ] 500/500 VUs  1m16.9s/2m30.0s

running (1m17.9s), 500/500 VUs, 3512 complete and 0 interrupted iterations
default   [  52% ] 500/500 VUs  1m17.9s/2m30.0s

running (1m18.9s), 500/500 VUs, 3596 complete and 0 interrupted iterations
default   [  53% ] 500/500 VUs  1m18.9s/2m30.0s

running (1m19.9s), 500/500 VUs, 3655 complete and 0 interrupted iterations
default   [  53% ] 500/500 VUs  1m19.9s/2m30.0s

running (1m20.9s), 500/500 VUs, 3725 complete and 0 interrupted iterations
default   [  54% ] 500/500 VUs  1m20.9s/2m30.0s

running (1m22.1s), 500/500 VUs, 3829 complete and 0 interrupted iterations
default   [  55% ] 500/500 VUs  1m22.1s/2m30.0s

running (1m22.9s), 500/500 VUs, 3874 complete and 0 interrupted iterations
default   [  55% ] 500/500 VUs  1m22.9s/2m30.0s

running (1m23.9s), 500/500 VUs, 3951 complete and 0 interrupted iterations
default   [  56% ] 500/500 VUs  1m23.9s/2m30.0s

running (1m24.9s), 500/500 VUs, 4064 complete and 0 interrupted iterations
default   [  57% ] 500/500 VUs  1m24.9s/2m30.0s

running (1m25.9s), 500/500 VUs, 4117 complete and 0 interrupted iterations
default   [  57% ] 500/500 VUs  1m25.9s/2m30.0s

running (1m26.9s), 500/500 VUs, 4184 complete and 0 interrupted iterations
default   [  58% ] 500/500 VUs  1m26.9s/2m30.0s

running (1m27.9s), 500/500 VUs, 4280 complete and 0 interrupted iterations
default   [  59% ] 500/500 VUs  1m27.9s/2m30.0s

running (1m28.9s), 500/500 VUs, 4348 complete and 0 interrupted iterations
default   [  59% ] 500/500 VUs  1m28.9s/2m30.0s

running (1m29.9s), 500/500 VUs, 4429 complete and 0 interrupted iterations
default   [  60% ] 500/500 VUs  1m29.9s/2m30.0s

running (1m30.9s), 500/500 VUs, 4546 complete and 0 interrupted iterations
default   [  61% ] 500/500 VUs  1m30.9s/2m30.0s

running (1m31.9s), 500/500 VUs, 4588 complete and 0 interrupted iterations
default   [  61% ] 500/500 VUs  1m31.9s/2m30.0s

running (1m32.9s), 500/500 VUs, 4652 complete and 0 interrupted iterations
default   [  62% ] 500/500 VUs  1m32.9s/2m30.0s

running (1m33.9s), 500/500 VUs, 4738 complete and 0 interrupted iterations
default   [  63% ] 500/500 VUs  1m33.9s/2m30.0s

running (1m34.9s), 500/500 VUs, 4809 complete and 0 interrupted iterations
default   [  63% ] 500/500 VUs  1m34.9s/2m30.0s

running (1m35.9s), 500/500 VUs, 4899 complete and 0 interrupted iterations
default   [  64% ] 500/500 VUs  1m35.9s/2m30.0s

running (1m36.9s), 500/500 VUs, 4989 complete and 0 interrupted iterations
default   [  65% ] 500/500 VUs  1m36.9s/2m30.0s

running (1m37.9s), 500/500 VUs, 5061 complete and 0 interrupted iterations
default   [  65% ] 500/500 VUs  1m37.9s/2m30.0s

running (1m38.9s), 500/500 VUs, 5129 complete and 0 interrupted iterations
default   [  66% ] 500/500 VUs  1m38.9s/2m30.0s

running (1m39.9s), 500/500 VUs, 5174 complete and 0 interrupted iterations
default   [  67% ] 500/500 VUs  1m39.9s/2m30.0s

running (1m40.9s), 500/500 VUs, 5274 complete and 0 interrupted iterations
default   [  67% ] 500/500 VUs  1m40.9s/2m30.0s

running (1m41.9s), 500/500 VUs, 5353 complete and 0 interrupted iterations
default   [  68% ] 500/500 VUs  1m41.9s/2m30.0s

running (1m42.9s), 500/500 VUs, 5427 complete and 0 interrupted iterations
default   [  69% ] 500/500 VUs  1m42.9s/2m30.0s

running (1m43.9s), 500/500 VUs, 5526 complete and 0 interrupted iterations
default   [  69% ] 500/500 VUs  1m43.9s/2m30.0s

running (1m44.9s), 500/500 VUs, 5587 complete and 0 interrupted iterations
default   [  70% ] 500/500 VUs  1m44.9s/2m30.0s

running (1m45.9s), 500/500 VUs, 5642 complete and 0 interrupted iterations
default   [  71% ] 500/500 VUs  1m45.9s/2m30.0s

running (1m46.9s), 500/500 VUs, 5733 complete and 0 interrupted iterations
default   [  71% ] 500/500 VUs  1m46.9s/2m30.0s

running (1m47.9s), 500/500 VUs, 5805 complete and 0 interrupted iterations
default   [  72% ] 500/500 VUs  1m47.9s/2m30.0s

running (1m48.9s), 500/500 VUs, 5890 complete and 0 interrupted iterations
default   [  73% ] 500/500 VUs  1m48.9s/2m30.0s

running (1m49.9s), 500/500 VUs, 5963 complete and 0 interrupted iterations
default   [  73% ] 500/500 VUs  1m49.9s/2m30.0s

running (1m51.0s), 500/500 VUs, 6060 complete and 0 interrupted iterations
default   [  74% ] 500/500 VUs  1m51.0s/2m30.0s

running (1m51.9s), 500/500 VUs, 6120 complete and 0 interrupted iterations
default   [  75% ] 500/500 VUs  1m51.9s/2m30.0s

running (1m52.9s), 500/500 VUs, 6172 complete and 0 interrupted iterations
default   [  75% ] 500/500 VUs  1m52.9s/2m30.0s

running (1m53.9s), 500/500 VUs, 6263 complete and 0 interrupted iterations
default   [  76% ] 500/500 VUs  1m53.9s/2m30.0s

running (1m54.9s), 500/500 VUs, 6335 complete and 0 interrupted iterations
default   [  77% ] 500/500 VUs  1m54.9s/2m30.0s

running (1m55.9s), 500/500 VUs, 6399 complete and 0 interrupted iterations
default   [  77% ] 500/500 VUs  1m55.9s/2m30.0s

running (1m57.1s), 500/500 VUs, 6502 complete and 0 interrupted iterations
default   [  78% ] 500/500 VUs  1m57.1s/2m30.0s

running (1m57.9s), 500/500 VUs, 6582 complete and 0 interrupted iterations
default   [  79% ] 500/500 VUs  1m57.9s/2m30.0s

running (1m58.9s), 500/500 VUs, 6630 complete and 0 interrupted iterations
default   [  79% ] 500/500 VUs  1m58.9s/2m30.0s

running (1m59.9s), 500/500 VUs, 6704 complete and 0 interrupted iterations
default   [  80% ] 500/500 VUs  1m59.9s/2m30.0s

running (2m00.9s), 500/500 VUs, 6772 complete and 0 interrupted iterations
default   [  81% ] 500/500 VUs  2m00.9s/2m30.0s

running (2m01.9s), 500/500 VUs, 6852 complete and 0 interrupted iterations
default   [  81% ] 500/500 VUs  2m01.9s/2m30.0s

running (2m02.9s), 488/500 VUs, 6957 complete and 0 interrupted iterations
default   [  82% ] 488/500 VUs  2m02.9s/2m30.0s

running (2m03.9s), 484/500 VUs, 7005 complete and 0 interrupted iterations
default   [  83% ] 484/500 VUs  2m03.9s/2m30.0s

running (2m04.9s), 472/500 VUs, 7093 complete and 0 interrupted iterations
default   [  83% ] 472/500 VUs  2m04.9s/2m30.0s

running (2m05.9s), 450/500 VUs, 7180 complete and 0 interrupted iterations
default   [  84% ] 450/500 VUs  2m05.9s/2m30.0s

running (2m06.9s), 434/500 VUs, 7261 complete and 0 interrupted iterations
default   [  85% ] 434/500 VUs  2m06.9s/2m30.0s

running (2m07.9s), 416/500 VUs, 7339 complete and 0 interrupted iterations
default   [  85% ] 416/500 VUs  2m07.9s/2m30.0s

running (2m08.9s), 401/500 VUs, 7412 complete and 0 interrupted iterations
default   [  86% ] 401/500 VUs  2m08.9s/2m30.0s

running (2m09.9s), 386/500 VUs, 7480 complete and 0 interrupted iterations
default   [  87% ] 386/500 VUs  2m09.9s/2m30.0s

running (2m10.9s), 365/500 VUs, 7560 complete and 0 interrupted iterations
default   [  87% ] 365/500 VUs  2m10.9s/2m30.0s

running (2m11.9s), 355/500 VUs, 7612 complete and 0 interrupted iterations
default   [  88% ] 355/500 VUs  2m11.9s/2m30.0s

running (2m12.9s), 339/500 VUs, 7683 complete and 0 interrupted iterations
default   [  89% ] 339/500 VUs  2m12.9s/2m30.0s

running (2m13.9s), 320/500 VUs, 7742 complete and 0 interrupted iterations
default   [  89% ] 320/500 VUs  2m13.9s/2m30.0s

running (2m14.9s), 303/500 VUs, 7813 complete and 0 interrupted iterations
default   [  90% ] 303/500 VUs  2m14.9s/2m30.0s

running (2m15.9s), 287/500 VUs, 7865 complete and 0 interrupted iterations
default   [  91% ] 287/500 VUs  2m15.9s/2m30.0s

running (2m16.9s), 271/500 VUs, 7920 complete and 0 interrupted iterations
default   [  91% ] 271/500 VUs  2m16.9s/2m30.0s

running (2m17.9s), 260/500 VUs, 7964 complete and 0 interrupted iterations
default   [  92% ] 260/500 VUs  2m17.9s/2m30.0s

running (2m18.9s), 237/500 VUs, 8021 complete and 0 interrupted iterations
default   [  93% ] 237/500 VUs  2m18.9s/2m30.0s

running (2m19.9s), 224/500 VUs, 8060 complete and 0 interrupted iterations
default   [  93% ] 224/500 VUs  2m19.9s/2m30.0s

running (2m20.9s), 207/500 VUs, 8115 complete and 0 interrupted iterations
default   [  94% ] 207/500 VUs  2m20.9s/2m30.0s

running (2m21.9s), 190/500 VUs, 8151 complete and 0 interrupted iterations
default   [  95% ] 190/500 VUs  2m21.9s/2m30.0s

running (2m22.9s), 172/500 VUs, 8185 complete and 0 interrupted iterations
default   [  95% ] 172/500 VUs  2m22.9s/2m30.0s

running (2m23.9s), 152/500 VUs, 8224 complete and 0 interrupted iterations
default   [  96% ] 152/500 VUs  2m23.9s/2m30.0s

running (2m24.9s), 135/500 VUs, 8258 complete and 0 interrupted iterations
default   [  97% ] 135/500 VUs  2m24.9s/2m30.0s

running (2m25.9s), 119/500 VUs, 8284 complete and 0 interrupted iterations
default   [  97% ] 119/500 VUs  2m25.9s/2m30.0s

running (2m26.9s), 101/500 VUs, 8322 complete and 0 interrupted iterations
default   [  98% ] 101/500 VUs  2m26.9s/2m30.0s

running (2m27.9s), 088/500 VUs, 8341 complete and 0 interrupted iterations
default   [  99% ] 088/500 VUs  2m27.9s/2m30.0s

running (2m28.9s), 074/500 VUs, 8357 complete and 0 interrupted iterations
default   [  99% ] 074/500 VUs  2m28.9s/2m30.0s

running (2m29.9s), 055/500 VUs, 8376 complete and 0 interrupted iterations
default   [ 100% ] 055/500 VUs  2m29.9s/2m30.0s

running (2m30.9s), 038/500 VUs, 8393 complete and 0 interrupted iterations
default ↓ [ 100% ] 052/500 VUs  2m30s

running (2m31.9s), 028/500 VUs, 8403 complete and 0 interrupted iterations
default ↓ [ 100% ] 052/500 VUs  2m30s

running (2m32.9s), 008/500 VUs, 8423 complete and 0 interrupted iterations
default ↓ [ 100% ] 052/500 VUs  2m30s

running (2m33.9s), 002/500 VUs, 8429 complete and 0 interrupted iterations
default ↓ [ 100% ] 052/500 VUs  2m30s


  █ THRESHOLDS 

    active_clients_time
    ✓ 'p(95)<500' p(95)=94ms

    attach_documents_time
    ✓ 'p(95)<10000' p(95)=356ms

    deactivate_clients_time
    ✓ 'p(95)<10000' p(95)=94ms

    http_req_duration
    ✓ 'p(95)<10000' p(95)=182.59ms

    pushpulls_time
    ✓ 'p(95)<1000' p(95)=187ms

    transaction_success_rate
    ✓ 'rate>0.99' rate=100.00%

    transaction_time
    ✓ 'p(95)<30000' p(95)=7.07s


  █ TOTAL RESULTS 

    checks_total.......: 134896  874.167995/s
    checks_succeeded...: 100.00% 134896 out of 134896
    checks_failed......: 0.00%   0 out of 134896

    ✓ status is 200
    ✓ response has valid body

    CUSTOM
    active_clients....................: 8431    54.6355/s
    active_clients_success_rate.......: 100.00% 8431 out of 8431
    active_clients_time...............: avg=20.74ms min=0s       med=4ms   max=562ms    p(90)=61ms     p(95)=94ms    
    attach_documents..................: 8431    54.6355/s
    attach_documents_success_rate.....: 100.00% 8431 out of 8431
    attach_documents_time.............: avg=91.32ms min=3ms      med=24ms  max=759ms    p(90)=273ms    p(95)=356ms   
    deactivate_clients................: 8431    54.6355/s
    deactivate_clients_success_rate...: 100.00% 8431 out of 8431
    deactivate_clients_time...........: avg=19.73ms min=0s       med=2ms   max=647ms    p(90)=55ms     p(95)=94ms    
    pushpulls.........................: 42155   273.177498/s
    pushpulls_success_rate............: 100.00% 42155 out of 42155
    pushpulls_time....................: avg=44.32ms min=1ms      med=14ms  max=813ms    p(90)=123ms    p(95)=187ms   
    transaction_success_rate..........: 100.00% 8431 out of 8431
    transaction_time..................: avg=6.41s   min=6.01s    med=6.35s max=8.11s    p(90)=6.91s    p(95)=7.07s   

    HTTP
    http_req_duration.................: avg=38.49ms min=197.69µs med=7.9ms max=740.22ms p(90)=112.89ms p(95)=182.59ms
      { expected_response:true }......: avg=38.49ms min=197.69µs med=7.9ms max=740.22ms p(90)=112.89ms p(95)=182.59ms
    http_req_failed...................: 0.00%   0 out of 67448
    http_reqs.........................: 67448   437.083997/s

    EXECUTION
    iteration_duration................: avg=6.41s   min=6.01s    med=6.35s max=8.11s    p(90)=6.91s    p(95)=7.07s   
    iterations........................: 8431    54.6355/s
    vus...............................: 2       min=2              max=500
    vus_max...........................: 500     min=500            max=500

    NETWORK
    data_received.....................: 1.2 GB  7.9 MB/s
    data_sent.........................: 64 MB   411 kB/s




running (2m34.3s), 000/500 VUs, 8431 complete and 0 interrupted iterations
default ✓ [ 100% ] 000/500 VUs  2m30s
