
         /\      Grafana   /‾‾/  
    /\  /  \     |\  __   /  /   
   /  \/    \    | |/ /  /   ‾‾\ 
  /          \   |   (  |  (‾)  |
 / __________ \  |_|\_\  \_____/ 


     execution: local
        script: test/k6/presence.ts
        output: -

     scenarios: (100.00%) 1 scenario, 500 max VUs, 3m0s max duration (incl. graceful stop):
              * default: Up to 500 looping VUs for 2m30s over 3 stages (gracefulRampDown: 30s, gracefulStop: 30s)


running (0m00.9s), 008/500 VUs, 0 complete and 0 interrupted iterations
default   [   1% ] 008/500 VUs  0m00.9s/2m30.0s

running (0m01.9s), 016/500 VUs, 0 complete and 0 interrupted iterations
default   [   1% ] 016/500 VUs  0m01.9s/2m30.0s

running (0m02.9s), 025/500 VUs, 0 complete and 0 interrupted iterations
default   [   2% ] 025/500 VUs  0m02.9s/2m30.0s

running (0m03.9s), 033/500 VUs, 0 complete and 0 interrupted iterations
default   [   3% ] 033/500 VUs  0m03.9s/2m30.0s

running (0m04.9s), 041/500 VUs, 0 complete and 0 interrupted iterations
default   [   3% ] 041/500 VUs  0m04.9s/2m30.0s

running (0m05.9s), 049/500 VUs, 0 complete and 0 interrupted iterations
default   [   4% ] 049/500 VUs  0m05.9s/2m30.0s

running (0m06.9s), 058/500 VUs, 8 complete and 0 interrupted iterations
default   [   5% ] 058/500 VUs  0m06.9s/2m30.0s

running (0m07.9s), 066/500 VUs, 16 complete and 0 interrupted iterations
default   [   5% ] 066/500 VUs  0m07.9s/2m30.0s

running (0m08.9s), 074/500 VUs, 24 complete and 0 interrupted iterations
default   [   6% ] 074/500 VUs  0m08.9s/2m30.0s

running (0m09.9s), 083/500 VUs, 33 complete and 0 interrupted iterations
default   [   7% ] 083/500 VUs  0m09.9s/2m30.0s

running (0m10.9s), 091/500 VUs, 41 complete and 0 interrupted iterations
default   [   7% ] 091/500 VUs  0m10.9s/2m30.0s

running (0m11.9s), 099/500 VUs, 49 complete and 0 interrupted iterations
default   [   8% ] 099/500 VUs  0m11.9s/2m30.0s

running (0m12.9s), 108/500 VUs, 66 complete and 0 interrupted iterations
default   [   9% ] 108/500 VUs  0m12.9s/2m30.0s

running (0m13.9s), 116/500 VUs, 82 complete and 0 interrupted iterations
default   [   9% ] 116/500 VUs  0m13.9s/2m30.0s

running (0m14.9s), 124/500 VUs, 98 complete and 0 interrupted iterations
default   [  10% ] 124/500 VUs  0m14.9s/2m30.0s

running (0m15.9s), 133/500 VUs, 115 complete and 0 interrupted iterations
default   [  11% ] 133/500 VUs  0m15.9s/2m30.0s

running (0m16.9s), 141/500 VUs, 132 complete and 0 interrupted iterations
default   [  11% ] 141/500 VUs  0m16.9s/2m30.0s

running (0m17.9s), 149/500 VUs, 148 complete and 0 interrupted iterations
default   [  12% ] 149/500 VUs  0m17.9s/2m30.0s

running (0m18.9s), 158/500 VUs, 172 complete and 0 interrupted iterations
default   [  13% ] 158/500 VUs  0m18.9s/2m30.0s

running (0m19.9s), 166/500 VUs, 198 complete and 0 interrupted iterations
default   [  13% ] 166/500 VUs  0m19.9s/2m30.0s

running (0m20.9s), 174/500 VUs, 222 complete and 0 interrupted iterations
default   [  14% ] 174/500 VUs  0m20.9s/2m30.0s

running (0m21.9s), 183/500 VUs, 246 complete and 0 interrupted iterations
default   [  15% ] 183/500 VUs  0m21.9s/2m30.0s

running (0m22.9s), 191/500 VUs, 273 complete and 0 interrupted iterations
default   [  15% ] 191/500 VUs  0m22.9s/2m30.0s

running (0m23.9s), 199/500 VUs, 297 complete and 0 interrupted iterations
default   [  16% ] 199/500 VUs  0m23.9s/2m30.0s

running (0m24.9s), 207/500 VUs, 328 complete and 0 interrupted iterations
default   [  17% ] 207/500 VUs  0m24.9s/2m30.0s

running (0m25.9s), 216/500 VUs, 364 complete and 0 interrupted iterations
default   [  17% ] 216/500 VUs  0m25.9s/2m30.0s

running (0m26.9s), 224/500 VUs, 396 complete and 0 interrupted iterations
default   [  18% ] 224/500 VUs  0m26.9s/2m30.0s

running (0m27.9s), 232/500 VUs, 428 complete and 0 interrupted iterations
default   [  19% ] 232/500 VUs  0m27.9s/2m30.0s

running (0m28.9s), 241/500 VUs, 463 complete and 0 interrupted iterations
default   [  19% ] 241/500 VUs  0m28.9s/2m30.0s

running (0m29.9s), 249/500 VUs, 496 complete and 0 interrupted iterations
default   [  20% ] 249/500 VUs  0m29.9s/2m30.0s

running (0m30.9s), 257/500 VUs, 535 complete and 0 interrupted iterations
default   [  21% ] 257/500 VUs  0m30.9s/2m30.0s

running (0m31.9s), 266/500 VUs, 576 complete and 0 interrupted iterations
default   [  21% ] 266/500 VUs  0m31.9s/2m30.0s

running (0m32.9s), 274/500 VUs, 619 complete and 0 interrupted iterations
default   [  22% ] 274/500 VUs  0m32.9s/2m30.0s

running (0m33.9s), 282/500 VUs, 660 complete and 0 interrupted iterations
default   [  23% ] 282/500 VUs  0m33.9s/2m30.0s

running (0m34.9s), 291/500 VUs, 700 complete and 0 interrupted iterations
default   [  23% ] 291/500 VUs  0m34.9s/2m30.0s

running (0m35.9s), 299/500 VUs, 742 complete and 0 interrupted iterations
default   [  24% ] 299/500 VUs  0m35.9s/2m30.0s

running (0m36.9s), 307/500 VUs, 790 complete and 0 interrupted iterations
default   [  25% ] 307/500 VUs  0m36.9s/2m30.0s

running (0m37.9s), 316/500 VUs, 840 complete and 0 interrupted iterations
default   [  25% ] 316/500 VUs  0m37.9s/2m30.0s

running (0m38.9s), 324/500 VUs, 890 complete and 0 interrupted iterations
default   [  26% ] 324/500 VUs  0m38.9s/2m30.0s

running (0m39.9s), 332/500 VUs, 941 complete and 0 interrupted iterations
default   [  27% ] 332/500 VUs  0m39.9s/2m30.0s

running (0m40.9s), 341/500 VUs, 990 complete and 0 interrupted iterations
default   [  27% ] 341/500 VUs  0m40.9s/2m30.0s

running (0m41.9s), 349/500 VUs, 1039 complete and 0 interrupted iterations
default   [  28% ] 349/500 VUs  0m41.9s/2m30.0s

running (0m42.9s), 357/500 VUs, 1096 complete and 0 interrupted iterations
default   [  29% ] 357/500 VUs  0m42.9s/2m30.0s

running (0m43.9s), 366/500 VUs, 1153 complete and 0 interrupted iterations
default   [  29% ] 366/500 VUs  0m43.9s/2m30.0s

running (0m44.9s), 374/500 VUs, 1211 complete and 0 interrupted iterations
default   [  30% ] 374/500 VUs  0m44.9s/2m30.0s

running (0m45.9s), 382/500 VUs, 1267 complete and 0 interrupted iterations
default   [  31% ] 382/500 VUs  0m45.9s/2m30.0s

running (0m46.9s), 390/500 VUs, 1324 complete and 0 interrupted iterations
default   [  31% ] 390/500 VUs  0m46.9s/2m30.0s

running (0m47.9s), 399/500 VUs, 1383 complete and 0 interrupted iterations
default   [  32% ] 399/500 VUs  0m47.9s/2m30.0s

running (0m48.9s), 407/500 VUs, 1447 complete and 0 interrupted iterations
default   [  33% ] 407/500 VUs  0m48.9s/2m30.0s

running (0m49.9s), 415/500 VUs, 1507 complete and 0 interrupted iterations
default   [  33% ] 415/500 VUs  0m49.9s/2m30.0s

running (0m50.9s), 424/500 VUs, 1570 complete and 0 interrupted iterations
default   [  34% ] 424/500 VUs  0m50.9s/2m30.0s

running (0m51.9s), 432/500 VUs, 1635 complete and 0 interrupted iterations
default   [  35% ] 432/500 VUs  0m51.9s/2m30.0s

running (0m52.9s), 440/500 VUs, 1706 complete and 0 interrupted iterations
default   [  35% ] 440/500 VUs  0m52.9s/2m30.0s

running (0m53.9s), 449/500 VUs, 1769 complete and 0 interrupted iterations
default   [  36% ] 449/500 VUs  0m53.9s/2m30.0s

running (0m54.9s), 457/500 VUs, 1827 complete and 0 interrupted iterations
default   [  37% ] 457/500 VUs  0m54.9s/2m30.0s

running (0m55.9s), 465/500 VUs, 1904 complete and 0 interrupted iterations
default   [  37% ] 465/500 VUs  0m55.9s/2m30.0s

running (0m56.9s), 474/500 VUs, 1977 complete and 0 interrupted iterations
default   [  38% ] 474/500 VUs  0m56.9s/2m30.0s

running (0m57.9s), 482/500 VUs, 2046 complete and 0 interrupted iterations
default   [  39% ] 482/500 VUs  0m57.9s/2m30.0s

running (0m58.9s), 490/500 VUs, 2114 complete and 0 interrupted iterations
default   [  39% ] 490/500 VUs  0m58.9s/2m30.0s

running (0m59.9s), 499/500 VUs, 2192 complete and 0 interrupted iterations
default   [  40% ] 499/500 VUs  0m59.9s/2m30.0s

running (1m00.9s), 500/500 VUs, 2264 complete and 0 interrupted iterations
default   [  41% ] 500/500 VUs  1m00.9s/2m30.0s

running (1m01.9s), 500/500 VUs, 2333 complete and 0 interrupted iterations
default   [  41% ] 500/500 VUs  1m01.9s/2m30.0s

running (1m02.9s), 500/500 VUs, 2392 complete and 0 interrupted iterations
default   [  42% ] 500/500 VUs  1m02.9s/2m30.0s

running (1m03.9s), 500/500 VUs, 2460 complete and 0 interrupted iterations
default   [  43% ] 500/500 VUs  1m03.9s/2m30.0s

running (1m04.9s), 500/500 VUs, 2533 complete and 0 interrupted iterations
default   [  43% ] 500/500 VUs  1m04.9s/2m30.0s

running (1m06.1s), 500/500 VUs, 2632 complete and 0 interrupted iterations
default   [  44% ] 500/500 VUs  1m06.1s/2m30.0s

running (1m06.9s), 500/500 VUs, 2705 complete and 0 interrupted iterations
default   [  45% ] 500/500 VUs  1m06.9s/2m30.0s

running (1m07.9s), 500/500 VUs, 2758 complete and 0 interrupted iterations
default   [  45% ] 500/500 VUs  1m07.9s/2m30.0s

running (1m08.9s), 500/500 VUs, 2837 complete and 0 interrupted iterations
default   [  46% ] 500/500 VUs  1m08.9s/2m30.0s

running (1m09.9s), 500/500 VUs, 2904 complete and 0 interrupted iterations
default   [  47% ] 500/500 VUs  1m09.9s/2m30.0s

running (1m10.9s), 500/500 VUs, 2970 complete and 0 interrupted iterations
default   [  47% ] 500/500 VUs  1m10.9s/2m30.0s

running (1m11.9s), 500/500 VUs, 3072 complete and 0 interrupted iterations
default   [  48% ] 500/500 VUs  1m11.9s/2m30.0s

running (1m12.9s), 500/500 VUs, 3152 complete and 0 interrupted iterations
default   [  49% ] 500/500 VUs  1m12.9s/2m30.0s

running (1m13.9s), 500/500 VUs, 3224 complete and 0 interrupted iterations
default   [  49% ] 500/500 VUs  1m13.9s/2m30.0s

running (1m14.9s), 500/500 VUs, 3295 complete and 0 interrupted iterations
default   [  50% ] 500/500 VUs  1m14.9s/2m30.0s

running (1m15.9s), 500/500 VUs, 3355 complete and 0 interrupted iterations
default   [  51% ] 500/500 VUs  1m15.9s/2m30.0s

running (1m16.9s), 500/500 VUs, 3432 complete and 0 interrupted iterations
default   [  51% ] 500/500 VUs  1m16.9s/2m30.0s

running (1m17.9s), 500/500 VUs, 3515 complete and 0 interrupted iterations
default   [  52% ] 500/500 VUs  1m17.9s/2m30.0s

running (1m18.9s), 500/500 VUs, 3577 complete and 0 interrupted iterations
default   [  53% ] 500/500 VUs  1m18.9s/2m30.0s

running (1m19.9s), 500/500 VUs, 3678 complete and 0 interrupted iterations
default   [  53% ] 500/500 VUs  1m19.9s/2m30.0s

running (1m20.9s), 500/500 VUs, 3735 complete and 0 interrupted iterations
default   [  54% ] 500/500 VUs  1m20.9s/2m30.0s

running (1m21.9s), 500/500 VUs, 3809 complete and 0 interrupted iterations
default   [  55% ] 500/500 VUs  1m21.9s/2m30.0s

running (1m22.9s), 500/500 VUs, 3898 complete and 0 interrupted iterations
default   [  55% ] 500/500 VUs  1m22.9s/2m30.0s

running (1m23.9s), 500/500 VUs, 3938 complete and 0 interrupted iterations
default   [  56% ] 500/500 VUs  1m23.9s/2m30.0s

running (1m24.9s), 500/500 VUs, 3998 complete and 0 interrupted iterations
default   [  57% ] 500/500 VUs  1m24.9s/2m30.0s

running (1m25.9s), 500/500 VUs, 4089 complete and 0 interrupted iterations
default   [  57% ] 500/500 VUs  1m25.9s/2m30.0s

running (1m26.9s), 500/500 VUs, 4168 complete and 0 interrupted iterations
default   [  58% ] 500/500 VUs  1m26.9s/2m30.0s

running (1m27.9s), 500/500 VUs, 4237 complete and 0 interrupted iterations
default   [  59% ] 500/500 VUs  1m27.9s/2m30.0s

running (1m29.0s), 500/500 VUs, 4336 complete and 0 interrupted iterations
default   [  59% ] 500/500 VUs  1m29.0s/2m30.0s

running (1m29.9s), 500/500 VUs, 4408 complete and 0 interrupted iterations
default   [  60% ] 500/500 VUs  1m29.9s/2m30.0s

running (1m30.9s), 500/500 VUs, 4457 complete and 0 interrupted iterations
default   [  61% ] 500/500 VUs  1m30.9s/2m30.0s

running (1m31.9s), 500/500 VUs, 4556 complete and 0 interrupted iterations
default   [  61% ] 500/500 VUs  1m31.9s/2m30.0s

running (1m32.9s), 500/500 VUs, 4621 complete and 0 interrupted iterations
default   [  62% ] 500/500 VUs  1m32.9s/2m30.0s

running (1m33.9s), 500/500 VUs, 4690 complete and 0 interrupted iterations
default   [  63% ] 500/500 VUs  1m33.9s/2m30.0s

running (1m34.9s), 500/500 VUs, 4778 complete and 0 interrupted iterations
default   [  63% ] 500/500 VUs  1m34.9s/2m30.0s

running (1m35.9s), 500/500 VUs, 4853 complete and 0 interrupted iterations
default   [  64% ] 500/500 VUs  1m35.9s/2m30.0s

running (1m36.9s), 500/500 VUs, 4919 complete and 0 interrupted iterations
default   [  65% ] 500/500 VUs  1m36.9s/2m30.0s

running (1m37.9s), 500/500 VUs, 4994 complete and 0 interrupted iterations
default   [  65% ] 500/500 VUs  1m37.9s/2m30.0s

running (1m38.9s), 500/500 VUs, 5073 complete and 0 interrupted iterations
default   [  66% ] 500/500 VUs  1m38.9s/2m30.0s

running (1m39.9s), 500/500 VUs, 5135 complete and 0 interrupted iterations
default   [  67% ] 500/500 VUs  1m39.9s/2m30.0s

running (1m40.9s), 500/500 VUs, 5216 complete and 0 interrupted iterations
default   [  67% ] 500/500 VUs  1m40.9s/2m30.0s

running (1m41.9s), 500/500 VUs, 5303 complete and 0 interrupted iterations
default   [  68% ] 500/500 VUs  1m41.9s/2m30.0s

running (1m42.9s), 500/500 VUs, 5366 complete and 0 interrupted iterations
default   [  69% ] 500/500 VUs  1m42.9s/2m30.0s

running (1m43.9s), 500/500 VUs, 5457 complete and 0 interrupted iterations
default   [  69% ] 500/500 VUs  1m43.9s/2m30.0s

running (1m44.9s), 500/500 VUs, 5551 complete and 0 interrupted iterations
default   [  70% ] 500/500 VUs  1m44.9s/2m30.0s

running (1m45.9s), 500/500 VUs, 5598 complete and 0 interrupted iterations
default   [  71% ] 500/500 VUs  1m45.9s/2m30.0s

running (1m46.9s), 500/500 VUs, 5678 complete and 0 interrupted iterations
default   [  71% ] 500/500 VUs  1m46.9s/2m30.0s

running (1m47.9s), 500/500 VUs, 5770 complete and 0 interrupted iterations
default   [  72% ] 500/500 VUs  1m47.9s/2m30.0s

running (1m48.9s), 500/500 VUs, 5840 complete and 0 interrupted iterations
default   [  73% ] 500/500 VUs  1m48.9s/2m30.0s

running (1m49.9s), 500/500 VUs, 5917 complete and 0 interrupted iterations
default   [  73% ] 500/500 VUs  1m49.9s/2m30.0s

running (1m50.9s), 500/500 VUs, 5992 complete and 0 interrupted iterations
default   [  74% ] 500/500 VUs  1m50.9s/2m30.0s

running (1m51.9s), 500/500 VUs, 6067 complete and 0 interrupted iterations
default   [  75% ] 500/500 VUs  1m51.9s/2m30.0s

running (1m52.9s), 500/500 VUs, 6142 complete and 0 interrupted iterations
default   [  75% ] 500/500 VUs  1m52.9s/2m30.0s

running (1m53.9s), 500/500 VUs, 6231 complete and 0 interrupted iterations
default   [  76% ] 500/500 VUs  1m53.9s/2m30.0s

running (1m54.9s), 500/500 VUs, 6287 complete and 0 interrupted iterations
default   [  77% ] 500/500 VUs  1m54.9s/2m30.0s

running (1m55.9s), 500/500 VUs, 6364 complete and 0 interrupted iterations
default   [  77% ] 500/500 VUs  1m55.9s/2m30.0s

running (1m57.0s), 500/500 VUs, 6457 complete and 0 interrupted iterations
default   [  78% ] 500/500 VUs  1m57.0s/2m30.0s

running (1m57.9s), 500/500 VUs, 6513 complete and 0 interrupted iterations
default   [  79% ] 500/500 VUs  1m57.9s/2m30.0s

running (1m58.9s), 500/500 VUs, 6596 complete and 0 interrupted iterations
default   [  79% ] 500/500 VUs  1m58.9s/2m30.0s

running (2m00.0s), 500/500 VUs, 6679 complete and 0 interrupted iterations
default   [  80% ] 500/500 VUs  2m00.0s/2m30.0s

running (2m00.9s), 499/500 VUs, 6724 complete and 0 interrupted iterations
default   [  81% ] 499/500 VUs  2m00.9s/2m30.0s

running (2m01.9s), 498/500 VUs, 6819 complete and 0 interrupted iterations
default   [  81% ] 498/500 VUs  2m01.9s/2m30.0s

running (2m02.9s), 491/500 VUs, 6907 complete and 0 interrupted iterations
default   [  82% ] 491/500 VUs  2m02.9s/2m30.0s

running (2m03.9s), 487/500 VUs, 6962 complete and 0 interrupted iterations
default   [  83% ] 487/500 VUs  2m03.9s/2m30.0s

running (2m04.9s), 478/500 VUs, 7042 complete and 0 interrupted iterations
default   [  83% ] 478/500 VUs  2m04.9s/2m30.0s

running (2m05.9s), 459/500 VUs, 7130 complete and 0 interrupted iterations
default   [  84% ] 459/500 VUs  2m05.9s/2m30.0s

running (2m06.9s), 440/500 VUs, 7196 complete and 0 interrupted iterations
default   [  85% ] 440/500 VUs  2m06.9s/2m30.0s

running (2m07.9s), 429/500 VUs, 7261 complete and 0 interrupted iterations
default   [  85% ] 429/500 VUs  2m07.9s/2m30.0s

running (2m08.9s), 403/500 VUs, 7361 complete and 0 interrupted iterations
default   [  86% ] 403/500 VUs  2m08.9s/2m30.0s

running (2m09.9s), 383/500 VUs, 7431 complete and 0 interrupted iterations
default   [  87% ] 383/500 VUs  2m09.9s/2m30.0s

running (2m10.9s), 372/500 VUs, 7487 complete and 0 interrupted iterations
default   [  87% ] 372/500 VUs  2m10.9s/2m30.0s

running (2m11.9s), 351/500 VUs, 7569 complete and 0 interrupted iterations
default   [  88% ] 351/500 VUs  2m11.9s/2m30.0s

running (2m12.9s), 338/500 VUs, 7618 complete and 0 interrupted iterations
default   [  89% ] 338/500 VUs  2m12.9s/2m30.0s

running (2m13.9s), 317/500 VUs, 7681 complete and 0 interrupted iterations
default   [  89% ] 317/500 VUs  2m13.9s/2m30.0s

running (2m14.9s), 297/500 VUs, 7745 complete and 0 interrupted iterations
default   [  90% ] 297/500 VUs  2m14.9s/2m30.0s

running (2m15.9s), 284/500 VUs, 7813 complete and 0 interrupted iterations
default   [  91% ] 284/500 VUs  2m15.9s/2m30.0s

running (2m16.9s), 268/500 VUs, 7859 complete and 0 interrupted iterations
default   [  91% ] 268/500 VUs  2m16.9s/2m30.0s

running (2m17.9s), 250/500 VUs, 7919 complete and 0 interrupted iterations
default   [  92% ] 250/500 VUs  2m17.9s/2m30.0s

running (2m18.9s), 236/500 VUs, 7953 complete and 0 interrupted iterations
default   [  93% ] 236/500 VUs  2m18.9s/2m30.0s

running (2m19.9s), 218/500 VUs, 7994 complete and 0 interrupted iterations
default   [  93% ] 218/500 VUs  2m19.9s/2m30.0s

running (2m20.9s), 204/500 VUs, 8042 complete and 0 interrupted iterations
default   [  94% ] 204/500 VUs  2m20.9s/2m30.0s

running (2m21.9s), 177/500 VUs, 8097 complete and 0 interrupted iterations
default   [  95% ] 177/500 VUs  2m21.9s/2m30.0s

running (2m22.9s), 162/500 VUs, 8127 complete and 0 interrupted iterations
default   [  95% ] 162/500 VUs  2m22.9s/2m30.0s

running (2m23.9s), 145/500 VUs, 8169 complete and 0 interrupted iterations
default   [  96% ] 145/500 VUs  2m23.9s/2m30.0s

running (2m24.9s), 135/500 VUs, 8187 complete and 0 interrupted iterations
default   [  97% ] 135/500 VUs  2m24.9s/2m30.0s

running (2m25.9s), 120/500 VUs, 8212 complete and 0 interrupted iterations
default   [  97% ] 120/500 VUs  2m25.9s/2m30.0s

running (2m26.9s), 102/500 VUs, 8246 complete and 0 interrupted iterations
default   [  98% ] 102/500 VUs  2m26.9s/2m30.0s

running (2m27.9s), 079/500 VUs, 8274 complete and 0 interrupted iterations
default   [  99% ] 079/500 VUs  2m27.9s/2m30.0s

running (2m28.9s), 067/500 VUs, 8289 complete and 0 interrupted iterations
default   [  99% ] 067/500 VUs  2m28.9s/2m30.0s

running (2m29.9s), 042/500 VUs, 8314 complete and 0 interrupted iterations
default   [ 100% ] 042/500 VUs  2m29.9s/2m30.0s

running (2m30.9s), 034/500 VUs, 8322 complete and 0 interrupted iterations
default ↓ [ 100% ] 042/500 VUs  2m30s

running (2m31.9s), 025/500 VUs, 8331 complete and 0 interrupted iterations
default ↓ [ 100% ] 042/500 VUs  2m30s

running (2m32.9s), 008/500 VUs, 8348 complete and 0 interrupted iterations
default ↓ [ 100% ] 042/500 VUs  2m30s

running (2m33.9s), 003/500 VUs, 8353 complete and 0 interrupted iterations
default ↓ [ 100% ] 042/500 VUs  2m30s


  █ THRESHOLDS 

    active_clients_time
    ✓ 'p(95)<500' p(95)=102ms

    attach_documents_time
    ✓ 'p(95)<10000' p(95)=393ms

    deactivate_clients_time
    ✓ 'p(95)<10000' p(95)=110ms

    http_req_duration
    ✓ 'p(95)<10000' p(95)=185.43ms

    pushpulls_time
    ✓ 'p(95)<1000' p(95)=179ms

    transaction_success_rate
    ✓ 'rate>0.99' rate=100.00%

    transaction_time
    ✓ 'p(95)<30000' p(95)=7.13s


  █ TOTAL RESULTS 

    checks_total.......: 133696  863.955601/s
    checks_succeeded...: 100.00% 133696 out of 133696
    checks_failed......: 0.00%   0 out of 133696

    ✓ status is 200
    ✓ response has valid body

    CUSTOM
    active_clients....................: 8356    53.997225/s
    active_clients_success_rate.......: 100.00% 8356 out of 8356
    active_clients_time...............: avg=22.81ms min=0s       med=5ms   max=367ms    p(90)=68ms     p(95)=102ms   
    attach_documents..................: 8356    53.997225/s
    attach_documents_success_rate.....: 100.00% 8356 out of 8356
    attach_documents_time.............: avg=97.16ms min=3ms      med=24ms  max=820ms    p(90)=315ms    p(95)=393ms   
    deactivate_clients................: 8356    53.997225/s
    deactivate_clients_success_rate...: 100.00% 8356 out of 8356
    deactivate_clients_time...........: avg=22.27ms min=0s       med=3ms   max=461ms    p(90)=64ms     p(95)=110ms   
    pushpulls.........................: 41780   269.986125/s
    pushpulls_success_rate............: 100.00% 41780 out of 41780
    pushpulls_time....................: avg=46.05ms min=1ms      med=17ms  max=841ms    p(90)=126ms    p(95)=179ms   
    transaction_success_rate..........: 100.00% 8356 out of 8356
    transaction_time..................: avg=6.46s   min=6.01s    med=6.42s max=8.54s    p(90)=6.97s    p(95)=7.13s   

    HTTP
    http_req_duration.................: avg=41.39ms min=187.01µs med=9.3ms max=818.78ms p(90)=120.24ms p(95)=185.43ms
      { expected_response:true }......: avg=41.39ms min=187.01µs med=9.3ms max=818.78ms p(90)=120.24ms p(95)=185.43ms
    http_req_failed...................: 0.00%   0 out of 66848
    http_reqs.........................: 66848   431.977801/s

    EXECUTION
    iteration_duration................: avg=6.46s   min=6.01s    med=6.42s max=8.54s    p(90)=6.96s    p(95)=7.13s   
    iterations........................: 8356    53.997225/s
    vus...............................: 3       min=3              max=500
    vus_max...........................: 500     min=500            max=500

    NETWORK
    data_received.....................: 1.2 GB  7.8 MB/s
    data_sent.........................: 63 MB   406 kB/s




running (2m34.7s), 000/500 VUs, 8356 complete and 0 interrupted iterations
default ✓ [ 100% ] 000/500 VUs  2m30s
