
         /\      Grafana   /‾‾/  
    /\  /  \     |\  __   /  /   
   /  \/    \    | |/ /  /   ‾‾\ 
  /          \   |   (  |  (‾)  |
 / __________ \  |_|\_\  \_____/ 


     execution: local
        script: test/k6/presence.ts
        output: -

     scenarios: (100.00%) 1 scenario, 500 max VUs, 3m0s max duration (incl. graceful stop):
              * default: Up to 500 looping VUs for 2m30s over 3 stages (gracefulRampDown: 30s, gracefulStop: 30s)


running (0m00.9s), 008/500 VUs, 0 complete and 0 interrupted iterations
default   [   1% ] 008/500 VUs  0m00.9s/2m30.0s

running (0m01.9s), 016/500 VUs, 0 complete and 0 interrupted iterations
default   [   1% ] 016/500 VUs  0m01.9s/2m30.0s

running (0m02.9s), 025/500 VUs, 0 complete and 0 interrupted iterations
default   [   2% ] 025/500 VUs  0m02.9s/2m30.0s

running (0m03.9s), 033/500 VUs, 0 complete and 0 interrupted iterations
default   [   3% ] 033/500 VUs  0m03.9s/2m30.0s

running (0m04.9s), 041/500 VUs, 0 complete and 0 interrupted iterations
default   [   3% ] 041/500 VUs  0m04.9s/2m30.0s

running (0m05.9s), 049/500 VUs, 0 complete and 0 interrupted iterations
default   [   4% ] 049/500 VUs  0m05.9s/2m30.0s

running (0m06.9s), 058/500 VUs, 8 complete and 0 interrupted iterations
default   [   5% ] 058/500 VUs  0m06.9s/2m30.0s

running (0m07.9s), 066/500 VUs, 16 complete and 0 interrupted iterations
default   [   5% ] 066/500 VUs  0m07.9s/2m30.0s

running (0m08.9s), 074/500 VUs, 24 complete and 0 interrupted iterations
default   [   6% ] 074/500 VUs  0m08.9s/2m30.0s

running (0m09.9s), 083/500 VUs, 33 complete and 0 interrupted iterations
default   [   7% ] 083/500 VUs  0m09.9s/2m30.0s

running (0m10.9s), 091/500 VUs, 41 complete and 0 interrupted iterations
default   [   7% ] 091/500 VUs  0m10.9s/2m30.0s

running (0m11.9s), 099/500 VUs, 49 complete and 0 interrupted iterations
default   [   8% ] 099/500 VUs  0m11.9s/2m30.0s

running (0m12.9s), 108/500 VUs, 66 complete and 0 interrupted iterations
default   [   9% ] 108/500 VUs  0m12.9s/2m30.0s

running (0m13.9s), 116/500 VUs, 82 complete and 0 interrupted iterations
default   [   9% ] 116/500 VUs  0m13.9s/2m30.0s

running (0m14.9s), 124/500 VUs, 98 complete and 0 interrupted iterations
default   [  10% ] 124/500 VUs  0m14.9s/2m30.0s

running (0m15.9s), 133/500 VUs, 115 complete and 0 interrupted iterations
default   [  11% ] 133/500 VUs  0m15.9s/2m30.0s

running (0m16.9s), 141/500 VUs, 132 complete and 0 interrupted iterations
default   [  11% ] 141/500 VUs  0m16.9s/2m30.0s

running (0m17.9s), 149/500 VUs, 148 complete and 0 interrupted iterations
default   [  12% ] 149/500 VUs  0m17.9s/2m30.0s

running (0m18.9s), 158/500 VUs, 172 complete and 0 interrupted iterations
default   [  13% ] 158/500 VUs  0m18.9s/2m30.0s

running (0m19.9s), 166/500 VUs, 198 complete and 0 interrupted iterations
default   [  13% ] 166/500 VUs  0m19.9s/2m30.0s

running (0m20.9s), 174/500 VUs, 222 complete and 0 interrupted iterations
default   [  14% ] 174/500 VUs  0m20.9s/2m30.0s

running (0m21.9s), 182/500 VUs, 246 complete and 0 interrupted iterations
default   [  15% ] 182/500 VUs  0m21.9s/2m30.0s

running (0m22.9s), 191/500 VUs, 273 complete and 0 interrupted iterations
default   [  15% ] 191/500 VUs  0m22.9s/2m30.0s

running (0m23.9s), 199/500 VUs, 297 complete and 0 interrupted iterations
default   [  16% ] 199/500 VUs  0m23.9s/2m30.0s

running (0m24.9s), 208/500 VUs, 328 complete and 0 interrupted iterations
default   [  17% ] 208/500 VUs  0m24.9s/2m30.0s

running (0m25.9s), 216/500 VUs, 364 complete and 0 interrupted iterations
default   [  17% ] 216/500 VUs  0m25.9s/2m30.0s

running (0m26.9s), 224/500 VUs, 396 complete and 0 interrupted iterations
default   [  18% ] 224/500 VUs  0m26.9s/2m30.0s

running (0m27.9s), 232/500 VUs, 428 complete and 0 interrupted iterations
default   [  19% ] 232/500 VUs  0m27.9s/2m30.0s

running (0m28.9s), 241/500 VUs, 461 complete and 0 interrupted iterations
default   [  19% ] 241/500 VUs  0m28.9s/2m30.0s

running (0m29.9s), 249/500 VUs, 496 complete and 0 interrupted iterations
default   [  20% ] 249/500 VUs  0m29.9s/2m30.0s

running (0m30.9s), 257/500 VUs, 535 complete and 0 interrupted iterations
default   [  21% ] 257/500 VUs  0m30.9s/2m30.0s

running (0m31.9s), 266/500 VUs, 577 complete and 0 interrupted iterations
default   [  21% ] 266/500 VUs  0m31.9s/2m30.0s

running (0m32.9s), 274/500 VUs, 620 complete and 0 interrupted iterations
default   [  22% ] 274/500 VUs  0m32.9s/2m30.0s

running (0m33.9s), 282/500 VUs, 660 complete and 0 interrupted iterations
default   [  23% ] 282/500 VUs  0m33.9s/2m30.0s

running (0m34.9s), 291/500 VUs, 700 complete and 0 interrupted iterations
default   [  23% ] 291/500 VUs  0m34.9s/2m30.0s

running (0m35.9s), 299/500 VUs, 744 complete and 0 interrupted iterations
default   [  24% ] 299/500 VUs  0m35.9s/2m30.0s

running (0m36.9s), 307/500 VUs, 792 complete and 0 interrupted iterations
default   [  25% ] 307/500 VUs  0m36.9s/2m30.0s

running (0m37.9s), 316/500 VUs, 840 complete and 0 interrupted iterations
default   [  25% ] 316/500 VUs  0m37.9s/2m30.0s

running (0m38.9s), 324/500 VUs, 892 complete and 0 interrupted iterations
default   [  26% ] 324/500 VUs  0m38.9s/2m30.0s

running (0m39.9s), 332/500 VUs, 942 complete and 0 interrupted iterations
default   [  27% ] 332/500 VUs  0m39.9s/2m30.0s

running (0m40.9s), 341/500 VUs, 990 complete and 0 interrupted iterations
default   [  27% ] 341/500 VUs  0m40.9s/2m30.0s

running (0m41.9s), 349/500 VUs, 1041 complete and 0 interrupted iterations
default   [  28% ] 349/500 VUs  0m41.9s/2m30.0s

running (0m42.9s), 357/500 VUs, 1098 complete and 0 interrupted iterations
default   [  29% ] 357/500 VUs  0m42.9s/2m30.0s

running (0m43.9s), 366/500 VUs, 1155 complete and 0 interrupted iterations
default   [  29% ] 366/500 VUs  0m43.9s/2m30.0s

running (0m44.9s), 374/500 VUs, 1211 complete and 0 interrupted iterations
default   [  30% ] 374/500 VUs  0m44.9s/2m30.0s

running (0m45.9s), 382/500 VUs, 1270 complete and 0 interrupted iterations
default   [  31% ] 382/500 VUs  0m45.9s/2m30.0s

running (0m46.9s), 390/500 VUs, 1328 complete and 0 interrupted iterations
default   [  31% ] 390/500 VUs  0m46.9s/2m30.0s

running (0m47.9s), 399/500 VUs, 1386 complete and 0 interrupted iterations
default   [  32% ] 399/500 VUs  0m47.9s/2m30.0s

running (0m48.9s), 407/500 VUs, 1449 complete and 0 interrupted iterations
default   [  33% ] 407/500 VUs  0m48.9s/2m30.0s

running (0m49.9s), 415/500 VUs, 1517 complete and 0 interrupted iterations
default   [  33% ] 415/500 VUs  0m49.9s/2m30.0s

running (0m50.9s), 424/500 VUs, 1580 complete and 0 interrupted iterations
default   [  34% ] 424/500 VUs  0m50.9s/2m30.0s

running (0m51.9s), 432/500 VUs, 1645 complete and 0 interrupted iterations
default   [  35% ] 432/500 VUs  0m51.9s/2m30.0s

running (0m52.9s), 440/500 VUs, 1711 complete and 0 interrupted iterations
default   [  35% ] 440/500 VUs  0m52.9s/2m30.0s

running (0m53.9s), 449/500 VUs, 1775 complete and 0 interrupted iterations
default   [  36% ] 449/500 VUs  0m53.9s/2m30.0s

running (0m55.3s), 460/500 VUs, 1855 complete and 0 interrupted iterations
default   [  37% ] 460/500 VUs  0m55.3s/2m30.0s

running (0m55.9s), 465/500 VUs, 1905 complete and 0 interrupted iterations
default   [  37% ] 465/500 VUs  0m55.9s/2m30.0s

running (0m56.9s), 474/500 VUs, 1978 complete and 0 interrupted iterations
default   [  38% ] 474/500 VUs  0m56.9s/2m30.0s

running (0m57.9s), 482/500 VUs, 2044 complete and 0 interrupted iterations
default   [  39% ] 482/500 VUs  0m57.9s/2m30.0s

running (0m58.9s), 490/500 VUs, 2101 complete and 0 interrupted iterations
default   [  39% ] 490/500 VUs  0m58.9s/2m30.0s

running (0m59.9s), 499/500 VUs, 2181 complete and 0 interrupted iterations
default   [  40% ] 499/500 VUs  0m59.9s/2m30.0s

running (1m00.9s), 500/500 VUs, 2253 complete and 0 interrupted iterations
default   [  41% ] 500/500 VUs  1m00.9s/2m30.0s

running (1m01.9s), 500/500 VUs, 2306 complete and 0 interrupted iterations
default   [  41% ] 500/500 VUs  1m01.9s/2m30.0s

running (1m02.9s), 500/500 VUs, 2396 complete and 0 interrupted iterations
default   [  42% ] 500/500 VUs  1m02.9s/2m30.0s

running (1m03.9s), 500/500 VUs, 2481 complete and 0 interrupted iterations
default   [  43% ] 500/500 VUs  1m03.9s/2m30.0s

running (1m04.9s), 500/500 VUs, 2538 complete and 0 interrupted iterations
default   [  43% ] 500/500 VUs  1m04.9s/2m30.0s

running (1m05.9s), 500/500 VUs, 2627 complete and 0 interrupted iterations
default   [  44% ] 500/500 VUs  1m05.9s/2m30.0s

running (1m06.9s), 500/500 VUs, 2721 complete and 0 interrupted iterations
default   [  45% ] 500/500 VUs  1m06.9s/2m30.0s

running (1m07.9s), 500/500 VUs, 2768 complete and 0 interrupted iterations
default   [  45% ] 500/500 VUs  1m07.9s/2m30.0s

running (1m08.9s), 500/500 VUs, 2842 complete and 0 interrupted iterations
default   [  46% ] 500/500 VUs  1m08.9s/2m30.0s

running (1m09.9s), 500/500 VUs, 2916 complete and 0 interrupted iterations
default   [  47% ] 500/500 VUs  1m09.9s/2m30.0s

running (1m10.9s), 500/500 VUs, 3003 complete and 0 interrupted iterations
default   [  47% ] 500/500 VUs  1m10.9s/2m30.0s

running (1m11.9s), 500/500 VUs, 3046 complete and 0 interrupted iterations
default   [  48% ] 500/500 VUs  1m11.9s/2m30.0s

running (1m12.9s), 500/500 VUs, 3148 complete and 0 interrupted iterations
default   [  49% ] 500/500 VUs  1m12.9s/2m30.0s

running (1m13.9s), 500/500 VUs, 3250 complete and 0 interrupted iterations
default   [  49% ] 500/500 VUs  1m13.9s/2m30.0s

running (1m14.9s), 500/500 VUs, 3312 complete and 0 interrupted iterations
default   [  50% ] 500/500 VUs  1m14.9s/2m30.0s

running (1m15.9s), 500/500 VUs, 3351 complete and 0 interrupted iterations
default   [  51% ] 500/500 VUs  1m15.9s/2m30.0s

running (1m16.9s), 500/500 VUs, 3436 complete and 0 interrupted iterations
default   [  51% ] 500/500 VUs  1m16.9s/2m30.0s

running (1m17.9s), 500/500 VUs, 3529 complete and 0 interrupted iterations
default   [  52% ] 500/500 VUs  1m17.9s/2m30.0s

running (1m18.9s), 500/500 VUs, 3612 complete and 0 interrupted iterations
default   [  53% ] 500/500 VUs  1m18.9s/2m30.0s

running (1m19.9s), 500/500 VUs, 3669 complete and 0 interrupted iterations
default   [  53% ] 500/500 VUs  1m19.9s/2m30.0s

running (1m20.9s), 500/500 VUs, 3757 complete and 0 interrupted iterations
default   [  54% ] 500/500 VUs  1m20.9s/2m30.0s

running (1m21.9s), 500/500 VUs, 3839 complete and 0 interrupted iterations
default   [  55% ] 500/500 VUs  1m21.9s/2m30.0s

running (1m22.9s), 500/500 VUs, 3909 complete and 0 interrupted iterations
default   [  55% ] 500/500 VUs  1m22.9s/2m30.0s

running (1m23.9s), 500/500 VUs, 3963 complete and 0 interrupted iterations
default   [  56% ] 500/500 VUs  1m23.9s/2m30.0s

running (1m24.9s), 500/500 VUs, 4033 complete and 0 interrupted iterations
default   [  57% ] 500/500 VUs  1m24.9s/2m30.0s

running (1m25.9s), 500/500 VUs, 4129 complete and 0 interrupted iterations
default   [  57% ] 500/500 VUs  1m25.9s/2m30.0s

running (1m26.9s), 500/500 VUs, 4218 complete and 0 interrupted iterations
default   [  58% ] 500/500 VUs  1m26.9s/2m30.0s

running (1m27.9s), 500/500 VUs, 4282 complete and 0 interrupted iterations
default   [  59% ] 500/500 VUs  1m27.9s/2m30.0s

running (1m28.9s), 500/500 VUs, 4355 complete and 0 interrupted iterations
default   [  59% ] 500/500 VUs  1m28.9s/2m30.0s

running (1m29.9s), 500/500 VUs, 4410 complete and 0 interrupted iterations
default   [  60% ] 500/500 VUs  1m29.9s/2m30.0s

running (1m30.9s), 500/500 VUs, 4501 complete and 0 interrupted iterations
default   [  61% ] 500/500 VUs  1m30.9s/2m30.0s

running (1m31.9s), 500/500 VUs, 4589 complete and 0 interrupted iterations
default   [  61% ] 500/500 VUs  1m31.9s/2m30.0s

running (1m32.9s), 500/500 VUs, 4656 complete and 0 interrupted iterations
default   [  62% ] 500/500 VUs  1m32.9s/2m30.0s

running (1m33.9s), 500/500 VUs, 4747 complete and 0 interrupted iterations
default   [  63% ] 500/500 VUs  1m33.9s/2m30.0s

running (1m34.9s), 500/500 VUs, 4835 complete and 0 interrupted iterations
default   [  63% ] 500/500 VUs  1m34.9s/2m30.0s

running (1m35.9s), 500/500 VUs, 4872 complete and 0 interrupted iterations
default   [  64% ] 500/500 VUs  1m35.9s/2m30.0s

running (1m36.9s), 500/500 VUs, 4944 complete and 0 interrupted iterations
default   [  65% ] 500/500 VUs  1m36.9s/2m30.0s

running (1m37.9s), 500/500 VUs, 5026 complete and 0 interrupted iterations
default   [  65% ] 500/500 VUs  1m37.9s/2m30.0s

running (1m38.9s), 500/500 VUs, 5109 complete and 0 interrupted iterations
default   [  66% ] 500/500 VUs  1m38.9s/2m30.0s

running (1m39.9s), 500/500 VUs, 5184 complete and 0 interrupted iterations
default   [  67% ] 500/500 VUs  1m39.9s/2m30.0s

running (1m41.0s), 500/500 VUs, 5289 complete and 0 interrupted iterations
default   [  67% ] 500/500 VUs  1m41.0s/2m30.0s

running (1m41.9s), 500/500 VUs, 5331 complete and 0 interrupted iterations
default   [  68% ] 500/500 VUs  1m41.9s/2m30.0s

running (1m42.9s), 500/500 VUs, 5397 complete and 0 interrupted iterations
default   [  69% ] 500/500 VUs  1m42.9s/2m30.0s

running (1m43.9s), 500/500 VUs, 5494 complete and 0 interrupted iterations
default   [  69% ] 500/500 VUs  1m43.9s/2m30.0s

running (1m44.9s), 500/500 VUs, 5555 complete and 0 interrupted iterations
default   [  70% ] 500/500 VUs  1m44.9s/2m30.0s

running (1m45.9s), 500/500 VUs, 5623 complete and 0 interrupted iterations
default   [  71% ] 500/500 VUs  1m45.9s/2m30.0s

running (1m46.9s), 500/500 VUs, 5722 complete and 0 interrupted iterations
default   [  71% ] 500/500 VUs  1m46.9s/2m30.0s

running (1m47.9s), 500/500 VUs, 5794 complete and 0 interrupted iterations
default   [  72% ] 500/500 VUs  1m47.9s/2m30.0s

running (1m48.9s), 500/500 VUs, 5861 complete and 0 interrupted iterations
default   [  73% ] 500/500 VUs  1m48.9s/2m30.0s

running (1m49.9s), 500/500 VUs, 5935 complete and 0 interrupted iterations
default   [  73% ] 500/500 VUs  1m49.9s/2m30.0s

running (1m50.9s), 500/500 VUs, 6019 complete and 0 interrupted iterations
default   [  74% ] 500/500 VUs  1m50.9s/2m30.0s

running (1m51.9s), 500/500 VUs, 6094 complete and 0 interrupted iterations
default   [  75% ] 500/500 VUs  1m51.9s/2m30.0s

running (1m52.9s), 500/500 VUs, 6203 complete and 0 interrupted iterations
default   [  75% ] 500/500 VUs  1m52.9s/2m30.0s

running (1m53.9s), 500/500 VUs, 6259 complete and 0 interrupted iterations
default   [  76% ] 500/500 VUs  1m53.9s/2m30.0s

running (1m54.9s), 500/500 VUs, 6337 complete and 0 interrupted iterations
default   [  77% ] 500/500 VUs  1m54.9s/2m30.0s

running (1m55.9s), 500/500 VUs, 6411 complete and 0 interrupted iterations
default   [  77% ] 500/500 VUs  1m55.9s/2m30.0s

running (1m56.9s), 500/500 VUs, 6456 complete and 0 interrupted iterations
default   [  78% ] 500/500 VUs  1m56.9s/2m30.0s

running (1m57.9s), 500/500 VUs, 6540 complete and 0 interrupted iterations
default   [  79% ] 500/500 VUs  1m57.9s/2m30.0s

running (1m58.9s), 500/500 VUs, 6634 complete and 0 interrupted iterations
default   [  79% ] 500/500 VUs  1m58.9s/2m30.0s

running (1m59.9s), 500/500 VUs, 6710 complete and 0 interrupted iterations
default   [  80% ] 500/500 VUs  1m59.9s/2m30.0s

running (2m00.9s), 498/500 VUs, 6772 complete and 0 interrupted iterations
default   [  81% ] 498/500 VUs  2m00.9s/2m30.0s

running (2m01.9s), 498/500 VUs, 6865 complete and 0 interrupted iterations
default   [  81% ] 498/500 VUs  2m01.9s/2m30.0s

running (2m02.9s), 490/500 VUs, 6921 complete and 0 interrupted iterations
default   [  82% ] 490/500 VUs  2m02.9s/2m30.0s

running (2m03.9s), 483/500 VUs, 6978 complete and 0 interrupted iterations
default   [  83% ] 483/500 VUs  2m03.9s/2m30.0s

running (2m04.9s), 475/500 VUs, 7066 complete and 0 interrupted iterations
default   [  83% ] 475/500 VUs  2m04.9s/2m30.0s

running (2m05.9s), 459/500 VUs, 7135 complete and 0 interrupted iterations
default   [  84% ] 459/500 VUs  2m05.9s/2m30.0s

running (2m06.9s), 438/500 VUs, 7236 complete and 0 interrupted iterations
default   [  85% ] 438/500 VUs  2m06.9s/2m30.0s

running (2m07.9s), 422/500 VUs, 7320 complete and 0 interrupted iterations
default   [  85% ] 422/500 VUs  2m07.9s/2m30.0s

running (2m08.9s), 406/500 VUs, 7381 complete and 0 interrupted iterations
default   [  86% ] 406/500 VUs  2m08.9s/2m30.0s

running (2m09.9s), 393/500 VUs, 7436 complete and 0 interrupted iterations
default   [  87% ] 393/500 VUs  2m09.9s/2m30.0s

running (2m10.9s), 375/500 VUs, 7514 complete and 0 interrupted iterations
default   [  87% ] 375/500 VUs  2m10.9s/2m30.0s

running (2m11.9s), 354/500 VUs, 7583 complete and 0 interrupted iterations
default   [  88% ] 354/500 VUs  2m11.9s/2m30.0s

running (2m12.9s), 333/500 VUs, 7667 complete and 0 interrupted iterations
default   [  89% ] 333/500 VUs  2m12.9s/2m30.0s

running (2m13.9s), 320/500 VUs, 7714 complete and 0 interrupted iterations
default   [  89% ] 320/500 VUs  2m13.9s/2m30.0s

running (2m14.9s), 305/500 VUs, 7777 complete and 0 interrupted iterations
default   [  90% ] 305/500 VUs  2m14.9s/2m30.0s

running (2m15.9s), 290/500 VUs, 7827 complete and 0 interrupted iterations
default   [  91% ] 290/500 VUs  2m15.9s/2m30.0s

running (2m16.9s), 267/500 VUs, 7889 complete and 0 interrupted iterations
default   [  91% ] 267/500 VUs  2m16.9s/2m30.0s

running (2m17.9s), 252/500 VUs, 7936 complete and 0 interrupted iterations
default   [  92% ] 252/500 VUs  2m17.9s/2m30.0s

running (2m18.9s), 227/500 VUs, 7999 complete and 0 interrupted iterations
default   [  93% ] 227/500 VUs  2m18.9s/2m30.0s

running (2m19.9s), 214/500 VUs, 8034 complete and 0 interrupted iterations
default   [  93% ] 214/500 VUs  2m19.9s/2m30.0s

running (2m20.9s), 198/500 VUs, 8082 complete and 0 interrupted iterations
default   [  94% ] 198/500 VUs  2m20.9s/2m30.0s

running (2m21.9s), 185/500 VUs, 8117 complete and 0 interrupted iterations
default   [  95% ] 185/500 VUs  2m21.9s/2m30.0s

running (2m22.9s), 165/500 VUs, 8155 complete and 0 interrupted iterations
default   [  95% ] 165/500 VUs  2m22.9s/2m30.0s

running (2m23.9s), 150/500 VUs, 8188 complete and 0 interrupted iterations
default   [  96% ] 150/500 VUs  2m23.9s/2m30.0s

running (2m24.9s), 131/500 VUs, 8225 complete and 0 interrupted iterations
default   [  97% ] 131/500 VUs  2m24.9s/2m30.0s

running (2m25.9s), 118/500 VUs, 8248 complete and 0 interrupted iterations
default   [  97% ] 118/500 VUs  2m25.9s/2m30.0s

running (2m26.9s), 100/500 VUs, 8280 complete and 0 interrupted iterations
default   [  98% ] 100/500 VUs  2m26.9s/2m30.0s

running (2m27.9s), 084/500 VUs, 8301 complete and 0 interrupted iterations
default   [  99% ] 084/500 VUs  2m27.9s/2m30.0s

running (2m28.9s), 071/500 VUs, 8320 complete and 0 interrupted iterations
default   [  99% ] 071/500 VUs  2m28.9s/2m30.0s

running (2m29.9s), 053/500 VUs, 8338 complete and 0 interrupted iterations
default   [ 100% ] 053/500 VUs  2m29.9s/2m30.0s

running (2m30.9s), 035/500 VUs, 8356 complete and 0 interrupted iterations
default ↓ [ 100% ] 053/500 VUs  2m30s

running (2m31.9s), 025/500 VUs, 8366 complete and 0 interrupted iterations
default ↓ [ 100% ] 053/500 VUs  2m30s

running (2m32.9s), 011/500 VUs, 8380 complete and 0 interrupted iterations
default ↓ [ 100% ] 053/500 VUs  2m30s

running (2m33.9s), 006/500 VUs, 8385 complete and 0 interrupted iterations
default ↓ [ 100% ] 053/500 VUs  2m30s


  █ THRESHOLDS 

    active_clients_time
    ✓ 'p(95)<500' p(95)=102ms

    attach_documents_time
    ✓ 'p(95)<10000' p(95)=356ms

    deactivate_clients_time
    ✓ 'p(95)<10000' p(95)=104ms

    http_req_duration
    ✓ 'p(95)<10000' p(95)=180.19ms

    pushpulls_time
    ✓ 'p(95)<1000' p(95)=171ms

    transaction_success_rate
    ✓ 'rate>0.99' rate=100.00%

    transaction_time
    ✓ 'p(95)<30000' p(95)=7.05s


  █ TOTAL RESULTS 

    checks_total.......: 134256  868.88335/s
    checks_succeeded...: 100.00% 134256 out of 134256
    checks_failed......: 0.00%   0 out of 134256

    ✓ status is 200
    ✓ response has valid body

    CUSTOM
    active_clients....................: 8391    54.305209/s
    active_clients_success_rate.......: 100.00% 8391 out of 8391
    active_clients_time...............: avg=23.05ms min=0s       med=4ms    max=359ms   p(90)=70ms     p(95)=102ms   
    attach_documents..................: 8391    54.305209/s
    attach_documents_success_rate.....: 100.00% 8391 out of 8391
    attach_documents_time.............: avg=93.6ms  min=3ms      med=21ms   max=626ms   p(90)=294ms    p(95)=356ms   
    deactivate_clients................: 8391    54.305209/s
    deactivate_clients_success_rate...: 100.00% 8391 out of 8391
    deactivate_clients_time...........: avg=21.72ms min=0s       med=3ms    max=512ms   p(90)=66ms     p(95)=104ms   
    pushpulls.........................: 41955   271.526047/s
    pushpulls_success_rate............: 100.00% 41955 out of 41955
    pushpulls_time....................: avg=44.12ms min=1ms      med=15ms   max=657ms   p(90)=124ms    p(95)=171ms   
    transaction_success_rate..........: 100.00% 8391 out of 8391
    transaction_time..................: avg=6.43s   min=6.01s    med=6.42s  max=7.94s   p(90)=6.9s     p(95)=7.05s   

    HTTP
    http_req_duration.................: avg=40.33ms min=196.35µs med=8.29ms max=625.3ms p(90)=120.44ms p(95)=180.19ms
      { expected_response:true }......: avg=40.33ms min=196.35µs med=8.29ms max=625.3ms p(90)=120.44ms p(95)=180.19ms
    http_req_failed...................: 0.00%   0 out of 67128
    http_reqs.........................: 67128   434.441675/s

    EXECUTION
    iteration_duration................: avg=6.43s   min=6.01s    med=6.42s  max=7.94s   p(90)=6.9s     p(95)=7.05s   
    iterations........................: 8391    54.305209/s
    vus...............................: 6       min=6              max=500
    vus_max...........................: 500     min=500            max=500

    NETWORK
    data_received.....................: 1.2 GB  7.7 MB/s
    data_sent.........................: 63 MB   409 kB/s




running (2m34.5s), 000/500 VUs, 8391 complete and 0 interrupted iterations
default ✓ [ 100% ] 000/500 VUs  2m30s
