
         /\      Grafana   /‾‾/  
    /\  /  \     |\  __   /  /   
   /  \/    \    | |/ /  /   ‾‾\ 
  /          \   |   (  |  (‾)  |
 / __________ \  |_|\_\  \_____/ 

     execution: local
        script: test/k6/presence.ts
        output: -

     scenarios: (100.00%) 1 scenario, 500 max VUs, 3m0s max duration (incl. graceful stop):
              * default: Up to 500 looping VUs for 2m30s over 3 stages (gracefulRampDown: 30s, gracefulStop: 30s)


running (0m00.9s), 008/500 VUs, 0 complete and 0 interrupted iterations
default   [   1% ] 008/500 VUs  0m00.9s/2m30.0s

running (0m01.9s), 016/500 VUs, 0 complete and 0 interrupted iterations
default   [   1% ] 016/500 VUs  0m01.9s/2m30.0s

running (0m02.9s), 025/500 VUs, 0 complete and 0 interrupted iterations
default   [   2% ] 025/500 VUs  0m02.9s/2m30.0s

running (0m03.9s), 033/500 VUs, 0 complete and 0 interrupted iterations
default   [   3% ] 033/500 VUs  0m03.9s/2m30.0s

running (0m04.9s), 041/500 VUs, 0 complete and 0 interrupted iterations
default   [   3% ] 041/500 VUs  0m04.9s/2m30.0s

running (0m05.9s), 049/500 VUs, 0 complete and 0 interrupted iterations
default   [   4% ] 049/500 VUs  0m05.9s/2m30.0s

running (0m06.9s), 058/500 VUs, 8 complete and 0 interrupted iterations
default   [   5% ] 058/500 VUs  0m06.9s/2m30.0s

running (0m07.9s), 066/500 VUs, 16 complete and 0 interrupted iterations
default   [   5% ] 066/500 VUs  0m07.9s/2m30.0s

running (0m08.9s), 074/500 VUs, 24 complete and 0 interrupted iterations
default   [   6% ] 074/500 VUs  0m08.9s/2m30.0s

running (0m09.9s), 083/500 VUs, 33 complete and 0 interrupted iterations
default   [   7% ] 083/500 VUs  0m09.9s/2m30.0s

running (0m10.9s), 091/500 VUs, 41 complete and 0 interrupted iterations
default   [   7% ] 091/500 VUs  0m10.9s/2m30.0s

running (0m11.9s), 099/500 VUs, 49 complete and 0 interrupted iterations
default   [   8% ] 099/500 VUs  0m11.9s/2m30.0s

running (0m12.9s), 108/500 VUs, 66 complete and 0 interrupted iterations
default   [   9% ] 108/500 VUs  0m12.9s/2m30.0s

running (0m13.9s), 116/500 VUs, 82 complete and 0 interrupted iterations
default   [   9% ] 116/500 VUs  0m13.9s/2m30.0s

running (0m14.9s), 124/500 VUs, 98 complete and 0 interrupted iterations
default   [  10% ] 124/500 VUs  0m14.9s/2m30.0s

running (0m15.9s), 133/500 VUs, 116 complete and 0 interrupted iterations
default   [  11% ] 133/500 VUs  0m15.9s/2m30.0s

running (0m16.9s), 141/500 VUs, 132 complete and 0 interrupted iterations
default   [  11% ] 141/500 VUs  0m16.9s/2m30.0s

running (0m17.9s), 149/500 VUs, 148 complete and 0 interrupted iterations
default   [  12% ] 149/500 VUs  0m17.9s/2m30.0s

running (0m18.9s), 158/500 VUs, 171 complete and 0 interrupted iterations
default   [  13% ] 158/500 VUs  0m18.9s/2m30.0s

running (0m19.9s), 166/500 VUs, 198 complete and 0 interrupted iterations
default   [  13% ] 166/500 VUs  0m19.9s/2m30.0s

running (0m20.9s), 174/500 VUs, 222 complete and 0 interrupted iterations
default   [  14% ] 174/500 VUs  0m20.9s/2m30.0s

running (0m21.9s), 183/500 VUs, 246 complete and 0 interrupted iterations
default   [  15% ] 183/500 VUs  0m21.9s/2m30.0s

running (0m22.9s), 191/500 VUs, 273 complete and 0 interrupted iterations
default   [  15% ] 191/500 VUs  0m22.9s/2m30.0s

running (0m23.9s), 199/500 VUs, 297 complete and 0 interrupted iterations
default   [  16% ] 199/500 VUs  0m23.9s/2m30.0s

running (0m24.9s), 207/500 VUs, 328 complete and 0 interrupted iterations
default   [  17% ] 207/500 VUs  0m24.9s/2m30.0s

running (0m25.9s), 216/500 VUs, 364 complete and 0 interrupted iterations
default   [  17% ] 216/500 VUs  0m25.9s/2m30.0s

running (0m26.9s), 224/500 VUs, 396 complete and 0 interrupted iterations
default   [  18% ] 224/500 VUs  0m26.9s/2m30.0s

running (0m27.9s), 232/500 VUs, 428 complete and 0 interrupted iterations
default   [  19% ] 232/500 VUs  0m27.9s/2m30.0s

running (0m28.9s), 241/500 VUs, 462 complete and 0 interrupted iterations
default   [  19% ] 241/500 VUs  0m28.9s/2m30.0s

running (0m29.9s), 249/500 VUs, 496 complete and 0 interrupted iterations
default   [  20% ] 249/500 VUs  0m29.9s/2m30.0s

running (0m30.9s), 257/500 VUs, 535 complete and 0 interrupted iterations
default   [  21% ] 257/500 VUs  0m30.9s/2m30.0s

running (0m31.9s), 266/500 VUs, 578 complete and 0 interrupted iterations
default   [  21% ] 266/500 VUs  0m31.9s/2m30.0s

running (0m32.9s), 274/500 VUs, 620 complete and 0 interrupted iterations
default   [  22% ] 274/500 VUs  0m32.9s/2m30.0s

running (0m33.9s), 282/500 VUs, 660 complete and 0 interrupted iterations
default   [  23% ] 282/500 VUs  0m33.9s/2m30.0s

running (0m34.9s), 291/500 VUs, 700 complete and 0 interrupted iterations
default   [  23% ] 291/500 VUs  0m34.9s/2m30.0s

running (0m35.9s), 299/500 VUs, 745 complete and 0 interrupted iterations
default   [  24% ] 299/500 VUs  0m35.9s/2m30.0s

running (0m36.9s), 307/500 VUs, 792 complete and 0 interrupted iterations
default   [  25% ] 307/500 VUs  0m36.9s/2m30.0s

running (0m37.9s), 316/500 VUs, 840 complete and 0 interrupted iterations
default   [  25% ] 316/500 VUs  0m37.9s/2m30.0s

running (0m38.9s), 324/500 VUs, 891 complete and 0 interrupted iterations
default   [  26% ] 324/500 VUs  0m38.9s/2m30.0s

running (0m39.9s), 332/500 VUs, 942 complete and 0 interrupted iterations
default   [  27% ] 332/500 VUs  0m39.9s/2m30.0s

running (0m40.9s), 341/500 VUs, 990 complete and 0 interrupted iterations
default   [  27% ] 341/500 VUs  0m40.9s/2m30.0s

running (0m41.9s), 349/500 VUs, 1040 complete and 0 interrupted iterations
default   [  28% ] 349/500 VUs  0m41.9s/2m30.0s

running (0m42.9s), 357/500 VUs, 1096 complete and 0 interrupted iterations
default   [  29% ] 357/500 VUs  0m42.9s/2m30.0s

running (0m43.9s), 366/500 VUs, 1155 complete and 0 interrupted iterations
default   [  29% ] 366/500 VUs  0m43.9s/2m30.0s

running (0m44.9s), 374/500 VUs, 1213 complete and 0 interrupted iterations
default   [  30% ] 374/500 VUs  0m44.9s/2m30.0s

running (0m45.9s), 382/500 VUs, 1273 complete and 0 interrupted iterations
default   [  31% ] 382/500 VUs  0m45.9s/2m30.0s

running (0m46.9s), 390/500 VUs, 1330 complete and 0 interrupted iterations
default   [  31% ] 390/500 VUs  0m46.9s/2m30.0s

running (0m47.9s), 399/500 VUs, 1387 complete and 0 interrupted iterations
default   [  32% ] 399/500 VUs  0m47.9s/2m30.0s

running (0m48.9s), 407/500 VUs, 1451 complete and 0 interrupted iterations
default   [  33% ] 407/500 VUs  0m48.9s/2m30.0s

running (0m49.9s), 415/500 VUs, 1519 complete and 0 interrupted iterations
default   [  33% ] 415/500 VUs  0m49.9s/2m30.0s

running (0m50.9s), 424/500 VUs, 1583 complete and 0 interrupted iterations
default   [  34% ] 424/500 VUs  0m50.9s/2m30.0s

running (0m51.9s), 432/500 VUs, 1648 complete and 0 interrupted iterations
default   [  35% ] 432/500 VUs  0m51.9s/2m30.0s

running (0m52.9s), 440/500 VUs, 1715 complete and 0 interrupted iterations
default   [  35% ] 440/500 VUs  0m52.9s/2m30.0s

running (0m53.9s), 449/500 VUs, 1773 complete and 0 interrupted iterations
default   [  36% ] 449/500 VUs  0m53.9s/2m30.0s

running (0m54.9s), 457/500 VUs, 1838 complete and 0 interrupted iterations
default   [  37% ] 457/500 VUs  0m54.9s/2m30.0s

running (0m55.9s), 465/500 VUs, 1914 complete and 0 interrupted iterations
default   [  37% ] 465/500 VUs  0m55.9s/2m30.0s

running (0m56.9s), 474/500 VUs, 1970 complete and 0 interrupted iterations
default   [  38% ] 474/500 VUs  0m56.9s/2m30.0s

running (0m57.9s), 482/500 VUs, 2052 complete and 0 interrupted iterations
default   [  39% ] 482/500 VUs  0m57.9s/2m30.0s

running (0m58.9s), 490/500 VUs, 2109 complete and 0 interrupted iterations
default   [  39% ] 490/500 VUs  0m58.9s/2m30.0s

running (0m59.9s), 499/500 VUs, 2193 complete and 0 interrupted iterations
default   [  40% ] 499/500 VUs  0m59.9s/2m30.0s

running (1m00.9s), 500/500 VUs, 2257 complete and 0 interrupted iterations
default   [  41% ] 500/500 VUs  1m00.9s/2m30.0s

running (1m01.9s), 500/500 VUs, 2329 complete and 0 interrupted iterations
default   [  41% ] 500/500 VUs  1m01.9s/2m30.0s

running (1m02.9s), 500/500 VUs, 2415 complete and 0 interrupted iterations
default   [  42% ] 500/500 VUs  1m02.9s/2m30.0s

running (1m04.0s), 500/500 VUs, 2511 complete and 0 interrupted iterations
default   [  43% ] 500/500 VUs  1m04.0s/2m30.0s

running (1m04.9s), 500/500 VUs, 2552 complete and 0 interrupted iterations
default   [  43% ] 500/500 VUs  1m04.9s/2m30.0s

running (1m05.9s), 500/500 VUs, 2626 complete and 0 interrupted iterations
default   [  44% ] 500/500 VUs  1m05.9s/2m30.0s

running (1m06.9s), 500/500 VUs, 2698 complete and 0 interrupted iterations
default   [  45% ] 500/500 VUs  1m06.9s/2m30.0s

running (1m07.9s), 500/500 VUs, 2775 complete and 0 interrupted iterations
default   [  45% ] 500/500 VUs  1m07.9s/2m30.0s

running (1m08.9s), 500/500 VUs, 2865 complete and 0 interrupted iterations
default   [  46% ] 500/500 VUs  1m08.9s/2m30.0s

running (1m10.1s), 500/500 VUs, 2938 complete and 0 interrupted iterations
default   [  47% ] 500/500 VUs  1m10.1s/2m30.0s

running (1m10.9s), 500/500 VUs, 2997 complete and 0 interrupted iterations
default   [  47% ] 500/500 VUs  1m10.9s/2m30.0s

running (1m11.9s), 500/500 VUs, 3082 complete and 0 interrupted iterations
default   [  48% ] 500/500 VUs  1m11.9s/2m30.0s

running (1m12.9s), 500/500 VUs, 3166 complete and 0 interrupted iterations
default   [  49% ] 500/500 VUs  1m12.9s/2m30.0s

running (1m13.9s), 500/500 VUs, 3219 complete and 0 interrupted iterations
default   [  49% ] 500/500 VUs  1m13.9s/2m30.0s

running (1m14.9s), 500/500 VUs, 3289 complete and 0 interrupted iterations
default   [  50% ] 500/500 VUs  1m14.9s/2m30.0s

running (1m16.0s), 500/500 VUs, 3396 complete and 0 interrupted iterations
default   [  51% ] 500/500 VUs  1m16.0s/2m30.0s

running (1m16.9s), 500/500 VUs, 3457 complete and 0 interrupted iterations
default   [  51% ] 500/500 VUs  1m16.9s/2m30.0s

running (1m17.9s), 500/500 VUs, 3538 complete and 0 interrupted iterations
default   [  52% ] 500/500 VUs  1m17.9s/2m30.0s

running (1m18.9s), 500/500 VUs, 3632 complete and 0 interrupted iterations
default   [  53% ] 500/500 VUs  1m18.9s/2m30.0s

running (1m19.9s), 500/500 VUs, 3688 complete and 0 interrupted iterations
default   [  53% ] 500/500 VUs  1m19.9s/2m30.0s

running (1m20.9s), 500/500 VUs, 3763 complete and 0 interrupted iterations
default   [  54% ] 500/500 VUs  1m20.9s/2m30.0s

running (1m21.9s), 500/500 VUs, 3874 complete and 0 interrupted iterations
default   [  55% ] 500/500 VUs  1m21.9s/2m30.0s

running (1m22.9s), 500/500 VUs, 3927 complete and 0 interrupted iterations
default   [  55% ] 500/500 VUs  1m22.9s/2m30.0s

running (1m23.9s), 500/500 VUs, 3993 complete and 0 interrupted iterations
default   [  56% ] 500/500 VUs  1m23.9s/2m30.0s

running (1m25.0s), 500/500 VUs, 4074 complete and 0 interrupted iterations
default   [  57% ] 500/500 VUs  1m25.0s/2m30.0s

running (1m25.9s), 500/500 VUs, 4155 complete and 0 interrupted iterations
default   [  57% ] 500/500 VUs  1m25.9s/2m30.0s

running (1m26.9s), 500/500 VUs, 4229 complete and 0 interrupted iterations
default   [  58% ] 500/500 VUs  1m26.9s/2m30.0s

running (1m28.1s), 500/500 VUs, 4306 complete and 0 interrupted iterations
default   [  59% ] 500/500 VUs  1m28.1s/2m30.0s

running (1m28.9s), 500/500 VUs, 4372 complete and 0 interrupted iterations
default   [  59% ] 500/500 VUs  1m28.9s/2m30.0s

running (1m29.9s), 500/500 VUs, 4439 complete and 0 interrupted iterations
default   [  60% ] 500/500 VUs  1m29.9s/2m30.0s

running (1m30.9s), 500/500 VUs, 4534 complete and 0 interrupted iterations
default   [  61% ] 500/500 VUs  1m30.9s/2m30.0s

running (1m31.9s), 500/500 VUs, 4590 complete and 0 interrupted iterations
default   [  61% ] 500/500 VUs  1m31.9s/2m30.0s

running (1m32.9s), 500/500 VUs, 4675 complete and 0 interrupted iterations
default   [  62% ] 500/500 VUs  1m32.9s/2m30.0s

running (1m33.9s), 500/500 VUs, 4770 complete and 0 interrupted iterations
default   [  63% ] 500/500 VUs  1m33.9s/2m30.0s

running (1m34.9s), 500/500 VUs, 4822 complete and 0 interrupted iterations
default   [  63% ] 500/500 VUs  1m34.9s/2m30.0s

running (1m35.9s), 500/500 VUs, 4890 complete and 0 interrupted iterations
default   [  64% ] 500/500 VUs  1m35.9s/2m30.0s

running (1m36.9s), 500/500 VUs, 4980 complete and 0 interrupted iterations
default   [  65% ] 500/500 VUs  1m36.9s/2m30.0s

running (1m37.9s), 500/500 VUs, 5050 complete and 0 interrupted iterations
default   [  65% ] 500/500 VUs  1m37.9s/2m30.0s

running (1m38.9s), 500/500 VUs, 5128 complete and 0 interrupted iterations
default   [  66% ] 500/500 VUs  1m38.9s/2m30.0s

running (1m39.9s), 500/500 VUs, 5202 complete and 0 interrupted iterations
default   [  67% ] 500/500 VUs  1m39.9s/2m30.0s

running (1m40.9s), 500/500 VUs, 5278 complete and 0 interrupted iterations
default   [  67% ] 500/500 VUs  1m40.9s/2m30.0s

running (1m41.9s), 500/500 VUs, 5340 complete and 0 interrupted iterations
default   [  68% ] 500/500 VUs  1m41.9s/2m30.0s

running (1m42.9s), 500/500 VUs, 5433 complete and 0 interrupted iterations
default   [  69% ] 500/500 VUs  1m42.9s/2m30.0s

running (1m43.9s), 500/500 VUs, 5513 complete and 0 interrupted iterations
default   [  69% ] 500/500 VUs  1m43.9s/2m30.0s

running (1m44.9s), 500/500 VUs, 5585 complete and 0 interrupted iterations
default   [  70% ] 500/500 VUs  1m44.9s/2m30.0s

running (1m45.9s), 500/500 VUs, 5667 complete and 0 interrupted iterations
default   [  71% ] 500/500 VUs  1m45.9s/2m30.0s

running (1m46.9s), 500/500 VUs, 5739 complete and 0 interrupted iterations
default   [  71% ] 500/500 VUs  1m46.9s/2m30.0s

running (1m47.9s), 500/500 VUs, 5812 complete and 0 interrupted iterations
default   [  72% ] 500/500 VUs  1m47.9s/2m30.0s

running (1m48.9s), 500/500 VUs, 5912 complete and 0 interrupted iterations
default   [  73% ] 500/500 VUs  1m48.9s/2m30.0s

running (1m49.9s), 500/500 VUs, 5978 complete and 0 interrupted iterations
default   [  73% ] 500/500 VUs  1m49.9s/2m30.0s

running (1m50.9s), 500/500 VUs, 6062 complete and 0 interrupted iterations
default   [  74% ] 500/500 VUs  1m50.9s/2m30.0s

running (1m51.9s), 500/500 VUs, 6125 complete and 0 interrupted iterations
default   [  75% ] 500/500 VUs  1m51.9s/2m30.0s

running (1m52.9s), 500/500 VUs, 6202 complete and 0 interrupted iterations
default   [  75% ] 500/500 VUs  1m52.9s/2m30.0s

running (1m53.9s), 500/500 VUs, 6261 complete and 0 interrupted iterations
default   [  76% ] 500/500 VUs  1m53.9s/2m30.0s

running (1m54.9s), 500/500 VUs, 6347 complete and 0 interrupted iterations
default   [  77% ] 500/500 VUs  1m54.9s/2m30.0s

running (1m55.9s), 500/500 VUs, 6422 complete and 0 interrupted iterations
default   [  77% ] 500/500 VUs  1m55.9s/2m30.0s

running (1m56.9s), 500/500 VUs, 6498 complete and 0 interrupted iterations
default   [  78% ] 500/500 VUs  1m56.9s/2m30.0s

running (1m57.9s), 500/500 VUs, 6557 complete and 0 interrupted iterations
default   [  79% ] 500/500 VUs  1m57.9s/2m30.0s

running (1m58.9s), 500/500 VUs, 6625 complete and 0 interrupted iterations
default   [  79% ] 500/500 VUs  1m58.9s/2m30.0s

running (1m59.9s), 500/500 VUs, 6716 complete and 0 interrupted iterations
default   [  80% ] 500/500 VUs  1m59.9s/2m30.0s

running (2m00.9s), 498/500 VUs, 6792 complete and 0 interrupted iterations
default   [  81% ] 498/500 VUs  2m00.9s/2m30.0s

running (2m01.9s), 498/500 VUs, 6895 complete and 0 interrupted iterations
default   [  81% ] 498/500 VUs  2m01.9s/2m30.0s

running (2m02.9s), 497/500 VUs, 6932 complete and 0 interrupted iterations
default   [  82% ] 497/500 VUs  2m02.9s/2m30.0s

running (2m03.9s), 484/500 VUs, 7026 complete and 0 interrupted iterations
default   [  83% ] 484/500 VUs  2m03.9s/2m30.0s

running (2m04.9s), 475/500 VUs, 7104 complete and 0 interrupted iterations
default   [  83% ] 475/500 VUs  2m04.9s/2m30.0s

running (2m05.9s), 459/500 VUs, 7188 complete and 0 interrupted iterations
default   [  84% ] 459/500 VUs  2m05.9s/2m30.0s

running (2m07.0s), 443/500 VUs, 7268 complete and 0 interrupted iterations
default   [  85% ] 443/500 VUs  2m07.0s/2m30.0s

running (2m07.9s), 425/500 VUs, 7327 complete and 0 interrupted iterations
default   [  85% ] 425/500 VUs  2m07.9s/2m30.0s

running (2m08.9s), 404/500 VUs, 7420 complete and 0 interrupted iterations
default   [  86% ] 404/500 VUs  2m08.9s/2m30.0s

running (2m09.9s), 385/500 VUs, 7491 complete and 0 interrupted iterations
default   [  87% ] 385/500 VUs  2m09.9s/2m30.0s

running (2m10.9s), 368/500 VUs, 7560 complete and 0 interrupted iterations
default   [  87% ] 368/500 VUs  2m10.9s/2m30.0s

running (2m11.9s), 350/500 VUs, 7633 complete and 0 interrupted iterations
default   [  88% ] 350/500 VUs  2m11.9s/2m30.0s

running (2m12.9s), 341/500 VUs, 7677 complete and 0 interrupted iterations
default   [  89% ] 341/500 VUs  2m12.9s/2m30.0s

running (2m13.9s), 323/500 VUs, 7747 complete and 0 interrupted iterations
default   [  89% ] 323/500 VUs  2m13.9s/2m30.0s

running (2m14.9s), 305/500 VUs, 7824 complete and 0 interrupted iterations
default   [  90% ] 305/500 VUs  2m14.9s/2m30.0s

running (2m15.9s), 288/500 VUs, 7876 complete and 0 interrupted iterations
default   [  91% ] 288/500 VUs  2m15.9s/2m30.0s

running (2m16.9s), 264/500 VUs, 7927 complete and 0 interrupted iterations
default   [  91% ] 264/500 VUs  2m16.9s/2m30.0s

running (2m17.9s), 249/500 VUs, 7980 complete and 0 interrupted iterations
default   [  92% ] 249/500 VUs  2m17.9s/2m30.0s

running (2m18.9s), 236/500 VUs, 8017 complete and 0 interrupted iterations
default   [  93% ] 236/500 VUs  2m18.9s/2m30.0s

running (2m19.9s), 217/500 VUs, 8068 complete and 0 interrupted iterations
default   [  93% ] 217/500 VUs  2m19.9s/2m30.0s

running (2m20.9s), 195/500 VUs, 8129 complete and 0 interrupted iterations
default   [  94% ] 195/500 VUs  2m20.9s/2m30.0s

running (2m21.9s), 180/500 VUs, 8164 complete and 0 interrupted iterations
default   [  95% ] 180/500 VUs  2m21.9s/2m30.0s

running (2m22.9s), 168/500 VUs, 8190 complete and 0 interrupted iterations
default   [  95% ] 168/500 VUs  2m22.9s/2m30.0s

running (2m23.9s), 153/500 VUs, 8224 complete and 0 interrupted iterations
default   [  96% ] 153/500 VUs  2m23.9s/2m30.0s

running (2m24.9s), 139/500 VUs, 8253 complete and 0 interrupted iterations
default   [  97% ] 139/500 VUs  2m24.9s/2m30.0s

running (2m25.9s), 123/500 VUs, 8285 complete and 0 interrupted iterations
default   [  97% ] 123/500 VUs  2m25.9s/2m30.0s

running (2m26.9s), 099/500 VUs, 8324 complete and 0 interrupted iterations
default   [  98% ] 099/500 VUs  2m26.9s/2m30.0s

running (2m27.9s), 086/500 VUs, 8344 complete and 0 interrupted iterations
default   [  99% ] 086/500 VUs  2m27.9s/2m30.0s

running (2m28.9s), 075/500 VUs, 8356 complete and 0 interrupted iterations
default   [  99% ] 075/500 VUs  2m28.9s/2m30.0s

running (2m29.9s), 056/500 VUs, 8375 complete and 0 interrupted iterations
default   [ 100% ] 056/500 VUs  2m29.9s/2m30.0s

running (2m30.9s), 039/500 VUs, 8392 complete and 0 interrupted iterations
default ↓ [ 100% ] 049/500 VUs  2m30s

running (2m31.9s), 023/500 VUs, 8408 complete and 0 interrupted iterations
default ↓ [ 100% ] 049/500 VUs  2m30s

running (2m32.9s), 008/500 VUs, 8423 complete and 0 interrupted iterations
default ↓ [ 100% ] 049/500 VUs  2m30s

running (2m33.9s), 001/500 VUs, 8430 complete and 0 interrupted iterations
default ↓ [ 100% ] 049/500 VUs  2m30s


  █ THRESHOLDS 

    active_clients_time
    ✓ 'p(95)<500' p(95)=94ms

    attach_documents_time
    ✓ 'p(95)<10000' p(95)=338ms

    deactivate_clients_time
    ✓ 'p(95)<10000' p(95)=108ms

    http_req_duration
    ✓ 'p(95)<10000' p(95)=169.01ms

    pushpulls_time
    ✓ 'p(95)<1000' p(95)=168.29ms

    transaction_success_rate
    ✓ 'rate>0.99' rate=100.00%

    transaction_time
    ✓ 'p(95)<30000' p(95)=7.03s


  █ TOTAL RESULTS 

    checks_total.......: 134896  872.879985/s
    checks_succeeded...: 100.00% 134896 out of 134896
    checks_failed......: 0.00%   0 out of 134896

    ✓ status is 200
    ✓ response has valid body

    CUSTOM
    active_clients....................: 8431    54.554999/s
    active_clients_success_rate.......: 100.00% 8431 out of 8431
    active_clients_time...............: avg=20.87ms min=0s       med=4ms    max=347ms    p(90)=66ms     p(95)=94ms    
    attach_documents..................: 8431    54.554999/s
    attach_documents_success_rate.....: 100.00% 8431 out of 8431
    attach_documents_time.............: avg=83.25ms min=3ms      med=20ms   max=599ms    p(90)=264ms    p(95)=338ms   
    deactivate_clients................: 8431    54.554999/s
    deactivate_clients_success_rate...: 100.00% 8431 out of 8431
    deactivate_clients_time...........: avg=21.15ms min=0s       med=3ms    max=467ms    p(90)=63ms     p(95)=108ms   
    pushpulls.........................: 42155   272.774995/s
    pushpulls_success_rate............: 100.00% 42155 out of 42155
    pushpulls_time....................: avg=41.29ms min=1ms      med=13ms   max=761ms    p(90)=120ms    p(95)=168.29ms
    transaction_success_rate..........: 100.00% 8431 out of 8431
    transaction_time..................: avg=6.4s    min=6.01s    med=6.37s  max=8.09s    p(90)=6.87s    p(95)=7.03s   

    HTTP
    http_req_duration.................: avg=36.97ms min=186.35µs med=7.43ms max=598.85ms p(90)=112.24ms p(95)=169.01ms
      { expected_response:true }......: avg=36.97ms min=186.35µs med=7.43ms max=598.85ms p(90)=112.24ms p(95)=169.01ms
    http_req_failed...................: 0.00%   0 out of 67448
    http_reqs.........................: 67448   436.439993/s

    EXECUTION
    iteration_duration................: avg=6.4s    min=6.01s    med=6.37s  max=8.09s    p(90)=6.87s    p(95)=7.03s   
    iterations........................: 8431    54.554999/s
    vus...............................: 1       min=1              max=500
    vus_max...........................: 500     min=500            max=500

    NETWORK
    data_received.....................: 1.2 GB  7.9 MB/s
    data_sent.........................: 64 MB   411 kB/s




running (2m34.5s), 000/500 VUs, 8431 complete and 0 interrupted iterations
default ✓ [ 100% ] 000/500 VUs  2m30s
