
         /\      Grafana   /‾‾/  
    /\  /  \     |\  __   /  /   
   /  \/    \    | |/ /  /   ‾‾\ 
  /          \   |   (  |  (‾)  |
 / __________ \  |_|\_\  \_____/ 

     execution: local
        script: test/k6/presence.ts
        output: -

     scenarios: (100.00%) 1 scenario, 500 max VUs, 3m0s max duration (incl. graceful stop):
              * default: Up to 500 looping VUs for 2m30s over 3 stages (gracefulRampDown: 30s, gracefulStop: 30s)


running (0m00.9s), 008/500 VUs, 0 complete and 0 interrupted iterations
default   [   1% ] 008/500 VUs  0m00.9s/2m30.0s

running (0m01.9s), 016/500 VUs, 0 complete and 0 interrupted iterations
default   [   1% ] 016/500 VUs  0m01.9s/2m30.0s

running (0m02.9s), 024/500 VUs, 0 complete and 0 interrupted iterations
default   [   2% ] 024/500 VUs  0m02.9s/2m30.0s

running (0m03.9s), 033/500 VUs, 0 complete and 0 interrupted iterations
default   [   3% ] 033/500 VUs  0m03.9s/2m30.0s

running (0m04.9s), 041/500 VUs, 0 complete and 0 interrupted iterations
default   [   3% ] 041/500 VUs  0m04.9s/2m30.0s

running (0m05.9s), 049/500 VUs, 0 complete and 0 interrupted iterations
default   [   4% ] 049/500 VUs  0m05.9s/2m30.0s

running (0m06.9s), 058/500 VUs, 8 complete and 0 interrupted iterations
default   [   5% ] 058/500 VUs  0m06.9s/2m30.0s

running (0m07.9s), 066/500 VUs, 16 complete and 0 interrupted iterations
default   [   5% ] 066/500 VUs  0m07.9s/2m30.0s

running (0m08.9s), 074/500 VUs, 24 complete and 0 interrupted iterations
default   [   6% ] 074/500 VUs  0m08.9s/2m30.0s

running (0m09.9s), 083/500 VUs, 33 complete and 0 interrupted iterations
default   [   7% ] 083/500 VUs  0m09.9s/2m30.0s

running (0m10.9s), 091/500 VUs, 41 complete and 0 interrupted iterations
default   [   7% ] 091/500 VUs  0m10.9s/2m30.0s

running (0m11.9s), 099/500 VUs, 49 complete and 0 interrupted iterations
default   [   8% ] 099/500 VUs  0m11.9s/2m30.0s

running (0m12.9s), 107/500 VUs, 64 complete and 0 interrupted iterations
default   [   9% ] 107/500 VUs  0m12.9s/2m30.0s

running (0m13.9s), 116/500 VUs, 82 complete and 0 interrupted iterations
default   [   9% ] 116/500 VUs  0m13.9s/2m30.0s

running (0m14.9s), 124/500 VUs, 98 complete and 0 interrupted iterations
default   [  10% ] 124/500 VUs  0m14.9s/2m30.0s

running (0m15.9s), 132/500 VUs, 114 complete and 0 interrupted iterations
default   [  11% ] 132/500 VUs  0m15.9s/2m30.0s

running (0m16.9s), 141/500 VUs, 132 complete and 0 interrupted iterations
default   [  11% ] 141/500 VUs  0m16.9s/2m30.0s

running (0m17.9s), 149/500 VUs, 148 complete and 0 interrupted iterations
default   [  12% ] 149/500 VUs  0m17.9s/2m30.0s

running (0m18.9s), 157/500 VUs, 171 complete and 0 interrupted iterations
default   [  13% ] 157/500 VUs  0m18.9s/2m30.0s

running (0m19.9s), 166/500 VUs, 198 complete and 0 interrupted iterations
default   [  13% ] 166/500 VUs  0m19.9s/2m30.0s

running (0m20.9s), 174/500 VUs, 222 complete and 0 interrupted iterations
default   [  14% ] 174/500 VUs  0m20.9s/2m30.0s

running (0m21.9s), 182/500 VUs, 246 complete and 0 interrupted iterations
default   [  15% ] 182/500 VUs  0m21.9s/2m30.0s

running (0m22.9s), 191/500 VUs, 271 complete and 0 interrupted iterations
default   [  15% ] 191/500 VUs  0m22.9s/2m30.0s

running (0m23.9s), 199/500 VUs, 297 complete and 0 interrupted iterations
default   [  16% ] 199/500 VUs  0m23.9s/2m30.0s

running (0m24.9s), 207/500 VUs, 328 complete and 0 interrupted iterations
default   [  17% ] 207/500 VUs  0m24.9s/2m30.0s

running (0m25.9s), 216/500 VUs, 361 complete and 0 interrupted iterations
default   [  17% ] 216/500 VUs  0m25.9s/2m30.0s

running (0m26.9s), 224/500 VUs, 396 complete and 0 interrupted iterations
default   [  18% ] 224/500 VUs  0m26.9s/2m30.0s

running (0m27.9s), 232/500 VUs, 428 complete and 0 interrupted iterations
default   [  19% ] 232/500 VUs  0m27.9s/2m30.0s

running (0m28.9s), 241/500 VUs, 460 complete and 0 interrupted iterations
default   [  19% ] 241/500 VUs  0m28.9s/2m30.0s

running (0m29.9s), 249/500 VUs, 496 complete and 0 interrupted iterations
default   [  20% ] 249/500 VUs  0m29.9s/2m30.0s

running (0m30.9s), 257/500 VUs, 535 complete and 0 interrupted iterations
default   [  21% ] 257/500 VUs  0m30.9s/2m30.0s

running (0m31.9s), 266/500 VUs, 575 complete and 0 interrupted iterations
default   [  21% ] 266/500 VUs  0m31.9s/2m30.0s

running (0m32.9s), 274/500 VUs, 618 complete and 0 interrupted iterations
default   [  22% ] 274/500 VUs  0m32.9s/2m30.0s

running (0m33.9s), 282/500 VUs, 660 complete and 0 interrupted iterations
default   [  23% ] 282/500 VUs  0m33.9s/2m30.0s

running (0m34.9s), 290/500 VUs, 700 complete and 0 interrupted iterations
default   [  23% ] 290/500 VUs  0m34.9s/2m30.0s

running (0m35.9s), 299/500 VUs, 742 complete and 0 interrupted iterations
default   [  24% ] 299/500 VUs  0m35.9s/2m30.0s

running (0m36.9s), 307/500 VUs, 790 complete and 0 interrupted iterations
default   [  25% ] 307/500 VUs  0m36.9s/2m30.0s

running (0m37.9s), 315/500 VUs, 840 complete and 0 interrupted iterations
default   [  25% ] 315/500 VUs  0m37.9s/2m30.0s

running (0m38.9s), 324/500 VUs, 889 complete and 0 interrupted iterations
default   [  26% ] 324/500 VUs  0m38.9s/2m30.0s

running (0m39.9s), 332/500 VUs, 941 complete and 0 interrupted iterations
default   [  27% ] 332/500 VUs  0m39.9s/2m30.0s

running (0m40.9s), 340/500 VUs, 990 complete and 0 interrupted iterations
default   [  27% ] 340/500 VUs  0m40.9s/2m30.0s

running (0m41.9s), 349/500 VUs, 1039 complete and 0 interrupted iterations
default   [  28% ] 349/500 VUs  0m41.9s/2m30.0s

running (0m42.9s), 357/500 VUs, 1094 complete and 0 interrupted iterations
default   [  29% ] 357/500 VUs  0m42.9s/2m30.0s

running (0m43.9s), 365/500 VUs, 1152 complete and 0 interrupted iterations
default   [  29% ] 365/500 VUs  0m43.9s/2m30.0s

running (0m44.9s), 374/500 VUs, 1211 complete and 0 interrupted iterations
default   [  30% ] 374/500 VUs  0m44.9s/2m30.0s

running (0m45.9s), 382/500 VUs, 1268 complete and 0 interrupted iterations
default   [  31% ] 382/500 VUs  0m45.9s/2m30.0s

running (0m46.9s), 390/500 VUs, 1325 complete and 0 interrupted iterations
default   [  31% ] 390/500 VUs  0m46.9s/2m30.0s

running (0m47.9s), 399/500 VUs, 1385 complete and 0 interrupted iterations
default   [  32% ] 399/500 VUs  0m47.9s/2m30.0s

running (0m48.9s), 407/500 VUs, 1449 complete and 0 interrupted iterations
default   [  33% ] 407/500 VUs  0m48.9s/2m30.0s

running (0m49.9s), 415/500 VUs, 1515 complete and 0 interrupted iterations
default   [  33% ] 415/500 VUs  0m49.9s/2m30.0s

running (0m50.9s), 424/500 VUs, 1581 complete and 0 interrupted iterations
default   [  34% ] 424/500 VUs  0m50.9s/2m30.0s

running (0m51.9s), 432/500 VUs, 1648 complete and 0 interrupted iterations
default   [  35% ] 432/500 VUs  0m51.9s/2m30.0s

running (0m52.9s), 440/500 VUs, 1714 complete and 0 interrupted iterations
default   [  35% ] 440/500 VUs  0m52.9s/2m30.0s

running (0m53.9s), 448/500 VUs, 1780 complete and 0 interrupted iterations
default   [  36% ] 448/500 VUs  0m53.9s/2m30.0s

running (0m54.9s), 457/500 VUs, 1853 complete and 0 interrupted iterations
default   [  37% ] 457/500 VUs  0m54.9s/2m30.0s

running (0m55.9s), 465/500 VUs, 1925 complete and 0 interrupted iterations
default   [  37% ] 465/500 VUs  0m55.9s/2m30.0s

running (0m56.9s), 473/500 VUs, 1995 complete and 0 interrupted iterations
default   [  38% ] 473/500 VUs  0m56.9s/2m30.0s

running (0m57.9s), 482/500 VUs, 2072 complete and 0 interrupted iterations
default   [  39% ] 482/500 VUs  0m57.9s/2m30.0s

running (0m58.9s), 490/500 VUs, 2128 complete and 0 interrupted iterations
default   [  39% ] 490/500 VUs  0m58.9s/2m30.0s

running (1m00.3s), 500/500 VUs, 2211 complete and 0 interrupted iterations
default   [  40% ] 500/500 VUs  1m00.3s/2m30.0s

running (1m00.9s), 500/500 VUs, 2270 complete and 0 interrupted iterations
default   [  41% ] 500/500 VUs  1m00.9s/2m30.0s

running (1m01.9s), 500/500 VUs, 2349 complete and 0 interrupted iterations
default   [  41% ] 500/500 VUs  1m01.9s/2m30.0s

running (1m02.9s), 500/500 VUs, 2421 complete and 0 interrupted iterations
default   [  42% ] 500/500 VUs  1m02.9s/2m30.0s

running (1m03.9s), 500/500 VUs, 2487 complete and 0 interrupted iterations
default   [  43% ] 500/500 VUs  1m03.9s/2m30.0s

running (1m04.9s), 500/500 VUs, 2566 complete and 0 interrupted iterations
default   [  43% ] 500/500 VUs  1m04.9s/2m30.0s

running (1m05.9s), 500/500 VUs, 2650 complete and 0 interrupted iterations
default   [  44% ] 500/500 VUs  1m05.9s/2m30.0s

running (1m06.9s), 500/500 VUs, 2706 complete and 0 interrupted iterations
default   [  45% ] 500/500 VUs  1m06.9s/2m30.0s

running (1m07.9s), 500/500 VUs, 2806 complete and 0 interrupted iterations
default   [  45% ] 500/500 VUs  1m07.9s/2m30.0s

running (1m08.9s), 500/500 VUs, 2877 complete and 0 interrupted iterations
default   [  46% ] 500/500 VUs  1m08.9s/2m30.0s

running (1m09.9s), 500/500 VUs, 2939 complete and 0 interrupted iterations
default   [  47% ] 500/500 VUs  1m09.9s/2m30.0s

running (1m10.9s), 500/500 VUs, 3025 complete and 0 interrupted iterations
default   [  47% ] 500/500 VUs  1m10.9s/2m30.0s

running (1m11.9s), 500/500 VUs, 3088 complete and 0 interrupted iterations
default   [  48% ] 500/500 VUs  1m11.9s/2m30.0s

running (1m13.0s), 500/500 VUs, 3173 complete and 0 interrupted iterations
default   [  49% ] 500/500 VUs  1m13.0s/2m30.0s

running (1m13.9s), 500/500 VUs, 3225 complete and 0 interrupted iterations
default   [  49% ] 500/500 VUs  1m13.9s/2m30.0s

running (1m14.9s), 500/500 VUs, 3307 complete and 0 interrupted iterations
default   [  50% ] 500/500 VUs  1m14.9s/2m30.0s

running (1m15.9s), 500/500 VUs, 3414 complete and 0 interrupted iterations
default   [  51% ] 500/500 VUs  1m15.9s/2m30.0s

running (1m16.9s), 500/500 VUs, 3473 complete and 0 interrupted iterations
default   [  51% ] 500/500 VUs  1m16.9s/2m30.0s

running (1m17.9s), 500/500 VUs, 3539 complete and 0 interrupted iterations
default   [  52% ] 500/500 VUs  1m17.9s/2m30.0s

running (1m18.9s), 500/500 VUs, 3619 complete and 0 interrupted iterations
default   [  53% ] 500/500 VUs  1m18.9s/2m30.0s

running (1m19.9s), 500/500 VUs, 3678 complete and 0 interrupted iterations
default   [  53% ] 500/500 VUs  1m19.9s/2m30.0s

running (1m20.9s), 500/500 VUs, 3753 complete and 0 interrupted iterations
default   [  54% ] 500/500 VUs  1m20.9s/2m30.0s

running (1m21.9s), 500/500 VUs, 3831 complete and 0 interrupted iterations
default   [  55% ] 500/500 VUs  1m21.9s/2m30.0s

running (1m22.9s), 500/500 VUs, 3934 complete and 0 interrupted iterations
default   [  55% ] 500/500 VUs  1m22.9s/2m30.0s

running (1m23.9s), 500/500 VUs, 4001 complete and 0 interrupted iterations
default   [  56% ] 500/500 VUs  1m23.9s/2m30.0s

running (1m24.9s), 500/500 VUs, 4060 complete and 0 interrupted iterations
default   [  57% ] 500/500 VUs  1m24.9s/2m30.0s

running (1m26.0s), 500/500 VUs, 4166 complete and 0 interrupted iterations
default   [  57% ] 500/500 VUs  1m26.0s/2m30.0s

running (1m26.9s), 500/500 VUs, 4223 complete and 0 interrupted iterations
default   [  58% ] 500/500 VUs  1m26.9s/2m30.0s

running (1m27.9s), 500/500 VUs, 4286 complete and 0 interrupted iterations
default   [  59% ] 500/500 VUs  1m27.9s/2m30.0s

running (1m28.9s), 500/500 VUs, 4364 complete and 0 interrupted iterations
default   [  59% ] 500/500 VUs  1m28.9s/2m30.0s

running (1m29.9s), 500/500 VUs, 4454 complete and 0 interrupted iterations
default   [  60% ] 500/500 VUs  1m29.9s/2m30.0s

running (1m30.9s), 500/500 VUs, 4533 complete and 0 interrupted iterations
default   [  61% ] 500/500 VUs  1m30.9s/2m30.0s

running (1m31.9s), 500/500 VUs, 4597 complete and 0 interrupted iterations
default   [  61% ] 500/500 VUs  1m31.9s/2m30.0s

running (1m32.9s), 500/500 VUs, 4676 complete and 0 interrupted iterations
default   [  62% ] 500/500 VUs  1m32.9s/2m30.0s

running (1m33.9s), 500/500 VUs, 4762 complete and 0 interrupted iterations
default   [  63% ] 500/500 VUs  1m33.9s/2m30.0s

running (1m34.9s), 500/500 VUs, 4825 complete and 0 interrupted iterations
default   [  63% ] 500/500 VUs  1m34.9s/2m30.0s

running (1m35.9s), 500/500 VUs, 4898 complete and 0 interrupted iterations
default   [  64% ] 500/500 VUs  1m35.9s/2m30.0s

running (1m36.9s), 500/500 VUs, 5000 complete and 0 interrupted iterations
default   [  65% ] 500/500 VUs  1m36.9s/2m30.0s

running (1m37.9s), 500/500 VUs, 5061 complete and 0 interrupted iterations
default   [  65% ] 500/500 VUs  1m37.9s/2m30.0s

running (1m38.9s), 500/500 VUs, 5149 complete and 0 interrupted iterations
default   [  66% ] 500/500 VUs  1m38.9s/2m30.0s

running (1m39.9s), 500/500 VUs, 5252 complete and 0 interrupted iterations
default   [  67% ] 500/500 VUs  1m39.9s/2m30.0s

running (1m40.9s), 500/500 VUs, 5307 complete and 0 interrupted iterations
default   [  67% ] 500/500 VUs  1m40.9s/2m30.0s

running (1m41.9s), 500/500 VUs, 5382 complete and 0 interrupted iterations
default   [  68% ] 500/500 VUs  1m41.9s/2m30.0s

running (1m42.9s), 500/500 VUs, 5463 complete and 0 interrupted iterations
default   [  69% ] 500/500 VUs  1m42.9s/2m30.0s

running (1m43.9s), 500/500 VUs, 5525 complete and 0 interrupted iterations
default   [  69% ] 500/500 VUs  1m43.9s/2m30.0s

running (1m44.9s), 500/500 VUs, 5609 complete and 0 interrupted iterations
default   [  70% ] 500/500 VUs  1m44.9s/2m30.0s

running (1m45.9s), 500/500 VUs, 5713 complete and 0 interrupted iterations
default   [  71% ] 500/500 VUs  1m45.9s/2m30.0s

running (1m46.9s), 500/500 VUs, 5779 complete and 0 interrupted iterations
default   [  71% ] 500/500 VUs  1m46.9s/2m30.0s

running (1m47.9s), 500/500 VUs, 5837 complete and 0 interrupted iterations
default   [  72% ] 500/500 VUs  1m47.9s/2m30.0s

running (1m48.9s), 500/500 VUs, 5926 complete and 0 interrupted iterations
default   [  73% ] 500/500 VUs  1m48.9s/2m30.0s

running (1m49.9s), 500/500 VUs, 6010 complete and 0 interrupted iterations
default   [  73% ] 500/500 VUs  1m49.9s/2m30.0s

running (1m50.9s), 500/500 VUs, 6093 complete and 0 interrupted iterations
default   [  74% ] 500/500 VUs  1m50.9s/2m30.0s

running (1m51.9s), 500/500 VUs, 6152 complete and 0 interrupted iterations
default   [  75% ] 500/500 VUs  1m51.9s/2m30.0s

running (1m53.1s), 500/500 VUs, 6234 complete and 0 interrupted iterations
default   [  75% ] 500/500 VUs  1m53.1s/2m30.0s

running (1m53.9s), 500/500 VUs, 6314 complete and 0 interrupted iterations
default   [  76% ] 500/500 VUs  1m53.9s/2m30.0s

running (1m54.9s), 500/500 VUs, 6376 complete and 0 interrupted iterations
default   [  77% ] 500/500 VUs  1m54.9s/2m30.0s

running (1m55.9s), 500/500 VUs, 6456 complete and 0 interrupted iterations
default   [  77% ] 500/500 VUs  1m55.9s/2m30.0s

running (1m56.9s), 500/500 VUs, 6530 complete and 0 interrupted iterations
default   [  78% ] 500/500 VUs  1m56.9s/2m30.0s

running (1m57.9s), 500/500 VUs, 6602 complete and 0 interrupted iterations
default   [  79% ] 500/500 VUs  1m57.9s/2m30.0s

running (1m58.9s), 500/500 VUs, 6702 complete and 0 interrupted iterations
default   [  79% ] 500/500 VUs  1m58.9s/2m30.0s

running (1m59.9s), 500/500 VUs, 6737 complete and 0 interrupted iterations
default   [  80% ] 500/500 VUs  1m59.9s/2m30.0s

running (2m00.9s), 499/500 VUs, 6831 complete and 0 interrupted iterations
default   [  81% ] 499/500 VUs  2m00.9s/2m30.0s

running (2m02.2s), 498/500 VUs, 6930 complete and 0 interrupted iterations
default   [  81% ] 498/500 VUs  2m02.2s/2m30.0s

running (2m02.9s), 489/500 VUs, 6974 complete and 0 interrupted iterations
default   [  82% ] 489/500 VUs  2m02.9s/2m30.0s

running (2m03.9s), 477/500 VUs, 7071 complete and 0 interrupted iterations
default   [  83% ] 477/500 VUs  2m03.9s/2m30.0s

running (2m05.0s), 461/500 VUs, 7141 complete and 0 interrupted iterations
default   [  83% ] 461/500 VUs  2m05.0s/2m30.0s

running (2m05.9s), 457/500 VUs, 7195 complete and 0 interrupted iterations
default   [  84% ] 457/500 VUs  2m05.9s/2m30.0s

running (2m06.9s), 448/500 VUs, 7263 complete and 0 interrupted iterations
default   [  85% ] 448/500 VUs  2m06.9s/2m30.0s

running (2m07.9s), 428/500 VUs, 7371 complete and 0 interrupted iterations
default   [  85% ] 428/500 VUs  2m07.9s/2m30.0s

running (2m08.9s), 408/500 VUs, 7442 complete and 0 interrupted iterations
default   [  86% ] 408/500 VUs  2m08.9s/2m30.0s

running (2m09.9s), 399/500 VUs, 7481 complete and 0 interrupted iterations
default   [  87% ] 399/500 VUs  2m09.9s/2m30.0s

running (2m10.9s), 376/500 VUs, 7563 complete and 0 interrupted iterations
default   [  87% ] 376/500 VUs  2m10.9s/2m30.0s

running (2m11.9s), 354/500 VUs, 7646 complete and 0 interrupted iterations
default   [  88% ] 354/500 VUs  2m11.9s/2m30.0s

running (2m12.9s), 337/500 VUs, 7708 complete and 0 interrupted iterations
default   [  89% ] 337/500 VUs  2m12.9s/2m30.0s

running (2m13.9s), 327/500 VUs, 7758 complete and 0 interrupted iterations
default   [  89% ] 327/500 VUs  2m13.9s/2m30.0s

running (2m14.9s), 307/500 VUs, 7835 complete and 0 interrupted iterations
default   [  90% ] 307/500 VUs  2m14.9s/2m30.0s

running (2m15.9s), 291/500 VUs, 7877 complete and 0 interrupted iterations
default   [  91% ] 291/500 VUs  2m15.9s/2m30.0s

running (2m16.9s), 272/500 VUs, 7939 complete and 0 interrupted iterations
default   [  91% ] 272/500 VUs  2m16.9s/2m30.0s

running (2m17.9s), 253/500 VUs, 7998 complete and 0 interrupted iterations
default   [  92% ] 253/500 VUs  2m17.9s/2m30.0s

running (2m18.9s), 235/500 VUs, 8045 complete and 0 interrupted iterations
default   [  93% ] 235/500 VUs  2m18.9s/2m30.0s

running (2m19.9s), 224/500 VUs, 8078 complete and 0 interrupted iterations
default   [  93% ] 224/500 VUs  2m19.9s/2m30.0s

running (2m20.9s), 201/500 VUs, 8142 complete and 0 interrupted iterations
default   [  94% ] 201/500 VUs  2m20.9s/2m30.0s

running (2m21.9s), 193/500 VUs, 8168 complete and 0 interrupted iterations
default   [  95% ] 193/500 VUs  2m21.9s/2m30.0s

running (2m22.9s), 173/500 VUs, 8211 complete and 0 interrupted iterations
default   [  95% ] 173/500 VUs  2m22.9s/2m30.0s

running (2m23.9s), 153/500 VUs, 8251 complete and 0 interrupted iterations
default   [  96% ] 153/500 VUs  2m23.9s/2m30.0s

running (2m24.9s), 135/500 VUs, 8279 complete and 0 interrupted iterations
default   [  97% ] 135/500 VUs  2m24.9s/2m30.0s

running (2m25.9s), 121/500 VUs, 8301 complete and 0 interrupted iterations
default   [  97% ] 121/500 VUs  2m25.9s/2m30.0s

running (2m26.9s), 100/500 VUs, 8343 complete and 0 interrupted iterations
default   [  98% ] 100/500 VUs  2m26.9s/2m30.0s

running (2m27.9s), 087/500 VUs, 8361 complete and 0 interrupted iterations
default   [  99% ] 087/500 VUs  2m27.9s/2m30.0s

running (2m28.9s), 072/500 VUs, 8384 complete and 0 interrupted iterations
default   [  99% ] 072/500 VUs  2m28.9s/2m30.0s

running (2m29.9s), 052/500 VUs, 8404 complete and 0 interrupted iterations
default   [ 100% ] 052/500 VUs  2m29.9s/2m30.0s

running (2m30.9s), 042/500 VUs, 8414 complete and 0 interrupted iterations
default ↓ [ 100% ] 051/500 VUs  2m30s

running (2m31.9s), 035/500 VUs, 8421 complete and 0 interrupted iterations
default ↓ [ 100% ] 051/500 VUs  2m30s

running (2m32.9s), 014/500 VUs, 8442 complete and 0 interrupted iterations
default ↓ [ 100% ] 051/500 VUs  2m30s

running (2m33.9s), 008/500 VUs, 8448 complete and 0 interrupted iterations
default ↓ [ 100% ] 051/500 VUs  2m30s


  █ THRESHOLDS 

    active_clients_time
    ✓ 'p(95)<500' p(95)=91ms

    attach_documents_time
    ✓ 'p(95)<10000' p(95)=370ms

    deactivate_clients_time
    ✓ 'p(95)<10000' p(95)=90.25ms

    http_req_duration
    ✓ 'p(95)<10000' p(95)=177.31ms

    pushpulls_time
    ✓ 'p(95)<1000' p(95)=191ms

    transaction_success_rate
    ✓ 'rate>0.99' rate=100.00%

    transaction_time
    ✓ 'p(95)<30000' p(95)=7.02s


  █ TOTAL RESULTS 

    checks_total.......: 135296  876.44126/s
    checks_succeeded...: 100.00% 135296 out of 135296
    checks_failed......: 0.00%   0 out of 135296

    ✓ status is 200
    ✓ response has valid body

    CUSTOM
    active_clients....................: 8456    54.777579/s
    active_clients_success_rate.......: 100.00% 8456 out of 8456
    active_clients_time...............: avg=20.02ms min=0s       med=4ms    max=536ms p(90)=60ms     p(95)=91ms    
    attach_documents..................: 8456    54.777579/s
    attach_documents_success_rate.....: 100.00% 8456 out of 8456
    attach_documents_time.............: avg=87.34ms min=3ms      med=21ms   max=1.07s p(90)=267ms    p(95)=370ms   
    deactivate_clients................: 8456    54.777579/s
    deactivate_clients_success_rate...: 100.00% 8456 out of 8456
    deactivate_clients_time...........: avg=19.37ms min=0s       med=2ms    max=922ms p(90)=53ms     p(95)=90.25ms 
    pushpulls.........................: 42280   273.887894/s
    pushpulls_success_rate............: 100.00% 42280 out of 42280
    pushpulls_time....................: avg=43.15ms min=1ms      med=13ms   max=979ms p(90)=123ms    p(95)=191ms   
    transaction_success_rate..........: 100.00% 8456 out of 8456
    transaction_time..................: avg=6.39s   min=6.01s    med=6.35s  max=8.15s p(90)=6.86s    p(95)=7.02s   

    HTTP
    http_req_duration.................: avg=37.03ms min=194.65µs med=7.15ms max=1.07s p(90)=111.49ms p(95)=177.31ms
      { expected_response:true }......: avg=37.03ms min=194.65µs med=7.15ms max=1.07s p(90)=111.49ms p(95)=177.31ms
    http_req_failed...................: 0.00%   0 out of 67648
    http_reqs.........................: 67648   438.22063/s

    EXECUTION
    iteration_duration................: avg=6.39s   min=6.01s    med=6.35s  max=8.15s p(90)=6.86s    p(95)=7.02s   
    iterations........................: 8456    54.777579/s
    vus...............................: 8       min=8              max=500
    vus_max...........................: 500     min=500            max=500

    NETWORK
    data_received.....................: 1.2 GB  8.0 MB/s
    data_sent.........................: 64 MB   412 kB/s




running (2m34.4s), 000/500 VUs, 8456 complete and 0 interrupted iterations
default ✓ [ 100% ] 000/500 VUs  2m30s
