
         /\      Grafana   /‾‾/  
    /\  /  \     |\  __   /  /   
   /  \/    \    | |/ /  /   ‾‾\ 
  /          \   |   (  |  (‾)  |
 / __________ \  |_|\_\  \_____/ 

     execution: local
        script: test/k6/presence.ts
        output: -

     scenarios: (100.00%) 1 scenario, 500 max VUs, 3m0s max duration (incl. graceful stop):
              * default: Up to 500 looping VUs for 2m30s over 3 stages (gracefulRampDown: 30s, gracefulStop: 30s)


running (0m00.9s), 008/500 VUs, 0 complete and 0 interrupted iterations
default   [   1% ] 008/500 VUs  0m00.9s/2m30.0s

running (0m01.9s), 016/500 VUs, 0 complete and 0 interrupted iterations
default   [   1% ] 016/500 VUs  0m01.9s/2m30.0s

running (0m02.9s), 024/500 VUs, 0 complete and 0 interrupted iterations
default   [   2% ] 024/500 VUs  0m02.9s/2m30.0s

running (0m03.9s), 033/500 VUs, 0 complete and 0 interrupted iterations
default   [   3% ] 033/500 VUs  0m03.9s/2m30.0s

running (0m04.9s), 041/500 VUs, 0 complete and 0 interrupted iterations
default   [   3% ] 041/500 VUs  0m04.9s/2m30.0s

running (0m05.9s), 049/500 VUs, 0 complete and 0 interrupted iterations
default   [   4% ] 049/500 VUs  0m05.9s/2m30.0s

running (0m06.9s), 058/500 VUs, 8 complete and 0 interrupted iterations
default   [   5% ] 058/500 VUs  0m06.9s/2m30.0s

running (0m07.9s), 066/500 VUs, 16 complete and 0 interrupted iterations
default   [   5% ] 066/500 VUs  0m07.9s/2m30.0s

running (0m08.9s), 074/500 VUs, 24 complete and 0 interrupted iterations
default   [   6% ] 074/500 VUs  0m08.9s/2m30.0s

running (0m09.9s), 083/500 VUs, 33 complete and 0 interrupted iterations
default   [   7% ] 083/500 VUs  0m09.9s/2m30.0s

running (0m10.9s), 091/500 VUs, 41 complete and 0 interrupted iterations
default   [   7% ] 091/500 VUs  0m10.9s/2m30.0s

running (0m11.9s), 099/500 VUs, 49 complete and 0 interrupted iterations
default   [   8% ] 099/500 VUs  0m11.9s/2m30.0s

running (0m12.9s), 108/500 VUs, 66 complete and 0 interrupted iterations
default   [   9% ] 108/500 VUs  0m12.9s/2m30.0s

running (0m13.9s), 116/500 VUs, 82 complete and 0 interrupted iterations
default   [   9% ] 116/500 VUs  0m13.9s/2m30.0s

running (0m14.9s), 124/500 VUs, 98 complete and 0 interrupted iterations
default   [  10% ] 124/500 VUs  0m14.9s/2m30.0s

running (0m15.9s), 133/500 VUs, 115 complete and 0 interrupted iterations
default   [  11% ] 133/500 VUs  0m15.9s/2m30.0s

running (0m16.9s), 141/500 VUs, 132 complete and 0 interrupted iterations
default   [  11% ] 141/500 VUs  0m16.9s/2m30.0s

running (0m17.9s), 149/500 VUs, 148 complete and 0 interrupted iterations
default   [  12% ] 149/500 VUs  0m17.9s/2m30.0s

running (0m18.9s), 158/500 VUs, 171 complete and 0 interrupted iterations
default   [  13% ] 158/500 VUs  0m18.9s/2m30.0s

running (0m19.9s), 166/500 VUs, 198 complete and 0 interrupted iterations
default   [  13% ] 166/500 VUs  0m19.9s/2m30.0s

running (0m20.9s), 174/500 VUs, 222 complete and 0 interrupted iterations
default   [  14% ] 174/500 VUs  0m20.9s/2m30.0s

running (0m21.9s), 182/500 VUs, 246 complete and 0 interrupted iterations
default   [  15% ] 182/500 VUs  0m21.9s/2m30.0s

running (0m22.9s), 191/500 VUs, 273 complete and 0 interrupted iterations
default   [  15% ] 191/500 VUs  0m22.9s/2m30.0s

running (0m23.9s), 199/500 VUs, 297 complete and 0 interrupted iterations
default   [  16% ] 199/500 VUs  0m23.9s/2m30.0s

running (0m24.9s), 207/500 VUs, 328 complete and 0 interrupted iterations
default   [  17% ] 207/500 VUs  0m24.9s/2m30.0s

running (0m25.9s), 216/500 VUs, 362 complete and 0 interrupted iterations
default   [  17% ] 216/500 VUs  0m25.9s/2m30.0s

running (0m26.9s), 224/500 VUs, 396 complete and 0 interrupted iterations
default   [  18% ] 224/500 VUs  0m26.9s/2m30.0s

running (0m27.9s), 232/500 VUs, 428 complete and 0 interrupted iterations
default   [  19% ] 232/500 VUs  0m27.9s/2m30.0s

running (0m28.9s), 241/500 VUs, 461 complete and 0 interrupted iterations
default   [  19% ] 241/500 VUs  0m28.9s/2m30.0s

running (0m29.9s), 249/500 VUs, 496 complete and 0 interrupted iterations
default   [  20% ] 249/500 VUs  0m29.9s/2m30.0s

running (0m30.9s), 257/500 VUs, 535 complete and 0 interrupted iterations
default   [  21% ] 257/500 VUs  0m30.9s/2m30.0s

running (0m31.9s), 266/500 VUs, 576 complete and 0 interrupted iterations
default   [  21% ] 266/500 VUs  0m31.9s/2m30.0s

running (0m32.9s), 274/500 VUs, 618 complete and 0 interrupted iterations
default   [  22% ] 274/500 VUs  0m32.9s/2m30.0s

running (0m33.9s), 282/500 VUs, 660 complete and 0 interrupted iterations
default   [  23% ] 282/500 VUs  0m33.9s/2m30.0s

running (0m34.9s), 291/500 VUs, 701 complete and 0 interrupted iterations
default   [  23% ] 291/500 VUs  0m34.9s/2m30.0s

running (0m35.9s), 299/500 VUs, 743 complete and 0 interrupted iterations
default   [  24% ] 299/500 VUs  0m35.9s/2m30.0s

running (0m36.9s), 307/500 VUs, 792 complete and 0 interrupted iterations
default   [  25% ] 307/500 VUs  0m36.9s/2m30.0s

running (0m37.9s), 316/500 VUs, 840 complete and 0 interrupted iterations
default   [  25% ] 316/500 VUs  0m37.9s/2m30.0s

running (0m38.9s), 324/500 VUs, 890 complete and 0 interrupted iterations
default   [  26% ] 324/500 VUs  0m38.9s/2m30.0s

running (0m39.9s), 332/500 VUs, 940 complete and 0 interrupted iterations
default   [  27% ] 332/500 VUs  0m39.9s/2m30.0s

running (0m40.9s), 341/500 VUs, 989 complete and 0 interrupted iterations
default   [  27% ] 341/500 VUs  0m40.9s/2m30.0s

running (0m41.9s), 349/500 VUs, 1039 complete and 0 interrupted iterations
default   [  28% ] 349/500 VUs  0m41.9s/2m30.0s

running (0m42.9s), 357/500 VUs, 1094 complete and 0 interrupted iterations
default   [  29% ] 357/500 VUs  0m42.9s/2m30.0s

running (0m43.9s), 365/500 VUs, 1153 complete and 0 interrupted iterations
default   [  29% ] 365/500 VUs  0m43.9s/2m30.0s

running (0m44.9s), 374/500 VUs, 1210 complete and 0 interrupted iterations
default   [  30% ] 374/500 VUs  0m44.9s/2m30.0s

running (0m45.9s), 382/500 VUs, 1268 complete and 0 interrupted iterations
default   [  31% ] 382/500 VUs  0m45.9s/2m30.0s

running (0m46.9s), 390/500 VUs, 1324 complete and 0 interrupted iterations
default   [  31% ] 390/500 VUs  0m46.9s/2m30.0s

running (0m47.9s), 399/500 VUs, 1382 complete and 0 interrupted iterations
default   [  32% ] 399/500 VUs  0m47.9s/2m30.0s

running (0m48.9s), 407/500 VUs, 1447 complete and 0 interrupted iterations
default   [  33% ] 407/500 VUs  0m48.9s/2m30.0s

running (0m49.9s), 415/500 VUs, 1514 complete and 0 interrupted iterations
default   [  33% ] 415/500 VUs  0m49.9s/2m30.0s

running (0m50.9s), 424/500 VUs, 1580 complete and 0 interrupted iterations
default   [  34% ] 424/500 VUs  0m50.9s/2m30.0s

running (0m51.9s), 432/500 VUs, 1644 complete and 0 interrupted iterations
default   [  35% ] 432/500 VUs  0m51.9s/2m30.0s

running (0m52.9s), 440/500 VUs, 1705 complete and 0 interrupted iterations
default   [  35% ] 440/500 VUs  0m52.9s/2m30.0s

running (0m53.9s), 449/500 VUs, 1776 complete and 0 interrupted iterations
default   [  36% ] 449/500 VUs  0m53.9s/2m30.0s

running (0m54.9s), 457/500 VUs, 1848 complete and 0 interrupted iterations
default   [  37% ] 457/500 VUs  0m54.9s/2m30.0s

running (0m55.9s), 465/500 VUs, 1908 complete and 0 interrupted iterations
default   [  37% ] 465/500 VUs  0m55.9s/2m30.0s

running (0m56.9s), 474/500 VUs, 1980 complete and 0 interrupted iterations
default   [  38% ] 474/500 VUs  0m56.9s/2m30.0s

running (0m57.9s), 482/500 VUs, 2057 complete and 0 interrupted iterations
default   [  39% ] 482/500 VUs  0m57.9s/2m30.0s

running (0m58.9s), 490/500 VUs, 2128 complete and 0 interrupted iterations
default   [  39% ] 490/500 VUs  0m58.9s/2m30.0s

running (1m00.0s), 499/500 VUs, 2183 complete and 0 interrupted iterations
default   [  40% ] 499/500 VUs  1m00.0s/2m30.0s

running (1m00.9s), 500/500 VUs, 2253 complete and 0 interrupted iterations
default   [  41% ] 500/500 VUs  1m00.9s/2m30.0s

running (1m01.9s), 500/500 VUs, 2329 complete and 0 interrupted iterations
default   [  41% ] 500/500 VUs  1m01.9s/2m30.0s

running (1m02.9s), 500/500 VUs, 2408 complete and 0 interrupted iterations
default   [  42% ] 500/500 VUs  1m02.9s/2m30.0s

running (1m03.9s), 500/500 VUs, 2464 complete and 0 interrupted iterations
default   [  43% ] 500/500 VUs  1m03.9s/2m30.0s

running (1m04.9s), 500/500 VUs, 2553 complete and 0 interrupted iterations
default   [  43% ] 500/500 VUs  1m04.9s/2m30.0s

running (1m05.9s), 500/500 VUs, 2633 complete and 0 interrupted iterations
default   [  44% ] 500/500 VUs  1m05.9s/2m30.0s

running (1m06.9s), 500/500 VUs, 2675 complete and 0 interrupted iterations
default   [  45% ] 500/500 VUs  1m06.9s/2m30.0s

running (1m07.9s), 500/500 VUs, 2766 complete and 0 interrupted iterations
default   [  45% ] 500/500 VUs  1m07.9s/2m30.0s

running (1m08.9s), 500/500 VUs, 2848 complete and 0 interrupted iterations
default   [  46% ] 500/500 VUs  1m08.9s/2m30.0s

running (1m09.9s), 500/500 VUs, 2893 complete and 0 interrupted iterations
default   [  47% ] 500/500 VUs  1m09.9s/2m30.0s

running (1m10.9s), 500/500 VUs, 2975 complete and 0 interrupted iterations
default   [  47% ] 500/500 VUs  1m10.9s/2m30.0s

running (1m11.9s), 500/500 VUs, 3058 complete and 0 interrupted iterations
default   [  48% ] 500/500 VUs  1m11.9s/2m30.0s

running (1m12.9s), 500/500 VUs, 3152 complete and 0 interrupted iterations
default   [  49% ] 500/500 VUs  1m12.9s/2m30.0s

running (1m13.9s), 500/500 VUs, 3193 complete and 0 interrupted iterations
default   [  49% ] 500/500 VUs  1m13.9s/2m30.0s

running (1m14.9s), 500/500 VUs, 3275 complete and 0 interrupted iterations
default   [  50% ] 500/500 VUs  1m14.9s/2m30.0s

running (1m15.9s), 500/500 VUs, 3365 complete and 0 interrupted iterations
default   [  51% ] 500/500 VUs  1m15.9s/2m30.0s

running (1m16.9s), 500/500 VUs, 3453 complete and 0 interrupted iterations
default   [  51% ] 500/500 VUs  1m16.9s/2m30.0s

running (1m17.9s), 500/500 VUs, 3512 complete and 0 interrupted iterations
default   [  52% ] 500/500 VUs  1m17.9s/2m30.0s

running (1m18.9s), 500/500 VUs, 3565 complete and 0 interrupted iterations
default   [  53% ] 500/500 VUs  1m18.9s/2m30.0s

running (1m19.9s), 500/500 VUs, 3660 complete and 0 interrupted iterations
default   [  53% ] 500/500 VUs  1m19.9s/2m30.0s

running (1m20.9s), 500/500 VUs, 3760 complete and 0 interrupted iterations
default   [  54% ] 500/500 VUs  1m20.9s/2m30.0s

running (1m21.9s), 500/500 VUs, 3812 complete and 0 interrupted iterations
default   [  55% ] 500/500 VUs  1m21.9s/2m30.0s

running (1m22.9s), 500/500 VUs, 3869 complete and 0 interrupted iterations
default   [  55% ] 500/500 VUs  1m22.9s/2m30.0s

running (1m23.9s), 500/500 VUs, 3955 complete and 0 interrupted iterations
default   [  56% ] 500/500 VUs  1m23.9s/2m30.0s

running (1m24.9s), 500/500 VUs, 4022 complete and 0 interrupted iterations
default   [  57% ] 500/500 VUs  1m24.9s/2m30.0s

running (1m25.9s), 500/500 VUs, 4072 complete and 0 interrupted iterations
default   [  57% ] 500/500 VUs  1m25.9s/2m30.0s

running (1m26.9s), 500/500 VUs, 4171 complete and 0 interrupted iterations
default   [  58% ] 500/500 VUs  1m26.9s/2m30.0s

running (1m27.9s), 500/500 VUs, 4239 complete and 0 interrupted iterations
default   [  59% ] 500/500 VUs  1m27.9s/2m30.0s

running (1m28.9s), 500/500 VUs, 4324 complete and 0 interrupted iterations
default   [  59% ] 500/500 VUs  1m28.9s/2m30.0s

running (1m29.9s), 500/500 VUs, 4387 complete and 0 interrupted iterations
default   [  60% ] 500/500 VUs  1m29.9s/2m30.0s

running (1m30.9s), 500/500 VUs, 4454 complete and 0 interrupted iterations
default   [  61% ] 500/500 VUs  1m30.9s/2m30.0s

running (1m31.9s), 500/500 VUs, 4547 complete and 0 interrupted iterations
default   [  61% ] 500/500 VUs  1m31.9s/2m30.0s

running (1m32.9s), 500/500 VUs, 4618 complete and 0 interrupted iterations
default   [  62% ] 500/500 VUs  1m32.9s/2m30.0s

running (1m33.9s), 500/500 VUs, 4690 complete and 0 interrupted iterations
default   [  63% ] 500/500 VUs  1m33.9s/2m30.0s

running (1m34.9s), 500/500 VUs, 4781 complete and 0 interrupted iterations
default   [  63% ] 500/500 VUs  1m34.9s/2m30.0s

running (1m35.9s), 500/500 VUs, 4864 complete and 0 interrupted iterations
default   [  64% ] 500/500 VUs  1m35.9s/2m30.0s

running (1m36.9s), 500/500 VUs, 4925 complete and 0 interrupted iterations
default   [  65% ] 500/500 VUs  1m36.9s/2m30.0s

running (1m37.9s), 500/500 VUs, 5012 complete and 0 interrupted iterations
default   [  65% ] 500/500 VUs  1m37.9s/2m30.0s

running (1m38.9s), 500/500 VUs, 5087 complete and 0 interrupted iterations
default   [  66% ] 500/500 VUs  1m38.9s/2m30.0s

running (1m39.9s), 500/500 VUs, 5160 complete and 0 interrupted iterations
default   [  67% ] 500/500 VUs  1m39.9s/2m30.0s

running (1m40.9s), 500/500 VUs, 5218 complete and 0 interrupted iterations
default   [  67% ] 500/500 VUs  1m40.9s/2m30.0s

running (1m42.0s), 500/500 VUs, 5309 complete and 0 interrupted iterations
default   [  68% ] 500/500 VUs  1m42.0s/2m30.0s

running (1m42.9s), 500/500 VUs, 5381 complete and 0 interrupted iterations
default   [  69% ] 500/500 VUs  1m42.9s/2m30.0s

running (1m43.9s), 500/500 VUs, 5452 complete and 0 interrupted iterations
default   [  69% ] 500/500 VUs  1m43.9s/2m30.0s

running (1m45.0s), 500/500 VUs, 5531 complete and 0 interrupted iterations
default   [  70% ] 500/500 VUs  1m45.0s/2m30.0s

running (1m45.9s), 500/500 VUs, 5617 complete and 0 interrupted iterations
default   [  71% ] 500/500 VUs  1m45.9s/2m30.0s

running (1m46.9s), 500/500 VUs, 5689 complete and 0 interrupted iterations
default   [  71% ] 500/500 VUs  1m46.9s/2m30.0s

running (1m47.9s), 500/500 VUs, 5758 complete and 0 interrupted iterations
default   [  72% ] 500/500 VUs  1m47.9s/2m30.0s

running (1m48.9s), 500/500 VUs, 5809 complete and 0 interrupted iterations
default   [  73% ] 500/500 VUs  1m48.9s/2m30.0s

running (1m50.0s), 500/500 VUs, 5899 complete and 0 interrupted iterations
default   [  73% ] 500/500 VUs  1m50.0s/2m30.0s

running (1m50.9s), 500/500 VUs, 5983 complete and 0 interrupted iterations
default   [  74% ] 500/500 VUs  1m50.9s/2m30.0s

running (1m51.9s), 500/500 VUs, 6038 complete and 0 interrupted iterations
default   [  75% ] 500/500 VUs  1m51.9s/2m30.0s

running (1m52.9s), 500/500 VUs, 6124 complete and 0 interrupted iterations
default   [  75% ] 500/500 VUs  1m52.9s/2m30.0s

running (1m54.0s), 500/500 VUs, 6205 complete and 0 interrupted iterations
default   [  76% ] 500/500 VUs  1m54.0s/2m30.0s

running (1m54.9s), 500/500 VUs, 6249 complete and 0 interrupted iterations
default   [  77% ] 500/500 VUs  1m54.9s/2m30.0s

running (1m56.0s), 500/500 VUs, 6339 complete and 0 interrupted iterations
default   [  77% ] 500/500 VUs  1m56.0s/2m30.0s

running (1m56.9s), 500/500 VUs, 6411 complete and 0 interrupted iterations
default   [  78% ] 500/500 VUs  1m56.9s/2m30.0s

running (1m57.9s), 500/500 VUs, 6491 complete and 0 interrupted iterations
default   [  79% ] 500/500 VUs  1m57.9s/2m30.0s

running (1m58.9s), 500/500 VUs, 6567 complete and 0 interrupted iterations
default   [  79% ] 500/500 VUs  1m58.9s/2m30.0s

running (1m59.9s), 500/500 VUs, 6635 complete and 0 interrupted iterations
default   [  80% ] 500/500 VUs  1m59.9s/2m30.0s

running (2m00.9s), 498/500 VUs, 6685 complete and 0 interrupted iterations
default   [  81% ] 498/500 VUs  2m00.9s/2m30.0s

running (2m02.1s), 496/500 VUs, 6782 complete and 0 interrupted iterations
default   [  81% ] 496/500 VUs  2m02.1s/2m30.0s

running (2m02.9s), 493/500 VUs, 6826 complete and 0 interrupted iterations
default   [  82% ] 493/500 VUs  2m02.9s/2m30.0s

running (2m03.9s), 484/500 VUs, 6923 complete and 0 interrupted iterations
default   [  83% ] 484/500 VUs  2m03.9s/2m30.0s

running (2m04.9s), 470/500 VUs, 7004 complete and 0 interrupted iterations
default   [  83% ] 470/500 VUs  2m04.9s/2m30.0s

running (2m05.9s), 462/500 VUs, 7066 complete and 0 interrupted iterations
default   [  84% ] 462/500 VUs  2m05.9s/2m30.0s

running (2m06.9s), 437/500 VUs, 7160 complete and 0 interrupted iterations
default   [  85% ] 437/500 VUs  2m06.9s/2m30.0s

running (2m07.9s), 418/500 VUs, 7222 complete and 0 interrupted iterations
default   [  85% ] 418/500 VUs  2m07.9s/2m30.0s

running (2m08.9s), 407/500 VUs, 7287 complete and 0 interrupted iterations
default   [  86% ] 407/500 VUs  2m08.9s/2m30.0s

running (2m09.9s), 391/500 VUs, 7362 complete and 0 interrupted iterations
default   [  87% ] 391/500 VUs  2m09.9s/2m30.0s

running (2m10.9s), 371/500 VUs, 7453 complete and 0 interrupted iterations
default   [  87% ] 371/500 VUs  2m10.9s/2m30.0s

running (2m11.9s), 348/500 VUs, 7523 complete and 0 interrupted iterations
default   [  88% ] 348/500 VUs  2m11.9s/2m30.0s

running (2m12.9s), 332/500 VUs, 7595 complete and 0 interrupted iterations
default   [  89% ] 332/500 VUs  2m12.9s/2m30.0s

running (2m13.9s), 323/500 VUs, 7638 complete and 0 interrupted iterations
default   [  89% ] 323/500 VUs  2m13.9s/2m30.0s

running (2m14.9s), 311/500 VUs, 7688 complete and 0 interrupted iterations
default   [  90% ] 311/500 VUs  2m14.9s/2m30.0s

running (2m15.9s), 287/500 VUs, 7751 complete and 0 interrupted iterations
default   [  91% ] 287/500 VUs  2m15.9s/2m30.0s

running (2m16.9s), 267/500 VUs, 7823 complete and 0 interrupted iterations
default   [  91% ] 267/500 VUs  2m16.9s/2m30.0s

running (2m17.9s), 248/500 VUs, 7871 complete and 0 interrupted iterations
default   [  92% ] 248/500 VUs  2m17.9s/2m30.0s

running (2m18.9s), 235/500 VUs, 7927 complete and 0 interrupted iterations
default   [  93% ] 235/500 VUs  2m18.9s/2m30.0s

running (2m19.9s), 221/500 VUs, 7959 complete and 0 interrupted iterations
default   [  93% ] 221/500 VUs  2m19.9s/2m30.0s

running (2m20.9s), 206/500 VUs, 7994 complete and 0 interrupted iterations
default   [  94% ] 206/500 VUs  2m20.9s/2m30.0s

running (2m21.9s), 188/500 VUs, 8038 complete and 0 interrupted iterations
default   [  95% ] 188/500 VUs  2m21.9s/2m30.0s

running (2m22.9s), 166/500 VUs, 8090 complete and 0 interrupted iterations
default   [  95% ] 166/500 VUs  2m22.9s/2m30.0s

running (2m23.9s), 156/500 VUs, 8119 complete and 0 interrupted iterations
default   [  96% ] 156/500 VUs  2m23.9s/2m30.0s

running (2m24.9s), 132/500 VUs, 8158 complete and 0 interrupted iterations
default   [  97% ] 132/500 VUs  2m24.9s/2m30.0s

running (2m25.9s), 120/500 VUs, 8179 complete and 0 interrupted iterations
default   [  97% ] 120/500 VUs  2m25.9s/2m30.0s

running (2m26.9s), 108/500 VUs, 8198 complete and 0 interrupted iterations
default   [  98% ] 108/500 VUs  2m26.9s/2m30.0s

running (2m27.9s), 089/500 VUs, 8226 complete and 0 interrupted iterations
default   [  99% ] 089/500 VUs  2m27.9s/2m30.0s

running (2m28.9s), 067/500 VUs, 8256 complete and 0 interrupted iterations
default   [  99% ] 067/500 VUs  2m28.9s/2m30.0s

running (2m29.9s), 048/500 VUs, 8275 complete and 0 interrupted iterations
default   [ 100% ] 048/500 VUs  2m29.9s/2m30.0s

running (2m30.9s), 033/500 VUs, 8290 complete and 0 interrupted iterations
default ↓ [ 100% ] 048/500 VUs  2m30s

running (2m31.9s), 024/500 VUs, 8299 complete and 0 interrupted iterations
default ↓ [ 100% ] 048/500 VUs  2m30s

running (2m32.9s), 017/500 VUs, 8306 complete and 0 interrupted iterations
default ↓ [ 100% ] 048/500 VUs  2m30s

running (2m33.9s), 008/500 VUs, 8315 complete and 0 interrupted iterations
default ↓ [ 100% ] 048/500 VUs  2m30s

running (2m34.9s), 000/500 VUs, 8323 complete and 0 interrupted iterations
default ✓ [ 100% ] 000/500 VUs  2m30s


  █ THRESHOLDS 

    active_clients_time
    ✓ 'p(95)<500' p(95)=126ms

    attach_documents_time
    ✓ 'p(95)<10000' p(95)=462ms

    deactivate_clients_time
    ✓ 'p(95)<10000' p(95)=111ms

    http_req_duration
    ✓ 'p(95)<10000' p(95)=219.43ms

    pushpulls_time
    ✓ 'p(95)<1000' p(95)=221ms

    transaction_success_rate
    ✓ 'rate>0.99' rate=100.00%

    transaction_time
    ✓ 'p(95)<30000' p(95)=7.22s


  █ TOTAL RESULTS 

    checks_total.......: 133168  859.920192/s
    checks_succeeded...: 100.00% 133168 out of 133168
    checks_failed......: 0.00%   0 out of 133168

    ✓ status is 200
    ✓ response has valid body

    CUSTOM
    active_clients....................: 8323    53.745012/s
    active_clients_success_rate.......: 100.00% 8323 out of 8323
    active_clients_time...............: avg=28.04ms  min=1ms     med=6ms     max=529ms    p(90)=88ms     p(95)=126ms   
    attach_documents..................: 8323    53.745012/s
    attach_documents_success_rate.....: 100.00% 8323 out of 8323
    attach_documents_time.............: avg=111.38ms min=3ms     med=27ms    max=823ms    p(90)=361ms    p(95)=462ms   
    deactivate_clients................: 8323    53.745012/s
    deactivate_clients_success_rate...: 100.00% 8323 out of 8323
    deactivate_clients_time...........: avg=24.32ms  min=0s      med=4ms     max=620ms    p(90)=75ms     p(95)=111ms   
    pushpulls.........................: 41615   268.72506/s
    pushpulls_success_rate............: 100.00% 41615 out of 41615
    pushpulls_time....................: avg=54.96ms  min=1ms     med=20ms    max=714ms    p(90)=154ms    p(95)=221ms   
    transaction_success_rate..........: 100.00% 8323 out of 8323
    transaction_time..................: avg=6.49s    min=6.01s   med=6.46s   max=8.16s    p(90)=7.05s    p(95)=7.22s   

    HTTP
    http_req_duration.................: avg=48.98ms  min=492.7µs med=11.09ms max=822.28ms p(90)=141.82ms p(95)=219.43ms
      { expected_response:true }......: avg=48.98ms  min=492.7µs med=11.09ms max=822.28ms p(90)=141.82ms p(95)=219.43ms
    http_req_failed...................: 0.00%   0 out of 66584
    http_reqs.........................: 66584   429.960096/s

    EXECUTION
    iteration_duration................: avg=6.49s    min=6.01s   med=6.46s   max=8.16s    p(90)=7.05s    p(95)=7.22s   
    iterations........................: 8323    53.745012/s
    vus...............................: 8       min=8              max=500
    vus_max...........................: 500     min=500            max=500

    NETWORK
    data_received.....................: 1.2 GB  7.6 MB/s
    data_sent.........................: 63 MB   405 kB/s




running (2m34.9s), 000/500 VUs, 8323 complete and 0 interrupted iterations
default ✓ [ 100% ] 000/500 VUs  2m30s
