
         /\      Grafana   /‾‾/  
    /\  /  \     |\  __   /  /   
   /  \/    \    | |/ /  /   ‾‾\ 
  /          \   |   (  |  (‾)  |
 / __________ \  |_|\_\  \_____/ 


     execution: local
        script: test/k6/presence.ts
        output: -

     scenarios: (100.00%) 1 scenario, 500 max VUs, 3m0s max duration (incl. graceful stop):
              * default: Up to 500 looping VUs for 2m30s over 3 stages (gracefulRampDown: 30s, gracefulStop: 30s)


running (0m00.9s), 008/500 VUs, 0 complete and 0 interrupted iterations
default   [   1% ] 008/500 VUs  0m00.9s/2m30.0s

running (0m01.9s), 016/500 VUs, 0 complete and 0 interrupted iterations
default   [   1% ] 016/500 VUs  0m01.9s/2m30.0s

running (0m02.9s), 024/500 VUs, 0 complete and 0 interrupted iterations
default   [   2% ] 024/500 VUs  0m02.9s/2m30.0s

running (0m03.9s), 033/500 VUs, 0 complete and 0 interrupted iterations
default   [   3% ] 033/500 VUs  0m03.9s/2m30.0s

running (0m04.9s), 041/500 VUs, 0 complete and 0 interrupted iterations
default   [   3% ] 041/500 VUs  0m04.9s/2m30.0s

running (0m05.9s), 049/500 VUs, 0 complete and 0 interrupted iterations
default   [   4% ] 049/500 VUs  0m05.9s/2m30.0s

running (0m06.9s), 058/500 VUs, 8 complete and 0 interrupted iterations
default   [   5% ] 058/500 VUs  0m06.9s/2m30.0s

running (0m07.9s), 066/500 VUs, 16 complete and 0 interrupted iterations
default   [   5% ] 066/500 VUs  0m07.9s/2m30.0s

running (0m08.9s), 074/500 VUs, 24 complete and 0 interrupted iterations
default   [   6% ] 074/500 VUs  0m08.9s/2m30.0s

running (0m09.9s), 083/500 VUs, 33 complete and 0 interrupted iterations
default   [   7% ] 083/500 VUs  0m09.9s/2m30.0s

running (0m10.9s), 091/500 VUs, 41 complete and 0 interrupted iterations
default   [   7% ] 091/500 VUs  0m10.9s/2m30.0s

running (0m11.9s), 099/500 VUs, 49 complete and 0 interrupted iterations
default   [   8% ] 099/500 VUs  0m11.9s/2m30.0s

running (0m12.9s), 108/500 VUs, 64 complete and 0 interrupted iterations
default   [   9% ] 108/500 VUs  0m12.9s/2m30.0s

running (0m13.9s), 116/500 VUs, 82 complete and 0 interrupted iterations
default   [   9% ] 116/500 VUs  0m13.9s/2m30.0s

running (0m14.9s), 124/500 VUs, 98 complete and 0 interrupted iterations
default   [  10% ] 124/500 VUs  0m14.9s/2m30.0s

running (0m15.9s), 132/500 VUs, 114 complete and 0 interrupted iterations
default   [  11% ] 132/500 VUs  0m15.9s/2m30.0s

running (0m16.9s), 141/500 VUs, 132 complete and 0 interrupted iterations
default   [  11% ] 141/500 VUs  0m16.9s/2m30.0s

running (0m17.9s), 149/500 VUs, 148 complete and 0 interrupted iterations
default   [  12% ] 149/500 VUs  0m17.9s/2m30.0s

running (0m18.9s), 157/500 VUs, 171 complete and 0 interrupted iterations
default   [  13% ] 157/500 VUs  0m18.9s/2m30.0s

running (0m19.9s), 166/500 VUs, 198 complete and 0 interrupted iterations
default   [  13% ] 166/500 VUs  0m19.9s/2m30.0s

running (0m20.9s), 174/500 VUs, 222 complete and 0 interrupted iterations
default   [  14% ] 174/500 VUs  0m20.9s/2m30.0s

running (0m21.9s), 182/500 VUs, 246 complete and 0 interrupted iterations
default   [  15% ] 182/500 VUs  0m21.9s/2m30.0s

running (0m22.9s), 191/500 VUs, 271 complete and 0 interrupted iterations
default   [  15% ] 191/500 VUs  0m22.9s/2m30.0s

running (0m23.9s), 199/500 VUs, 297 complete and 0 interrupted iterations
default   [  16% ] 199/500 VUs  0m23.9s/2m30.0s

running (0m24.9s), 207/500 VUs, 328 complete and 0 interrupted iterations
default   [  17% ] 207/500 VUs  0m24.9s/2m30.0s

running (0m25.9s), 216/500 VUs, 360 complete and 0 interrupted iterations
default   [  17% ] 216/500 VUs  0m25.9s/2m30.0s

running (0m26.9s), 224/500 VUs, 396 complete and 0 interrupted iterations
default   [  18% ] 224/500 VUs  0m26.9s/2m30.0s

running (0m27.9s), 232/500 VUs, 428 complete and 0 interrupted iterations
default   [  19% ] 232/500 VUs  0m27.9s/2m30.0s

running (0m28.9s), 241/500 VUs, 461 complete and 0 interrupted iterations
default   [  19% ] 241/500 VUs  0m28.9s/2m30.0s

running (0m29.9s), 249/500 VUs, 496 complete and 0 interrupted iterations
default   [  20% ] 249/500 VUs  0m29.9s/2m30.0s

running (0m30.9s), 257/500 VUs, 535 complete and 0 interrupted iterations
default   [  21% ] 257/500 VUs  0m30.9s/2m30.0s

running (0m31.9s), 266/500 VUs, 575 complete and 0 interrupted iterations
default   [  21% ] 266/500 VUs  0m31.9s/2m30.0s

running (0m32.9s), 274/500 VUs, 618 complete and 0 interrupted iterations
default   [  22% ] 274/500 VUs  0m32.9s/2m30.0s

running (0m33.9s), 282/500 VUs, 660 complete and 0 interrupted iterations
default   [  23% ] 282/500 VUs  0m33.9s/2m30.0s

running (0m34.9s), 290/500 VUs, 700 complete and 0 interrupted iterations
default   [  23% ] 290/500 VUs  0m34.9s/2m30.0s

running (0m35.9s), 299/500 VUs, 742 complete and 0 interrupted iterations
default   [  24% ] 299/500 VUs  0m35.9s/2m30.0s

running (0m36.9s), 307/500 VUs, 791 complete and 0 interrupted iterations
default   [  25% ] 307/500 VUs  0m36.9s/2m30.0s

running (0m37.9s), 315/500 VUs, 840 complete and 0 interrupted iterations
default   [  25% ] 315/500 VUs  0m37.9s/2m30.0s

running (0m38.9s), 324/500 VUs, 889 complete and 0 interrupted iterations
default   [  26% ] 324/500 VUs  0m38.9s/2m30.0s

running (0m39.9s), 332/500 VUs, 940 complete and 0 interrupted iterations
default   [  27% ] 332/500 VUs  0m39.9s/2m30.0s

running (0m40.9s), 340/500 VUs, 990 complete and 0 interrupted iterations
default   [  27% ] 340/500 VUs  0m40.9s/2m30.0s

running (0m41.9s), 349/500 VUs, 1039 complete and 0 interrupted iterations
default   [  28% ] 349/500 VUs  0m41.9s/2m30.0s

running (0m42.9s), 357/500 VUs, 1096 complete and 0 interrupted iterations
default   [  29% ] 357/500 VUs  0m42.9s/2m30.0s

running (0m43.9s), 365/500 VUs, 1155 complete and 0 interrupted iterations
default   [  29% ] 365/500 VUs  0m43.9s/2m30.0s

running (0m44.9s), 374/500 VUs, 1212 complete and 0 interrupted iterations
default   [  30% ] 374/500 VUs  0m44.9s/2m30.0s

running (0m45.9s), 382/500 VUs, 1271 complete and 0 interrupted iterations
default   [  31% ] 382/500 VUs  0m45.9s/2m30.0s

running (0m46.9s), 390/500 VUs, 1330 complete and 0 interrupted iterations
default   [  31% ] 390/500 VUs  0m46.9s/2m30.0s

running (0m47.9s), 399/500 VUs, 1386 complete and 0 interrupted iterations
default   [  32% ] 399/500 VUs  0m47.9s/2m30.0s

running (0m48.9s), 407/500 VUs, 1450 complete and 0 interrupted iterations
default   [  33% ] 407/500 VUs  0m48.9s/2m30.0s

running (0m49.9s), 415/500 VUs, 1516 complete and 0 interrupted iterations
default   [  33% ] 415/500 VUs  0m49.9s/2m30.0s

running (0m50.9s), 424/500 VUs, 1581 complete and 0 interrupted iterations
default   [  34% ] 424/500 VUs  0m50.9s/2m30.0s

running (0m51.9s), 432/500 VUs, 1649 complete and 0 interrupted iterations
default   [  35% ] 432/500 VUs  0m51.9s/2m30.0s

running (0m52.9s), 440/500 VUs, 1715 complete and 0 interrupted iterations
default   [  35% ] 440/500 VUs  0m52.9s/2m30.0s

running (0m53.9s), 449/500 VUs, 1778 complete and 0 interrupted iterations
default   [  36% ] 449/500 VUs  0m53.9s/2m30.0s

running (0m54.9s), 457/500 VUs, 1849 complete and 0 interrupted iterations
default   [  37% ] 457/500 VUs  0m54.9s/2m30.0s

running (0m55.9s), 465/500 VUs, 1924 complete and 0 interrupted iterations
default   [  37% ] 465/500 VUs  0m55.9s/2m30.0s

running (0m56.9s), 474/500 VUs, 1999 complete and 0 interrupted iterations
default   [  38% ] 474/500 VUs  0m56.9s/2m30.0s

running (0m57.9s), 482/500 VUs, 2065 complete and 0 interrupted iterations
default   [  39% ] 482/500 VUs  0m57.9s/2m30.0s

running (0m58.9s), 490/500 VUs, 2129 complete and 0 interrupted iterations
default   [  39% ] 490/500 VUs  0m58.9s/2m30.0s

running (0m59.9s), 498/500 VUs, 2202 complete and 0 interrupted iterations
default   [  40% ] 498/500 VUs  0m59.9s/2m30.0s

running (1m00.9s), 500/500 VUs, 2270 complete and 0 interrupted iterations
default   [  41% ] 500/500 VUs  1m00.9s/2m30.0s

running (1m01.9s), 500/500 VUs, 2349 complete and 0 interrupted iterations
default   [  41% ] 500/500 VUs  1m01.9s/2m30.0s

running (1m02.9s), 500/500 VUs, 2418 complete and 0 interrupted iterations
default   [  42% ] 500/500 VUs  1m02.9s/2m30.0s

running (1m04.1s), 500/500 VUs, 2500 complete and 0 interrupted iterations
default   [  43% ] 500/500 VUs  1m04.1s/2m30.0s

running (1m04.9s), 500/500 VUs, 2548 complete and 0 interrupted iterations
default   [  43% ] 500/500 VUs  1m04.9s/2m30.0s

running (1m05.9s), 500/500 VUs, 2623 complete and 0 interrupted iterations
default   [  44% ] 500/500 VUs  1m05.9s/2m30.0s

running (1m07.0s), 500/500 VUs, 2718 complete and 0 interrupted iterations
default   [  45% ] 500/500 VUs  1m07.0s/2m30.0s

running (1m07.9s), 500/500 VUs, 2789 complete and 0 interrupted iterations
default   [  45% ] 500/500 VUs  1m07.9s/2m30.0s

running (1m08.9s), 500/500 VUs, 2869 complete and 0 interrupted iterations
default   [  46% ] 500/500 VUs  1m08.9s/2m30.0s

running (1m09.9s), 500/500 VUs, 2950 complete and 0 interrupted iterations
default   [  47% ] 500/500 VUs  1m09.9s/2m30.0s

running (1m10.9s), 500/500 VUs, 3012 complete and 0 interrupted iterations
default   [  47% ] 500/500 VUs  1m10.9s/2m30.0s

running (1m11.9s), 500/500 VUs, 3073 complete and 0 interrupted iterations
default   [  48% ] 500/500 VUs  1m11.9s/2m30.0s

running (1m12.9s), 500/500 VUs, 3158 complete and 0 interrupted iterations
default   [  49% ] 500/500 VUs  1m12.9s/2m30.0s

running (1m13.9s), 500/500 VUs, 3213 complete and 0 interrupted iterations
default   [  49% ] 500/500 VUs  1m13.9s/2m30.0s

running (1m14.9s), 500/500 VUs, 3299 complete and 0 interrupted iterations
default   [  50% ] 500/500 VUs  1m14.9s/2m30.0s

running (1m15.9s), 500/500 VUs, 3383 complete and 0 interrupted iterations
default   [  51% ] 500/500 VUs  1m15.9s/2m30.0s

running (1m16.9s), 500/500 VUs, 3451 complete and 0 interrupted iterations
default   [  51% ] 500/500 VUs  1m16.9s/2m30.0s

running (1m17.9s), 500/500 VUs, 3536 complete and 0 interrupted iterations
default   [  52% ] 500/500 VUs  1m17.9s/2m30.0s

running (1m18.9s), 500/500 VUs, 3601 complete and 0 interrupted iterations
default   [  53% ] 500/500 VUs  1m18.9s/2m30.0s

running (1m19.9s), 500/500 VUs, 3678 complete and 0 interrupted iterations
default   [  53% ] 500/500 VUs  1m19.9s/2m30.0s

running (1m20.9s), 500/500 VUs, 3764 complete and 0 interrupted iterations
default   [  54% ] 500/500 VUs  1m20.9s/2m30.0s

running (1m21.9s), 500/500 VUs, 3848 complete and 0 interrupted iterations
default   [  55% ] 500/500 VUs  1m21.9s/2m30.0s

running (1m22.9s), 500/500 VUs, 3907 complete and 0 interrupted iterations
default   [  55% ] 500/500 VUs  1m22.9s/2m30.0s

running (1m23.9s), 500/500 VUs, 3986 complete and 0 interrupted iterations
default   [  56% ] 500/500 VUs  1m23.9s/2m30.0s

running (1m24.9s), 500/500 VUs, 4052 complete and 0 interrupted iterations
default   [  57% ] 500/500 VUs  1m24.9s/2m30.0s

running (1m25.9s), 500/500 VUs, 4145 complete and 0 interrupted iterations
default   [  57% ] 500/500 VUs  1m25.9s/2m30.0s

running (1m26.9s), 500/500 VUs, 4215 complete and 0 interrupted iterations
default   [  58% ] 500/500 VUs  1m26.9s/2m30.0s

running (1m27.9s), 500/500 VUs, 4289 complete and 0 interrupted iterations
default   [  59% ] 500/500 VUs  1m27.9s/2m30.0s

running (1m28.9s), 500/500 VUs, 4387 complete and 0 interrupted iterations
default   [  59% ] 500/500 VUs  1m28.9s/2m30.0s

running (1m29.9s), 500/500 VUs, 4461 complete and 0 interrupted iterations
default   [  60% ] 500/500 VUs  1m29.9s/2m30.0s

running (1m30.9s), 500/500 VUs, 4518 complete and 0 interrupted iterations
default   [  61% ] 500/500 VUs  1m30.9s/2m30.0s

running (1m31.9s), 500/500 VUs, 4605 complete and 0 interrupted iterations
default   [  61% ] 500/500 VUs  1m31.9s/2m30.0s

running (1m32.9s), 500/500 VUs, 4685 complete and 0 interrupted iterations
default   [  62% ] 500/500 VUs  1m32.9s/2m30.0s

running (1m33.9s), 500/500 VUs, 4756 complete and 0 interrupted iterations
default   [  63% ] 500/500 VUs  1m33.9s/2m30.0s

running (1m34.9s), 500/500 VUs, 4841 complete and 0 interrupted iterations
default   [  63% ] 500/500 VUs  1m34.9s/2m30.0s

running (1m36.0s), 500/500 VUs, 4939 complete and 0 interrupted iterations
default   [  64% ] 500/500 VUs  1m36.0s/2m30.0s

running (1m36.9s), 500/500 VUs, 4987 complete and 0 interrupted iterations
default   [  65% ] 500/500 VUs  1m36.9s/2m30.0s

running (1m37.9s), 500/500 VUs, 5064 complete and 0 interrupted iterations
default   [  65% ] 500/500 VUs  1m37.9s/2m30.0s

running (1m39.2s), 500/500 VUs, 5148 complete and 0 interrupted iterations
default   [  66% ] 500/500 VUs  1m39.2s/2m30.0s

running (1m39.9s), 500/500 VUs, 5219 complete and 0 interrupted iterations
default   [  67% ] 500/500 VUs  1m39.9s/2m30.0s

running (1m40.9s), 500/500 VUs, 5266 complete and 0 interrupted iterations
default   [  67% ] 500/500 VUs  1m40.9s/2m30.0s

running (1m41.9s), 500/500 VUs, 5360 complete and 0 interrupted iterations
default   [  68% ] 500/500 VUs  1m41.9s/2m30.0s

running (1m42.9s), 500/500 VUs, 5438 complete and 0 interrupted iterations
default   [  69% ] 500/500 VUs  1m42.9s/2m30.0s

running (1m43.9s), 500/500 VUs, 5518 complete and 0 interrupted iterations
default   [  69% ] 500/500 VUs  1m43.9s/2m30.0s

running (1m44.9s), 500/500 VUs, 5591 complete and 0 interrupted iterations
default   [  70% ] 500/500 VUs  1m44.9s/2m30.0s

running (1m45.9s), 500/500 VUs, 5653 complete and 0 interrupted iterations
default   [  71% ] 500/500 VUs  1m45.9s/2m30.0s

running (1m46.9s), 500/500 VUs, 5738 complete and 0 interrupted iterations
default   [  71% ] 500/500 VUs  1m46.9s/2m30.0s

running (1m47.9s), 500/500 VUs, 5840 complete and 0 interrupted iterations
default   [  72% ] 500/500 VUs  1m47.9s/2m30.0s

running (1m49.2s), 500/500 VUs, 5912 complete and 0 interrupted iterations
default   [  73% ] 500/500 VUs  1m49.2s/2m30.0s

running (1m49.9s), 500/500 VUs, 5946 complete and 0 interrupted iterations
default   [  73% ] 500/500 VUs  1m49.9s/2m30.0s

running (1m50.9s), 500/500 VUs, 6023 complete and 0 interrupted iterations
default   [  74% ] 500/500 VUs  1m50.9s/2m30.0s

running (1m51.9s), 500/500 VUs, 6088 complete and 0 interrupted iterations
default   [  75% ] 500/500 VUs  1m51.9s/2m30.0s

running (1m52.9s), 500/500 VUs, 6167 complete and 0 interrupted iterations
default   [  75% ] 500/500 VUs  1m52.9s/2m30.0s

running (1m53.9s), 500/500 VUs, 6243 complete and 0 interrupted iterations
default   [  76% ] 500/500 VUs  1m53.9s/2m30.0s

running (1m54.9s), 500/500 VUs, 6298 complete and 0 interrupted iterations
default   [  77% ] 500/500 VUs  1m54.9s/2m30.0s

running (1m55.9s), 500/500 VUs, 6385 complete and 0 interrupted iterations
default   [  77% ] 500/500 VUs  1m55.9s/2m30.0s

running (1m56.9s), 500/500 VUs, 6489 complete and 0 interrupted iterations
default   [  78% ] 500/500 VUs  1m56.9s/2m30.0s

running (1m58.0s), 500/500 VUs, 6555 complete and 0 interrupted iterations
default   [  79% ] 500/500 VUs  1m58.0s/2m30.0s

running (1m58.9s), 500/500 VUs, 6625 complete and 0 interrupted iterations
default   [  79% ] 500/500 VUs  1m58.9s/2m30.0s

running (1m59.9s), 500/500 VUs, 6691 complete and 0 interrupted iterations
default   [  80% ] 500/500 VUs  1m59.9s/2m30.0s

running (2m01.1s), 499/500 VUs, 6772 complete and 0 interrupted iterations
default   [  81% ] 499/500 VUs  2m01.1s/2m30.0s

running (2m01.9s), 499/500 VUs, 6820 complete and 0 interrupted iterations
default   [  81% ] 499/500 VUs  2m01.9s/2m30.0s

running (2m02.9s), 495/500 VUs, 6900 complete and 0 interrupted iterations
default   [  82% ] 495/500 VUs  2m02.9s/2m30.0s

running (2m03.9s), 490/500 VUs, 6979 complete and 0 interrupted iterations
default   [  83% ] 490/500 VUs  2m03.9s/2m30.0s

running (2m04.9s), 480/500 VUs, 7050 complete and 0 interrupted iterations
default   [  83% ] 480/500 VUs  2m04.9s/2m30.0s

running (2m05.9s), 467/500 VUs, 7136 complete and 0 interrupted iterations
default   [  84% ] 467/500 VUs  2m05.9s/2m30.0s

running (2m06.9s), 441/500 VUs, 7227 complete and 0 interrupted iterations
default   [  85% ] 441/500 VUs  2m06.9s/2m30.0s

running (2m07.9s), 429/500 VUs, 7270 complete and 0 interrupted iterations
default   [  85% ] 429/500 VUs  2m07.9s/2m30.0s

running (2m08.9s), 407/500 VUs, 7347 complete and 0 interrupted iterations
default   [  86% ] 407/500 VUs  2m08.9s/2m30.0s

running (2m09.9s), 392/500 VUs, 7417 complete and 0 interrupted iterations
default   [  87% ] 392/500 VUs  2m09.9s/2m30.0s

running (2m10.9s), 369/500 VUs, 7505 complete and 0 interrupted iterations
default   [  87% ] 369/500 VUs  2m10.9s/2m30.0s

running (2m11.9s), 352/500 VUs, 7571 complete and 0 interrupted iterations
default   [  88% ] 352/500 VUs  2m11.9s/2m30.0s

running (2m12.9s), 343/500 VUs, 7620 complete and 0 interrupted iterations
default   [  89% ] 343/500 VUs  2m12.9s/2m30.0s

running (2m13.9s), 325/500 VUs, 7690 complete and 0 interrupted iterations
default   [  89% ] 325/500 VUs  2m13.9s/2m30.0s

running (2m14.9s), 310/500 VUs, 7752 complete and 0 interrupted iterations
default   [  90% ] 310/500 VUs  2m14.9s/2m30.0s

running (2m15.9s), 291/500 VUs, 7807 complete and 0 interrupted iterations
default   [  91% ] 291/500 VUs  2m15.9s/2m30.0s

running (2m16.9s), 265/500 VUs, 7869 complete and 0 interrupted iterations
default   [  91% ] 265/500 VUs  2m16.9s/2m30.0s

running (2m17.9s), 257/500 VUs, 7919 complete and 0 interrupted iterations
default   [  92% ] 257/500 VUs  2m17.9s/2m30.0s

running (2m18.9s), 240/500 VUs, 7963 complete and 0 interrupted iterations
default   [  93% ] 240/500 VUs  2m18.9s/2m30.0s

running (2m19.9s), 216/500 VUs, 8015 complete and 0 interrupted iterations
default   [  93% ] 216/500 VUs  2m19.9s/2m30.0s

running (2m20.9s), 203/500 VUs, 8062 complete and 0 interrupted iterations
default   [  94% ] 203/500 VUs  2m20.9s/2m30.0s

running (2m21.9s), 189/500 VUs, 8097 complete and 0 interrupted iterations
default   [  95% ] 189/500 VUs  2m21.9s/2m30.0s

running (2m22.9s), 176/500 VUs, 8133 complete and 0 interrupted iterations
default   [  95% ] 176/500 VUs  2m22.9s/2m30.0s

running (2m23.9s), 158/500 VUs, 8171 complete and 0 interrupted iterations
default   [  96% ] 158/500 VUs  2m23.9s/2m30.0s

running (2m24.9s), 139/500 VUs, 8203 complete and 0 interrupted iterations
default   [  97% ] 139/500 VUs  2m24.9s/2m30.0s

running (2m25.9s), 120/500 VUs, 8231 complete and 0 interrupted iterations
default   [  97% ] 120/500 VUs  2m25.9s/2m30.0s

running (2m26.9s), 099/500 VUs, 8265 complete and 0 interrupted iterations
default   [  98% ] 099/500 VUs  2m26.9s/2m30.0s

running (2m27.9s), 084/500 VUs, 8286 complete and 0 interrupted iterations
default   [  99% ] 084/500 VUs  2m27.9s/2m30.0s

running (2m28.9s), 067/500 VUs, 8308 complete and 0 interrupted iterations
default   [  99% ] 067/500 VUs  2m28.9s/2m30.0s

running (2m29.9s), 052/500 VUs, 8325 complete and 0 interrupted iterations
default   [ 100% ] 052/500 VUs  2m29.9s/2m30.0s

running (2m30.9s), 035/500 VUs, 8342 complete and 0 interrupted iterations
default ↓ [ 100% ] 044/500 VUs  2m30s

running (2m31.9s), 026/500 VUs, 8351 complete and 0 interrupted iterations
default ↓ [ 100% ] 044/500 VUs  2m30s

running (2m32.9s), 013/500 VUs, 8364 complete and 0 interrupted iterations
default ↓ [ 100% ] 044/500 VUs  2m30s

running (2m33.9s), 007/500 VUs, 8370 complete and 0 interrupted iterations
default ↓ [ 100% ] 044/500 VUs  2m30s

running (2m34.9s), 002/500 VUs, 8375 complete and 0 interrupted iterations
default ↓ [ 100% ] 044/500 VUs  2m30s


  █ THRESHOLDS 

    active_clients_time
    ✓ 'p(95)<500' p(95)=107ms

    attach_documents_time
    ✓ 'p(95)<10000' p(95)=375.19ms

    deactivate_clients_time
    ✓ 'p(95)<10000' p(95)=126ms

    http_req_duration
    ✓ 'p(95)<10000' p(95)=198.2ms

    pushpulls_time
    ✓ 'p(95)<1000' p(95)=198ms

    transaction_success_rate
    ✓ 'rate>0.99' rate=100.00%

    transaction_time
    ✓ 'p(95)<30000' p(95)=7.19s


  █ TOTAL RESULTS 

    checks_total.......: 134032  864.02471/s
    checks_succeeded...: 100.00% 134032 out of 134032
    checks_failed......: 0.00%   0 out of 134032

    ✓ status is 200
    ✓ response has valid body

    CUSTOM
    active_clients....................: 8377    54.001544/s
    active_clients_success_rate.......: 100.00% 8377 out of 8377
    active_clients_time...............: avg=22.88ms min=0s       med=4ms   max=437ms    p(90)=74ms    p(95)=107ms   
    attach_documents..................: 8377    54.001544/s
    attach_documents_success_rate.....: 100.00% 8377 out of 8377
    attach_documents_time.............: avg=91.64ms min=3ms      med=21ms  max=832ms    p(90)=291ms   p(95)=375.19ms
    deactivate_clients................: 8377    54.001544/s
    deactivate_clients_success_rate...: 100.00% 8377 out of 8377
    deactivate_clients_time...........: avg=24.44ms min=0s       med=2ms   max=722ms    p(90)=75ms    p(95)=126ms   
    pushpulls.........................: 41885   270.007722/s
    pushpulls_success_rate............: 100.00% 41885 out of 41885
    pushpulls_time....................: avg=47.82ms min=1ms      med=14ms  max=864ms    p(90)=137ms   p(95)=198ms   
    transaction_success_rate..........: 100.00% 8377 out of 8377
    transaction_time..................: avg=6.45s   min=6.01s    med=6.41s max=8.59s    p(90)=6.98s   p(95)=7.19s   

    HTTP
    http_req_duration.................: avg=41.94ms min=187.57µs med=7.9ms max=794.93ms p(90)=128.3ms p(95)=198.2ms 
      { expected_response:true }......: avg=41.94ms min=187.57µs med=7.9ms max=794.93ms p(90)=128.3ms p(95)=198.2ms 
    http_req_failed...................: 0.00%   0 out of 67016
    http_reqs.........................: 67016   432.012355/s

    EXECUTION
    iteration_duration................: avg=6.45s   min=6.01s    med=6.41s max=8.59s    p(90)=6.98s   p(95)=7.19s   
    iterations........................: 8377    54.001544/s
    vus...............................: 2       min=2              max=500
    vus_max...........................: 500     min=500            max=500

    NETWORK
    data_received.....................: 1.2 GB  7.6 MB/s
    data_sent.........................: 63 MB   407 kB/s




running (2m35.1s), 000/500 VUs, 8377 complete and 0 interrupted iterations
default ✓ [ 100% ] 000/500 VUs  2m30s
