
         /\      Grafana   /‾‾/  
    /\  /  \     |\  __   /  /   
   /  \/    \    | |/ /  /   ‾‾\ 
  /          \   |   (  |  (‾)  |
 / __________ \  |_|\_\  \_____/ 

     execution: local
        script: test/k6/presence.ts
        output: -

     scenarios: (100.00%) 1 scenario, 500 max VUs, 3m0s max duration (incl. graceful stop):
              * default: Up to 500 looping VUs for 2m30s over 3 stages (gracefulRampDown: 30s, gracefulStop: 30s)


running (0m00.9s), 008/500 VUs, 0 complete and 0 interrupted iterations
default   [   1% ] 008/500 VUs  0m00.9s/2m30.0s

running (0m01.9s), 016/500 VUs, 0 complete and 0 interrupted iterations
default   [   1% ] 016/500 VUs  0m01.9s/2m30.0s

running (0m02.9s), 025/500 VUs, 0 complete and 0 interrupted iterations
default   [   2% ] 025/500 VUs  0m02.9s/2m30.0s

running (0m03.9s), 033/500 VUs, 0 complete and 0 interrupted iterations
default   [   3% ] 033/500 VUs  0m03.9s/2m30.0s

running (0m04.9s), 041/500 VUs, 0 complete and 0 interrupted iterations
default   [   3% ] 041/500 VUs  0m04.9s/2m30.0s

running (0m05.9s), 049/500 VUs, 0 complete and 0 interrupted iterations
default   [   4% ] 049/500 VUs  0m05.9s/2m30.0s

running (0m06.9s), 058/500 VUs, 8 complete and 0 interrupted iterations
default   [   5% ] 058/500 VUs  0m06.9s/2m30.0s

running (0m07.9s), 066/500 VUs, 16 complete and 0 interrupted iterations
default   [   5% ] 066/500 VUs  0m07.9s/2m30.0s

running (0m08.9s), 074/500 VUs, 24 complete and 0 interrupted iterations
default   [   6% ] 074/500 VUs  0m08.9s/2m30.0s

running (0m09.9s), 083/500 VUs, 33 complete and 0 interrupted iterations
default   [   7% ] 083/500 VUs  0m09.9s/2m30.0s

running (0m10.9s), 091/500 VUs, 41 complete and 0 interrupted iterations
default   [   7% ] 091/500 VUs  0m10.9s/2m30.0s

running (0m11.9s), 099/500 VUs, 49 complete and 0 interrupted iterations
default   [   8% ] 099/500 VUs  0m11.9s/2m30.0s

running (0m12.9s), 108/500 VUs, 65 complete and 0 interrupted iterations
default   [   9% ] 108/500 VUs  0m12.9s/2m30.0s

running (0m13.9s), 116/500 VUs, 82 complete and 0 interrupted iterations
default   [   9% ] 116/500 VUs  0m13.9s/2m30.0s

running (0m14.9s), 124/500 VUs, 98 complete and 0 interrupted iterations
default   [  10% ] 124/500 VUs  0m14.9s/2m30.0s

running (0m15.9s), 133/500 VUs, 115 complete and 0 interrupted iterations
default   [  11% ] 133/500 VUs  0m15.9s/2m30.0s

running (0m16.9s), 141/500 VUs, 132 complete and 0 interrupted iterations
default   [  11% ] 141/500 VUs  0m16.9s/2m30.0s

running (0m17.9s), 149/500 VUs, 148 complete and 0 interrupted iterations
default   [  12% ] 149/500 VUs  0m17.9s/2m30.0s

running (0m18.9s), 158/500 VUs, 171 complete and 0 interrupted iterations
default   [  13% ] 158/500 VUs  0m18.9s/2m30.0s

running (0m19.9s), 166/500 VUs, 198 complete and 0 interrupted iterations
default   [  13% ] 166/500 VUs  0m19.9s/2m30.0s

running (0m20.9s), 174/500 VUs, 222 complete and 0 interrupted iterations
default   [  14% ] 174/500 VUs  0m20.9s/2m30.0s

running (0m21.9s), 183/500 VUs, 246 complete and 0 interrupted iterations
default   [  15% ] 183/500 VUs  0m21.9s/2m30.0s

running (0m22.9s), 191/500 VUs, 272 complete and 0 interrupted iterations
default   [  15% ] 191/500 VUs  0m22.9s/2m30.0s

running (0m23.9s), 199/500 VUs, 297 complete and 0 interrupted iterations
default   [  16% ] 199/500 VUs  0m23.9s/2m30.0s

running (0m24.9s), 208/500 VUs, 328 complete and 0 interrupted iterations
default   [  17% ] 208/500 VUs  0m24.9s/2m30.0s

running (0m25.9s), 216/500 VUs, 361 complete and 0 interrupted iterations
default   [  17% ] 216/500 VUs  0m25.9s/2m30.0s

running (0m26.9s), 224/500 VUs, 395 complete and 0 interrupted iterations
default   [  18% ] 224/500 VUs  0m26.9s/2m30.0s

running (0m27.9s), 232/500 VUs, 428 complete and 0 interrupted iterations
default   [  19% ] 232/500 VUs  0m27.9s/2m30.0s

running (0m28.9s), 241/500 VUs, 460 complete and 0 interrupted iterations
default   [  19% ] 241/500 VUs  0m28.9s/2m30.0s

running (0m29.9s), 249/500 VUs, 495 complete and 0 interrupted iterations
default   [  20% ] 249/500 VUs  0m29.9s/2m30.0s

running (0m30.9s), 257/500 VUs, 535 complete and 0 interrupted iterations
default   [  21% ] 257/500 VUs  0m30.9s/2m30.0s

running (0m31.9s), 266/500 VUs, 576 complete and 0 interrupted iterations
default   [  21% ] 266/500 VUs  0m31.9s/2m30.0s

running (0m32.9s), 274/500 VUs, 618 complete and 0 interrupted iterations
default   [  22% ] 274/500 VUs  0m32.9s/2m30.0s

running (0m33.9s), 282/500 VUs, 660 complete and 0 interrupted iterations
default   [  23% ] 282/500 VUs  0m33.9s/2m30.0s

running (0m34.9s), 291/500 VUs, 700 complete and 0 interrupted iterations
default   [  23% ] 291/500 VUs  0m34.9s/2m30.0s

running (0m35.9s), 299/500 VUs, 742 complete and 0 interrupted iterations
default   [  24% ] 299/500 VUs  0m35.9s/2m30.0s

running (0m36.9s), 307/500 VUs, 789 complete and 0 interrupted iterations
default   [  25% ] 307/500 VUs  0m36.9s/2m30.0s

running (0m37.9s), 316/500 VUs, 837 complete and 0 interrupted iterations
default   [  25% ] 316/500 VUs  0m37.9s/2m30.0s

running (0m38.9s), 324/500 VUs, 888 complete and 0 interrupted iterations
default   [  26% ] 324/500 VUs  0m38.9s/2m30.0s

running (0m39.9s), 332/500 VUs, 938 complete and 0 interrupted iterations
default   [  27% ] 332/500 VUs  0m39.9s/2m30.0s

running (0m40.9s), 341/500 VUs, 987 complete and 0 interrupted iterations
default   [  27% ] 341/500 VUs  0m40.9s/2m30.0s

running (0m41.9s), 349/500 VUs, 1036 complete and 0 interrupted iterations
default   [  28% ] 349/500 VUs  0m41.9s/2m30.0s

running (0m42.9s), 357/500 VUs, 1093 complete and 0 interrupted iterations
default   [  29% ] 357/500 VUs  0m42.9s/2m30.0s

running (0m43.9s), 366/500 VUs, 1152 complete and 0 interrupted iterations
default   [  29% ] 366/500 VUs  0m43.9s/2m30.0s

running (0m44.9s), 374/500 VUs, 1212 complete and 0 interrupted iterations
default   [  30% ] 374/500 VUs  0m44.9s/2m30.0s

running (0m45.9s), 383/500 VUs, 1271 complete and 0 interrupted iterations
default   [  31% ] 383/500 VUs  0m45.9s/2m30.0s

running (0m46.9s), 390/500 VUs, 1321 complete and 0 interrupted iterations
default   [  31% ] 390/500 VUs  0m46.9s/2m30.0s

running (0m47.9s), 399/500 VUs, 1380 complete and 0 interrupted iterations
default   [  32% ] 399/500 VUs  0m47.9s/2m30.0s

running (0m48.9s), 407/500 VUs, 1444 complete and 0 interrupted iterations
default   [  33% ] 407/500 VUs  0m48.9s/2m30.0s

running (0m49.9s), 415/500 VUs, 1508 complete and 0 interrupted iterations
default   [  33% ] 415/500 VUs  0m49.9s/2m30.0s

running (0m50.9s), 424/500 VUs, 1569 complete and 0 interrupted iterations
default   [  34% ] 424/500 VUs  0m50.9s/2m30.0s

running (0m51.9s), 432/500 VUs, 1636 complete and 0 interrupted iterations
default   [  35% ] 432/500 VUs  0m51.9s/2m30.0s

running (0m52.9s), 440/500 VUs, 1707 complete and 0 interrupted iterations
default   [  35% ] 440/500 VUs  0m52.9s/2m30.0s

running (0m53.9s), 449/500 VUs, 1770 complete and 0 interrupted iterations
default   [  36% ] 449/500 VUs  0m53.9s/2m30.0s

running (0m54.9s), 457/500 VUs, 1840 complete and 0 interrupted iterations
default   [  37% ] 457/500 VUs  0m54.9s/2m30.0s

running (0m55.9s), 465/500 VUs, 1904 complete and 0 interrupted iterations
default   [  37% ] 465/500 VUs  0m55.9s/2m30.0s

running (0m56.9s), 474/500 VUs, 1972 complete and 0 interrupted iterations
default   [  38% ] 474/500 VUs  0m56.9s/2m30.0s

running (0m57.9s), 478/500 VUs, 2039 complete and 0 interrupted iterations
default   [  39% ] 478/500 VUs  0m57.9s/2m30.0s

running (0m58.9s), 490/500 VUs, 2105 complete and 0 interrupted iterations
default   [  39% ] 490/500 VUs  0m58.9s/2m30.0s

running (0m59.9s), 499/500 VUs, 2164 complete and 0 interrupted iterations
default   [  40% ] 499/500 VUs  0m59.9s/2m30.0s

running (1m00.9s), 500/500 VUs, 2226 complete and 0 interrupted iterations
default   [  41% ] 500/500 VUs  1m00.9s/2m30.0s

running (1m01.9s), 500/500 VUs, 2306 complete and 0 interrupted iterations
default   [  41% ] 500/500 VUs  1m01.9s/2m30.0s

running (1m02.9s), 500/500 VUs, 2365 complete and 0 interrupted iterations
default   [  42% ] 500/500 VUs  1m02.9s/2m30.0s

running (1m03.9s), 500/500 VUs, 2424 complete and 0 interrupted iterations
default   [  43% ] 500/500 VUs  1m03.9s/2m30.0s

running (1m04.9s), 500/500 VUs, 2507 complete and 0 interrupted iterations
default   [  43% ] 500/500 VUs  1m04.9s/2m30.0s

running (1m05.9s), 500/500 VUs, 2593 complete and 0 interrupted iterations
default   [  44% ] 500/500 VUs  1m05.9s/2m30.0s

running (1m06.9s), 500/500 VUs, 2651 complete and 0 interrupted iterations
default   [  45% ] 500/500 VUs  1m06.9s/2m30.0s

running (1m07.9s), 500/500 VUs, 2700 complete and 0 interrupted iterations
default   [  45% ] 500/500 VUs  1m07.9s/2m30.0s

running (1m08.9s), 500/500 VUs, 2802 complete and 0 interrupted iterations
default   [  46% ] 500/500 VUs  1m08.9s/2m30.0s

running (1m09.9s), 500/500 VUs, 2869 complete and 0 interrupted iterations
default   [  47% ] 500/500 VUs  1m09.9s/2m30.0s

running (1m10.9s), 500/500 VUs, 2945 complete and 0 interrupted iterations
default   [  47% ] 500/500 VUs  1m10.9s/2m30.0s

running (1m11.9s), 500/500 VUs, 2984 complete and 0 interrupted iterations
default   [  48% ] 500/500 VUs  1m11.9s/2m30.0s

running (1m12.9s), 500/500 VUs, 3087 complete and 0 interrupted iterations
default   [  49% ] 500/500 VUs  1m12.9s/2m30.0s

running (1m13.9s), 500/500 VUs, 3165 complete and 0 interrupted iterations
default   [  49% ] 500/500 VUs  1m13.9s/2m30.0s

running (1m14.9s), 500/500 VUs, 3242 complete and 0 interrupted iterations
default   [  50% ] 500/500 VUs  1m14.9s/2m30.0s

running (1m15.9s), 500/500 VUs, 3299 complete and 0 interrupted iterations
default   [  51% ] 500/500 VUs  1m15.9s/2m30.0s

running (1m16.9s), 500/500 VUs, 3366 complete and 0 interrupted iterations
default   [  51% ] 500/500 VUs  1m16.9s/2m30.0s

running (1m17.9s), 500/500 VUs, 3461 complete and 0 interrupted iterations
default   [  52% ] 500/500 VUs  1m17.9s/2m30.0s

running (1m19.0s), 500/500 VUs, 3536 complete and 0 interrupted iterations
default   [  53% ] 500/500 VUs  1m19.0s/2m30.0s

running (1m19.9s), 500/500 VUs, 3583 complete and 0 interrupted iterations
default   [  53% ] 500/500 VUs  1m19.9s/2m30.0s

running (1m20.9s), 500/500 VUs, 3671 complete and 0 interrupted iterations
default   [  54% ] 500/500 VUs  1m20.9s/2m30.0s

running (1m21.9s), 500/500 VUs, 3746 complete and 0 interrupted iterations
default   [  55% ] 500/500 VUs  1m21.9s/2m30.0s

running (1m22.9s), 500/500 VUs, 3829 complete and 0 interrupted iterations
default   [  55% ] 500/500 VUs  1m22.9s/2m30.0s

running (1m23.9s), 500/500 VUs, 3882 complete and 0 interrupted iterations
default   [  56% ] 500/500 VUs  1m23.9s/2m30.0s

running (1m24.9s), 500/500 VUs, 3964 complete and 0 interrupted iterations
default   [  57% ] 500/500 VUs  1m24.9s/2m30.0s

running (1m26.3s), 500/500 VUs, 4060 complete and 0 interrupted iterations
default   [  58% ] 500/500 VUs  1m26.3s/2m30.0s

running (1m26.9s), 500/500 VUs, 4130 complete and 0 interrupted iterations
default   [  58% ] 500/500 VUs  1m26.9s/2m30.0s

running (1m27.9s), 500/500 VUs, 4190 complete and 0 interrupted iterations
default   [  59% ] 500/500 VUs  1m27.9s/2m30.0s

running (1m28.9s), 500/500 VUs, 4264 complete and 0 interrupted iterations
default   [  59% ] 500/500 VUs  1m28.9s/2m30.0s

running (1m29.9s), 500/500 VUs, 4333 complete and 0 interrupted iterations
default   [  60% ] 500/500 VUs  1m29.9s/2m30.0s

running (1m30.9s), 500/500 VUs, 4389 complete and 0 interrupted iterations
default   [  61% ] 500/500 VUs  1m30.9s/2m30.0s

running (1m31.9s), 500/500 VUs, 4455 complete and 0 interrupted iterations
default   [  61% ] 500/500 VUs  1m31.9s/2m30.0s

running (1m33.0s), 500/500 VUs, 4550 complete and 0 interrupted iterations
default   [  62% ] 500/500 VUs  1m33.0s/2m30.0s

running (1m33.9s), 500/500 VUs, 4643 complete and 0 interrupted iterations
default   [  63% ] 500/500 VUs  1m33.9s/2m30.0s

running (1m34.9s), 500/500 VUs, 4708 complete and 0 interrupted iterations
default   [  63% ] 500/500 VUs  1m34.9s/2m30.0s

running (1m35.9s), 500/500 VUs, 4764 complete and 0 interrupted iterations
default   [  64% ] 500/500 VUs  1m35.9s/2m30.0s

running (1m37.1s), 500/500 VUs, 4849 complete and 0 interrupted iterations
default   [  65% ] 500/500 VUs  1m37.1s/2m30.0s

running (1m37.9s), 500/500 VUs, 4937 complete and 0 interrupted iterations
default   [  65% ] 500/500 VUs  1m37.9s/2m30.0s

running (1m38.9s), 500/500 VUs, 4981 complete and 0 interrupted iterations
default   [  66% ] 500/500 VUs  1m38.9s/2m30.0s

running (1m39.9s), 500/500 VUs, 5046 complete and 0 interrupted iterations
default   [  67% ] 500/500 VUs  1m39.9s/2m30.0s

running (1m40.9s), 500/500 VUs, 5139 complete and 0 interrupted iterations
default   [  67% ] 500/500 VUs  1m40.9s/2m30.0s

running (1m41.9s), 500/500 VUs, 5212 complete and 0 interrupted iterations
default   [  68% ] 500/500 VUs  1m41.9s/2m30.0s

running (1m42.9s), 500/500 VUs, 5291 complete and 0 interrupted iterations
default   [  69% ] 500/500 VUs  1m42.9s/2m30.0s

running (1m43.9s), 500/500 VUs, 5357 complete and 0 interrupted iterations
default   [  69% ] 500/500 VUs  1m43.9s/2m30.0s

running (1m45.0s), 500/500 VUs, 5438 complete and 0 interrupted iterations
default   [  70% ] 500/500 VUs  1m45.0s/2m30.0s

running (1m45.9s), 500/500 VUs, 5517 complete and 0 interrupted iterations
default   [  71% ] 500/500 VUs  1m45.9s/2m30.0s

running (1m46.9s), 500/500 VUs, 5555 complete and 0 interrupted iterations
default   [  71% ] 500/500 VUs  1m46.9s/2m30.0s

running (1m48.4s), 500/500 VUs, 5667 complete and 0 interrupted iterations
default   [  72% ] 500/500 VUs  1m48.4s/2m30.0s

running (1m48.9s), 500/500 VUs, 5717 complete and 0 interrupted iterations
default   [  73% ] 500/500 VUs  1m48.9s/2m30.0s

running (1m50.0s), 500/500 VUs, 5785 complete and 0 interrupted iterations
default   [  73% ] 500/500 VUs  1m50.0s/2m30.0s

running (1m50.9s), 500/500 VUs, 5873 complete and 0 interrupted iterations
default   [  74% ] 500/500 VUs  1m50.9s/2m30.0s

running (1m51.9s), 500/500 VUs, 5921 complete and 0 interrupted iterations
default   [  75% ] 500/500 VUs  1m51.9s/2m30.0s

running (1m52.9s), 500/500 VUs, 6005 complete and 0 interrupted iterations
default   [  75% ] 500/500 VUs  1m52.9s/2m30.0s

running (1m53.9s), 500/500 VUs, 6087 complete and 0 interrupted iterations
default   [  76% ] 500/500 VUs  1m53.9s/2m30.0s

running (1m54.9s), 500/500 VUs, 6144 complete and 0 interrupted iterations
default   [  77% ] 500/500 VUs  1m54.9s/2m30.0s

running (1m55.9s), 500/500 VUs, 6226 complete and 0 interrupted iterations
default   [  77% ] 500/500 VUs  1m55.9s/2m30.0s

running (1m56.9s), 500/500 VUs, 6286 complete and 0 interrupted iterations
default   [  78% ] 500/500 VUs  1m56.9s/2m30.0s

running (1m57.9s), 500/500 VUs, 6353 complete and 0 interrupted iterations
default   [  79% ] 500/500 VUs  1m57.9s/2m30.0s

running (1m58.9s), 500/500 VUs, 6432 complete and 0 interrupted iterations
default   [  79% ] 500/500 VUs  1m58.9s/2m30.0s

running (1m59.9s), 500/500 VUs, 6485 complete and 0 interrupted iterations
default   [  80% ] 500/500 VUs  1m59.9s/2m30.0s

running (2m01.2s), 498/500 VUs, 6566 complete and 0 interrupted iterations
default   [  81% ] 498/500 VUs  2m01.2s/2m30.0s

running (2m01.9s), 489/500 VUs, 6639 complete and 0 interrupted iterations
default   [  81% ] 489/500 VUs  2m01.9s/2m30.0s

running (2m02.9s), 486/500 VUs, 6682 complete and 0 interrupted iterations
default   [  82% ] 486/500 VUs  2m02.9s/2m30.0s

running (2m03.9s), 476/500 VUs, 6792 complete and 0 interrupted iterations
default   [  83% ] 476/500 VUs  2m03.9s/2m30.0s

running (2m04.9s), 467/500 VUs, 6845 complete and 0 interrupted iterations
default   [  83% ] 467/500 VUs  2m04.9s/2m30.0s

running (2m05.9s), 459/500 VUs, 6906 complete and 0 interrupted iterations
default   [  84% ] 459/500 VUs  2m05.9s/2m30.0s

running (2m06.9s), 439/500 VUs, 7010 complete and 0 interrupted iterations
default   [  85% ] 439/500 VUs  2m06.9s/2m30.0s

running (2m07.9s), 431/500 VUs, 7061 complete and 0 interrupted iterations
default   [  85% ] 431/500 VUs  2m07.9s/2m30.0s

running (2m08.9s), 405/500 VUs, 7146 complete and 0 interrupted iterations
default   [  86% ] 405/500 VUs  2m08.9s/2m30.0s

running (2m09.9s), 388/500 VUs, 7220 complete and 0 interrupted iterations
default   [  87% ] 388/500 VUs  2m09.9s/2m30.0s

running (2m10.9s), 372/500 VUs, 7281 complete and 0 interrupted iterations
default   [  87% ] 372/500 VUs  2m10.9s/2m30.0s

running (2m11.9s), 353/500 VUs, 7359 complete and 0 interrupted iterations
default   [  88% ] 353/500 VUs  2m11.9s/2m30.0s

running (2m12.9s), 342/500 VUs, 7408 complete and 0 interrupted iterations
default   [  89% ] 342/500 VUs  2m12.9s/2m30.0s

running (2m13.9s), 326/500 VUs, 7481 complete and 0 interrupted iterations
default   [  89% ] 326/500 VUs  2m13.9s/2m30.0s

running (2m14.9s), 307/500 VUs, 7545 complete and 0 interrupted iterations
default   [  90% ] 307/500 VUs  2m14.9s/2m30.0s

running (2m15.9s), 287/500 VUs, 7595 complete and 0 interrupted iterations
default   [  91% ] 287/500 VUs  2m15.9s/2m30.0s

running (2m16.9s), 271/500 VUs, 7649 complete and 0 interrupted iterations
default   [  91% ] 271/500 VUs  2m16.9s/2m30.0s

running (2m17.9s), 252/500 VUs, 7711 complete and 0 interrupted iterations
default   [  92% ] 252/500 VUs  2m17.9s/2m30.0s

running (2m18.9s), 237/500 VUs, 7745 complete and 0 interrupted iterations
default   [  93% ] 237/500 VUs  2m18.9s/2m30.0s

running (2m19.9s), 217/500 VUs, 7807 complete and 0 interrupted iterations
default   [  93% ] 217/500 VUs  2m19.9s/2m30.0s

running (2m20.9s), 199/500 VUs, 7852 complete and 0 interrupted iterations
default   [  94% ] 199/500 VUs  2m20.9s/2m30.0s

running (2m21.9s), 187/500 VUs, 7881 complete and 0 interrupted iterations
default   [  95% ] 187/500 VUs  2m21.9s/2m30.0s

running (2m22.9s), 173/500 VUs, 7918 complete and 0 interrupted iterations
default   [  95% ] 173/500 VUs  2m22.9s/2m30.0s

running (2m23.9s), 151/500 VUs, 7963 complete and 0 interrupted iterations
default   [  96% ] 151/500 VUs  2m23.9s/2m30.0s

running (2m24.9s), 139/500 VUs, 7981 complete and 0 interrupted iterations
default   [  97% ] 139/500 VUs  2m24.9s/2m30.0s

running (2m25.9s), 119/500 VUs, 8023 complete and 0 interrupted iterations
default   [  97% ] 119/500 VUs  2m25.9s/2m30.0s

running (2m26.9s), 100/500 VUs, 8050 complete and 0 interrupted iterations
default   [  98% ] 100/500 VUs  2m26.9s/2m30.0s

running (2m27.9s), 087/500 VUs, 8067 complete and 0 interrupted iterations
default   [  99% ] 087/500 VUs  2m27.9s/2m30.0s

running (2m28.9s), 068/500 VUs, 8088 complete and 0 interrupted iterations
default   [  99% ] 068/500 VUs  2m28.9s/2m30.0s

running (2m29.9s), 050/500 VUs, 8114 complete and 0 interrupted iterations
default   [ 100% ] 050/500 VUs  2m29.9s/2m30.0s

running (2m30.9s), 044/500 VUs, 8120 complete and 0 interrupted iterations
default ↓ [ 100% ] 050/500 VUs  2m30s

running (2m31.9s), 022/500 VUs, 8142 complete and 0 interrupted iterations
default ↓ [ 100% ] 050/500 VUs  2m30s

running (2m32.9s), 014/500 VUs, 8150 complete and 0 interrupted iterations
default ↓ [ 100% ] 050/500 VUs  2m30s

running (2m33.9s), 010/500 VUs, 8154 complete and 0 interrupted iterations
default ↓ [ 100% ] 050/500 VUs  2m30s

running (2m34.9s), 008/500 VUs, 8156 complete and 0 interrupted iterations
default ↓ [ 100% ] 050/500 VUs  2m30s


  █ THRESHOLDS 

    active_clients_time
    ✓ 'p(95)<500' p(95)=77ms

    attach_documents_time
    ✓ 'p(95)<10000' p(95)=378.84ms

    deactivate_clients_time
    ✓ 'p(95)<10000' p(95)=460.69ms

    http_req_duration
    ✓ 'p(95)<10000' p(95)=258.36ms

    pushpulls_time
    ✓ 'p(95)<1000' p(95)=236ms

    transaction_success_rate
    ✓ 'rate>0.99' rate=100.00%

    transaction_time
    ✓ 'p(95)<30000' p(95)=7.48s


  █ TOTAL RESULTS 

    checks_total.......................: 130624  840.216082/s
    checks_succeeded...................: 100.00% 130624 out of 130624
    checks_failed......................: 0.00%   0 out of 130624

    ✓ status is 200
    ✓ response has valid body

    CUSTOM
    active_clients..........................................................: 8164    52.513505/s
    active_clients_success_rate.............................................: 100.00% 8164 out of 8164
    active_clients_time.....................................................: avg=16.02ms  min=1ms      med=5ms     max=513ms   p(90)=45ms     p(95)=77ms    
    attach_documents........................................................: 8164    52.513505/s
    attach_documents_success_rate...........................................: 100.00% 8164 out of 8164
    attach_documents_time...................................................: avg=103.57ms min=3ms      med=51ms    max=896ms   p(90)=287.69ms p(95)=378.84ms
    deactivate_clients......................................................: 8164    52.513505/s
    deactivate_clients_success_rate.........................................: 100.00% 8164 out of 8164
    deactivate_clients_time.................................................: avg=124.31ms min=3ms      med=59ms    max=901ms   p(90)=347ms    p(95)=460.69ms
    pushpulls...............................................................: 40820   262.567526/s
    pushpulls_success_rate..................................................: 100.00% 40820 out of 40820
    pushpulls_time..........................................................: avg=62.93ms  min=1ms      med=28ms    max=783ms   p(90)=171ms    p(95)=236ms   
    transaction_success_rate................................................: 100.00% 8164 out of 8164
    transaction_time........................................................: avg=6.62s    min=6.02s    med=6.63s   max=8.63s   p(90)=7.26s    p(95)=7.48s   

    HTTP
    http_req_duration.......................................................: avg=62.87ms  min=866.41µs med=19.43ms max=900.9ms p(90)=179.15ms p(95)=258.36ms
      { expected_response:true }............................................: avg=62.87ms  min=866.41µs med=19.43ms max=900.9ms p(90)=179.15ms p(95)=258.36ms
    http_req_failed.........................................................: 0.00%   0 out of 65312
    http_reqs...............................................................: 65312   420.108041/s

    EXECUTION
    iteration_duration......................................................: avg=6.62s    min=6.02s    med=6.63s   max=8.63s   p(90)=7.26s    p(95)=7.48s   
    iterations..............................................................: 8164    52.513505/s
    vus.....................................................................: 8       min=8              max=500
    vus_max.................................................................: 500     min=500            max=500

    NETWORK
    data_received...........................................................: 1.2 GB  7.5 MB/s
    data_sent...............................................................: 61 MB   395 kB/s




running (2m35.5s), 000/500 VUs, 8164 complete and 0 interrupted iterations
default ✓ [ 100% ] 000/500 VUs  2m30s
