
         /\      Grafana   /‾‾/  
    /\  /  \     |\  __   /  /   
   /  \/    \    | |/ /  /   ‾‾\ 
  /          \   |   (  |  (‾)  |
 / __________ \  |_|\_\  \_____/ 

     execution: local
        script: test/k6/presence.ts
        output: -

     scenarios: (100.00%) 1 scenario, 500 max VUs, 3m0s max duration (incl. graceful stop):
              * default: Up to 500 looping VUs for 2m30s over 3 stages (gracefulRampDown: 30s, gracefulStop: 30s)


running (0m00.9s), 008/500 VUs, 0 complete and 0 interrupted iterations
default   [   1% ] 008/500 VUs  0m00.9s/2m30.0s

running (0m01.9s), 016/500 VUs, 0 complete and 0 interrupted iterations
default   [   1% ] 016/500 VUs  0m01.9s/2m30.0s

running (0m02.9s), 024/500 VUs, 0 complete and 0 interrupted iterations
default   [   2% ] 024/500 VUs  0m02.9s/2m30.0s

running (0m03.9s), 033/500 VUs, 0 complete and 0 interrupted iterations
default   [   3% ] 033/500 VUs  0m03.9s/2m30.0s

running (0m04.9s), 041/500 VUs, 0 complete and 0 interrupted iterations
default   [   3% ] 041/500 VUs  0m04.9s/2m30.0s

running (0m05.9s), 049/500 VUs, 0 complete and 0 interrupted iterations
default   [   4% ] 049/500 VUs  0m05.9s/2m30.0s

running (0m06.9s), 057/500 VUs, 7 complete and 0 interrupted iterations
default   [   5% ] 057/500 VUs  0m06.9s/2m30.0s

running (0m07.9s), 066/500 VUs, 16 complete and 0 interrupted iterations
default   [   5% ] 066/500 VUs  0m07.9s/2m30.0s

running (0m08.9s), 074/500 VUs, 24 complete and 0 interrupted iterations
default   [   6% ] 074/500 VUs  0m08.9s/2m30.0s

running (0m09.9s), 082/500 VUs, 32 complete and 0 interrupted iterations
default   [   7% ] 082/500 VUs  0m09.9s/2m30.0s

running (0m10.9s), 091/500 VUs, 41 complete and 0 interrupted iterations
default   [   7% ] 091/500 VUs  0m10.9s/2m30.0s

running (0m11.9s), 099/500 VUs, 49 complete and 0 interrupted iterations
default   [   8% ] 099/500 VUs  0m11.9s/2m30.0s

running (0m12.9s), 107/500 VUs, 64 complete and 0 interrupted iterations
default   [   9% ] 107/500 VUs  0m12.9s/2m30.0s

running (0m13.9s), 116/500 VUs, 82 complete and 0 interrupted iterations
default   [   9% ] 116/500 VUs  0m13.9s/2m30.0s

running (0m14.9s), 124/500 VUs, 98 complete and 0 interrupted iterations
default   [  10% ] 124/500 VUs  0m14.9s/2m30.0s

running (0m15.9s), 132/500 VUs, 114 complete and 0 interrupted iterations
default   [  11% ] 132/500 VUs  0m15.9s/2m30.0s

running (0m16.9s), 141/500 VUs, 131 complete and 0 interrupted iterations
default   [  11% ] 141/500 VUs  0m16.9s/2m30.0s

running (0m17.9s), 149/500 VUs, 148 complete and 0 interrupted iterations
default   [  12% ] 149/500 VUs  0m17.9s/2m30.0s

running (0m18.9s), 157/500 VUs, 171 complete and 0 interrupted iterations
default   [  13% ] 157/500 VUs  0m18.9s/2m30.0s

running (0m19.9s), 166/500 VUs, 195 complete and 0 interrupted iterations
default   [  13% ] 166/500 VUs  0m19.9s/2m30.0s

running (0m20.9s), 174/500 VUs, 222 complete and 0 interrupted iterations
default   [  14% ] 174/500 VUs  0m20.9s/2m30.0s

running (0m21.9s), 182/500 VUs, 246 complete and 0 interrupted iterations
default   [  15% ] 182/500 VUs  0m21.9s/2m30.0s

running (0m22.9s), 191/500 VUs, 270 complete and 0 interrupted iterations
default   [  15% ] 191/500 VUs  0m22.9s/2m30.0s

running (0m23.9s), 199/500 VUs, 297 complete and 0 interrupted iterations
default   [  16% ] 199/500 VUs  0m23.9s/2m30.0s

running (0m24.9s), 207/500 VUs, 328 complete and 0 interrupted iterations
default   [  17% ] 207/500 VUs  0m24.9s/2m30.0s

running (0m25.9s), 215/500 VUs, 360 complete and 0 interrupted iterations
default   [  17% ] 215/500 VUs  0m25.9s/2m30.0s

running (0m26.9s), 224/500 VUs, 394 complete and 0 interrupted iterations
default   [  18% ] 224/500 VUs  0m26.9s/2m30.0s

running (0m27.9s), 232/500 VUs, 428 complete and 0 interrupted iterations
default   [  19% ] 232/500 VUs  0m27.9s/2m30.0s

running (0m28.9s), 240/500 VUs, 460 complete and 0 interrupted iterations
default   [  19% ] 240/500 VUs  0m28.9s/2m30.0s

running (0m29.9s), 249/500 VUs, 493 complete and 0 interrupted iterations
default   [  20% ] 249/500 VUs  0m29.9s/2m30.0s

running (0m30.9s), 257/500 VUs, 535 complete and 0 interrupted iterations
default   [  21% ] 257/500 VUs  0m30.9s/2m30.0s

running (0m31.9s), 265/500 VUs, 575 complete and 0 interrupted iterations
default   [  21% ] 265/500 VUs  0m31.9s/2m30.0s

running (0m32.9s), 274/500 VUs, 617 complete and 0 interrupted iterations
default   [  22% ] 274/500 VUs  0m32.9s/2m30.0s

running (0m33.9s), 282/500 VUs, 660 complete and 0 interrupted iterations
default   [  23% ] 282/500 VUs  0m33.9s/2m30.0s

running (0m34.9s), 290/500 VUs, 700 complete and 0 interrupted iterations
default   [  23% ] 290/500 VUs  0m34.9s/2m30.0s

running (0m35.9s), 299/500 VUs, 740 complete and 0 interrupted iterations
default   [  24% ] 299/500 VUs  0m35.9s/2m30.0s

running (0m36.9s), 307/500 VUs, 789 complete and 0 interrupted iterations
default   [  25% ] 307/500 VUs  0m36.9s/2m30.0s

running (0m37.9s), 315/500 VUs, 840 complete and 0 interrupted iterations
default   [  25% ] 315/500 VUs  0m37.9s/2m30.0s

running (0m38.9s), 324/500 VUs, 888 complete and 0 interrupted iterations
default   [  26% ] 324/500 VUs  0m38.9s/2m30.0s

running (0m39.9s), 332/500 VUs, 938 complete and 0 interrupted iterations
default   [  27% ] 332/500 VUs  0m39.9s/2m30.0s

running (0m40.9s), 340/500 VUs, 989 complete and 0 interrupted iterations
default   [  27% ] 340/500 VUs  0m40.9s/2m30.0s

running (0m41.9s), 349/500 VUs, 1038 complete and 0 interrupted iterations
default   [  28% ] 349/500 VUs  0m41.9s/2m30.0s

running (0m42.9s), 357/500 VUs, 1094 complete and 0 interrupted iterations
default   [  29% ] 357/500 VUs  0m42.9s/2m30.0s

running (0m43.9s), 365/500 VUs, 1150 complete and 0 interrupted iterations
default   [  29% ] 365/500 VUs  0m43.9s/2m30.0s

running (0m44.9s), 374/500 VUs, 1207 complete and 0 interrupted iterations
default   [  30% ] 374/500 VUs  0m44.9s/2m30.0s

running (0m45.9s), 382/500 VUs, 1264 complete and 0 interrupted iterations
default   [  31% ] 382/500 VUs  0m45.9s/2m30.0s

running (0m46.9s), 390/500 VUs, 1323 complete and 0 interrupted iterations
default   [  31% ] 390/500 VUs  0m46.9s/2m30.0s

running (0m47.9s), 398/500 VUs, 1382 complete and 0 interrupted iterations
default   [  32% ] 398/500 VUs  0m47.9s/2m30.0s

running (0m48.9s), 407/500 VUs, 1443 complete and 0 interrupted iterations
default   [  33% ] 407/500 VUs  0m48.9s/2m30.0s

running (0m49.9s), 415/500 VUs, 1507 complete and 0 interrupted iterations
default   [  33% ] 415/500 VUs  0m49.9s/2m30.0s

running (0m50.9s), 424/500 VUs, 1573 complete and 0 interrupted iterations
default   [  34% ] 424/500 VUs  0m50.9s/2m30.0s

running (0m51.9s), 432/500 VUs, 1642 complete and 0 interrupted iterations
default   [  35% ] 432/500 VUs  0m51.9s/2m30.0s

running (0m52.9s), 440/500 VUs, 1708 complete and 0 interrupted iterations
default   [  35% ] 440/500 VUs  0m52.9s/2m30.0s

running (0m53.9s), 448/500 VUs, 1764 complete and 0 interrupted iterations
default   [  36% ] 448/500 VUs  0m53.9s/2m30.0s

running (0m54.9s), 456/500 VUs, 1824 complete and 0 interrupted iterations
default   [  37% ] 456/500 VUs  0m54.9s/2m30.0s

running (0m55.9s), 465/500 VUs, 1896 complete and 0 interrupted iterations
default   [  37% ] 465/500 VUs  0m55.9s/2m30.0s

running (0m56.9s), 473/500 VUs, 1965 complete and 0 interrupted iterations
default   [  38% ] 473/500 VUs  0m56.9s/2m30.0s

running (0m57.9s), 482/500 VUs, 2032 complete and 0 interrupted iterations
default   [  39% ] 482/500 VUs  0m57.9s/2m30.0s

running (0m58.9s), 490/500 VUs, 2097 complete and 0 interrupted iterations
default   [  39% ] 490/500 VUs  0m58.9s/2m30.0s

running (0m59.9s), 498/500 VUs, 2169 complete and 0 interrupted iterations
default   [  40% ] 498/500 VUs  0m59.9s/2m30.0s

running (1m00.9s), 500/500 VUs, 2244 complete and 0 interrupted iterations
default   [  41% ] 500/500 VUs  1m00.9s/2m30.0s

running (1m01.9s), 500/500 VUs, 2300 complete and 0 interrupted iterations
default   [  41% ] 500/500 VUs  1m01.9s/2m30.0s

running (1m02.9s), 500/500 VUs, 2377 complete and 0 interrupted iterations
default   [  42% ] 500/500 VUs  1m02.9s/2m30.0s

running (1m03.9s), 500/500 VUs, 2463 complete and 0 interrupted iterations
default   [  43% ] 500/500 VUs  1m03.9s/2m30.0s

running (1m04.9s), 500/500 VUs, 2546 complete and 0 interrupted iterations
default   [  43% ] 500/500 VUs  1m04.9s/2m30.0s

running (1m05.9s), 500/500 VUs, 2612 complete and 0 interrupted iterations
default   [  44% ] 500/500 VUs  1m05.9s/2m30.0s

running (1m06.9s), 500/500 VUs, 2684 complete and 0 interrupted iterations
default   [  45% ] 500/500 VUs  1m06.9s/2m30.0s

running (1m07.9s), 500/500 VUs, 2753 complete and 0 interrupted iterations
default   [  45% ] 500/500 VUs  1m07.9s/2m30.0s

running (1m08.9s), 500/500 VUs, 2843 complete and 0 interrupted iterations
default   [  46% ] 500/500 VUs  1m08.9s/2m30.0s

running (1m09.9s), 500/500 VUs, 2896 complete and 0 interrupted iterations
default   [  47% ] 500/500 VUs  1m09.9s/2m30.0s

running (1m10.9s), 500/500 VUs, 2965 complete and 0 interrupted iterations
default   [  47% ] 500/500 VUs  1m10.9s/2m30.0s

running (1m12.3s), 500/500 VUs, 3087 complete and 0 interrupted iterations
default   [  48% ] 500/500 VUs  1m12.3s/2m30.0s

running (1m12.9s), 500/500 VUs, 3118 complete and 0 interrupted iterations
default   [  49% ] 500/500 VUs  1m12.9s/2m30.0s

running (1m13.9s), 500/500 VUs, 3191 complete and 0 interrupted iterations
default   [  49% ] 500/500 VUs  1m13.9s/2m30.0s

running (1m14.9s), 500/500 VUs, 3267 complete and 0 interrupted iterations
default   [  50% ] 500/500 VUs  1m14.9s/2m30.0s

running (1m15.9s), 500/500 VUs, 3341 complete and 0 interrupted iterations
default   [  51% ] 500/500 VUs  1m15.9s/2m30.0s

running (1m16.9s), 500/500 VUs, 3413 complete and 0 interrupted iterations
default   [  51% ] 500/500 VUs  1m16.9s/2m30.0s

running (1m17.9s), 500/500 VUs, 3472 complete and 0 interrupted iterations
default   [  52% ] 500/500 VUs  1m17.9s/2m30.0s

running (1m19.0s), 500/500 VUs, 3568 complete and 0 interrupted iterations
default   [  53% ] 500/500 VUs  1m19.0s/2m30.0s

running (1m19.9s), 500/500 VUs, 3646 complete and 0 interrupted iterations
default   [  53% ] 500/500 VUs  1m19.9s/2m30.0s

running (1m20.9s), 500/500 VUs, 3696 complete and 0 interrupted iterations
default   [  54% ] 500/500 VUs  1m20.9s/2m30.0s

running (1m21.9s), 500/500 VUs, 3771 complete and 0 interrupted iterations
default   [  55% ] 500/500 VUs  1m21.9s/2m30.0s

running (1m22.9s), 500/500 VUs, 3832 complete and 0 interrupted iterations
default   [  55% ] 500/500 VUs  1m22.9s/2m30.0s

running (1m23.9s), 500/500 VUs, 3909 complete and 0 interrupted iterations
default   [  56% ] 500/500 VUs  1m23.9s/2m30.0s

running (1m24.9s), 500/500 VUs, 4007 complete and 0 interrupted iterations
default   [  57% ] 500/500 VUs  1m24.9s/2m30.0s

running (1m25.9s), 500/500 VUs, 4079 complete and 0 interrupted iterations
default   [  57% ] 500/500 VUs  1m25.9s/2m30.0s

running (1m26.9s), 500/500 VUs, 4156 complete and 0 interrupted iterations
default   [  58% ] 500/500 VUs  1m26.9s/2m30.0s

running (1m27.9s), 500/500 VUs, 4218 complete and 0 interrupted iterations
default   [  59% ] 500/500 VUs  1m27.9s/2m30.0s

running (1m28.9s), 500/500 VUs, 4295 complete and 0 interrupted iterations
default   [  59% ] 500/500 VUs  1m28.9s/2m30.0s

running (1m29.9s), 500/500 VUs, 4352 complete and 0 interrupted iterations
default   [  60% ] 500/500 VUs  1m29.9s/2m30.0s

running (1m30.9s), 500/500 VUs, 4439 complete and 0 interrupted iterations
default   [  61% ] 500/500 VUs  1m30.9s/2m30.0s

running (1m31.9s), 500/500 VUs, 4527 complete and 0 interrupted iterations
default   [  61% ] 500/500 VUs  1m31.9s/2m30.0s

running (1m32.9s), 500/500 VUs, 4600 complete and 0 interrupted iterations
default   [  62% ] 500/500 VUs  1m32.9s/2m30.0s

running (1m33.9s), 500/500 VUs, 4678 complete and 0 interrupted iterations
default   [  63% ] 500/500 VUs  1m33.9s/2m30.0s

running (1m34.9s), 500/500 VUs, 4733 complete and 0 interrupted iterations
default   [  63% ] 500/500 VUs  1m34.9s/2m30.0s

running (1m35.9s), 500/500 VUs, 4818 complete and 0 interrupted iterations
default   [  64% ] 500/500 VUs  1m35.9s/2m30.0s

running (1m36.9s), 500/500 VUs, 4892 complete and 0 interrupted iterations
default   [  65% ] 500/500 VUs  1m36.9s/2m30.0s

running (1m37.9s), 500/500 VUs, 4934 complete and 0 interrupted iterations
default   [  65% ] 500/500 VUs  1m37.9s/2m30.0s

running (1m38.9s), 500/500 VUs, 5023 complete and 0 interrupted iterations
default   [  66% ] 500/500 VUs  1m38.9s/2m30.0s

running (1m39.9s), 500/500 VUs, 5122 complete and 0 interrupted iterations
default   [  67% ] 500/500 VUs  1m39.9s/2m30.0s

running (1m40.9s), 500/500 VUs, 5156 complete and 0 interrupted iterations
default   [  67% ] 500/500 VUs  1m40.9s/2m30.0s

running (1m41.9s), 500/500 VUs, 5238 complete and 0 interrupted iterations
default   [  68% ] 500/500 VUs  1m41.9s/2m30.0s

running (1m42.9s), 500/500 VUs, 5328 complete and 0 interrupted iterations
default   [  69% ] 500/500 VUs  1m42.9s/2m30.0s

running (1m43.9s), 500/500 VUs, 5396 complete and 0 interrupted iterations
default   [  69% ] 500/500 VUs  1m43.9s/2m30.0s

running (1m44.9s), 500/500 VUs, 5474 complete and 0 interrupted iterations
default   [  70% ] 500/500 VUs  1m44.9s/2m30.0s

running (1m45.9s), 500/500 VUs, 5530 complete and 0 interrupted iterations
default   [  71% ] 500/500 VUs  1m45.9s/2m30.0s

running (1m46.9s), 500/500 VUs, 5613 complete and 0 interrupted iterations
default   [  71% ] 500/500 VUs  1m46.9s/2m30.0s

running (1m47.9s), 500/500 VUs, 5700 complete and 0 interrupted iterations
default   [  72% ] 500/500 VUs  1m47.9s/2m30.0s

running (1m48.9s), 500/500 VUs, 5743 complete and 0 interrupted iterations
default   [  73% ] 500/500 VUs  1m48.9s/2m30.0s

running (1m49.9s), 500/500 VUs, 5832 complete and 0 interrupted iterations
default   [  73% ] 500/500 VUs  1m49.9s/2m30.0s

running (1m50.9s), 500/500 VUs, 5870 complete and 0 interrupted iterations
default   [  74% ] 500/500 VUs  1m50.9s/2m30.0s

running (1m52.0s), 500/500 VUs, 5959 complete and 0 interrupted iterations
default   [  75% ] 500/500 VUs  1m52.0s/2m30.0s

running (1m53.0s), 500/500 VUs, 6050 complete and 0 interrupted iterations
default   [  75% ] 500/500 VUs  1m53.0s/2m30.0s

running (1m53.9s), 500/500 VUs, 6109 complete and 0 interrupted iterations
default   [  76% ] 500/500 VUs  1m53.9s/2m30.0s

running (1m54.9s), 500/500 VUs, 6180 complete and 0 interrupted iterations
default   [  77% ] 500/500 VUs  1m54.9s/2m30.0s

running (1m55.9s), 500/500 VUs, 6291 complete and 0 interrupted iterations
default   [  77% ] 500/500 VUs  1m55.9s/2m30.0s

running (1m56.9s), 500/500 VUs, 6318 complete and 0 interrupted iterations
default   [  78% ] 500/500 VUs  1m56.9s/2m30.0s

running (1m57.9s), 500/500 VUs, 6411 complete and 0 interrupted iterations
default   [  79% ] 500/500 VUs  1m57.9s/2m30.0s

running (1m58.9s), 500/500 VUs, 6485 complete and 0 interrupted iterations
default   [  79% ] 500/500 VUs  1m58.9s/2m30.0s

running (1m59.9s), 500/500 VUs, 6543 complete and 0 interrupted iterations
default   [  80% ] 500/500 VUs  1m59.9s/2m30.0s

running (2m00.9s), 498/500 VUs, 6619 complete and 0 interrupted iterations
default   [  81% ] 498/500 VUs  2m00.9s/2m30.0s

running (2m01.9s), 495/500 VUs, 6696 complete and 0 interrupted iterations
default   [  81% ] 495/500 VUs  2m01.9s/2m30.0s

running (2m02.9s), 490/500 VUs, 6767 complete and 0 interrupted iterations
default   [  82% ] 490/500 VUs  2m02.9s/2m30.0s

running (2m03.9s), 488/500 VUs, 6818 complete and 0 interrupted iterations
default   [  83% ] 488/500 VUs  2m03.9s/2m30.0s

running (2m05.2s), 470/500 VUs, 6910 complete and 0 interrupted iterations
default   [  83% ] 470/500 VUs  2m05.2s/2m30.0s

running (2m05.9s), 457/500 VUs, 6968 complete and 0 interrupted iterations
default   [  84% ] 457/500 VUs  2m05.9s/2m30.0s

running (2m06.9s), 448/500 VUs, 7042 complete and 0 interrupted iterations
default   [  85% ] 448/500 VUs  2m06.9s/2m30.0s

running (2m07.9s), 425/500 VUs, 7119 complete and 0 interrupted iterations
default   [  85% ] 425/500 VUs  2m07.9s/2m30.0s

running (2m08.9s), 408/500 VUs, 7173 complete and 0 interrupted iterations
default   [  86% ] 408/500 VUs  2m08.9s/2m30.0s

running (2m09.9s), 384/500 VUs, 7262 complete and 0 interrupted iterations
default   [  87% ] 384/500 VUs  2m09.9s/2m30.0s

running (2m10.9s), 378/500 VUs, 7315 complete and 0 interrupted iterations
default   [  87% ] 378/500 VUs  2m10.9s/2m30.0s

running (2m11.9s), 364/500 VUs, 7376 complete and 0 interrupted iterations
default   [  88% ] 364/500 VUs  2m11.9s/2m30.0s

running (2m12.9s), 344/500 VUs, 7460 complete and 0 interrupted iterations
default   [  89% ] 344/500 VUs  2m12.9s/2m30.0s

running (2m13.9s), 322/500 VUs, 7534 complete and 0 interrupted iterations
default   [  89% ] 322/500 VUs  2m13.9s/2m30.0s

running (2m14.9s), 307/500 VUs, 7579 complete and 0 interrupted iterations
default   [  90% ] 307/500 VUs  2m14.9s/2m30.0s

running (2m15.9s), 285/500 VUs, 7646 complete and 0 interrupted iterations
default   [  91% ] 285/500 VUs  2m15.9s/2m30.0s

running (2m16.9s), 271/500 VUs, 7690 complete and 0 interrupted iterations
default   [  91% ] 271/500 VUs  2m16.9s/2m30.0s

running (2m17.9s), 255/500 VUs, 7738 complete and 0 interrupted iterations
default   [  92% ] 255/500 VUs  2m17.9s/2m30.0s

running (2m18.9s), 233/500 VUs, 7804 complete and 0 interrupted iterations
default   [  93% ] 233/500 VUs  2m18.9s/2m30.0s

running (2m19.9s), 208/500 VUs, 7856 complete and 0 interrupted iterations
default   [  93% ] 208/500 VUs  2m19.9s/2m30.0s

running (2m20.9s), 199/500 VUs, 7883 complete and 0 interrupted iterations
default   [  94% ] 199/500 VUs  2m20.9s/2m30.0s

running (2m21.9s), 181/500 VUs, 7929 complete and 0 interrupted iterations
default   [  95% ] 181/500 VUs  2m21.9s/2m30.0s

running (2m22.9s), 171/500 VUs, 7957 complete and 0 interrupted iterations
default   [  95% ] 171/500 VUs  2m22.9s/2m30.0s

running (2m23.9s), 157/500 VUs, 7991 complete and 0 interrupted iterations
default   [  96% ] 157/500 VUs  2m23.9s/2m30.0s

running (2m24.9s), 134/500 VUs, 8037 complete and 0 interrupted iterations
default   [  97% ] 134/500 VUs  2m24.9s/2m30.0s

running (2m25.9s), 116/500 VUs, 8064 complete and 0 interrupted iterations
default   [  97% ] 116/500 VUs  2m25.9s/2m30.0s

running (2m26.9s), 105/500 VUs, 8079 complete and 0 interrupted iterations
default   [  98% ] 105/500 VUs  2m26.9s/2m30.0s

running (2m27.9s), 083/500 VUs, 8109 complete and 0 interrupted iterations
default   [  99% ] 083/500 VUs  2m27.9s/2m30.0s

running (2m28.9s), 068/500 VUs, 8128 complete and 0 interrupted iterations
default   [  99% ] 068/500 VUs  2m28.9s/2m30.0s

running (2m29.9s), 052/500 VUs, 8148 complete and 0 interrupted iterations
default   [ 100% ] 052/500 VUs  2m29.9s/2m30.0s

running (2m30.9s), 029/500 VUs, 8171 complete and 0 interrupted iterations
default ↓ [ 100% ] 047/500 VUs  2m30s

running (2m31.9s), 020/500 VUs, 8180 complete and 0 interrupted iterations
default ↓ [ 100% ] 047/500 VUs  2m30s

running (2m32.9s), 016/500 VUs, 8184 complete and 0 interrupted iterations
default ↓ [ 100% ] 047/500 VUs  2m30s

running (2m33.9s), 008/500 VUs, 8192 complete and 0 interrupted iterations
default ↓ [ 100% ] 047/500 VUs  2m30s

running (2m34.9s), 005/500 VUs, 8195 complete and 0 interrupted iterations
default ↓ [ 100% ] 047/500 VUs  2m30s


  █ THRESHOLDS 

    active_clients_time
    ✓ 'p(95)<500' p(95)=123ms

    attach_documents_time
    ✓ 'p(95)<10000' p(95)=481.04ms

    deactivate_clients_time
    ✓ 'p(95)<10000' p(95)=151.04ms

    http_req_duration
    ✓ 'p(95)<10000' p(95)=242.55ms

    pushpulls_time
    ✓ 'p(95)<1000' p(95)=276ms

    transaction_success_rate
    ✓ 'rate>0.99' rate=100.00%

    transaction_time
    ✓ 'p(95)<30000' p(95)=7.41s


  █ TOTAL RESULTS 

    checks_total.......: 131200  842.917991/s
    checks_succeeded...: 100.00% 131200 out of 131200
    checks_failed......: 0.00%   0 out of 131200

    ✓ status is 200
    ✓ response has valid body

    CUSTOM
    active_clients....................: 8200    52.682374/s
    active_clients_success_rate.......: 100.00% 8200 out of 8200
    active_clients_time...............: avg=27.41ms  min=0s      med=6ms     max=465ms   p(90)=86ms     p(95)=123ms   
    attach_documents..................: 8200    52.682374/s
    attach_documents_success_rate.....: 100.00% 8200 out of 8200
    attach_documents_time.............: avg=123.08ms min=3ms     med=38ms    max=1s      p(90)=371ms    p(95)=481.04ms
    deactivate_clients................: 8200    52.682374/s
    deactivate_clients_success_rate...: 100.00% 8200 out of 8200
    deactivate_clients_time...........: avg=29.6ms   min=0s      med=4ms     max=683ms   p(90)=87ms     p(95)=151.04ms
    pushpulls.........................: 41000   263.411872/s
    pushpulls_success_rate............: 100.00% 41000 out of 41000
    pushpulls_time....................: avg=67.07ms  min=1ms     med=23ms    max=848ms   p(90)=194ms    p(95)=276ms   
    transaction_success_rate..........: 100.00% 8200 out of 8200
    transaction_time..................: avg=6.59s    min=6.01s   med=6.58s   max=8.97s   p(90)=7.23s    p(95)=7.41s   

    HTTP
    http_req_duration.................: avg=55.67ms  min=190.2µs med=12.64ms max=958.6ms p(90)=167.82ms p(95)=242.55ms
      { expected_response:true }......: avg=55.67ms  min=190.2µs med=12.64ms max=958.6ms p(90)=167.82ms p(95)=242.55ms
    http_req_failed...................: 0.00%   0 out of 65600
    http_reqs.........................: 65600   421.458995/s

    EXECUTION
    iteration_duration................: avg=6.59s    min=6.01s   med=6.58s   max=8.97s   p(90)=7.23s    p(95)=7.41s   
    iterations........................: 8200    52.682374/s
    vus...............................: 5       min=5              max=500
    vus_max...........................: 500     min=500            max=500

    NETWORK
    data_received.....................: 1.2 GB  7.6 MB/s
    data_sent.........................: 62 MB   397 kB/s




running (2m35.6s), 000/500 VUs, 8200 complete and 0 interrupted iterations
default ✓ [ 100% ] 000/500 VUs  2m30s
