
         /\      Grafana   /‾‾/  
    /\  /  \     |\  __   /  /   
   /  \/    \    | |/ /  /   ‾‾\ 
  /          \   |   (  |  (‾)  |
 / __________ \  |_|\_\  \_____/ 

     execution: local
        script: test/k6/presence.ts
        output: -

     scenarios: (100.00%) 1 scenario, 500 max VUs, 3m0s max duration (incl. graceful stop):
              * default: Up to 500 looping VUs for 2m30s over 3 stages (gracefulRampDown: 30s, gracefulStop: 30s)


running (0m00.9s), 008/500 VUs, 0 complete and 0 interrupted iterations
default   [   1% ] 008/500 VUs  0m00.9s/2m30.0s

running (0m01.9s), 016/500 VUs, 0 complete and 0 interrupted iterations
default   [   1% ] 016/500 VUs  0m01.9s/2m30.0s

running (0m02.9s), 025/500 VUs, 0 complete and 0 interrupted iterations
default   [   2% ] 025/500 VUs  0m02.9s/2m30.0s

running (0m03.9s), 033/500 VUs, 0 complete and 0 interrupted iterations
default   [   3% ] 033/500 VUs  0m03.9s/2m30.0s

running (0m04.9s), 041/500 VUs, 0 complete and 0 interrupted iterations
default   [   3% ] 041/500 VUs  0m04.9s/2m30.0s

running (0m05.9s), 049/500 VUs, 0 complete and 0 interrupted iterations
default   [   4% ] 049/500 VUs  0m05.9s/2m30.0s

running (0m06.9s), 058/500 VUs, 8 complete and 0 interrupted iterations
default   [   5% ] 058/500 VUs  0m06.9s/2m30.0s

running (0m07.9s), 066/500 VUs, 16 complete and 0 interrupted iterations
default   [   5% ] 066/500 VUs  0m07.9s/2m30.0s

running (0m08.9s), 074/500 VUs, 24 complete and 0 interrupted iterations
default   [   6% ] 074/500 VUs  0m08.9s/2m30.0s

running (0m09.9s), 083/500 VUs, 33 complete and 0 interrupted iterations
default   [   7% ] 083/500 VUs  0m09.9s/2m30.0s

running (0m10.9s), 091/500 VUs, 41 complete and 0 interrupted iterations
default   [   7% ] 091/500 VUs  0m10.9s/2m30.0s

running (0m11.9s), 099/500 VUs, 49 complete and 0 interrupted iterations
default   [   8% ] 099/500 VUs  0m11.9s/2m30.0s

running (0m12.9s), 108/500 VUs, 65 complete and 0 interrupted iterations
default   [   9% ] 108/500 VUs  0m12.9s/2m30.0s

running (0m13.9s), 116/500 VUs, 82 complete and 0 interrupted iterations
default   [   9% ] 116/500 VUs  0m13.9s/2m30.0s

running (0m14.9s), 124/500 VUs, 98 complete and 0 interrupted iterations
default   [  10% ] 124/500 VUs  0m14.9s/2m30.0s

running (0m15.9s), 133/500 VUs, 114 complete and 0 interrupted iterations
default   [  11% ] 133/500 VUs  0m15.9s/2m30.0s

running (0m16.9s), 141/500 VUs, 132 complete and 0 interrupted iterations
default   [  11% ] 141/500 VUs  0m16.9s/2m30.0s

running (0m17.9s), 149/500 VUs, 148 complete and 0 interrupted iterations
default   [  12% ] 149/500 VUs  0m17.9s/2m30.0s

running (0m18.9s), 158/500 VUs, 171 complete and 0 interrupted iterations
default   [  13% ] 158/500 VUs  0m18.9s/2m30.0s

running (0m19.9s), 166/500 VUs, 197 complete and 0 interrupted iterations
default   [  13% ] 166/500 VUs  0m19.9s/2m30.0s

running (0m20.9s), 174/500 VUs, 222 complete and 0 interrupted iterations
default   [  14% ] 174/500 VUs  0m20.9s/2m30.0s

running (0m21.9s), 183/500 VUs, 246 complete and 0 interrupted iterations
default   [  15% ] 183/500 VUs  0m21.9s/2m30.0s

running (0m22.9s), 191/500 VUs, 272 complete and 0 interrupted iterations
default   [  15% ] 191/500 VUs  0m22.9s/2m30.0s

running (0m23.9s), 199/500 VUs, 297 complete and 0 interrupted iterations
default   [  16% ] 199/500 VUs  0m23.9s/2m30.0s

running (0m24.9s), 207/500 VUs, 328 complete and 0 interrupted iterations
default   [  17% ] 207/500 VUs  0m24.9s/2m30.0s

running (0m25.9s), 216/500 VUs, 361 complete and 0 interrupted iterations
default   [  17% ] 216/500 VUs  0m25.9s/2m30.0s

running (0m26.9s), 224/500 VUs, 396 complete and 0 interrupted iterations
default   [  18% ] 224/500 VUs  0m26.9s/2m30.0s

running (0m27.9s), 232/500 VUs, 428 complete and 0 interrupted iterations
default   [  19% ] 232/500 VUs  0m27.9s/2m30.0s

running (0m28.9s), 241/500 VUs, 461 complete and 0 interrupted iterations
default   [  19% ] 241/500 VUs  0m28.9s/2m30.0s

running (0m29.9s), 249/500 VUs, 495 complete and 0 interrupted iterations
default   [  20% ] 249/500 VUs  0m29.9s/2m30.0s

running (0m30.9s), 257/500 VUs, 534 complete and 0 interrupted iterations
default   [  21% ] 257/500 VUs  0m30.9s/2m30.0s

running (0m31.9s), 266/500 VUs, 576 complete and 0 interrupted iterations
default   [  21% ] 266/500 VUs  0m31.9s/2m30.0s

running (0m32.9s), 274/500 VUs, 617 complete and 0 interrupted iterations
default   [  22% ] 274/500 VUs  0m32.9s/2m30.0s

running (0m33.9s), 282/500 VUs, 660 complete and 0 interrupted iterations
default   [  23% ] 282/500 VUs  0m33.9s/2m30.0s

running (0m34.9s), 291/500 VUs, 701 complete and 0 interrupted iterations
default   [  23% ] 291/500 VUs  0m34.9s/2m30.0s

running (0m35.9s), 299/500 VUs, 742 complete and 0 interrupted iterations
default   [  24% ] 299/500 VUs  0m35.9s/2m30.0s

running (0m36.9s), 307/500 VUs, 790 complete and 0 interrupted iterations
default   [  25% ] 307/500 VUs  0m36.9s/2m30.0s

running (0m37.9s), 316/500 VUs, 838 complete and 0 interrupted iterations
default   [  25% ] 316/500 VUs  0m37.9s/2m30.0s

running (0m38.9s), 324/500 VUs, 889 complete and 0 interrupted iterations
default   [  26% ] 324/500 VUs  0m38.9s/2m30.0s

running (0m39.9s), 332/500 VUs, 937 complete and 0 interrupted iterations
default   [  27% ] 332/500 VUs  0m39.9s/2m30.0s

running (0m40.9s), 341/500 VUs, 988 complete and 0 interrupted iterations
default   [  27% ] 341/500 VUs  0m40.9s/2m30.0s

running (0m41.9s), 349/500 VUs, 1036 complete and 0 interrupted iterations
default   [  28% ] 349/500 VUs  0m41.9s/2m30.0s

running (0m42.9s), 357/500 VUs, 1094 complete and 0 interrupted iterations
default   [  29% ] 357/500 VUs  0m42.9s/2m30.0s

running (0m43.9s), 365/500 VUs, 1152 complete and 0 interrupted iterations
default   [  29% ] 365/500 VUs  0m43.9s/2m30.0s

running (0m44.9s), 374/500 VUs, 1211 complete and 0 interrupted iterations
default   [  30% ] 374/500 VUs  0m44.9s/2m30.0s

running (0m45.9s), 382/500 VUs, 1269 complete and 0 interrupted iterations
default   [  31% ] 382/500 VUs  0m45.9s/2m30.0s

running (0m46.9s), 390/500 VUs, 1323 complete and 0 interrupted iterations
default   [  31% ] 390/500 VUs  0m46.9s/2m30.0s

running (0m47.9s), 399/500 VUs, 1378 complete and 0 interrupted iterations
default   [  32% ] 399/500 VUs  0m47.9s/2m30.0s

running (0m48.9s), 407/500 VUs, 1442 complete and 0 interrupted iterations
default   [  33% ] 407/500 VUs  0m48.9s/2m30.0s

running (0m49.9s), 415/500 VUs, 1495 complete and 0 interrupted iterations
default   [  33% ] 415/500 VUs  0m49.9s/2m30.0s

running (0m50.9s), 424/500 VUs, 1565 complete and 0 interrupted iterations
default   [  34% ] 424/500 VUs  0m50.9s/2m30.0s

running (0m51.9s), 432/500 VUs, 1621 complete and 0 interrupted iterations
default   [  35% ] 432/500 VUs  0m51.9s/2m30.0s

running (0m52.9s), 438/500 VUs, 1686 complete and 0 interrupted iterations
default   [  35% ] 438/500 VUs  0m52.9s/2m30.0s

running (0m53.9s), 449/500 VUs, 1742 complete and 0 interrupted iterations
default   [  36% ] 449/500 VUs  0m53.9s/2m30.0s

running (0m54.9s), 457/500 VUs, 1809 complete and 0 interrupted iterations
default   [  37% ] 457/500 VUs  0m54.9s/2m30.0s

running (0m55.9s), 465/500 VUs, 1880 complete and 0 interrupted iterations
default   [  37% ] 465/500 VUs  0m55.9s/2m30.0s

running (0m56.9s), 474/500 VUs, 1926 complete and 0 interrupted iterations
default   [  38% ] 474/500 VUs  0m56.9s/2m30.0s

running (0m57.9s), 482/500 VUs, 2004 complete and 0 interrupted iterations
default   [  39% ] 482/500 VUs  0m57.9s/2m30.0s

running (0m58.9s), 490/500 VUs, 2072 complete and 0 interrupted iterations
default   [  39% ] 490/500 VUs  0m58.9s/2m30.0s

running (0m59.9s), 499/500 VUs, 2120 complete and 0 interrupted iterations
default   [  40% ] 499/500 VUs  0m59.9s/2m30.0s

running (1m01.3s), 500/500 VUs, 2207 complete and 0 interrupted iterations
default   [  41% ] 500/500 VUs  1m01.3s/2m30.0s

running (1m01.9s), 500/500 VUs, 2278 complete and 0 interrupted iterations
default   [  41% ] 500/500 VUs  1m01.9s/2m30.0s

running (1m02.9s), 500/500 VUs, 2331 complete and 0 interrupted iterations
default   [  42% ] 500/500 VUs  1m02.9s/2m30.0s

running (1m04.0s), 500/500 VUs, 2404 complete and 0 interrupted iterations
default   [  43% ] 500/500 VUs  1m04.0s/2m30.0s

running (1m04.9s), 500/500 VUs, 2477 complete and 0 interrupted iterations
default   [  43% ] 500/500 VUs  1m04.9s/2m30.0s

running (1m05.9s), 500/500 VUs, 2529 complete and 0 interrupted iterations
default   [  44% ] 500/500 VUs  1m05.9s/2m30.0s

running (1m07.0s), 500/500 VUs, 2618 complete and 0 interrupted iterations
default   [  45% ] 500/500 VUs  1m07.2s/2m30.0s

running (1m07.9s), 500/500 VUs, 2672 complete and 0 interrupted iterations
default   [  45% ] 500/500 VUs  1m07.9s/2m30.0s

running (1m08.9s), 500/500 VUs, 2741 complete and 0 interrupted iterations
default   [  46% ] 500/500 VUs  1m08.9s/2m30.0s

running (1m09.9s), 500/500 VUs, 2811 complete and 0 interrupted iterations
default   [  47% ] 500/500 VUs  1m09.9s/2m30.0s

running (1m10.9s), 500/500 VUs, 2906 complete and 0 interrupted iterations
default   [  47% ] 500/500 VUs  1m10.9s/2m30.0s

running (1m11.9s), 500/500 VUs, 2978 complete and 0 interrupted iterations
default   [  48% ] 500/500 VUs  1m11.9s/2m30.0s

running (1m12.9s), 500/500 VUs, 3057 complete and 0 interrupted iterations
default   [  49% ] 500/500 VUs  1m12.9s/2m30.0s

running (1m13.9s), 500/500 VUs, 3100 complete and 0 interrupted iterations
default   [  49% ] 500/500 VUs  1m13.9s/2m30.0s

running (1m14.9s), 500/500 VUs, 3184 complete and 0 interrupted iterations
default   [  50% ] 500/500 VUs  1m14.9s/2m30.0s

running (1m15.9s), 500/500 VUs, 3250 complete and 0 interrupted iterations
default   [  51% ] 500/500 VUs  1m15.9s/2m30.0s

running (1m16.9s), 500/500 VUs, 3329 complete and 0 interrupted iterations
default   [  51% ] 500/500 VUs  1m16.9s/2m30.0s

running (1m17.9s), 500/500 VUs, 3380 complete and 0 interrupted iterations
default   [  52% ] 500/500 VUs  1m17.9s/2m30.0s

running (1m18.9s), 500/500 VUs, 3466 complete and 0 interrupted iterations
default   [  53% ] 500/500 VUs  1m18.9s/2m30.0s

running (1m19.9s), 500/500 VUs, 3535 complete and 0 interrupted iterations
default   [  53% ] 500/500 VUs  1m19.9s/2m30.0s

running (1m20.9s), 500/500 VUs, 3609 complete and 0 interrupted iterations
default   [  54% ] 500/500 VUs  1m20.9s/2m30.0s

running (1m21.9s), 500/500 VUs, 3668 complete and 0 interrupted iterations
default   [  55% ] 500/500 VUs  1m21.9s/2m30.0s

running (1m22.9s), 500/500 VUs, 3749 complete and 0 interrupted iterations
default   [  55% ] 500/500 VUs  1m22.9s/2m30.0s

running (1m23.9s), 500/500 VUs, 3822 complete and 0 interrupted iterations
default   [  56% ] 500/500 VUs  1m23.9s/2m30.0s

running (1m24.9s), 500/500 VUs, 3864 complete and 0 interrupted iterations
default   [  57% ] 500/500 VUs  1m24.9s/2m30.0s

running (1m25.9s), 500/500 VUs, 3959 complete and 0 interrupted iterations
default   [  57% ] 500/500 VUs  1m25.9s/2m30.0s

running (1m26.9s), 500/500 VUs, 4032 complete and 0 interrupted iterations
default   [  58% ] 500/500 VUs  1m26.9s/2m30.0s

running (1m27.9s), 500/500 VUs, 4110 complete and 0 interrupted iterations
default   [  59% ] 500/500 VUs  1m27.9s/2m30.0s

running (1m28.9s), 500/500 VUs, 4172 complete and 0 interrupted iterations
default   [  59% ] 500/500 VUs  1m28.9s/2m30.0s

running (1m29.9s), 500/500 VUs, 4245 complete and 0 interrupted iterations
default   [  60% ] 500/500 VUs  1m29.9s/2m30.0s

running (1m30.9s), 500/500 VUs, 4327 complete and 0 interrupted iterations
default   [  61% ] 500/500 VUs  1m30.9s/2m30.0s

running (1m31.9s), 500/500 VUs, 4354 complete and 0 interrupted iterations
default   [  61% ] 500/500 VUs  1m31.9s/2m30.0s

running (1m32.9s), 500/500 VUs, 4447 complete and 0 interrupted iterations
default   [  62% ] 500/500 VUs  1m32.9s/2m30.0s

running (1m33.9s), 500/500 VUs, 4514 complete and 0 interrupted iterations
default   [  63% ] 500/500 VUs  1m33.9s/2m30.0s

running (1m34.9s), 500/500 VUs, 4583 complete and 0 interrupted iterations
default   [  63% ] 500/500 VUs  1m34.9s/2m30.0s

running (1m35.9s), 500/500 VUs, 4664 complete and 0 interrupted iterations
default   [  64% ] 500/500 VUs  1m35.9s/2m30.0s

running (1m36.9s), 500/500 VUs, 4721 complete and 0 interrupted iterations
default   [  65% ] 500/500 VUs  1m36.9s/2m30.0s

running (1m37.9s), 500/500 VUs, 4823 complete and 0 interrupted iterations
default   [  65% ] 500/500 VUs  1m37.9s/2m30.0s

running (1m38.9s), 500/500 VUs, 4857 complete and 0 interrupted iterations
default   [  66% ] 500/500 VUs  1m38.9s/2m30.0s

running (1m39.9s), 500/500 VUs, 4930 complete and 0 interrupted iterations
default   [  67% ] 500/500 VUs  1m39.9s/2m30.0s

running (1m40.9s), 500/500 VUs, 4983 complete and 0 interrupted iterations
default   [  67% ] 500/500 VUs  1m40.9s/2m30.0s

running (1m41.9s), 500/500 VUs, 5070 complete and 0 interrupted iterations
default   [  68% ] 500/500 VUs  1m41.9s/2m30.0s

running (1m42.9s), 500/500 VUs, 5128 complete and 0 interrupted iterations
default   [  69% ] 500/500 VUs  1m42.9s/2m30.0s

running (1m44.0s), 500/500 VUs, 5211 complete and 0 interrupted iterations
default   [  69% ] 500/500 VUs  1m44.0s/2m30.0s

running (1m44.9s), 500/500 VUs, 5257 complete and 0 interrupted iterations
default   [  70% ] 500/500 VUs  1m44.9s/2m30.0s

running (1m45.9s), 500/500 VUs, 5356 complete and 0 interrupted iterations
default   [  71% ] 500/500 VUs  1m45.9s/2m30.0s

running (1m46.9s), 500/500 VUs, 5392 complete and 0 interrupted iterations
default   [  71% ] 500/500 VUs  1m46.9s/2m30.0s

running (1m47.9s), 500/500 VUs, 5480 complete and 0 interrupted iterations
default   [  72% ] 500/500 VUs  1m47.9s/2m30.0s

running (1m48.9s), 500/500 VUs, 5569 complete and 0 interrupted iterations
default   [  73% ] 500/500 VUs  1m48.9s/2m30.0s

running (1m49.9s), 500/500 VUs, 5593 complete and 0 interrupted iterations
default   [  73% ] 500/500 VUs  1m49.9s/2m30.0s

running (1m50.9s), 500/500 VUs, 5698 complete and 0 interrupted iterations
default   [  74% ] 500/500 VUs  1m50.9s/2m30.0s

running (1m51.9s), 500/500 VUs, 5756 complete and 0 interrupted iterations
default   [  75% ] 500/500 VUs  1m51.9s/2m30.0s

running (1m52.9s), 500/500 VUs, 5844 complete and 0 interrupted iterations
default   [  75% ] 500/500 VUs  1m52.9s/2m30.0s

running (1m53.9s), 500/500 VUs, 5881 complete and 0 interrupted iterations
default   [  76% ] 500/500 VUs  1m53.9s/2m30.0s

running (1m54.9s), 500/500 VUs, 5981 complete and 0 interrupted iterations
default   [  77% ] 500/500 VUs  1m54.9s/2m30.0s

running (1m55.9s), 500/500 VUs, 6066 complete and 0 interrupted iterations
default   [  77% ] 500/500 VUs  1m55.9s/2m30.0s

running (1m56.9s), 500/500 VUs, 6094 complete and 0 interrupted iterations
default   [  78% ] 500/500 VUs  1m56.9s/2m30.0s

running (1m57.9s), 500/500 VUs, 6198 complete and 0 interrupted iterations
default   [  79% ] 500/500 VUs  1m57.9s/2m30.0s

running (1m58.9s), 500/500 VUs, 6280 complete and 0 interrupted iterations
default   [  79% ] 500/500 VUs  1m58.9s/2m30.0s

running (1m59.9s), 500/500 VUs, 6347 complete and 0 interrupted iterations
default   [  80% ] 500/500 VUs  1m59.9s/2m30.0s

running (2m00.9s), 500/500 VUs, 6393 complete and 0 interrupted iterations
default   [  81% ] 500/500 VUs  2m00.9s/2m30.0s

running (2m01.9s), 492/500 VUs, 6479 complete and 0 interrupted iterations
default   [  81% ] 492/500 VUs  2m01.9s/2m30.0s

running (2m02.9s), 483/500 VUs, 6571 complete and 0 interrupted iterations
default   [  82% ] 483/500 VUs  2m02.9s/2m30.0s

running (2m03.9s), 480/500 VUs, 6608 complete and 0 interrupted iterations
default   [  83% ] 480/500 VUs  2m03.9s/2m30.0s

running (2m04.9s), 463/500 VUs, 6706 complete and 0 interrupted iterations
default   [  83% ] 463/500 VUs  2m04.9s/2m30.0s

running (2m05.9s), 449/500 VUs, 6785 complete and 0 interrupted iterations
default   [  84% ] 449/500 VUs  2m05.9s/2m30.0s

running (2m06.9s), 435/500 VUs, 6866 complete and 0 interrupted iterations
default   [  85% ] 435/500 VUs  2m06.9s/2m30.0s

running (2m07.9s), 429/500 VUs, 6900 complete and 0 interrupted iterations
default   [  85% ] 429/500 VUs  2m07.9s/2m30.0s

running (2m08.9s), 411/500 VUs, 6977 complete and 0 interrupted iterations
default   [  86% ] 411/500 VUs  2m08.9s/2m30.0s

running (2m09.9s), 391/500 VUs, 7061 complete and 0 interrupted iterations
default   [  87% ] 391/500 VUs  2m09.9s/2m30.0s

running (2m10.9s), 376/500 VUs, 7120 complete and 0 interrupted iterations
default   [  87% ] 376/500 VUs  2m10.9s/2m30.0s

running (2m11.9s), 363/500 VUs, 7168 complete and 0 interrupted iterations
default   [  88% ] 363/500 VUs  2m11.9s/2m30.0s

running (2m12.9s), 336/500 VUs, 7251 complete and 0 interrupted iterations
default   [  89% ] 336/500 VUs  2m12.9s/2m30.0s

running (2m13.9s), 316/500 VUs, 7323 complete and 0 interrupted iterations
default   [  89% ] 316/500 VUs  2m13.9s/2m30.0s

running (2m14.9s), 299/500 VUs, 7379 complete and 0 interrupted iterations
default   [  90% ] 299/500 VUs  2m14.9s/2m30.0s

running (2m15.9s), 289/500 VUs, 7417 complete and 0 interrupted iterations
default   [  91% ] 289/500 VUs  2m15.9s/2m30.0s

running (2m16.9s), 267/500 VUs, 7487 complete and 0 interrupted iterations
default   [  91% ] 267/500 VUs  2m16.9s/2m30.0s

running (2m17.9s), 251/500 VUs, 7531 complete and 0 interrupted iterations
default   [  92% ] 251/500 VUs  2m17.9s/2m30.0s

running (2m18.9s), 229/500 VUs, 7587 complete and 0 interrupted iterations
default   [  93% ] 229/500 VUs  2m18.9s/2m30.0s

running (2m19.9s), 211/500 VUs, 7639 complete and 0 interrupted iterations
default   [  93% ] 211/500 VUs  2m19.9s/2m30.0s

running (2m20.9s), 198/500 VUs, 7674 complete and 0 interrupted iterations
default   [  94% ] 198/500 VUs  2m20.9s/2m30.0s

running (2m21.9s), 187/500 VUs, 7705 complete and 0 interrupted iterations
default   [  95% ] 187/500 VUs  2m21.9s/2m30.0s

running (2m22.9s), 173/500 VUs, 7750 complete and 0 interrupted iterations
default   [  95% ] 173/500 VUs  2m22.9s/2m30.0s

running (2m23.9s), 157/500 VUs, 7782 complete and 0 interrupted iterations
default   [  96% ] 157/500 VUs  2m23.9s/2m30.0s

running (2m24.9s), 138/500 VUs, 7816 complete and 0 interrupted iterations
default   [  97% ] 138/500 VUs  2m24.9s/2m30.0s

running (2m25.9s), 115/500 VUs, 7850 complete and 0 interrupted iterations
default   [  97% ] 115/500 VUs  2m25.9s/2m30.0s

running (2m26.9s), 106/500 VUs, 7871 complete and 0 interrupted iterations
default   [  98% ] 106/500 VUs  2m26.9s/2m30.0s

running (2m27.9s), 090/500 VUs, 7892 complete and 0 interrupted iterations
default   [  99% ] 090/500 VUs  2m27.9s/2m30.0s

running (2m28.9s), 063/500 VUs, 7923 complete and 0 interrupted iterations
default   [  99% ] 063/500 VUs  2m28.9s/2m30.0s

running (2m29.9s), 048/500 VUs, 7939 complete and 0 interrupted iterations
default   [ 100% ] 048/500 VUs  2m29.9s/2m30.0s

running (2m30.9s), 033/500 VUs, 7954 complete and 0 interrupted iterations
default ↓ [ 100% ] 048/500 VUs  2m30s

running (2m31.9s), 022/500 VUs, 7965 complete and 0 interrupted iterations
default ↓ [ 100% ] 048/500 VUs  2m30s

running (2m32.9s), 011/500 VUs, 7976 complete and 0 interrupted iterations
default ↓ [ 100% ] 048/500 VUs  2m30s

running (2m33.9s), 005/500 VUs, 7982 complete and 0 interrupted iterations
default ↓ [ 100% ] 048/500 VUs  2m30s

running (2m34.9s), 001/500 VUs, 7986 complete and 0 interrupted iterations
default ↓ [ 100% ] 048/500 VUs  2m30s


  █ THRESHOLDS 

    active_clients_time
    ✓ 'p(95)<500' p(95)=153ms

    attach_documents_time
    ✓ 'p(95)<10000' p(95)=556ms

    deactivate_clients_time
    ✓ 'p(95)<10000' p(95)=156ms

    http_req_duration
    ✓ 'p(95)<10000' p(95)=300.56ms

    pushpulls_time
    ✓ 'p(95)<1000' p(95)=282ms

    transaction_success_rate
    ✓ 'rate>0.99' rate=100.00%

    transaction_time
    ✓ 'p(95)<30000' p(95)=7.67s


  █ TOTAL RESULTS 

    checks_total.......: 127792  822.032101/s
    checks_succeeded...: 100.00% 127792 out of 127792
    checks_failed......: 0.00%   0 out of 127792

    ✓ status is 200
    ✓ response has valid body

    CUSTOM
    active_clients....................: 7987    51.377006/s
    active_clients_success_rate.......: 100.00% 7987 out of 7987
    active_clients_time...............: avg=43.46ms  min=1ms     med=19ms    max=601ms    p(90)=118ms    p(95)=153ms   
    attach_documents..................: 7987    51.377006/s
    attach_documents_success_rate.....: 100.00% 7987 out of 7987
    attach_documents_time.............: avg=193.13ms min=3ms     med=156ms   max=985ms    p(90)=466ms    p(95)=556ms   
    deactivate_clients................: 7987    51.377006/s
    deactivate_clients_success_rate...: 100.00% 7987 out of 7987
    deactivate_clients_time...........: avg=42.05ms  min=0s      med=18ms    max=559ms    p(90)=112ms    p(95)=156ms   
    pushpulls.........................: 39935   256.885032/s
    pushpulls_success_rate............: 100.00% 39935 out of 39935
    pushpulls_time....................: avg=78.21ms  min=1ms     med=41ms    max=876ms    p(90)=203ms    p(95)=282ms   
    transaction_success_rate..........: 100.00% 7987 out of 7987
    transaction_time..................: avg=6.76s    min=6.02s   med=6.8s    max=9.02s    p(90)=7.46s    p(95)=7.67s   

    HTTP
    http_req_duration.................: avg=74.58ms  min=506.2µs med=31.16ms max=914.89ms p(90)=208.06ms p(95)=300.56ms
      { expected_response:true }......: avg=74.58ms  min=506.2µs med=31.16ms max=914.89ms p(90)=208.06ms p(95)=300.56ms
    http_req_failed...................: 0.00%   0 out of 63896
    http_reqs.........................: 63896   411.01605/s

    EXECUTION
    iteration_duration................: avg=6.76s    min=6.01s   med=6.8s    max=9.02s    p(90)=7.45s    p(95)=7.66s   
    iterations........................: 7987    51.377006/s
    vus...............................: 1       min=1              max=500
    vus_max...........................: 500     min=500            max=500

    NETWORK
    data_received.....................: 1.1 GB  7.1 MB/s
    data_sent.........................: 60 MB   387 kB/s




running (2m35.5s), 000/500 VUs, 7987 complete and 0 interrupted iterations
default ✓ [ 100% ] 000/500 VUs  2m30s
