
         /\      Grafana   /‾‾/  
    /\  /  \     |\  __   /  /   
   /  \/    \    | |/ /  /   ‾‾\ 
  /          \   |   (  |  (‾)  |
 / __________ \  |_|\_\  \_____/ 

     execution: local
        script: test/k6/presence.ts
        output: -

     scenarios: (100.00%) 1 scenario, 500 max VUs, 3m0s max duration (incl. graceful stop):
              * default: Up to 500 looping VUs for 2m30s over 3 stages (gracefulRampDown: 30s, gracefulStop: 30s)


running (0m00.9s), 008/500 VUs, 0 complete and 0 interrupted iterations
default   [   1% ] 008/500 VUs  0m00.9s/2m30.0s

running (0m01.9s), 016/500 VUs, 0 complete and 0 interrupted iterations
default   [   1% ] 016/500 VUs  0m01.9s/2m30.0s

running (0m02.9s), 024/500 VUs, 0 complete and 0 interrupted iterations
default   [   2% ] 024/500 VUs  0m02.9s/2m30.0s

running (0m03.9s), 033/500 VUs, 0 complete and 0 interrupted iterations
default   [   3% ] 033/500 VUs  0m03.9s/2m30.0s

running (0m04.9s), 041/500 VUs, 0 complete and 0 interrupted iterations
default   [   3% ] 041/500 VUs  0m04.9s/2m30.0s

running (0m05.9s), 049/500 VUs, 0 complete and 0 interrupted iterations
default   [   4% ] 049/500 VUs  0m05.9s/2m30.0s

running (0m06.9s), 058/500 VUs, 8 complete and 0 interrupted iterations
default   [   5% ] 058/500 VUs  0m06.9s/2m30.0s

running (0m07.9s), 066/500 VUs, 16 complete and 0 interrupted iterations
default   [   5% ] 066/500 VUs  0m07.9s/2m30.0s

running (0m08.9s), 074/500 VUs, 24 complete and 0 interrupted iterations
default   [   6% ] 074/500 VUs  0m08.9s/2m30.0s

running (0m09.9s), 083/500 VUs, 33 complete and 0 interrupted iterations
default   [   7% ] 083/500 VUs  0m09.9s/2m30.0s

running (0m10.9s), 091/500 VUs, 41 complete and 0 interrupted iterations
default   [   7% ] 091/500 VUs  0m10.9s/2m30.0s

running (0m11.9s), 099/500 VUs, 49 complete and 0 interrupted iterations
default   [   8% ] 099/500 VUs  0m11.9s/2m30.0s

running (0m12.9s), 108/500 VUs, 65 complete and 0 interrupted iterations
default   [   9% ] 108/500 VUs  0m12.9s/2m30.0s

running (0m13.9s), 116/500 VUs, 82 complete and 0 interrupted iterations
default   [   9% ] 116/500 VUs  0m13.9s/2m30.0s

running (0m14.9s), 124/500 VUs, 98 complete and 0 interrupted iterations
default   [  10% ] 124/500 VUs  0m14.9s/2m30.0s

running (0m15.9s), 133/500 VUs, 114 complete and 0 interrupted iterations
default   [  11% ] 133/500 VUs  0m15.9s/2m30.0s

running (0m16.9s), 141/500 VUs, 132 complete and 0 interrupted iterations
default   [  11% ] 141/500 VUs  0m16.9s/2m30.0s

running (0m17.9s), 149/500 VUs, 148 complete and 0 interrupted iterations
default   [  12% ] 149/500 VUs  0m17.9s/2m30.0s

running (0m18.9s), 158/500 VUs, 171 complete and 0 interrupted iterations
default   [  13% ] 158/500 VUs  0m18.9s/2m30.0s

running (0m19.9s), 166/500 VUs, 198 complete and 0 interrupted iterations
default   [  13% ] 166/500 VUs  0m19.9s/2m30.0s

running (0m20.9s), 174/500 VUs, 222 complete and 0 interrupted iterations
default   [  14% ] 174/500 VUs  0m20.9s/2m30.0s

running (0m21.9s), 182/500 VUs, 246 complete and 0 interrupted iterations
default   [  15% ] 182/500 VUs  0m21.9s/2m30.0s

running (0m22.9s), 191/500 VUs, 273 complete and 0 interrupted iterations
default   [  15% ] 191/500 VUs  0m22.9s/2m30.0s

running (0m23.9s), 199/500 VUs, 297 complete and 0 interrupted iterations
default   [  16% ] 199/500 VUs  0m23.9s/2m30.0s

running (0m24.9s), 207/500 VUs, 328 complete and 0 interrupted iterations
default   [  17% ] 207/500 VUs  0m24.9s/2m30.0s

running (0m25.9s), 216/500 VUs, 362 complete and 0 interrupted iterations
default   [  17% ] 216/500 VUs  0m25.9s/2m30.0s

running (0m26.9s), 224/500 VUs, 396 complete and 0 interrupted iterations
default   [  18% ] 224/500 VUs  0m26.9s/2m30.0s

running (0m27.9s), 232/500 VUs, 428 complete and 0 interrupted iterations
default   [  19% ] 232/500 VUs  0m27.9s/2m30.0s

running (0m28.9s), 241/500 VUs, 461 complete and 0 interrupted iterations
default   [  19% ] 241/500 VUs  0m28.9s/2m30.0s

running (0m29.9s), 249/500 VUs, 496 complete and 0 interrupted iterations
default   [  20% ] 249/500 VUs  0m29.9s/2m30.0s

running (0m30.9s), 257/500 VUs, 535 complete and 0 interrupted iterations
default   [  21% ] 257/500 VUs  0m30.9s/2m30.0s

running (0m31.9s), 266/500 VUs, 576 complete and 0 interrupted iterations
default   [  21% ] 266/500 VUs  0m31.9s/2m30.0s

running (0m32.9s), 274/500 VUs, 620 complete and 0 interrupted iterations
default   [  22% ] 274/500 VUs  0m32.9s/2m30.0s

running (0m33.9s), 282/500 VUs, 660 complete and 0 interrupted iterations
default   [  23% ] 282/500 VUs  0m33.9s/2m30.0s

running (0m34.9s), 291/500 VUs, 700 complete and 0 interrupted iterations
default   [  23% ] 291/500 VUs  0m34.9s/2m30.0s

running (0m35.9s), 299/500 VUs, 743 complete and 0 interrupted iterations
default   [  24% ] 299/500 VUs  0m35.9s/2m30.0s

running (0m36.9s), 307/500 VUs, 792 complete and 0 interrupted iterations
default   [  25% ] 307/500 VUs  0m36.9s/2m30.0s

running (0m37.9s), 316/500 VUs, 840 complete and 0 interrupted iterations
default   [  25% ] 316/500 VUs  0m37.9s/2m30.0s

running (0m38.9s), 324/500 VUs, 889 complete and 0 interrupted iterations
default   [  26% ] 324/500 VUs  0m38.9s/2m30.0s

running (0m39.9s), 332/500 VUs, 941 complete and 0 interrupted iterations
default   [  27% ] 332/500 VUs  0m39.9s/2m30.0s

running (0m40.9s), 340/500 VUs, 990 complete and 0 interrupted iterations
default   [  27% ] 340/500 VUs  0m40.9s/2m30.0s

running (0m41.9s), 349/500 VUs, 1039 complete and 0 interrupted iterations
default   [  28% ] 349/500 VUs  0m41.9s/2m30.0s

running (0m42.9s), 357/500 VUs, 1097 complete and 0 interrupted iterations
default   [  29% ] 357/500 VUs  0m42.9s/2m30.0s

running (0m43.9s), 365/500 VUs, 1155 complete and 0 interrupted iterations
default   [  29% ] 365/500 VUs  0m43.9s/2m30.0s

running (0m44.9s), 374/500 VUs, 1212 complete and 0 interrupted iterations
default   [  30% ] 374/500 VUs  0m44.9s/2m30.0s

running (0m45.9s), 382/500 VUs, 1269 complete and 0 interrupted iterations
default   [  31% ] 382/500 VUs  0m45.9s/2m30.0s

running (0m46.9s), 390/500 VUs, 1328 complete and 0 interrupted iterations
default   [  31% ] 390/500 VUs  0m46.9s/2m30.0s

running (0m47.9s), 399/500 VUs, 1385 complete and 0 interrupted iterations
default   [  32% ] 399/500 VUs  0m47.9s/2m30.0s

running (0m48.9s), 407/500 VUs, 1449 complete and 0 interrupted iterations
default   [  33% ] 407/500 VUs  0m48.9s/2m30.0s

running (0m49.9s), 415/500 VUs, 1514 complete and 0 interrupted iterations
default   [  33% ] 415/500 VUs  0m49.9s/2m30.0s

running (0m50.9s), 424/500 VUs, 1577 complete and 0 interrupted iterations
default   [  34% ] 424/500 VUs  0m50.9s/2m30.0s

running (0m52.0s), 433/500 VUs, 1654 complete and 0 interrupted iterations
default   [  35% ] 433/500 VUs  0m52.0s/2m30.0s

running (0m52.9s), 440/500 VUs, 1708 complete and 0 interrupted iterations
default   [  35% ] 440/500 VUs  0m52.9s/2m30.0s

running (0m53.9s), 449/500 VUs, 1774 complete and 0 interrupted iterations
default   [  36% ] 449/500 VUs  0m53.9s/2m30.0s

running (0m54.9s), 454/500 VUs, 1837 complete and 0 interrupted iterations
default   [  37% ] 454/500 VUs  0m54.9s/2m30.0s

running (0m56.3s), 468/500 VUs, 1930 complete and 0 interrupted iterations
default   [  38% ] 468/500 VUs  0m56.3s/2m30.0s

running (0m56.9s), 474/500 VUs, 1977 complete and 0 interrupted iterations
default   [  38% ] 474/500 VUs  0m56.9s/2m30.0s

running (0m58.1s), 483/500 VUs, 2032 complete and 0 interrupted iterations
default   [  39% ] 483/500 VUs  0m58.1s/2m30.0s

running (0m58.9s), 490/500 VUs, 2090 complete and 0 interrupted iterations
default   [  39% ] 490/500 VUs  0m58.9s/2m30.0s

running (0m59.9s), 499/500 VUs, 2163 complete and 0 interrupted iterations
default   [  40% ] 499/500 VUs  0m59.9s/2m30.0s

running (1m01.3s), 500/500 VUs, 2251 complete and 0 interrupted iterations
default   [  41% ] 500/500 VUs  1m01.3s/2m30.0s

running (1m01.9s), 500/500 VUs, 2306 complete and 0 interrupted iterations
default   [  41% ] 500/500 VUs  1m01.9s/2m30.0s

running (1m02.9s), 500/500 VUs, 2365 complete and 0 interrupted iterations
default   [  42% ] 500/500 VUs  1m02.9s/2m30.0s

running (1m04.1s), 500/500 VUs, 2468 complete and 0 interrupted iterations
default   [  43% ] 500/500 VUs  1m04.1s/2m30.0s

running (1m04.9s), 500/500 VUs, 2498 complete and 0 interrupted iterations
default   [  43% ] 500/500 VUs  1m04.9s/2m30.0s

running (1m05.9s), 500/500 VUs, 2577 complete and 0 interrupted iterations
default   [  44% ] 500/500 VUs  1m05.9s/2m30.0s

running (1m06.9s), 500/500 VUs, 2673 complete and 0 interrupted iterations
default   [  45% ] 500/500 VUs  1m06.9s/2m30.0s

running (1m07.9s), 500/500 VUs, 2741 complete and 0 interrupted iterations
default   [  45% ] 500/500 VUs  1m07.9s/2m30.0s

running (1m08.9s), 500/500 VUs, 2822 complete and 0 interrupted iterations
default   [  46% ] 500/500 VUs  1m08.9s/2m30.0s

running (1m09.9s), 500/500 VUs, 2878 complete and 0 interrupted iterations
default   [  47% ] 500/500 VUs  1m09.9s/2m30.0s

running (1m10.9s), 500/500 VUs, 2953 complete and 0 interrupted iterations
default   [  47% ] 500/500 VUs  1m10.9s/2m30.0s

running (1m11.9s), 500/500 VUs, 3026 complete and 0 interrupted iterations
default   [  48% ] 500/500 VUs  1m11.9s/2m30.0s

running (1m12.9s), 500/500 VUs, 3094 complete and 0 interrupted iterations
default   [  49% ] 500/500 VUs  1m12.9s/2m30.0s

running (1m13.9s), 500/500 VUs, 3191 complete and 0 interrupted iterations
default   [  49% ] 500/500 VUs  1m13.9s/2m30.0s

running (1m15.1s), 500/500 VUs, 3246 complete and 0 interrupted iterations
default   [  50% ] 500/500 VUs  1m15.1s/2m30.0s

running (1m16.0s), 500/500 VUs, 3302 complete and 0 interrupted iterations
default   [  51% ] 500/500 VUs  1m16.0s/2m30.0s

running (1m16.9s), 500/500 VUs, 3383 complete and 0 interrupted iterations
default   [  51% ] 500/500 VUs  1m16.9s/2m30.0s

running (1m17.9s), 500/500 VUs, 3461 complete and 0 interrupted iterations
default   [  52% ] 500/500 VUs  1m17.9s/2m30.0s

running (1m18.9s), 500/500 VUs, 3512 complete and 0 interrupted iterations
default   [  53% ] 500/500 VUs  1m18.9s/2m30.0s

running (1m19.9s), 500/500 VUs, 3594 complete and 0 interrupted iterations
default   [  53% ] 500/500 VUs  1m19.9s/2m30.0s

running (1m20.9s), 500/500 VUs, 3700 complete and 0 interrupted iterations
default   [  54% ] 500/500 VUs  1m20.9s/2m30.0s

running (1m22.0s), 500/500 VUs, 3734 complete and 0 interrupted iterations
default   [  55% ] 500/500 VUs  1m22.0s/2m30.0s

running (1m22.9s), 500/500 VUs, 3822 complete and 0 interrupted iterations
default   [  55% ] 500/500 VUs  1m22.9s/2m30.0s

running (1m23.9s), 500/500 VUs, 3908 complete and 0 interrupted iterations
default   [  56% ] 500/500 VUs  1m23.9s/2m30.0s

running (1m24.9s), 500/500 VUs, 3965 complete and 0 interrupted iterations
default   [  57% ] 500/500 VUs  1m24.9s/2m30.0s

running (1m25.9s), 500/500 VUs, 4029 complete and 0 interrupted iterations
default   [  57% ] 500/500 VUs  1m25.9s/2m30.0s

running (1m26.9s), 500/500 VUs, 4105 complete and 0 interrupted iterations
default   [  58% ] 500/500 VUs  1m26.9s/2m30.0s

running (1m27.9s), 500/500 VUs, 4213 complete and 0 interrupted iterations
default   [  59% ] 500/500 VUs  1m27.9s/2m30.0s

running (1m28.9s), 500/500 VUs, 4254 complete and 0 interrupted iterations
default   [  59% ] 500/500 VUs  1m28.9s/2m30.0s

running (1m29.9s), 500/500 VUs, 4329 complete and 0 interrupted iterations
default   [  60% ] 500/500 VUs  1m29.9s/2m30.0s

running (1m30.9s), 500/500 VUs, 4393 complete and 0 interrupted iterations
default   [  61% ] 500/500 VUs  1m30.9s/2m30.0s

running (1m31.9s), 500/500 VUs, 4465 complete and 0 interrupted iterations
default   [  61% ] 500/500 VUs  1m31.9s/2m30.0s

running (1m32.9s), 500/500 VUs, 4545 complete and 0 interrupted iterations
default   [  62% ] 500/500 VUs  1m32.9s/2m30.0s

running (1m33.9s), 500/500 VUs, 4602 complete and 0 interrupted iterations
default   [  63% ] 500/500 VUs  1m33.9s/2m30.0s

running (1m34.9s), 500/500 VUs, 4669 complete and 0 interrupted iterations
default   [  63% ] 500/500 VUs  1m34.9s/2m30.0s

running (1m36.2s), 500/500 VUs, 4794 complete and 0 interrupted iterations
default   [  64% ] 500/500 VUs  1m36.2s/2m30.0s

running (1m36.9s), 500/500 VUs, 4847 complete and 0 interrupted iterations
default   [  65% ] 500/500 VUs  1m36.9s/2m30.0s

running (1m37.9s), 500/500 VUs, 4896 complete and 0 interrupted iterations
default   [  65% ] 500/500 VUs  1m37.9s/2m30.0s

running (1m38.9s), 500/500 VUs, 5022 complete and 0 interrupted iterations
default   [  66% ] 500/500 VUs  1m38.9s/2m30.0s

running (1m39.9s), 500/500 VUs, 5062 complete and 0 interrupted iterations
default   [  67% ] 500/500 VUs  1m39.9s/2m30.0s

running (1m40.9s), 500/500 VUs, 5123 complete and 0 interrupted iterations
default   [  67% ] 500/500 VUs  1m40.9s/2m30.0s

running (1m41.9s), 500/500 VUs, 5197 complete and 0 interrupted iterations
default   [  68% ] 500/500 VUs  1m41.9s/2m30.0s

running (1m42.9s), 500/500 VUs, 5288 complete and 0 interrupted iterations
default   [  69% ] 500/500 VUs  1m42.9s/2m30.0s

running (1m43.9s), 500/500 VUs, 5351 complete and 0 interrupted iterations
default   [  69% ] 500/500 VUs  1m43.9s/2m30.0s

running (1m44.9s), 500/500 VUs, 5426 complete and 0 interrupted iterations
default   [  70% ] 500/500 VUs  1m44.9s/2m30.0s

running (1m45.9s), 500/500 VUs, 5539 complete and 0 interrupted iterations
default   [  71% ] 500/500 VUs  1m45.9s/2m30.0s

running (1m46.9s), 500/500 VUs, 5565 complete and 0 interrupted iterations
default   [  71% ] 500/500 VUs  1m46.9s/2m30.0s

running (1m47.9s), 500/500 VUs, 5651 complete and 0 interrupted iterations
default   [  72% ] 500/500 VUs  1m47.9s/2m30.0s

running (1m48.9s), 500/500 VUs, 5732 complete and 0 interrupted iterations
default   [  73% ] 500/500 VUs  1m48.9s/2m30.0s

running (1m49.9s), 500/500 VUs, 5795 complete and 0 interrupted iterations
default   [  73% ] 500/500 VUs  1m49.9s/2m30.0s

running (1m50.9s), 500/500 VUs, 5866 complete and 0 interrupted iterations
default   [  74% ] 500/500 VUs  1m50.9s/2m30.0s

running (1m51.9s), 500/500 VUs, 5935 complete and 0 interrupted iterations
default   [  75% ] 500/500 VUs  1m51.9s/2m30.0s

running (1m52.9s), 500/500 VUs, 6034 complete and 0 interrupted iterations
default   [  75% ] 500/500 VUs  1m52.9s/2m30.0s

running (1m53.9s), 500/500 VUs, 6101 complete and 0 interrupted iterations
default   [  76% ] 500/500 VUs  1m53.9s/2m30.0s

running (1m54.9s), 500/500 VUs, 6168 complete and 0 interrupted iterations
default   [  77% ] 500/500 VUs  1m54.9s/2m30.0s

running (1m55.9s), 500/500 VUs, 6280 complete and 0 interrupted iterations
default   [  77% ] 500/500 VUs  1m55.9s/2m30.0s

running (1m56.9s), 500/500 VUs, 6345 complete and 0 interrupted iterations
default   [  78% ] 500/500 VUs  1m56.9s/2m30.0s

running (1m57.9s), 500/500 VUs, 6389 complete and 0 interrupted iterations
default   [  79% ] 500/500 VUs  1m57.9s/2m30.0s

running (1m58.9s), 500/500 VUs, 6465 complete and 0 interrupted iterations
default   [  79% ] 500/500 VUs  1m58.9s/2m30.0s

running (1m59.9s), 500/500 VUs, 6550 complete and 0 interrupted iterations
default   [  80% ] 500/500 VUs  1m59.9s/2m30.0s

running (2m00.9s), 500/500 VUs, 6612 complete and 0 interrupted iterations
default   [  81% ] 500/500 VUs  2m00.9s/2m30.0s

running (2m01.9s), 497/500 VUs, 6682 complete and 0 interrupted iterations
default   [  81% ] 497/500 VUs  2m01.9s/2m30.0s

running (2m02.9s), 490/500 VUs, 6777 complete and 0 interrupted iterations
default   [  82% ] 490/500 VUs  2m02.9s/2m30.0s

running (2m03.9s), 485/500 VUs, 6821 complete and 0 interrupted iterations
default   [  83% ] 485/500 VUs  2m03.9s/2m30.0s

running (2m04.9s), 476/500 VUs, 6903 complete and 0 interrupted iterations
default   [  83% ] 476/500 VUs  2m04.9s/2m30.0s

running (2m05.9s), 463/500 VUs, 6985 complete and 0 interrupted iterations
default   [  84% ] 463/500 VUs  2m05.9s/2m30.0s

running (2m06.9s), 445/500 VUs, 7047 complete and 0 interrupted iterations
default   [  85% ] 445/500 VUs  2m06.9s/2m30.0s

running (2m07.9s), 422/500 VUs, 7130 complete and 0 interrupted iterations
default   [  85% ] 422/500 VUs  2m07.9s/2m30.0s

running (2m08.9s), 405/500 VUs, 7205 complete and 0 interrupted iterations
default   [  86% ] 405/500 VUs  2m08.9s/2m30.0s

running (2m09.9s), 384/500 VUs, 7283 complete and 0 interrupted iterations
default   [  87% ] 384/500 VUs  2m09.9s/2m30.0s

running (2m10.9s), 370/500 VUs, 7334 complete and 0 interrupted iterations
default   [  87% ] 370/500 VUs  2m10.9s/2m30.0s

running (2m11.9s), 348/500 VUs, 7425 complete and 0 interrupted iterations
default   [  88% ] 348/500 VUs  2m11.9s/2m30.0s

running (2m12.9s), 331/500 VUs, 7487 complete and 0 interrupted iterations
default   [  89% ] 331/500 VUs  2m12.9s/2m30.0s

running (2m13.9s), 324/500 VUs, 7537 complete and 0 interrupted iterations
default   [  89% ] 324/500 VUs  2m13.9s/2m30.0s

running (2m14.9s), 305/500 VUs, 7606 complete and 0 interrupted iterations
default   [  90% ] 305/500 VUs  2m14.9s/2m30.0s

running (2m15.9s), 289/500 VUs, 7658 complete and 0 interrupted iterations
default   [  91% ] 289/500 VUs  2m15.9s/2m30.0s

running (2m16.9s), 282/500 VUs, 7699 complete and 0 interrupted iterations
default   [  91% ] 282/500 VUs  2m16.9s/2m30.0s

running (2m17.9s), 255/500 VUs, 7772 complete and 0 interrupted iterations
default   [  92% ] 255/500 VUs  2m17.9s/2m30.0s

running (2m18.9s), 239/500 VUs, 7818 complete and 0 interrupted iterations
default   [  93% ] 239/500 VUs  2m18.9s/2m30.0s

running (2m19.9s), 225/500 VUs, 7860 complete and 0 interrupted iterations
default   [  93% ] 225/500 VUs  2m19.9s/2m30.0s

running (2m20.9s), 203/500 VUs, 7910 complete and 0 interrupted iterations
default   [  94% ] 203/500 VUs  2m20.9s/2m30.0s

running (2m21.9s), 192/500 VUs, 7938 complete and 0 interrupted iterations
default   [  95% ] 192/500 VUs  2m21.9s/2m30.0s

running (2m22.9s), 171/500 VUs, 7981 complete and 0 interrupted iterations
default   [  95% ] 171/500 VUs  2m22.9s/2m30.0s

running (2m23.9s), 148/500 VUs, 8027 complete and 0 interrupted iterations
default   [  96% ] 148/500 VUs  2m23.9s/2m30.0s

running (2m24.9s), 134/500 VUs, 8056 complete and 0 interrupted iterations
default   [  97% ] 134/500 VUs  2m24.9s/2m30.0s

running (2m25.9s), 119/500 VUs, 8084 complete and 0 interrupted iterations
default   [  97% ] 119/500 VUs  2m25.9s/2m30.0s

running (2m26.9s), 102/500 VUs, 8113 complete and 0 interrupted iterations
default   [  98% ] 102/500 VUs  2m26.9s/2m30.0s

running (2m27.9s), 090/500 VUs, 8129 complete and 0 interrupted iterations
default   [  99% ] 090/500 VUs  2m27.9s/2m30.0s

running (2m28.9s), 074/500 VUs, 8152 complete and 0 interrupted iterations
default   [  99% ] 074/500 VUs  2m28.9s/2m30.0s

running (2m29.9s), 054/500 VUs, 8175 complete and 0 interrupted iterations
default   [ 100% ] 054/500 VUs  2m29.9s/2m30.0s

running (2m30.9s), 039/500 VUs, 8190 complete and 0 interrupted iterations
default ↓ [ 100% ] 053/500 VUs  2m30s

running (2m31.9s), 026/500 VUs, 8203 complete and 0 interrupted iterations
default ↓ [ 100% ] 053/500 VUs  2m30s

running (2m32.9s), 015/500 VUs, 8214 complete and 0 interrupted iterations
default ↓ [ 100% ] 053/500 VUs  2m30s

running (2m33.9s), 010/500 VUs, 8219 complete and 0 interrupted iterations
default ↓ [ 100% ] 053/500 VUs  2m30s

running (2m34.9s), 003/500 VUs, 8226 complete and 0 interrupted iterations
default ↓ [ 100% ] 053/500 VUs  2m30s


  █ THRESHOLDS 

    active_clients_time
    ✓ 'p(95)<500' p(95)=142ms

    attach_documents_time
    ✓ 'p(95)<10000' p(95)=493ms

    deactivate_clients_time
    ✓ 'p(95)<10000' p(95)=155ms

    http_req_duration
    ✓ 'p(95)<10000' p(95)=235.36ms

    pushpulls_time
    ✓ 'p(95)<1000' p(95)=253ms

    transaction_success_rate
    ✓ 'rate>0.99' rate=100.00%

    transaction_time
    ✓ 'p(95)<30000' p(95)=7.34s


  █ TOTAL RESULTS 

    checks_total.......: 131664  847.791006/s
    checks_succeeded...: 100.00% 131664 out of 131664
    checks_failed......: 0.00%   0 out of 131664

    ✓ status is 200
    ✓ response has valid body

    CUSTOM
    active_clients....................: 8229    52.986938/s
    active_clients_success_rate.......: 100.00% 8229 out of 8229
    active_clients_time...............: avg=32.49ms  min=1ms      med=7ms    max=774ms    p(90)=98ms     p(95)=142ms   
    attach_documents..................: 8229    52.986938/s
    attach_documents_success_rate.....: 100.00% 8229 out of 8229
    attach_documents_time.............: avg=123.49ms min=3ms      med=36ms   max=998ms    p(90)=376ms    p(95)=493ms   
    deactivate_clients................: 8229    52.986938/s
    deactivate_clients_success_rate...: 100.00% 8229 out of 8229
    deactivate_clients_time...........: avg=33.05ms  min=0s       med=5ms    max=833ms    p(90)=102ms    p(95)=155ms   
    pushpulls.........................: 41145   264.934689/s
    pushpulls_success_rate............: 100.00% 41145 out of 41145
    pushpulls_time....................: avg=62.26ms  min=1ms      med=21ms   max=816ms    p(90)=178ms    p(95)=253ms   
    transaction_success_rate..........: 100.00% 8229 out of 8229
    transaction_time..................: avg=6.57s    min=6.01s    med=6.57s  max=8.88s    p(90)=7.16s    p(95)=7.34s   

    HTTP
    http_req_duration.................: avg=54.65ms  min=471.17µs med=12.5ms max=997.04ms p(90)=161.91ms p(95)=235.36ms
      { expected_response:true }......: avg=54.65ms  min=471.17µs med=12.5ms max=997.04ms p(90)=161.91ms p(95)=235.36ms
    http_req_failed...................: 0.00%   0 out of 65832
    http_reqs.........................: 65832   423.895503/s

    EXECUTION
    iteration_duration................: avg=6.57s    min=6.01s    med=6.57s  max=8.88s    p(90)=7.16s    p(95)=7.34s   
    iterations........................: 8229    52.986938/s
    vus...............................: 3       min=3              max=500
    vus_max...........................: 500     min=500            max=500

    NETWORK
    data_received.....................: 1.2 GB  7.4 MB/s
    data_sent.........................: 62 MB   399 kB/s




running (2m35.3s), 000/500 VUs, 8229 complete and 0 interrupted iterations
default ✓ [ 100% ] 000/500 VUs  2m30s
