
         /\      Grafana   /‾‾/  
    /\  /  \     |\  __   /  /   
   /  \/    \    | |/ /  /   ‾‾\ 
  /          \   |   (  |  (‾)  |
 / __________ \  |_|\_\  \_____/ 

     execution: local
        script: test/k6/presence.ts
        output: -

     scenarios: (100.00%) 1 scenario, 500 max VUs, 3m0s max duration (incl. graceful stop):
              * default: Up to 500 looping VUs for 2m30s over 3 stages (gracefulRampDown: 30s, gracefulStop: 30s)


running (0m00.9s), 008/500 VUs, 0 complete and 0 interrupted iterations
default   [   1% ] 008/500 VUs  0m00.9s/2m30.0s

running (0m01.9s), 016/500 VUs, 0 complete and 0 interrupted iterations
default   [   1% ] 016/500 VUs  0m01.9s/2m30.0s

running (0m02.9s), 024/500 VUs, 0 complete and 0 interrupted iterations
default   [   2% ] 024/500 VUs  0m02.9s/2m30.0s

running (0m03.9s), 033/500 VUs, 0 complete and 0 interrupted iterations
default   [   3% ] 033/500 VUs  0m03.9s/2m30.0s

running (0m04.9s), 041/500 VUs, 0 complete and 0 interrupted iterations
default   [   3% ] 041/500 VUs  0m04.9s/2m30.0s

running (0m05.9s), 049/500 VUs, 0 complete and 0 interrupted iterations
default   [   4% ] 049/500 VUs  0m05.9s/2m30.0s

running (0m06.9s), 058/500 VUs, 8 complete and 0 interrupted iterations
default   [   5% ] 058/500 VUs  0m06.9s/2m30.0s

running (0m07.9s), 066/500 VUs, 16 complete and 0 interrupted iterations
default   [   5% ] 066/500 VUs  0m07.9s/2m30.0s

running (0m08.9s), 074/500 VUs, 24 complete and 0 interrupted iterations
default   [   6% ] 074/500 VUs  0m08.9s/2m30.0s

running (0m09.9s), 083/500 VUs, 33 complete and 0 interrupted iterations
default   [   7% ] 083/500 VUs  0m09.9s/2m30.0s

running (0m10.9s), 091/500 VUs, 41 complete and 0 interrupted iterations
default   [   7% ] 091/500 VUs  0m10.9s/2m30.0s

running (0m11.9s), 099/500 VUs, 49 complete and 0 interrupted iterations
default   [   8% ] 099/500 VUs  0m11.9s/2m30.0s

running (0m12.9s), 108/500 VUs, 64 complete and 0 interrupted iterations
default   [   9% ] 108/500 VUs  0m12.9s/2m30.0s

running (0m13.9s), 116/500 VUs, 82 complete and 0 interrupted iterations
default   [   9% ] 116/500 VUs  0m13.9s/2m30.0s

running (0m14.9s), 124/500 VUs, 98 complete and 0 interrupted iterations
default   [  10% ] 124/500 VUs  0m14.9s/2m30.0s

running (0m15.9s), 132/500 VUs, 114 complete and 0 interrupted iterations
default   [  11% ] 132/500 VUs  0m15.9s/2m30.0s

running (0m16.9s), 141/500 VUs, 132 complete and 0 interrupted iterations
default   [  11% ] 141/500 VUs  0m16.9s/2m30.0s

running (0m17.9s), 149/500 VUs, 148 complete and 0 interrupted iterations
default   [  12% ] 149/500 VUs  0m17.9s/2m30.0s

running (0m18.9s), 157/500 VUs, 171 complete and 0 interrupted iterations
default   [  13% ] 157/500 VUs  0m18.9s/2m30.0s

running (0m19.9s), 166/500 VUs, 198 complete and 0 interrupted iterations
default   [  13% ] 166/500 VUs  0m19.9s/2m30.0s

running (0m20.9s), 174/500 VUs, 222 complete and 0 interrupted iterations
default   [  14% ] 174/500 VUs  0m20.9s/2m30.0s

running (0m21.9s), 182/500 VUs, 246 complete and 0 interrupted iterations
default   [  15% ] 182/500 VUs  0m21.9s/2m30.0s

running (0m22.9s), 191/500 VUs, 272 complete and 0 interrupted iterations
default   [  15% ] 191/500 VUs  0m22.9s/2m30.0s

running (0m23.9s), 199/500 VUs, 297 complete and 0 interrupted iterations
default   [  16% ] 199/500 VUs  0m23.9s/2m30.0s

running (0m24.9s), 207/500 VUs, 328 complete and 0 interrupted iterations
default   [  17% ] 207/500 VUs  0m24.9s/2m30.0s

running (0m25.9s), 216/500 VUs, 361 complete and 0 interrupted iterations
default   [  17% ] 216/500 VUs  0m25.9s/2m30.0s

running (0m26.9s), 224/500 VUs, 396 complete and 0 interrupted iterations
default   [  18% ] 224/500 VUs  0m26.9s/2m30.0s

running (0m27.9s), 232/500 VUs, 428 complete and 0 interrupted iterations
default   [  19% ] 232/500 VUs  0m27.9s/2m30.0s

running (0m28.9s), 241/500 VUs, 460 complete and 0 interrupted iterations
default   [  19% ] 241/500 VUs  0m28.9s/2m30.0s

running (0m29.9s), 249/500 VUs, 496 complete and 0 interrupted iterations
default   [  20% ] 249/500 VUs  0m29.9s/2m30.0s

running (0m30.9s), 257/500 VUs, 535 complete and 0 interrupted iterations
default   [  21% ] 257/500 VUs  0m30.9s/2m30.0s

running (0m31.9s), 266/500 VUs, 575 complete and 0 interrupted iterations
default   [  21% ] 266/500 VUs  0m31.9s/2m30.0s

running (0m32.9s), 274/500 VUs, 619 complete and 0 interrupted iterations
default   [  22% ] 274/500 VUs  0m32.9s/2m30.0s

running (0m33.9s), 282/500 VUs, 660 complete and 0 interrupted iterations
default   [  23% ] 282/500 VUs  0m33.9s/2m30.0s

running (0m34.9s), 291/500 VUs, 700 complete and 0 interrupted iterations
default   [  23% ] 291/500 VUs  0m34.9s/2m30.0s

running (0m35.9s), 299/500 VUs, 741 complete and 0 interrupted iterations
default   [  24% ] 299/500 VUs  0m35.9s/2m30.0s

running (0m36.9s), 307/500 VUs, 790 complete and 0 interrupted iterations
default   [  25% ] 307/500 VUs  0m36.9s/2m30.0s

running (0m37.9s), 315/500 VUs, 839 complete and 0 interrupted iterations
default   [  25% ] 315/500 VUs  0m37.9s/2m30.0s

running (0m38.9s), 324/500 VUs, 888 complete and 0 interrupted iterations
default   [  26% ] 324/500 VUs  0m38.9s/2m30.0s

running (0m39.9s), 332/500 VUs, 939 complete and 0 interrupted iterations
default   [  27% ] 332/500 VUs  0m39.9s/2m30.0s

running (0m40.9s), 340/500 VUs, 989 complete and 0 interrupted iterations
default   [  27% ] 340/500 VUs  0m40.9s/2m30.0s

running (0m41.9s), 349/500 VUs, 1039 complete and 0 interrupted iterations
default   [  28% ] 349/500 VUs  0m41.9s/2m30.0s

running (0m42.9s), 357/500 VUs, 1094 complete and 0 interrupted iterations
default   [  29% ] 357/500 VUs  0m42.9s/2m30.0s

running (0m43.9s), 365/500 VUs, 1152 complete and 0 interrupted iterations
default   [  29% ] 365/500 VUs  0m43.9s/2m30.0s

running (0m44.9s), 374/500 VUs, 1211 complete and 0 interrupted iterations
default   [  30% ] 374/500 VUs  0m44.9s/2m30.0s

running (0m45.9s), 382/500 VUs, 1269 complete and 0 interrupted iterations
default   [  31% ] 382/500 VUs  0m45.9s/2m30.0s

running (0m46.9s), 390/500 VUs, 1327 complete and 0 interrupted iterations
default   [  31% ] 390/500 VUs  0m46.9s/2m30.0s

running (0m47.9s), 399/500 VUs, 1384 complete and 0 interrupted iterations
default   [  32% ] 399/500 VUs  0m47.9s/2m30.0s

running (0m48.9s), 407/500 VUs, 1450 complete and 0 interrupted iterations
default   [  33% ] 407/500 VUs  0m48.9s/2m30.0s

running (0m49.9s), 415/500 VUs, 1515 complete and 0 interrupted iterations
default   [  33% ] 415/500 VUs  0m49.9s/2m30.0s

running (0m50.9s), 424/500 VUs, 1579 complete and 0 interrupted iterations
default   [  34% ] 424/500 VUs  0m50.9s/2m30.0s

running (0m51.9s), 432/500 VUs, 1643 complete and 0 interrupted iterations
default   [  35% ] 432/500 VUs  0m51.9s/2m30.0s

running (0m52.9s), 440/500 VUs, 1703 complete and 0 interrupted iterations
default   [  35% ] 440/500 VUs  0m52.9s/2m30.0s

running (0m53.9s), 449/500 VUs, 1770 complete and 0 interrupted iterations
default   [  36% ] 449/500 VUs  0m53.9s/2m30.0s

running (0m54.9s), 457/500 VUs, 1837 complete and 0 interrupted iterations
default   [  37% ] 457/500 VUs  0m54.9s/2m30.0s

running (0m55.9s), 465/500 VUs, 1912 complete and 0 interrupted iterations
default   [  37% ] 465/500 VUs  0m55.9s/2m30.0s

running (0m56.9s), 473/500 VUs, 1984 complete and 0 interrupted iterations
default   [  38% ] 473/500 VUs  0m56.9s/2m30.0s

running (0m57.9s), 482/500 VUs, 2057 complete and 0 interrupted iterations
default   [  39% ] 482/500 VUs  0m57.9s/2m30.0s

running (0m58.9s), 490/500 VUs, 2125 complete and 0 interrupted iterations
default   [  39% ] 490/500 VUs  0m58.9s/2m30.0s

running (0m59.9s), 499/500 VUs, 2177 complete and 0 interrupted iterations
default   [  40% ] 499/500 VUs  0m59.9s/2m30.0s

running (1m00.9s), 500/500 VUs, 2244 complete and 0 interrupted iterations
default   [  41% ] 500/500 VUs  1m00.9s/2m30.0s

running (1m01.9s), 500/500 VUs, 2303 complete and 0 interrupted iterations
default   [  41% ] 500/500 VUs  1m01.9s/2m30.0s

running (1m02.9s), 500/500 VUs, 2374 complete and 0 interrupted iterations
default   [  42% ] 500/500 VUs  1m02.9s/2m30.0s

running (1m03.9s), 500/500 VUs, 2428 complete and 0 interrupted iterations
default   [  43% ] 500/500 VUs  1m03.9s/2m30.0s

running (1m04.9s), 500/500 VUs, 2510 complete and 0 interrupted iterations
default   [  43% ] 500/500 VUs  1m04.9s/2m30.0s

running (1m05.9s), 500/500 VUs, 2568 complete and 0 interrupted iterations
default   [  44% ] 500/500 VUs  1m05.9s/2m30.0s

running (1m06.9s), 500/500 VUs, 2671 complete and 0 interrupted iterations
default   [  45% ] 500/500 VUs  1m06.9s/2m30.0s

running (1m07.9s), 500/500 VUs, 2720 complete and 0 interrupted iterations
default   [  45% ] 500/500 VUs  1m07.9s/2m30.0s

running (1m08.9s), 500/500 VUs, 2791 complete and 0 interrupted iterations
default   [  46% ] 500/500 VUs  1m08.9s/2m30.0s

running (1m09.9s), 500/500 VUs, 2861 complete and 0 interrupted iterations
default   [  47% ] 500/500 VUs  1m09.9s/2m30.0s

running (1m10.9s), 500/500 VUs, 2927 complete and 0 interrupted iterations
default   [  47% ] 500/500 VUs  1m10.9s/2m30.0s

running (1m11.9s), 500/500 VUs, 3018 complete and 0 interrupted iterations
default   [  48% ] 500/500 VUs  1m11.9s/2m30.0s

running (1m12.9s), 500/500 VUs, 3065 complete and 0 interrupted iterations
default   [  49% ] 500/500 VUs  1m12.9s/2m30.0s

running (1m13.9s), 500/500 VUs, 3158 complete and 0 interrupted iterations
default   [  49% ] 500/500 VUs  1m13.9s/2m30.0s

running (1m14.9s), 500/500 VUs, 3230 complete and 0 interrupted iterations
default   [  50% ] 500/500 VUs  1m14.9s/2m30.0s

running (1m15.9s), 500/500 VUs, 3302 complete and 0 interrupted iterations
default   [  51% ] 500/500 VUs  1m15.9s/2m30.0s

running (1m16.9s), 500/500 VUs, 3372 complete and 0 interrupted iterations
default   [  51% ] 500/500 VUs  1m16.9s/2m30.0s

running (1m18.0s), 500/500 VUs, 3428 complete and 0 interrupted iterations
default   [  52% ] 500/500 VUs  1m18.0s/2m30.0s

running (1m18.9s), 500/500 VUs, 3494 complete and 0 interrupted iterations
default   [  53% ] 500/500 VUs  1m18.9s/2m30.0s

running (1m19.9s), 500/500 VUs, 3568 complete and 0 interrupted iterations
default   [  53% ] 500/500 VUs  1m19.9s/2m30.0s

running (1m20.9s), 500/500 VUs, 3655 complete and 0 interrupted iterations
default   [  54% ] 500/500 VUs  1m20.9s/2m30.0s

running (1m21.9s), 500/500 VUs, 3698 complete and 0 interrupted iterations
default   [  55% ] 500/500 VUs  1m21.9s/2m30.0s

running (1m22.9s), 500/500 VUs, 3757 complete and 0 interrupted iterations
default   [  55% ] 500/500 VUs  1m22.9s/2m30.0s

running (1m23.9s), 500/500 VUs, 3874 complete and 0 interrupted iterations
default   [  56% ] 500/500 VUs  1m23.9s/2m30.0s

running (1m24.9s), 500/500 VUs, 3943 complete and 0 interrupted iterations
default   [  57% ] 500/500 VUs  1m24.9s/2m30.0s

running (1m25.9s), 500/500 VUs, 3976 complete and 0 interrupted iterations
default   [  57% ] 500/500 VUs  1m25.9s/2m30.0s

running (1m26.9s), 500/500 VUs, 4096 complete and 0 interrupted iterations
default   [  58% ] 500/500 VUs  1m26.9s/2m30.0s

running (1m27.9s), 500/500 VUs, 4154 complete and 0 interrupted iterations
default   [  59% ] 500/500 VUs  1m27.9s/2m30.0s

running (1m28.9s), 500/500 VUs, 4224 complete and 0 interrupted iterations
default   [  59% ] 500/500 VUs  1m28.9s/2m30.0s

running (1m29.9s), 500/500 VUs, 4262 complete and 0 interrupted iterations
default   [  60% ] 500/500 VUs  1m29.9s/2m30.0s

running (1m30.9s), 500/500 VUs, 4329 complete and 0 interrupted iterations
default   [  61% ] 500/500 VUs  1m30.9s/2m30.0s

running (1m31.9s), 500/500 VUs, 4404 complete and 0 interrupted iterations
default   [  61% ] 500/500 VUs  1m31.9s/2m30.0s

running (1m32.9s), 500/500 VUs, 4471 complete and 0 interrupted iterations
default   [  62% ] 500/500 VUs  1m32.9s/2m30.0s

running (1m33.9s), 500/500 VUs, 4567 complete and 0 interrupted iterations
default   [  63% ] 500/500 VUs  1m33.9s/2m30.0s

running (1m34.9s), 500/500 VUs, 4630 complete and 0 interrupted iterations
default   [  63% ] 500/500 VUs  1m34.9s/2m30.0s

running (1m35.9s), 500/500 VUs, 4694 complete and 0 interrupted iterations
default   [  64% ] 500/500 VUs  1m35.9s/2m30.0s

running (1m36.9s), 500/500 VUs, 4765 complete and 0 interrupted iterations
default   [  65% ] 500/500 VUs  1m36.9s/2m30.0s

running (1m37.9s), 500/500 VUs, 4829 complete and 0 interrupted iterations
default   [  65% ] 500/500 VUs  1m37.9s/2m30.0s

running (1m38.9s), 500/500 VUs, 4916 complete and 0 interrupted iterations
default   [  66% ] 500/500 VUs  1m38.9s/2m30.0s

running (1m39.9s), 500/500 VUs, 4966 complete and 0 interrupted iterations
default   [  67% ] 500/500 VUs  1m39.9s/2m30.0s

running (1m40.9s), 500/500 VUs, 5066 complete and 0 interrupted iterations
default   [  67% ] 500/500 VUs  1m40.9s/2m30.0s

running (1m41.9s), 500/500 VUs, 5126 complete and 0 interrupted iterations
default   [  68% ] 500/500 VUs  1m41.9s/2m30.0s

running (1m42.9s), 500/500 VUs, 5189 complete and 0 interrupted iterations
default   [  69% ] 500/500 VUs  1m42.9s/2m30.0s

running (1m43.9s), 500/500 VUs, 5287 complete and 0 interrupted iterations
default   [  69% ] 500/500 VUs  1m43.9s/2m30.0s

running (1m44.9s), 500/500 VUs, 5335 complete and 0 interrupted iterations
default   [  70% ] 500/500 VUs  1m44.9s/2m30.0s

running (1m45.9s), 500/500 VUs, 5415 complete and 0 interrupted iterations
default   [  71% ] 500/500 VUs  1m45.9s/2m30.0s

running (1m46.9s), 500/500 VUs, 5492 complete and 0 interrupted iterations
default   [  71% ] 500/500 VUs  1m46.9s/2m30.0s

running (1m47.9s), 500/500 VUs, 5560 complete and 0 interrupted iterations
default   [  72% ] 500/500 VUs  1m47.9s/2m30.0s

running (1m48.9s), 500/500 VUs, 5633 complete and 0 interrupted iterations
default   [  73% ] 500/500 VUs  1m48.9s/2m30.0s

running (1m49.9s), 500/500 VUs, 5691 complete and 0 interrupted iterations
default   [  73% ] 500/500 VUs  1m49.9s/2m30.0s

running (1m50.9s), 500/500 VUs, 5763 complete and 0 interrupted iterations
default   [  74% ] 500/500 VUs  1m50.9s/2m30.0s

running (1m51.9s), 500/500 VUs, 5871 complete and 0 interrupted iterations
default   [  75% ] 500/500 VUs  1m51.9s/2m30.0s

running (1m52.9s), 500/500 VUs, 5915 complete and 0 interrupted iterations
default   [  75% ] 500/500 VUs  1m52.9s/2m30.0s

running (1m53.9s), 500/500 VUs, 5976 complete and 0 interrupted iterations
default   [  76% ] 500/500 VUs  1m53.9s/2m30.0s

running (1m54.9s), 500/500 VUs, 6070 complete and 0 interrupted iterations
default   [  77% ] 500/500 VUs  1m54.9s/2m30.0s

running (1m55.9s), 500/500 VUs, 6137 complete and 0 interrupted iterations
default   [  77% ] 500/500 VUs  1m55.9s/2m30.0s

running (1m56.9s), 500/500 VUs, 6189 complete and 0 interrupted iterations
default   [  78% ] 500/500 VUs  1m56.9s/2m30.0s

running (1m57.9s), 500/500 VUs, 6261 complete and 0 interrupted iterations
default   [  79% ] 500/500 VUs  1m57.9s/2m30.0s

running (1m58.9s), 500/500 VUs, 6323 complete and 0 interrupted iterations
default   [  79% ] 500/500 VUs  1m58.9s/2m30.0s

running (1m59.9s), 500/500 VUs, 6420 complete and 0 interrupted iterations
default   [  80% ] 500/500 VUs  1m59.9s/2m30.0s

running (2m00.9s), 499/500 VUs, 6481 complete and 0 interrupted iterations
default   [  81% ] 499/500 VUs  2m00.9s/2m30.0s

running (2m01.9s), 491/500 VUs, 6566 complete and 0 interrupted iterations
default   [  81% ] 491/500 VUs  2m01.9s/2m30.0s

running (2m02.9s), 482/500 VUs, 6645 complete and 0 interrupted iterations
default   [  82% ] 482/500 VUs  2m02.9s/2m30.0s

running (2m03.9s), 480/500 VUs, 6691 complete and 0 interrupted iterations
default   [  83% ] 480/500 VUs  2m03.9s/2m30.0s

running (2m04.9s), 471/500 VUs, 6761 complete and 0 interrupted iterations
default   [  83% ] 471/500 VUs  2m04.9s/2m30.0s

running (2m05.9s), 454/500 VUs, 6856 complete and 0 interrupted iterations
default   [  84% ] 454/500 VUs  2m05.9s/2m30.0s

running (2m06.9s), 444/500 VUs, 6921 complete and 0 interrupted iterations
default   [  85% ] 444/500 VUs  2m06.9s/2m30.0s

running (2m07.9s), 422/500 VUs, 7005 complete and 0 interrupted iterations
default   [  85% ] 422/500 VUs  2m07.9s/2m30.0s

running (2m08.9s), 407/500 VUs, 7069 complete and 0 interrupted iterations
default   [  86% ] 407/500 VUs  2m08.9s/2m30.0s

running (2m09.9s), 394/500 VUs, 7119 complete and 0 interrupted iterations
default   [  87% ] 394/500 VUs  2m09.9s/2m30.0s

running (2m10.9s), 381/500 VUs, 7191 complete and 0 interrupted iterations
default   [  87% ] 381/500 VUs  2m10.9s/2m30.0s

running (2m11.9s), 357/500 VUs, 7272 complete and 0 interrupted iterations
default   [  88% ] 357/500 VUs  2m11.9s/2m30.0s

running (2m12.9s), 332/500 VUs, 7354 complete and 0 interrupted iterations
default   [  89% ] 332/500 VUs  2m12.9s/2m30.0s

running (2m13.9s), 318/500 VUs, 7405 complete and 0 interrupted iterations
default   [  89% ] 318/500 VUs  2m13.9s/2m30.0s

running (2m14.9s), 302/500 VUs, 7464 complete and 0 interrupted iterations
default   [  90% ] 302/500 VUs  2m14.9s/2m30.0s

running (2m15.9s), 290/500 VUs, 7509 complete and 0 interrupted iterations
default   [  91% ] 290/500 VUs  2m15.9s/2m30.0s

running (2m16.9s), 264/500 VUs, 7571 complete and 0 interrupted iterations
default   [  91% ] 264/500 VUs  2m16.9s/2m30.0s

running (2m17.9s), 249/500 VUs, 7623 complete and 0 interrupted iterations
default   [  92% ] 249/500 VUs  2m17.9s/2m30.0s

running (2m18.9s), 228/500 VUs, 7682 complete and 0 interrupted iterations
default   [  93% ] 228/500 VUs  2m18.9s/2m30.0s

running (2m19.9s), 215/500 VUs, 7723 complete and 0 interrupted iterations
default   [  93% ] 215/500 VUs  2m19.9s/2m30.0s

running (2m20.9s), 204/500 VUs, 7763 complete and 0 interrupted iterations
default   [  94% ] 204/500 VUs  2m20.9s/2m30.0s

running (2m21.9s), 191/500 VUs, 7796 complete and 0 interrupted iterations
default   [  95% ] 191/500 VUs  2m21.9s/2m30.0s

running (2m22.9s), 169/500 VUs, 7833 complete and 0 interrupted iterations
default   [  95% ] 169/500 VUs  2m22.9s/2m30.0s

running (2m23.9s), 152/500 VUs, 7870 complete and 0 interrupted iterations
default   [  96% ] 152/500 VUs  2m23.9s/2m30.0s

running (2m24.9s), 135/500 VUs, 7907 complete and 0 interrupted iterations
default   [  97% ] 135/500 VUs  2m24.9s/2m30.0s

running (2m25.9s), 116/500 VUs, 7938 complete and 0 interrupted iterations
default   [  97% ] 116/500 VUs  2m25.9s/2m30.0s

running (2m26.9s), 098/500 VUs, 7967 complete and 0 interrupted iterations
default   [  98% ] 098/500 VUs  2m26.9s/2m30.0s

running (2m27.9s), 083/500 VUs, 7987 complete and 0 interrupted iterations
default   [  99% ] 083/500 VUs  2m27.9s/2m30.0s

running (2m28.9s), 071/500 VUs, 8002 complete and 0 interrupted iterations
default   [  99% ] 071/500 VUs  2m28.9s/2m30.0s

running (2m29.9s), 054/500 VUs, 8021 complete and 0 interrupted iterations
default   [ 100% ] 054/500 VUs  2m29.9s/2m30.0s

running (2m30.9s), 035/500 VUs, 8042 complete and 0 interrupted iterations
default ↓ [ 100% ] 051/500 VUs  2m30s

running (2m31.9s), 023/500 VUs, 8054 complete and 0 interrupted iterations
default ↓ [ 100% ] 051/500 VUs  2m30s

running (2m32.9s), 012/500 VUs, 8065 complete and 0 interrupted iterations
default ↓ [ 100% ] 051/500 VUs  2m30s

running (2m33.9s), 007/500 VUs, 8070 complete and 0 interrupted iterations
default ↓ [ 100% ] 051/500 VUs  2m30s

running (2m34.9s), 004/500 VUs, 8073 complete and 0 interrupted iterations
default ↓ [ 100% ] 051/500 VUs  2m30s

running (2m35.9s), 002/500 VUs, 8075 complete and 0 interrupted iterations
default ↓ [ 100% ] 051/500 VUs  2m30s


  █ THRESHOLDS 

    active_clients_time
    ✓ 'p(95)<500' p(95)=145ms

    attach_documents_time
    ✓ 'p(95)<10000' p(95)=591.19ms

    deactivate_clients_time
    ✓ 'p(95)<10000' p(95)=149ms

    http_req_duration
    ✓ 'p(95)<10000' p(95)=297.12ms

    pushpulls_time
    ✓ 'p(95)<1000' p(95)=298ms

    transaction_success_rate
    ✓ 'rate>0.99' rate=100.00%

    transaction_time
    ✓ 'p(95)<30000' p(95)=7.64s


  █ TOTAL RESULTS 

    checks_total.......: 129232  828.520592/s
    checks_succeeded...: 100.00% 129232 out of 129232
    checks_failed......: 0.00%   0 out of 129232

    ✓ status is 200
    ✓ response has valid body

    CUSTOM
    active_clients....................: 8077    51.782537/s
    active_clients_success_rate.......: 100.00% 8077 out of 8077
    active_clients_time...............: avg=33.92ms  min=1ms      med=8ms     max=561ms p(90)=101ms    p(95)=145ms   
    attach_documents..................: 8077    51.782537/s
    attach_documents_success_rate.....: 100.00% 8077 out of 8077
    attach_documents_time.............: avg=156.57ms min=3ms      med=40ms    max=1.09s p(90)=495ms    p(95)=591.19ms
    deactivate_clients................: 8077    51.782537/s
    deactivate_clients_success_rate...: 100.00% 8077 out of 8077
    deactivate_clients_time...........: avg=33.08ms  min=0s       med=5ms     max=758ms p(90)=96ms     p(95)=149ms   
    pushpulls.........................: 40385   258.912685/s
    pushpulls_success_rate............: 100.00% 40385 out of 40385
    pushpulls_time....................: avg=75.95ms  min=1ms      med=27ms    max=995ms p(90)=219ms    p(95)=298ms   
    transaction_success_rate..........: 100.00% 8077 out of 8077
    transaction_time..................: avg=6.68s    min=6.01s    med=6.67s   max=9.03s p(90)=7.44s    p(95)=7.64s   

    HTTP
    http_req_duration.................: avg=67.31ms  min=500.63µs med=15.64ms max=1.04s p(90)=198.96ms p(95)=297.12ms
      { expected_response:true }......: avg=67.31ms  min=500.63µs med=15.64ms max=1.04s p(90)=198.96ms p(95)=297.12ms
    http_req_failed...................: 0.00%   0 out of 64616
    http_reqs.........................: 64616   414.260296/s

    EXECUTION
    iteration_duration................: avg=6.68s    min=6.01s    med=6.67s   max=9.03s p(90)=7.44s    p(95)=7.64s   
    iterations........................: 8077    51.782537/s
    vus...............................: 2       min=2              max=500
    vus_max...........................: 500     min=500            max=500

    NETWORK
    data_received.....................: 1.2 GB  7.4 MB/s
    data_sent.........................: 61 MB   390 kB/s




running (2m36.0s), 000/500 VUs, 8077 complete and 0 interrupted iterations
default ✓ [ 100% ] 000/500 VUs  2m30s
