
         /\      Grafana   /‾‾/  
    /\  /  \     |\  __   /  /   
   /  \/    \    | |/ /  /   ‾‾\ 
  /          \   |   (  |  (‾)  |
 / __________ \  |_|\_\  \_____/ 

     execution: local
        script: test/k6/presence.ts
        output: -

     scenarios: (100.00%) 1 scenario, 500 max VUs, 3m0s max duration (incl. graceful stop):
              * default: Up to 500 looping VUs for 2m30s over 3 stages (gracefulRampDown: 30s, gracefulStop: 30s)


running (0m00.9s), 008/500 VUs, 0 complete and 0 interrupted iterations
default   [   1% ] 008/500 VUs  0m00.9s/2m30.0s

running (0m01.9s), 016/500 VUs, 0 complete and 0 interrupted iterations
default   [   1% ] 016/500 VUs  0m01.9s/2m30.0s

running (0m02.9s), 024/500 VUs, 0 complete and 0 interrupted iterations
default   [   2% ] 024/500 VUs  0m02.9s/2m30.0s

running (0m03.9s), 033/500 VUs, 0 complete and 0 interrupted iterations
default   [   3% ] 033/500 VUs  0m03.9s/2m30.0s

running (0m04.9s), 041/500 VUs, 0 complete and 0 interrupted iterations
default   [   3% ] 041/500 VUs  0m04.9s/2m30.0s

running (0m05.9s), 049/500 VUs, 0 complete and 0 interrupted iterations
default   [   4% ] 049/500 VUs  0m05.9s/2m30.0s

running (0m06.9s), 058/500 VUs, 8 complete and 0 interrupted iterations
default   [   5% ] 058/500 VUs  0m06.9s/2m30.0s

running (0m07.9s), 066/500 VUs, 16 complete and 0 interrupted iterations
default   [   5% ] 066/500 VUs  0m07.9s/2m30.0s

running (0m08.9s), 074/500 VUs, 24 complete and 0 interrupted iterations
default   [   6% ] 074/500 VUs  0m08.9s/2m30.0s

running (0m09.9s), 083/500 VUs, 33 complete and 0 interrupted iterations
default   [   7% ] 083/500 VUs  0m09.9s/2m30.0s

running (0m10.9s), 091/500 VUs, 41 complete and 0 interrupted iterations
default   [   7% ] 091/500 VUs  0m10.9s/2m30.0s

running (0m11.9s), 099/500 VUs, 49 complete and 0 interrupted iterations
default   [   8% ] 099/500 VUs  0m11.9s/2m30.0s

running (0m12.9s), 108/500 VUs, 65 complete and 0 interrupted iterations
default   [   9% ] 108/500 VUs  0m12.9s/2m30.0s

running (0m13.9s), 116/500 VUs, 82 complete and 0 interrupted iterations
default   [   9% ] 116/500 VUs  0m13.9s/2m30.0s

running (0m14.9s), 124/500 VUs, 98 complete and 0 interrupted iterations
default   [  10% ] 124/500 VUs  0m14.9s/2m30.0s

running (0m15.9s), 133/500 VUs, 114 complete and 0 interrupted iterations
default   [  11% ] 133/500 VUs  0m15.9s/2m30.0s

running (0m16.9s), 141/500 VUs, 132 complete and 0 interrupted iterations
default   [  11% ] 141/500 VUs  0m16.9s/2m30.0s

running (0m17.9s), 149/500 VUs, 148 complete and 0 interrupted iterations
default   [  12% ] 149/500 VUs  0m17.9s/2m30.0s

running (0m18.9s), 158/500 VUs, 171 complete and 0 interrupted iterations
default   [  13% ] 158/500 VUs  0m18.9s/2m30.0s

running (0m19.9s), 166/500 VUs, 198 complete and 0 interrupted iterations
default   [  13% ] 166/500 VUs  0m19.9s/2m30.0s

running (0m20.9s), 174/500 VUs, 222 complete and 0 interrupted iterations
default   [  14% ] 174/500 VUs  0m20.9s/2m30.0s

running (0m21.9s), 182/500 VUs, 246 complete and 0 interrupted iterations
default   [  15% ] 182/500 VUs  0m21.9s/2m30.0s

running (0m22.9s), 191/500 VUs, 272 complete and 0 interrupted iterations
default   [  15% ] 191/500 VUs  0m22.9s/2m30.0s

running (0m23.9s), 199/500 VUs, 297 complete and 0 interrupted iterations
default   [  16% ] 199/500 VUs  0m23.9s/2m30.0s

running (0m24.9s), 207/500 VUs, 328 complete and 0 interrupted iterations
default   [  17% ] 207/500 VUs  0m24.9s/2m30.0s

running (0m25.9s), 216/500 VUs, 362 complete and 0 interrupted iterations
default   [  17% ] 216/500 VUs  0m25.9s/2m30.0s

running (0m26.9s), 224/500 VUs, 396 complete and 0 interrupted iterations
default   [  18% ] 224/500 VUs  0m26.9s/2m30.0s

running (0m27.9s), 232/500 VUs, 428 complete and 0 interrupted iterations
default   [  19% ] 232/500 VUs  0m27.9s/2m30.0s

running (0m28.9s), 241/500 VUs, 462 complete and 0 interrupted iterations
default   [  19% ] 241/500 VUs  0m28.9s/2m30.0s

running (0m29.9s), 249/500 VUs, 496 complete and 0 interrupted iterations
default   [  20% ] 249/500 VUs  0m29.9s/2m30.0s

running (0m30.9s), 257/500 VUs, 535 complete and 0 interrupted iterations
default   [  21% ] 257/500 VUs  0m30.9s/2m30.0s

running (0m31.9s), 266/500 VUs, 576 complete and 0 interrupted iterations
default   [  21% ] 266/500 VUs  0m31.9s/2m30.0s

running (0m32.9s), 274/500 VUs, 620 complete and 0 interrupted iterations
default   [  22% ] 274/500 VUs  0m32.9s/2m30.0s

running (0m33.9s), 282/500 VUs, 660 complete and 0 interrupted iterations
default   [  23% ] 282/500 VUs  0m33.9s/2m30.0s

running (0m34.9s), 291/500 VUs, 700 complete and 0 interrupted iterations
default   [  23% ] 291/500 VUs  0m34.9s/2m30.0s

running (0m35.9s), 299/500 VUs, 743 complete and 0 interrupted iterations
default   [  24% ] 299/500 VUs  0m35.9s/2m30.0s

running (0m36.9s), 307/500 VUs, 792 complete and 0 interrupted iterations
default   [  25% ] 307/500 VUs  0m36.9s/2m30.0s

running (0m37.9s), 316/500 VUs, 840 complete and 0 interrupted iterations
default   [  25% ] 316/500 VUs  0m37.9s/2m30.0s

running (0m38.9s), 324/500 VUs, 890 complete and 0 interrupted iterations
default   [  26% ] 324/500 VUs  0m38.9s/2m30.0s

running (0m39.9s), 332/500 VUs, 942 complete and 0 interrupted iterations
default   [  27% ] 332/500 VUs  0m39.9s/2m30.0s

running (0m40.9s), 340/500 VUs, 990 complete and 0 interrupted iterations
default   [  27% ] 340/500 VUs  0m40.9s/2m30.0s

running (0m41.9s), 349/500 VUs, 1039 complete and 0 interrupted iterations
default   [  28% ] 349/500 VUs  0m41.9s/2m30.0s

running (0m42.9s), 357/500 VUs, 1095 complete and 0 interrupted iterations
default   [  29% ] 357/500 VUs  0m42.9s/2m30.0s

running (0m43.9s), 365/500 VUs, 1155 complete and 0 interrupted iterations
default   [  29% ] 365/500 VUs  0m43.9s/2m30.0s

running (0m44.9s), 374/500 VUs, 1212 complete and 0 interrupted iterations
default   [  30% ] 374/500 VUs  0m44.9s/2m30.0s

running (0m45.9s), 382/500 VUs, 1269 complete and 0 interrupted iterations
default   [  31% ] 382/500 VUs  0m45.9s/2m30.0s

running (0m46.9s), 390/500 VUs, 1327 complete and 0 interrupted iterations
default   [  31% ] 390/500 VUs  0m46.9s/2m30.0s

running (0m47.9s), 399/500 VUs, 1386 complete and 0 interrupted iterations
default   [  32% ] 399/500 VUs  0m47.9s/2m30.0s

running (0m48.9s), 407/500 VUs, 1450 complete and 0 interrupted iterations
default   [  33% ] 407/500 VUs  0m48.9s/2m30.0s

running (0m49.9s), 415/500 VUs, 1515 complete and 0 interrupted iterations
default   [  33% ] 415/500 VUs  0m49.9s/2m30.0s

running (0m50.9s), 424/500 VUs, 1579 complete and 0 interrupted iterations
default   [  34% ] 424/500 VUs  0m50.9s/2m30.0s

running (0m51.9s), 432/500 VUs, 1645 complete and 0 interrupted iterations
default   [  35% ] 432/500 VUs  0m51.9s/2m30.0s

running (0m52.9s), 440/500 VUs, 1712 complete and 0 interrupted iterations
default   [  35% ] 440/500 VUs  0m52.9s/2m30.0s

running (0m53.9s), 449/500 VUs, 1780 complete and 0 interrupted iterations
default   [  36% ] 449/500 VUs  0m53.9s/2m30.0s

running (0m54.9s), 457/500 VUs, 1840 complete and 0 interrupted iterations
default   [  37% ] 457/500 VUs  0m54.9s/2m30.0s

running (0m55.9s), 465/500 VUs, 1908 complete and 0 interrupted iterations
default   [  37% ] 465/500 VUs  0m55.9s/2m30.0s

running (0m56.9s), 474/500 VUs, 1979 complete and 0 interrupted iterations
default   [  38% ] 474/500 VUs  0m56.9s/2m30.0s

running (0m57.9s), 482/500 VUs, 2022 complete and 0 interrupted iterations
default   [  39% ] 482/500 VUs  0m57.9s/2m30.0s

running (0m58.9s), 490/500 VUs, 2097 complete and 0 interrupted iterations
default   [  39% ] 490/500 VUs  0m58.9s/2m30.0s

running (0m59.9s), 499/500 VUs, 2168 complete and 0 interrupted iterations
default   [  40% ] 499/500 VUs  0m59.9s/2m30.0s

running (1m01.1s), 500/500 VUs, 2245 complete and 0 interrupted iterations
default   [  41% ] 500/500 VUs  1m01.1s/2m30.0s

running (1m01.9s), 500/500 VUs, 2294 complete and 0 interrupted iterations
default   [  41% ] 500/500 VUs  1m01.9s/2m30.0s

running (1m02.9s), 500/500 VUs, 2372 complete and 0 interrupted iterations
default   [  42% ] 500/500 VUs  1m02.9s/2m30.0s

running (1m03.9s), 500/500 VUs, 2467 complete and 0 interrupted iterations
default   [  43% ] 500/500 VUs  1m03.9s/2m30.0s

running (1m04.9s), 500/500 VUs, 2510 complete and 0 interrupted iterations
default   [  43% ] 500/500 VUs  1m04.9s/2m30.0s

running (1m06.1s), 500/500 VUs, 2609 complete and 0 interrupted iterations
default   [  44% ] 500/500 VUs  1m06.1s/2m30.0s

running (1m06.9s), 500/500 VUs, 2702 complete and 0 interrupted iterations
default   [  45% ] 500/500 VUs  1m06.9s/2m30.0s

running (1m07.9s), 500/500 VUs, 2747 complete and 0 interrupted iterations
default   [  45% ] 500/500 VUs  1m07.9s/2m30.0s

running (1m08.9s), 500/500 VUs, 2818 complete and 0 interrupted iterations
default   [  46% ] 500/500 VUs  1m08.9s/2m30.0s

running (1m09.9s), 500/500 VUs, 2922 complete and 0 interrupted iterations
default   [  47% ] 500/500 VUs  1m09.9s/2m30.0s

running (1m10.9s), 500/500 VUs, 2966 complete and 0 interrupted iterations
default   [  47% ] 500/500 VUs  1m10.9s/2m30.0s

running (1m11.9s), 500/500 VUs, 3036 complete and 0 interrupted iterations
default   [  48% ] 500/500 VUs  1m11.9s/2m30.0s

running (1m12.9s), 500/500 VUs, 3106 complete and 0 interrupted iterations
default   [  49% ] 500/500 VUs  1m12.9s/2m30.0s

running (1m13.9s), 500/500 VUs, 3216 complete and 0 interrupted iterations
default   [  49% ] 500/500 VUs  1m13.9s/2m30.0s

running (1m14.9s), 500/500 VUs, 3259 complete and 0 interrupted iterations
default   [  50% ] 500/500 VUs  1m14.9s/2m30.0s

running (1m15.9s), 500/500 VUs, 3323 complete and 0 interrupted iterations
default   [  51% ] 500/500 VUs  1m15.9s/2m30.0s

running (1m16.9s), 500/500 VUs, 3398 complete and 0 interrupted iterations
default   [  51% ] 500/500 VUs  1m16.9s/2m30.0s

running (1m18.2s), 500/500 VUs, 3478 complete and 0 interrupted iterations
default   [  52% ] 500/500 VUs  1m18.2s/2m30.0s

running (1m18.9s), 500/500 VUs, 3541 complete and 0 interrupted iterations
default   [  53% ] 500/500 VUs  1m18.9s/2m30.0s

running (1m19.9s), 500/500 VUs, 3620 complete and 0 interrupted iterations
default   [  53% ] 500/500 VUs  1m19.9s/2m30.0s

running (1m20.9s), 500/500 VUs, 3714 complete and 0 interrupted iterations
default   [  54% ] 500/500 VUs  1m20.9s/2m30.0s

running (1m21.9s), 500/500 VUs, 3762 complete and 0 interrupted iterations
default   [  55% ] 500/500 VUs  1m21.9s/2m30.0s

running (1m22.9s), 500/500 VUs, 3840 complete and 0 interrupted iterations
default   [  55% ] 500/500 VUs  1m22.9s/2m30.0s

running (1m23.9s), 500/500 VUs, 3917 complete and 0 interrupted iterations
default   [  56% ] 500/500 VUs  1m23.9s/2m30.0s

running (1m24.9s), 500/500 VUs, 3976 complete and 0 interrupted iterations
default   [  57% ] 500/500 VUs  1m24.9s/2m30.0s

running (1m25.9s), 500/500 VUs, 4067 complete and 0 interrupted iterations
default   [  57% ] 500/500 VUs  1m25.9s/2m30.0s

running (1m26.9s), 500/500 VUs, 4129 complete and 0 interrupted iterations
default   [  58% ] 500/500 VUs  1m26.9s/2m30.0s

running (1m27.9s), 500/500 VUs, 4187 complete and 0 interrupted iterations
default   [  59% ] 500/500 VUs  1m27.9s/2m30.0s

running (1m28.9s), 500/500 VUs, 4287 complete and 0 interrupted iterations
default   [  59% ] 500/500 VUs  1m28.9s/2m30.0s

running (1m29.9s), 500/500 VUs, 4341 complete and 0 interrupted iterations
default   [  60% ] 500/500 VUs  1m29.9s/2m30.0s

running (1m30.9s), 500/500 VUs, 4430 complete and 0 interrupted iterations
default   [  61% ] 500/500 VUs  1m30.9s/2m30.0s

running (1m31.9s), 500/500 VUs, 4489 complete and 0 interrupted iterations
default   [  61% ] 500/500 VUs  1m31.9s/2m30.0s

running (1m32.9s), 500/500 VUs, 4565 complete and 0 interrupted iterations
default   [  62% ] 500/500 VUs  1m32.9s/2m30.0s

running (1m33.9s), 500/500 VUs, 4632 complete and 0 interrupted iterations
default   [  63% ] 500/500 VUs  1m33.9s/2m30.0s

running (1m34.9s), 500/500 VUs, 4698 complete and 0 interrupted iterations
default   [  63% ] 500/500 VUs  1m34.9s/2m30.0s

running (1m35.9s), 500/500 VUs, 4771 complete and 0 interrupted iterations
default   [  64% ] 500/500 VUs  1m35.9s/2m30.0s

running (1m36.9s), 500/500 VUs, 4856 complete and 0 interrupted iterations
default   [  65% ] 500/500 VUs  1m36.9s/2m30.0s

running (1m37.9s), 500/500 VUs, 4924 complete and 0 interrupted iterations
default   [  65% ] 500/500 VUs  1m37.9s/2m30.0s

running (1m38.9s), 500/500 VUs, 4986 complete and 0 interrupted iterations
default   [  66% ] 500/500 VUs  1m38.9s/2m30.0s

running (1m40.0s), 500/500 VUs, 5108 complete and 0 interrupted iterations
default   [  67% ] 500/500 VUs  1m40.0s/2m30.0s

running (1m40.9s), 500/500 VUs, 5130 complete and 0 interrupted iterations
default   [  67% ] 500/500 VUs  1m40.9s/2m30.0s

running (1m41.9s), 500/500 VUs, 5205 complete and 0 interrupted iterations
default   [  68% ] 500/500 VUs  1m41.9s/2m30.0s

running (1m42.9s), 500/500 VUs, 5310 complete and 0 interrupted iterations
default   [  69% ] 500/500 VUs  1m42.9s/2m30.0s

running (1m43.9s), 500/500 VUs, 5370 complete and 0 interrupted iterations
default   [  69% ] 500/500 VUs  1m43.9s/2m30.0s

running (1m44.9s), 500/500 VUs, 5441 complete and 0 interrupted iterations
default   [  70% ] 500/500 VUs  1m44.9s/2m30.0s

running (1m45.9s), 500/500 VUs, 5521 complete and 0 interrupted iterations
default   [  71% ] 500/500 VUs  1m45.9s/2m30.0s

running (1m46.9s), 500/500 VUs, 5608 complete and 0 interrupted iterations
default   [  71% ] 500/500 VUs  1m46.9s/2m30.0s

running (1m47.9s), 500/500 VUs, 5678 complete and 0 interrupted iterations
default   [  72% ] 500/500 VUs  1m47.9s/2m30.0s

running (1m48.9s), 500/500 VUs, 5746 complete and 0 interrupted iterations
default   [  73% ] 500/500 VUs  1m48.9s/2m30.0s

running (1m49.9s), 500/500 VUs, 5831 complete and 0 interrupted iterations
default   [  73% ] 500/500 VUs  1m49.9s/2m30.0s

running (1m50.9s), 500/500 VUs, 5900 complete and 0 interrupted iterations
default   [  74% ] 500/500 VUs  1m50.9s/2m30.0s

running (1m51.9s), 500/500 VUs, 5965 complete and 0 interrupted iterations
default   [  75% ] 500/500 VUs  1m51.9s/2m30.0s

running (1m52.9s), 500/500 VUs, 6053 complete and 0 interrupted iterations
default   [  75% ] 500/500 VUs  1m52.9s/2m30.0s

running (1m53.9s), 500/500 VUs, 6112 complete and 0 interrupted iterations
default   [  76% ] 500/500 VUs  1m53.9s/2m30.0s

running (1m54.9s), 500/500 VUs, 6209 complete and 0 interrupted iterations
default   [  77% ] 500/500 VUs  1m54.9s/2m30.0s

running (1m55.9s), 500/500 VUs, 6274 complete and 0 interrupted iterations
default   [  77% ] 500/500 VUs  1m55.9s/2m30.0s

running (1m56.9s), 500/500 VUs, 6390 complete and 0 interrupted iterations
default   [  78% ] 500/500 VUs  1m56.9s/2m30.0s

running (1m57.9s), 500/500 VUs, 6417 complete and 0 interrupted iterations
default   [  79% ] 500/500 VUs  1m57.9s/2m30.0s

running (1m58.9s), 500/500 VUs, 6487 complete and 0 interrupted iterations
default   [  79% ] 500/500 VUs  1m58.9s/2m30.0s

running (1m59.9s), 500/500 VUs, 6571 complete and 0 interrupted iterations
default   [  80% ] 500/500 VUs  1m59.9s/2m30.0s

running (2m00.9s), 499/500 VUs, 6631 complete and 0 interrupted iterations
default   [  81% ] 499/500 VUs  2m00.9s/2m30.0s

running (2m01.9s), 495/500 VUs, 6717 complete and 0 interrupted iterations
default   [  81% ] 495/500 VUs  2m01.9s/2m30.0s

running (2m02.9s), 492/500 VUs, 6781 complete and 0 interrupted iterations
default   [  82% ] 492/500 VUs  2m02.9s/2m30.0s

running (2m03.9s), 486/500 VUs, 6852 complete and 0 interrupted iterations
default   [  83% ] 486/500 VUs  2m03.9s/2m30.0s

running (2m04.9s), 477/500 VUs, 6933 complete and 0 interrupted iterations
default   [  83% ] 477/500 VUs  2m04.9s/2m30.0s

running (2m05.9s), 463/500 VUs, 6989 complete and 0 interrupted iterations
default   [  84% ] 463/500 VUs  2m05.9s/2m30.0s

running (2m06.9s), 448/500 VUs, 7056 complete and 0 interrupted iterations
default   [  85% ] 448/500 VUs  2m06.9s/2m30.0s

running (2m07.9s), 429/500 VUs, 7151 complete and 0 interrupted iterations
default   [  85% ] 429/500 VUs  2m07.9s/2m30.0s

running (2m08.9s), 416/500 VUs, 7204 complete and 0 interrupted iterations
default   [  86% ] 416/500 VUs  2m08.9s/2m30.0s

running (2m09.9s), 395/500 VUs, 7276 complete and 0 interrupted iterations
default   [  87% ] 395/500 VUs  2m09.9s/2m30.0s

running (2m10.9s), 371/500 VUs, 7380 complete and 0 interrupted iterations
default   [  87% ] 371/500 VUs  2m10.9s/2m30.0s

running (2m11.9s), 358/500 VUs, 7422 complete and 0 interrupted iterations
default   [  88% ] 358/500 VUs  2m11.9s/2m30.0s

running (2m12.9s), 344/500 VUs, 7473 complete and 0 interrupted iterations
default   [  89% ] 344/500 VUs  2m12.9s/2m30.0s

running (2m13.9s), 321/500 VUs, 7554 complete and 0 interrupted iterations
default   [  89% ] 321/500 VUs  2m13.9s/2m30.0s

running (2m14.9s), 305/500 VUs, 7613 complete and 0 interrupted iterations
default   [  90% ] 305/500 VUs  2m14.9s/2m30.0s

running (2m15.9s), 286/500 VUs, 7663 complete and 0 interrupted iterations
default   [  91% ] 286/500 VUs  2m15.9s/2m30.0s

running (2m16.9s), 257/500 VUs, 7750 complete and 0 interrupted iterations
default   [  91% ] 257/500 VUs  2m16.9s/2m30.0s

running (2m17.9s), 252/500 VUs, 7774 complete and 0 interrupted iterations
default   [  92% ] 252/500 VUs  2m17.9s/2m30.0s

running (2m18.9s), 233/500 VUs, 7815 complete and 0 interrupted iterations
default   [  93% ] 233/500 VUs  2m18.9s/2m30.0s

running (2m19.9s), 217/500 VUs, 7875 complete and 0 interrupted iterations
default   [  93% ] 217/500 VUs  2m19.9s/2m30.0s

running (2m20.9s), 199/500 VUs, 7916 complete and 0 interrupted iterations
default   [  94% ] 199/500 VUs  2m20.9s/2m30.0s

running (2m21.9s), 189/500 VUs, 7949 complete and 0 interrupted iterations
default   [  95% ] 189/500 VUs  2m21.9s/2m30.0s

running (2m22.9s), 165/500 VUs, 8005 complete and 0 interrupted iterations
default   [  95% ] 165/500 VUs  2m22.9s/2m30.0s

running (2m23.9s), 155/500 VUs, 8025 complete and 0 interrupted iterations
default   [  96% ] 155/500 VUs  2m23.9s/2m30.0s

running (2m24.9s), 144/500 VUs, 8048 complete and 0 interrupted iterations
default   [  97% ] 144/500 VUs  2m24.9s/2m30.0s

running (2m25.9s), 118/500 VUs, 8092 complete and 0 interrupted iterations
default   [  97% ] 118/500 VUs  2m25.9s/2m30.0s

running (2m26.9s), 107/500 VUs, 8113 complete and 0 interrupted iterations
default   [  98% ] 107/500 VUs  2m26.9s/2m30.0s

running (2m27.9s), 089/500 VUs, 8138 complete and 0 interrupted iterations
default   [  99% ] 089/500 VUs  2m27.9s/2m30.0s

running (2m28.9s), 074/500 VUs, 8160 complete and 0 interrupted iterations
default   [  99% ] 074/500 VUs  2m28.9s/2m30.0s

running (2m29.9s), 056/500 VUs, 8180 complete and 0 interrupted iterations
default   [ 100% ] 056/500 VUs  2m29.9s/2m30.0s

running (2m30.9s), 045/500 VUs, 8191 complete and 0 interrupted iterations
default ↓ [ 100% ] 054/500 VUs  2m30s

running (2m31.9s), 026/500 VUs, 8210 complete and 0 interrupted iterations
default ↓ [ 100% ] 054/500 VUs  2m30s

running (2m32.9s), 016/500 VUs, 8220 complete and 0 interrupted iterations
default ↓ [ 100% ] 054/500 VUs  2m30s

running (2m33.9s), 009/500 VUs, 8227 complete and 0 interrupted iterations
default ↓ [ 100% ] 054/500 VUs  2m30s

running (2m34.9s), 003/500 VUs, 8233 complete and 0 interrupted iterations
default ↓ [ 100% ] 054/500 VUs  2m30s


  █ THRESHOLDS 

    active_clients_time
    ✓ 'p(95)<500' p(95)=122ms

    attach_documents_time
    ✓ 'p(95)<10000' p(95)=481ms

    deactivate_clients_time
    ✓ 'p(95)<10000' p(95)=136ms

    http_req_duration
    ✓ 'p(95)<10000' p(95)=241.9ms

    pushpulls_time
    ✓ 'p(95)<1000' p(95)=254ms

    transaction_success_rate
    ✓ 'rate>0.99' rate=100.00%

    transaction_time
    ✓ 'p(95)<30000' p(95)=7.37s


  █ TOTAL RESULTS 

    checks_total.......: 131776  849.012539/s
    checks_succeeded...: 100.00% 131776 out of 131776
    checks_failed......: 0.00%   0 out of 131776

    ✓ status is 200
    ✓ response has valid body

    CUSTOM
    active_clients....................: 8236    53.063284/s
    active_clients_success_rate.......: 100.00% 8236 out of 8236
    active_clients_time...............: avg=28.16ms  min=1ms      med=7ms     max=759ms p(90)=85ms     p(95)=122ms  
    attach_documents..................: 8236    53.063284/s
    attach_documents_success_rate.....: 100.00% 8236 out of 8236
    attach_documents_time.............: avg=131.58ms min=3ms      med=38.5ms  max=1.04s p(90)=395ms    p(95)=481ms  
    deactivate_clients................: 8236    53.063284/s
    deactivate_clients_success_rate...: 100.00% 8236 out of 8236
    deactivate_clients_time...........: avg=29.07ms  min=0s       med=6ms     max=742ms p(90)=84ms     p(95)=136ms  
    pushpulls.........................: 41180   265.316418/s
    pushpulls_success_rate............: 100.00% 41180 out of 41180
    pushpulls_time....................: avg=62.25ms  min=1ms      med=22ms    max=1.09s p(90)=178ms    p(95)=254ms  
    transaction_success_rate..........: 100.00% 8236 out of 8236
    transaction_time..................: avg=6.57s    min=6.01s    med=6.55s   max=8.41s p(90)=7.17s    p(95)=7.37s  

    HTTP
    http_req_duration.................: avg=54.48ms  min=501.51µs med=12.88ms max=1.07s p(90)=161.58ms p(95)=241.9ms
      { expected_response:true }......: avg=54.48ms  min=501.51µs med=12.88ms max=1.07s p(90)=161.58ms p(95)=241.9ms
    http_req_failed...................: 0.00%   0 out of 65888
    http_reqs.........................: 65888   424.506269/s

    EXECUTION
    iteration_duration................: avg=6.57s    min=6.01s    med=6.55s   max=8.41s p(90)=7.17s    p(95)=7.37s  
    iterations........................: 8236    53.063284/s
    vus...............................: 3       min=3              max=500
    vus_max...........................: 500     min=500            max=500

    NETWORK
    data_received.....................: 1.2 GB  7.6 MB/s
    data_sent.........................: 62 MB   399 kB/s




running (2m35.2s), 000/500 VUs, 8236 complete and 0 interrupted iterations
default ✓ [ 100% ] 000/500 VUs  2m30s
